1900-09-01	1900-8-8	30	执	六	庚子 甲申 丁丑	无	白露 (9, 7)	无	无	无	入殓 安葬 捕捉 普渡 畋猎 破土 祭祀 结网 解除	交易 入宅 嫁娶 开市
1900-09-02	1900-8-9	30	破	日	庚子 甲申 戊寅	无	白露 (9, 7)	无	无	无	坏垣 沐浴 破屋 馀事勿取	开市 斋醮
1900-09-03	1900-8-10	30	危	一	庚子 甲申 己卯	无	白露 (9, 7)	无	无	无	入宅 出火 启钻 安葬 安香 开市 挂匾 祈福 祭祀 立券 纳采 订盟 造桥	动土 嫁娶 安床 掘井 破土
1900-09-04	1900-8-11	30	成	二	庚子 甲申 庚辰	无	白露 (9, 7)	无	无	无	交易 修造 入宅 动土 嫁娶 安床 安香 开光 开市 捕捉 斋醮 普渡 治病 畋猎 祈福 祭祀 移徙 立券 结网 造车器	安葬 探病 纳采 经络 行丧 订盟
1900-09-05	1900-8-12	30	收	三	庚子 甲申 辛巳	无	白露 (9, 7)	无	无	无	会亲友 作灶 冠笄 嫁娶 安床 安机械 开市 牧养 立券 纳畜 纳财 纳采 裁衣 订盟	出行 安葬 掘井 破土 行丧
1900-09-06	1900-8-13	30	开	四	庚子 甲申 壬午	无	白露 (9, 7)	无	无	无	上梁 会亲友 修造 出行 出货财 动土 启钻 嫁娶 开仓 开光 开市 开池 斋醮 普渡 牧养 破土 祭祀 竖柱 纳畜 纳财 纳采 解除 订盟	入宅 出火 安葬 安门 盖屋
1900-09-07	1900-8-14	30	闭	五	庚子 乙酉 癸未	白露	秋分 (9, 23)	无	无	无	入殓 塞穴 嫁娶 安葬 成服 断蚁 普渡 祈福 祭祀 筑堤 补垣 除服	上梁 动土 开光 掘井 破土 词讼
1900-09-08	1900-8-15	30	闭	六	庚子 乙酉 甲申	无	秋分 (9, 23)	无	无	无	伐木 修坟 修造 出行 动土 嫁娶 安葬 拆卸 破土 移徙 立碑	入宅 安床 开光 开市 挂匾 掘井 祈福
1900-09-09	1900-8-16	30	建	日	庚子 乙酉 乙酉	无	秋分 (9, 23)	无	无	无	出行 扫舍 祭祀 馀事勿取	诸事不宜
1900-09-10	1900-8-17	30	除	一	庚子 乙酉 丙戌	无	秋分 (9, 23)	教师节	无	无	出行 动土 塑绘 嫁娶 安床 开光 开池 扫舍 放水 整手足甲 理发 祭祀 解除	伐木 作梁 作灶 安葬 行丧
1900-09-11	1900-8-18	30	满	二	庚子 乙酉 丁亥	无	秋分 (9, 23)	无	无	无	上梁 交易 入宅 出火 出行 安床 开光 开市 挂匾 移徙 立券	乘船 作灶 嫁娶 安葬 理发 行丧
1900-09-12	1900-8-19	30	平	三	庚子 乙酉 戊子	无	秋分 (9, 23)	无	无	无	修饰垣墙 平治道涂 沐浴 祭祀 馀事勿取	诸事不宜
1900-09-13	1900-8-20	30	定	四	庚子 乙酉 己丑	无	秋分 (9, 23)	无	无	无	交易 修造 入宅 入殓 出火 出行 动土 嫁娶 安床 安葬 开光 开市 成服 拆卸 挂匾 栽种 求嗣 祈福 祭祀 移徙 立券 纳畜 进人口 除服	无
1900-09-14	1900-8-21	30	执	五	庚子 乙酉 庚寅	无	秋分 (9, 23)	无	无	无	坏垣 解除 馀事勿取	诸事不宜
1900-09-15	1900-8-22	30	破	六	庚子 乙酉 辛卯	无	秋分 (9, 23)	全民国防教育日	无	无	坏垣 治病 破屋 祭祀 馀事勿取	诸事不宜
1900-09-16	1900-8-23	30	危	日	庚子 乙酉 壬辰	无	秋分 (9, 23)	无	无	无	作梁 修造 入宅 入殓 出火 出行 动土 嫁娶 安床 安葬 开光 成服 拆卸 挂匾 栽种 理发 破土 祭祀 移徙 纳畜 纳采 订盟 进人口 除服	开市 开渠 掘井 造桥 造船
1900-09-17	1900-8-24	30	成	一	庚子 乙酉 癸巳	无	秋分 (9, 23)	无	无	无	交易 动土 安床 开光 开市 拆卸 挂匾 栽种 祈福 祭祀 立券 纳财	入宅 出火 出行 嫁娶 安葬 破土 移徙 纳畜 词讼 进人口
1900-09-18	1900-8-25	30	收	二	庚子 乙酉 甲午	无	秋分 (9, 23)	无	无	无	会亲友 作灶 冠笄 嫁娶 理发 祭祀 移柩 进人口	上梁 伐木 出货财 启钻 开仓 开市 栽种 盖屋 破土 纳畜
1900-09-19	1900-8-26	30	开	三	庚子 乙酉 乙未	无	秋分 (9, 23)	无	无	无	修坟 启钻 成服 祭祀 移柩 除服 馀事勿取	入宅 动土 嫁娶 安葬 开市 破土
1900-09-20	1900-8-27	30	闭	四	庚子 乙酉 丙申	无	秋分 (9, 23)	无	无	无	伐木 作梁 修坟 冠笄 合寿木 启钻 嫁娶 安机械 安葬 安门 扫舍 架马 沐浴 牧养 立碑 纳畜 解除	入宅 动土 开光 开市 祈福
1900-09-21	1900-8-28	30	建	五	庚子 乙酉 丁酉	无	秋分 (9, 23)	无	无	无	出行 安葬 扫舍 沐浴 祭祀 馀事勿取	动土 掘井 破土 置产
1900-09-22	1900-8-29	30	除	六	庚子 乙酉 戊戌	无	秋分 (9, 23)	无	无	无	上梁 修造 出行 动土 合脊 嫁娶 安床 定磉 开市 扫舍 整手足甲 求医 治病 盖屋 祭祀 纳采 解除 起基	伐木 作灶 安葬 行丧 造庙 造船
1900-09-23	1900-8-30	30	满	日	庚子 乙酉 己亥	秋分	寒露 (10, 8)	无	无	无	交易 修造 入宅 出火 安床 安门 开光 开市 拆卸 挂匾 栽种 移徙 立券 纳财 纳采 订盟 进人口	作灶 动土 嫁娶 安葬 斋醮 破土 行丧
1900-09-24	1900-8a-1	29	平	一	庚子 乙酉 庚子	无	寒露 (10, 8)	无	无	无	修饰垣墙 平治道涂 沐浴 祭祀 馀事勿取	入宅 出行 嫁娶 安床
1900-09-25	1900-8a-2	29	定	二	庚子 乙酉 辛丑	无	寒露 (10, 8)	无	无	无	会亲友 修造 动土 开光 开厕 斋醮 栽种 求嗣 牧养 祈福 纳财 造仓	作灶 入宅 出火 开渠 祭祀 移徙 进人口
1900-09-26	1900-8a-3	29	执	三	庚子 乙酉 壬寅	无	寒露 (10, 8)	无	无	无	修坟 修造 动土 安葬 安门 开光 拆卸 牧养 破土 移柩 竖柱 解除	入宅 出火 嫁娶 安床 开市 探病 祈福 祭祀 移徙
1900-09-27	1900-8a-4	29	破	四	庚子 乙酉 癸卯	无	寒露 (10, 8)	无	无	无	坏垣 求医 治病 破屋 馀事勿取	入宅 移徙
1900-09-28	1900-8a-5	29	危	五	庚子 乙酉 甲辰	无	寒露 (10, 8)	无	无	无	上梁 修造 入宅 出火 出行 动土 合脊 嫁娶 安床 开光 成服 拆卸 掘井 放水 求嗣 破土 祈福 祭祀 移徙 移柩 纳采 订盟 谢土 进人口 除服	安葬 安门 开仓 开市
1900-09-29	1900-8a-6	29	成	六	庚子 乙酉 乙巳	无	寒露 (10, 8)	无	无	无	交易 入宅 出火 嫁娶 安床 开光 开市 挂匾 求嗣 祈福 祭祀 移徙 立券 纳采 解除 订盟 进人口	伐木 出行 安葬 栽种 纳畜 行丧 造庙 造桥
1900-09-30	1900-8a-7	29	收	日	庚子 乙酉 丙午	无	寒露 (10, 8)	无	无	无	冠笄 捕捉 祭祀 馀事勿取	作梁 合寿木 嫁娶 开市 盖屋
