1900-02-01	一八九九 己亥[猪]年	腊月大	廿三	周四	己亥 丁丑 乙巳 辛巳	猪	水瓶座	无	立春 (2, 4)	无	小年	无	祭祀、结婚姻、宴会、上官、冠带、竖柱上梁、经络、牧养、雪冤、裁制、覃恩、招贤、举正直、纳畜、颁诏、祈福、酝酿、庆赐、施恩、纳采、临政、恤孤茕、宣政事、求嗣	出行、修置产室、开渠、穿井、平治道涂、破屋坏垣、畋猎、破土、启攒、补垣、修饰垣墙、塞穴、乘船渡水、整手足甲、取鱼、筑堤防、鼓铸
1900-02-02	一八九九 己亥[猪]年	腊月大	廿四	周五	己亥 丁丑 丙午 癸巳	猪	水瓶座	无	立春 (2, 4)	无	子时灶君上天朝玉帝	无	沐浴、剃头、捕捉、畋猎、赴任、诉讼、整手足甲、整容	出行、结婚姻、宴会、嫁娶、安床、修造、求医疗病、上表章、上官、冠带、进人口、竖柱上梁、经络、开市、纳财、修置产室、开渠、穿井、安碓硙、平治道涂、破屋坏垣、栽种、牧养、破土、安葬、启攒、立券交易、裁制、乘船渡水、缮城郭、苫盖、招贤、布政事、选将、举正直、塞穴、纳畜、取鱼、上册、颁诏、修饰垣墙、出师、祈福、酝酿、庆赐、开仓、鼓铸、补垣、解除、纳采、施恩、修宫室、修仓库、临政、搬移、营建、筑堤防、宣政事、求嗣、安抚边境
1900-02-03	一八九九 己亥[猪]年	腊月大	廿五	周六	己亥 丁丑 丁未 乙巳	猪	水瓶座	无	立春 (2, 4)	无	无	无	诸事不宜	祭祀、出行、结婚姻、宴会、嫁娶、安床、剃头、修造、上表章、上官、冠带、进人口、竖柱上梁、经络、开市、纳财、修置产室、开渠、穿井、安碓硙、平治道涂、伐木、栽种、牧养、安葬、启攒、立券交易、裁制、缮城郭、招贤、布政事、举正直、选将、塞穴、纳畜、上册、颁诏、修饰垣墙、出师、祈福、安抚边境、酝酿、庆赐、整容、鼓铸、开仓、补垣、修宫室、施恩、纳采、整手足甲、修仓库、临政、搬移、营建、筑堤防、宣政事、求嗣
1900-02-04	一八九九 己亥[猪]年	腊月大	廿六	周日	己亥 戊寅 戊申 丁巳	猪	水瓶座	立春	雨水 (2, 18)	无	无	无	祭祀、沐浴、求医疗病、扫舍宇、破屋坏垣、解除	结婚姻、宴会、嫁娶、安床、修造、上官、冠带、进人口、竖柱上梁、经络、开市、纳财、修置产室、开渠、穿井、安碓硙、伐木、栽种、牧养、安葬、启攒、立券交易、裁制、缮城郭、招贤、布政事、举正直、选将、塞穴、纳畜、上册、颁诏、修饰垣墙、出师、酝酿、庆赐、鼓铸、开仓、补垣、修宫室、施恩、纳采、修仓库、临政、营建、筑堤防、宣政事、求嗣、安抚边境
1900-02-05	一八九九 己亥[猪]年	腊月大	廿七	周一	己亥 戊寅 己酉 己巳	猪	水瓶座	无	雨水 (2, 18)	无	无	无	祭祀、出行、嫁娶、安床、沐浴、剃头、修造、求医疗病、上官、扫舍宇、安葬、雪冤、赴任、覃恩、布政事、选将、入宅、祈福、整容、解除、纳采、整手足甲、临政、搬移、恤孤茕、安抚边境	结婚姻、宴会、上表章、冠带、竖柱上梁、修置产室、栽种、牧养、乘船渡水、缮城郭、招贤、举正直、纳畜、取鱼、上册、出师、开仓、修宫室、施恩、修仓库、筑堤防、营建、求嗣
1900-02-06	一八九九 己亥[猪]年	腊月大	廿八	周二	己亥 戊寅 庚戌 辛巳	猪	水瓶座	无	雨水 (2, 18)	无	无	无	入学、雪冤、覃恩、恤孤茕	出行、结婚姻、宴会、嫁娶、安床、剃头、修造、求医疗病、上表章、上官、冠带、进人口、竖柱上梁、经络、开市、纳财、修置产室、开渠、穿井、安碓硙、平治道涂、破屋坏垣、伐木、畋猎、栽种、牧养、破土、安葬、启攒、立券交易、裁制、缮城郭、远回、招贤、布政事、举正直、选将、塞穴、纳畜、上册、颁诏、修饰垣墙、出师、祈福、安抚边境、酝酿、庆赐、整容、鼓铸、开仓、补垣、宣政事、解除、修宫室、施恩、纳采、整手足甲、修仓库、临政、搬移、营建、筑堤防、求嗣
1900-02-07	一八九九 己亥[猪]年	腊月大	廿九	周三	己亥 戊寅 辛亥 癸巳	猪	水瓶座	无	雨水 (2, 18)	无	华严菩萨诞	无	祭祀、出行、结婚姻、宴会、沐浴、修造、求医疗病、上表章、上官、进人口、竖柱上梁、经络、开市、纳财、捕捉、栽种、牧养、安葬、立券交易、雪冤、裁制、覃恩、缮城郭、招贤、举正直、选将、纳畜、上册、颁诏、出师、祈福、酝酿、庆赐、开仓、解除、施恩、纳采、修仓库、临政、搬移、营建、恤孤茕、宣政事、求嗣、安抚边境	嫁娶、剃头、冠带、修置产室、开渠、穿井、安碓硙、破屋坏垣、畋猎、破土、启攒、塞穴、取鱼、修饰垣墙、整容、鼓铸、补垣、修宫室、整手足甲、筑堤防
1900-02-08	一八九九 己亥[猪]年	腊月大	三十	周四	己亥 戊寅 壬子 乙巳	猪	水瓶座	无	雨水 (2, 18)	无	除夕	无	祭祀、出行、结婚姻、宴会、嫁娶、沐浴、修造、求医疗病、上表章、上官、入学、竖柱上梁、开市、纳财、修置产室、安碓硙、栽种、牧养、雪冤、裁制、覃恩、缮城郭、招贤、举正直、选将、纳畜、上册、颁诏、出师、祈福、庆赐、解除、修宫室、施恩、纳采、修仓库、临政、搬移、营建、恤孤茕、宣政事、求嗣、安抚边境	剃头、冠带、开渠、破屋坏垣、伐木、畋猎、补垣、修饰垣墙、入宅、塞穴、整手足甲、苫盖、取鱼、筑堤防、开仓、整容、鼓铸
1900-02-09	一九零零 庚子[鼠]年	正月大	初一	周五	庚子 戊寅 癸丑 丁巳	鼠	水瓶座	无	雨水 (2, 18)	春节	弥勒佛圣诞	无	诸事不宜	诸事不宜
1900-02-10	一九零零 庚子[鼠]年	正月大	初二	周六	庚子 戊寅 甲寅 己巳	鼠	水瓶座	无	雨水 (2, 18)	无	无	无	宴会、经络、纳财、立券交易、雪冤、赴任、裁制、诉讼、覃恩、举正直、纳畜、酝酿、庆赐、施恩、恤孤茕	祭祀、剃头、求医疗病、上表章、修置产室、开渠、穿井、平治道涂、破屋坏垣、伐木、捕捉、畋猎、栽种、取鱼、上册、修饰垣墙、祈福、整容、开仓、补垣、解除、整手足甲、搬移、营建、筑堤防、求嗣
1900-02-11	一九零零 庚子[鼠]年	正月大	初三	周日	庚子 戊寅 乙卯 辛巳	鼠	水瓶座	无	雨水 (2, 18)	无	无	无	出行、结婚姻、宴会、嫁娶、沐浴、剃头、修造、求医疗病、上官、扫舍宇、立券交易、赴任、选将、入宅、出师、整容、解除、纳采、整手足甲、临政、搬移、安抚边境	上表章、冠带、竖柱上梁、修置产室、穿井、栽种、牧养、乘船渡水、缮城郭、招贤、纳畜、取鱼、上册、祈福、开仓、修仓库、筑堤防、营建、求嗣、修宫室
1900-02-12	一九零零 庚子[鼠]年	正月大	初四	周一	庚子 戊寅 丙辰 癸巳	鼠	水瓶座	无	雨水 (2, 18)	无	无	无	出行、宴会、上表章、竖柱上梁、经络、牧养、安葬、雪冤、裁制、覃恩、缮城郭、选将、纳畜、上册、颁诏、祈福、安抚边境、庆赐、解除、搬移、营建、恤孤茕、宣政事、求嗣、修宫室	祭祀、畋猎、乘船渡水、取鱼、鼓铸
1900-02-13	一九零零 庚子[鼠]年	正月大	初五	周二	庚子 戊寅 丁巳 乙巳	鼠	水瓶座	无	雨水 (2, 18)	无	无	无	平治道涂、雪冤、覃恩、恤孤茕	出行、剃头、冠带、修置产室、开渠、穿井、安碓硙、破屋坏垣、畋猎、破土、启攒、乘船渡水、布政事、塞穴、取鱼、整容、鼓铸、补垣、整手足甲、筑堤防
1900-02-14	一九零零 庚子[鼠]年	正月大	初六	周三	庚子 戊寅 戊午 丁巳	鼠	水瓶座	无	雨水 (2, 18)	无	无	无	祭祀、结婚姻、宴会、上官、冠带、进人口、竖柱上梁、经络、安碓硙、牧养、裁制、缮城郭、举正直、纳畜、祈福、酝酿、庆赐、纳采、施恩、临政、求嗣、修宫室	修置产室、安葬、选将、出师、整手足甲、苫盖、安抚边境
1900-02-15	一九零零 庚子[鼠]年	正月大	初七	周四	庚子 戊寅 己未 己巳	鼠	水瓶座	无	雨水 (2, 18)	无	无	无	捕捉	结婚姻、修造、求医疗病、选将、出师、纳畜、纳采、安抚边境
1900-02-16	一九零零 庚子[鼠]年	正月大	初八	周五	庚子 戊寅 庚申 辛巳	鼠	水瓶座	无	雨水 (2, 18)	无	五殿阎罗天子诞	无	祭祀、沐浴、扫舍宇、破屋坏垣、入宅	结婚姻、宴会、安床、上官、冠带、进人口、竖柱上梁、经络、开市、纳财、修置产室、开渠、穿井、安碓硙、伐木、栽种、牧养、启攒、立券交易、裁制、缮城郭、招贤、布政事、举正直、选将、塞穴、纳畜、上册、颁诏、修饰垣墙、出师、酝酿、庆赐、鼓铸、开仓、补垣、修宫室、施恩、修仓库、临政、营建、筑堤防、宣政事、求嗣、安抚边境
1900-02-17	一九零零 庚子[鼠]年	正月大	初九	周六	庚子 戊寅 辛酉 癸巳	鼠	水瓶座	无	雨水 (2, 18)	无	玉皇上帝诞	无	祭祀、出行、结婚姻、嫁娶、安床、沐浴、剃头、修造、求医疗病、上表章、上官、竖柱上梁、扫舍宇、栽种、牧养、安葬、雪冤、裁制、覃恩、缮城郭、招贤、选将、举正直、纳畜、上册、颁诏、出师、祈福、整容、解除、施恩、纳采、整手足甲、修仓库、临政、搬移、营建、恤孤茕、宣政事、求嗣、安抚边境	宴会、冠带、修置产室、开渠、穿井、安碓硙、畋猎、启攒、补垣、修饰垣墙、塞穴、修宫室、取鱼、筑堤防、开仓、布政事、鼓铸
1900-02-18	一九零零 庚子[鼠]年	正月大	初十	周日	庚子 戊寅 壬戌 乙巳	鼠	水瓶座	雨水	惊蛰 (3, 5)	无	无	无	祭祀、出行、结婚姻、宴会、嫁娶、修造、求医疗病、上表章、上官、入学、进人口、竖柱上梁、经络、开市、纳财、安碓硙、栽种、牧养、安葬、立券交易、雪冤、裁制、覃恩、缮城郭、选将、纳畜、上册、出师、祈福、酝酿、庆赐、解除、修宫室、纳采、修仓库、临政、筑堤防、搬移、恤孤茕、营建、求嗣、安抚边境	剃头、冠带、修置产室、开渠、穿井、平治道涂、破屋坏垣、伐木、畋猎、破土、启攒、远回、布政事、塞穴、取鱼、修饰垣墙、整容、开仓、补垣、鼓铸、整手足甲
1900-02-19	一九零零 庚子[鼠]年	正月大	十一	周一	庚子 戊寅 癸亥 丁巳	鼠	双鱼座	无	惊蛰 (3, 5)	无	无	无	祭祀、结婚姻、宴会、沐浴、进人口、经络、开市、纳财、捕捉、栽种、牧养、安葬、立券交易、纳畜、取鱼、祈福、酝酿、开仓	出行、嫁娶、安床、剃头、修造、求医疗病、上表章、上官、冠带、竖柱上梁、修置产室、开渠、穿井、安碓硙、破屋坏垣、破土、启攒、裁制、缮城郭、招贤、布政事、举正直、选将、塞穴、上册、颁诏、修饰垣墙、出师、安抚边境、庆赐、整容、鼓铸、补垣、解除、修宫室、施恩、纳采、整手足甲、修仓库、临政、搬移、营建、筑堤防、宣政事、求嗣
1900-02-20	一九零零 庚子[鼠]年	正月大	十二	周二	庚子 戊寅 甲子 己巳	鼠	双鱼座	无	惊蛰 (3, 5)	无	无	无	沐浴、入学、雪冤、赴任、诉讼、覃恩、恤孤茕	结婚姻、嫁娶、冠带、进人口、竖柱上梁、经络、伐木、畋猎、破土、安葬、启攒、塞穴、取鱼、入宅、酝酿、开仓、补垣、纳采、筑堤防、营建
1900-02-21	一九零零 庚子[鼠]年	正月大	十三	周三	庚子 戊寅 乙丑 辛巳	鼠	双鱼座	无	惊蛰 (3, 5)	无	无	无	祭祀、雪冤、赴任、覃恩、入宅、恤孤茕	出行、结婚姻、宴会、嫁娶、安床、剃头、修造、求医疗病、上表章、上官、冠带、进人口、竖柱上梁、经络、开市、立券、纳财、修置产室、开渠、穿井、安碓硙、平治道涂、破屋坏垣、栽种、牧养、破土、安葬、立券交易、疗目、针刺、裁制、缮城郭、远回、招贤、布政事、举正直、选将、塞穴、纳畜、上册、颁诏、修饰垣墙、出师、祈福、安抚边境、开张、酝酿、庆赐、开仓、整容、鼓铸、补垣、解除、修宫室、施恩、纳采、整手足甲、修仓库、临政、搬移、营建、筑堤防、宣政事、求嗣
1900-02-22	一九零零 庚子[鼠]年	正月大	十四	周四	庚子 戊寅 丙寅 癸巳	鼠	双鱼座	无	惊蛰 (3, 5)	无	无	无	宴会、经络、纳财、牧养、立券交易、雪冤、裁制、覃恩、布政事、举正直、纳畜、酝酿、庆赐、施恩、恤孤茕	祭祀、剃头、修置产室、开渠、穿井、平治道涂、破屋坏垣、伐木、捕捉、畋猎、补垣、修饰垣墙、整容、乘船渡水、整手足甲、取鱼、筑堤防
1900-02-23	一九零零 庚子[鼠]年	正月大	十五	周五	庚子 戊寅 丁卯 乙巳	鼠	双鱼座	无	惊蛰 (3, 5)	无	元宵节	无	祭祀、出行、结婚姻、宴会、嫁娶、沐浴、修造、求医疗病、上表章、上官、竖柱上梁、纳财、扫舍宇、栽种、牧养、安葬、立券交易、雪冤、裁制、覃恩、缮城郭、招贤、举正直、选将、纳畜、上册、颁诏、出师、祈福、安抚边境、庆赐、开仓、解除、施恩、整手足甲、纳采、修仓库、临政、搬移、营建、恤孤茕、宣政事、求嗣、修宫室	剃头、冠带、修置产室、穿井、畋猎、乘船渡水、取鱼、筑堤防
1900-02-24	一九零零 庚子[鼠]年	正月大	十六	周六	庚子 戊寅 戊辰 丁巳	鼠	双鱼座	无	惊蛰 (3, 5)	无	无	无	宴会、上表章、竖柱上梁、经络、安葬、雪冤、裁制、覃恩、缮城郭、布政事、上册、庆赐、恤孤茕、修宫室	祭祀、结婚姻、嫁娶、上官、栽种、举正直、选将、出师、鼓铸、乘船渡水、纳采、施恩、安抚边境、取鱼、招贤
1900-02-25	一九零零 庚子[鼠]年	正月大	十七	周日	庚子 戊寅 己巳 己巳	鼠	双鱼座	无	惊蛰 (3, 5)	无	无	无	平治道涂	祭祀、出行、结婚姻、宴会、嫁娶、安床、剃头、修造、求医疗病、上表章、上官、冠带、进人口、竖柱上梁、经络、开市、纳财、修置产室、开渠、穿井、安碓硙、破屋坏垣、栽种、牧养、破土、安葬、启攒、立券交易、裁制、缮城郭、招贤、布政事、举正直、选将、塞穴、纳畜、上册、颁诏、修饰垣墙、出师、祈福、酝酿、庆赐、开仓、鼓铸、整容、补垣、解除、修宫室、施恩、整手足甲、纳采、修仓库、临政、搬移、营建、筑堤防、宣政事、求嗣、安抚边境
1900-02-26	一九零零 庚子[鼠]年	正月大	十八	周一	庚子 戊寅 庚午 辛巳	鼠	双鱼座	无	惊蛰 (3, 5)	无	无	无	祭祀、宴会、上官、冠带、进人口、竖柱上梁、牧养、裁制、举正直、纳畜、入宅、祈福、酝酿、庆赐、纳采、施恩、临政、求嗣	修置产室、开渠、穿井、平治道涂、破屋坏垣、选将、补垣、修饰垣墙、出师、安抚边境、苫盖、筑堤防、营建
1900-02-27	一九零零 庚子[鼠]年	正月大	十九	周二	庚子 戊寅 辛未 癸巳	鼠	双鱼座	无	惊蛰 (3, 5)	无	无	无	祭祀、出行、结婚姻、宴会、嫁娶、上表章、上官、竖柱上梁、捕捉、栽种、牧养、破土、安葬、雪冤、裁制、覃恩、缮城郭、招贤、举正直、选将、上册、颁诏、出师、祈福、庆赐、解除、施恩、纳采、修仓库、临政、搬移、营建、恤孤茕、宣政事、求嗣、安抚边境	畋猎、整手足甲、取鱼
1900-02-28	一九零零 庚子[鼠]年	正月大	二十	周三	庚子 戊寅 壬申 乙巳	鼠	双鱼座	无	惊蛰 (3, 5)	无	无	无	祭祀、沐浴、求医疗病、扫舍宇、破屋坏垣、雪冤、覃恩、解除、恤孤茕	冠带、修置产室、开渠、穿井、安碓硙、伐木、畋猎、启攒、补垣、修饰垣墙、塞穴、修宫室、取鱼、筑堤防、开仓、布政事、鼓铸
