1903-04-01	一九零三 癸卯[兔]年	三月小	初四	周三	无	无	无	癸卯 乙卯 己未 己巳	无	清明 (4, 6)	兔	白羊座	祭祀、出行、宴会、修造、上官、冠带、进人口、竖柱上梁、经络、安碓硙、牧养、安葬、纳畜、颁诏、举正直、雪冤、缮城郭、裁制、宣政事、临政、酝酿、招贤、祈福、施恩、求嗣、覃恩、庆赐、恤孤茕、修宫室、营建、搬移	修置产室、畋猎、针刺、取鱼、开仓
1903-04-02	一九零三 癸卯[兔]年	三月小	初五	周四	无	无	无	癸卯 乙卯 庚申 辛巳	无	清明 (4, 6)	兔	白羊座	祭祀、沐浴、扫舍宇、捕捉、雪冤、覃恩、恤孤茕	安床、冠带、进人口、经络、开市、纳财、修置产室、开渠、穿井、安碓硙、破屋坏垣、畋猎、启攒、布政事、补垣、鼓铸、乘船渡水、酝酿、立券交易、开仓、筑堤防、塞穴、修饰垣墙、修宫室
1903-04-03	一九零三 癸卯[兔]年	三月小	初六	周五	无	无	无	癸卯 乙卯 辛酉 癸巳	无	清明 (4, 6)	兔	白羊座	诸事不宜	诸事不宜
1903-04-04	一九零三 癸卯[兔]年	三月小	初七	周六	无	无	无	癸卯 乙卯 壬戌 乙巳	无	清明 (4, 6)	兔	白羊座	赴任、诉讼、取鱼	出行、剃头、修造、求医疗病、上表章、上官、竖柱上梁、修置产室、开渠、穿井、安碓硙、破屋坏垣、栽种、布政事、颁诏、纳采、补垣、举正直、修仓库、整手足甲、缮城郭、鼓铸、裁制、宣政事、临政、招贤、开仓、祈福、解除、施恩、筑堤防、求嗣、塞穴、修饰垣墙、上册、庆赐、整容、修宫室、营建、出师
1903-04-05	一九零三 癸卯[兔]年	三月小	初八	周日	无	六殿卞城王诞	无	癸卯 乙卯 癸亥 丁巳	无	清明 (4, 6)	兔	白羊座	出行、结婚姻、宴会、沐浴、修造、上表章、上官、入学、进人口、竖柱上梁、经络、开市、纳财、安碓硙、栽种、牧养、赴任、纳畜、纳采、举正直、修仓库、缮城郭、裁制、临政、酝酿、立券交易、筑堤防、入宅、施恩、上册、庆赐、修宫室、搬移	嫁娶、求医疗病、破土、安葬、启攒
1903-04-06	一九零三 癸卯[兔]年	三月小	初九	周一	清明节	无	无	癸卯 丙辰 甲子 己巳	清明	谷雨 (4, 21)	兔	白羊座	祭祀、宴会、沐浴、上官、入学、进人口、竖柱上梁、经络、开市、纳财、牧养、赴任、布政事、纳畜、举正直、雪冤、裁制、临政、诉讼、酝酿、立券交易、施恩、祈福、覃恩、庆赐、恤孤茕	立券、修置产室、开渠、穿井、平治道涂、破屋坏垣、破土、安葬、开张、营建、开仓、远回、补垣、修饰垣墙
1903-04-07	一九零三 癸卯[兔]年	三月小	初十	周二	无	无	无	癸卯 丙辰 乙丑 辛巳	无	谷雨 (4, 21)	兔	白羊座	进人口、纳财、捕捉、雪冤、纳畜、恤孤茕、取鱼、覃恩	出行、结婚姻、安床、修造、求医疗病、上表章、上官、冠带、竖柱上梁、经络、开市、修置产室、开渠、穿井、栽种、破土、安葬、启攒、颁诏、纳采、举正直、修仓库、缮城郭、鼓铸、裁制、宣政事、临政、酝酿、立券交易、招贤、开仓、解除、施恩、筑堤防、上册、修宫室、营建、搬移
1903-04-08	一九零三 癸卯[兔]年	三月小	十一	周三	无	无	无	癸卯 丙辰 丙寅 癸巳	无	谷雨 (4, 21)	兔	白羊座	出行、结婚姻、宴会、修造、求医疗病、上表章、上官、入学、竖柱上梁、开市、纳财、修置产室、开渠、穿井、安碓硙、栽种、牧养、颁诏、纳采、举正直、安抚边境、修仓库、雪冤、缮城郭、裁制、宣政事、临政、立券交易、招贤、开仓、祈福、解除、施恩、求嗣、覃恩、上册、庆赐、恤孤茕、修宫室、选将、搬移	祭祀、嫁娶、伐木、畋猎、乘船渡水、针刺、取鱼
1903-04-09	一九零三 癸卯[兔]年	三月小	十二	周四	无	无	无	癸卯 丙辰 丁卯 乙巳	无	谷雨 (4, 21)	兔	白羊座	祭祀、补垣、雪冤、裁制、塞穴、覃恩、恤孤茕	剃头、冠带、修置产室、开渠、穿井、畋猎、针刺、整容、取鱼、疗目
1903-04-10	一九零三 癸卯[兔]年	三月小	十三	周五	无	无	无	癸卯 丙辰 戊辰 丁巳	无	谷雨 (4, 21)	兔	白羊座	雪冤、入宅、覃恩、恤孤茕	安床、剃头、求医疗病、上表章、冠带、开市、修置产室、开渠、穿井、平治道涂、破屋坏垣、伐木、栽种、牧养、破土、安葬、启攒、颁诏、补垣、整手足甲、鼓铸、宣政事、开仓、祈福、解除、求嗣、筑堤防、塞穴、修饰垣墙、上册、整容、营建
1903-04-11	一九零三 癸卯[兔]年	三月小	十四	周六	无	无	无	癸卯 丙辰 己巳 己巳	无	谷雨 (4, 21)	兔	白羊座	沐浴、扫舍宇、雪冤、恤孤茕	出行、结婚姻、宴会、嫁娶、安床、修造、上表章、冠带、进人口、竖柱上梁、修置产室、开渠、穿井、安碓硙、破屋坏垣、破土、安葬、启攒、布政事、颁诏、纳采、补垣、修仓库、缮城郭、鼓铸、裁制、宣政事、乘船渡水、招贤、祈福、筑堤防、求嗣、塞穴、修饰垣墙、上册、庆赐、修宫室、营建、搬移
1903-04-12	一九零三 癸卯[兔]年	三月小	十五	周日	无	昊天上帝诞	无	癸卯 丙辰 庚午 辛巳	无	谷雨 (4, 21)	兔	白羊座	诸事不宜	祭祀、出行、结婚姻、宴会、嫁娶、安床、剃头、修造、求医疗病、上表章、上官、冠带、进人口、竖柱上梁、经络、开市、纳财、修置产室、开渠、穿井、安碓硙、破屋坏垣、栽种、牧养、破土、安葬、启攒、布政事、纳畜、颁诏、补垣、纳采、举正直、苫盖、安抚边境、修仓库、整手足甲、缮城郭、鼓铸、裁制、宣政事、临政、酝酿、立券交易、招贤、开仓、入宅、祈福、解除、施恩、筑堤防、求嗣、塞穴、修饰垣墙、上册、庆赐、整容、修宫室、选将、营建、出师、搬移
1903-04-13	一九零三 癸卯[兔]年	三月小	十六	周一	无	准提菩萨诞	无	癸卯 丙辰 辛未 癸巳	无	谷雨 (4, 21)	兔	白羊座	诸事不宜	诸事不宜
1903-04-14	一九零三 癸卯[兔]年	三月小	十七	周二	无	无	无	癸卯 丙辰 壬申 乙巳	无	谷雨 (4, 21)	兔	白羊座	祭祀、沐浴、扫舍宇、雪冤、恤孤茕、覃恩	安床、开市、修置产室、开渠、穿井、平治道涂、破屋坏垣、伐木、捕捉、畋猎、启攒、布政事、取鱼、补垣、鼓铸、开仓、筑堤防、塞穴、修饰垣墙、远回
1903-04-15	一九零三 癸卯[兔]年	三月小	十八	周三	无	无	无	癸卯 丙辰 癸酉 丁巳	无	谷雨 (4, 21)	兔	白羊座	祭祀、出行、结婚姻、嫁娶、沐浴、剃头、修造、求医疗病、上官、进人口、经络、纳财、扫舍宇、捕捉、安葬、赴任、纳畜、取鱼、纳采、安抚边境、整手足甲、临政、酝酿、立券交易、祈福、入宅、解除、整容、搬移	宴会、上表章、冠带、竖柱上梁、修置产室、开渠、穿井、安碓硙、平治道涂、破屋坏垣、栽种、牧养、补垣、举正直、修仓库、缮城郭、乘船渡水、招贤、开仓、筑堤防、施恩、求嗣、修饰垣墙、上册、庆赐、修宫室、选将、营建、出师
1903-04-16	一九零三 癸卯[兔]年	三月小	十九	周四	无	中岳大帝诞	无	癸卯 丙辰 甲戌 己巳	无	谷雨 (4, 21)	兔	白羊座	祭祀、沐浴、求医疗病、破屋坏垣、解除	结婚姻、宴会、安床、修造、上官、冠带、进人口、竖柱上梁、经络、开市、纳财、修置产室、开渠、穿井、安碓硙、伐木、栽种、牧养、破土、安葬、启攒、布政事、纳畜、取鱼、颁诏、纳采、补垣、举正直、修仓库、缮城郭、鼓铸、裁制、宣政事、临政、乘船渡水、酝酿、立券交易、招贤、开仓、筑堤防、施恩、求嗣、塞穴、修饰垣墙、上册、庆赐、修宫室、营建
1903-04-17	一九零三 癸卯[兔]年	三月小	二十	周五	无	子孙娘娘诞	无	癸卯 丙辰 乙亥 辛巳	无	谷雨 (4, 21)	兔	白羊座	安床、沐浴、牧养、纳畜、取鱼	出行、结婚姻、嫁娶、求医疗病、进人口、开市、畋猎、破土、安葬、启攒、修仓库、纳采、立券交易、开仓、祈福、解除、求嗣
1903-04-18	一九零三 癸卯[兔]年	三月小	廿一	周六	无	无	无	癸卯 丙辰 丙子 癸巳	无	谷雨 (4, 21)	兔	白羊座	祭祀、结婚姻、宴会、嫁娶、沐浴、修造、求医疗病、上表章、上官、入学、进人口、竖柱上梁、经络、开市、纳财、安碓硙、栽种、牧养、安葬、赴任、纳畜、纳采、举正直、修仓库、缮城郭、裁制、临政、诉讼、酝酿、立券交易、开仓、筑堤防、祈福、施恩、解除、求嗣、庆赐、修宫室	整手足甲、远回
1903-04-19	一九零三 癸卯[兔]年	三月小	廿二	周日	无	无	无	癸卯 丙辰 丁丑 乙巳	无	谷雨 (4, 21)	兔	白羊座	进人口、纳财、捕捉、牧养、纳畜、雪冤、覃恩、恤孤茕	剃头、冠带、修置产室、开渠、穿井、安碓硙、平治道涂、破屋坏垣、畋猎、破土、启攒、布政事、取鱼、补垣、鼓铸、乘船渡水、筑堤防、修饰垣墙、整容
1903-04-20	一九零三 癸卯[兔]年	三月小	廿三	周一	无	无	无	癸卯 丙辰 戊寅 丁巳	无	谷雨 (4, 21)	兔	白羊座	结婚姻、宴会、上表章、上官、入学、竖柱上梁、开市、牧养、纳畜、颁诏、纳采、举正直、雪冤、裁制、宣政事、临政、立券交易、招贤、祈福、解除、施恩、入宅、求嗣、覃恩、上册、庆赐、恤孤茕、搬移	祭祀、平治道涂、破屋坏垣、伐木、畋猎、启攒、乘船渡水、针刺、整手足甲、取鱼、筑堤防、出师、补垣、修饰垣墙
1903-04-21	一九零三 癸卯[兔]年	三月小	廿四	周二	无	无	无	癸卯 丙辰 己卯 己巳	谷雨	立夏 (5, 7)	兔	金牛座	雪冤、恤孤茕、覃恩、塞穴	出行、结婚姻、宴会、嫁娶、安床、修造、求医疗病、上表章、上官、冠带、进人口、竖柱上梁、经络、开市、纳财、修置产室、开渠、穿井、安碓硙、平治道涂、破屋坏垣、栽种、牧养、破土、安葬、启攒、布政事、出师、纳畜、颁诏、补垣、纳采、举正直、安抚边境、修仓库、缮城郭、宣政事、临政、针刺、酝酿、立券交易、招贤、开仓、祈福、解除、施恩、筑堤防、求嗣、修饰垣墙、上册、庆赐、修宫室、选将、营建、疗目、搬移
1903-04-22	一九零三 癸卯[兔]年	三月小	廿五	周三	无	无	无	癸卯 丙辰 庚辰 辛巳	无	立夏 (5, 7)	兔	金牛座	祭祀、雪冤、覃恩、恤孤茕	出行、结婚姻、宴会、嫁娶、安床、剃头、修造、求医疗病、上表章、上官、冠带、进人口、竖柱上梁、经络、开市、纳财、修置产室、开渠、穿井、安碓硙、平治道涂、破屋坏垣、伐木、栽种、牧养、破土、安葬、启攒、布政事、纳畜、颁诏、纳采、补垣、举正直、安抚边境、修仓库、整手足甲、缮城郭、鼓铸、裁制、宣政事、临政、酝酿、立券交易、招贤、开仓、祈福、解除、施恩、求嗣、筑堤防、塞穴、修饰垣墙、上册、庆赐、整容、修宫室、选将、营建、出师、搬移
1903-04-23	一九零三 癸卯[兔]年	三月小	廿六	周四	无	无	无	癸卯 丙辰 辛巳 癸巳	无	立夏 (5, 7)	兔	金牛座	沐浴、扫舍宇、雪冤、覃恩、恤孤茕	出行、结婚姻、嫁娶、安床、修造、上表章、冠带、进人口、竖柱上梁、修置产室、开渠、穿井、安碓硙、平治道涂、破屋坏垣、破土、安葬、启攒、颁诏、纳采、补垣、修仓库、缮城郭、鼓铸、裁制、宣政事、招贤、祈福、筑堤防、塞穴、求嗣、修饰垣墙、上册、修宫室、营建、搬移
1903-04-24	一九零三 癸卯[兔]年	三月小	廿七	周五	无	七殿泰山王诞	无	癸卯 丙辰 壬午 乙巳	无	立夏 (5, 7)	兔	金牛座	出行、结婚姻、宴会、嫁娶、修造、求医疗病、上表章、上官、进人口、竖柱上梁、经络、开市、纳财、栽种、牧养、安葬、出师、纳畜、颁诏、纳采、补垣、举正直、安抚边境、修仓库、雪冤、缮城郭、裁制、宣政事、临政、立券交易、招贤、开仓、祈福、解除、施恩、塞穴、求嗣、覃恩、上册、庆赐、恤孤茕、修宫室、选将、营建、搬移	祭祀、剃头、冠带、修置产室、开渠、穿井、安碓硙、平治道涂、破屋坏垣、畋猎、启攒、取鱼、苫盖、整手足甲、鼓铸、入宅、筑堤防、修饰垣墙、整容
1903-04-25	一九零三 癸卯[兔]年	三月小	廿八	周六	无	苍颉至圣先师诞	无	癸卯 丙辰 癸未 丁巳	无	立夏 (5, 7)	兔	金牛座	赴任、雪冤、恤孤茕、入宅、覃恩	出行、结婚姻、宴会、嫁娶、安床、剃头、修造、求医疗病、上表章、上官、冠带、进人口、竖柱上梁、经络、开市、纳财、修置产室、开渠、穿井、安碓硙、平治道涂、破屋坏垣、栽种、牧养、破土、安葬、启攒、布政事、出师、纳畜、颁诏、纳采、补垣、举正直、安抚边境、修仓库、整手足甲、缮城郭、鼓铸、裁制、宣政事、临政、酝酿、立券交易、招贤、开仓、祈福、解除、施恩、筑堤防、求嗣、塞穴、修饰垣墙、上册、庆赐、整容、修宫室、选将、营建、搬移
1903-04-26	一九零三 癸卯[兔]年	三月小	廿九	周日	无	无	无	癸卯 丙辰 甲申 己巳	无	立夏 (5, 7)	兔	金牛座	沐浴、扫舍宇	出行、结婚姻、宴会、嫁娶、安床、剃头、修造、求医疗病、上表章、上官、冠带、进人口、竖柱上梁、经络、开市、纳财、修置产室、开渠、穿井、安碓硙、平治道涂、破屋坏垣、伐木、捕捉、畋猎、栽种、牧养、破土、安葬、启攒、布政事、出师、纳畜、取鱼、颁诏、补垣、纳采、举正直、安抚边境、修仓库、整手足甲、缮城郭、鼓铸、裁制、宣政事、临政、酝酿、立券交易、招贤、开仓、祈福、解除、施恩、筑堤防、求嗣、塞穴、修饰垣墙、上册、庆赐、整容、修宫室、选将、营建、远回、搬移
1903-04-27	一九零三 癸卯[兔]年	四月大	初一	周一	无	八殿都市王诞	无	癸卯 丙辰 乙酉 辛巳	无	立夏 (5, 7)	兔	金牛座	祭祀、出行、结婚姻、嫁娶、沐浴、剃头、修造、求医疗病、上表章、上官、进人口、竖柱上梁、经络、开市、纳财、扫舍宇、捕捉、栽种、牧养、安葬、纳畜、取鱼、颁诏、纳采、举正直、安抚边境、修仓库、雪冤、整手足甲、缮城郭、裁制、宣政事、临政、酝酿、立券交易、招贤、祈福、解除、施恩、求嗣、覃恩、上册、整容、恤孤茕、选将、营建、搬移	宴会、冠带、修置产室、开渠、穿井、安碓硙、平治道涂、破屋坏垣、乘船渡水、修宫室、开仓、筑堤防、出师、补垣、修饰垣墙
1903-04-28	一九零三 癸卯[兔]年	四月大	初二	周二	无	无	无	癸卯 丙辰 丙戌 癸巳	无	立夏 (5, 7)	兔	金牛座	祭祀、沐浴、求医疗病、解除	冠带、修置产室、开渠、穿井、安碓硙、平治道涂、伐木、破土、安葬、启攒、布政事、纳畜、取鱼、颁诏、补垣、修仓库、鼓铸、宣政事、乘船渡水、招贤、筑堤防、塞穴、修饰垣墙、上册、营建
1903-04-29	一九零三 癸卯[兔]年	四月大	初三	周三	无	无	无	癸卯 丙辰 丁亥 乙巳	无	立夏 (5, 7)	兔	金牛座	祭祀、宴会、安床、沐浴、上表章、上官、竖柱上梁、纳财、牧养、纳畜、颁诏、纳采、举正直、雪冤、裁制、宣政事、临政、招贤、施恩、覃恩、上册、庆赐、恤孤茕、搬移	嫁娶、剃头、修置产室、开渠、穿井、安碓硙、平治道涂、破屋坏垣、畋猎、破土、启攒、整容、取鱼、筑堤防、补垣、修饰垣墙
1903-04-30	一九零三 癸卯[兔]年	四月大	初四	周四	无	文殊菩萨诞	无	癸卯 丙辰 戊子 丁巳	无	立夏 (5, 7)	兔	金牛座	祭祀、结婚姻、宴会、嫁娶、沐浴、上官、入学、进人口、竖柱上梁、经络、开市、纳财、牧养、赴任、纳畜、纳采、举正直、安抚边境、裁制、临政、诉讼、酝酿、立券交易、入宅、施恩、祈福、庆赐、选将、出师	修置产室、开渠、穿井、平治道涂、破屋坏垣、破土、启攒、补垣、修饰垣墙、营建、远回
