1903-11-01	1903-9-13	30	危	日	癸卯 壬戌 癸巳	无	立冬 (11, 8)	万圣节	无	无	会亲友 嫁娶 订盟 纳采 纳婿 拆卸 修造 动土 起基 竖柱 上梁 安床 纳财	出行 祈福 安葬 作灶
1903-11-02	1903-9-14	30	成	一	癸卯 壬戌 甲午	无	立冬 (11, 8)	无	无	无	祭祀 塑绘 开光 祈福 斋醮 出行 订盟 纳采 裁衣 嫁娶 拆卸 修造 安床 入宅 安香 入殓 启钻 安葬 谢土 赴任 会亲友 进人口 移徙 上梁 经络 开市 交易 立券 纳财	开仓 冠笄 伐木 作梁
1903-11-03	1903-9-15	30	收	二	癸卯 壬戌 乙未	无	立冬 (11, 8)	无	无	无	祭祀 作灶 入殓 除服 成服 畋猎	栽种 动土 安葬 开市
1903-11-04	1903-9-16	30	开	三	癸卯 壬戌 丙申	无	立冬 (11, 8)	无	无	无	祭祀 祈福 斋醮 沐浴 竖柱 订盟 纳采 嫁娶 拆卸 入宅 移柩 启钻 谢土 赴任 出火 纳畜	作灶 入殓 安葬 安床
1903-11-05	1903-9-17	30	闭	四	癸卯 壬戌 丁酉	无	立冬 (11, 8)	无	无	无	嫁娶 祭祀 安机械 入殓 破土 安葬	动土 上梁
1903-11-06	1903-9-18	30	建	五	癸卯 壬戌 戊戌	无	立冬 (11, 8)	无	无	无	作灶 造畜稠	行丧 安葬
1903-11-07	1903-9-19	30	除	六	癸卯 壬戌 己亥	无	立冬 (11, 8)	无	无	无	沐浴 理发 入学 习艺 进人口	嫁娶 入宅
1903-11-08	1903-9-20	30	除	日	癸卯 癸亥 庚子	立冬	小雪 (11, 23)	无	无	无	纳采 订盟 嫁娶 祭祀 祈福 求嗣 开光 出行 解除 进人口 开市 立券 挂匾 入宅 移徙 安门 栽种 动土 求医 治病 会亲友 起基 修造 盖屋 安葬	作灶 经络 安床
1903-11-09	1903-9-21	30	满	一	癸卯 癸亥 辛丑	无	小雪 (11, 23)	无	无	无	祭祀 塑绘 理发 会亲友 牧养 开池 造畜稠 畋猎 结网	祈福 谢土 安葬 上梁 作灶 开市 嫁娶 出行 入宅 动土
1903-11-10	1903-9-22	30	平	二	癸卯 癸亥 壬寅	无	小雪 (11, 23)	无	无	无	出行 纳财 开市 交易 立券 动土 移徙 入宅 裁衣 会亲友 拆卸 进人口 安香 经络 出货财 修饰垣墙 平治道涂	造庙 谢土 作灶 作梁 伐木 安葬 行丧 修坟 探病
1903-11-11	1903-9-23	30	定	三	癸卯 癸亥 癸卯	无	小雪 (11, 23)	无	无	无	嫁娶 纳采 订盟 祭祀 斋醮 开光 安香 出火 出行 拆卸 动土 祈福 进人口 纳财 交易 立券 移徙 安床 修造 安葬 除服 成服	置产 掘井 词讼 栽种
1903-11-12	1903-9-24	30	执	四	癸卯 癸亥 甲辰	无	小雪 (11, 23)	无	无	无	嫁娶 纳采 订盟 祭祀 开光 出行 解除 伐木 出火 入宅 移徙 拆卸 修造 栽种 安葬 入殓	破土 动土 安门 作灶 开市 交易
1903-11-13	1903-9-25	30	破	五	癸卯 癸亥 乙巳	无	小雪 (11, 23)	无	无	无	祭祀 解除 破屋 坏垣 求医 治病 馀事勿取	嫁娶 安葬
1903-11-14	1903-9-26	30	危	六	癸卯 癸亥 丙午	无	小雪 (11, 23)	无	无	无	祭祀 扫舍 破土 安葬 除服 成服 启钻 移柩 入殓 立碑 馀事勿取	嫁娶 入宅 修造 动土
1903-11-15	1903-9-27	30	成	日	癸卯 癸亥 丁未	无	小雪 (11, 23)	无	无	无	订盟 纳采 会亲友 祭祀 祈福 修造 动土 安机械 破土 安葬	嫁娶 移徙 出火 开市 入宅
1903-11-16	1903-9-28	30	收	一	癸卯 癸亥 戊申	无	小雪 (11, 23)	无	无	无	祭祀 沐浴 捕捉 畋猎 结网 扫舍	嫁娶 纳采 订盟 安床 动土 破土 安葬
1903-11-17	1903-9-29	30	开	二	癸卯 癸亥 己酉	无	小雪 (11, 23)	无	无	无	开市 纳财 出行 祭祀 祈福 求嗣 斋醮 问名 入学 起基 定磉 置产 开渠 掘井 拆卸 栽种 纳畜 牧养 动土 破土 启钻	移徙 入宅 出火 入殓 安葬
1903-11-18	1903-9-30	30	闭	三	癸卯 癸亥 庚戌	无	小雪 (11, 23)	无	无	无	祭祀 理发 置产 塞穴 除服 成服 移柩 入殓 破土 安葬	嫁娶 入宅 安床 掘井 开光
1903-11-19	1903-10-1	30	建	四	癸卯 癸亥 辛亥	无	小雪 (11, 23)	无	无	无	祭祀 沐浴 出行 馀事勿取	开市 动土 破土 行丧 安葬
1903-11-20	1903-10-2	30	除	五	癸卯 癸亥 壬子	无	小雪 (11, 23)	无	无	无	嫁娶 造车器 出行 会亲友 移徙 入宅 修造 动土 雕刻 开光 安香 出火 理发 盖屋 合脊 起基 归岫 安门 拆卸 扫舍 栽种 造畜稠	开市 纳采 造庙 安床 开渠 安葬
1903-11-21	1903-10-3	30	满	六	癸卯 癸亥 癸丑	无	小雪 (11, 23)	无	无	无	塑绘 会亲友 安机械 塞穴 结网 裁衣 经络	嫁娶 开市 祈福 斋醮 安葬
1903-11-22	1903-10-4	30	平	日	癸卯 癸亥 甲寅	无	小雪 (11, 23)	无	无	无	纳采 移徙 纳财 开市 交易 立券 入宅 修造 动土 竖柱 起基 定磉 造庙 安香 出火 修饰垣墙 平治道涂 会亲友 出行 开池 开厕	开仓 盖屋 造桥 祭祀
1903-11-23	1903-10-5	30	定	一	癸卯 癸亥 乙卯	小雪	大雪 (12, 8)	无	无	无	订盟 纳采 纳财 开市 立券 祭祀 祈福 移徙 入宅 出行 盖屋 起基 修造 动土 竖柱 上梁 安门 安香 出火 教牛马 会亲友 破土	嫁娶 安葬 掘井 置产 造船
1903-11-24	1903-10-6	30	执	二	癸卯 癸亥 丙辰	无	大雪 (12, 8)	无	无	无	嫁娶 订盟 纳采 祭祀 祈福 塑绘 开光 移徙 安床 伐木 作梁 捕捉 畋猎 结网 求医 治病 解除 安葬 除服 成服 移柩 入殓 立碑 谢土	开市 造庙 动土 破土
1903-11-25	1903-10-7	30	破	三	癸卯 癸亥 丁巳	无	大雪 (12, 8)	无	无	无	破屋 坏垣 祭祀 馀事勿取	嫁娶 安葬
1903-11-26	1903-10-8	30	危	四	癸卯 癸亥 戊午	无	大雪 (12, 8)	感恩节	无	无	嫁娶 纳采 订盟 祭祀 冠笄 裁衣 伐木 作梁 架马 定磉 开柱眼 作灶 移徙 安床 畋猎 结网 开池 开厕 除服 成服 启钻 入殓 移柩 安葬	盖屋 造船 动土 破土
1903-11-27	1903-10-9	30	成	五	癸卯 癸亥 己未	无	大雪 (12, 8)	无	无	无	纳采 订盟 祭祀 祈福 求嗣 斋醮 开光 会亲友 解除 入学 纳财 交易 立券 经络 起基 动土 定磉 开池 栽种 纳畜 牧养 破土 入殓 立碑 安葬	嫁娶 开市 入宅 出火 移徙
1903-11-28	1903-10-10	30	收	六	癸卯 癸亥 庚申	无	大雪 (12, 8)	无	无	无	捕捉 畋猎 会亲友 解除 入殓 除服 成服 移柩 馀事勿取	安床 安门 破土 修坟 安葬
1903-11-29	1903-10-11	30	开	日	癸卯 癸亥 辛酉	无	大雪 (12, 8)	无	无	无	祭祀 祈福 求嗣 斋醮 沐浴 冠笄 出行 理发 拆卸 解除 起基 动土 定磉 安碓磑 开池 掘井 扫舍 除服 成服 移柩 启钻 立碑 谢土	移徙 入宅 安门 作梁 安葬
1903-11-30	1903-10-12	30	闭	一	癸卯 癸亥 壬戌	无	大雪 (12, 8)	无	无	无	嫁娶 冠笄 安床 纳采 会亲友 塞穴 捕捉 置产 造畜稠	开光 掘井 安葬 谢土 修坟
