1906-12-01	一九零六 丙午[马]年	十月大	十六	周六	丙午 己亥 己卯 己巳	无	大雪 (12, 8)	无	无	无	马	射手座	祭祀、出行、结婚姻、宴会、嫁娶、修造、上官、冠带、进人口、竖柱上梁、经络、安碓硙、牧养、破土、搬移、祈福、缮城郭、裁制、修宫室、颁诏、求嗣、覃恩、恤孤茕、雪冤、庆赐、招贤、宣政事、施恩、临政、纳畜、举正直、酝酿、营建、纳采	修置产室、穿井、畋猎、取鱼、开仓、苫盖
1906-12-02	一九零六 丙午[马]年	十月大	十七	周日	丙午 己亥 庚辰 辛巳	无	大雪 (12, 8)	无	无	无	马	射手座	祭祀、结婚姻、宴会、嫁娶、沐浴、剃头、求医疗病、上表章、上官、竖柱上梁、捕捉、牧养、安葬、搬移、祈福、裁制、上册、颁诏、求嗣、覃恩、恤孤茕、雪冤、庆赐、招贤、整容、宣政事、安抚边境、施恩、临政、纳畜、举正直、解除、选将、纳采、整手足甲、出师	修置产室、开渠、穿井、安碓硙、平治道涂、破屋坏垣、畋猎、破土、补垣、取鱼、修饰垣墙、筑堤防、开仓、修宫室
1906-12-03	一九零六 丙午[马]年	十月大	十八	周一	丙午 己亥 辛巳 癸巳	无	大雪 (12, 8)	无	无	无	马	射手座	求医疗病、破屋坏垣、覃恩、恤孤茕、雪冤、入宅、赴任	出行、结婚姻、剃头、上表章、上官、冠带、竖柱上梁、修置产室、开渠、穿井、安碓硙、伐木、栽种、牧养、破土、安葬、启攒、祈福、缮城郭、裁制、上册、开仓、修宫室、颁诏、求嗣、补垣、招贤、整容、宣政事、施恩、修饰垣墙、临政、举正直、塞穴、修仓库、鼓铸、营建、整手足甲、筑堤防
1906-12-04	一九零六 丙午[马]年	十月大	十九	周二	丙午 己亥 壬午 乙巳	无	大雪 (12, 8)	无	无	无	马	射手座	祭祀、宴会、伐木、畋猎、裁制、覃恩、恤孤茕、庆赐、雪冤、布政事	出行、结婚姻、嫁娶、安床、修造、求医疗病、上表章、上官、冠带、进人口、竖柱上梁、开市、纳财、修置产室、开渠、穿井、栽种、牧养、破土、安葬、启攒、搬移、祈福、缮城郭、开仓、上册、修宫室、求嗣、招贤、安抚边境、施恩、立券交易、临政、纳畜、举正直、解除、修仓库、选将、营建、纳采、整手足甲、出师、筑堤防、苫盖
1906-12-05	一九零六 丙午[马]年	十月大	二十	周三	丙午 己亥 癸未 丁巳	无	大雪 (12, 8)	无	无	无	马	射手座	祭祀、结婚姻、宴会、入学、竖柱上梁、经络、开市、纳财、安碓硙、破土、祈福、缮城郭、裁制、修宫室、覃恩、庆赐、恤孤茕、雪冤、布政事、立券交易、纳畜、酝酿、纳采、筑堤防	求医疗病、捕捉、畋猎、颁诏、取鱼、招贤、宣政事、乘船渡水、选将、出师
1906-12-06	一九零六 丙午[马]年	十月大	廿一	周四	丙午 己亥 甲申 己巳	无	大雪 (12, 8)	无	无	无	马	射手座	祭祀、出行、结婚姻、宴会、嫁娶、沐浴、剃头、修造、求医疗病、上表章、上官、进人口、竖柱上梁、纳财、扫舍宇、捕捉、栽种、牧养、安葬、搬移、祈福、缮城郭、开仓、裁制、上册、修宫室、颁诏、求嗣、覃恩、恤孤茕、雪冤、庆赐、招贤、整容、宣政事、安抚边境、施恩、临政、纳畜、举正直、解除、修仓库、选将、营建、纳采、整手足甲、出师	冠带、修置产室、开渠、穿井、安碓硙、破屋坏垣、畋猎、启攒、补垣、取鱼、鼓铸、布政事、筑堤防、塞穴、修饰垣墙
1906-12-07	一九零六 丙午[马]年	十月大	廿二	周五	丙午 己亥 乙酉 辛巳	无	大雪 (12, 8)	无	无	无	马	射手座	祭祀、出行、结婚姻、嫁娶、沐浴、剃头、修造、求医疗病、上表章、上官、入学、竖柱上梁、开市、纳财、修置产室、开渠、穿井、安碓硙、扫舍宇、栽种、牧养、搬移、祈福、缮城郭、开仓、裁制、上册、修宫室、颁诏、求嗣、覃恩、恤孤茕、雪冤、招贤、整容、宣政事、安抚边境、施恩、临政、纳畜、举正直、解除、修仓库、选将、营建、纳采、整手足甲、出师	宴会、冠带、破屋坏垣、伐木、畋猎、补垣、取鱼、鼓铸、布政事、入宅、筑堤防、塞穴、修饰垣墙
1906-12-08	一九零六 丙午[马]年	十月大	廿三	周六	丙午 庚子 丙戌 癸巳	大雪	冬至 (12, 23)	无	无	无	马	射手座	宴会、入学、开市、修置产室、开渠、穿井、安碓硙、栽种、牧养、祈福、缮城郭、裁制、修宫室、求嗣、覃恩、恤孤茕、雪冤、庆赐、入宅、施恩、举正直、解除、纳采	进人口、立券、伐木、捕捉、畋猎、开仓、取鱼、安抚边境、开张、乘船渡水、选将、整手足甲、出师
1906-12-09	一九零六 丙午[马]年	十月大	廿四	周日	丙午 庚子 丁亥 乙巳	无	冬至 (12, 23)	无	无	无	马	射手座	祭祀、沐浴、栽种、牧养、缮城郭、裁制、覃恩、补垣、恤孤茕、雪冤、纳畜、塞穴、修仓库、筑堤防	嫁娶、剃头、修置产室、开渠、穿井、畋猎、破土、启攒、取鱼、针刺、整容、疗目、布政事、开仓、修宫室
1906-12-10	一九零六 丙午[马]年	十月大	廿五	周一	丙午 庚子 戊子 丁巳	无	冬至 (12, 23)	无	无	无	马	射手座	诸事不宜	诸事不宜
1906-12-11	一九零六 丙午[马]年	十月大	廿六	周二	丙午 庚子 己丑 己巳	无	冬至 (12, 23)	无	无	无	马	射手座	祭祀、出行、结婚姻、宴会、嫁娶、沐浴、剃头、上官、进人口、经络、纳财、扫舍宇、安葬、祈福、恤孤茕、雪冤、整容、施恩、立券交易、临政、举正直、解除、酝酿、整手足甲	修造、冠带
1906-12-12	一九零六 丙午[马]年	十月大	廿七	周三	丙午 庚子 庚寅 辛巳	无	冬至 (12, 23)	无	无	无	马	射手座	宴会、修造、上表章、进人口、竖柱上梁、开市、纳财、栽种、牧养、祈福、缮城郭、裁制、上册、修宫室、求嗣、庆赐、补垣、安抚边境、立券交易、解除、塞穴、选将、出师	祭祀、招贤、远回
1906-12-13	一九零六 丙午[马]年	十月大	廿八	周四	丙午 庚子 辛卯 癸巳	无	冬至 (12, 23)	无	无	无	马	射手座	平治道涂、入宅、赴任	出行、结婚姻、宴会、嫁娶、安床、剃头、修造、求医疗病、上表章、上官、冠带、进人口、竖柱上梁、经络、开市、纳财、修置产室、开渠、穿井、安碓硙、破屋坏垣、畋猎、栽种、牧养、破土、安葬、启攒、搬移、祈福、缮城郭、裁制、上册、开仓、修宫室、颁诏、求嗣、庆赐、补垣、招贤、整容、布政事、宣政事、安抚边境、施恩、立券交易、修饰垣墙、临政、纳畜、举正直、解除、塞穴、修仓库、酝酿、选将、鼓铸、营建、纳采、整手足甲、出师、筑堤防
1906-12-14	一九零六 丙午[马]年	十月大	廿九	周五	丙午 庚子 壬辰 乙巳	无	冬至 (12, 23)	无	无	无	马	射手座	祭祀、宴会、经络、安碓硙、诉讼、祈福、裁制、颁诏、求嗣、覃恩、恤孤茕、雪冤、庆赐、招贤、宣政事、施恩、举正直、赴任、酝酿	安床、开市、修置产室、开渠、穿井、畋猎、破土、启攒、取鱼、筑堤防、开仓
1906-12-15	一九零六 丙午[马]年	十月大	三十	周六	丙午 庚子 癸巳 丁巳	无	冬至 (12, 23)	无	无	无	马	射手座	祭祀、捕捉、覃恩、恤孤茕、雪冤	出行、安床、剃头、冠带、进人口、修置产室、开渠、穿井、安碓硙、破屋坏垣、破土、启攒、修宫室、补垣、取鱼、整容、布政事、修饰垣墙、塞穴、鼓铸、整手足甲、筑堤防
1906-12-16	一九零六 丙午[马]年	冬月小	初一	周日	丙午 庚子 甲午 己巳	无	冬至 (12, 23)	无	无	无	马	射手座	诸事不宜	诸事不宜
1906-12-17	一九零六 丙午[马]年	冬月小	初二	周一	丙午 庚子 乙未 辛巳	无	冬至 (12, 23)	无	无	无	马	射手座	祭祀、伐木、畋猎	出行、结婚姻、宴会、嫁娶、安床、剃头、修造、求医疗病、上表章、上官、冠带、进人口、竖柱上梁、经络、开市、纳财、修置产室、开渠、穿井、安碓硙、破屋坏垣、栽种、牧养、破土、安葬、启攒、搬移、祈福、缮城郭、裁制、上册、修宫室、开仓、颁诏、求嗣、庆赐、补垣、招贤、整容、布政事、宣政事、安抚边境、施恩、立券交易、修饰垣墙、临政、纳畜、举正直、解除、塞穴、修仓库、酝酿、选将、鼓铸、营建、纳采、整手足甲、出师、筑堤防
1906-12-18	一九零六 丙午[马]年	冬月小	初三	周二	丙午 庚子 丙申 癸巳	无	冬至 (12, 23)	无	无	无	马	射手座	出行、沐浴、剃头、求医疗病、上表章、上官、入学、竖柱上梁、经络、扫舍宇、牧养、安葬、裁制、整容、入宅、施恩、临政、举正直、解除、酝酿、整手足甲	安床、修置产室、开渠、穿井、平治道涂、破屋坏垣、开仓、补垣、取鱼、修饰垣墙、塞穴、乘船渡水、选将、鼓铸、营建、出师
1906-12-19	一九零六 丙午[马]年	冬月小	初四	周三	丙午 庚子 丁酉 乙巳	无	冬至 (12, 23)	无	至圣先师孔子诞	无	马	射手座	沐浴、扫舍宇、捕捉、覃恩、恤孤茕、雪冤、整手足甲	宴会、剃头、冠带、修置产室、开渠、穿井、畋猎、启攒、取鱼、鼓铸、布政事、乘船渡水、筑堤防、开仓、修宫室
1906-12-20	一九零六 丙午[马]年	冬月小	初五	周四	丙午 庚子 戊戌 丁巳	无	冬至 (12, 23)	无	无	无	马	射手座	宴会、修造、入学、开市、修置产室、开渠、穿井、安碓硙、栽种、牧养、祈福、缮城郭、裁制、修宫室、求嗣、覃恩、恤孤茕、雪冤、庆赐、施恩、举正直、解除	嫁娶、进人口、伐木、捕捉、畋猎、开仓、取鱼、安抚边境、乘船渡水、选将、出师
1906-12-21	一九零六 丙午[马]年	冬月小	初六	周五	丙午 庚子 己亥 己巳	无	冬至 (12, 23)	无	西岳大帝诞	无	马	射手座	沐浴、裁制、覃恩、恤孤茕、补垣、雪冤、安抚边境、塞穴、选将、筑堤防	出行、结婚姻、宴会、嫁娶、安床、修造、求医疗病、上表章、上官、进人口、竖柱上梁、开市、修置产室、开渠、穿井、破土、安葬、启攒、搬移、祈福、开仓、上册、修宫室、颁诏、求嗣、庆赐、针刺、招贤、布政事、宣政事、疗目、施恩、临政、举正直、解除、营建、纳采、整手足甲、出师
1906-12-22	一九零六 丙午[马]年	冬月小	初七	周六	丙午 庚子 庚子 辛巳	无	冬至 (12, 23)	无	无	无	马	射手座	诸事不宜	诸事不宜
1906-12-23	一九零六 丙午[马]年	冬月小	初八	周日	丙午 庚子 辛丑 癸巳	冬至	小寒 (1, 6)	无	无	无	马	摩羯座	祭祀、出行、结婚姻、宴会、嫁娶、沐浴、剃头、上官、进人口、经络、纳财、扫舍宇、安葬、搬移、祈福、恤孤茕、雪冤、整容、入宅、安抚边境、施恩、立券交易、临政、举正直、解除、赴任、选将、纳采、整手足甲、出师	冠带
1906-12-24	一九零六 丙午[马]年	冬月小	初九	周一	丙午 庚子 壬寅 乙巳	无	小寒 (1, 6)	无	无	无	马	摩羯座	宴会、嫁娶、上表章、进人口、竖柱上梁、经络、开市、纳财、栽种、牧养、祈福、缮城郭、裁制、上册、修宫室、颁诏、求嗣、覃恩、补垣、恤孤茕、雪冤、庆赐、宣政事、安抚边境、立券交易、纳畜、解除、塞穴、选将、营建	祭祀、开渠、穿井、畋猎、取鱼、远回
1906-12-25	一九零六 丙午[马]年	冬月小	初十	周二	丙午 庚子 癸卯 丁巳	无	小寒 (1, 6)	无	无	无	马	摩羯座	诸事不宜	诸事不宜
1906-12-26	一九零六 丙午[马]年	冬月小	十一	周三	丙午 庚子 甲辰 己巳	无	小寒 (1, 6)	无	太乙救苦天尊诞	无	马	摩羯座	祭祀、出行、结婚姻、宴会、嫁娶、修造、上官、冠带、进人口、竖柱上梁、经络、安碓硙、牧养、安葬、诉讼、搬移、祈福、缮城郭、裁制、修宫室、求嗣、庆赐、施恩、临政、纳畜、举正直、赴任、酝酿、纳采	修置产室
1906-12-27	一九零六 丙午[马]年	冬月小	十二	周四	丙午 庚子 乙巳 辛巳	无	小寒 (1, 6)	无	无	无	马	摩羯座	祭祀、捕捉、覃恩、恤孤茕、雪冤	出行、剃头、冠带、修置产室、开渠、穿井、安碓硙、破屋坏垣、畋猎、破土、启攒、补垣、取鱼、整容、布政事、修饰垣墙、塞穴、鼓铸、整手足甲、筑堤防
1906-12-28	一九零六 丙午[马]年	冬月小	十三	周五	丙午 庚子 丙午 癸巳	无	小寒 (1, 6)	无	无	无	马	摩羯座	祭祀、沐浴	出行、结婚姻、宴会、嫁娶、安床、剃头、修造、求医疗病、上表章、上官、冠带、进人口、竖柱上梁、经络、开市、纳财、修置产室、开渠、穿井、安碓硙、破屋坏垣、伐木、栽种、牧养、破土、安葬、启攒、搬移、祈福、缮城郭、裁制、上册、修宫室、开仓、颁诏、求嗣、庆赐、补垣、取鱼、针刺、招贤、整容、布政事、宣政事、安抚边境、入宅、施恩、立券交易、修饰垣墙、临政、纳畜、举正直、解除、塞穴、乘船渡水、修仓库、酝酿、选将、鼓铸、营建、纳采、整手足甲、出师、筑堤防、苫盖
1906-12-29	一九零六 丙午[马]年	冬月小	十四	周六	丙午 庚子 丁未 乙巳	无	小寒 (1, 6)	无	无	无	马	摩羯座	祭祀、伐木、覃恩、恤孤茕、雪冤	剃头、冠带、修置产室、开渠、穿井、安碓硙、破屋坏垣、畋猎、启攒、开仓、修宫室、补垣、取鱼、整容、布政事、修饰垣墙、塞穴、乘船渡水、鼓铸、整手足甲、筑堤防
1906-12-30	一九零六 丙午[马]年	冬月小	十五	周日	丙午 庚子 戊申 丁巳	无	小寒 (1, 6)	无	无	无	马	摩羯座	出行、沐浴、上官、入学、竖柱上梁、经络、扫舍宇、牧养、裁制、施恩、临政、举正直、解除、酝酿	安床、修置产室、开渠、穿井、平治道涂、破屋坏垣、开仓、补垣、取鱼、修饰垣墙、塞穴、乘船渡水、选将、鼓铸、营建、出师
1906-12-31	一九零六 丙午[马]年	冬月小	十六	周一	丙午 庚子 己酉 己巳	无	小寒 (1, 6)	无	无	无	马	摩羯座	沐浴、剃头、扫舍宇、捕捉、畋猎、覃恩、恤孤茕、雪冤、整容、整手足甲	祭祀、出行、结婚姻、宴会、嫁娶、安床、修造、求医疗病、上表章、上官、冠带、进人口、竖柱上梁、经络、开市、纳财、修置产室、开渠、穿井、栽种、牧养、破土、安葬、启攒、搬移、祈福、缮城郭、裁制、上册、开仓、修宫室、颁诏、求嗣、庆赐、取鱼、招贤、布政事、宣政事、安抚边境、施恩、立券交易、临政、纳畜、举正直、解除、乘船渡水、修仓库、酝酿、选将、鼓铸、营建、纳采、出师、筑堤防
