1908-11-01	1908-10-8	30	开	日	戊申 壬戌 庚申	无	立冬 (11, 8)	万圣节	无	无	交易 入宅 出火 出行 嫁娶 开光 开市 挂匾 栽种 求嗣 破土 祈福 祭祀 移徙 立券 纳财 解除 谢土 进人口	安床 安葬
1908-11-02	1908-10-9	30	闭	一	戊申 壬戌 辛酉	无	立冬 (11, 8)	无	无	无	作灶 入殓 动土 启钻 嫁娶 安床 安葬 成服 扫舍 整手足甲 求嗣 破土 祈福 祭祀 移柩 补垣 除服	开光 栽种
1908-11-03	1908-10-10	30	建	二	戊申 壬戌 壬戌	无	立冬 (11, 8)	无	无	无	上梁 入宅 出行 安床 安门 开光 求嗣 祈福 祭祀 移徙 纳畜 纳财 解除 造畜稠	伐木 嫁娶 安葬 开渠 破土 行丧
1908-11-04	1908-10-11	30	除	三	戊申 壬戌 癸亥	无	立冬 (11, 8)	无	无	无	上梁 伐木 出火 出行 合脊 安床 开光 拆卸 理发 祭祀 解除 造畜稠	作灶 动土 嫁娶 安葬 破土 行丧 词讼 造桥
1908-11-05	1908-10-12	30	满	四	戊申 壬戌 甲子	无	立冬 (11, 8)	无	无	无	会亲友 冠笄 启钻 安床 安葬 开生坟 成服 沐浴 理发 移柩 纳采 裁衣 订盟 除服	上梁 修坟 入宅 出行 动土 嫁娶 安门 开市 祈福 谢土
1908-11-06	1908-10-13	30	平	五	戊申 壬戌 乙丑	无	立冬 (11, 8)	无	无	无	修饰垣墙 平治道涂 祭祀 解除 造畜稠 馀事勿取	交易 入学 入宅 嫁娶 安葬 开市
1908-11-07	1908-10-14	30	定	六	戊申 壬戌 丙寅	无	立冬 (11, 8)	无	无	无	入殓 启钻 安葬 成服 破土 除服 馀事勿取	入宅 塞穴 开市 祭祀 置产 补垣
1908-11-08	1908-10-15	30	定	日	戊申 癸亥 丁卯	立冬	小雪 (11, 23)	无	无	无	会亲友 修造 入宅 入殓 动土 安床 安葬 安香 拆卸 祈福 祭祀 移徙 移柩 纳采 裁衣 订盟 谢土 赴任 起基 进人口	作灶 治病
1908-11-09	1908-10-16	30	执	一	戊申 癸亥 戊辰	无	小雪 (11, 23)	无	无	无	入殓 启钻 塑绘 嫁娶 安床 安葬 开光 成服 祭祀 移柩 立碑 纳采 订盟 进人口 除服	交易 作灶 开市 破土
1908-11-10	1908-10-17	30	破	二	戊申 癸亥 己巳	无	小雪 (11, 23)	无	无	无	坏垣 破屋 祭祀 解除 馀事勿取	诸事不宜
1908-11-11	1908-10-18	30	危	三	戊申 癸亥 庚午	无	小雪 (11, 23)	无	无	无	上梁 伐木 修造 入殓 冠笄 出行 动土 启钻 塑绘 安床 安葬 开光 成服 拆卸 斋醮 栽种 破土 祈福 祭祀 移徙 移柩 竖柱 纳畜 纳采 裁衣 解除 订盟 赴任 除服	治病 盖屋
1908-11-12	1908-10-19	30	成	四	戊申 癸亥 辛未	无	小雪 (11, 23)	无	无	无	上梁 交易 会亲友 入殓 冠笄 合帐 启钻 安床 安机械 安葬 开市 成服 祈福 祭祀 移柩 立券 竖柱 筑堤 纳畜 纳财 纳采 经络 裁衣 订盟 谢土 造畜稠 除服	入宅 嫁娶 治病 赴任
1908-11-13	1908-10-20	30	收	五	戊申 癸亥 壬申	无	小雪 (11, 23)	无	无	无	扫舍 沐浴 馀事勿取	诸事不宜
1908-11-14	1908-10-21	30	开	六	戊申 癸亥 癸酉	无	小雪 (11, 23)	无	无	无	诸事不宜	无
1908-11-15	1908-10-22	30	闭	日	戊申 癸亥 甲戌	无	小雪 (11, 23)	无	无	无	入殓 出行 安葬 斋醮 破土 祈福 移柩 立碑 纳采 结网 订盟	作灶 入宅
1908-11-16	1908-10-23	30	建	一	戊申 癸亥 乙亥	无	小雪 (11, 23)	无	无	无	冠笄 出行 沐浴 祭祀 进人口 馀事勿取	作灶 动土 嫁娶 安葬
1908-11-17	1908-10-24	30	除	二	戊申 癸亥 丙子	无	小雪 (11, 23)	无	无	无	作梁 修坟 入学 入宅 入殓 冠笄 启钻 塑绘 嫁娶 安葬 安香 开光 拆卸 整手足甲 斋醮 沐浴 治病 理发 破土 祈福 祭祀 移徙 移柩 纳采 裁衣 订盟 谢土 赴任	开市
1908-11-18	1908-10-25	30	满	三	戊申 癸亥 丁丑	无	小雪 (11, 23)	无	无	无	诸事不宜	无
1908-11-19	1908-10-26	30	平	四	戊申 癸亥 戊寅	无	小雪 (11, 23)	无	无	无	交易 入宅 入殓 出行 安床 安葬 开光 开市 挂匾 移徙 移柩 立券 纳畜 纳财	作灶 动土 嫁娶 栽种 破土 祈福 祭祀 置产
1908-11-20	1908-10-27	30	定	五	戊申 癸亥 己卯	无	小雪 (11, 23)	无	无	无	修造 入宅 入殓 出火 出行 动土 嫁娶 安床 安葬 开光 成服 拆卸 栽种 求嗣 祈福 祭祀 移徙 立碑 纳畜 解除 进人口 除服	无
1908-11-21	1908-10-28	30	执	六	戊申 癸亥 庚辰	无	小雪 (11, 23)	无	无	无	修造 入殓 动土 启钻 安床 安葬 开光 拆卸 纳畜 解除	作灶 入宅 出火 分居 嫁娶 安香 开市 掘井 栽种 破土 移徙
1908-11-22	1908-10-29	30	破	日	戊申 癸亥 辛巳	无	小雪 (11, 23)	无	无	无	坏垣 破屋 馀事勿取	诸事不宜
1908-11-23	1908-10-30	30	危	一	戊申 癸亥 壬午	小雪	大雪 (12, 7)	无	无	无	交易 修造 入宅 出火 出行 动土 嫁娶 安床 开光 开市 拆卸 挂匾 栽种 祭祀 移徙 立券 纳畜 纳财 解除	安葬 探病
1908-11-24	1908-11-1	29	成	二	戊申 癸亥 癸未	无	大雪 (12, 7)	无	无	无	会亲友 修坟 启钻 安葬 开光 栽种 求嗣 牧养 理发 祈福 祭祀 立碑 纳畜 解除	作灶 入宅 出行 移徙 词讼 赴任
1908-11-25	1908-11-2	29	收	三	戊申 癸亥 甲申	无	大雪 (12, 7)	无	无	无	入殓 成服 沐浴 祭祀 移柩 结网 除服	交易 作灶 修坟 出货财 嫁娶 安床 安葬 开市
1908-11-26	1908-11-3	29	开	四	戊申 癸亥 乙酉	无	大雪 (12, 7)	感恩节	无	无	解除 馀事勿取	无
1908-11-27	1908-11-4	29	闭	五	戊申 癸亥 丙戌	无	大雪 (12, 7)	无	无	无	入殓 启钻 安床 开池 破土 祭祀 移柩 补垣	作灶 入宅 出火 嫁娶 开光 开市 掘井 移徙 进人口
1908-11-28	1908-11-5	29	建	六	戊申 癸亥 丁亥	无	大雪 (12, 7)	无	无	无	沐浴 祭祀 馀事勿取	无
1908-11-29	1908-11-6	29	除	日	戊申 癸亥 戊子	无	大雪 (12, 7)	无	无	无	修造 入宅 出火 出行 动土 嫁娶 安葬 开光 成服 拆卸 掘井 栽种 移徙 纳畜 解除 进人口 除服	安床 置产
1908-11-30	1908-11-7	29	满	一	戊申 癸亥 己丑	无	大雪 (12, 7)	无	无	无	会亲友 安床 安门 开光 理发 结网 裁衣	上梁 伐木 入宅 冠笄 出火 出行 动土 嫁娶 安葬 栽种 祈福 移徙
