1913-09-01	一九一三 癸丑[牛]年 八月小初一	周一	无	许真君诞	无	癸丑 庚申 乙酉 辛巳	无	白露 (9, 8)	牛	处女座	出行、嫁娶、沐浴、剃头、求医疗病、上官、扫舍宇、安葬、整手足甲、临政、恤孤茕、解除、整容、安抚边境、选将、雪冤、出师	结婚姻、宴会、安床、修造、上表章、冠带、进人口、竖柱上梁、开市、纳财、修置产室、捕捉、畋猎、栽种、牧养、纳畜、纳采、鼓铸、修仓库、求嗣、上册、颁诏、乘船渡水、开仓、庆赐、筑堤防、补垣、营建、宣政事、修宫室、搬移、塞穴、招贤、祈福、缮城郭、立券交易、取鱼
1913-09-02	一九一三 癸丑[牛]年 八月小初二	周二	无	无	无	癸丑 庚申 丙戌 癸巳	无	白露 (9, 8)	牛	处女座	宴会、上表章、进人口、竖柱上梁、经络、开市、纳财、栽种、牧养、安葬、纳畜、修仓库、上册、裁制、开仓、庆赐、补垣、修宫室、塞穴、缮城郭、立券交易	祭祀、结婚姻、嫁娶、上官、纳采、举正直、取鱼、施恩、乘船渡水、招贤
1913-09-03	一九一三 癸丑[牛]年 八月小初三	周三	无	司命灶君诞	无	癸丑 庚申 丁亥 乙巳	无	白露 (9, 8)	牛	处女座	祭祀、出行、结婚姻、宴会、沐浴、修造、求医疗病、上表章、上官、竖柱上梁、平治道涂、栽种、牧养、安葬、纳畜、纳采、举正直、临政、恤孤茕、修仓库、求嗣、解除、上册、颁诏、裁制、庆赐、覃恩、安抚边境、营建、宣政事、选将、施恩、雪冤、修饰垣墙、搬移、招贤、祈福、缮城郭、出师	嫁娶、剃头、冠带、修置产室、开渠、穿井、畋猎、破土、启攒、鼓铸、取鱼、修宫室、开仓、布政事、筑堤防、整容
1913-09-04	一九一三 癸丑[牛]年 八月小初四	周四	无	无	无	癸丑 庚申 戊子 丁巳	无	白露 (9, 8)	牛	处女座	祭祀、出行、结婚姻、宴会、嫁娶、沐浴、修造、上官、冠带、进人口、竖柱上梁、经络、安碓硙、牧养、安葬、纳畜、纳采、举正直、临政、恤孤茕、求嗣、酝酿、颁诏、裁制、庆赐、入宅、覃恩、营建、宣政事、施恩、修宫室、雪冤、搬移、招贤、祈福、缮城郭	修置产室、畋猎、取鱼
1913-09-05	一九一三 癸丑[牛]年 八月小初五	周五	无	雷声大帝诞	无	癸丑 庚申 己丑 己巳	无	白露 (9, 8)	牛	处女座	纳财、捕捉、栽种、牧养、纳畜	出行、冠带、畋猎、安抚边境、远回、选将、出师、搬移、乘船渡水
1913-09-06	一九一三 癸丑[牛]年 八月小初六	周六	无	无	无	癸丑 庚申 庚寅 辛巳	无	白露 (9, 8)	牛	处女座	诸事不宜	诸事不宜
1913-09-07	一九一三 癸丑[牛]年 八月小初七	周日	无	无	无	癸丑 庚申 辛卯 癸巳	无	白露 (9, 8)	牛	处女座	祭祀、宴会	出行、结婚姻、嫁娶、安床、修造、求医疗病、上表章、上官、冠带、进人口、竖柱上梁、开市、纳财、修置产室、开渠、穿井、安碓硙、平治道涂、破屋坏垣、栽种、牧养、破土、纳畜、纳采、举正直、临政、修仓库、求嗣、解除、上册、酝酿、开仓、筑堤防、安抚边境、营建、补垣、选将、施恩、修宫室、搬移、修饰垣墙、招贤、祈福、缮城郭、立券交易、出师
1913-09-08	一九一三 癸丑[牛]年 八月小初八	周一	无	无	无	癸丑 辛酉 壬辰 乙巳	白露	秋分 (9, 24)	牛	处女座	祭祀	上表章、开渠、穿井、布政事、上册、颁诏、筑堤防、营建、补垣、宣政事、塞穴、招贤、出师
1913-09-09	一九一三 癸丑[牛]年 八月小初九	周二	无	无	无	癸丑 辛酉 癸巳 丁巳	无	秋分 (9, 24)	牛	处女座	祭祀、结婚姻、宴会、修造、求医疗病、上表章、上官、入学、进人口、竖柱上梁、经络、开市、纳财、安碓硙、栽种、牧养、纳畜、纳采、举正直、临政、修仓库、求嗣、解除、赴任、上册、酝酿、裁制、庆赐、开仓、入宅、筑堤防、安抚边境、选将、修宫室、施恩、搬移、祈福、缮城郭、立券交易	出行、破土、安葬、启攒
1913-09-10	一九一三 癸丑[牛]年 八月小初十	周三	无	北斗大帝诞	无	癸丑 辛酉 甲午 己巳	无	秋分 (9, 24)	牛	处女座	祭祀、捕捉	出行、结婚姻、宴会、嫁娶、安床、修造、求医疗病、上表章、上官、冠带、进人口、竖柱上梁、经络、开市、纳财、修置产室、开渠、穿井、栽种、牧养、破土、安葬、启攒、纳畜、纳采、鼓铸、举正直、临政、布政事、修仓库、求嗣、解除、上册、酝酿、颁诏、乘船渡水、裁制、庆赐、开仓、筑堤防、安抚边境、营建、补垣、宣政事、选将、施恩、修宫室、搬移、塞穴、招贤、祈福、缮城郭、苫盖、立券交易、出师、取鱼
1913-09-11	一九一三 癸丑[牛]年 八月小十一	周四	无	无	无	癸丑 辛酉 乙未 辛巳	无	秋分 (9, 24)	牛	处女座	结婚姻、宴会、上表章、上官、入学、进人口、竖柱上梁、开市、纳财、牧养、纳畜、纳采、举正直、临政、恤孤茕、求嗣、解除、上册、颁诏、裁制、庆赐、覃恩、安抚边境、宣政事、选将、施恩、雪冤、招贤、祈福	平治道涂、破屋坏垣、伐木、畋猎、补垣、取鱼、修饰垣墙、开仓、筑堤防
1913-09-12	一九一三 癸丑[牛]年 八月小十二	周五	无	西方五道诞	无	癸丑 辛酉 丙申 癸巳	无	秋分 (9, 24)	牛	处女座	祭祀、沐浴、经络、纳财、扫舍宇、栽种、牧养、整手足甲、恤孤茕、酝酿、裁制、筑堤防、覃恩、补垣、安抚边境、选将、雪冤、塞穴	出行、结婚姻、宴会、嫁娶、安床、剃头、修造、求医疗病、上表章、上官、进人口、竖柱上梁、开市、修置产室、开渠、穿井、安葬、纳畜、纳采、针刺、举正直、临政、布政事、求嗣、解除、上册、颁诏、庆赐、开仓、整容、营建、宣政事、施恩、修宫室、搬移、招贤、祈福、立券交易、出师、疗目
1913-09-13	一九一三 癸丑[牛]年 八月小十三	周六	无	无	无	癸丑 辛酉 丁酉 乙巳	无	秋分 (9, 24)	牛	处女座	祭祀、沐浴、扫舍宇	出行、结婚姻、宴会、嫁娶、安床、剃头、修造、求医疗病、上表章、上官、冠带、进人口、竖柱上梁、经络、开市、纳财、修置产室、开渠、穿井、安碓硙、平治道涂、破屋坏垣、伐木、栽种、牧养、破土、安葬、启攒、纳畜、纳采、鼓铸、举正直、整手足甲、临政、布政事、修仓库、求嗣、解除、上册、酝酿、颁诏、乘船渡水、裁制、开仓、庆赐、整容、筑堤防、营建、安抚边境、补垣、宣政事、选将、修宫室、施恩、搬移、修饰垣墙、塞穴、招贤、祈福、缮城郭、苫盖、立券交易、出师、取鱼
1913-09-14	一九一三 癸丑[牛]年 八月小十四	周日	无	无	无	癸丑 辛酉 戊戌 丁巳	无	秋分 (9, 24)	牛	处女座	祭祀、出行、嫁娶、沐浴、剃头、修造、求医疗病、上官、纳财、扫舍宇、栽种、牧养、安葬、纳畜、纳采、举正直、整手足甲、临政、求嗣、解除、赴任、入宅、整容、安抚边境、选将、施恩、搬移、祈福、诉讼、出师	宴会、上表章、进人口、经络、开市、修置产室、破土、启攒、针刺、修仓库、上册、酝酿、乘船渡水、庆赐、开仓、立券交易
1913-09-15	一九一三 癸丑[牛]年 八月小十五	周一	中秋节	无	无	癸丑 辛酉 己亥 己巳	无	秋分 (9, 24)	牛	处女座	出行、宴会、沐浴、上表章、进人口、竖柱上梁、经络、开市、纳财、上册、裁制、庆赐、补垣、修宫室、塞穴、缮城郭、立券交易	祭祀、结婚姻、嫁娶、剃头、修造、破土、启攒、纳畜、纳采、安抚边境、举正直、选将、整手足甲、施恩、出师、招贤、整容
1913-09-16	一九一三 癸丑[牛]年 八月小十六	周二	无	天曹掠刷真君降	无	癸丑 辛酉 庚子 辛巳	无	秋分 (9, 24)	牛	处女座	祭祀、沐浴、平治道涂、恤孤茕、覃恩、雪冤、修饰垣墙	冠带、修置产室、开渠、穿井、捕捉、畋猎、安葬、鼓铸、取鱼、布政事、筑堤防
1913-09-17	一九一三 癸丑[牛]年 八月小十七	周三	无	无	无	癸丑 辛酉 辛丑 癸巳	无	秋分 (9, 24)	牛	处女座	宴会、经络、安碓硙、裁制、庆赐	出行、安床、求医疗病、上表章、上官、开市、修置产室、破土、安葬、启攒、临政、解除、上册、开仓、筑堤防、安抚边境、营建、选将、搬移、出师
1913-09-18	一九一三 癸丑[牛]年 八月小十八	周四	无	天人兴福之辰	无	癸丑 辛酉 壬寅 乙巳	无	秋分 (9, 24)	牛	处女座	沐浴、捕捉、恤孤茕、覃恩、雪冤	祭祀、冠带、修置产室、开渠、穿井、安碓硙、破屋坏垣、畋猎、启攒、补垣、鼓铸、远回、取鱼、修饰垣墙、塞穴、布政事、筑堤防
1913-09-19	一九一三 癸丑[牛]年 八月小十九	周五	无	无	无	癸丑 辛酉 癸卯 丁巳	无	秋分 (9, 24)	牛	处女座	诸事不宜	诸事不宜
1913-09-20	一九一三 癸丑[牛]年 八月小二十	周六	无	无	无	癸丑 辛酉 甲辰 己巳	无	秋分 (9, 24)	牛	处女座	诸事不宜	出行、剃头、修造、求医疗病、上官、竖柱上梁、修置产室、开渠、穿井、安碓硙、破屋坏垣、纳采、鼓铸、举正直、整手足甲、临政、布政事、修仓库、求嗣、解除、上册、颁诏、裁制、开仓、庆赐、整容、筑堤防、营建、补垣、宣政事、施恩、修宫室、修饰垣墙、塞穴、招贤、祈福、缮城郭、出师
1913-09-21	一九一三 癸丑[牛]年 八月小廿一	周日	无	无	无	癸丑 辛酉 乙巳 辛巳	无	秋分 (9, 24)	牛	处女座	祭祀、结婚姻、宴会、求医疗病、上表章、上官、入学、进人口、竖柱上梁、经络、开市、纳财、安碓硙、牧养、纳畜、纳采、举正直、临政、恤孤茕、求嗣、解除、上册、酝酿、颁诏、裁制、庆赐、筑堤防、覃恩、安抚边境、营建、宣政事、选将、施恩、修宫室、雪冤、搬移、招贤、祈福、缮城郭、立券交易	出行、畋猎、破土、启攒、取鱼、整手足甲
1913-09-22	一九一三 癸丑[牛]年 八月小廿二	周一	无	无	无	癸丑 辛酉 丙午 癸巳	无	秋分 (9, 24)	牛	处女座	祭祀、捕捉	出行、结婚姻、宴会、嫁娶、安床、修造、求医疗病、上表章、上官、冠带、进人口、竖柱上梁、经络、开市、纳财、修置产室、开渠、穿井、栽种、牧养、破土、安葬、启攒、纳畜、纳采、鼓铸、举正直、临政、布政事、修仓库、求嗣、解除、上册、酝酿、颁诏、乘船渡水、裁制、庆赐、开仓、筑堤防、安抚边境、营建、补垣、宣政事、选将、施恩、修宫室、搬移、塞穴、招贤、祈福、缮城郭、苫盖、立券交易、出师、取鱼
1913-09-23	一九一三 癸丑[牛]年 八月小廿三	周二	无	汉恒候张显王诞	无	癸丑 辛酉 丁未 乙巳	无	秋分 (9, 24)	牛	天秤座	宴会、上表章、上官、入学、进人口、开市、纳财、牧养、纳畜、举正直、临政、恤孤茕、求嗣、解除、上册、颁诏、裁制、庆赐、覃恩、宣政事、施恩、雪冤、招贤、祈福	结婚姻、嫁娶、剃头、平治道涂、破屋坏垣、伐木、畋猎、纳采、营建、补垣、整手足甲、取鱼、修饰垣墙、乘船渡水、开仓、整容、筑堤防
1913-09-24	一九一三 癸丑[牛]年 八月小廿四	周三	无	灶君夫人诞	无	癸丑 辛酉 戊申 丁巳	秋分	寒露 (10, 9)	牛	天秤座	祭祀、沐浴、剃头、经络、纳财、扫舍宇、栽种、牧养、破土、整手足甲、恤孤茕、修仓库、酝酿、裁制、入宅、整容、筑堤防、覃恩、补垣、安抚边境、选将、雪冤、塞穴、缮城郭	修置产室、开渠、穿井、畋猎、针刺、疗目、取鱼、修宫室、布政事
1913-09-25	一九一三 癸丑[牛]年 八月小廿五	周四	无	无	无	癸丑 辛酉 己酉 己巳	无	寒露 (10, 9)	牛	天秤座	祭祀、沐浴、扫舍宇、恤孤茕、覃恩、雪冤	出行、结婚姻、宴会、嫁娶、安床、剃头、修造、求医疗病、上表章、上官、冠带、进人口、竖柱上梁、经络、开市、纳财、修置产室、开渠、穿井、安碓硙、平治道涂、破屋坏垣、伐木、栽种、牧养、破土、安葬、启攒、纳畜、纳采、鼓铸、举正直、整手足甲、临政、布政事、修仓库、求嗣、解除、上册、酝酿、颁诏、乘船渡水、裁制、开仓、庆赐、整容、筑堤防、营建、安抚边境、补垣、宣政事、选将、修宫室、施恩、搬移、修饰垣墙、塞穴、招贤、祈福、缮城郭、苫盖、立券交易、出师、取鱼
1913-09-26	一九一三 癸丑[牛]年 八月小廿六	周五	无	无	无	癸丑 辛酉 庚戌 辛巳	无	寒露 (10, 9)	牛	天秤座	祭祀、出行、结婚姻、宴会、嫁娶、沐浴、剃头、修造、求医疗病、上表章、上官、竖柱上梁、纳财、扫舍宇、栽种、牧养、安葬、纳畜、纳采、举正直、整手足甲、临政、恤孤茕、修仓库、求嗣、解除、赴任、上册、颁诏、裁制、庆赐、整容、覃恩、安抚边境、营建、宣政事、选将、施恩、雪冤、搬移、招贤、祈福、缮城郭、出师、诉讼	进人口、经络、开市、修置产室、畋猎、破土、启攒、针刺、酝酿、开仓、立券交易、取鱼
1913-09-27	一九一三 癸丑[牛]年 八月小廿七	周六	无	无	无	癸丑 辛酉 辛亥 癸巳	无	寒露 (10, 9)	牛	天秤座	出行、宴会、沐浴、上表章、竖柱上梁、经络、恤孤茕、布政事、上册、裁制、庆赐、覃恩、补垣、修宫室、雪冤、塞穴、缮城郭	祭祀、结婚姻、嫁娶、修造、立券、破土、安葬、启攒、纳畜、纳采、安抚边境、举正直、选将、开张、酝酿、施恩、出师、招贤
1913-09-28	一九一三 癸丑[牛]年 八月小廿八	周日	无	无	无	癸丑 辛酉 壬子 乙巳	无	寒露 (10, 9)	牛	天秤座	祭祀、沐浴、平治道涂、恤孤茕、覃恩、修饰垣墙、雪冤	出行、结婚姻、宴会、嫁娶、安床、修造、求医疗病、上表章、上官、冠带、进人口、竖柱上梁、经络、开市、纳财、修置产室、开渠、穿井、捕捉、畋猎、栽种、牧养、破土、安葬、启攒、纳畜、纳采、鼓铸、举正直、临政、布政事、修仓库、求嗣、解除、上册、酝酿、颁诏、裁制、庆赐、开仓、筑堤防、安抚边境、营建、宣政事、选将、施恩、修宫室、搬移、招贤、祈福、缮城郭、立券交易、出师、取鱼
1913-09-29	一九一三 癸丑[牛]年 八月小廿九	周一	无	至圣先师孔子诞	无	癸丑 辛酉 癸丑 丁巳	无	寒露 (10, 9)	牛	天秤座	祭祀、出行、宴会、修造、上官、进人口、竖柱上梁、经络、安碓硙、牧养、纳畜、举正直、临政、恤孤茕、布政事、求嗣、赴任、酝酿、裁制、庆赐、入宅、覃恩、修宫室、施恩、搬移、雪冤、祈福、缮城郭	上表章、修置产室、安抚边境、上册、选将、出师
1913-09-30	一九一三 癸丑[牛]年 九月小初一	周二	无	北斗九星降世	无	癸丑 辛酉 甲寅 己巳	无	寒露 (10, 9)	牛	天秤座	沐浴、捕捉、恤孤茕、覃恩、雪冤	祭祀、安床、冠带、进人口、经络、开市、纳财、修置产室、开渠、穿井、安碓硙、破屋坏垣、畋猎、鼓铸、布政事、酝酿、开仓、筑堤防、补垣、修宫室、修饰垣墙、塞穴、远回、取鱼
