1916-08-01	1916-7-3	30	闭	二	丙辰 乙未 庚午	无	立秋 (8, 8)	建军节	无	无	入殓 启钻 塞穴 安葬 成服 移柩 结网 补垣 除服 馀事勿取	诸事不宜
1916-08-02	1916-7-4	30	建	三	丙辰 乙未 辛未	无	立秋 (8, 8)	无	无	无	入宅 出行 嫁娶 祈福 祭祀 移徙 纳采 解除	动土 安葬
1916-08-03	1916-7-5	30	除	四	丙辰 乙未 壬申	无	立秋 (8, 8)	无	无	无	嫁娶 安葬 斋醮 治病 破土 祈福 祭祀	入宅 开市
1916-08-04	1916-7-6	30	满	五	丙辰 乙未 癸酉	无	立秋 (8, 8)	无	无	无	入殓 出行 启钻 嫁娶 安床 安葬 开市	动土 破土 祈福
1916-08-05	1916-7-7	30	平	六	丙辰 乙未 甲戌	无	立秋 (8, 8)	无	无	无	冠笄 嫁娶 沐浴 祭祀 结网 裁衣	出货财 动土 安葬 开仓 掘井 栽种 破土 置产
1916-08-06	1916-7-8	30	定	日	丙辰 乙未 乙亥	无	立秋 (8, 8)	无	无	无	交易 修造 入宅 出火 动土 安床 开光 开市 拆卸 求嗣 祈福 移徙 立券 进人口	修坟 嫁娶 安葬 栽种 破土 置产 行丧
1916-08-07	1916-7-9	30	执	一	丙辰 乙未 丙子	无	立秋 (8, 8)	无	无	无	入殓 启钻 安葬 整手足甲 沐浴 破土 祭祀 移柩 解除	交易 作灶 入宅 嫁娶 安门 开市 栽种 移徙
1916-08-08	1916-7-10	30	执	二	丙辰 丙申 丁丑	立秋	处暑 (8, 23)	无	无	无	入殓 安葬 捕捉 普渡 畋猎 破土 祭祀 结网 解除	交易 入宅 嫁娶 开市
1916-08-09	1916-7-11	30	破	三	丙辰 丙申 戊寅	无	处暑 (8, 23)	无	无	无	坏垣 沐浴 破屋 馀事勿取	开市 斋醮
1916-08-10	1916-7-12	30	危	四	丙辰 丙申 己卯	无	处暑 (8, 23)	无	无	无	入宅 出火 启钻 安葬 安香 开市 挂匾 祈福 祭祀 立券 纳采 订盟 造桥	动土 嫁娶 安床 掘井 破土
1916-08-11	1916-7-13	30	成	五	丙辰 丙申 庚辰	无	处暑 (8, 23)	无	无	无	交易 修造 入宅 动土 嫁娶 安床 安香 开光 开市 捕捉 斋醮 普渡 治病 畋猎 祈福 祭祀 移徙 立券 结网 造车器	安葬 探病 纳采 经络 行丧 订盟
1916-08-12	1916-7-14	30	收	六	丙辰 丙申 辛巳	无	处暑 (8, 23)	无	无	无	会亲友 作灶 冠笄 嫁娶 安床 安机械 开市 牧养 立券 纳畜 纳财 纳采 裁衣 订盟	出行 安葬 掘井 破土 行丧
1916-08-13	1916-7-15	30	开	日	丙辰 丙申 壬午	无	处暑 (8, 23)	无	无	无	上梁 会亲友 修造 出行 出货财 动土 启钻 嫁娶 开仓 开光 开市 开池 斋醮 普渡 牧养 破土 祭祀 竖柱 纳畜 纳财 纳采 解除 订盟	入宅 出火 安葬 安门 盖屋
1916-08-14	1916-7-16	30	闭	一	丙辰 丙申 癸未	无	处暑 (8, 23)	无	无	无	入殓 塞穴 嫁娶 安葬 成服 断蚁 普渡 祈福 祭祀 筑堤 补垣 除服	上梁 动土 开光 掘井 破土 词讼
1916-08-15	1916-7-17	30	建	二	丙辰 丙申 甲申	无	处暑 (8, 23)	无	无	无	冠笄 出行 嫁娶 扫舍 普渡 沐浴 祭祀 纳畜 纳财 赴任	上梁 动土 安床 开仓 开市 破土
1916-08-16	1916-7-18	30	除	三	丙辰 丙申 乙酉	无	处暑 (8, 23)	无	无	无	入殓 冠笄 启钻 安葬 整手足甲 沐浴 理发 破土 祭祀 移柩 解除	入宅 出行 嫁娶 安门 开市
1916-08-17	1916-7-19	30	满	四	丙辰 丙申 丙戌	无	处暑 (8, 23)	无	无	无	会亲友 冠笄 塑绘 塞穴 嫁娶 捕捉 栽种 牧养 纳畜 经络 补垣 裁衣 进人口	动土 安葬 开市 祈福 行丧
1916-08-18	1916-7-20	30	平	五	丙辰 丙申 丁亥	无	处暑 (8, 23)	无	无	无	上梁 出行 沐浴 牧养 移徙 竖柱 纳畜 纳采 裁衣 订盟	动土 嫁娶 安葬 安门
1916-08-19	1916-7-21	30	定	六	丙辰 丙申 戊子	无	处暑 (8, 23)	无	无	无	上梁 修造 入宅 出火 动土 启钻 嫁娶 安葬 安门 安香 开光 普渡 盖屋 破土 祈福 祭祀 移徙 竖柱 纳采 订盟 起基 造庙 造桥	作灶 开市 立券 纳财
1916-08-20	1916-7-22	30	执	日	丙辰 丙申 己丑	无	处暑 (8, 23)	无	无	无	入殓 启钻 安葬 成服 捕捉 牧养 畋猎 破土 祭祀 移柩 纳畜 除服	入宅 嫁娶 开市 纳采 订盟
1916-08-21	1916-7-23	30	破	一	丙辰 丙申 庚寅	无	处暑 (8, 23)	无	无	无	坏垣 治病 破屋 馀事勿取	安葬 行丧
1916-08-22	1916-7-24	30	危	二	丙辰 丙申 辛卯	无	处暑 (8, 23)	无	无	无	交易 入宅 入殓 冠笄 出行 启钻 嫁娶 安葬 开市 开柱眼 成服 斋醮 破土 祈福 移柩 立券 纳财 造桥 除服 雕刻	动土 安床 开池 订盟
1916-08-23	1916-7-25	30	成	三	丙辰 丙申 壬辰	处暑	白露 (9, 8)	无	无	无	入殓 动土 安葬 开市 开生坟 成服 放水 求嗣 牧养 破土 祈福 移柩 纳畜 纳采 解除 订盟 起基 造仓 除服	无
1916-08-24	1916-7-26	30	收	四	丙辰 丙申 癸巳	无	白露 (9, 8)	无	无	无	交易 修造 入宅 出火 分居 动土 塑绘 嫁娶 安门 开光 开市 拆卸 牧养 移徙 立券 纳畜 纳财 纳采 解除 订盟 起基	无
1916-08-25	1916-7-27	30	开	五	丙辰 丙申 甲午	无	白露 (9, 8)	无	无	无	交易 出行 动土 嫁娶 安床 开市 开渠 成服 掘井 放水 栽种 破土 祈福 移柩 立券 纳采 裁衣 订盟 除服	无
1916-08-26	1916-7-28	30	闭	六	丙辰 丙申 乙未	无	白露 (9, 8)	无	无	无	作灶 入宅 嫁娶 斋醮 祈福 祭祀 移徙	动土 破土
1916-08-27	1916-7-29	30	建	日	丙辰 丙申 丙申	无	白露 (9, 8)	无	无	无	入殓 出行 启钻 嫁娶 安葬 祭祀 纳畜	作灶 动土 破土
1916-08-28	1916-7-30	30	除	一	丙辰 丙申 丁酉	无	白露 (9, 8)	无	无	无	上梁 修造 动土 安葬 破土 祈福 祭祀 纳采 订盟	嫁娶 开市
1916-08-29	1916-8-1	29	满	二	丙辰 丙申 戊戌	无	白露 (9, 8)	无	无	无	上梁 会亲友 修造 入宅 出行 移徙 纳采 订盟	安葬 开市
1916-08-30	1916-8-2	29	平	三	丙辰 丙申 己亥	无	白露 (9, 8)	无	无	无	修饰垣墙 平治道涂 沐浴 馀事勿取	嫁娶 祈福
1916-08-31	1916-8-3	29	定	四	丙辰 丙申 庚子	无	白露 (9, 8)	无	无	无	入宅 动土 嫁娶 斋醮 祈福 祭祀 移徙	安葬 开市
