1919-07-01	1919-6-4	29	成	二	己未 庚午 甲寅	无	小暑 (7, 8)	建党节	无	无	开市 交易 立券 纳财 栽种 安床 拆卸 修造 动土 上梁 入殓 安葬 破土 除服 成服	嫁娶 出火 伐木 祭祀 入宅 移徙 纳畜 探病
1919-07-02	1919-6-5	29	收	三	己未 庚午 乙卯	无	小暑 (7, 8)	无	无	无	祭祀 作灶 馀事勿取	诸事不宜
1919-07-03	1919-6-6	29	开	四	己未 庚午 丙辰	无	小暑 (7, 8)	无	无	无	解除 坏垣 馀事勿取	诸事不宜
1919-07-04	1919-6-7	29	闭	五	己未 庚午 丁巳	无	小暑 (7, 8)	无	无	无	修造 动土 起基 安门 安床 栽种 筑堤 补垣 造畜稠	嫁娶 掘井 入宅 移徙 出火 出行 行丧 安葬 开光 理发 进人口
1919-07-05	1919-6-8	29	建	六	己未 庚午 戊午	无	小暑 (7, 8)	无	无	无	祭祀 教牛马 断蚁 馀事勿取	斋醮 移徙 入宅 动土
1919-07-06	1919-6-9	29	除	日	己未 庚午 己未	无	小暑 (7, 8)	无	无	无	纳采 订盟 嫁娶 祭祀 祈福 开市 纳财 立券 移徙 出行 修造 动土 起基 定磉 竖柱 拆卸 扫舍 放水 安香 安床 造船 开池 掘井 造畜稠 栽种	行丧 安葬 破土 作灶 伐木 斋醮
1919-07-07	1919-6-10	29	满	一	己未 庚午 庚申	无	小暑 (7, 8)	无	无	无	嫁娶 开光 祭祀 祈福 出行 解除 移徙 入宅 开市 纳财 起基 修造 竖柱 上梁 盖屋 作灶 出火 安香 补垣 塞穴 拆卸 放水 扫舍 造仓 造船 栽种 安葬	纳采 订盟 安床 谢土 破土 动土
1919-07-08	1919-6-11	29	满	二	己未 辛未 辛酉	小暑	大暑 (7, 24)	无	无	无	塑绘 出行 冠笄 嫁娶 进人口 裁衣 纳婿 造畜稠 交易 立券 牧养 开生坟 入殓 除服 成服 移柩 安葬 启钻	无
1919-07-09	1919-6-12	29	平	三	己未 辛未 壬戌	无	大暑 (7, 24)	无	无	无	祭祀 冠笄 嫁娶 捕捉 结网 畋猎 取渔 馀事勿取	无
1919-07-10	1919-6-13	29	定	四	己未 辛未 癸亥	无	大暑 (7, 24)	无	无	无	沐浴 扫舍 馀事勿取	诸事不宜
1919-07-11	1919-6-14	29	执	五	己未 辛未 甲子	无	大暑 (7, 24)	无	无	无	纳采 祭祀 祈福 解除 动土 破土 安葬	嫁娶 移徙 入宅
1919-07-12	1919-6-15	29	破	六	己未 辛未 乙丑	无	大暑 (7, 24)	无	无	无	祭祀 破屋 坏垣 馀事勿取	诸事不宜
1919-07-13	1919-6-16	29	危	日	己未 辛未 丙寅	无	大暑 (7, 24)	无	无	无	嫁娶 纳采 开市 出行 动土 上梁 移徙 入宅 破土 安葬	祭祀 祈福
1919-07-14	1919-6-17	29	成	一	己未 辛未 丁卯	无	大暑 (7, 24)	无	无	无	嫁娶 纳采 开市 出行 动土 上梁 移徙 入宅 破土 安葬	赴任
1919-07-15	1919-6-18	29	收	二	己未 辛未 戊辰	无	大暑 (7, 24)	无	无	无	祭祀 作灶 纳财 捕捉	开市 破土
1919-07-16	1919-6-19	29	开	三	己未 辛未 己巳	无	大暑 (7, 24)	无	无	无	嫁娶 开市 立券 祭祀 祈福 动土 移徙 入宅	造庙 安葬
1919-07-17	1919-6-20	29	闭	四	己未 辛未 庚午	无	大暑 (7, 24)	无	无	无	补垣 塞穴 结网 入殓 除服 成服 移柩 安葬 启钻 馀事勿取	诸事不宜
1919-07-18	1919-6-21	29	建	五	己未 辛未 辛未	无	大暑 (7, 24)	无	无	无	嫁娶 纳采 出行 祭祀 祈福 解除 移徙 入宅	动土 安葬
1919-07-19	1919-6-22	29	除	六	己未 辛未 壬申	无	大暑 (7, 24)	无	无	无	嫁娶 祭祀 祈福 斋醮 治病 破土 安葬	开市 入宅
1919-07-20	1919-6-23	29	满	日	己未 辛未 癸酉	无	大暑 (7, 24)	无	无	无	嫁娶 出行 开市 安床 入殓 启钻 安葬	祈福 动土 破土
1919-07-21	1919-6-24	29	平	一	己未 辛未 甲戌	无	大暑 (7, 24)	无	无	无	嫁娶 祭祀 裁衣 结网 冠笄 沐浴	开仓 出货财 置产 安葬 动土 破土 掘井 栽种
1919-07-22	1919-6-25	29	定	二	己未 辛未 乙亥	无	大暑 (7, 24)	无	无	无	入宅 移徙 安床 开光 祈福 求嗣 进人口 开市 交易 立券 出火 拆卸 修造 动土	嫁娶 破土 置产 栽种 安葬 修坟 行丧
1919-07-23	1919-6-26	29	执	三	己未 辛未 丙子	无	大暑 (7, 24)	无	无	无	祭祀 解除 沐浴 整手足甲 入殓 移柩 破土 启钻 安葬	嫁娶 入宅 移徙 作灶 开市 交易 安门 栽种
1919-07-24	1919-6-27	29	破	四	己未 辛未 丁丑	大暑	立秋 (8, 8)	无	无	无	破屋 坏垣 馀事勿取	诸事不宜
1919-07-25	1919-6-28	29	危	五	己未 辛未 戊寅	无	立秋 (8, 8)	无	无	无	嫁娶 开光 出行 理发 作梁 出火 拆卸 修造 开市 交易 立券 挂匾 动土 入宅 移徙 安床 栽种	伐木 祭祀 纳畜
1919-07-26	1919-6-29	29	成	六	己未 辛未 己卯	无	立秋 (8, 8)	无	无	无	嫁娶 开光 出行 祈福 求嗣 解除 拆卸 动土 修造 进人口 开市 交易 立券 挂匾 入宅 移徙 安床 栽种 纳畜 入殓 移柩 安葬	无
1919-07-27	1919-7-1	29	收	日	己未 辛未 庚辰	无	立秋 (8, 8)	无	无	无	祭祀 作灶 纳财 栽种 纳畜 进人口	安葬 经络 修坟 破土 开市 安床 启钻 立碑
1919-07-28	1919-7-2	29	开	一	己未 辛未 辛巳	无	立秋 (8, 8)	无	无	无	祭祀 祈福 求嗣 开光 开市 牧养 理发	嫁娶 出行 安葬 入殓 入宅 作灶 冠笄 上梁
1919-07-29	1919-7-3	29	闭	二	己未 辛未 壬午	无	立秋 (8, 8)	无	无	无	祭祀 入殓 破土 除服 成服 移柩 启钻 安葬 谢土 馀事勿取	无
1919-07-30	1919-7-4	29	建	三	己未 辛未 癸未	无	立秋 (8, 8)	无	无	无	祭祀 出行 交易 割蜜 造畜稠	嫁娶 作灶 安葬 动土 词讼 作梁 伐木 掘井 破土 移徙
1919-07-31	1919-7-5	29	除	四	己未 辛未 甲申	无	立秋 (8, 8)	无	无	无	嫁娶 祭祀 祈福 求嗣 开光 出火 拆卸 修造 动土 进人口 开市 交易 立券 挂匾 入宅 移徙 栽种 纳畜 入殓 启钻 除服 成服	无
