1921-10-01	一九二一 辛酉[鸡]年	九月大	初一	周六	无	北斗九星降世	无	辛酉 丁酉 丁酉 乙巳	无	寒露 (10, 9)	鸡	天秤座	祭祀、沐浴、扫舍宇	出行、结婚姻、宴会、嫁娶、安床、剃头、修造、求医疗病、上表章、上官、冠带、进人口、竖柱上梁、经络、开市、纳财、修置产室、开渠、穿井、安碓硙、平治道涂、破屋坏垣、伐木、栽种、牧养、破土、安葬、启攒、布政事、纳畜、取鱼、颁诏、纳采、补垣、举正直、安抚边境、修仓库、苫盖、整手足甲、缮城郭、鼓铸、裁制、宣政事、临政、乘船渡水、酝酿、立券交易、招贤、开仓、祈福、解除、施恩、求嗣、筑堤防、塞穴、修饰垣墙、上册、庆赐、整容、修宫室、选将、营建、出师、搬移
1921-10-02	一九二一 辛酉[鸡]年	九月大	初二	周日	无	无	无	辛酉 丁酉 戊戌 丁巳	无	寒露 (10, 9)	鸡	天秤座	祭祀、出行、沐浴、剃头、扫舍宇、栽种、赴任、举正直、整手足甲、临政、诉讼、解除、施恩、整容	宴会、嫁娶、修造、求医疗病、上表章、上官、进人口、经络、开市、纳财、修置产室、牧养、破土、安葬、启攒、出师、纳畜、纳采、安抚边境、修仓库、针刺、酝酿、立券交易、开仓、祈福、求嗣、上册、庆赐、选将
1921-10-03	一九二一 辛酉[鸡]年	九月大	初三	周一	无	五瘟神诞	无	辛酉 丁酉 己亥 己巳	无	寒露 (10, 9)	鸡	天秤座	出行、宴会、沐浴、上表章、进人口、竖柱上梁、经络、开市、纳财、补垣、缮城郭、裁制、立券交易、塞穴、上册、庆赐、修宫室	祭祀、结婚姻、嫁娶、修造、破土、启攒、安抚边境、纳畜、招贤、选将、施恩、出师、纳采、举正直
1921-10-04	一九二一 辛酉[鸡]年	九月大	初四	周二	无	无	无	辛酉 丁酉 庚子 辛巳	无	寒露 (10, 9)	鸡	天秤座	祭祀、沐浴、平治道涂、雪冤、覃恩、修饰垣墙、恤孤茕	冠带、修置产室、开渠、穿井、捕捉、畋猎、安葬、布政事、鼓铸、取鱼、筑堤防
1921-10-05	一九二一 辛酉[鸡]年	九月大	初五	周三	无	无	无	辛酉 丁酉 辛丑 癸巳	无	寒露 (10, 9)	鸡	天秤座	宴会、经络、安碓硙、赴任、裁制、入宅、庆赐	求医疗病、上表章、上官、修置产室、破土、安葬、启攒、上册、安抚边境、乘船渡水、出师、选将、营建、开仓、解除、筑堤防、临政
1921-10-06	一九二一 辛酉[鸡]年	九月大	初六	周四	无	无	无	辛酉 丁酉 壬寅 乙巳	无	寒露 (10, 9)	鸡	天秤座	沐浴、捕捉、雪冤、覃恩、恤孤茕	祭祀、冠带、修置产室、开渠、穿井、安碓硙、破屋坏垣、畋猎、启攒、布政事、鼓铸、取鱼、筑堤防、远回、塞穴、修饰垣墙、补垣
1921-10-07	一九二一 辛酉[鸡]年	九月大	初七	周五	无	无	无	辛酉 丁酉 癸卯 丁巳	无	寒露 (10, 9)	鸡	天秤座	诸事不宜	诸事不宜
1921-10-08	一九二一 辛酉[鸡]年	九月大	初八	周六	无	无	无	辛酉 丁酉 甲辰 己巳	无	寒露 (10, 9)	鸡	天秤座	诸事不宜	出行、剃头、修造、求医疗病、上官、竖柱上梁、修置产室、开渠、穿井、安碓硙、破屋坏垣、布政事、出师、颁诏、补垣、纳采、举正直、修仓库、整手足甲、缮城郭、鼓铸、裁制、宣政事、临政、招贤、开仓、祈福、解除、施恩、筑堤防、求嗣、塞穴、修饰垣墙、上册、庆赐、整容、修宫室、营建
1921-10-09	一九二一 辛酉[鸡]年	九月大	初九	周日	无	重阳节-酆都大帝诞	无	辛酉 戊戌 乙巳 辛巳	寒露	霜降 (10, 24)	鸡	天秤座	祭祀、安床、安抚边境、雪冤、恤孤茕、选将	出行、修造、求医疗病、栽种、破土、启攒、修仓库、针刺、纳畜、开仓、解除
1921-10-10	一九二一 辛酉[鸡]年	九月大	初十	周一	无	无	无	辛酉 戊戌 丙午 癸巳	无	霜降 (10, 24)	鸡	天秤座	祭祀、出行、结婚姻、宴会、嫁娶、修造、求医疗病、上表章、上官、入学、进人口、竖柱上梁、经络、开市、纳财、安碓硙、栽种、牧养、安葬、纳畜、颁诏、纳采、举正直、修仓库、雪冤、缮城郭、裁制、宣政事、临政、酝酿、立券交易、招贤、祈福、筑堤防、入宅、施恩、解除、求嗣、覃恩、上册、庆赐、恤孤茕、修宫室、营建、搬移	畋猎、苫盖、取鱼
1921-10-11	一九二一 辛酉[鸡]年	九月大	十一	周二	无	无	无	辛酉 戊戌 丁未 乙巳	无	霜降 (10, 24)	鸡	天秤座	捕捉	出行、结婚姻、宴会、嫁娶、安床、剃头、修造、求医疗病、上表章、上官、冠带、进人口、竖柱上梁、经络、开市、纳财、修置产室、开渠、穿井、安碓硙、破屋坏垣、栽种、牧养、破土、安葬、启攒、布政事、纳畜、取鱼、颁诏、补垣、纳采、举正直、安抚边境、修仓库、整手足甲、缮城郭、鼓铸、裁制、宣政事、临政、乘船渡水、酝酿、立券交易、招贤、开仓、祈福、解除、施恩、筑堤防、求嗣、塞穴、修饰垣墙、上册、庆赐、整容、修宫室、选将、营建、出师、搬移
1921-10-12	一九二一 辛酉[鸡]年	九月大	十二	周三	无	无	无	辛酉 戊戌 戊申 丁巳	无	霜降 (10, 24)	鸡	天秤座	出行、沐浴、修造、求医疗病、上表章、上官、入学、竖柱上梁、开市、修置产室、开渠、穿井、安碓硙、扫舍宇、栽种、牧养、纳畜、颁诏、举正直、安抚边境、修仓库、雪冤、整手足甲、缮城郭、裁制、宣政事、临政、招贤、祈福、解除、施恩、求嗣、覃恩、上册、恤孤茕、修宫室、选将、营建、搬移	伐木、畋猎、启攒、乘船渡水、取鱼
1921-10-13	一九二一 辛酉[鸡]年	九月大	十三	周四	无	孟婆尊神诞	无	辛酉 戊戌 己酉 己巳	无	霜降 (10, 24)	鸡	天秤座	沐浴、剃头、扫舍宇、补垣、雪冤、整手足甲、塞穴、覃恩、整容、恤孤茕	出行、结婚姻、宴会、嫁娶、安床、修造、求医疗病、上表章、上官、冠带、进人口、竖柱上梁、经络、开市、纳财、修置产室、开渠、穿井、栽种、牧养、破土、安葬、启攒、布政事、出师、纳畜、颁诏、纳采、举正直、安抚边境、修仓库、缮城郭、宣政事、临政、针刺、酝酿、立券交易、招贤、开仓、祈福、解除、施恩、筑堤防、求嗣、上册、庆赐、修宫室、选将、营建、疗目、搬移
1921-10-14	一九二一 辛酉[鸡]年	九月大	十四	周五	无	无	无	辛酉 戊戌 庚戌 辛巳	无	霜降 (10, 24)	鸡	天秤座	祭祀、宴会、嫁娶、上官、进人口、纳财、牧养、布政事、纳畜、举正直、安抚边境、雪冤、裁制、临政、酝酿、立券交易、招贤、施恩、覃恩、庆赐、恤孤茕、选将、出师、搬移	剃头、上表章、修置产室、开渠、穿井、平治道涂、破屋坏垣、伐木、破土、安葬、启攒、补垣、整手足甲、乘船渡水、筑堤防、修饰垣墙、上册、整容、营建
1921-10-15	一九二一 辛酉[鸡]年	九月大	十五	周六	无	无	无	辛酉 戊戌 辛亥 癸巳	无	霜降 (10, 24)	鸡	天秤座	祭祀、出行、结婚姻、宴会、沐浴、剃头、修造、求医疗病、上表章、上官、竖柱上梁、经络、开市、纳财、扫舍宇、栽种、牧养、赴任、出师、纳畜、颁诏、纳采、举正直、安抚边境、修仓库、雪冤、整手足甲、缮城郭、裁制、宣政事、临政、酝酿、立券交易、招贤、开仓、祈福、解除、入宅、施恩、求嗣、覃恩、上册、庆赐、整容、恤孤茕、选将、营建、搬移	嫁娶、冠带、修置产室、开渠、穿井、安碓硙、平治道涂、破屋坏垣、畋猎、破土、安葬、修宫室、鼓铸、取鱼、筑堤防、塞穴、补垣、修饰垣墙
1921-10-16	一九二一 辛酉[鸡]年	九月大	十六	周日	无	无	无	辛酉 戊戌 壬子 乙巳	无	霜降 (10, 24)	鸡	天秤座	沐浴、赴任、雪冤、诉讼、覃恩、恤孤茕	祭祀、出行、结婚姻、宴会、嫁娶、安床、剃头、修造、求医疗病、上表章、上官、冠带、进人口、竖柱上梁、经络、开市、纳财、修置产室、开渠、穿井、安碓硙、破屋坏垣、栽种、牧养、破土、安葬、启攒、布政事、出师、纳畜、颁诏、纳采、补垣、举正直、安抚边境、修仓库、苫盖、整手足甲、缮城郭、鼓铸、裁制、宣政事、临政、酝酿、立券交易、招贤、开仓、入宅、祈福、解除、施恩、筑堤防、求嗣、塞穴、修饰垣墙、上册、庆赐、整容、修宫室、选将、营建、远回、搬移
1921-10-17	一九二一 辛酉[鸡]年	九月大	十七	周一	无	金龙四大王诞	无	辛酉 戊戌 癸丑 丁巳	无	霜降 (10, 24)	鸡	天秤座	诸事不宜	诸事不宜
1921-10-18	一九二一 辛酉[鸡]年	九月大	十八	周二	无	无	无	辛酉 戊戌 甲寅 己巳	无	霜降 (10, 24)	鸡	天秤座	诸事不宜	祭祀、出行、结婚姻、宴会、嫁娶、安床、剃头、修造、求医疗病、上表章、上官、冠带、进人口、竖柱上梁、经络、开市、纳财、修置产室、开渠、穿井、安碓硙、平治道涂、破屋坏垣、伐木、畋猎、栽种、牧养、破土、安葬、启攒、布政事、纳畜、取鱼、颁诏、纳采、补垣、举正直、安抚边境、修仓库、整手足甲、缮城郭、鼓铸、裁制、宣政事、临政、乘船渡水、酝酿、立券交易、招贤、开仓、祈福、解除、施恩、筑堤防、求嗣、塞穴、修饰垣墙、上册、庆赐、整容、修宫室、选将、营建、远回、出师、搬移
1921-10-19	一九二一 辛酉[鸡]年	九月大	十九	周三	无	观世音菩萨出家	无	辛酉 戊戌 乙卯 辛巳	无	霜降 (10, 24)	鸡	天秤座	祭祀、结婚姻、宴会、嫁娶、上官、进人口、经络、纳财、捕捉、安葬、安抚边境、酝酿、纳畜、立券交易、祈福、临政	出行、安床、修造、求医疗病、上表章、冠带、竖柱上梁、开市、修置产室、开渠、穿井、安碓硙、栽种、牧养、布政事、取鱼、颁诏、纳采、补垣、举正直、修仓库、整手足甲、缮城郭、鼓铸、裁制、宣政事、乘船渡水、招贤、开仓、解除、施恩、筑堤防、塞穴、求嗣、修饰垣墙、上册、庆赐、修宫室、选将、营建、出师、搬移
1921-10-20	一九二一 辛酉[鸡]年	九月大	二十	周四	无	无	无	辛酉 戊戌 丙辰 癸巳	无	霜降 (10, 24)	鸡	天秤座	祭祀、沐浴、破屋坏垣、雪冤、入宅、解除、覃恩、恤孤茕	安床、冠带、进人口、经络、开市、修置产室、开渠、穿井、安碓硙、伐木、捕捉、畋猎、破土、启攒、布政事、取鱼、补垣、鼓铸、酝酿、立券交易、开仓、筑堤防、塞穴、修饰垣墙、修宫室
1921-10-21	一九二一 辛酉[鸡]年	九月大	廿一	周五	无	无	无	辛酉 戊戌 丁巳 乙巳	无	霜降 (10, 24)	鸡	天秤座	祭祀、安床、雪冤、恤孤茕	出行、剃头、修造、求医疗病、修置产室、开渠、穿井、安碓硙、平治道涂、破屋坏垣、栽种、破土、安葬、启攒、纳畜、补垣、修仓库、整手足甲、缮城郭、针刺、开仓、筑堤防、解除、修饰垣墙、整容、修宫室、营建
1921-10-22	一九二一 辛酉[鸡]年	九月大	廿二	周六	无	无	无	辛酉 戊戌 戊午 丁巳	无	霜降 (10, 24)	鸡	天秤座	出行、宴会、上官、入学、进人口、竖柱上梁、经络、纳畜、纳采、举正直、裁制、临政、酝酿、施恩、庆赐、搬移	求医疗病、修置产室、开渠、穿井、平治道涂、破屋坏垣、栽种、破土、安葬、启攒、补垣、苫盖、开仓、修饰垣墙、营建
1921-10-23	一九二一 辛酉[鸡]年	九月大	廿三	周日	无	无	无	辛酉 戊戌 己未 己巳	无	霜降 (10, 24)	鸡	天蝎座	捕捉	出行、结婚姻、宴会、嫁娶、安床、剃头、修造、求医疗病、上表章、上官、冠带、进人口、竖柱上梁、经络、开市、纳财、修置产室、开渠、穿井、安碓硙、平治道涂、破屋坏垣、栽种、牧养、破土、安葬、启攒、布政事、出师、纳畜、颁诏、纳采、补垣、举正直、安抚边境、修仓库、整手足甲、缮城郭、鼓铸、裁制、宣政事、临政、乘船渡水、酝酿、立券交易、招贤、开仓、祈福、解除、施恩、筑堤防、求嗣、塞穴、修饰垣墙、上册、庆赐、整容、修宫室、选将、营建、搬移
1921-10-24	一九二一 辛酉[鸡]年	九月大	廿四	周一	无	无	无	辛酉 戊戌 庚申 辛巳	霜降	立冬 (11, 8)	鸡	天蝎座	出行、沐浴、剃头、求医疗病、上表章、上官、入学、竖柱上梁、开市、纳财、扫舍宇、牧养、颁诏、举正直、雪冤、整手足甲、裁制、宣政事、临政、招贤、开仓、祈福、解除、施恩、求嗣、覃恩、上册、整容、恤孤茕、搬移	嫁娶、平治道涂、破屋坏垣、伐木、畋猎、乘船渡水、取鱼、营建、筑堤防、补垣、出师、修饰垣墙
1921-10-25	一九二一 辛酉[鸡]年	九月大	廿五	周二	无	无	无	辛酉 戊戌 辛酉 癸巳	无	立冬 (11, 8)	鸡	天蝎座	祭祀、沐浴、剃头、扫舍宇、赴任、雪冤、整手足甲、裁制、入宅、塞穴、覃恩、整容、恤孤茕	宴会、冠带、立券、修置产室、开渠、穿井、安碓硙、平治道涂、破屋坏垣、畋猎、启攒、布政事、取鱼、开张、针刺、开仓、修饰垣墙、修宫室、疗目
1921-10-26	一九二一 辛酉[鸡]年	九月大	廿六	周三	无	无	无	辛酉 戊戌 壬戌 乙巳	无	立冬 (11, 8)	鸡	天蝎座	祭祀、出行、宴会、嫁娶、上官、进人口、经络、纳财、牧养、纳畜、举正直、裁制、临政、酝酿、立券交易、招贤、施恩、庆赐、搬移	剃头、修置产室、开渠、穿井、平治道涂、破屋坏垣、伐木、破土、安葬、启攒、上册、整容、整手足甲、营建、筑堤防、补垣、修饰垣墙
1921-10-27	一九二一 辛酉[鸡]年	九月大	廿七	周四	无	无	无	辛酉 戊戌 癸亥 丁巳	无	立冬 (11, 8)	鸡	天蝎座	祭祀、沐浴、扫舍宇	嫁娶、上表章、开渠、穿井、破土、安葬、启攒、布政事、颁诏、补垣、宣政事、招贤、筑堤防、塞穴、上册、营建
1921-10-28	一九二一 辛酉[鸡]年	九月大	廿八	周五	无	无	无	辛酉 戊戌 甲子 己巳	无	立冬 (11, 8)	鸡	天蝎座	沐浴、赴任、雪冤、诉讼、覃恩、恤孤茕	祭祀、出行、结婚姻、宴会、嫁娶、安床、剃头、修造、求医疗病、上表章、上官、冠带、进人口、竖柱上梁、经络、开市、纳财、修置产室、开渠、穿井、安碓硙、平治道涂、破屋坏垣、栽种、牧养、破土、安葬、启攒、布政事、纳畜、颁诏、补垣、纳采、举正直、安抚边境、修仓库、苫盖、整手足甲、缮城郭、鼓铸、裁制、宣政事、临政、酝酿、立券交易、招贤、开仓、入宅、祈福、解除、施恩、筑堤防、求嗣、塞穴、修饰垣墙、上册、庆赐、整容、修宫室、选将、营建、远回、出师、搬移
1921-10-29	一九二一 辛酉[鸡]年	九月大	廿九	周六	无	无	无	辛酉 戊戌 乙丑 辛巳	无	立冬 (11, 8)	鸡	天蝎座	诸事不宜	诸事不宜
1921-10-30	一九二一 辛酉[鸡]年	九月大	三十	周日	无	药师琉璃光佛诞	无	辛酉 戊戌 丙寅 癸巳	无	立冬 (11, 8)	鸡	天蝎座	布政事、雪冤、恤孤茕、入宅、覃恩	祭祀、安床、剃头、开市、修置产室、开渠、穿井、平治道涂、破屋坏垣、伐木、畋猎、取鱼、补垣、整手足甲、鼓铸、乘船渡水、开仓、筑堤防、塞穴、修饰垣墙、整容、远回
1921-10-31	一九二一 辛酉[鸡]年	十月小	初一	周一	无	寒衣节	无	辛酉 戊戌 丁卯 乙巳	无	立冬 (11, 8)	鸡	天蝎座	祭祀、结婚姻、宴会、嫁娶、上官、进人口、经络、纳财、捕捉、畋猎、安葬、布政事、纳畜、安抚边境、雪冤、临政、酝酿、立券交易、祈福、覃恩、庆赐、恤孤茕	出行、安床、剃头、修造、求医疗病、上表章、冠带、竖柱上梁、开市、修置产室、开渠、穿井、安碓硙、平治道涂、破屋坏垣、栽种、牧养、取鱼、补垣、纳采、举正直、修仓库、整手足甲、缮城郭、乘船渡水、招贤、开仓、解除、施恩、筑堤防、求嗣、修饰垣墙、上册、整容、修宫室、选将、营建、出师、搬移
