1924-10-01	一九二四 甲子[鼠]年	九月小	初三	周三	无	五瘟神诞	无	甲子 癸酉 癸丑 丁巳	无	寒露 (10, 8)	鼠	天秤座	祭祀、出行、宴会、修造、上官、进人口、竖柱上梁、经络、安碓硙、牧养、布政事、纳畜、举正直、雪冤、缮城郭、裁制、临政、酝酿、祈福、施恩、求嗣、覃恩、庆赐、修宫室、恤孤茕、搬移	上表章、修置产室、上册、安抚边境、选将、出师
1924-10-02	一九二四 甲子[鼠]年	九月小	初四	周四	无	无	无	甲子 癸酉 甲寅 己巳	无	寒露 (10, 8)	鼠	天秤座	沐浴、捕捉、雪冤、入宅、覃恩、恤孤茕	祭祀、安床、冠带、进人口、经络、开市、纳财、修置产室、开渠、穿井、安碓硙、破屋坏垣、畋猎、布政事、取鱼、补垣、鼓铸、酝酿、开仓、筑堤防、塞穴、修饰垣墙、修宫室、远回
1924-10-03	一九二四 甲子[鼠]年	九月小	初五	周五	无	无	无	甲子 癸酉 乙卯 辛巳	无	寒露 (10, 8)	鼠	天秤座	诸事不宜	诸事不宜
1924-10-04	一九二四 甲子[鼠]年	九月小	初六	周六	无	无	无	甲子 癸酉 丙辰 癸巳	无	寒露 (10, 8)	鼠	天秤座	祭祀、雪冤、覃恩、恤孤茕	剃头、求医疗病、开渠、穿井、布政事、补垣、开仓、解除、筑堤防、塞穴、整容、出师
1924-10-05	一九二四 甲子[鼠]年	九月小	初七	周日	无	无	无	甲子 癸酉 丁巳 乙巳	无	寒露 (10, 8)	鼠	天秤座	祭祀、宴会、上表章、上官、入学、进人口、竖柱上梁、经络、开市、纳财、纳畜、纳采、举正直、裁制、临政、酝酿、立券交易、施恩、祈福、上册、庆赐、搬移	出行、剃头、求医疗病、修置产室、开渠、穿井、平治道涂、破屋坏垣、栽种、破土、安葬、启攒、整容、营建、补垣、修饰垣墙
1924-10-06	一九二四 甲子[鼠]年	九月小	初八	周一	无	无	无	甲子 癸酉 戊午 丁巳	无	寒露 (10, 8)	鼠	天秤座	祭祀、捕捉	出行、结婚姻、宴会、嫁娶、安床、修造、求医疗病、上表章、上官、冠带、进人口、竖柱上梁、经络、开市、纳财、修置产室、开渠、穿井、栽种、牧养、破土、安葬、启攒、布政事、纳畜、取鱼、颁诏、纳采、补垣、举正直、安抚边境、苫盖、修仓库、缮城郭、鼓铸、裁制、宣政事、临政、乘船渡水、酝酿、立券交易、招贤、开仓、祈福、解除、施恩、筑堤防、求嗣、塞穴、上册、庆赐、修宫室、选将、营建、出师、搬移
1924-10-07	一九二四 甲子[鼠]年	九月小	初九	周二	无	重阳节-酆都大帝诞	无	甲子 癸酉 己未 己巳	无	寒露 (10, 8)	鼠	天秤座	出行、宴会、上表章、上官、入学、进人口、开市、纳财、牧养、赴任、纳畜、颁诏、举正直、雪冤、裁制、宣政事、临政、招贤、祈福、解除、施恩、入宅、求嗣、覃恩、上册、庆赐、恤孤茕、搬移	结婚姻、平治道涂、破屋坏垣、伐木、畋猎、破土、取鱼、营建、开仓、筑堤防、补垣、修饰垣墙
1924-10-08	一九二四 甲子[鼠]年	九月小	初十	周三	无	无	无	甲子 甲戌 庚申 辛巳	寒露	霜降 (10, 24)	鼠	天秤座	出行、沐浴、剃头、修造、求医疗病、上表章、上官、入学、竖柱上梁、开市、纳财、修置产室、开渠、穿井、安碓硙、扫舍宇、栽种、牧养、颁诏、举正直、修仓库、雪冤、整手足甲、缮城郭、裁制、宣政事、临政、招贤、开仓、祈福、解除、施恩、求嗣、覃恩、上册、整容、恤孤茕、修宫室、搬移	嫁娶、伐木、畋猎、乘船渡水、取鱼、出师
1924-10-09	一九二四 甲子[鼠]年	九月小	十一	周四	无	无	无	甲子 甲戌 辛酉 癸巳	无	霜降 (10, 24)	鼠	天秤座	祭祀、沐浴、剃头、扫舍宇、补垣、雪冤、整手足甲、裁制、塞穴、覃恩、整容、恤孤茕	宴会、冠带、修置产室、开渠、穿井、畋猎、启攒、针刺、布政事、修宫室、取鱼、开仓、疗目
1924-10-10	一九二四 甲子[鼠]年	九月小	十二	周五	无	无	无	甲子 甲戌 壬戌 乙巳	无	霜降 (10, 24)	鼠	天秤座	祭祀、出行、宴会、嫁娶、上官、进人口、经络、纳财、牧养、纳畜、举正直、裁制、临政、酝酿、立券交易、招贤、施恩、庆赐、搬移	剃头、修置产室、开渠、穿井、平治道涂、破屋坏垣、伐木、破土、安葬、启攒、上册、整容、整手足甲、营建、筑堤防、补垣、修饰垣墙
1924-10-11	一九二四 甲子[鼠]年	九月小	十三	周六	无	孟婆尊神诞	无	甲子 甲戌 癸亥 丁巳	无	霜降 (10, 24)	鼠	天秤座	祭祀、沐浴、扫舍宇	嫁娶、上表章、开渠、穿井、破土、安葬、启攒、布政事、颁诏、补垣、宣政事、招贤、筑堤防、塞穴、上册、营建
1924-10-12	一九二四 甲子[鼠]年	九月小	十四	周日	无	无	无	甲子 甲戌 甲子 己巳	无	霜降 (10, 24)	鼠	天秤座	出行、结婚姻、宴会、嫁娶、沐浴、修造、求医疗病、上表章、上官、进人口、竖柱上梁、经络、开市、纳财、栽种、牧养、安葬、赴任、布政事、纳畜、补垣、纳采、修仓库、雪冤、缮城郭、裁制、临政、诉讼、立券交易、开仓、祈福、入宅、塞穴、解除、求嗣、覃恩、上册、庆赐、修宫室、恤孤茕、搬移	祭祀、剃头、冠带、修置产室、开渠、穿井、安碓硙、破屋坏垣、破土、启攒、颁诏、安抚边境、苫盖、整手足甲、鼓铸、宣政事、乘船渡水、招贤、筑堤防、修饰垣墙、整容、选将、营建、远回、出师
1924-10-13	一九二四 甲子[鼠]年	九月小	十五	周一	无	无	无	甲子 甲戌 乙丑 辛巳	无	霜降 (10, 24)	鼠	天秤座	诸事不宜	诸事不宜
1924-10-14	一九二四 甲子[鼠]年	九月小	十六	周二	无	无	无	甲子 甲戌 丙寅 癸巳	无	霜降 (10, 24)	鼠	天秤座	雪冤、恤孤茕、覃恩、布政事	祭祀、安床、剃头、开市、修置产室、开渠、穿井、平治道涂、破屋坏垣、伐木、畋猎、取鱼、补垣、整手足甲、鼓铸、乘船渡水、开仓、筑堤防、塞穴、修饰垣墙、整容、远回
1924-10-15	一九二四 甲子[鼠]年	九月小	十七	周三	无	金龙四大王诞	无	甲子 甲戌 丁卯 乙巳	无	霜降 (10, 24)	鼠	天秤座	祭祀、结婚姻、宴会、嫁娶、上官、进人口、经络、纳财、捕捉、安葬、布政事、纳畜、安抚边境、雪冤、临政、酝酿、立券交易、祈福、覃恩、庆赐、恤孤茕	出行、安床、剃头、修造、求医疗病、上表章、冠带、竖柱上梁、开市、修置产室、穿井、栽种、牧养、取鱼、纳采、举正直、修仓库、缮城郭、乘船渡水、招贤、开仓、解除、施恩、筑堤防、求嗣、上册、整容、修宫室、选将、营建、出师、搬移
1924-10-16	一九二四 甲子[鼠]年	九月小	十八	周四	无	无	无	甲子 甲戌 戊辰 丁巳	无	霜降 (10, 24)	鼠	天秤座	祭祀、沐浴、雪冤、覃恩、恤孤茕	出行、结婚姻、安床、修造、上官、冠带、进人口、竖柱上梁、经络、开市、修置产室、开渠、穿井、安碓硙、平治道涂、伐木、捕捉、畋猎、破土、安葬、启攒、取鱼、颁诏、纳采、补垣、举正直、修仓库、缮城郭、鼓铸、宣政事、临政、酝酿、立券交易、招贤、开仓、筑堤防、施恩、塞穴、修饰垣墙、上册、修宫室、营建、搬移
1924-10-17	一九二四 甲子[鼠]年	九月小	十九	周五	无	观世音菩萨出家	无	甲子 甲戌 己巳 己巳	无	霜降 (10, 24)	鼠	天秤座	祭祀、安床、赴任、安抚边境、纳采、雪冤、恤孤茕、选将、入宅、搬移	出行、求医疗病、破土、安葬、启攒、修仓库、针刺、纳畜、整手足甲、开仓、解除
1924-10-18	一九二四 甲子[鼠]年	九月小	二十	周六	无	无	无	甲子 甲戌 庚午 辛巳	无	霜降 (10, 24)	鼠	天秤座	祭祀、结婚姻、宴会、求医疗病、上官、入学、进人口、竖柱上梁、开市、纳财、安碓硙、栽种、牧养、安葬、纳畜、纳采、举正直、修仓库、缮城郭、裁制、临政、酝酿、立券交易、开仓、筑堤防、施恩、祈福、解除、求嗣、庆赐、修宫室	苫盖
1924-10-19	一九二四 甲子[鼠]年	九月小	廿一	周日	无	无	无	甲子 甲戌 辛未 癸巳	无	霜降 (10, 24)	鼠	天秤座	祭祀、捕捉、雪冤、覃恩、恤孤茕	剃头、冠带、修置产室、开渠、穿井、安碓硙、破屋坏垣、畋猎、启攒、布政事、取鱼、补垣、整手足甲、鼓铸、乘船渡水、开仓、筑堤防、塞穴、修饰垣墙、整容、修宫室
1924-10-20	一九二四 甲子[鼠]年	九月小	廿二	周一	无	无	无	甲子 甲戌 壬申 乙巳	无	霜降 (10, 24)	鼠	天秤座	出行、沐浴、剃头、修造、上表章、上官、入学、竖柱上梁、开市、纳财、修置产室、安碓硙、扫舍宇、栽种、牧养、颁诏、举正直、安抚边境、修仓库、雪冤、整手足甲、缮城郭、裁制、宣政事、临政、招贤、开仓、祈福、解除、施恩、求嗣、覃恩、上册、整容、恤孤茕、修宫室、选将、搬移	嫁娶、开渠、伐木、畋猎、乘船渡水、取鱼
1924-10-21	一九二四 甲子[鼠]年	九月小	廿三	周二	无	无	无	甲子 甲戌 癸酉 丁巳	无	霜降 (10, 24)	鼠	天秤座	祭祀、沐浴、剃头、扫舍宇、裁制、塞穴、整容	出行、结婚姻、宴会、嫁娶、安床、修造、求医疗病、上表章、上官、冠带、进人口、竖柱上梁、经络、开市、纳财、修置产室、开渠、穿井、安碓硙、平治道涂、破屋坏垣、栽种、牧养、破土、安葬、启攒、布政事、出师、纳畜、颁诏、补垣、纳采、举正直、安抚边境、修仓库、整手足甲、缮城郭、宣政事、临政、乘船渡水、针刺、酝酿、立券交易、招贤、开仓、祈福、解除、施恩、筑堤防、求嗣、修饰垣墙、上册、庆赐、修宫室、选将、营建、疗目、搬移
1924-10-22	一九二四 甲子[鼠]年	九月小	廿四	周三	无	无	无	甲子 甲戌 甲戌 己巳	无	霜降 (10, 24)	鼠	天秤座	出行、宴会、嫁娶、上官、进人口、经络、纳财、牧养、纳畜、举正直、安抚边境、裁制、临政、酝酿、立券交易、招贤、入宅、施恩、庆赐、选将、出师、搬移	剃头、求医疗病、上表章、修置产室、开渠、穿井、平治道涂、破屋坏垣、伐木、破土、安葬、启攒、补垣、整手足甲、开仓、祈福、解除、筑堤防、求嗣、修饰垣墙、上册、整容、营建
1924-10-23	一九二四 甲子[鼠]年	九月小	廿五	周四	无	无	无	甲子 甲戌 乙亥 辛巳	无	霜降 (10, 24)	鼠	天蝎座	沐浴、扫舍宇	结婚姻、宴会、嫁娶、安床、修造、上表章、冠带、进人口、竖柱上梁、立券、修置产室、开渠、穿井、安碓硙、平治道涂、破屋坏垣、破土、安葬、启攒、布政事、颁诏、纳采、补垣、开张、修仓库、缮城郭、鼓铸、裁制、宣政事、招贤、祈福、筑堤防、求嗣、塞穴、修饰垣墙、上册、庆赐、修宫室、营建、搬移
1924-10-24	一九二四 甲子[鼠]年	九月小	廿六	周五	无	无	无	甲子 甲戌 丙子 癸巳	霜降	立冬 (11, 8)	鼠	天蝎座	出行、结婚姻、宴会、嫁娶、沐浴、修造、求医疗病、上表章、上官、进人口、竖柱上梁、经络、开市、纳财、栽种、牧养、安葬、赴任、出师、纳畜、颁诏、纳采、补垣、举正直、安抚边境、修仓库、雪冤、缮城郭、裁制、宣政事、临政、诉讼、立券交易、招贤、开仓、祈福、解除、施恩、塞穴、求嗣、覃恩、上册、庆赐、恤孤茕、修宫室、选将、营建、搬移	祭祀、剃头、冠带、修置产室、开渠、穿井、安碓硙、平治道涂、破屋坏垣、畋猎、布政事、取鱼、苫盖、整手足甲、鼓铸、入宅、筑堤防、修饰垣墙、整容、远回
1924-10-25	一九二四 甲子[鼠]年	九月小	廿七	周六	无	无	无	甲子 甲戌 丁丑 乙巳	无	立冬 (11, 8)	鼠	天蝎座	诸事不宜	诸事不宜
1924-10-26	一九二四 甲子[鼠]年	九月小	廿八	周日	无	无	无	甲子 甲戌 戊寅 丁巳	无	立冬 (11, 8)	鼠	天蝎座	诸事不宜	祭祀、出行、结婚姻、宴会、嫁娶、安床、剃头、修造、求医疗病、上表章、上官、冠带、进人口、竖柱上梁、经络、开市、纳财、修置产室、开渠、穿井、安碓硙、平治道涂、破屋坏垣、伐木、畋猎、栽种、牧养、破土、安葬、启攒、布政事、纳畜、取鱼、颁诏、纳采、补垣、举正直、安抚边境、修仓库、整手足甲、缮城郭、鼓铸、裁制、宣政事、临政、乘船渡水、酝酿、立券交易、招贤、开仓、祈福、解除、施恩、筑堤防、求嗣、塞穴、修饰垣墙、上册、庆赐、整容、修宫室、选将、营建、远回、出师、搬移
1924-10-27	一九二四 甲子[鼠]年	九月小	廿九	周一	无	无	无	甲子 甲戌 己卯 己巳	无	立冬 (11, 8)	鼠	天蝎座	祭祀、出行、结婚姻、宴会、嫁娶、修造、上官、进人口、经络、纳财、捕捉、畋猎、破土、安葬、赴任、布政事、纳畜、纳采、安抚边境、雪冤、临政、酝酿、立券交易、祈福、入宅、覃恩、庆赐、恤孤茕、搬移	求医疗病、上表章、冠带、竖柱上梁、修置产室、开渠、穿井、安碓硙、平治道涂、破屋坏垣、栽种、牧养、取鱼、补垣、举正直、修仓库、缮城郭、乘船渡水、招贤、开仓、解除、施恩、筑堤防、求嗣、修饰垣墙、上册、修宫室、选将、营建、出师
1924-10-28	一九二四 甲子[鼠]年	十月大	初一	周二	无	寒衣节	无	甲子 甲戌 庚辰 辛巳	无	立冬 (11, 8)	鼠	天蝎座	祭祀、沐浴、雪冤、解除、覃恩、恤孤茕	冠带、修置产室、开渠、穿井、安碓硙、平治道涂、伐木、捕捉、畋猎、破土、安葬、启攒、取鱼、颁诏、补垣、修仓库、鼓铸、宣政事、招贤、筑堤防、塞穴、修饰垣墙、上册、营建
1924-10-29	一九二四 甲子[鼠]年	十月大	初二	周三	无	无	无	甲子 甲戌 辛巳 癸巳	无	立冬 (11, 8)	鼠	天蝎座	祭祀、结婚姻、宴会、嫁娶、安床、上表章、上官、竖柱上梁、牧养、颁诏、纳采、举正直、雪冤、裁制、宣政事、临政、招贤、施恩、覃恩、上册、庆赐、恤孤茕、搬移	出行、修置产室、开渠、穿井、安碓硙、平治道涂、破屋坏垣、畋猎、破土、启攒、针刺、修宫室、取鱼、开仓、筑堤防、补垣、修饰垣墙
1924-10-30	一九二四 甲子[鼠]年	十月大	初三	周四	无	三茅诞	无	甲子 甲戌 壬午 乙巳	无	立冬 (11, 8)	鼠	天蝎座	祭祀、宴会、求医疗病、上表章、上官、入学、进人口、竖柱上梁、经络、开市、纳财、牧养、安葬、布政事、纳畜、纳采、举正直、安抚边境、雪冤、裁制、临政、酝酿、立券交易、开仓、祈福、施恩、解除、求嗣、覃恩、庆赐、恤孤茕、选将、出师	修置产室、开渠、穿井、平治道涂、破屋坏垣、苫盖、营建、补垣、修饰垣墙
1924-10-31	一九二四 甲子[鼠]年	十月大	初四	周五	无	无	无	甲子 甲戌 癸未 丁巳	无	立冬 (11, 8)	鼠	天蝎座	祭祀、捕捉、畋猎、雪冤、覃恩、恤孤茕	出行、结婚姻、宴会、嫁娶、安床、剃头、修造、求医疗病、上表章、上官、冠带、进人口、竖柱上梁、经络、开市、纳财、修置产室、开渠、穿井、安碓硙、平治道涂、破屋坏垣、栽种、牧养、破土、安葬、启攒、布政事、出师、纳畜、颁诏、纳采、补垣、举正直、安抚边境、修仓库、整手足甲、缮城郭、鼓铸、裁制、宣政事、临政、酝酿、立券交易、招贤、开仓、祈福、解除、施恩、筑堤防、求嗣、塞穴、修饰垣墙、上册、庆赐、整容、修宫室、选将、营建、搬移
