1927-04-01	一九二七 丁卯[兔]年	二月小	廿九	周五	丁卯 癸卯 乙丑 辛巳	兔	白羊座	无	清明 (4, 6)	无	无	无	出行、宴会、修造、求医疗病、上表章、上官、入学、修置产室、开渠、穿井、安碓硙、牧养、雪冤、裁制、覃恩、缮城郭、招贤、举正直、选将、纳畜、上册、颁诏、出师、祈福、庆赐、解除、修宫室、施恩、临政、搬移、求嗣、恤孤茕、宣政事、安抚边境	冠带、伐木、畋猎、破土、安葬、启攒、立券交易、乘船渡水、塞穴、取鱼、开仓、鼓铸、补垣
1927-04-02	一九二七 丁卯[兔]年	三月小	初一	周六	丁卯 癸卯 丙寅 癸巳	兔	白羊座	无	清明 (4, 6)	无	二殿楚江王诞	无	经络、纳财、栽种、牧养、立券交易、雪冤、裁制、缮城郭、覃恩、选将、塞穴、纳畜、酝酿、补垣、筑堤防、恤孤茕、安抚边境	祭祀、出行、结婚姻、宴会、嫁娶、安床、修造、求医疗病、上表章、上官、进人口、竖柱上梁、开市、修置产室、开渠、穿井、疗目、针刺、远回、招贤、布政事、举正直、上册、颁诏、出师、祈福、庆赐、开仓、解除、施恩、纳采、整手足甲、临政、搬移、营建、宣政事、求嗣、修宫室
1927-04-03	一九二七 丁卯[兔]年	三月小	初二	周日	丁卯 癸卯 丁卯 乙巳	兔	白羊座	无	清明 (4, 6)	无	无	无	出行、宴会、上官、进人口、经络、纳财、牧养、立券交易、雪冤、赴任、裁制、覃恩、招贤、布政事、举正直、选将、纳畜、入宅、出师、酝酿、庆赐、施恩、临政、搬移、恤孤茕、安抚边境	剃头、上表章、修置产室、开渠、穿井、平治道涂、破屋坏垣、伐木、安葬、乘船渡水、苫盖、取鱼、上册、修饰垣墙、整容、补垣、整手足甲、筑堤防、营建
1927-04-04	一九二七 丁卯[兔]年	三月小	初三	周一	丁卯 癸卯 戊辰 丁巳	兔	白羊座	无	清明 (4, 6)	无	三月三-玄天上帝诞	无	出行、沐浴、剃头、扫舍宇、雪冤、覃恩、布政事、举正直、整容、解除、施恩、整手足甲、临政、恤孤茕	结婚姻、宴会、嫁娶、修造、求医疗病、上表章、上官、进人口、经络、开市、纳财、修置产室、畋猎、牧养、破土、安葬、启攒、立券交易、选将、纳畜、上册、出师、祈福、酝酿、庆赐、开仓、纳采、修仓库、求嗣、安抚边境
1927-04-05	一九二七 丁卯[兔]年	三月小	初四	周二	丁卯 癸卯 己巳 己巳	兔	白羊座	无	清明 (4, 6)	无	无	无	宴会、竖柱上梁、经络、开市、纳财、牧养、立券交易、雪冤、裁制、覃恩、塞穴、祈福、庆赐、解除、恤孤茕、求嗣	祭祀、出行、修置产室、开渠、穿井、安碓硙、平治道涂、破屋坏垣、捕捉、畋猎、破土、启攒、修饰垣墙、取鱼、筑堤防
1927-04-06	一九二七 丁卯[兔]年	三月小	初五	周三	丁卯 甲辰 庚午 辛巳	兔	白羊座	清明	谷雨 (4, 21)	清明节	无	无	诸事不宜	祭祀、出行、结婚姻、宴会、嫁娶、安床、剃头、修造、求医疗病、上表章、上官、冠带、进人口、竖柱上梁、经络、开市、纳财、修置产室、开渠、穿井、安碓硙、破屋坏垣、栽种、牧养、破土、安葬、启攒、立券交易、裁制、乘船渡水、缮城郭、苫盖、招贤、布政事、举正直、选将、塞穴、纳畜、上册、颁诏、修饰垣墙、出师、祈福、入宅、安抚边境、酝酿、庆赐、整容、鼓铸、开仓、补垣、宣政事、解除、修宫室、纳采、施恩、整手足甲、修仓库、临政、搬移、营建、筑堤防、求嗣
1927-04-07	一九二七 丁卯[兔]年	三月小	初六	周四	丁卯 甲辰 辛未 癸巳	兔	白羊座	无	谷雨 (4, 21)	无	无	无	诸事不宜	诸事不宜
1927-04-08	一九二七 丁卯[兔]年	三月小	初七	周五	丁卯 甲辰 壬申 乙巳	兔	白羊座	无	谷雨 (4, 21)	无	无	无	祭祀、沐浴、扫舍宇、雪冤、入宅、覃恩、恤孤茕	安床、开市、修置产室、开渠、穿井、平治道涂、破屋坏垣、伐木、捕捉、畋猎、启攒、远回、布政事、塞穴、取鱼、修饰垣墙、开仓、鼓铸、补垣、筑堤防
1927-04-09	一九二七 丁卯[兔]年	三月小	初八	周六	丁卯 甲辰 癸酉 丁巳	兔	白羊座	无	谷雨 (4, 21)	无	六殿卞城王诞	无	祭祀、结婚姻、嫁娶、沐浴、剃头、求医疗病、上官、进人口、经络、纳财、扫舍宇、捕捉、安葬、立券交易、纳畜、取鱼、祈福、酝酿、整容、解除、整手足甲、临政、安抚边境	出行、宴会、安床、修造、上表章、冠带、竖柱上梁、开市、修置产室、开渠、穿井、安碓硙、平治道涂、破屋坏垣、栽种、牧养、乘船渡水、缮城郭、招贤、举正直、选将、上册、修饰垣墙、出师、庆赐、开仓、补垣、纳采、施恩、修仓库、搬移、营建、筑堤防、求嗣、修宫室
1927-04-10	一九二七 丁卯[兔]年	三月小	初九	周日	丁卯 甲辰 甲戌 己巳	兔	白羊座	无	谷雨 (4, 21)	无	无	无	祭祀、沐浴、求医疗病、破屋坏垣、解除	结婚姻、宴会、安床、修造、上官、冠带、进人口、竖柱上梁、经络、开市、立券、纳财、修置产室、开渠、穿井、安碓硙、伐木、栽种、牧养、破土、安葬、启攒、立券交易、裁制、乘船渡水、缮城郭、招贤、布政事、举正直、塞穴、纳畜、取鱼、上册、颁诏、修饰垣墙、开张、酝酿、庆赐、开仓、鼓铸、补垣、修宫室、施恩、纳采、修仓库、临政、营建、筑堤防、宣政事、求嗣
1927-04-11	一九二七 丁卯[兔]年	三月小	初十	周一	丁卯 甲辰 乙亥 辛巳	兔	白羊座	无	谷雨 (4, 21)	无	无	无	安床、沐浴、牧养、纳畜、取鱼	出行、结婚姻、嫁娶、求医疗病、进人口、开市、畋猎、破土、安葬、启攒、立券交易、祈福、解除、纳采、修仓库、求嗣、开仓
1927-04-12	一九二七 丁卯[兔]年	三月小	十一	周二	丁卯 甲辰 丙子 癸巳	兔	白羊座	无	谷雨 (4, 21)	无	无	无	祭祀、结婚姻、宴会、嫁娶、沐浴、修造、求医疗病、上表章、上官、入学、进人口、竖柱上梁、经络、开市、纳财、安碓硙、栽种、牧养、安葬、立券交易、赴任、裁制、诉讼、缮城郭、举正直、纳畜、祈福、酝酿、庆赐、开仓、解除、纳采、施恩、修宫室、修仓库、临政、筑堤防、求嗣	远回
1927-04-13	一九二七 丁卯[兔]年	三月小	十二	周三	丁卯 甲辰 丁丑 乙巳	兔	白羊座	无	谷雨 (4, 21)	无	无	无	进人口、纳财、捕捉、栽种、牧养、雪冤、赴任、覃恩、纳畜、入宅、恤孤茕	剃头、冠带、修置产室、开渠、穿井、畋猎、破土、启攒、整容、乘船渡水、筑堤防、取鱼、布政事、鼓铸
1927-04-14	一九二七 丁卯[兔]年	三月小	十三	周四	丁卯 甲辰 戊寅 丁巳	兔	白羊座	无	谷雨 (4, 21)	无	无	无	出行、宴会、修造、求医疗病、上表章、上官、入学、竖柱上梁、开市、修置产室、开渠、穿井、安碓硙、栽种、牧养、立券交易、雪冤、裁制、覃恩、缮城郭、招贤、举正直、纳畜、上册、颁诏、祈福、庆赐、解除、修宫室、施恩、纳采、修仓库、临政、搬移、营建、恤孤茕、宣政事、求嗣	祭祀、伐木、畋猎、启攒、针刺、出师、乘船渡水、取鱼
1927-04-15	一九二七 丁卯[兔]年	三月小	十四	周五	丁卯 甲辰 己卯 己巳	兔	白羊座	无	谷雨 (4, 21)	无	无	无	补垣、雪冤、塞穴、覃恩、恤孤茕	出行、结婚姻、宴会、嫁娶、安床、修造、求医疗病、上表章、上官、冠带、进人口、竖柱上梁、经络、开市、纳财、修置产室、开渠、穿井、栽种、牧养、破土、安葬、启攒、立券交易、疗目、针刺、乘船渡水、缮城郭、招贤、布政事、举正直、选将、纳畜、上册、颁诏、出师、祈福、酝酿、庆赐、开仓、修宫室、施恩、纳采、解除、修仓库、临政、搬移、营建、筑堤防、宣政事、求嗣、安抚边境
1927-04-16	一九二七 丁卯[兔]年	三月小	十五	周六	丁卯 甲辰 庚辰 辛巳	兔	白羊座	无	谷雨 (4, 21)	无	昊天上帝诞	无	祭祀、雪冤、覃恩、恤孤茕	出行、结婚姻、宴会、嫁娶、安床、剃头、修造、求医疗病、上表章、上官、冠带、进人口、竖柱上梁、经络、开市、纳财、修置产室、开渠、穿井、安碓硙、平治道涂、破屋坏垣、伐木、栽种、牧养、破土、安葬、启攒、立券交易、裁制、缮城郭、招贤、布政事、举正直、选将、塞穴、纳畜、上册、颁诏、修饰垣墙、出师、祈福、安抚边境、酝酿、庆赐、开仓、整容、鼓铸、补垣、解除、纳采、整手足甲、施恩、修仓库、临政、搬移、营建、筑堤防、宣政事、求嗣、修宫室
1927-04-17	一九二七 丁卯[兔]年	三月小	十六	周日	丁卯 甲辰 辛巳 癸巳	兔	白羊座	无	谷雨 (4, 21)	无	准提菩萨诞	无	沐浴、扫舍宇、雪冤、覃恩、恤孤茕	出行、结婚姻、嫁娶、安床、修造、上表章、冠带、进人口、竖柱上梁、修置产室、开渠、穿井、安碓硙、破屋坏垣、破土、安葬、启攒、裁制、缮城郭、招贤、塞穴、上册、颁诏、修饰垣墙、祈福、鼓铸、补垣、纳采、修仓库、搬移、营建、筑堤防、宣政事、求嗣、修宫室
1927-04-18	一九二七 丁卯[兔]年	三月小	十七	周一	丁卯 甲辰 壬午 乙巳	兔	白羊座	无	谷雨 (4, 21)	无	无	无	出行、结婚姻、宴会、嫁娶、修造、求医疗病、上表章、上官、进人口、竖柱上梁、经络、开市、纳财、栽种、牧养、安葬、立券交易、雪冤、裁制、覃恩、缮城郭、招贤、举正直、选将、塞穴、纳畜、上册、颁诏、入宅、出师、祈福、安抚边境、庆赐、开仓、补垣、解除、纳采、施恩、修仓库、临政、搬移、营建、恤孤茕、宣政事、求嗣、修宫室	祭祀、剃头、冠带、修置产室、开渠、穿井、安碓硙、平治道涂、破屋坏垣、畋猎、启攒、修饰垣墙、整容、整手足甲、苫盖、取鱼、筑堤防、鼓铸
1927-04-19	一九二七 丁卯[兔]年	三月小	十八	周二	丁卯 甲辰 癸未 丁巳	兔	白羊座	无	谷雨 (4, 21)	无	无	无	诸事不宜	诸事不宜
1927-04-20	一九二七 丁卯[兔]年	三月小	十九	周三	丁卯 甲辰 甲申 己巳	兔	白羊座	无	谷雨 (4, 21)	无	中岳大帝诞	无	沐浴、扫舍宇	出行、结婚姻、宴会、嫁娶、安床、剃头、修造、求医疗病、上表章、上官、冠带、进人口、竖柱上梁、经络、开市、纳财、修置产室、开渠、穿井、安碓硙、平治道涂、破屋坏垣、伐木、捕捉、畋猎、栽种、牧养、破土、安葬、启攒、立券交易、裁制、缮城郭、远回、招贤、布政事、选将、举正直、塞穴、纳畜、取鱼、上册、颁诏、修饰垣墙、出师、祈福、安抚边境、酝酿、庆赐、开仓、整容、鼓铸、补垣、宣政事、解除、修宫室、施恩、整手足甲、纳采、修仓库、临政、搬移、营建、筑堤防、求嗣
1927-04-21	一九二七 丁卯[兔]年	三月小	二十	周四	丁卯 甲辰 乙酉 辛巳	兔	金牛座	谷雨	立夏 (5, 6)	无	子孙娘娘诞	无	祭祀、出行、结婚姻、嫁娶、沐浴、剃头、修造、求医疗病、上表章、上官、进人口、竖柱上梁、经络、开市、纳财、扫舍宇、捕捉、栽种、牧养、安葬、立券交易、雪冤、裁制、覃恩、缮城郭、招贤、举正直、选将、纳畜、取鱼、上册、颁诏、祈福、酝酿、整容、解除、施恩、纳采、整手足甲、修仓库、临政、搬移、求嗣、恤孤茕、宣政事、营建、安抚边境	宴会、冠带、修置产室、开渠、穿井、安碓硙、平治道涂、破屋坏垣、补垣、修饰垣墙、出师、修宫室、乘船渡水、开仓、筑堤防
1927-04-22	一九二七 丁卯[兔]年	三月小	廿一	周五	丁卯 甲辰 丙戌 癸巳	兔	金牛座	无	立夏 (5, 6)	无	无	无	祭祀、沐浴、求医疗病、解除	冠带、修置产室、开渠、穿井、安碓硙、平治道涂、伐木、破土、安葬、启攒、乘船渡水、招贤、布政事、塞穴、纳畜、取鱼、上册、颁诏、修饰垣墙、鼓铸、补垣、修仓库、筑堤防、营建、宣政事
1927-04-23	一九二七 丁卯[兔]年	三月小	廿二	周六	丁卯 甲辰 丁亥 乙巳	兔	金牛座	无	立夏 (5, 6)	无	无	无	祭祀、宴会、安床、沐浴、上表章、上官、竖柱上梁、纳财、牧养、雪冤、赴任、裁制、覃恩、招贤、举正直、纳畜、上册、颁诏、入宅、庆赐、纳采、施恩、临政、搬移、恤孤茕、宣政事	嫁娶、剃头、修置产室、开渠、穿井、安碓硙、平治道涂、破屋坏垣、畋猎、破土、启攒、补垣、修饰垣墙、整容、筑堤防、取鱼
1927-04-24	一九二七 丁卯[兔]年	三月小	廿三	周日	丁卯 甲辰 戊子 丁巳	兔	金牛座	无	立夏 (5, 6)	无	无	无	祭祀、结婚姻、宴会、嫁娶、沐浴、上官、入学、进人口、竖柱上梁、经络、开市、纳财、牧养、立券交易、赴任、裁制、诉讼、举正直、选将、纳畜、出师、祈福、酝酿、庆赐、纳采、施恩、临政、安抚边境	求医疗病、修置产室、开渠、穿井、平治道涂、破屋坏垣、破土、启攒、乘船渡水、远回、修饰垣墙、补垣、整手足甲、营建
1927-04-25	一九二七 丁卯[兔]年	三月小	廿四	周一	丁卯 甲辰 己丑 己巳	兔	金牛座	无	立夏 (5, 6)	无	无	无	进人口、纳财、捕捉、纳畜、取鱼	出行、结婚姻、宴会、安床、修造、求医疗病、上表章、上官、冠带、竖柱上梁、经络、开市、修置产室、开渠、穿井、安碓硙、平治道涂、破屋坏垣、栽种、破土、安葬、启攒、立券交易、裁制、缮城郭、招贤、布政事、举正直、上册、颁诏、修饰垣墙、酝酿、庆赐、开仓、鼓铸、补垣、解除、修宫室、施恩、纳采、修仓库、临政、搬移、营建、筑堤防、宣政事
1927-04-26	一九二七 丁卯[兔]年	三月小	廿五	周二	丁卯 甲辰 庚寅 辛巳	兔	金牛座	无	立夏 (5, 6)	无	无	无	出行、结婚姻、宴会、求医疗病、上表章、上官、入学、竖柱上梁、开市、纳财、牧养、立券交易、雪冤、裁制、覃恩、招贤、举正直、选将、上册、颁诏、祈福、庆赐、开仓、解除、施恩、纳采、临政、搬移、求嗣、恤孤茕、宣政事、安抚边境	祭祀、嫁娶、平治道涂、破屋坏垣、伐木、畋猎、补垣、针刺、修饰垣墙、出师、乘船渡水、取鱼、筑堤防、营建
1927-04-27	一九二七 丁卯[兔]年	三月小	廿六	周三	丁卯 甲辰 辛卯 癸巳	兔	金牛座	无	立夏 (5, 6)	无	无	无	塞穴	出行、结婚姻、宴会、嫁娶、安床、修造、求医疗病、上表章、上官、冠带、进人口、竖柱上梁、经络、开市、纳财、修置产室、开渠、穿井、安碓硙、平治道涂、破屋坏垣、栽种、牧养、破土、安葬、启攒、立券交易、疗目、针刺、缮城郭、招贤、布政事、举正直、选将、纳畜、上册、颁诏、修饰垣墙、出师、祈福、酝酿、庆赐、开仓、补垣、修宫室、施恩、纳采、解除、修仓库、临政、搬移、营建、筑堤防、宣政事、求嗣、安抚边境
1927-04-28	一九二七 丁卯[兔]年	三月小	廿七	周四	丁卯 甲辰 壬辰 乙巳	兔	金牛座	无	立夏 (5, 6)	无	七殿泰山王诞	无	祭祀、雪冤、覃恩、入宅、恤孤茕	安床、剃头、冠带、开市、修置产室、开渠、穿井、平治道涂、破屋坏垣、伐木、畋猎、破土、启攒、布政事、塞穴、取鱼、修饰垣墙、整容、开仓、补垣、鼓铸、整手足甲、筑堤防
1927-04-29	一九二七 丁卯[兔]年	三月小	廿八	周五	丁卯 甲辰 癸巳 丁巳	兔	金牛座	无	立夏 (5, 6)	无	苍颉至圣先师诞	无	沐浴、扫舍宇、雪冤、恤孤茕	出行、结婚姻、宴会、嫁娶、安床、修造、上表章、冠带、进人口、竖柱上梁、修置产室、开渠、穿井、安碓硙、平治道涂、破屋坏垣、破土、安葬、启攒、裁制、缮城郭、招贤、布政事、塞穴、上册、颁诏、修饰垣墙、祈福、庆赐、鼓铸、补垣、纳采、修仓库、搬移、营建、筑堤防、宣政事、求嗣、修宫室
1927-04-30	一九二七 丁卯[兔]年	三月小	廿九	周六	丁卯 甲辰 甲午 己巳	兔	金牛座	无	立夏 (5, 6)	无	无	无	诸事不宜	祭祀、出行、结婚姻、宴会、嫁娶、安床、剃头、修造、求医疗病、上表章、上官、冠带、进人口、竖柱上梁、经络、开市、纳财、修置产室、开渠、穿井、安碓硙、平治道涂、破屋坏垣、栽种、牧养、破土、安葬、启攒、立券交易、裁制、缮城郭、苫盖、招贤、布政事、举正直、选将、塞穴、纳畜、上册、颁诏、修饰垣墙、出师、祈福、入宅、安抚边境、酝酿、庆赐、开仓、整容、鼓铸、补垣、宣政事、解除、修宫室、纳采、施恩、整手足甲、修仓库、临政、搬移、营建、筑堤防、求嗣
