1928-01-01	一九二七 丁卯[兔]年	腊月大	初九	周日	元旦节	无	无	丁卯 壬子 庚子 辛巳	无	小寒 (1, 6)	兔	摩羯座	诸事不宜	诸事不宜
1928-01-02	一九二七 丁卯[兔]年	腊月大	初十	周一	无	无	无	丁卯 壬子 辛丑 癸巳	无	小寒 (1, 6)	兔	摩羯座	祭祀、出行、结婚姻、宴会、嫁娶、沐浴、剃头、上官、进人口、经络、纳财、扫舍宇、安葬、举正直、安抚边境、雪冤、整手足甲、临政、立券交易、祈福、解除、施恩、整容、恤孤茕、选将	修造、冠带、修仓库
1928-01-03	一九二七 丁卯[兔]年	腊月大	十一	周二	无	无	无	丁卯 壬子 壬寅 乙巳	无	小寒 (1, 6)	兔	摩羯座	宴会、嫁娶、修造、上表章、进人口、竖柱上梁、经络、开市、纳财、栽种、牧养、出师、纳畜、颁诏、补垣、安抚边境、雪冤、缮城郭、裁制、宣政事、立券交易、祈福、入宅、塞穴、解除、求嗣、覃恩、上册、庆赐、恤孤茕、修宫室、选将、营建	祭祀、开渠、穿井、畋猎、取鱼、远回
1928-01-04	一九二七 丁卯[兔]年	腊月大	十二	周三	无	无	无	丁卯 壬子 癸卯 丁巳	无	小寒 (1, 6)	兔	摩羯座	诸事不宜	诸事不宜
1928-01-05	一九二七 丁卯[兔]年	腊月大	十三	周四	无	无	无	丁卯 壬子 甲辰 己巳	无	小寒 (1, 6)	兔	摩羯座	祭祀、出行、宴会、修造、上官、冠带、进人口、竖柱上梁、经络、安碓硙、牧养、安葬、赴任、纳畜、纳采、举正直、缮城郭、裁制、临政、诉讼、酝酿、祈福、施恩、求嗣、庆赐、修宫室、搬移	修置产室
1928-01-06	一九二七 丁卯[兔]年	腊月大	十四	周五	无	无	无	丁卯 癸丑 乙巳 辛巳	小寒	大寒 (1, 21)	兔	摩羯座	祭祀、结婚姻、宴会、修造、上官、冠带、竖柱上梁、经络、安碓硙、牧养、纳畜、颁诏、纳采、举正直、雪冤、缮城郭、裁制、宣政事、临政、酝酿、招贤、祈福、施恩、求嗣、覃恩、庆赐、恤孤茕、修宫室、营建、搬移	出行、修置产室、畋猎、破土、启攒、乘船渡水、鼓铸、取鱼、塞穴、补垣
1928-01-07	一九二七 丁卯[兔]年	腊月大	十五	周六	无	无	无	丁卯 癸丑 丙午 癸巳	无	大寒 (1, 21)	兔	摩羯座	沐浴、捕捉、畋猎、赴任、诉讼	出行、结婚姻、宴会、嫁娶、安床、剃头、修造、求医疗病、上表章、上官、冠带、进人口、竖柱上梁、经络、开市、纳财、修置产室、开渠、穿井、安碓硙、栽种、牧养、破土、安葬、启攒、布政事、出师、纳畜、取鱼、颁诏、纳采、补垣、举正直、苫盖、安抚边境、修仓库、整手足甲、缮城郭、鼓铸、裁制、宣政事、临政、乘船渡水、酝酿、立券交易、招贤、开仓、祈福、解除、施恩、筑堤防、求嗣、塞穴、修饰垣墙、上册、庆赐、整容、修宫室、选将、营建、搬移
1928-01-08	一九二七 丁卯[兔]年	腊月大	十六	周日	无	南岳大帝诞	无	丁卯 癸丑 丁未 乙巳	无	大寒 (1, 21)	兔	摩羯座	破屋坏垣、赴任、入宅	祭祀、结婚姻、宴会、剃头、上表章、上官、冠带、竖柱上梁、修置产室、开渠、穿井、安碓硙、伐木、栽种、牧养、安葬、启攒、布政事、纳畜、颁诏、补垣、举正直、安抚边境、修仓库、整手足甲、缮城郭、鼓铸、裁制、宣政事、临政、招贤、开仓、祈福、筑堤防、施恩、塞穴、求嗣、修饰垣墙、上册、庆赐、整容、修宫室、选将、营建、出师
1928-01-09	一九二七 丁卯[兔]年	腊月大	十七	周一	无	无	无	丁卯 癸丑 戊申 丁巳	无	大寒 (1, 21)	兔	摩羯座	祭祀、嫁娶、沐浴、剃头、经络、开市、纳财、扫舍宇、伐木、畋猎、栽种、牧养、破土、纳畜、安抚边境、整手足甲、酝酿、开仓、整容、选将	结婚姻、宴会、庆赐、求嗣、纳采
1928-01-10	一九二七 丁卯[兔]年	腊月大	十八	周二	无	无	无	丁卯 癸丑 己酉 己巳	无	大寒 (1, 21)	兔	摩羯座	沐浴、剃头、求医疗病、上表章、上官、入学、进人口、竖柱上梁、经络、开市、纳财、安碓硙、扫舍宇、栽种、牧养、布政事、举正直、修仓库、雪冤、整手足甲、缮城郭、裁制、临政、酝酿、筑堤防、施恩、解除、覃恩、上册、整容、修宫室、恤孤茕	宴会、畋猎、苫盖、选将、出师
1928-01-11	一九二七 丁卯[兔]年	腊月大	十九	周三	无	无	无	丁卯 癸丑 庚戌 辛巳	无	大寒 (1, 21)	兔	摩羯座	祭祀、捕捉、雪冤、覃恩、恤孤茕	安床、剃头、冠带、经络、开市、立券、修置产室、开渠、穿井、安碓硙、破屋坏垣、破土、启攒、取鱼、补垣、开张、整手足甲、鼓铸、酝酿、立券交易、开仓、筑堤防、塞穴、修饰垣墙、整容、修宫室
1928-01-12	一九二七 丁卯[兔]年	腊月大	二十	周四	无	无	无	丁卯 癸丑 辛亥 癸巳	无	大寒 (1, 21)	兔	摩羯座	沐浴、入学、雪冤、恤孤茕、覃恩	祭祀、出行、结婚姻、宴会、嫁娶、安床、剃头、修造、求医疗病、上表章、上官、冠带、进人口、竖柱上梁、经络、开市、纳财、修置产室、开渠、穿井、安碓硙、平治道涂、破屋坏垣、伐木、畋猎、栽种、牧养、破土、安葬、启攒、布政事、纳畜、取鱼、颁诏、补垣、纳采、举正直、安抚边境、修仓库、整手足甲、缮城郭、鼓铸、裁制、宣政事、临政、酝酿、立券交易、招贤、开仓、祈福、解除、施恩、筑堤防、求嗣、塞穴、修饰垣墙、上册、庆赐、整容、修宫室、选将、营建、远回、出师、搬移
1928-01-13	一九二七 丁卯[兔]年	腊月大	廿一	周五	无	天猷上帝诞	无	丁卯 癸丑 壬子 乙巳	无	大寒 (1, 21)	兔	摩羯座	祭祀、沐浴、经络、雪冤、酝酿、入宅、塞穴、覃恩、恤孤茕	出行、安床、上表章、冠带、竖柱上梁、开市、修置产室、开渠、穿井、安碓硙、平治道涂、破屋坏垣、栽种、牧养、安葬、颁诏、举正直、安抚边境、修仓库、整手足甲、缮城郭、宣政事、针刺、招贤、开仓、解除、施恩、修饰垣墙、上册、修宫室、选将、营建、远回、出师、疗目
1928-01-14	一九二七 丁卯[兔]年	腊月大	廿二	周六	无	无	无	丁卯 癸丑 癸丑 丁巳	无	大寒 (1, 21)	兔	摩羯座	宴会、经络、纳财、布政事、纳畜、举正直、雪冤、裁制、酝酿、立券交易、施恩、覃恩、庆赐、恤孤茕	剃头、求医疗病、上表章、冠带、修置产室、开渠、穿井、平治道涂、破屋坏垣、伐木、捕捉、畋猎、栽种、破土、安葬、启攒、取鱼、颁诏、补垣、整手足甲、宣政事、开仓、祈福、解除、筑堤防、求嗣、修饰垣墙、上册、整容、营建、搬移
1928-01-15	一九二七 丁卯[兔]年	腊月大	廿三	周日	无	小年	无	丁卯 癸丑 甲寅 己巳	无	大寒 (1, 21)	兔	摩羯座	沐浴、扫舍宇	祭祀、开渠、穿井、布政事、取鱼、颁诏、补垣、宣政事、乘船渡水、招贤、筑堤防、塞穴、上册、营建
1928-01-16	一九二七 丁卯[兔]年	腊月大	廿四	周一	无	子时灶君上天朝玉帝	无	丁卯 癸丑 乙卯 辛巳	无	大寒 (1, 21)	兔	摩羯座	出行、结婚姻、宴会、嫁娶、修造、求医疗病、上表章、上官、进人口、竖柱上梁、经络、开市、纳财、栽种、牧养、安葬、出师、纳畜、颁诏、纳采、补垣、举正直、安抚边境、修仓库、雪冤、缮城郭、裁制、宣政事、临政、立券交易、招贤、开仓、祈福、解除、施恩、塞穴、求嗣、覃恩、上册、庆赐、恤孤茕、修宫室、选将、营建、搬移	祭祀、剃头、冠带、修置产室、开渠、穿井、安碓硙、破屋坏垣、畋猎、布政事、整容、整手足甲、鼓铸、取鱼、入宅、筑堤防、修饰垣墙
1928-01-17	一九二七 丁卯[兔]年	腊月大	廿五	周二	无	无	无	丁卯 癸丑 丙辰 癸巳	无	大寒 (1, 21)	兔	摩羯座	诸事不宜	诸事不宜
1928-01-18	一九二七 丁卯[兔]年	腊月大	廿六	周三	无	无	无	丁卯 癸丑 丁巳 乙巳	无	大寒 (1, 21)	兔	摩羯座	赴任、入宅	出行、剃头、求医疗病、上表章、上官、修置产室、开渠、穿井、平治道涂、破屋坏垣、栽种、牧养、破土、安葬、启攒、布政事、出师、取鱼、颁诏、补垣、举正直、安抚边境、鼓铸、宣政事、乘船渡水、招贤、开仓、祈福、解除、施恩、筑堤防、塞穴、求嗣、修饰垣墙、上册、整容、选将、营建
1928-01-19	一九二七 丁卯[兔]年	腊月大	廿七	周四	无	无	无	丁卯 癸丑 戊午 丁巳	无	大寒 (1, 21)	兔	摩羯座	沐浴、剃头、捕捉、畋猎、赴任、整容、诉讼、整手足甲	出行、结婚姻、宴会、嫁娶、安床、修造、求医疗病、上表章、上官、冠带、进人口、竖柱上梁、经络、开市、纳财、修置产室、开渠、穿井、安碓硙、平治道涂、破屋坏垣、栽种、牧养、破土、安葬、启攒、出师、纳畜、取鱼、纳采、补垣、举正直、苫盖、安抚边境、修仓库、缮城郭、临政、乘船渡水、酝酿、立券交易、招贤、开仓、祈福、解除、施恩、筑堤防、求嗣、修饰垣墙、上册、庆赐、修宫室、选将、营建、搬移
1928-01-20	一九二七 丁卯[兔]年	腊月大	廿八	周五	无	无	无	丁卯 癸丑 己未 己巳	无	大寒 (1, 21)	兔	水瓶座	诸事不宜	祭祀、出行、结婚姻、宴会、嫁娶、安床、剃头、修造、上表章、上官、冠带、进人口、竖柱上梁、经络、开市、纳财、修置产室、开渠、穿井、安碓硙、平治道涂、伐木、栽种、牧养、破土、安葬、启攒、布政事、纳畜、颁诏、纳采、补垣、举正直、安抚边境、修仓库、整手足甲、缮城郭、鼓铸、裁制、宣政事、临政、酝酿、立券交易、招贤、开仓、祈福、筑堤防、施恩、求嗣、塞穴、修饰垣墙、上册、庆赐、整容、修宫室、选将、营建、出师、搬移
1928-01-21	一九二七 丁卯[兔]年	腊月大	廿九	周六	无	华严菩萨诞	无	丁卯 癸丑 庚申 辛巳	大寒	立春 (2, 5)	兔	水瓶座	祭祀、出行、沐浴、剃头、上表章、上官、竖柱上梁、开市、纳财、扫舍宇、伐木、牧养、安葬、纳畜、颁诏、举正直、雪冤、整手足甲、裁制、宣政事、临政、酝酿、招贤、开仓、施恩、覃恩、上册、整容、恤孤茕、搬移	修置产室、开渠、穿井、安碓硙、平治道涂、破屋坏垣、取鱼、补垣、筑堤防、修饰垣墙、修宫室
1928-01-22	一九二七 丁卯[兔]年	腊月大	三十	周日	无	除夕	无	丁卯 癸丑 辛酉 癸巳	无	立春 (2, 5)	兔	水瓶座	祭祀、沐浴、剃头、求医疗病、上表章、上官、入学、进人口、竖柱上梁、经络、扫舍宇、牧养、安葬、举正直、整手足甲、裁制、临政、施恩、祈福、解除、求嗣、上册、整容	宴会、修置产室、开渠、穿井、平治道涂、破屋坏垣、畋猎、苫盖、选将、营建、出师、补垣、修饰垣墙
1928-01-23	一九二八 戊辰[龙]年	正月小	初一	周一	春节	弥勒佛圣诞	无	戊辰 癸丑 壬戌 乙巳	无	立春 (2, 5)	龙	水瓶座	祭祀、捕捉、畋猎	出行、结婚姻、宴会、嫁娶、安床、剃头、修造、求医疗病、上表章、上官、冠带、进人口、竖柱上梁、经络、开市、纳财、修置产室、开渠、穿井、安碓硙、平治道涂、破屋坏垣、栽种、牧养、破土、安葬、启攒、布政事、纳畜、颁诏、补垣、纳采、举正直、安抚边境、修仓库、整手足甲、缮城郭、鼓铸、裁制、宣政事、临政、酝酿、立券交易、招贤、开仓、祈福、解除、施恩、筑堤防、求嗣、塞穴、修饰垣墙、上册、庆赐、整容、修宫室、选将、营建、出师、搬移
1928-01-24	一九二八 戊辰[龙]年	正月小	初二	周二	无	无	无	戊辰 癸丑 癸亥 丁巳	无	立春 (2, 5)	龙	水瓶座	祭祀、出行、宴会、沐浴、修造、求医疗病、上表章、上官、入学、开市、修置产室、开渠、穿井、安碓硙、栽种、牧养、赴任、纳采、安抚边境、修仓库、雪冤、缮城郭、裁制、临政、祈福、解除、入宅、求嗣、覃恩、上册、庆赐、恤孤茕、修宫室、选将、搬移	结婚姻、嫁娶、剃头、冠带、竖柱上梁、平治道涂、破屋坏垣、伐木、畋猎、破土、安葬、启攒、布政事、纳畜、取鱼、补垣、整手足甲、鼓铸、开仓、筑堤防、塞穴、修饰垣墙、整容、营建、远回、出师
1928-01-25	一九二八 戊辰[龙]年	正月小	初三	周三	无	无	无	戊辰 癸丑 甲子 己巳	无	立春 (2, 5)	龙	水瓶座	祭祀、沐浴、经络、安葬、雪冤、裁制、酝酿、塞穴、覃恩、恤孤茕	出行、结婚姻、宴会、嫁娶、安床、修造、求医疗病、上表章、上官、冠带、进人口、竖柱上梁、开市、纳财、修置产室、开渠、穿井、安碓硙、平治道涂、破屋坏垣、畋猎、栽种、牧养、破土、布政事、纳畜、取鱼、颁诏、纳采、举正直、补垣、安抚边境、修仓库、缮城郭、宣政事、临政、针刺、立券交易、招贤、开仓、祈福、解除、施恩、筑堤防、求嗣、修饰垣墙、上册、庆赐、修宫室、选将、营建、远回、出师、疗目、搬移
1928-01-26	一九二八 戊辰[龙]年	正月小	初四	周四	无	无	无	戊辰 癸丑 乙丑 辛巳	无	立春 (2, 5)	龙	水瓶座	祭祀、宴会、经络、纳财、牧养、布政事、纳畜、举正直、雪冤、裁制、酝酿、立券交易、施恩、覃恩、庆赐、恤孤茕	剃头、冠带、修置产室、开渠、穿井、平治道涂、破屋坏垣、伐木、捕捉、畋猎、破土、启攒、整容、整手足甲、取鱼、筑堤防、补垣、修饰垣墙
1928-01-27	一九二八 戊辰[龙]年	正月小	初五	周五	无	无	无	戊辰 癸丑 丙寅 癸巳	无	立春 (2, 5)	龙	水瓶座	沐浴、扫舍宇、雪冤、覃恩、恤孤茕	祭祀、上表章、开渠、穿井、安葬、颁诏、补垣、宣政事、乘船渡水、招贤、筑堤防、塞穴、上册、营建
1928-01-28	一九二八 戊辰[龙]年	正月小	初六	周六	无	无	无	戊辰 癸丑 丁卯 乙巳	无	立春 (2, 5)	龙	水瓶座	雪冤、覃恩、恤孤茕	祭祀、出行、结婚姻、宴会、嫁娶、安床、剃头、修造、求医疗病、上表章、上官、冠带、进人口、竖柱上梁、经络、开市、纳财、修置产室、开渠、穿井、安碓硙、平治道涂、破屋坏垣、栽种、牧养、破土、安葬、启攒、布政事、纳畜、颁诏、补垣、纳采、举正直、安抚边境、修仓库、整手足甲、缮城郭、鼓铸、裁制、宣政事、临政、酝酿、立券交易、招贤、开仓、入宅、祈福、解除、施恩、筑堤防、求嗣、塞穴、修饰垣墙、上册、庆赐、整容、修宫室、选将、营建、出师、搬移
1928-01-29	一九二八 戊辰[龙]年	正月小	初七	周日	无	无	无	戊辰 癸丑 戊辰 丁巳	无	立春 (2, 5)	龙	水瓶座	雪冤、恤孤茕、入宅、覃恩	出行、结婚姻、宴会、嫁娶、安床、剃头、修造、求医疗病、上表章、上官、冠带、进人口、竖柱上梁、经络、开市、纳财、修置产室、开渠、穿井、安碓硙、平治道涂、破屋坏垣、栽种、牧养、破土、安葬、启攒、布政事、纳畜、颁诏、纳采、补垣、举正直、安抚边境、修仓库、整手足甲、缮城郭、鼓铸、裁制、宣政事、临政、酝酿、立券交易、招贤、开仓、祈福、解除、施恩、筑堤防、求嗣、塞穴、修饰垣墙、上册、庆赐、整容、修宫室、选将、营建、出师、搬移
1928-01-30	一九二八 戊辰[龙]年	正月小	初八	周一	无	五殿阎罗天子诞	无	戊辰 癸丑 己巳 己巳	无	立春 (2, 5)	龙	水瓶座	结婚姻、宴会、冠带、竖柱上梁、经络、纳畜、纳采、裁制、临政、酝酿、庆赐	出行、求医疗病、上表章、开市、修置产室、开渠、穿井、平治道涂、破屋坏垣、栽种、破土、安葬、启攒、取鱼、补垣、安抚边境、鼓铸、乘船渡水、开仓、解除、筑堤防、塞穴、修饰垣墙、上册、选将、营建、出师
1928-01-31	一九二八 戊辰[龙]年	正月小	初九	周二	无	玉皇上帝诞	无	戊辰 癸丑 庚午 辛巳	无	立春 (2, 5)	龙	水瓶座	祭祀、出行、结婚姻、宴会、嫁娶、沐浴、剃头、修造、求医疗病、上表章、上官、竖柱上梁、捕捉、畋猎、栽种、牧养、安葬、赴任、出师、纳畜、颁诏、纳采、举正直、安抚边境、修仓库、雪冤、整手足甲、缮城郭、裁制、宣政事、临政、诉讼、招贤、祈福、解除、施恩、求嗣、覃恩、上册、庆赐、整容、恤孤茕、选将、营建、搬移	安床、冠带、进人口、经络、开市、纳财、修置产室、开渠、穿井、安碓硙、平治道涂、破屋坏垣、启攒、取鱼、补垣、苫盖、乘船渡水、酝酿、立券交易、开仓、筑堤防、修饰垣墙、修宫室
