1934-05-01	一九三四 甲戌[狗]年	三月小	十八	周二	甲戌 戊辰 壬申 乙巳	无	立夏 (5, 6)	国际劳动节	无	无	狗	金牛座	祭祀、沐浴、扫舍宇、覃恩、恤孤茕、雪冤	安床、开市、修置产室、开渠、穿井、平治道涂、破屋坏垣、伐木、捕捉、畋猎、启攒、开仓、补垣、取鱼、布政事、修饰垣墙、塞穴、远回、鼓铸、筑堤防
1934-05-02	一九三四 甲戌[狗]年	三月小	十九	周三	甲戌 戊辰 癸酉 丁巳	无	立夏 (5, 6)	无	中岳大帝诞	无	狗	金牛座	祭祀、结婚姻、嫁娶、沐浴、剃头、求医疗病、上官、进人口、经络、纳财、扫舍宇、捕捉、安葬、祈福、取鱼、整容、安抚边境、立券交易、临政、纳畜、解除、酝酿、整手足甲	出行、宴会、安床、修造、上表章、冠带、竖柱上梁、开市、修置产室、开渠、穿井、安碓硙、平治道涂、破屋坏垣、栽种、牧养、搬移、缮城郭、开仓、上册、修宫室、求嗣、庆赐、补垣、招贤、施恩、修饰垣墙、举正直、乘船渡水、修仓库、选将、营建、纳采、出师、筑堤防
1934-05-03	一九三四 甲戌[狗]年	三月小	二十	周四	甲戌 戊辰 甲戌 己巳	无	立夏 (5, 6)	无	子孙娘娘诞	无	狗	金牛座	祭祀、沐浴、求医疗病、入宅、解除	结婚姻、宴会、安床、上官、冠带、进人口、竖柱上梁、经络、开市、纳财、修置产室、开渠、穿井、安碓硙、平治道涂、伐木、栽种、牧养、破土、安葬、启攒、缮城郭、开仓、上册、裁制、修宫室、颁诏、求嗣、庆赐、补垣、取鱼、招贤、布政事、宣政事、施恩、立券交易、修饰垣墙、临政、纳畜、举正直、塞穴、乘船渡水、修仓库、酝酿、鼓铸、营建、筑堤防
1934-05-04	一九三四 甲戌[狗]年	三月小	廿一	周五	甲戌 戊辰 乙亥 辛巳	无	立夏 (5, 6)	无	无	无	狗	金牛座	安床、沐浴、牧养、取鱼、纳畜	出行、结婚姻、嫁娶、修造、求医疗病、进人口、开市、修置产室、开渠、穿井、安碓硙、平治道涂、破屋坏垣、畋猎、破土、安葬、启攒、祈福、缮城郭、开仓、修宫室、求嗣、补垣、修饰垣墙、立券交易、解除、修仓库、营建、纳采、整手足甲、筑堤防
1934-05-05	一九三四 甲戌[狗]年	三月小	廿二	周六	甲戌 戊辰 丙子 癸巳	无	立夏 (5, 6)	无	无	无	狗	金牛座	宴会、沐浴、上表章、入学、竖柱上梁、经络、纳财、牧养、安葬、诉讼、祈福、开仓、裁制、求嗣、庆赐、施恩、临政、纳畜、举正直、解除、赴任、酝酿、纳采	修置产室、开渠、穿井、平治道涂、破屋坏垣、补垣、远回、营建、修饰垣墙
1934-05-06	一九三四 甲戌[狗]年	三月小	廿三	周日	甲戌 己巳 丁丑 乙巳	立夏	小满 (5, 22)	无	无	无	狗	金牛座	结婚姻、宴会、修造、上表章、上官、入学、进人口、竖柱上梁、经络、开市、纳财、安碓硙、缮城郭、裁制、上册、修宫室、庆赐、施恩、立券交易、临政、纳畜、举正直、修仓库、酝酿、纳采、筑堤防	剃头、求医疗病、冠带、取鱼、整容、远回、选将、整手足甲、出师、乘船渡水
1934-05-07	一九三四 甲戌[狗]年	三月小	廿四	周一	甲戌 己巳 戊寅 丁巳	无	小满 (5, 22)	无	无	无	狗	金牛座	捕捉、诉讼、赴任	祭祀、出行、结婚姻、宴会、嫁娶、安床、剃头、修造、求医疗病、上表章、上官、冠带、进人口、竖柱上梁、经络、开市、纳财、修置产室、开渠、穿井、安碓硙、平治道涂、破屋坏垣、栽种、牧养、破土、安葬、启攒、搬移、祈福、缮城郭、裁制、上册、开仓、修宫室、颁诏、求嗣、庆赐、补垣、招贤、整容、布政事、宣政事、安抚边境、施恩、立券交易、修饰垣墙、临政、纳畜、举正直、解除、塞穴、修仓库、酝酿、选将、鼓铸、营建、纳采、整手足甲、出师、筑堤防
1934-05-08	一九三四 甲戌[狗]年	三月小	廿五	周二	甲戌 己巳 己卯 己巳	无	小满 (5, 22)	无	无	无	狗	金牛座	祭祀、出行、结婚姻、宴会、嫁娶、修造、求医疗病、上表章、上官、入学、竖柱上梁、开市、纳财、修置产室、安碓硙、栽种、牧养、搬移、祈福、缮城郭、开仓、裁制、上册、修宫室、颁诏、求嗣、覃恩、恤孤茕、雪冤、庆赐、招贤、宣政事、入宅、施恩、立券交易、临政、纳畜、举正直、解除、修仓库、赴任、纳采	剃头、冠带、穿井、平治道涂、破屋坏垣、伐木、畋猎、安葬、启攒、补垣、取鱼、整容、安抚边境、修饰垣墙、塞穴、选将、鼓铸、营建、整手足甲、出师、筑堤防
1934-05-09	一九三四 甲戌[狗]年	三月小	廿六	周三	甲戌 己巳 庚辰 辛巳	无	小满 (5, 22)	无	无	无	狗	金牛座	祭祀、覃恩、恤孤茕、雪冤	出行、结婚姻、宴会、嫁娶、安床、剃头、修造、求医疗病、上表章、上官、冠带、进人口、竖柱上梁、经络、开市、纳财、修置产室、开渠、穿井、安碓硙、破屋坏垣、畋猎、栽种、牧养、安葬、搬移、祈福、缮城郭、开仓、上册、修宫室、裁制、颁诏、求嗣、庆赐、补垣、取鱼、针刺、招贤、整容、布政事、宣政事、安抚边境、施恩、疗目、立券交易、临政、修饰垣墙、纳畜、举正直、解除、塞穴、修仓库、酝酿、选将、鼓铸、营建、纳采、整手足甲、出师、筑堤防
1934-05-10	一九三四 甲戌[狗]年	三月小	廿七	周四	甲戌 己巳 辛巳 癸巳	无	小满 (5, 22)	无	七殿泰山王诞	无	狗	金牛座	祭祀、宴会、上官、进人口、经络、纳财、牧养、搬移、裁制、颁诏、覃恩、恤孤茕、雪冤、庆赐、招贤、宣政事、施恩、立券交易、临政、纳畜、举正直	出行、剃头、修置产室、开渠、穿井、平治道涂、破屋坏垣、伐木、畋猎、破土、启攒、补垣、取鱼、整容、整手足甲、筑堤防、开仓、修饰垣墙
1934-05-11	一九三四 甲戌[狗]年	三月小	廿八	周五	甲戌 己巳 壬午 乙巳	无	小满 (5, 22)	无	苍颉至圣先师诞	无	狗	金牛座	祭祀、宴会、沐浴、剃头、扫舍宇、覃恩、恤孤茕、庆赐、雪冤、整容、布政事、整手足甲	结婚姻、嫁娶、安床、修造、上表章、冠带、进人口、竖柱上梁、开市、纳财、修置产室、开渠、穿井、栽种、牧养、搬移、缮城郭、开仓、上册、修宫室、求嗣、取鱼、招贤、立券交易、纳畜、乘船渡水、修仓库、营建、纳采、筑堤防、苫盖
1934-05-12	一九三四 甲戌[狗]年	三月小	廿九	周六	甲戌 己巳 癸未 丁巳	无	小满 (5, 22)	无	无	无	狗	金牛座	覃恩、雪冤、布政事、恤孤茕	祭祀、出行、结婚姻、嫁娶、安床、剃头、修造、上官、冠带、修置产室、开渠、穿井、安碓硙、平治道涂、破屋坏垣、伐木、栽种、牧养、启攒、搬移、颁诏、补垣、取鱼、招贤、整容、宣政事、安抚边境、施恩、修饰垣墙、临政、纳畜、举正直、解除、乘船渡水、酝酿、选将、远回、鼓铸、营建、纳采、整手足甲、出师、筑堤防
1934-05-13	一九三四 甲戌[狗]年	四月大	初一	周日	甲戌 己巳 甲申 己巳	无	小满 (5, 22)	无	八殿都市王诞	无	狗	金牛座	祭祀、结婚姻、宴会、嫁娶、沐浴、剃头、修造、求医疗病、上表章、上官、进人口、经络、开市、纳财、扫舍宇、平治道涂、栽种、牧养、安葬、搬移、祈福、开仓、求嗣、整容、入宅、修饰垣墙、立券交易、临政、纳畜、解除、酝酿、纳采、整手足甲	出行、安床、冠带、竖柱上梁、修置产室、开渠、穿井、安碓硙、破屋坏垣、缮城郭、裁制、上册、修宫室、颁诏、庆赐、补垣、取鱼、针刺、招贤、布政事、宣政事、安抚边境、施恩、举正直、塞穴、乘船渡水、修仓库、选将、鼓铸、营建、出师、筑堤防
1934-05-14	一九三四 甲戌[狗]年	四月大	初二	周一	甲戌 己巳 乙酉 辛巳	无	小满 (5, 22)	无	无	无	狗	金牛座	祭祀、沐浴、剃头、修造、上官、冠带、进人口、竖柱上梁、经络、安碓硙、扫舍宇、牧养、安葬、搬移、祈福、缮城郭、裁制、修宫室、颁诏、求嗣、覃恩、恤孤茕、雪冤、招贤、整容、宣政事、施恩、临政、纳畜、举正直、酝酿、营建、整手足甲	宴会、修置产室、畋猎、取鱼、开仓、苫盖
1934-05-15	一九三四 甲戌[狗]年	四月大	初三	周二	甲戌 己巳 丙戌 癸巳	无	小满 (5, 22)	无	无	无	狗	金牛座	祭祀、宴会、沐浴、剃头、上表章、捕捉、祈福、裁制、上册、颁诏、求嗣、覃恩、恤孤茕、雪冤、庆赐、招贤、整容、宣政事、施恩、举正直、整手足甲	冠带、修置产室、畋猎、破土、启攒、取鱼、筑堤防、开仓、修宫室
1934-05-16	一九三四 甲戌[狗]年	四月大	初四	周三	甲戌 己巳 丁亥 乙巳	无	小满 (5, 22)	无	文殊菩萨诞	无	狗	金牛座	沐浴、破屋坏垣	祭祀、结婚姻、宴会、嫁娶、安床、剃头、修造、上表章、上官、冠带、竖柱上梁、经络、开市、修置产室、开渠、穿井、安碓硙、伐木、捕捉、畋猎、栽种、牧养、破土、安葬、启攒、祈福、缮城郭、开仓、裁制、上册、修宫室、颁诏、求嗣、庆赐、补垣、取鱼、招贤、整容、布政事、宣政事、施恩、立券交易、修饰垣墙、临政、举正直、塞穴、修仓库、酝酿、鼓铸、营建、纳采、整手足甲、筑堤防
1934-05-17	一九三四 甲戌[狗]年	四月大	初五	周四	甲戌 己巳 戊子 丁巳	无	小满 (5, 22)	无	无	无	狗	金牛座	祭祀、宴会、沐浴、裁制、庆赐	上表章、冠带、修置产室、安葬、纳畜、招贤、营建、筑堤防、乘船渡水、上册、修仓库
1934-05-18	一九三四 甲戌[狗]年	四月大	初六	周五	甲戌 己巳 己丑 己巳	无	小满 (5, 22)	无	无	无	狗	金牛座	祭祀、出行、结婚姻、宴会、求医疗病、上表章、上官、入学、进人口、竖柱上梁、经络、开市、纳财、牧养、祈福、开仓、裁制、上册、求嗣、庆赐、入宅、立券交易、施恩、临政、纳畜、举正直、解除、赴任、酝酿、纳采	冠带、修置产室、开渠、穿井、平治道涂、破屋坏垣、破土、补垣、取鱼、选将、远回、营建、整手足甲、出师、乘船渡水、修饰垣墙
1934-05-19	一九三四 甲戌[狗]年	四月大	初七	周六	甲戌 己巳 庚寅 辛巳	无	小满 (5, 22)	无	无	无	狗	金牛座	出行、结婚姻、宴会、嫁娶、修造、求医疗病、上表章、上官、进人口、竖柱上梁、纳财、捕捉、栽种、牧养、安葬、诉讼、搬移、祈福、缮城郭、裁制、上册、颁诏、求嗣、覃恩、恤孤茕、雪冤、庆赐、招贤、宣政事、安抚边境、施恩、立券交易、临政、纳畜、举正直、解除、修仓库、赴任、选将、营建、纳采、出师	祭祀、安床、剃头、冠带、经络、开市、立券、修置产室、开渠、穿井、安碓硙、平治道涂、破屋坏垣、畋猎、启攒、开仓、修宫室、补垣、取鱼、整容、布政事、修饰垣墙、开张、塞穴、酝酿、鼓铸、整手足甲、筑堤防
1934-05-20	一九三四 甲戌[狗]年	四月大	初八	周日	甲戌 己巳 辛卯 癸巳	无	小满 (5, 22)	无	释迦牟尼佛诞	无	狗	金牛座	祭祀、出行、结婚姻、宴会、嫁娶、修造、求医疗病、上表章、上官、入学、竖柱上梁、开市、纳财、修置产室、安碓硙、栽种、牧养、搬移、祈福、缮城郭、裁制、上册、修宫室、颁诏、求嗣、覃恩、恤孤茕、雪冤、庆赐、招贤、宣政事、安抚边境、施恩、立券交易、临政、纳畜、举正直、解除、修仓库、选将、营建、纳采、出师	安床、剃头、冠带、进人口、经络、穿井、破屋坏垣、伐木、畋猎、开仓、补垣、取鱼、整容、布政事、入宅、修饰垣墙、塞穴、酝酿、鼓铸、整手足甲、筑堤防
1934-05-21	一九三四 甲戌[狗]年	四月大	初九	周一	甲戌 己巳 壬辰 乙巳	无	小满 (5, 22)	无	无	无	狗	双子座	诸事不宜	诸事不宜
1934-05-22	一九三四 甲戌[狗]年	四月大	初十	周二	甲戌 己巳 癸巳 丁巳	小满	芒种 (6, 6)	无	无	无	狗	双子座	宴会、上官、进人口、经络、纳财、裁制、颁诏、覃恩、庆赐、恤孤茕、雪冤、招贤、宣政事、安抚边境、施恩、立券交易、临政、纳畜、举正直、酝酿、选将	出行、剃头、求医疗病、上表章、修置产室、开渠、穿井、平治道涂、破屋坏垣、伐木、畋猎、栽种、破土、安葬、启攒、祈福、开仓、上册、求嗣、补垣、整容、修饰垣墙、解除、营建、整手足甲、筑堤防
1934-05-23	一九三四 甲戌[狗]年	四月大	十一	周三	甲戌 己巳 甲午 己巳	无	芒种 (6, 6)	无	无	无	狗	双子座	祭祀、宴会、沐浴、剃头、扫舍宇、安葬、裁制、颁诏、覃恩、恤孤茕、雪冤、庆赐、整容、入宅、宣政事、整手足甲	冠带、修置产室、畋猎、取鱼、苫盖、乘船渡水、筑堤防、开仓、修宫室
1934-05-24	一九三四 甲戌[狗]年	四月大	十二	周四	甲戌 己巳 乙未 辛巳	无	芒种 (6, 6)	无	无	无	狗	双子座	覃恩、雪冤、恤孤茕	祭祀、剃头、冠带、修置产室、开渠、穿井、安碓硙、平治道涂、破屋坏垣、伐木、畋猎、启攒、补垣、取鱼、整容、布政事、修饰垣墙、乘船渡水、远回、鼓铸、整手足甲、筑堤防
1934-05-25	一九三四 甲戌[狗]年	四月大	十三	周五	甲戌 己巳 丙申 癸巳	无	芒种 (6, 6)	无	无	无	狗	双子座	祭祀、出行、结婚姻、宴会、嫁娶、沐浴、剃头、修造、求医疗病、上表章、上官、进人口、竖柱上梁、经络、开市、纳财、扫舍宇、平治道涂、栽种、牧养、安葬、搬移、祈福、缮城郭、开仓、裁制、上册、颁诏、求嗣、覃恩、恤孤茕、雪冤、庆赐、招贤、整容、宣政事、安抚边境、施恩、修饰垣墙、立券交易、临政、纳畜、举正直、解除、修仓库、酝酿、选将、营建、纳采、整手足甲、出师	诸事不忌
1934-05-26	一九三四 甲戌[狗]年	四月大	十四	周六	甲戌 己巳 丁酉 乙巳	无	芒种 (6, 6)	无	纯阳祖师诞	无	狗	双子座	沐浴、修造、冠带、进人口、竖柱上梁、经络、安碓硙、扫舍宇、牧养、安葬、搬移、缮城郭、裁制、修宫室、纳畜、酝酿、整手足甲	出行、宴会、剃头、上表章、修置产室、乘船渡水、开仓、上册、苫盖
1934-05-27	一九三四 甲戌[狗]年	四月大	十五	周日	甲戌 己巳 戊戌 丁巳	无	芒种 (6, 6)	无	钟离祖师诞	无	狗	双子座	祭祀、结婚姻、宴会、嫁娶、沐浴、修造、上表章、上官、竖柱上梁、纳财、捕捉、栽种、牧养、搬移、祈福、缮城郭、裁制、修宫室、求嗣、庆赐、施恩、临政、举正直、解除、纳采	修仓库
1934-05-28	一九三四 甲戌[狗]年	四月大	十六	周一	甲戌 己巳 己亥 己巳	无	芒种 (6, 6)	无	无	无	狗	双子座	沐浴、破屋坏垣、入宅、解除、赴任	嫁娶、剃头、上表章、冠带、修置产室、开渠、穿井、安碓硙、伐木、捕捉、畋猎、破土、安葬、启攒、上册、颁诏、补垣、取鱼、招贤、整容、布政事、宣政事、修饰垣墙、塞穴、修仓库、鼓铸、营建、整手足甲、筑堤防
1934-05-29	一九三四 甲戌[狗]年	四月大	十七	周二	甲戌 己巳 庚子 辛巳	无	芒种 (6, 6)	无	十殿转轮王诞	无	狗	双子座	祭祀、宴会、沐浴、裁制、颁诏、覃恩、恤孤茕、雪冤、庆赐、宣政事	冠带、进人口、经络、开市、纳财、修置产室、畋猎、开仓、修宫室、取鱼、立券交易、筑堤防
1934-05-30	一九三四 甲戌[狗]年	四月大	十八	周三	甲戌 己巳 辛丑 癸巳	无	芒种 (6, 6)	无	紫徽大帝诞	无	狗	双子座	祭祀、出行、宴会、修造、求医疗病、上表章、上官、入学、进人口、竖柱上梁、经络、开市、纳财、安碓硙、栽种、牧养、安葬、祈福、缮城郭、裁制、上册、修宫室、颁诏、求嗣、覃恩、恤孤茕、雪冤、庆赐、招贤、宣政事、施恩、立券交易、临政、纳畜、举正直、解除、修仓库、营建、纳采、筑堤防	冠带、畋猎、取鱼、远回、乘船渡水
1934-05-31	一九三四 甲戌[狗]年	四月大	十九	周四	甲戌 己巳 壬寅 乙巳	无	芒种 (6, 6)	无	无	无	狗	双子座	捕捉、诉讼、赴任	祭祀、出行、结婚姻、宴会、嫁娶、安床、剃头、修造、求医疗病、上表章、上官、冠带、进人口、竖柱上梁、经络、开市、纳财、修置产室、开渠、穿井、安碓硙、平治道涂、破屋坏垣、栽种、牧养、破土、安葬、启攒、搬移、祈福、缮城郭、裁制、上册、开仓、修宫室、颁诏、求嗣、庆赐、补垣、招贤、整容、布政事、宣政事、安抚边境、施恩、立券交易、修饰垣墙、临政、纳畜、举正直、解除、塞穴、修仓库、酝酿、选将、鼓铸、营建、纳采、整手足甲、出师、筑堤防
