1935-10-01	一九三五 乙亥[猪]年	九月小	初四	周二	乙亥 乙酉 庚戌 辛巳	无	寒露 (10, 9)	无	无	无	猪	天秤座	祭祀、出行、结婚姻、宴会、嫁娶、沐浴、剃头、修造、求医疗病、上表章、上官、竖柱上梁、纳财、扫舍宇、栽种、牧养、安葬、诉讼、搬移、祈福、缮城郭、裁制、上册、颁诏、求嗣、覃恩、恤孤茕、雪冤、庆赐、招贤、整容、入宅、宣政事、安抚边境、施恩、临政、纳畜、举正直、解除、修仓库、赴任、选将、营建、纳采、整手足甲、出师	进人口、经络、开市、修置产室、畋猎、破土、启攒、开仓、取鱼、针刺、立券交易、酝酿
1935-10-02	一九三五 乙亥[猪]年	九月小	初五	周三	乙亥 乙酉 辛亥 癸巳	无	寒露 (10, 9)	无	无	无	猪	天秤座	宴会、沐浴、上表章、竖柱上梁、经络、缮城郭、裁制、上册、修宫室、覃恩、恤孤茕、补垣、雪冤、庆赐、布政事、塞穴	祭祀、结婚姻、嫁娶、修造、破土、安葬、启攒、招贤、纳畜、酝酿、选将、安抚边境、举正直、纳采、出师、乘船渡水、施恩
1935-10-03	一九三五 乙亥[猪]年	九月小	初六	周四	乙亥 乙酉 壬子 乙巳	无	寒露 (10, 9)	无	无	无	猪	天秤座	祭祀、沐浴、平治道涂、覃恩、恤孤茕、雪冤、修饰垣墙	出行、结婚姻、宴会、嫁娶、安床、修造、求医疗病、上表章、上官、冠带、进人口、竖柱上梁、经络、开市、纳财、修置产室、开渠、穿井、捕捉、畋猎、栽种、牧养、破土、安葬、启攒、搬移、祈福、缮城郭、开仓、裁制、上册、修宫室、颁诏、求嗣、庆赐、取鱼、招贤、布政事、宣政事、安抚边境、施恩、立券交易、临政、纳畜、举正直、解除、修仓库、酝酿、选将、鼓铸、营建、纳采、整手足甲、出师、筑堤防
1935-10-04	一九三五 乙亥[猪]年	九月小	初七	周五	乙亥 乙酉 癸丑 丁巳	无	寒露 (10, 9)	无	无	无	猪	天秤座	祭祀、出行、宴会、修造、上官、进人口、竖柱上梁、经络、安碓硙、牧养、搬移、祈福、缮城郭、裁制、修宫室、求嗣、庆赐、覃恩、恤孤茕、雪冤、布政事、施恩、临政、纳畜、举正直、酝酿	上表章、修置产室、选将、安抚边境、出师、上册
1935-10-05	一九三五 乙亥[猪]年	九月小	初八	周六	乙亥 乙酉 甲寅 己巳	无	寒露 (10, 9)	无	无	无	猪	天秤座	沐浴、捕捉、覃恩、恤孤茕、雪冤	祭祀、安床、冠带、进人口、经络、开市、纳财、修置产室、开渠、穿井、安碓硙、破屋坏垣、畋猎、开仓、修宫室、补垣、取鱼、布政事、修饰垣墙、塞穴、酝酿、远回、鼓铸、筑堤防
1935-10-06	一九三五 乙亥[猪]年	九月小	初九	周日	乙亥 乙酉 乙卯 辛巳	无	寒露 (10, 9)	无	重阳节-酆都大帝诞	无	猪	天秤座	诸事不宜	诸事不宜
1935-10-07	一九三五 乙亥[猪]年	九月小	初十	周一	乙亥 乙酉 丙辰 癸巳	无	寒露 (10, 9)	无	无	无	猪	天秤座	祭祀、覃恩、恤孤茕、雪冤	剃头、求医疗病、开渠、穿井、开仓、补垣、整容、布政事、解除、塞穴、出师、筑堤防
1935-10-08	一九三五 乙亥[猪]年	九月小	十一	周二	乙亥 乙酉 丁巳 乙巳	无	寒露 (10, 9)	无	无	无	猪	天秤座	祭祀、结婚姻、宴会、上表章、上官、入学、进人口、竖柱上梁、经络、开市、纳财、祈福、裁制、上册、庆赐、施恩、立券交易、临政、纳畜、举正直、酝酿、纳采	出行、剃头、修置产室、开渠、穿井、平治道涂、破屋坏垣、栽种、破土、安葬、启攒、补垣、整容、营建、修饰垣墙
1935-10-09	一九三五 乙亥[猪]年	九月小	十二	周三	乙亥 丙戌 戊午 丁巳	寒露	霜降 (10, 24)	无	无	无	猪	天秤座	出行、结婚姻、宴会、嫁娶、修造、上官、入学、进人口、竖柱上梁、经络、安碓硙、搬移、缮城郭、裁制、修宫室、庆赐、施恩、临政、纳畜、举正直、酝酿、纳采、筑堤防	剃头、破土、安葬、启攒、整容、开仓、苫盖
1935-10-10	一九三五 乙亥[猪]年	九月小	十三	周四	乙亥 丙戌 己未 己巳	无	霜降 (10, 24)	无	孟婆尊神诞	无	猪	天秤座	捕捉	出行、结婚姻、宴会、嫁娶、安床、剃头、修造、求医疗病、上表章、上官、冠带、进人口、竖柱上梁、经络、开市、纳财、修置产室、开渠、穿井、安碓硙、破屋坏垣、栽种、牧养、破土、安葬、启攒、搬移、祈福、缮城郭、开仓、裁制、上册、修宫室、颁诏、求嗣、庆赐、补垣、招贤、整容、布政事、宣政事、安抚边境、施恩、立券交易、修饰垣墙、临政、纳畜、举正直、解除、塞穴、修仓库、酝酿、选将、鼓铸、营建、纳采、整手足甲、出师、筑堤防
1935-10-11	一九三五 乙亥[猪]年	九月小	十四	周五	乙亥 丙戌 庚申 辛巳	无	霜降 (10, 24)	无	无	无	猪	天秤座	沐浴、剃头、求医疗病、上表章、上官、入学、竖柱上梁、开市、纳财、修置产室、开渠、穿井、安碓硙、扫舍宇、栽种、牧养、搬移、祈福、缮城郭、开仓、裁制、上册、修宫室、颁诏、求嗣、覃恩、恤孤茕、雪冤、招贤、整容、宣政事、入宅、施恩、临政、举正直、解除、整手足甲	伐木、畋猎、取鱼、出师、乘船渡水
1935-10-12	一九三五 乙亥[猪]年	九月小	十五	周六	乙亥 丙戌 辛酉 癸巳	无	霜降 (10, 24)	无	无	无	猪	天秤座	祭祀、沐浴、扫舍宇、裁制、覃恩、补垣、恤孤茕、雪冤、塞穴	宴会、冠带、修置产室、开渠、穿井、畋猎、启攒、取鱼、针刺、修宫室、布政事、开仓、疗目
1935-10-13	一九三五 乙亥[猪]年	九月小	十六	周日	乙亥 丙戌 壬戌 乙巳	无	霜降 (10, 24)	无	无	无	猪	天秤座	祭祀、出行、宴会、嫁娶、上官、进人口、经络、纳财、牧养、搬移、裁制、庆赐、招贤、施恩、立券交易、临政、纳畜、举正直、酝酿	剃头、修置产室、开渠、穿井、平治道涂、破屋坏垣、伐木、破土、安葬、启攒、补垣、整容、营建、整手足甲、筑堤防、上册、修饰垣墙
1935-10-14	一九三五 乙亥[猪]年	九月小	十七	周一	乙亥 丙戌 癸亥 丁巳	无	霜降 (10, 24)	无	金龙四大王诞	无	猪	天秤座	祭祀、沐浴、扫舍宇	嫁娶、上表章、开渠、穿井、破土、安葬、启攒、上册、颁诏、补垣、招贤、布政事、宣政事、塞穴、营建、筑堤防
1935-10-15	一九三五 乙亥[猪]年	九月小	十八	周二	乙亥 丙戌 甲子 己巳	无	霜降 (10, 24)	无	无	无	猪	天秤座	沐浴、诉讼、覃恩、恤孤茕、雪冤、赴任	祭祀、出行、结婚姻、宴会、嫁娶、安床、剃头、修造、求医疗病、上表章、上官、冠带、进人口、竖柱上梁、经络、开市、纳财、修置产室、开渠、穿井、安碓硙、破屋坏垣、栽种、牧养、破土、安葬、启攒、搬移、祈福、缮城郭、裁制、开仓、上册、修宫室、颁诏、求嗣、庆赐、补垣、招贤、整容、布政事、宣政事、安抚边境、入宅、施恩、立券交易、修饰垣墙、临政、纳畜、举正直、解除、塞穴、修仓库、酝酿、选将、远回、鼓铸、营建、纳采、整手足甲、出师、筑堤防、苫盖
1935-10-16	一九三五 乙亥[猪]年	九月小	十九	周三	乙亥 丙戌 乙丑 辛巳	无	霜降 (10, 24)	无	观世音菩萨出家	无	猪	天秤座	平治道涂、覃恩、恤孤茕、雪冤、入宅、赴任	祭祀、出行、结婚姻、宴会、嫁娶、安床、剃头、修造、求医疗病、上表章、上官、冠带、进人口、竖柱上梁、经络、开市、纳财、修置产室、开渠、穿井、安碓硙、破屋坏垣、栽种、牧养、破土、安葬、启攒、搬移、祈福、缮城郭、裁制、上册、开仓、修宫室、颁诏、求嗣、庆赐、补垣、招贤、整容、布政事、宣政事、安抚边境、施恩、立券交易、修饰垣墙、临政、纳畜、举正直、解除、塞穴、修仓库、酝酿、选将、鼓铸、营建、纳采、整手足甲、出师、筑堤防
1935-10-17	一九三五 乙亥[猪]年	九月小	二十	周四	乙亥 丙戌 丙寅 癸巳	无	霜降 (10, 24)	无	无	无	猪	天秤座	覃恩、雪冤、布政事、恤孤茕	祭祀、安床、剃头、开市、修置产室、开渠、穿井、平治道涂、破屋坏垣、伐木、畋猎、开仓、补垣、取鱼、整容、修饰垣墙、塞穴、乘船渡水、远回、鼓铸、整手足甲、筑堤防
1935-10-18	一九三五 乙亥[猪]年	九月小	廿一	周五	乙亥 丙戌 丁卯 乙巳	无	霜降 (10, 24)	无	无	无	猪	天秤座	祭祀、结婚姻、宴会、嫁娶、上官、进人口、经络、纳财、捕捉、安葬、祈福、覃恩、恤孤茕、庆赐、雪冤、布政事、安抚边境、立券交易、临政、纳畜、酝酿	出行、安床、剃头、修造、求医疗病、上表章、冠带、竖柱上梁、开市、修置产室、穿井、栽种、牧养、搬移、缮城郭、开仓、上册、修宫室、求嗣、取鱼、招贤、整容、施恩、举正直、解除、乘船渡水、修仓库、选将、营建、纳采、整手足甲、出师、筑堤防
1935-10-19	一九三五 乙亥[猪]年	九月小	廿二	周六	乙亥 丙戌 戊辰 丁巳	无	霜降 (10, 24)	无	无	无	猪	天秤座	祭祀、沐浴、覃恩、恤孤茕、雪冤	出行、结婚姻、安床、修造、上官、冠带、进人口、竖柱上梁、经络、开市、修置产室、开渠、穿井、安碓硙、平治道涂、伐木、捕捉、畋猎、破土、安葬、启攒、搬移、缮城郭、上册、修宫室、开仓、颁诏、补垣、取鱼、招贤、宣政事、施恩、立券交易、修饰垣墙、临政、举正直、塞穴、修仓库、酝酿、鼓铸、营建、纳采、筑堤防
1935-10-20	一九三五 乙亥[猪]年	九月小	廿三	周日	乙亥 丙戌 己巳 己巳	无	霜降 (10, 24)	无	无	无	猪	天秤座	祭祀、安床、恤孤茕、雪冤、选将、安抚边境	出行、嫁娶、修造、求医疗病、破土、安葬、启攒、针刺、纳畜、乘船渡水、搬移、整手足甲、解除、开仓、修仓库
1935-10-21	一九三五 乙亥[猪]年	九月小	廿四	周一	乙亥 丙戌 庚午 辛巳	无	霜降 (10, 24)	无	无	无	猪	天秤座	祭祀、出行、结婚姻、宴会、嫁娶、求医疗病、上官、入学、进人口、竖柱上梁、开市、纳财、牧养、安葬、搬移、祈福、开仓、裁制、求嗣、庆赐、入宅、立券交易、施恩、临政、纳畜、举正直、解除、酝酿、纳采	修置产室、开渠、穿井、平治道涂、破屋坏垣、补垣、苫盖、营建、修饰垣墙
1935-10-22	一九三五 乙亥[猪]年	九月小	廿五	周二	乙亥 丙戌 辛未 癸巳	无	霜降 (10, 24)	无	无	无	猪	天秤座	祭祀、捕捉、覃恩、恤孤茕、雪冤	剃头、冠带、立券、修置产室、开渠、穿井、安碓硙、平治道涂、破屋坏垣、畋猎、启攒、开仓、修宫室、补垣、取鱼、整容、布政事、修饰垣墙、开张、塞穴、乘船渡水、鼓铸、整手足甲、筑堤防
1935-10-23	一九三五 乙亥[猪]年	九月小	廿六	周三	乙亥 丙戌 壬申 乙巳	无	霜降 (10, 24)	无	无	无	猪	天蝎座	出行、沐浴、剃头、求医疗病、上表章、上官、入学、竖柱上梁、开市、纳财、扫舍宇、牧养、搬移、祈福、开仓、裁制、上册、颁诏、求嗣、覃恩、恤孤茕、雪冤、招贤、整容、宣政事、安抚边境、施恩、临政、举正直、解除、选将、整手足甲	嫁娶、开渠、平治道涂、破屋坏垣、伐木、畋猎、补垣、取鱼、营建、筑堤防、乘船渡水、修饰垣墙
1935-10-24	一九三五 乙亥[猪]年	九月小	廿七	周四	乙亥 丙戌 癸酉 丁巳	霜降	立冬 (11, 8)	无	无	无	猪	天蝎座	祭祀、沐浴、剃头、扫舍宇、裁制、整容、塞穴、整手足甲	出行、结婚姻、宴会、嫁娶、安床、修造、求医疗病、上表章、上官、冠带、进人口、竖柱上梁、经络、开市、纳财、修置产室、开渠、穿井、安碓硙、平治道涂、破屋坏垣、栽种、牧养、破土、安葬、启攒、搬移、祈福、缮城郭、开仓、上册、修宫室、颁诏、求嗣、庆赐、补垣、针刺、招贤、布政事、宣政事、安抚边境、疗目、施恩、立券交易、临政、修饰垣墙、纳畜、举正直、解除、修仓库、酝酿、选将、营建、纳采、出师、筑堤防
1935-10-25	一九三五 乙亥[猪]年	九月小	廿八	周五	乙亥 丙戌 甲戌 己巳	无	立冬 (11, 8)	无	无	无	猪	天蝎座	出行、宴会、嫁娶、上官、进人口、经络、纳财、牧养、搬移、裁制、庆赐、招贤、安抚边境、施恩、立券交易、临政、纳畜、举正直、酝酿、选将、出师	剃头、求医疗病、上表章、修置产室、开渠、穿井、平治道涂、破屋坏垣、伐木、破土、安葬、启攒、祈福、开仓、上册、求嗣、补垣、整容、修饰垣墙、解除、营建、整手足甲、筑堤防
1935-10-26	一九三五 乙亥[猪]年	九月小	廿九	周六	乙亥 丙戌 乙亥 辛巳	无	立冬 (11, 8)	无	无	无	猪	天蝎座	出行、沐浴、剃头、修造、求医疗病、上官、经络、开市、纳财、扫舍宇、栽种、牧养、搬移、开仓、整容、入宅、安抚边境、立券交易、临政、纳畜、解除、赴任、酝酿、选将、纳采、整手足甲、出师	结婚姻、宴会、嫁娶、上表章、冠带、竖柱上梁、修置产室、开渠、穿井、安碓硙、平治道涂、破屋坏垣、破土、安葬、启攒、祈福、缮城郭、裁制、上册、修宫室、颁诏、求嗣、庆赐、补垣、招贤、布政事、宣政事、修饰垣墙、塞穴、修仓库、鼓铸、营建、筑堤防
1935-10-27	一九三五 乙亥[猪]年	十月大	初一	周日	乙亥 丙戌 丙子 癸巳	无	立冬 (11, 8)	无	寒衣节	无	猪	天蝎座	出行、结婚姻、宴会、嫁娶、沐浴、修造、求医疗病、上表章、上官、进人口、竖柱上梁、经络、开市、纳财、栽种、牧养、安葬、诉讼、搬移、祈福、缮城郭、裁制、开仓、上册、修宫室、颁诏、求嗣、覃恩、补垣、恤孤茕、雪冤、庆赐、招贤、宣政事、安抚边境、施恩、立券交易、临政、纳畜、举正直、解除、塞穴、修仓库、赴任、选将、营建、纳采、出师	祭祀、剃头、冠带、修置产室、开渠、穿井、安碓硙、平治道涂、破屋坏垣、畋猎、取鱼、整容、布政事、入宅、修饰垣墙、远回、鼓铸、整手足甲、筑堤防、苫盖
1935-10-28	一九三五 乙亥[猪]年	十月大	初二	周一	乙亥 丙戌 丁丑 乙巳	无	立冬 (11, 8)	无	无	无	猪	天蝎座	诸事不宜	诸事不宜
1935-10-29	一九三五 乙亥[猪]年	十月大	初三	周二	乙亥 丙戌 戊寅 丁巳	无	立冬 (11, 8)	无	三茅诞	无	猪	天蝎座	诸事不宜	祭祀、出行、结婚姻、宴会、嫁娶、安床、剃头、修造、求医疗病、上表章、上官、冠带、进人口、竖柱上梁、经络、开市、纳财、修置产室、开渠、穿井、安碓硙、平治道涂、破屋坏垣、伐木、畋猎、栽种、牧养、破土、安葬、启攒、搬移、祈福、缮城郭、裁制、上册、开仓、修宫室、颁诏、求嗣、庆赐、补垣、取鱼、招贤、整容、布政事、宣政事、安抚边境、施恩、立券交易、修饰垣墙、临政、纳畜、举正直、解除、塞穴、乘船渡水、修仓库、酝酿、选将、远回、鼓铸、营建、纳采、整手足甲、出师、筑堤防
1935-10-30	一九三五 乙亥[猪]年	十月大	初四	周三	乙亥 丙戌 己卯 己巳	无	立冬 (11, 8)	无	无	无	猪	天蝎座	祭祀、结婚姻、宴会、嫁娶、上官、进人口、经络、纳财、捕捉、畋猎、破土、安葬、祈福、覃恩、恤孤茕、庆赐、雪冤、布政事、安抚边境、立券交易、临政、纳畜、酝酿	出行、安床、修造、求医疗病、上表章、冠带、竖柱上梁、开市、修置产室、开渠、穿井、安碓硙、平治道涂、破屋坏垣、栽种、牧养、搬移、缮城郭、开仓、上册、修宫室、求嗣、补垣、取鱼、招贤、施恩、修饰垣墙、举正直、解除、乘船渡水、修仓库、选将、营建、纳采、出师、筑堤防
1935-10-31	一九三五 乙亥[猪]年	十月大	初五	周四	乙亥 丙戌 庚辰 辛巳	无	立冬 (11, 8)	无	达摩祖师诞	无	猪	天蝎座	祭祀、沐浴、覃恩、恤孤茕、雪冤、入宅、解除	冠带、修置产室、开渠、穿井、安碓硙、平治道涂、伐木、捕捉、畋猎、破土、安葬、启攒、上册、颁诏、补垣、取鱼、招贤、宣政事、修饰垣墙、塞穴、乘船渡水、修仓库、鼓铸、营建、筑堤防
