1941-06-01	一九四一 辛巳[蛇]年	五月大	初七	周日	无	无	无	辛巳 癸巳 庚辰 辛巳	无	芒种 (6, 6)	蛇	双子座	祭祀、雪冤、覃恩、恤孤茕	出行、结婚姻、宴会、嫁娶、安床、剃头、修造、求医疗病、上表章、上官、冠带、进人口、竖柱上梁、经络、开市、纳财、修置产室、开渠、穿井、安碓硙、破屋坏垣、畋猎、栽种、牧养、安葬、布政事、出师、纳畜、取鱼、颁诏、纳采、举正直、补垣、安抚边境、修仓库、整手足甲、缮城郭、鼓铸、裁制、宣政事、临政、针刺、酝酿、立券交易、招贤、开仓、祈福、解除、施恩、筑堤防、求嗣、塞穴、修饰垣墙、上册、庆赐、整容、修宫室、选将、营建、疗目、搬移
1941-06-02	一九四一 辛巳[蛇]年	五月大	初八	周一	无	南方五道诞	无	辛巳 癸巳 辛巳 癸巳	无	芒种 (6, 6)	蛇	双子座	祭祀、宴会、上官、进人口、经络、纳财、牧养、赴任、纳畜、颁诏、举正直、雪冤、裁制、宣政事、临政、立券交易、招贤、入宅、施恩、覃恩、庆赐、恤孤茕、搬移	出行、剃头、修置产室、开渠、穿井、平治道涂、破屋坏垣、伐木、畋猎、破土、启攒、整容、整手足甲、取鱼、开仓、筑堤防、补垣、修饰垣墙
1941-06-03	一九四一 辛巳[蛇]年	五月大	初九	周二	无	无	无	辛巳 癸巳 壬午 乙巳	无	芒种 (6, 6)	蛇	双子座	祭祀、宴会、沐浴、剃头、扫舍宇、布政事、雪冤、整手足甲、覃恩、庆赐、整容、恤孤茕	结婚姻、嫁娶、安床、修造、上表章、冠带、进人口、竖柱上梁、开市、纳财、修置产室、开渠、穿井、栽种、牧养、纳畜、取鱼、纳采、苫盖、修仓库、缮城郭、乘船渡水、立券交易、招贤、开仓、筑堤防、求嗣、上册、修宫室、营建、搬移
1941-06-04	一九四一 辛巳[蛇]年	五月大	初十	周三	无	无	无	辛巳 癸巳 癸未 丁巳	无	芒种 (6, 6)	蛇	双子座	雪冤、恤孤茕、覃恩、布政事	祭祀、出行、结婚姻、嫁娶、安床、剃头、修造、上官、冠带、修置产室、开渠、穿井、安碓硙、平治道涂、破屋坏垣、伐木、栽种、牧养、启攒、出师、纳畜、取鱼、颁诏、纳采、补垣、举正直、安抚边境、整手足甲、鼓铸、宣政事、临政、乘船渡水、酝酿、招贤、解除、施恩、筑堤防、修饰垣墙、整容、选将、营建、远回、搬移
1941-06-05	一九四一 辛巳[蛇]年	五月大	十一	周四	无	天下都城隍诞	无	辛巳 癸巳 甲申 己巳	无	芒种 (6, 6)	蛇	双子座	祭祀、沐浴、扫舍宇、平治道涂	出行、安床、修造、竖柱上梁、修置产室、开渠、穿井、安碓硙、破屋坏垣、启攒、布政事、取鱼、颁诏、补垣、纳采、举正直、安抚边境、修仓库、缮城郭、鼓铸、裁制、宣政事、乘船渡水、针刺、招贤、筑堤防、施恩、塞穴、上册、庆赐、修宫室、选将、营建、出师、搬移
1941-06-06	一九四一 辛巳[蛇]年	五月大	十二	周五	无	炳灵公诞	无	辛巳 甲午 乙酉 辛巳	芒种	夏至 (6, 22)	蛇	双子座	沐浴、扫舍宇、平治道涂、整手足甲、修饰垣墙	祭祀、出行、结婚姻、宴会、嫁娶、安床、剃头、修造、求医疗病、上表章、上官、冠带、进人口、竖柱上梁、经络、开市、纳财、修置产室、开渠、穿井、栽种、牧养、破土、安葬、启攒、布政事、出师、纳畜、颁诏、纳采、举正直、安抚边境、修仓库、缮城郭、鼓铸、裁制、宣政事、临政、酝酿、立券交易、招贤、开仓、祈福、解除、施恩、筑堤防、求嗣、上册、庆赐、整容、修宫室、选将、营建、搬移
1941-06-07	一九四一 辛巳[蛇]年	五月大	十三	周六	无	关圣降	无	辛巳 甲午 丙戌 癸巳	无	夏至 (6, 22)	蛇	双子座	祭祀、宴会、经络、安碓硙、颁诏、举正直、雪冤、裁制、宣政事、酝酿、招贤、祈福、入宅、施恩、求嗣、覃恩、庆赐、恤孤茕	安床、开市、修置产室、畋猎、破土、启攒、取鱼、开仓、筑堤防
1941-06-08	一九四一 辛巳[蛇]年	五月大	十四	周日	无	无	无	辛巳 甲午 丁亥 乙巳	无	夏至 (6, 22)	蛇	双子座	祭祀、沐浴、捕捉、雪冤、覃恩、恤孤茕	嫁娶、安床、剃头、冠带、进人口、修置产室、开渠、穿井、安碓硙、破屋坏垣、畋猎、破土、安葬、启攒、布政事、取鱼、补垣、整手足甲、鼓铸、乘船渡水、筑堤防、塞穴、修饰垣墙、整容、修宫室
1941-06-09	一九四一 辛巳[蛇]年	五月大	十五	周一	无	无	无	辛巳 甲午 戊子 丁巳	无	夏至 (6, 22)	蛇	双子座	诸事不宜	诸事不宜
1941-06-10	一九四一 辛巳[蛇]年	五月大	十六	周二	无	天地元气造化万物之辰	无	辛巳 甲午 己丑 己巳	无	夏至 (6, 22)	蛇	双子座	祭祀、雪冤、恤孤茕	出行、结婚姻、宴会、嫁娶、安床、剃头、修造、求医疗病、上表章、上官、冠带、进人口、竖柱上梁、经络、开市、纳财、修置产室、开渠、穿井、安碓硙、破屋坏垣、栽种、牧养、破土、安葬、启攒、布政事、纳畜、颁诏、纳采、补垣、举正直、安抚边境、修仓库、整手足甲、缮城郭、鼓铸、裁制、宣政事、临政、酝酿、立券交易、招贤、开仓、祈福、解除、施恩、筑堤防、求嗣、塞穴、修饰垣墙、上册、庆赐、整容、修宫室、选将、营建、出师、搬移
1941-06-11	一九四一 辛巳[蛇]年	五月大	十七	周三	无	无	无	辛巳 甲午 庚寅 辛巳	无	夏至 (6, 22)	蛇	双子座	结婚姻、宴会、上官、入学、进人口、竖柱上梁、开市、纳财、安碓硙、栽种、牧养、纳采、举正直、修仓库、缮城郭、裁制、临政、酝酿、立券交易、筑堤防、施恩、祈福、求嗣、庆赐、修宫室	祭祀、出师、远回、选将
1941-06-12	一九四一 辛巳[蛇]年	五月大	十八	周四	无	张天师诞	无	辛巳 甲午 辛卯 癸巳	无	夏至 (6, 22)	蛇	双子座	祭祀、赴任、雪冤、入宅、覃恩、恤孤茕	冠带、修置产室、开渠、穿井、畋猎、乘船渡水、针刺、布政事、修宫室、鼓铸、取鱼、开仓、筑堤防、塞穴、补垣
1941-06-13	一九四一 辛巳[蛇]年	五月大	十九	周五	无	无	无	辛巳 甲午 壬辰 乙巳	无	夏至 (6, 22)	蛇	双子座	出行、结婚姻、宴会、修造、求医疗病、上表章、上官、入学、竖柱上梁、开市、纳财、修置产室、安碓硙、栽种、牧养、赴任、颁诏、纳采、举正直、雪冤、缮城郭、裁制、宣政事、临政、诉讼、招贤、祈福、解除、施恩、求嗣、覃恩、上册、庆赐、恤孤茕、修宫室、搬移	开渠、伐木、畋猎、安抚边境、整手足甲、取鱼、选将、出师
1941-06-14	一九四一 辛巳[蛇]年	五月大	二十	周六	无	无	无	辛巳 甲午 癸巳 丁巳	无	夏至 (6, 22)	蛇	双子座	补垣、安抚边境、雪冤、裁制、筑堤防、塞穴、覃恩、恤孤茕、选将	出行、结婚姻、宴会、嫁娶、安床、修造、求医疗病、上表章、上官、进人口、竖柱上梁、开市、修置产室、开渠、穿井、破土、安葬、启攒、布政事、出师、颁诏、纳采、举正直、宣政事、临政、针刺、招贤、开仓、祈福、解除、施恩、求嗣、上册、庆赐、修宫室、营建、疗目、搬移
1941-06-15	一九四一 辛巳[蛇]年	五月大	廿一	周日	无	无	无	辛巳 甲午 甲午 己巳	无	夏至 (6, 22)	蛇	双子座	诸事不宜	诸事不宜
1941-06-16	一九四一 辛巳[蛇]年	五月大	廿二	周一	无	孝娥神诞	无	辛巳 甲午 乙未 辛巳	无	夏至 (6, 22)	蛇	双子座	出行、宴会、沐浴、剃头、上官、进人口、经络、纳财、扫舍宇、破土、安葬、纳畜、举正直、安抚边境、整手足甲、临政、酝酿、立券交易、解除、施恩、整容、选将	修造、栽种、修仓库
1941-06-17	一九四一 辛巳[蛇]年	五月大	廿三	周二	无	无	无	辛巳 甲午 丙申 癸巳	无	夏至 (6, 22)	蛇	双子座	嫁娶、沐浴、剃头、修造、上表章、进人口、竖柱上梁、经络、开市、纳财、扫舍宇、栽种、牧养、安葬、出师、纳畜、颁诏、补垣、安抚边境、雪冤、缮城郭、裁制、宣政事、祈福、入宅、塞穴、解除、求嗣、覃恩、上册、整容、恤孤茕、修宫室、选将、营建、搬移	祭祀、安床、畋猎、乘船渡水、取鱼
1941-06-18	一九四一 辛巳[蛇]年	五月大	廿四	周三	无	无	无	辛巳 甲午 丁酉 乙巳	无	夏至 (6, 22)	蛇	双子座	沐浴、扫舍宇、平治道涂、整手足甲、修饰垣墙	祭祀、出行、结婚姻、宴会、嫁娶、安床、剃头、修造、求医疗病、上表章、上官、冠带、进人口、竖柱上梁、经络、开市、纳财、修置产室、开渠、穿井、栽种、牧养、破土、安葬、启攒、布政事、出师、纳畜、颁诏、纳采、举正直、安抚边境、修仓库、缮城郭、鼓铸、裁制、宣政事、临政、酝酿、立券交易、招贤、开仓、祈福、解除、施恩、筑堤防、求嗣、上册、庆赐、整容、修宫室、选将、营建、搬移
1941-06-19	一九四一 辛巳[蛇]年	五月大	廿五	周四	无	无	无	辛巳 甲午 戊戌 丁巳	无	夏至 (6, 22)	蛇	双子座	祭祀、出行、结婚姻、宴会、嫁娶、修造、上官、冠带、进人口、竖柱上梁、经络、安碓硙、牧养、纳畜、纳采、举正直、缮城郭、裁制、临政、酝酿、祈福、施恩、求嗣、庆赐、修宫室、搬移	修置产室
1941-06-20	一九四一 辛巳[蛇]年	五月大	廿六	周五	无	无	无	辛巳 甲午 己亥 己巳	无	夏至 (6, 22)	蛇	双子座	祭祀、沐浴、捕捉、雪冤、覃恩、恤孤茕	嫁娶、剃头、冠带、修置产室、开渠、穿井、安碓硙、破屋坏垣、畋猎、破土、启攒、布政事、取鱼、补垣、整手足甲、鼓铸、筑堤防、塞穴、修饰垣墙、整容
1941-06-21	一九四一 辛巳[蛇]年	五月大	廿七	周六	无	无	无	辛巳 甲午 庚子 辛巳	无	夏至 (6, 22)	蛇	双子座	诸事不宜	诸事不宜
1941-06-22	一九四一 辛巳[蛇]年	五月大	廿八	周日	无	无	无	辛巳 甲午 辛丑 癸巳	夏至	小暑 (7, 7)	蛇	巨蟹座	祭祀、赴任、雪冤、入宅、覃恩、恤孤茕	剃头、冠带、修置产室、开渠、穿井、安碓硙、破屋坏垣、畋猎、破土、启攒、布政事、取鱼、补垣、整手足甲、鼓铸、开仓、筑堤防、塞穴、修饰垣墙、整容、修宫室
1941-06-23	一九四一 辛巳[蛇]年	五月大	廿九	周一	无	无	无	辛巳 甲午 壬寅 乙巳	无	小暑 (7, 7)	蛇	巨蟹座	结婚姻、宴会、上表章、上官、入学、进人口、竖柱上梁、经络、开市、纳财、安碓硙、栽种、牧养、纳采、举正直、修仓库、缮城郭、裁制、临政、酝酿、立券交易、筑堤防、施恩、祈福、求嗣、庆赐、修宫室	祭祀、开渠、穿井、选将、远回、出师
1941-06-24	一九四一 辛巳[蛇]年	五月大	三十	周二	无	无	无	辛巳 甲午 癸卯 丁巳	无	小暑 (7, 7)	蛇	巨蟹座	祭祀	出行、结婚姻、宴会、嫁娶、安床、修造、求医疗病、上表章、上官、冠带、进人口、竖柱上梁、经络、开市、纳财、修置产室、开渠、穿井、捕捉、畋猎、栽种、牧养、破土、安葬、启攒、布政事、纳畜、取鱼、颁诏、补垣、纳采、举正直、安抚边境、修仓库、缮城郭、鼓铸、裁制、宣政事、临政、乘船渡水、针刺、酝酿、立券交易、招贤、开仓、祈福、解除、施恩、筑堤防、求嗣、塞穴、上册、庆赐、修宫室、选将、营建、出师、搬移
1941-06-25	一九四一 辛巳[蛇]年	六月小	初一	周三	无	无	无	辛巳 甲午 甲辰 己巳	无	小暑 (7, 7)	蛇	巨蟹座	出行、结婚姻、宴会、上表章、上官、入学、竖柱上梁、开市、纳财、修置产室、开渠、穿井、安碓硙、栽种、牧养、赴任、颁诏、纳采、举正直、雪冤、缮城郭、裁制、宣政事、临政、诉讼、招贤、祈福、解除、施恩、求嗣、覃恩、上册、庆赐、恤孤茕、修宫室、搬移	伐木、畋猎、乘船渡水、整手足甲、取鱼、出师
1941-06-26	一九四一 辛巳[蛇]年	六月小	初二	周四	无	无	无	辛巳 甲午 乙巳 辛巳	无	小暑 (7, 7)	蛇	巨蟹座	补垣、安抚边境、雪冤、裁制、筑堤防、塞穴、覃恩、恤孤茕、选将	出行、结婚姻、宴会、嫁娶、安床、修造、求医疗病、上表章、上官、进人口、竖柱上梁、开市、立券、修置产室、开渠、穿井、栽种、破土、安葬、启攒、布政事、出师、颁诏、纳采、举正直、开张、修仓库、宣政事、临政、针刺、招贤、开仓、祈福、解除、施恩、求嗣、上册、庆赐、修宫室、营建、疗目、搬移
1941-06-27	一九四一 辛巳[蛇]年	六月小	初三	周五	无	无	无	辛巳 甲午 丙午 癸巳	无	小暑 (7, 7)	蛇	巨蟹座	祭祀、雪冤、恤孤茕、入宅、覃恩	出行、结婚姻、宴会、嫁娶、安床、剃头、修造、求医疗病、上表章、上官、冠带、进人口、竖柱上梁、经络、开市、纳财、修置产室、开渠、穿井、安碓硙、平治道涂、破屋坏垣、伐木、畋猎、栽种、牧养、破土、安葬、启攒、布政事、出师、纳畜、取鱼、颁诏、补垣、纳采、举正直、苫盖、修仓库、安抚边境、整手足甲、缮城郭、鼓铸、裁制、宣政事、临政、酝酿、立券交易、招贤、开仓、祈福、解除、施恩、求嗣、筑堤防、塞穴、修饰垣墙、上册、庆赐、整容、修宫室、选将、营建、远回、搬移
1941-06-28	一九四一 辛巳[蛇]年	六月小	初四	周六	无	无	无	辛巳 甲午 丁未 乙巳	无	小暑 (7, 7)	蛇	巨蟹座	出行、宴会、沐浴、上官、进人口、经络、纳财、扫舍宇、纳畜、举正直、整手足甲、裁制、临政、酝酿、立券交易、解除、施恩	剃头、启攒、纳采
1941-06-29	一九四一 辛巳[蛇]年	六月小	初五	周日	无	无	无	辛巳 甲午 戊申 丁巳	无	小暑 (7, 7)	蛇	巨蟹座	嫁娶、沐浴、剃头、修造、上表章、进人口、竖柱上梁、经络、开市、纳财、扫舍宇、栽种、牧养、破土、安葬、补垣、安抚边境、整手足甲、缮城郭、裁制、祈福、解除、塞穴、求嗣、上册、整容、修宫室、选将、出师、搬移	祭祀、招贤、乘船渡水
1941-06-30	一九四一 辛巳[蛇]年	六月小	初六	周一	无	无	无	辛巳 甲午 己酉 己巳	无	小暑 (7, 7)	蛇	巨蟹座	沐浴、剃头、扫舍宇、平治道涂、雪冤、修饰垣墙、覃恩、整容、恤孤茕	祭祀、出行、结婚姻、宴会、嫁娶、安床、修造、求医疗病、上表章、上官、冠带、进人口、竖柱上梁、经络、开市、纳财、修置产室、开渠、穿井、栽种、牧养、破土、安葬、启攒、布政事、出师、纳畜、颁诏、纳采、举正直、安抚边境、修仓库、整手足甲、缮城郭、鼓铸、裁制、宣政事、临政、酝酿、立券交易、招贤、开仓、祈福、解除、施恩、筑堤防、求嗣、上册、庆赐、修宫室、选将、营建、搬移
