1942-10-01	一九四二 壬午[马]年	八月大	廿二	周四	壬午 己酉 丁亥 乙巳	马	天秤座	无	寒露 (10, 9)	无	无	无	出行、宴会、沐浴、上表章、进人口、竖柱上梁、经络、开市、纳财、立券交易、赴任、裁制、缮城郭、塞穴、上册、入宅、庆赐、补垣、修宫室	祭祀、结婚姻、嫁娶、剃头、破土、启攒、举正直、选将、出师、纳畜、施恩、安抚边境、招贤、整容
1942-10-02	一九四二 壬午[马]年	八月大	廿三	周五	壬午 己酉 戊子 丁巳	马	天秤座	无	寒露 (10, 9)	无	汉恒候张显王诞	无	祭祀、沐浴、平治道涂、修饰垣墙	出行、结婚姻、宴会、嫁娶、安床、修造、求医疗病、上表章、上官、冠带、进人口、竖柱上梁、经络、开市、纳财、修置产室、开渠、穿井、捕捉、畋猎、栽种、牧养、破土、安葬、启攒、立券交易、裁制、乘船渡水、缮城郭、招贤、布政事、举正直、选将、纳畜、取鱼、上册、颁诏、出师、祈福、安抚边境、酝酿、庆赐、开仓、鼓铸、解除、修宫室、施恩、纳采、整手足甲、修仓库、临政、搬移、营建、筑堤防、宣政事、求嗣
1942-10-03	一九四二 壬午[马]年	八月大	廿四	周六	壬午 己酉 己丑 己巳	马	天秤座	无	寒露 (10, 9)	无	灶君夫人诞	无	结婚姻、宴会、嫁娶、修造、进人口、竖柱上梁、经络、安碓硙、牧养、裁制、缮城郭、纳畜、酝酿、庆赐、纳采、修宫室	求医疗病、上表章、开市、修置产室、选将、出师、解除、开仓、上册、安抚边境
1942-10-04	一九四二 壬午[马]年	八月大	廿五	周日	壬午 己酉 庚寅 辛巳	马	天秤座	无	寒露 (10, 9)	无	无	无	沐浴、捕捉、雪冤、覃恩、恤孤茕	祭祀、安床、冠带、进人口、经络、开市、纳财、修置产室、开渠、穿井、安碓硙、破屋坏垣、畋猎、启攒、远回、布政事、塞穴、取鱼、修饰垣墙、酝酿、开仓、鼓铸、补垣、修宫室、筑堤防
1942-10-05	一九四二 壬午[马]年	八月大	廿六	周一	壬午 己酉 辛卯 癸巳	马	天秤座	无	寒露 (10, 9)	无	无	无	诸事不宜	诸事不宜
1942-10-06	一九四二 壬午[马]年	八月大	廿七	周二	壬午 己酉 壬辰 乙巳	马	天秤座	无	寒露 (10, 9)	无	无	无	祭祀、出行、结婚姻、宴会、嫁娶、安床、修造、求医疗病、上官、进人口、竖柱上梁、经络、纳财、栽种、牧养、安葬、立券交易、裁制、缮城郭、选将、纳畜、入宅、祈福、安抚边境、酝酿、庆赐、开仓、解除、纳采、临政、搬移、求嗣、修宫室	剃头、上表章、冠带、立券、修置产室、开渠、穿井、安碓硙、破屋坏垣、招贤、布政事、塞穴、上册、颁诏、修饰垣墙、出师、开张、整容、鼓铸、补垣、整手足甲、修仓库、筑堤防、营建、宣政事
1942-10-07	一九四二 壬午[马]年	八月大	廿八	周三	壬午 己酉 癸巳 丁巳	马	天秤座	无	寒露 (10, 9)	无	无	无	祭祀、结婚姻、宴会、求医疗病、上表章、上官、入学、进人口、竖柱上梁、经络、开市、纳财、安碓硙、栽种、牧养、立券交易、裁制、缮城郭、举正直、选将、纳畜、上册、祈福、酝酿、庆赐、开仓、解除、修宫室、纳采、施恩、临政、筑堤防、搬移、求嗣、安抚边境	出行、破土、安葬、启攒
1942-10-08	一九四二 壬午[马]年	八月大	廿九	周四	壬午 己酉 甲午 己巳	马	天秤座	无	寒露 (10, 9)	无	至圣先师孔子诞	无	祭祀、捕捉	出行、结婚姻、宴会、嫁娶、安床、修造、求医疗病、上表章、上官、冠带、进人口、竖柱上梁、经络、开市、纳财、修置产室、开渠、穿井、栽种、牧养、破土、安葬、启攒、立券交易、裁制、乘船渡水、缮城郭、苫盖、招贤、布政事、举正直、选将、塞穴、纳畜、取鱼、上册、颁诏、出师、祈福、安抚边境、酝酿、庆赐、开仓、鼓铸、补垣、解除、修宫室、施恩、纳采、修仓库、临政、搬移、营建、筑堤防、宣政事、求嗣
1942-10-09	一九四二 壬午[马]年	八月大	三十	周五	壬午 庚戌 乙未 辛巳	马	天秤座	寒露	霜降 (10, 24)	无	无	无	捕捉	出行、结婚姻、宴会、嫁娶、安床、剃头、修造、求医疗病、上表章、上官、冠带、进人口、竖柱上梁、经络、开市、纳财、修置产室、开渠、穿井、安碓硙、破屋坏垣、栽种、牧养、破土、安葬、启攒、立券交易、裁制、缮城郭、招贤、布政事、举正直、选将、塞穴、纳畜、上册、颁诏、修饰垣墙、出师、祈福、安抚边境、酝酿、庆赐、开仓、鼓铸、整容、补垣、解除、修宫室、施恩、纳采、整手足甲、修仓库、临政、搬移、营建、筑堤防、宣政事、求嗣
1942-10-10	一九四二 壬午[马]年	九月小	初一	周六	壬午 庚戌 丙申 癸巳	马	天秤座	无	霜降 (10, 24)	无	北斗九星降世	无	出行、沐浴、剃头、修造、上表章、上官、入学、竖柱上梁、开市、修置产室、开渠、穿井、安碓硙、扫舍宇、栽种、牧养、雪冤、裁制、覃恩、缮城郭、招贤、举正直、选将、纳畜、上册、颁诏、出师、祈福、整容、解除、修宫室、施恩、修仓库、临政、搬移、营建、恤孤茕、宣政事、求嗣、安抚边境	安床、伐木、畋猎、立券交易、乘船渡水、取鱼
1942-10-11	一九四二 壬午[马]年	九月小	初二	周日	壬午 庚戌 丁酉 乙巳	马	天秤座	无	霜降 (10, 24)	无	无	无	沐浴、扫舍宇、赴任、塞穴、入宅、补垣、整手足甲	结婚姻、宴会、剃头、上表章、冠带、竖柱上梁、修置产室、开渠、穿井、栽种、牧养、启攒、疗目、针刺、缮城郭、招贤、布政事、举正直、选将、纳畜、上册、颁诏、出师、祈福、庆赐、开仓、修宫室、施恩、修仓库、营建、求嗣、宣政事、安抚边境
1942-10-12	一九四二 壬午[马]年	九月小	初三	周一	壬午 庚戌 戊戌 丁巳	马	天秤座	无	霜降 (10, 24)	无	五瘟神诞	无	出行、宴会、上官、进人口、经络、纳财、牧养、立券交易、裁制、招贤、举正直、纳畜、酝酿、庆赐、施恩、临政、搬移	剃头、求医疗病、上表章、修置产室、开渠、穿井、平治道涂、破屋坏垣、伐木、破土、安葬、启攒、上册、修饰垣墙、祈福、开仓、整容、补垣、解除、整手足甲、筑堤防、营建、求嗣
1942-10-13	一九四二 壬午[马]年	九月小	初四	周二	壬午 庚戌 己亥 己巳	马	天秤座	无	霜降 (10, 24)	无	无	无	沐浴、扫舍宇	结婚姻、宴会、嫁娶、安床、修造、上表章、冠带、进人口、竖柱上梁、修置产室、开渠、穿井、安碓硙、平治道涂、破屋坏垣、破土、安葬、启攒、裁制、缮城郭、招贤、布政事、塞穴、上册、颁诏、修饰垣墙、祈福、庆赐、鼓铸、补垣、纳采、修仓库、搬移、营建、筑堤防、宣政事、求嗣、修宫室
1942-10-14	一九四二 壬午[马]年	九月小	初五	周三	壬午 庚戌 庚子 辛巳	马	天秤座	无	霜降 (10, 24)	无	无	无	沐浴、赴任、诉讼	祭祀、出行、结婚姻、宴会、嫁娶、安床、剃头、修造、求医疗病、上表章、上官、冠带、进人口、竖柱上梁、经络、开市、纳财、修置产室、开渠、穿井、安碓硙、破屋坏垣、栽种、牧养、破土、安葬、启攒、立券交易、乘船渡水、裁制、缮城郭、远回、苫盖、招贤、布政事、举正直、选将、塞穴、纳畜、上册、颁诏、修饰垣墙、出师、祈福、入宅、酝酿、庆赐、整容、鼓铸、开仓、补垣、解除、修宫室、纳采、施恩、整手足甲、修仓库、临政、搬移、营建、筑堤防、宣政事、求嗣、安抚边境
1942-10-15	一九四二 壬午[马]年	九月小	初六	周四	壬午 庚戌 辛丑 癸巳	马	天秤座	无	霜降 (10, 24)	无	无	无	平治道涂、雪冤、覃恩、恤孤茕	祭祀、出行、结婚姻、宴会、嫁娶、安床、剃头、修造、求医疗病、上表章、上官、冠带、进人口、竖柱上梁、经络、开市、纳财、修置产室、开渠、穿井、安碓硙、破屋坏垣、畋猎、栽种、牧养、破土、安葬、启攒、立券交易、裁制、缮城郭、招贤、布政事、举正直、选将、塞穴、纳畜、取鱼、上册、颁诏、修饰垣墙、出师、祈福、酝酿、庆赐、开仓、鼓铸、整容、补垣、解除、修宫室、施恩、纳采、整手足甲、修仓库、临政、搬移、营建、筑堤防、宣政事、求嗣、安抚边境
1942-10-16	一九四二 壬午[马]年	九月小	初七	周五	壬午 庚戌 壬寅 乙巳	马	天秤座	无	霜降 (10, 24)	无	无	无	入宅	祭祀、剃头、修置产室、开渠、穿井、平治道涂、破屋坏垣、伐木、畋猎、启攒、乘船渡水、远回、招贤、布政事、选将、塞穴、取鱼、颁诏、修饰垣墙、出师、安抚边境、整容、鼓铸、补垣、整手足甲、筑堤防、营建、宣政事
1942-10-17	一九四二 壬午[马]年	九月小	初八	周六	壬午 庚戌 癸卯 丁巳	马	天秤座	无	霜降 (10, 24)	无	无	无	祭祀、出行、结婚姻、宴会、嫁娶、修造、求医疗病、上官、进人口、竖柱上梁、经络、纳财、捕捉、栽种、牧养、安葬、立券交易、裁制、缮城郭、纳畜、祈福、酝酿、庆赐、开仓、解除、纳采、修宫室、临政、搬移、求嗣、安抚边境	上表章、冠带、修置产室、穿井、选将、出师、乘船渡水、修仓库、取鱼、营建、招贤、筑堤防、上册
1942-10-18	一九四二 壬午[马]年	九月小	初九	周日	壬午 庚戌 甲辰 己巳	马	天秤座	无	霜降 (10, 24)	无	重阳节-酆都大帝诞	无	祭祀、沐浴、破屋坏垣、解除	出行、结婚姻、宴会、嫁娶、安床、修造、上官、冠带、进人口、竖柱上梁、经络、开市、修置产室、开渠、穿井、安碓硙、伐木、捕捉、畋猎、破土、启攒、立券交易、裁制、缮城郭、招贤、布政事、举正直、塞穴、取鱼、上册、颁诏、修饰垣墙、酝酿、庆赐、开仓、鼓铸、补垣、修宫室、施恩、纳采、修仓库、临政、搬移、营建、筑堤防、宣政事
1942-10-19	一九四二 壬午[马]年	九月小	初十	周一	壬午 庚戌 乙巳 辛巳	马	天秤座	无	霜降 (10, 24)	无	无	无	祭祀、安床、选将、雪冤、恤孤茕、安抚边境	出行、修造、求医疗病、栽种、破土、启攒、针刺、纳畜、解除、修仓库、开仓
1942-10-20	一九四二 壬午[马]年	九月小	十一	周二	壬午 庚戌 丙午 癸巳	马	天秤座	无	霜降 (10, 24)	无	无	无	祭祀、出行、结婚姻、宴会、嫁娶、修造、求医疗病、上表章、上官、入学、进人口、竖柱上梁、经络、开市、纳财、安碓硙、栽种、牧养、安葬、立券交易、雪冤、裁制、覃恩、缮城郭、招贤、举正直、纳畜、上册、颁诏、祈福、酝酿、庆赐、解除、施恩、纳采、修仓库、临政、筑堤防、搬移、恤孤茕、宣政事、营建、求嗣、修宫室	畋猎、苫盖、取鱼
1942-10-21	一九四二 壬午[马]年	九月小	十二	周三	壬午 庚戌 丁未 乙巳	马	天秤座	无	霜降 (10, 24)	无	无	无	捕捉、入宅、赴任	结婚姻、宴会、剃头、求医疗病、上表章、上官、冠带、竖柱上梁、修置产室、开渠、穿井、安碓硙、平治道涂、破屋坏垣、安葬、启攒、裁制、乘船渡水、缮城郭、招贤、布政事、举正直、塞穴、取鱼、上册、颁诏、修饰垣墙、祈福、庆赐、开仓、鼓铸、整容、补垣、解除、施恩、整手足甲、修仓库、临政、筑堤防、营建、宣政事、求嗣、修宫室
1942-10-22	一九四二 壬午[马]年	九月小	十三	周四	壬午 庚戌 戊申 丁巳	马	天秤座	无	霜降 (10, 24)	无	孟婆尊神诞	无	出行、沐浴、剃头、求医疗病、上表章、上官、入学、竖柱上梁、开市、扫舍宇、牧养、雪冤、裁制、覃恩、招贤、举正直、选将、纳畜、上册、颁诏、祈福、整容、解除、施恩、整手足甲、临政、搬移、恤孤茕、宣政事、求嗣、安抚边境	平治道涂、破屋坏垣、伐木、畋猎、启攒、补垣、修饰垣墙、乘船渡水、取鱼、筑堤防
1942-10-23	一九四二 壬午[马]年	九月小	十四	周五	壬午 庚戌 己酉 己巳	马	天蝎座	无	霜降 (10, 24)	无	无	无	沐浴、剃头、扫舍宇、雪冤、覃恩、塞穴、整容、整手足甲、恤孤茕	出行、结婚姻、宴会、嫁娶、安床、修造、求医疗病、上表章、上官、冠带、进人口、竖柱上梁、经络、开市、纳财、修置产室、开渠、穿井、安碓硙、平治道涂、破屋坏垣、栽种、牧养、破土、安葬、启攒、立券交易、疗目、针刺、乘船渡水、缮城郭、招贤、布政事、举正直、选将、纳畜、上册、颁诏、修饰垣墙、出师、祈福、酝酿、庆赐、开仓、补垣、修宫室、施恩、纳采、解除、修仓库、临政、搬移、营建、筑堤防、宣政事、求嗣、安抚边境
1942-10-24	一九四二 壬午[马]年	九月小	十五	周六	壬午 庚戌 庚戌 辛巳	马	天蝎座	霜降	立冬 (11, 8)	无	无	无	祭祀、出行、宴会、嫁娶、上官、进人口、纳财、牧养、立券交易、雪冤、裁制、覃恩、招贤、布政事、举正直、选将、纳畜、出师、酝酿、庆赐、施恩、临政、搬移、恤孤茕、安抚边境	剃头、上表章、修置产室、开渠、穿井、平治道涂、破屋坏垣、伐木、破土、安葬、启攒、补垣、修饰垣墙、整容、整手足甲、筑堤防、营建、上册
1942-10-25	一九四二 壬午[马]年	九月小	十六	周日	壬午 庚戌 辛亥 癸巳	马	天蝎座	无	立冬 (11, 8)	无	无	无	祭祀、出行、结婚姻、宴会、沐浴、剃头、修造、求医疗病、上表章、上官、竖柱上梁、经络、开市、纳财、扫舍宇、栽种、牧养、立券交易、雪冤、裁制、覃恩、缮城郭、招贤、举正直、选将、纳畜、上册、颁诏、出师、祈福、酝酿、庆赐、整容、开仓、解除、施恩、整手足甲、纳采、修仓库、临政、搬移、营建、恤孤茕、宣政事、求嗣、安抚边境	嫁娶、冠带、修置产室、开渠、穿井、安碓硙、平治道涂、破屋坏垣、畋猎、破土、安葬、补垣、修饰垣墙、塞穴、鼓铸、修宫室、取鱼、筑堤防
1942-10-26	一九四二 壬午[马]年	九月小	十七	周一	壬午 庚戌 壬子 乙巳	马	天蝎座	无	立冬 (11, 8)	无	金龙四大王诞	无	出行、结婚姻、宴会、嫁娶、沐浴、修造、求医疗病、上表章、上官、进人口、竖柱上梁、经络、开市、纳财、栽种、牧养、安葬、立券交易、雪冤、赴任、裁制、诉讼、缮城郭、覃恩、布政事、塞穴、纳畜、上册、入宅、祈福、庆赐、开仓、补垣、解除、纳采、修仓库、临政、搬移、求嗣、恤孤茕、修宫室	祭祀、剃头、冠带、修置产室、开渠、穿井、安碓硙、平治道涂、破屋坏垣、远回、苫盖、招贤、选将、颁诏、修饰垣墙、出师、整容、鼓铸、整手足甲、筑堤防、营建、宣政事、安抚边境
1942-10-27	一九四二 壬午[马]年	九月小	十八	周二	壬午 庚戌 癸丑 丁巳	马	天蝎座	无	立冬 (11, 8)	无	无	无	诸事不宜	诸事不宜
1942-10-28	一九四二 壬午[马]年	九月小	十九	周三	壬午 庚戌 甲寅 己巳	马	天蝎座	无	立冬 (11, 8)	无	观世音菩萨出家	无	诸事不宜	祭祀、出行、结婚姻、宴会、嫁娶、安床、剃头、修造、求医疗病、上表章、上官、冠带、进人口、竖柱上梁、经络、开市、纳财、修置产室、开渠、穿井、安碓硙、平治道涂、破屋坏垣、伐木、畋猎、栽种、牧养、破土、安葬、启攒、立券交易、裁制、乘船渡水、缮城郭、远回、招贤、布政事、选将、举正直、塞穴、纳畜、取鱼、上册、颁诏、修饰垣墙、出师、祈福、酝酿、庆赐、开仓、整容、鼓铸、补垣、解除、修宫室、施恩、整手足甲、纳采、修仓库、临政、搬移、营建、筑堤防、宣政事、求嗣、安抚边境
1942-10-29	一九四二 壬午[马]年	九月小	二十	周四	壬午 庚戌 乙卯 辛巳	马	天蝎座	无	立冬 (11, 8)	无	无	无	祭祀、结婚姻、宴会、嫁娶、上官、进人口、经络、纳财、捕捉、畋猎、安葬、立券交易、纳畜、祈福、酝酿、临政、安抚边境	出行、安床、修造、求医疗病、上表章、冠带、竖柱上梁、开市、修置产室、开渠、穿井、安碓硙、平治道涂、破屋坏垣、栽种、牧养、裁制、乘船渡水、缮城郭、招贤、布政事、举正直、选将、塞穴、取鱼、上册、颁诏、修饰垣墙、出师、庆赐、开仓、鼓铸、补垣、解除、修宫室、施恩、纳采、修仓库、搬移、营建、筑堤防、宣政事、求嗣
1942-10-30	一九四二 壬午[马]年	九月小	廿一	周五	壬午 庚戌 丙辰 癸巳	马	天蝎座	无	立冬 (11, 8)	无	无	无	祭祀、沐浴、雪冤、覃恩、解除、恤孤茕	安床、冠带、进人口、经络、开市、修置产室、开渠、穿井、安碓硙、平治道涂、伐木、捕捉、畋猎、破土、启攒、立券交易、布政事、塞穴、取鱼、修饰垣墙、酝酿、鼓铸、开仓、补垣、修宫室、筑堤防
1942-10-31	一九四二 壬午[马]年	九月小	廿二	周六	壬午 庚戌 丁巳 乙巳	马	天蝎座	无	立冬 (11, 8)	无	无	无	祭祀、安床、畋猎、雪冤、入宅、赴任、纳采、搬移、恤孤茕	出行、结婚姻、剃头、求医疗病、修置产室、开渠、穿井、安碓硙、平治道涂、破屋坏垣、栽种、破土、安葬、启攒、针刺、缮城郭、纳畜、修饰垣墙、整容、开仓、补垣、解除、修仓库、筑堤防、营建、修宫室
