1942-04-01	一九四二 壬午[马]年 二月小十六	周三	无	无	国际愚人节	壬午 癸卯 甲申 己巳	无	清明 (4, 5)	马	白羊座	祭祀、沐浴、扫舍宇、捕捉、恤孤茕、覃恩、雪冤	安床、冠带、进人口、经络、开市、纳财、修置产室、开渠、穿井、安碓硙、破屋坏垣、畋猎、启攒、补垣、开仓、鼓铸、布政事、筑堤防、酝酿、修饰垣墙、塞穴、修宫室、立券交易
1942-04-02	一九四二 壬午[马]年 二月小十七	周四	无	东方杜将军诞	国际儿童图书日	壬午 癸卯 乙酉 辛巳	无	清明 (4, 5)	马	白羊座	诸事不宜	诸事不宜
1942-04-03	一九四二 壬午[马]年 二月小十八	周五	无	至圣先师孔子讳辰	无	壬午 癸卯 丙戌 癸巳	无	清明 (4, 5)	马	白羊座	祭祀、赴任、取鱼、诉讼	上表章、开渠、穿井、补垣、颁诏、出师、招贤、布政事、筑堤防、营建、宣政事、上册、塞穴
1942-04-04	一九四二 壬午[马]年 二月小十九	周六	无	观音大士诞	无	壬午 癸卯 丁亥 乙巳	无	清明 (4, 5)	马	白羊座	祭祀、出行、结婚姻、宴会、沐浴、修造、求医疗病、上表章、上官、入学、进人口、竖柱上梁、经络、开市、纳财、安碓硙、栽种、牧养、庆赐、临政、搬移、裁制、开仓、纳采、修仓库、赴任、入宅、纳畜、解除、筑堤防、举正直、酝酿、求嗣、缮城郭、施恩、上册、修宫室、立券交易、祈福	嫁娶、剃头、破土、安葬、启攒、整容、整手足甲
1942-04-05	一九四二 壬午[马]年 二月小二十	周日	清明节	无	无	壬午 甲辰 戊子 丁巳	清明	谷雨 (4, 21)	马	白羊座	祭祀、结婚姻、宴会、沐浴、上官、入学、进人口、竖柱上梁、经络、开市、纳财、安碓硙、栽种、牧养、庆赐、临政、裁制、纳采、立券交易、修仓库、赴任、纳畜、出师、筑堤防、选将、举正直、酝酿、缮城郭、安抚边境、施恩、修宫室、祈福、诉讼	破土、启攒、远回
1942-04-06	一九四二 壬午[马]年 二月小廿一	周一	无	普贤菩萨诞	无	壬午 甲辰 己丑 己巳	无	谷雨 (4, 21)	马	白羊座	进人口、纳财、捕捉、取鱼、纳畜	出行、结婚姻、宴会、安床、修造、求医疗病、上表章、上官、冠带、竖柱上梁、经络、开市、修置产室、开渠、穿井、破土、安葬、启攒、庆赐、临政、搬移、裁制、开仓、纳采、修仓库、鼓铸、颁诏、解除、招贤、布政事、筑堤防、举正直、酝酿、营建、缮城郭、施恩、宣政事、上册、修宫室、整手足甲、立券交易
1942-04-07	一九四二 壬午[马]年 二月小廿二	周二	无	无	世界卫生日	壬午 甲辰 庚寅 辛巳	无	谷雨 (4, 21)	马	白羊座	出行、宴会、修造、上表章、上官、入学、竖柱上梁、开市、纳财、修置产室、开渠、穿井、安碓硙、栽种、牧养、庆赐、临政、搬移、裁制、开仓、纳采、立券交易、修仓库、颁诏、恤孤茕、解除、招贤、选将、覃恩、举正直、求嗣、雪冤、缮城郭、施恩、安抚边境、宣政事、上册、修宫室、祈福	祭祀、嫁娶、伐木、畋猎、取鱼、针刺、乘船渡水
1942-04-08	一九四二 壬午[马]年 二月小廿三	周三	无	无	无	壬午 甲辰 辛卯 癸巳	无	谷雨 (4, 21)	马	白羊座	补垣、塞穴	出行、结婚姻、宴会、嫁娶、安床、修造、求医疗病、上表章、上官、冠带、进人口、竖柱上梁、经络、开市、纳财、修置产室、开渠、穿井、栽种、牧养、破土、安葬、启攒、庆赐、临政、搬移、开仓、纳采、立券交易、修仓库、颁诏、乘船渡水、纳畜、出师、解除、招贤、布政事、选将、筑堤防、举正直、酝酿、疗目、针刺、求嗣、营建、缮城郭、施恩、安抚边境、宣政事、上册、修宫室、整手足甲、祈福
1942-04-09	一九四二 壬午[马]年 二月小廿四	周四	无	无	无	壬午 甲辰 壬辰 乙巳	无	谷雨 (4, 21)	马	白羊座	祭祀、入宅、恤孤茕、覃恩、雪冤	安床、剃头、冠带、开市、修置产室、开渠、穿井、平治道涂、破屋坏垣、伐木、畋猎、破土、启攒、补垣、开仓、鼓铸、整容、布政事、筑堤防、取鱼、修饰垣墙、塞穴、整手足甲
1942-04-10	一九四二 壬午[马]年 二月小廿五	周五	无	无	无	壬午 甲辰 癸巳 丁巳	无	谷雨 (4, 21)	马	白羊座	沐浴、扫舍宇、恤孤茕、雪冤	出行、结婚姻、宴会、嫁娶、安床、修造、上表章、冠带、进人口、竖柱上梁、修置产室、开渠、穿井、安碓硙、破屋坏垣、破土、安葬、启攒、庆赐、补垣、搬移、裁制、纳采、修仓库、鼓铸、颁诏、招贤、布政事、筑堤防、求嗣、营建、缮城郭、修饰垣墙、宣政事、上册、塞穴、修宫室、祈福
1942-04-11	一九四二 壬午[马]年 二月小廿六	周六	无	无	无	壬午 甲辰 甲午 己巳	无	谷雨 (4, 21)	马	白羊座	诸事不宜	祭祀、出行、结婚姻、宴会、嫁娶、安床、剃头、修造、求医疗病、上表章、上官、冠带、进人口、竖柱上梁、经络、开市、纳财、修置产室、开渠、穿井、安碓硙、破屋坏垣、栽种、牧养、破土、安葬、启攒、庆赐、补垣、临政、搬移、裁制、开仓、纳采、立券交易、修仓库、鼓铸、颁诏、解除、纳畜、出师、入宅、招贤、布政事、选将、整容、筑堤防、举正直、酝酿、求嗣、营建、缮城郭、施恩、安抚边境、宣政事、修饰垣墙、上册、苫盖、塞穴、整手足甲、修宫室、祈福
1942-04-12	一九四二 壬午[马]年 二月小廿七	周日	无	无	无	壬午 甲辰 乙未 辛巳	无	谷雨 (4, 21)	马	白羊座	诸事不宜	诸事不宜
1942-04-13	一九四二 壬午[马]年 二月小廿八	周一	无	无	无	壬午 甲辰 丙申 癸巳	无	谷雨 (4, 21)	马	白羊座	祭祀、沐浴、扫舍宇	出行、结婚姻、宴会、嫁娶、安床、剃头、修造、求医疗病、上表章、上官、冠带、进人口、竖柱上梁、经络、开市、纳财、修置产室、开渠、穿井、安碓硙、平治道涂、破屋坏垣、伐木、捕捉、畋猎、栽种、牧养、破土、安葬、启攒、庆赐、补垣、临政、搬移、裁制、开仓、纳采、立券交易、修仓库、鼓铸、颁诏、解除、纳畜、出师、招贤、布政事、选将、整容、筑堤防、举正直、酝酿、求嗣、营建、缮城郭、安抚边境、施恩、宣政事、修饰垣墙、取鱼、上册、远回、塞穴、整手足甲、修宫室、祈福
1942-04-14	一九四二 壬午[马]年 二月小廿九	周二	无	无	无	壬午 甲辰 丁酉 乙巳	无	谷雨 (4, 21)	马	白羊座	祭祀、出行、结婚姻、嫁娶、沐浴、修造、求医疗病、上表章、上官、进人口、竖柱上梁、经络、纳财、扫舍宇、捕捉、栽种、牧养、安葬、临政、搬移、裁制、开仓、纳采、修仓库、赴任、颁诏、入宅、恤孤茕、出师、解除、纳畜、招贤、选将、覃恩、举正直、酝酿、求嗣、雪冤、营建、缮城郭、施恩、宣政事、安抚边境、上册、修宫室、整手足甲、立券交易、祈福	宴会、剃头、冠带、修置产室、开渠、穿井、安碓硙、平治道涂、破屋坏垣、畋猎、筑堤防、修饰垣墙、补垣、取鱼、乘船渡水
1942-04-15	一九四二 壬午[马]年 三月大初一	周三	无	二殿楚江王诞	无	壬午 甲辰 戊戌 丁巳	无	谷雨 (4, 21)	马	白羊座	祭祀、沐浴、破屋坏垣、解除	结婚姻、宴会、安床、修造、上官、冠带、进人口、竖柱上梁、经络、开市、纳财、修置产室、开渠、穿井、安碓硙、伐木、栽种、牧养、破土、安葬、启攒、庆赐、补垣、临政、开仓、纳采、修仓库、鼓铸、颁诏、乘船渡水、纳畜、招贤、布政事、筑堤防、举正直、酝酿、求嗣、营建、缮城郭、施恩、宣政事、修饰垣墙、取鱼、上册、塞穴、修宫室、立券交易
1942-04-16	一九四二 壬午[马]年 三月大初二	周四	无	无	无	壬午 甲辰 己亥 己巳	无	谷雨 (4, 21)	马	白羊座	安床、沐浴、纳财、栽种、牧养、选将、安抚边境、取鱼、纳畜、出师	出行、嫁娶、求医疗病、畋猎、破土、安葬、启攒、修仓库、祈福、解除、开仓、求嗣
1942-04-17	一九四二 壬午[马]年 三月大初三	周五	无	三月三-玄天上帝诞	无	壬午 甲辰 庚子 辛巳	无	谷雨 (4, 21)	马	白羊座	祭祀、宴会、沐浴、求医疗病、上官、入学、进人口、竖柱上梁、开市、纳财、安碓硙、栽种、牧养、安葬、庆赐、临政、裁制、开仓、纳采、立券交易、修仓库、赴任、解除、纳畜、出师、筑堤防、选将、举正直、酝酿、求嗣、缮城郭、安抚边境、施恩、修宫室、祈福、诉讼	远回
1942-04-18	一九四二 壬午[马]年 三月大初四	周六	无	无	无	壬午 甲辰 辛丑 癸巳	无	谷雨 (4, 21)	马	白羊座	进人口、纳财、捕捉、取鱼、纳畜	出行、结婚姻、宴会、嫁娶、安床、修造、求医疗病、上表章、上官、冠带、竖柱上梁、经络、开市、修置产室、开渠、穿井、安碓硙、平治道涂、破屋坏垣、栽种、破土、安葬、启攒、庆赐、补垣、临政、搬移、裁制、开仓、纳采、立券交易、修仓库、鼓铸、颁诏、解除、招贤、布政事、筑堤防、举正直、酝酿、营建、缮城郭、施恩、宣政事、修饰垣墙、上册、修宫室
1942-04-19	一九四二 壬午[马]年 三月大初五	周日	无	无	无	壬午 甲辰 壬寅 乙巳	无	谷雨 (4, 21)	马	白羊座	结婚姻、宴会、求医疗病、上表章、上官、入学、竖柱上梁、开市、牧养、庆赐、临政、搬移、裁制、纳采、颁诏、恤孤茕、解除、入宅、纳畜、招贤、选将、覃恩、举正直、求嗣、雪冤、施恩、安抚边境、宣政事、上册、立券交易、祈福	祭祀、开渠、平治道涂、破屋坏垣、伐木、畋猎、筑堤防、补垣、取鱼、修饰垣墙、针刺、乘船渡水
1942-04-20	一九四二 壬午[马]年 三月大初六	周一	无	无	无	壬午 甲辰 癸卯 丁巳	无	谷雨 (4, 21)	马	白羊座	塞穴	出行、结婚姻、宴会、嫁娶、安床、修造、求医疗病、上表章、上官、冠带、进人口、竖柱上梁、经络、开市、纳财、修置产室、开渠、穿井、安碓硙、平治道涂、破屋坏垣、栽种、牧养、破土、安葬、启攒、庆赐、补垣、临政、搬移、开仓、纳采、立券交易、修仓库、颁诏、解除、纳畜、出师、招贤、布政事、选将、筑堤防、举正直、酝酿、疗目、针刺、求嗣、营建、缮城郭、施恩、安抚边境、宣政事、修饰垣墙、上册、修宫室、整手足甲、祈福
1942-04-21	一九四二 壬午[马]年 三月大初七	周二	无	无	无	壬午 甲辰 甲辰 己巳	谷雨	立夏 (5, 6)	马	金牛座	诸事不宜	出行、结婚姻、宴会、嫁娶、安床、剃头、修造、求医疗病、上表章、上官、冠带、进人口、竖柱上梁、经络、开市、纳财、修置产室、开渠、穿井、安碓硙、平治道涂、破屋坏垣、伐木、栽种、牧养、破土、安葬、启攒、庆赐、补垣、临政、搬移、裁制、开仓、纳采、立券交易、修仓库、鼓铸、颁诏、解除、纳畜、出师、招贤、整容、布政事、选将、筑堤防、举正直、酝酿、求嗣、营建、缮城郭、施恩、宣政事、安抚边境、修饰垣墙、上册、塞穴、整手足甲、修宫室、祈福
1942-04-22	一九四二 壬午[马]年 三月大初八	周三	无	六殿卞城王诞	列宁诞辰纪念日	壬午 甲辰 乙巳 辛巳	无	立夏 (5, 6)	马	金牛座	沐浴、扫舍宇、恤孤茕、雪冤	出行、结婚姻、宴会、嫁娶、安床、修造、上表章、冠带、进人口、竖柱上梁、修置产室、开渠、穿井、安碓硙、平治道涂、破屋坏垣、破土、启攒、庆赐、补垣、搬移、裁制、纳采、修仓库、鼓铸、颁诏、招贤、布政事、筑堤防、求嗣、营建、缮城郭、修饰垣墙、宣政事、上册、塞穴、修宫室、祈福
1942-04-23	一九四二 壬午[马]年 三月大初九	周四	无	无	世界图书和版权日	壬午 甲辰 丙午 癸巳	无	立夏 (5, 6)	马	金牛座	诸事不宜	祭祀、出行、结婚姻、宴会、嫁娶、安床、剃头、修造、求医疗病、上表章、上官、冠带、进人口、竖柱上梁、经络、开市、立券、纳财、修置产室、开渠、穿井、安碓硙、平治道涂、破屋坏垣、栽种、牧养、破土、安葬、启攒、庆赐、补垣、开张、临政、搬移、裁制、开仓、纳采、立券交易、修仓库、鼓铸、颁诏、解除、纳畜、出师、入宅、招贤、布政事、选将、整容、筑堤防、举正直、酝酿、求嗣、营建、缮城郭、施恩、安抚边境、宣政事、修饰垣墙、上册、苫盖、塞穴、整手足甲、修宫室、祈福
1942-04-24	一九四二 壬午[马]年 三月大初十	周五	无	无	无	壬午 甲辰 丁未 乙巳	无	立夏 (5, 6)	马	金牛座	祭祀、赴任、入宅、恤孤茕、覃恩、雪冤	出行、结婚姻、宴会、嫁娶、安床、剃头、修造、求医疗病、上表章、上官、冠带、进人口、竖柱上梁、经络、开市、纳财、修置产室、开渠、穿井、安碓硙、平治道涂、破屋坏垣、畋猎、栽种、牧养、破土、安葬、启攒、庆赐、补垣、临政、搬移、裁制、开仓、纳采、修仓库、鼓铸、颁诏、解除、纳畜、出师、招贤、布政事、选将、筑堤防、整容、举正直、酝酿、求嗣、营建、缮城郭、施恩、安抚边境、宣政事、取鱼、修饰垣墙、上册、塞穴、修宫室、整手足甲、立券交易、祈福
1942-04-25	一九四二 壬午[马]年 三月大十一	周六	无	无	无	壬午 甲辰 戊申 丁巳	无	立夏 (5, 6)	马	金牛座	沐浴、扫舍宇	出行、结婚姻、宴会、嫁娶、安床、剃头、修造、求医疗病、上表章、上官、冠带、进人口、竖柱上梁、经络、开市、纳财、修置产室、开渠、穿井、安碓硙、平治道涂、破屋坏垣、伐木、捕捉、畋猎、栽种、牧养、破土、安葬、启攒、庆赐、补垣、临政、搬移、裁制、开仓、纳采、立券交易、修仓库、鼓铸、颁诏、解除、纳畜、出师、招贤、布政事、选将、整容、筑堤防、举正直、酝酿、求嗣、营建、缮城郭、安抚边境、施恩、宣政事、修饰垣墙、取鱼、上册、远回、塞穴、整手足甲、修宫室、祈福
1942-04-26	一九四二 壬午[马]年 三月大十二	周日	无	无	世界知识产权日	壬午 甲辰 己酉 己巳	无	立夏 (5, 6)	马	金牛座	祭祀、结婚姻、嫁娶、沐浴、剃头、求医疗病、上官、进人口、经络、纳财、扫舍宇、捕捉、安葬、临政、解除、恤孤茕、纳畜、布政事、整容、覃恩、酝酿、雪冤、取鱼、安抚边境、整手足甲、立券交易、祈福	出行、宴会、安床、修造、上表章、冠带、竖柱上梁、开市、修置产室、开渠、穿井、安碓硙、平治道涂、破屋坏垣、栽种、牧养、补垣、搬移、开仓、纳采、修仓库、乘船渡水、出师、招贤、筑堤防、选将、举正直、求嗣、营建、缮城郭、施恩、修饰垣墙、上册、修宫室
1942-04-27	一九四二 壬午[马]年 三月大十三	周一	无	无	无	壬午 甲辰 庚戌 辛巳	无	立夏 (5, 6)	马	金牛座	祭祀、沐浴、求医疗病、解除、恤孤茕、覃恩、雪冤	嫁娶、冠带、修置产室、开渠、穿井、安碓硙、平治道涂、伐木、破土、安葬、启攒、补垣、修仓库、鼓铸、颁诏、乘船渡水、纳畜、招贤、筑堤防、营建、修饰垣墙、取鱼、宣政事、上册、塞穴
1942-04-28	一九四二 壬午[马]年 三月大十四	周二	无	无	无	壬午 甲辰 辛亥 癸巳	无	立夏 (5, 6)	马	金牛座	宴会、安床、沐浴、纳财、牧养、庆赐、布政事、选将、覃恩、安抚边境、取鱼、恤孤茕、纳畜、出师、雪冤	出行、嫁娶、修造、求医疗病、修置产室、开渠、穿井、安碓硙、平治道涂、破屋坏垣、畋猎、破土、安葬、启攒、补垣、开仓、修仓库、解除、乘船渡水、筑堤防、酝酿、求嗣、营建、缮城郭、修饰垣墙、修宫室、祈福
1942-04-29	一九四二 壬午[马]年 三月大十五	周三	无	昊天上帝诞	无	壬午 甲辰 壬子 乙巳	无	立夏 (5, 6)	马	金牛座	祭祀、结婚姻、宴会、沐浴、上表章、上官、入学、进人口、竖柱上梁、经络、牧养、安葬、庆赐、临政、裁制、纳采、赴任、颁诏、入宅、恤孤茕、解除、纳畜、招贤、覃恩、举正直、酝酿、求嗣、雪冤、施恩、宣政事、上册、祈福、诉讼	剃头、修置产室、开渠、穿井、平治道涂、破屋坏垣、畋猎、整容、补垣、取鱼、修饰垣墙、远回、整手足甲、开仓
1942-04-30	一九四二 壬午[马]年 三月大十六	周四	无	准提菩萨诞	无	壬午 甲辰 癸丑 丁巳	无	立夏 (5, 6)	马	金牛座	进人口、纳财、捕捉、覃恩、取鱼、纳畜、恤孤茕、雪冤	出行、结婚姻、嫁娶、安床、修造、求医疗病、上表章、上官、冠带、竖柱上梁、经络、开市、修置产室、开渠、穿井、安碓硙、平治道涂、破屋坏垣、栽种、破土、安葬、启攒、补垣、临政、搬移、裁制、开仓、纳采、修仓库、鼓铸、颁诏、解除、招贤、筑堤防、举正直、酝酿、营建、缮城郭、施恩、宣政事、修饰垣墙、上册、修宫室、立券交易
