1944-03-01 10:00:00	一九四四 甲申[猴]年 二月小初七	星期三	国、际、海、豹、日	甲申 丙寅 甲子 己巳	无	惊蛰 (3, 6)	猴	双鱼座	祭祀、出行、宴会、嫁娶、沐浴、修造、求医疗病、上表章、上官、入学、开市、纳财、修置产室、开渠、穿井、安碓硙、栽种、牧养、赴任、纳畜、招贤、施恩、选将、解除、颁诏、出师、修仓库、祈福、缮城郭、入宅、上册、纳采、求嗣、宣政事、举正直、修宫室、覃恩、恤孤茕、诉讼、裁制、搬移、安抚边境、庆赐、雪冤、临政	结婚姻、安床、剃头、冠带、进人口、竖柱上梁、经络、破屋坏垣、伐木、畋猎、破土、安葬、营建、开仓、苫盖、整容、修饰垣墙、补垣、取鱼、鼓铸、整手足甲、筑堤防、塞穴、酝酿
1944-03-02 10:00:00	一九四四 甲申[猴]年 二月小初八	星期四	释、迦、牟、尼、佛、出、家	甲申 丙寅 乙丑 辛巳	无	惊蛰 (3, 6)	猴	双鱼座	诸事不宜	诸事不宜
1944-03-03 10:00:00	一九四四 甲申[猴]年 二月小初九	星期五	全、国、爱、耳、日	甲申 丙寅 丙寅 癸巳	无	惊蛰 (3, 6)	猴	双鱼座	宴会、经络、纳财、牧养、纳畜、施恩、布政事、举正直、覃恩、恤孤茕、立券交易、酝酿、裁制、庆赐、雪冤	祭祀、剃头、修置产室、开渠、穿井、平治道涂、破屋坏垣、伐木、捕捉、畋猎、修饰垣墙、补垣、筑堤防、整容、取鱼、整手足甲
1944-03-04 10:00:00	一九四四 甲申[猴]年 二月小初十	星期六	无	甲申 丙寅 丁卯 乙巳	无	惊蛰 (3, 6)	猴	双鱼座	祭祀、出行、结婚姻、宴会、嫁娶、沐浴、修造、求医疗病、上表章、上官、竖柱上梁、纳财、扫舍宇、栽种、牧养、安葬、营建、开仓、纳畜、招贤、施恩、选将、解除、颁诏、修仓库、出师、祈福、缮城郭、上册、整手足甲、纳采、求嗣、宣政事、举正直、覃恩、恤孤茕、立券交易、裁制、搬移、安抚边境、庆赐、雪冤、临政、修宫室	剃头、冠带、修置产室、穿井、畋猎、乘船渡水、筑堤防、取鱼
1944-03-05 10:00:00	一九四四 甲申[猴]年 二月小十一	星期日	周、恩、来、诞、辰、纪、念、日、,、中、国、青、年、志、愿、者、服、务、日	甲申 丙寅 戊辰 丁巳	无	惊蛰 (3, 6)	猴	双鱼座	宴会、上表章、竖柱上梁、经络、安葬、布政事、缮城郭、上册、覃恩、恤孤茕、裁制、庆赐、雪冤、修宫室	祭祀、结婚姻、嫁娶、修造、上官、立券、栽种、乘船渡水、招贤、施恩、选将、纳采、举正直、安抚边境、开张、取鱼、鼓铸、出师
1944-03-06 10:00:00	一九四四 甲申[猴]年 二月小十二	星期一	世、界、青、光、眼、日	甲申 丁卯 己巳 己巳	惊蛰	春分 (3, 21)	猴	双鱼座	宴会、竖柱上梁、经络、开市、纳财、牧养、赴任、解除、祈福、入宅、求嗣、覃恩、恤孤茕、立券交易、塞穴、裁制、庆赐、雪冤	祭祀、出行、剃头、修置产室、开渠、穿井、安碓硙、平治道涂、破屋坏垣、捕捉、畋猎、破土、启攒、取鱼、筑堤防、整容、修饰垣墙
1944-03-07 10:00:00	一九四四 甲申[猴]年 二月小十三	星期二	无	甲申 丁卯 庚午 辛巳	无	春分 (3, 21)	猴	双鱼座	祭祀、平治道涂、修饰垣墙	出行、结婚姻、宴会、嫁娶、安床、修造、求医疗病、上表章、上官、冠带、进人口、竖柱上梁、经络、开市、纳财、修置产室、开渠、穿井、栽种、牧养、破土、安葬、启攒、营建、开仓、纳畜、招贤、施恩、选将、苫盖、解除、颁诏、出师、布政事、修仓库、祈福、缮城郭、鼓铸、上册、纳采、求嗣、宣政事、举正直、修宫室、筑堤防、立券交易、酝酿、裁制、搬移、安抚边境、庆赐、临政
1944-03-08 10:00:00	一九四四 甲申[猴]年 二月小十四	星期三	国、际、劳、动、妇、女、节	甲申 丁卯 辛未 癸巳	无	春分 (3, 21)	猴	双鱼座	祭祀、结婚姻、宴会、修造、冠带、进人口、竖柱上梁、经络、安碓硙、破土、纳畜、缮城郭、祈福、纳采、求嗣、恤孤茕、裁制、庆赐、雪冤、修宫室	出行、求医疗病、上表章、开市、修置产室、栽种、安葬、开仓、选将、解除、针刺、出师、上册、乘船渡水、安抚边境
1944-03-09 10:00:00	一九四四 甲申[猴]年 二月小十五	星期四	释、迦、牟、尼、佛、般、涅、槃	甲申 丁卯 壬申 乙巳	无	春分 (3, 21)	猴	双鱼座	祭祀、沐浴、扫舍宇、捕捉、覃恩、恤孤茕、雪冤	安床、冠带、进人口、经络、开市、纳财、修置产室、开渠、穿井、安碓硙、破屋坏垣、畋猎、启攒、开仓、修饰垣墙、布政事、补垣、鼓铸、修宫室、筑堤防、立券交易、塞穴、酝酿
1944-03-10 10:00:00	一九四四 甲申[猴]年 二月小十六	星期五	无	甲申 丁卯 癸酉 丁巳	无	春分 (3, 21)	猴	双鱼座	诸事不宜	诸事不宜
1944-03-11 10:00:00	一九四四 甲申[猴]年 二月小十七	星期六	东、方、杜、将、军、诞	甲申 丁卯 甲戌 己巳	无	春分 (3, 21)	猴	双鱼座	祭祀、出行、结婚姻、宴会、嫁娶、安床、修造、求医疗病、上表章、上官、进人口、竖柱上梁、经络、开市、纳财、栽种、牧养、安葬、赴任、营建、纳畜、招贤、选将、施恩、解除、颁诏、修仓库、出师、祈福、缮城郭、入宅、取鱼、上册、纳采、求嗣、宣政事、举正直、覃恩、恤孤茕、立券交易、酝酿、诉讼、裁制、搬移、安抚边境、庆赐、雪冤、临政	诸事不忌
1944-03-12 10:00:00	一九四四 甲申[猴]年 二月小十八	星期日	孙、中、山、逝、世、纪、念、日、,、中、国、植、树、节、至、圣、先、师、孔、子、讳、辰	甲申 丁卯 乙亥 辛巳	无	春分 (3, 21)	猴	双鱼座	出行、宴会、沐浴、修造、上表章、上官、入学、竖柱上梁、经络、安碓硙、牧养、纳畜、施恩、缮城郭、上册、举正直、筑堤防、酝酿、裁制、搬移、庆赐、临政、修宫室	嫁娶、破土、安葬、启攒、开仓
1944-03-13 10:00:00	一九四四 甲申[猴]年 二月小十九	星期一	观、音、大、士、诞	甲申 丁卯 丙子 癸巳	无	春分 (3, 21)	猴	双鱼座	诸事不宜	诸事不宜
1944-03-14 10:00:00	一九四四 甲申[猴]年 二月小二十	星期二	马、克、思、逝、世、纪、念、日	甲申 丁卯 丁丑 乙巳	无	春分 (3, 21)	猴	双鱼座	出行、结婚姻、宴会、嫁娶、求医疗病、上表章、上官、入学、竖柱上梁、修置产室、开渠、穿井、安碓硙、牧养、纳畜、招贤、施恩、选将、解除、颁诏、祈福、缮城郭、上册、纳采、求嗣、宣政事、举正直、修宫室、覃恩、恤孤茕、裁制、搬移、安抚边境、庆赐、雪冤、临政	剃头、冠带、伐木、畋猎、乘船渡水、补垣、塞穴、取鱼、鼓铸、整容
1944-03-15 10:00:00	一九四四 甲申[猴]年 二月小廿一	星期三	国、际、消、费、者、权、益、日、普、贤、菩、萨、诞	甲申 丁卯 戊寅 丁巳	无	春分 (3, 21)	猴	双鱼座	经络、纳财、栽种、牧养、破土、安葬、纳畜、修仓库、缮城郭、补垣、筑堤防、覃恩、恤孤茕、立券交易、塞穴、酝酿、裁制、雪冤	祭祀、出行、结婚姻、宴会、嫁娶、安床、修造、求医疗病、上表章、上官、进人口、竖柱上梁、开市、修置产室、开渠、穿井、畋猎、营建、开仓、招贤、施恩、选将、解除、针刺、颁诏、出师、布政事、祈福、取鱼、上册、整手足甲、疗目、远回、纳采、求嗣、宣政事、举正直、修宫室、搬移、安抚边境、庆赐、临政
1944-03-16 10:00:00	一九四四 甲申[猴]年 二月小廿二	星期四	无	甲申 丁卯 己卯 己巳	无	春分 (3, 21)	猴	双鱼座	出行、宴会、上官、进人口、经络、纳财、牧养、赴任、纳畜、招贤、施恩、颁诏、入宅、宣政事、举正直、覃恩、恤孤茕、立券交易、酝酿、裁制、搬移、庆赐、雪冤、临政	剃头、修置产室、开渠、穿井、平治道涂、破屋坏垣、伐木、畋猎、启攒、修饰垣墙、开仓、乘船渡水、补垣、苫盖、筑堤防、整容、取鱼、整手足甲
1944-03-17 10:00:00	一九四四 甲申[猴]年 二月小廿三	星期五	国、际、航、海、日	甲申 丁卯 庚辰 辛巳	无	春分 (3, 21)	猴	双鱼座	沐浴、剃头、扫舍宇、施恩、解除、整容、布政事、举正直、覃恩、恤孤茕、雪冤、临政	出行、宴会、嫁娶、修造、求医疗病、上表章、上官、进人口、经络、开市、纳财、修置产室、畋猎、牧养、破土、安葬、启攒、开仓、纳畜、选将、出师、修仓库、祈福、上册、整手足甲、乘船渡水、纳采、求嗣、立券交易、酝酿、安抚边境、庆赐
1944-03-18 10:00:00	一九四四 甲申[猴]年 二月小廿四	星期六	全、国、科、技、人、才、活、动、日	甲申 丁卯 辛巳 癸巳	无	春分 (3, 21)	猴	双鱼座	宴会、竖柱上梁、经络、开市、纳财、布政事、祈福、覃恩、恤孤茕、立券交易、塞穴、裁制、庆赐、雪冤	祭祀、出行、结婚姻、嫁娶、修造、修置产室、开渠、穿井、安碓硙、平治道涂、破屋坏垣、捕捉、畋猎、栽种、破土、启攒、营建、纳畜、招贤、施恩、选将、颁诏、修饰垣墙、出师、取鱼、纳采、宣政事、举正直、筑堤防、酝酿、安抚边境
1944-03-19 10:00:00	一九四四 甲申[猴]年 二月小廿五	星期日	无	甲申 丁卯 壬午 乙巳	无	春分 (3, 21)	猴	双鱼座	祭祀、平治道涂、修饰垣墙、覃恩、恤孤茕、雪冤	出行、结婚姻、宴会、嫁娶、安床、修造、求医疗病、上表章、上官、冠带、进人口、竖柱上梁、经络、开市、纳财、修置产室、开渠、穿井、栽种、牧养、破土、安葬、启攒、营建、开仓、纳畜、招贤、施恩、选将、苫盖、解除、颁诏、出师、布政事、修仓库、祈福、缮城郭、鼓铸、上册、纳采、求嗣、宣政事、举正直、筑堤防、立券交易、酝酿、裁制、搬移、安抚边境、庆赐、临政、修宫室
1944-03-20 10:00:00	一九四四 甲申[猴]年 二月小廿六	星期一	无	甲申 丁卯 癸未 丁巳	无	春分 (3, 21)	猴	双鱼座	祭祀、结婚姻、宴会、冠带、进人口、竖柱上梁、经络、纳畜、布政事、祈福、纳采、求嗣、覃恩、恤孤茕、酝酿、裁制、庆赐、雪冤	出行、求医疗病、上表章、开市、修置产室、开渠、穿井、平治道涂、破屋坏垣、栽种、营建、开仓、选将、解除、针刺、修饰垣墙、出师、补垣、上册、筑堤防、安抚边境
1944-03-21 10:00:00	一九四四 甲申[猴]年 二月小廿七	星期二	世、界、森、林、日、,、世、界、睡、眠、日	甲申 丁卯 甲申 己巳	春分	清明 (4, 5)	猴	白羊座	祭祀、沐浴、扫舍宇、捕捉、入宅、覃恩、恤孤茕、雪冤	安床、冠带、进人口、经络、开市、纳财、修置产室、开渠、穿井、安碓硙、破屋坏垣、畋猎、启攒、开仓、修饰垣墙、布政事、补垣、鼓铸、筑堤防、立券交易、塞穴、酝酿、修宫室
1944-03-22 10:00:00	一九四四 甲申[猴]年 二月小廿八	星期三	世、界、水、日	甲申 丁卯 乙酉 辛巳	无	清明 (4, 5)	猴	白羊座	诸事不宜	诸事不宜
1944-03-23 10:00:00	一九四四 甲申[猴]年 二月小廿九	星期四	世、界、气、象、日	甲申 丁卯 丙戌 癸巳	无	清明 (4, 5)	猴	白羊座	祭祀、赴任、取鱼、诉讼	上表章、开渠、穿井、营建、招贤、颁诏、出师、布政事、补垣、上册、宣政事、筑堤防、塞穴
1944-03-24 10:00:00	一九四四 甲申[猴]年 三月大初一	星期五	世、界、防、治、结、核、病、日、二、殿、楚、江、王、诞	甲申 丁卯 丁亥 乙巳	无	清明 (4, 5)	猴	白羊座	祭祀、出行、结婚姻、宴会、沐浴、上表章、上官、入学、进人口、竖柱上梁、经络、开市、纳财、安碓硙、栽种、牧养、开仓、纳畜、施恩、解除、缮城郭、祈福、上册、纳采、求嗣、举正直、筑堤防、立券交易、酝酿、裁制、搬移、庆赐、临政、修宫室	嫁娶、剃头、破土、安葬、启攒、整容、整手足甲
1944-03-25 10:00:00	一九四四 甲申[猴]年 三月大初二	星期六	无	甲申 丁卯 戊子 丁巳	无	清明 (4, 5)	猴	白羊座	诸事不宜	诸事不宜
1944-03-26 10:00:00	一九四四 甲申[猴]年 三月大初三	星期日	三、月、三、-、玄、天、上、帝、诞	甲申 丁卯 己丑 己巳	无	清明 (4, 5)	猴	白羊座	出行、宴会、修造、求医疗病、上表章、上官、入学、竖柱上梁、修置产室、开渠、穿井、安碓硙、牧养、赴任、营建、纳畜、招贤、施恩、解除、颁诏、祈福、缮城郭、入宅、上册、纳采、求嗣、宣政事、举正直、修宫室、覃恩、恤孤茕、裁制、搬移、庆赐、雪冤、临政	冠带、伐木、畋猎、乘船渡水、开仓、补垣、塞穴、取鱼、鼓铸
1944-03-27 10:00:00	一九四四 甲申[猴]年 三月大初四	星期一	无	甲申 丁卯 庚寅 辛巳	无	清明 (4, 5)	猴	白羊座	纳财、栽种、牧养、安葬、纳畜、选将、补垣、筑堤防、覃恩、恤孤茕、立券交易、塞穴、酝酿、裁制、安抚边境、雪冤	祭祀、出行、结婚姻、宴会、嫁娶、安床、修造、求医疗病、上表章、上官、进人口、竖柱上梁、经络、开市、修置产室、开渠、穿井、营建、开仓、招贤、施恩、解除、针刺、颁诏、出师、布政事、祈福、上册、疗目、远回、纳采、求嗣、宣政事、举正直、搬移、庆赐、临政、修宫室
1944-03-28 10:00:00	一九四四 甲申[猴]年 三月大初五	星期二	无	甲申 丁卯 辛卯 癸巳	无	清明 (4, 5)	猴	白羊座	宴会、上官、进人口、经络、纳财、纳畜、招贤、施恩、选将、出师、举正直、立券交易、裁制、安抚边境、庆赐、临政	剃头、求医疗病、上表章、修置产室、开渠、穿井、平治道涂、破屋坏垣、伐木、栽种、安葬、营建、开仓、苫盖、解除、整容、修饰垣墙、补垣、取鱼、上册、整手足甲、乘船渡水、求嗣、筑堤防、搬移
1944-03-29 10:00:00	一九四四 甲申[猴]年 三月大初六	星期三	无	甲申 丁卯 壬辰 乙巳	无	清明 (4, 5)	猴	白羊座	出行、沐浴、剃头、扫舍宇、施恩、解除、举正直、整容、临政	宴会、嫁娶、修造、求医疗病、上表章、上官、进人口、经络、开市、纳财、修置产室、开渠、穿井、畋猎、牧养、破土、安葬、启攒、纳畜、开仓、选将、出师、修仓库、祈福、整手足甲、上册、纳采、求嗣、立券交易、酝酿、安抚边境、庆赐
1944-03-30 10:00:00	一九四四 甲申[猴]年 三月大初七	星期四	无	甲申 丁卯 癸巳 丁巳	无	清明 (4, 5)	猴	白羊座	宴会、竖柱上梁、经络、开市、纳财、祈福、立券交易、塞穴、裁制、庆赐	祭祀、出行、结婚姻、嫁娶、修造、修置产室、开渠、穿井、安碓硙、平治道涂、破屋坏垣、捕捉、畋猎、栽种、破土、启攒、营建、纳畜、招贤、施恩、选将、颁诏、修饰垣墙、出师、取鱼、纳采、宣政事、举正直、筑堤防、安抚边境
1944-03-31 10:00:00	一九四四 甲申[猴]年 三月大初八	星期五	六、殿、卞、城、王、诞	甲申 丁卯 甲午 己巳	无	清明 (4, 5)	猴	白羊座	祭祀、平治道涂、修饰垣墙、入宅、覃恩、恤孤茕、雪冤	冠带、修置产室、开渠、穿井、畋猎、鼓铸、苫盖、筑堤防、取鱼、布政事
