1944-02-01	一九四四 甲申[猴]年	正月大	初八	周二	甲申 乙丑 乙未 辛巳	猴	水瓶座	无	立春 (2, 5)	无	五殿阎罗天子诞	无	雪冤、覃恩、解除、恤孤茕	剃头、冠带、修置产室、开渠、穿井、安碓硙、平治道涂、伐木、畋猎、启攒、布政事、塞穴、取鱼、修饰垣墙、整容、鼓铸、补垣、整手足甲、筑堤防
1944-02-02	一九四四 甲申[猴]年	正月大	初九	周三	甲申 乙丑 丙申 癸巳	猴	水瓶座	无	立春 (2, 5)	无	玉皇上帝诞	无	祭祀、沐浴、剃头、经络、开市、纳财、扫舍宇、伐木、畋猎、牧养、安葬、选将、纳畜、安抚边境、酝酿、整容、开仓、整手足甲	结婚姻、宴会、修造、修置产室、开渠、穿井、安碓硙、平治道涂、破屋坏垣、缮城郭、修饰垣墙、出师、庆赐、补垣、修宫室、纳采、修仓库、筑堤防、营建、求嗣
1944-02-03	一九四四 甲申[猴]年	正月大	初十	周四	甲申 乙丑 丁酉 乙巳	猴	水瓶座	无	立春 (2, 5)	无	无	无	出行、沐浴、求医疗病、上表章、上官、入学、进人口、竖柱上梁、经络、开市、纳财、扫舍宇、牧养、安葬、裁制、举正直、上册、酝酿、解除、施恩、整手足甲、临政	宴会、剃头、修置产室、开渠、穿井、平治道涂、破屋坏垣、畋猎、选将、补垣、修饰垣墙、出师、苫盖、营建
1944-02-04	一九四四 甲申[猴]年	正月大	十一	周五	甲申 乙丑 戊戌 丁巳	猴	水瓶座	无	立春 (2, 5)	无	无	无	捕捉、畋猎	祭祀、出行、结婚姻、宴会、嫁娶、安床、剃头、修造、求医疗病、上表章、上官、冠带、进人口、竖柱上梁、经络、开市、纳财、修置产室、开渠、穿井、安碓硙、平治道涂、破屋坏垣、栽种、牧养、破土、安葬、启攒、立券交易、裁制、缮城郭、招贤、布政事、举正直、选将、塞穴、纳畜、上册、颁诏、修饰垣墙、出师、祈福、安抚边境、酝酿、庆赐、开仓、鼓铸、整容、补垣、解除、修宫室、施恩、纳采、整手足甲、修仓库、临政、搬移、营建、筑堤防、宣政事、求嗣
1944-02-05	一九四四 甲申[猴]年	正月大	十二	周六	甲申 丙寅 己亥 己巳	猴	水瓶座	立春	雨水 (2, 20)	无	无	无	祭祀、出行、结婚姻、宴会、沐浴、修造、进人口、经络、开市、纳财、捕捉、栽种、牧养、安葬、立券交易、赴任、纳畜、入宅、祈福、酝酿、开仓、纳采、搬移	嫁娶、剃头、求医疗病、上表章、上官、冠带、竖柱上梁、修置产室、开渠、穿井、安碓硙、破屋坏垣、破土、启攒、裁制、缮城郭、招贤、布政事、举正直、选将、塞穴、上册、颁诏、修饰垣墙、出师、安抚边境、庆赐、整容、鼓铸、补垣、解除、修宫室、施恩、整手足甲、修仓库、临政、筑堤防、营建、宣政事、求嗣
1944-02-06	一九四四 甲申[猴]年	正月大	十三	周日	甲申 丙寅 庚子 辛巳	猴	水瓶座	无	雨水 (2, 20)	无	无	无	沐浴、入学、雪冤、覃恩、恤孤茕	结婚姻、冠带、进人口、竖柱上梁、经络、立券、伐木、畋猎、安葬、布政事、塞穴、取鱼、入宅、酝酿、开仓、补垣、纳采、筑堤防、营建、开张
1944-02-07	一九四四 甲申[猴]年	正月大	十四	周一	甲申 丙寅 辛丑 癸巳	猴	水瓶座	无	雨水 (2, 20)	无	无	无	祭祀、雪冤、覃恩、恤孤茕	出行、结婚姻、宴会、嫁娶、安床、剃头、修造、求医疗病、上表章、上官、冠带、进人口、竖柱上梁、经络、开市、纳财、修置产室、开渠、穿井、安碓硙、平治道涂、破屋坏垣、畋猎、栽种、牧养、破土、安葬、立券交易、疗目、针刺、裁制、乘船渡水、缮城郭、远回、招贤、布政事、举正直、选将、塞穴、纳畜、取鱼、上册、颁诏、修饰垣墙、出师、祈福、安抚边境、酝酿、庆赐、开仓、整容、鼓铸、补垣、解除、修宫室、施恩、纳采、整手足甲、修仓库、临政、搬移、营建、筑堤防、宣政事、求嗣
1944-02-08	一九四四 甲申[猴]年	正月大	十五	周二	甲申 丙寅 壬寅 乙巳	猴	水瓶座	无	雨水 (2, 20)	无	元宵节	无	宴会、经络、纳财、牧养、立券交易、雪冤、裁制、覃恩、举正直、纳畜、酝酿、庆赐、施恩、恤孤茕	祭祀、剃头、修置产室、开渠、穿井、平治道涂、破屋坏垣、伐木、捕捉、畋猎、启攒、补垣、修饰垣墙、整容、整手足甲、取鱼、开仓、筑堤防
1944-02-09	一九四四 甲申[猴]年	正月大	十六	周三	甲申 丙寅 癸卯 丁巳	猴	水瓶座	无	雨水 (2, 20)	无	无	无	出行、结婚姻、宴会、沐浴、剃头、求医疗病、上官、扫舍宇、立券交易、选将、出师、整容、解除、整手足甲、临政、安抚边境	嫁娶、安床、修造、上表章、冠带、进人口、竖柱上梁、开市、纳财、修置产室、穿井、栽种、牧养、乘船渡水、缮城郭、招贤、纳畜、取鱼、上册、祈福、开仓、纳采、修仓库、搬移、营建、筑堤防、求嗣、修宫室
1944-02-10	一九四四 甲申[猴]年	正月大	十七	周四	甲申 丙寅 甲辰 己巳	猴	水瓶座	无	雨水 (2, 20)	无	无	无	宴会、修造、上表章、竖柱上梁、经络、赴任、裁制、诉讼、缮城郭、上册、入宅、庆赐、搬移、修宫室	祭祀、结婚姻、上官、栽种、破土、启攒、举正直、乘船渡水、施恩、取鱼、招贤、鼓铸
1944-02-11	一九四四 甲申[猴]年	正月大	十八	周五	甲申 丙寅 乙巳 辛巳	猴	水瓶座	无	雨水 (2, 20)	无	无	无	平治道涂	祭祀、出行、结婚姻、宴会、嫁娶、安床、剃头、修造、求医疗病、上表章、上官、冠带、进人口、竖柱上梁、经络、开市、纳财、修置产室、开渠、穿井、安碓硙、破屋坏垣、栽种、牧养、破土、安葬、启攒、立券交易、裁制、缮城郭、招贤、布政事、举正直、选将、塞穴、纳畜、上册、颁诏、修饰垣墙、出师、祈福、酝酿、庆赐、开仓、鼓铸、整容、补垣、解除、修宫室、施恩、整手足甲、纳采、修仓库、临政、搬移、营建、筑堤防、宣政事、求嗣、安抚边境
1944-02-12	一九四四 甲申[猴]年	正月大	十九	周六	甲申 丙寅 丙午 癸巳	猴	水瓶座	无	雨水 (2, 20)	无	无	无	祭祀、结婚姻、宴会、嫁娶、上官、冠带、进人口、竖柱上梁、经络、安碓硙、牧养、雪冤、裁制、覃恩、缮城郭、招贤、举正直、纳畜、颁诏、祈福、酝酿、庆赐、施恩、纳采、临政、搬移、营建、恤孤茕、宣政事、求嗣、修宫室	修置产室、畋猎、整手足甲、苫盖、取鱼
1944-02-13	一九四四 甲申[猴]年	正月大	二十	周日	甲申 丙寅 丁未 乙巳	猴	水瓶座	无	雨水 (2, 20)	无	无	无	祭祀、出行、宴会、上表章、上官、竖柱上梁、纳财、捕捉、栽种、牧养、破土、安葬、雪冤、裁制、覃恩、缮城郭、招贤、举正直、上册、颁诏、祈福、庆赐、开仓、解除、施恩、临政、搬移、营建、恤孤茕、宣政事、求嗣、修宫室	剃头、畋猎、取鱼、整容
1944-02-14	一九四四 甲申[猴]年	正月大	廿一	周一	甲申 丙寅 戊申 丁巳	猴	水瓶座	无	雨水 (2, 20)	无	无	无	祭祀、沐浴、求医疗病、扫舍宇、破屋坏垣、解除	结婚姻、宴会、嫁娶、安床、修造、上官、冠带、进人口、竖柱上梁、经络、开市、纳财、修置产室、开渠、穿井、安碓硙、伐木、栽种、牧养、安葬、启攒、立券交易、裁制、缮城郭、招贤、布政事、举正直、选将、塞穴、纳畜、上册、颁诏、修饰垣墙、出师、酝酿、庆赐、鼓铸、开仓、补垣、修宫室、施恩、纳采、修仓库、临政、营建、筑堤防、宣政事、求嗣、安抚边境
1944-02-15	一九四四 甲申[猴]年	正月大	廿二	周二	甲申 丙寅 己酉 己巳	猴	水瓶座	无	雨水 (2, 20)	无	无	无	祭祀、出行、嫁娶、安床、沐浴、剃头、修造、求医疗病、上官、扫舍宇、安葬、雪冤、赴任、覃恩、布政事、选将、入宅、祈福、整容、解除、纳采、整手足甲、临政、搬移、恤孤茕、安抚边境	结婚姻、宴会、上表章、冠带、竖柱上梁、修置产室、栽种、牧养、乘船渡水、缮城郭、招贤、举正直、纳畜、取鱼、上册、出师、开仓、修宫室、施恩、修仓库、筑堤防、营建、求嗣
1944-02-16	一九四四 甲申[猴]年	正月大	廿三	周三	甲申 丙寅 庚戌 辛巳	猴	水瓶座	无	雨水 (2, 20)	无	无	无	入学、雪冤、覃恩、恤孤茕	出行、结婚姻、宴会、嫁娶、安床、剃头、修造、求医疗病、上表章、上官、冠带、进人口、竖柱上梁、经络、开市、纳财、修置产室、开渠、穿井、安碓硙、平治道涂、破屋坏垣、伐木、畋猎、栽种、牧养、破土、安葬、启攒、立券交易、乘船渡水、裁制、缮城郭、远回、招贤、布政事、举正直、选将、塞穴、纳畜、上册、颁诏、修饰垣墙、出师、祈福、安抚边境、酝酿、庆赐、整容、鼓铸、开仓、补垣、宣政事、解除、修宫室、施恩、整手足甲、纳采、修仓库、临政、搬移、营建、筑堤防、求嗣
1944-02-17	一九四四 甲申[猴]年	正月大	廿四	周四	甲申 丙寅 辛亥 癸巳	猴	水瓶座	无	雨水 (2, 20)	无	无	无	祭祀、出行、结婚姻、宴会、沐浴、修造、求医疗病、上表章、上官、进人口、竖柱上梁、经络、开市、纳财、捕捉、栽种、牧养、安葬、立券交易、雪冤、裁制、覃恩、缮城郭、招贤、举正直、选将、纳畜、上册、颁诏、出师、祈福、酝酿、庆赐、开仓、解除、施恩、纳采、修仓库、临政、搬移、营建、恤孤茕、宣政事、求嗣、安抚边境	嫁娶、剃头、冠带、修置产室、开渠、穿井、安碓硙、破屋坏垣、畋猎、破土、启攒、塞穴、取鱼、修饰垣墙、整容、鼓铸、补垣、修宫室、整手足甲、筑堤防
1944-02-18	一九四四 甲申[猴]年	正月大	廿五	周五	甲申 丙寅 壬子 乙巳	猴	水瓶座	无	雨水 (2, 20)	无	无	无	祭祀、出行、结婚姻、宴会、嫁娶、沐浴、修造、求医疗病、上表章、上官、入学、竖柱上梁、开市、纳财、修置产室、安碓硙、栽种、牧养、雪冤、裁制、覃恩、缮城郭、招贤、举正直、选将、纳畜、上册、颁诏、出师、祈福、庆赐、解除、修宫室、施恩、纳采、修仓库、临政、搬移、营建、恤孤茕、宣政事、求嗣、安抚边境	剃头、冠带、开渠、破屋坏垣、伐木、畋猎、补垣、修饰垣墙、入宅、塞穴、整手足甲、苫盖、取鱼、筑堤防、开仓、整容、鼓铸
1944-02-19	一九四四 甲申[猴]年	正月大	廿六	周六	甲申 丙寅 癸丑 丁巳	猴	双鱼座	无	雨水 (2, 20)	无	无	无	诸事不宜	诸事不宜
1944-02-20	一九四四 甲申[猴]年	正月大	廿七	周日	甲申 丙寅 甲寅 己巳	猴	双鱼座	雨水	惊蛰 (3, 6)	无	无	无	宴会、经络、纳财、立券交易、雪冤、赴任、裁制、诉讼、覃恩、举正直、纳畜、入宅、酝酿、庆赐、施恩、恤孤茕	祭祀、剃头、求医疗病、上表章、修置产室、开渠、穿井、平治道涂、破屋坏垣、伐木、捕捉、畋猎、栽种、取鱼、上册、修饰垣墙、祈福、整容、开仓、补垣、解除、整手足甲、筑堤防、营建、求嗣
1944-02-21	一九四四 甲申[猴]年	正月大	廿八	周一	甲申 丙寅 乙卯 辛巳	猴	双鱼座	无	惊蛰 (3, 6)	无	无	无	出行、结婚姻、宴会、沐浴、剃头、求医疗病、上官、扫舍宇、立券交易、选将、出师、整容、解除、整手足甲、临政、安抚边境	嫁娶、安床、修造、上表章、冠带、进人口、竖柱上梁、开市、纳财、修置产室、穿井、栽种、牧养、乘船渡水、缮城郭、招贤、纳畜、取鱼、上册、祈福、开仓、修宫室、纳采、修仓库、搬移、营建、筑堤防、求嗣
1944-02-22	一九四四 甲申[猴]年	正月大	廿九	周二	甲申 丙寅 丙辰 癸巳	猴	双鱼座	无	惊蛰 (3, 6)	无	无	无	出行、宴会、上表章、竖柱上梁、经络、牧养、安葬、雪冤、裁制、覃恩、缮城郭、选将、纳畜、上册、颁诏、祈福、安抚边境、庆赐、解除、搬移、营建、恤孤茕、宣政事、求嗣、修宫室	祭祀、畋猎、乘船渡水、取鱼、鼓铸
1944-02-23	一九四四 甲申[猴]年	正月大	三十	周三	甲申 丙寅 丁巳 乙巳	猴	双鱼座	无	惊蛰 (3, 6)	无	无	无	平治道涂、雪冤、覃恩、恤孤茕	出行、剃头、冠带、修置产室、开渠、穿井、安碓硙、破屋坏垣、畋猎、破土、启攒、布政事、塞穴、取鱼、整容、鼓铸、补垣、整手足甲、筑堤防
1944-02-24	一九四四 甲申[猴]年	二月小	初一	周四	甲申 丙寅 戊午 丁巳	猴	双鱼座	无	惊蛰 (3, 6)	无	一殿秦广王诞	无	祭祀、结婚姻、宴会、嫁娶、修造、上官、冠带、进人口、竖柱上梁、经络、安碓硙、牧养、裁制、缮城郭、举正直、纳畜、祈福、酝酿、庆赐、纳采、施恩、临政、搬移、求嗣、修宫室	修置产室、安葬、选将、出师、整手足甲、苫盖、安抚边境
1944-02-25	一九四四 甲申[猴]年	二月小	初二	周五	甲申 丙寅 己未 己巳	猴	双鱼座	无	惊蛰 (3, 6)	无	春龙节-福德土地正神诞	无	出行、捕捉、入宅、赴任、取鱼、搬移	结婚姻、求医疗病、选将、出师、纳畜、安抚边境
1944-02-26	一九四四 甲申[猴]年	二月小	初三	周六	甲申 丙寅 庚申 辛巳	猴	双鱼座	无	惊蛰 (3, 6)	无	文昌帝君诞	无	祭祀、沐浴、扫舍宇、破屋坏垣	结婚姻、宴会、嫁娶、安床、修造、上官、冠带、进人口、竖柱上梁、经络、开市、纳财、修置产室、开渠、穿井、安碓硙、伐木、栽种、牧养、启攒、立券交易、裁制、缮城郭、招贤、布政事、举正直、选将、塞穴、纳畜、上册、颁诏、修饰垣墙、出师、酝酿、庆赐、鼓铸、开仓、补垣、修宫室、施恩、纳采、修仓库、临政、营建、筑堤防、宣政事、求嗣、安抚边境
1944-02-27	一九四四 甲申[猴]年	二月小	初四	周日	甲申 丙寅 辛酉 癸巳	猴	双鱼座	无	惊蛰 (3, 6)	无	无	无	祭祀、出行、结婚姻、嫁娶、安床、沐浴、剃头、修造、求医疗病、上表章、上官、竖柱上梁、扫舍宇、栽种、牧养、安葬、雪冤、裁制、覃恩、缮城郭、招贤、选将、举正直、纳畜、上册、颁诏、出师、祈福、整容、解除、施恩、纳采、整手足甲、修仓库、临政、搬移、营建、恤孤茕、宣政事、求嗣、安抚边境	宴会、冠带、修置产室、开渠、穿井、安碓硙、畋猎、启攒、补垣、修饰垣墙、塞穴、修宫室、筑堤防、取鱼、开仓、布政事、鼓铸
1944-02-28	一九四四 甲申[猴]年	二月小	初五	周一	甲申 丙寅 壬戌 乙巳	猴	双鱼座	无	惊蛰 (3, 6)	无	无	无	祭祀、出行、结婚姻、宴会、嫁娶、修造、求医疗病、上表章、上官、入学、进人口、竖柱上梁、经络、开市、纳财、安碓硙、栽种、牧养、安葬、立券交易、雪冤、裁制、覃恩、缮城郭、选将、纳畜、上册、出师、祈福、酝酿、庆赐、解除、修宫室、纳采、修仓库、临政、筑堤防、搬移、恤孤茕、营建、求嗣、安抚边境	剃头、冠带、修置产室、开渠、穿井、平治道涂、破屋坏垣、伐木、畋猎、破土、启攒、乘船渡水、远回、布政事、塞穴、取鱼、修饰垣墙、整容、开仓、补垣、鼓铸、整手足甲
1944-02-29	一九四四 甲申[猴]年	二月小	初六	周二	甲申 丙寅 癸亥 丁巳	猴	双鱼座	无	惊蛰 (3, 6)	无	东华帝君诞	无	祭祀、结婚姻、宴会、沐浴、进人口、经络、开市、纳财、捕捉、栽种、牧养、安葬、立券交易、纳畜、取鱼、祈福、酝酿、开仓	出行、嫁娶、安床、剃头、修造、求医疗病、上表章、上官、冠带、竖柱上梁、修置产室、开渠、穿井、安碓硙、破屋坏垣、破土、启攒、裁制、缮城郭、招贤、布政事、举正直、选将、塞穴、上册、颁诏、修饰垣墙、出师、庆赐、整容、鼓铸、补垣、解除、修宫室、施恩、纳采、整手足甲、修仓库、临政、搬移、营建、筑堤防、宣政事、求嗣、安抚边境
