1950-05-01	1950-3-15	30	定	一	庚寅 庚辰 丙申	无	立夏 (5, 6)	劳动节	无	无	祭祀 斋醮 开市 动土 入殓 破土 安葬	嫁娶 移徙 入宅
1950-05-02	1950-3-16	30	执	二	庚寅 庚辰 丁酉	无	立夏 (5, 6)	无	无	无	嫁娶 纳采 祭祀 祈福 出行 移徙 求医	开市 动土 破土
1950-05-03	1950-3-17	30	破	三	庚寅 庚辰 戊戌	无	立夏 (5, 6)	无	无	无	祭祀 求医 治病 解除 馀事勿取	诸事不宜
1950-05-04	1950-3-18	30	危	四	庚寅 庚辰 己亥	无	立夏 (5, 6)	青年节	无	无	沐浴 结网 取渔	嫁娶 入宅 安葬
1950-05-05	1950-3-19	30	成	五	庚寅 庚辰 庚子	无	立夏 (5, 6)	无	无	无	无	诸事不宜
1950-05-06	1950-3-20	30	成	六	庚寅 辛巳 辛丑	立夏	小满 (5, 21)	无	无	无	祭祀 祈福 求嗣 开光 订盟 纳采 解除 动土 起基 进人口 开市 交易 立券 纳财 造仓 开池 栽种 纳畜 破土 安葬	安床 上梁 裁衣 入宅 嫁娶
1950-05-07	1950-3-21	30	收	日	庚寅 辛巳 壬寅	无	小满 (5, 21)	无	无	无	祭祀 结网 捕捉 馀事勿取	探病 嫁娶 开市
1950-05-08	1950-3-22	30	开	一	庚寅 辛巳 癸卯	无	小满 (5, 21)	无	无	无	祭祀 祈福 求嗣 开光 纳采 订盟 嫁娶 出行 动土 破土 会亲友 开市 交易 立券 习艺 拆卸 起基 安碓磑 放水 开池 造仓 开渠 栽种 谢土 启钻 修坟 立碑	入宅 安门 安葬
1950-05-09	1950-3-23	30	闭	二	庚寅 辛巳 甲辰	无	小满 (5, 21)	无	无	无	嫁娶 冠笄 祭祀 出行 移徙 入宅 作灶 造车器 补垣 塞穴 开厕 破土 启钻 除服 成服 入殓	盖屋 造桥 安门 安葬 上梁
1950-05-10	1950-3-24	30	建	三	庚寅 辛巳 乙巳	无	小满 (5, 21)	无	无	无	祭祀 解除 断蚁 会亲友 馀事勿取	嫁娶 安葬
1950-05-11	1950-3-25	30	除	四	庚寅 辛巳 丙午	无	小满 (5, 21)	无	无	无	嫁娶 纳采 订盟 祭祀 祈福 治病 造车器 修造 动土 移徙 入宅	开市 出行 安床 作灶 安葬
1950-05-12	1950-3-26	30	满	五	庚寅 辛巳 丁未	无	小满 (5, 21)	无	无	无	嫁娶 纳采 订盟 会亲友 安机械 结网 冠笄 祭祀 求嗣 进人口 经络	开市 作灶 动土 行丧 安葬
1950-05-13	1950-3-27	30	平	六	庚寅 辛巳 戊申	无	小满 (5, 21)	无	无	无	祭祀 沐浴 移徙 破土 安葬 扫舍 平治道涂	祈福 嫁娶 入宅 安床 作灶
1950-05-14	1950-3-28	30	定	日	庚寅 辛巳 己酉	无	小满 (5, 21)	母亲节	无	无	祭祀 祈福 斋醮 求嗣 安机械 纳畜 移徙 入宅 塑绘 开光 起基 竖柱 上梁 作灶 安门 安香 出火 盖屋 启钻 安葬	动土 破土 嫁娶
1950-05-15	1950-3-29	30	执	一	庚寅 辛巳 庚戌	无	小满 (5, 21)	无	无	无	嫁娶 纳采 订盟 斋醮 开光 祭祀 祈福 求医 治病 会亲友 动土 解除 捕捉 纳畜 牧养 入殓 破土 安葬	移徙 入宅 盖屋 架马
1950-05-16	1950-3-30	30	破	二	庚寅 辛巳 辛亥	无	小满 (5, 21)	无	无	无	祭祀 沐浴 解除 破屋 坏垣 馀事勿取	行丧 安葬
1950-05-17	1950-4-1	29	危	三	庚寅 辛巳 壬子	无	小满 (5, 21)	无	无	无	沐浴 扫舍 馀事勿取	斋醮 开市 嫁娶 作灶
1950-05-18	1950-4-2	29	成	四	庚寅 辛巳 癸丑	无	小满 (5, 21)	无	无	无	开市 交易 立券 安机械 会亲友 开光 求医 治病 盖屋 起基 修造 动土 定磉 竖柱 上梁 安门 作灶 放水 开厕 开池 栽种 牧养 造畜稠 破土 安葬 立碑	嫁娶 出火 移徙 入宅
1950-05-19	1950-4-3	29	收	五	庚寅 辛巳 甲寅	无	小满 (5, 21)	无	无	无	栽种 捕捉 畋猎 馀事勿取	开市 动土 祭祀 斋醮 安葬 探病
1950-05-20	1950-4-4	29	开	六	庚寅 辛巳 乙卯	无	小满 (5, 21)	无	无	无	嫁娶 祭祀 祈福 求嗣 斋醮 订盟 纳采 解除 出行 动土 破土 习艺 针灸 理发 会亲友 起基 修造 竖柱 定磉 安床 拆卸 纳畜 牧养 放水 除服 成服 修坟 立碑	开市 入宅 探病 出火 盖屋
1950-05-21	1950-4-5	29	闭	日	庚寅 辛巳 丙辰	小满	芒种 (6, 6)	全国助残日	无	无	馀事勿取	无
1950-05-22	1950-4-6	29	建	一	庚寅 辛巳 丁巳	无	芒种 (6, 6)	无	无	无	塞穴 断蚁 结网 馀事勿取	破土 安葬
1950-05-23	1950-4-7	29	除	二	庚寅 辛巳 戊午	无	芒种 (6, 6)	无	无	无	开光 出行 纳采 嫁娶 伐木 架马 出火 拆卸 移徙 入宅 造庙 造桥 造船 造畜稠 开市 入殓 除服 成服 移柩 安葬	无
1950-05-24	1950-4-8	29	满	三	庚寅 辛巳 己未	无	芒种 (6, 6)	无	无	无	进人口 牧养 置产 塞穴 结网 馀事勿取	诸事不宜
1950-05-25	1950-4-9	29	平	四	庚寅 辛巳 庚申	无	芒种 (6, 6)	无	无	无	开光 出行 嫁娶	会亲友 进人口 修造 动土 起基 移徙 开市 纳畜 入殓 除服 成服 移柩 破土 安葬 修坟 立碑
1950-05-26	1950-4-10	29	定	五	庚寅 辛巳 辛酉	无	芒种 (6, 6)	无	无	无	嫁娶 纳采 出行 祭祀 祈福 开市 动土 移徙 入宅 破土 安葬	安门
1950-05-27	1950-4-11	29	执	六	庚寅 辛巳 壬戌	无	芒种 (6, 6)	无	无	无	嫁娶 纳采 求医 治病 修造 动土 移徙 入宅 破土 安葬	开市 开光
1950-05-28	1950-4-12	29	破	日	庚寅 辛巳 癸亥	无	芒种 (6, 6)	无	无	无	祭祀 破屋 坏垣 馀事勿取	诸事不宜
1950-05-29	1950-4-13	29	危	一	庚寅 辛巳 甲子	无	芒种 (6, 6)	无	无	无	嫁娶 纳采 祭祀 祈福 出行 动土 上梁 移徙 入宅 破土 安葬	斋醮
1950-05-30	1950-4-14	29	成	二	庚寅 辛巳 乙丑	无	芒种 (6, 6)	无	无	无	纳采 祭祀 祈福 开市 求医 治病 动土 纳畜	嫁娶 安葬
1950-05-31	1950-4-15	29	收	三	庚寅 辛巳 丙寅	无	芒种 (6, 6)	无	无	无	嫁娶 纳采 出行 移徙 入宅	动土 破土 安葬
