1950-05-01	一九五零 庚寅[虎]年	三月大	十五	周一	庚寅 庚辰 丙申 癸巳	无	立夏 (5, 6)	国际劳动节	昊天上帝诞	无	虎	金牛座	祭祀、沐浴、扫舍宇	出行、结婚姻、宴会、嫁娶、安床、剃头、修造、求医疗病、上表章、上官、冠带、进人口、竖柱上梁、经络、开市、纳财、修置产室、开渠、穿井、安碓硙、平治道涂、破屋坏垣、伐木、捕捉、畋猎、栽种、牧养、破土、安葬、启攒、搬移、祈福、缮城郭、开仓、裁制、上册、修宫室、颁诏、求嗣、庆赐、补垣、取鱼、招贤、整容、布政事、宣政事、安抚边境、施恩、立券交易、修饰垣墙、临政、纳畜、举正直、解除、塞穴、修仓库、酝酿、选将、远回、鼓铸、营建、纳采、整手足甲、出师、筑堤防
1950-05-02	一九五零 庚寅[虎]年	三月大	十六	周二	庚寅 庚辰 丁酉 乙巳	无	立夏 (5, 6)	无	准提菩萨诞	无	虎	金牛座	祭祀、出行、结婚姻、嫁娶、沐浴、修造、求医疗病、上表章、上官、进人口、竖柱上梁、经络、纳财、扫舍宇、捕捉、栽种、牧养、安葬、搬移、祈福、缮城郭、开仓、裁制、上册、修宫室、颁诏、求嗣、覃恩、恤孤茕、雪冤、招贤、宣政事、安抚边境、施恩、立券交易、临政、纳畜、举正直、解除、修仓库、酝酿、选将、营建、纳采、整手足甲、出师	宴会、剃头、冠带、修置产室、开渠、穿井、安碓硙、平治道涂、破屋坏垣、畋猎、补垣、取鱼、筑堤防、乘船渡水、修饰垣墙
1950-05-03	一九五零 庚寅[虎]年	三月大	十七	周三	庚寅 庚辰 戊戌 丁巳	无	立夏 (5, 6)	无	无	世界新闻自由日	虎	金牛座	祭祀、沐浴、求医疗病、解除	结婚姻、宴会、安床、修造、上官、冠带、进人口、竖柱上梁、经络、开市、纳财、修置产室、开渠、穿井、安碓硙、平治道涂、伐木、栽种、牧养、破土、安葬、启攒、缮城郭、上册、修宫室、开仓、颁诏、求嗣、庆赐、补垣、取鱼、招贤、布政事、宣政事、施恩、立券交易、修饰垣墙、临政、纳畜、举正直、塞穴、乘船渡水、修仓库、酝酿、鼓铸、营建、纳采、筑堤防
1950-05-04	一九五零 庚寅[虎]年	三月大	十八	周四	庚寅 庚辰 己亥 己巳	无	立夏 (5, 6)	无	无	中国青年节	虎	金牛座	安床、沐浴、纳财、牧养、取鱼、纳畜、选将、安抚边境、出师	出行、结婚姻、嫁娶、修造、求医疗病、修置产室、开渠、穿井、安碓硙、平治道涂、破屋坏垣、畋猎、破土、安葬、启攒、祈福、缮城郭、开仓、修宫室、求嗣、补垣、修饰垣墙、解除、修仓库、营建、筑堤防
1950-05-05	一九五零 庚寅[虎]年	三月大	十九	周五	庚寅 庚辰 庚子 辛巳	无	立夏 (5, 6)	无	中岳大帝诞	马克思诞辰纪念日	虎	金牛座	结婚姻、宴会、沐浴、求医疗病、入学、竖柱上梁、纳财、牧养、安葬、诉讼、祈福、开仓、裁制、求嗣、庆赐、入宅、安抚边境、施恩、临政、纳畜、举正直、解除、赴任、酝酿、选将、纳采、出师	修置产室、开渠、穿井、平治道涂、破屋坏垣、补垣、远回、营建、整手足甲、修饰垣墙
1950-05-06	一九五零 庚寅[虎]年	三月大	二十	周六	庚寅 辛巳 辛丑 癸巳	立夏	小满 (5, 21)	无	子孙娘娘诞	无	虎	金牛座	祭祀、出行、结婚姻、宴会、修造、求医疗病、上表章、上官、入学、进人口、竖柱上梁、经络、开市、纳财、安碓硙、栽种、牧养、安葬、祈福、缮城郭、裁制、上册、修宫室、颁诏、求嗣、覃恩、恤孤茕、雪冤、庆赐、招贤、宣政事、施恩、立券交易、临政、纳畜、举正直、解除、修仓库、营建、纳采、筑堤防	冠带、畋猎、取鱼、远回、乘船渡水
1950-05-07	一九五零 庚寅[虎]年	三月大	廿一	周日	庚寅 辛巳 壬寅 乙巳	无	小满 (5, 21)	无	无	无	虎	金牛座	捕捉、诉讼、赴任	祭祀、出行、结婚姻、宴会、嫁娶、安床、剃头、修造、求医疗病、上表章、上官、冠带、进人口、竖柱上梁、经络、开市、纳财、修置产室、开渠、穿井、安碓硙、平治道涂、破屋坏垣、栽种、牧养、破土、安葬、启攒、搬移、祈福、缮城郭、裁制、上册、开仓、修宫室、颁诏、求嗣、庆赐、补垣、招贤、整容、布政事、宣政事、安抚边境、施恩、立券交易、修饰垣墙、临政、纳畜、举正直、解除、塞穴、修仓库、酝酿、选将、鼓铸、营建、纳采、整手足甲、出师、筑堤防
1950-05-08	一九五零 庚寅[虎]年	三月大	廿二	周一	庚寅 辛巳 癸卯 丁巳	无	小满 (5, 21)	无	无	世界红十字日	虎	金牛座	入学、覃恩、恤孤茕、雪冤	竖柱上梁、经络、穿井、伐木、畋猎、安葬、开仓、补垣、取鱼、布政事、入宅、安抚边境、塞穴、酝酿、选将、营建、纳采、出师、筑堤防
1950-05-09	一九五零 庚寅[虎]年	三月大	廿三	周二	庚寅 辛巳 甲辰 己巳	无	小满 (5, 21)	无	无	无	虎	金牛座	诸事不宜	诸事不宜
1950-05-10	一九五零 庚寅[虎]年	三月大	廿四	周三	庚寅 辛巳 乙巳 辛巳	无	小满 (5, 21)	无	无	无	虎	金牛座	祭祀、宴会、上官、进人口、经络、纳财、牧养、搬移、裁制、颁诏、覃恩、恤孤茕、雪冤、庆赐、招贤、入宅、宣政事、安抚边境、施恩、立券交易、临政、纳畜、举正直、赴任、酝酿、选将	出行、剃头、修置产室、开渠、穿井、平治道涂、破屋坏垣、伐木、畋猎、破土、启攒、补垣、取鱼、整容、整手足甲、筑堤防、开仓、修饰垣墙
1950-05-11	一九五零 庚寅[虎]年	三月大	廿五	周四	庚寅 辛巳 丙午 癸巳	无	小满 (5, 21)	无	无	世界肥胖日	虎	金牛座	祭祀、宴会、沐浴、剃头、扫舍宇、裁制、颁诏、覃恩、恤孤茕、雪冤、庆赐、整容、宣政事、整手足甲	冠带、修置产室、畋猎、启攒、取鱼、苫盖、乘船渡水、筑堤防、开仓、修宫室
1950-05-12	一九五零 庚寅[虎]年	三月大	廿六	周五	庚寅 辛巳 丁未 乙巳	无	小满 (5, 21)	无	无	无	虎	金牛座	诸事不宜	祭祀、出行、结婚姻、嫁娶、安床、剃头、修造、上官、冠带、修置产室、开渠、穿井、安碓硙、平治道涂、破屋坏垣、伐木、栽种、牧养、启攒、搬移、颁诏、补垣、取鱼、招贤、整容、布政事、宣政事、安抚边境、修饰垣墙、施恩、临政、纳畜、举正直、解除、乘船渡水、酝酿、选将、远回、鼓铸、营建、纳采、整手足甲、出师、筑堤防
1950-05-13	一九五零 庚寅[虎]年	三月大	廿七	周六	庚寅 辛巳 戊申 丁巳	无	小满 (5, 21)	无	七殿泰山王诞	无	虎	金牛座	祭祀、沐浴、扫舍宇、平治道涂	上表章、开渠、穿井、启攒、上册、颁诏、补垣、针刺、招贤、布政事、宣政事、安抚边境、塞穴、选将、营建、出师、筑堤防
1950-05-14	一九五零 庚寅[虎]年	三月大	廿八	周日	庚寅 辛巳 己酉 己巳	无	小满 (5, 21)	无	苍颉至圣先师诞	母亲节	虎	金牛座	祭祀、沐浴、剃头、修造、上官、冠带、进人口、竖柱上梁、经络、安碓硙、扫舍宇、牧养、安葬、搬移、祈福、缮城郭、裁制、修宫室、求嗣、覃恩、恤孤茕、雪冤、整容、布政事、施恩、临政、纳畜、举正直、酝酿、整手足甲	宴会、上表章、修置产室、上册、苫盖
1950-05-15	一九五零 庚寅[虎]年	三月大	廿九	周一	庚寅 辛巳 庚戌 辛巳	无	小满 (5, 21)	无	无	无	虎	金牛座	祭祀、结婚姻、宴会、嫁娶、沐浴、剃头、修造、求医疗病、上表章、上官、竖柱上梁、捕捉、栽种、牧养、安葬、搬移、祈福、缮城郭、裁制、上册、颁诏、求嗣、覃恩、恤孤茕、雪冤、庆赐、招贤、整容、入宅、宣政事、安抚边境、施恩、临政、纳畜、举正直、解除、选将、营建、纳采、整手足甲、出师	经络、畋猎、取鱼、开仓
1950-05-16	一九五零 庚寅[虎]年	三月大	三十	周二	庚寅 辛巳 辛亥 癸巳	无	小满 (5, 21)	无	无	无	虎	金牛座	沐浴、破屋坏垣、覃恩、恤孤茕、雪冤、解除	嫁娶、安床、剃头、冠带、经络、开市、修置产室、开渠、穿井、安碓硙、伐木、捕捉、畋猎、破土、启攒、开仓、修宫室、补垣、取鱼、整容、修饰垣墙、立券交易、塞穴、酝酿、鼓铸、整手足甲、筑堤防
1950-05-17	一九五零 庚寅[虎]年	四月小	初一	周三	庚寅 辛巳 壬子 乙巳	无	小满 (5, 21)	无	八殿都市王诞	无	虎	金牛座	沐浴、覃恩、恤孤茕、雪冤	结婚姻、嫁娶、修造、求医疗病、上表章、冠带、进人口、竖柱上梁、经络、开市、纳财、修置产室、开渠、穿井、安碓硙、栽种、牧养、安葬、祈福、缮城郭、裁制、开仓、上册、修宫室、颁诏、求嗣、补垣、招贤、宣政事、施恩、立券交易、修饰垣墙、纳畜、举正直、解除、塞穴、修仓库、酝酿、鼓铸、营建、纳采、整手足甲、筑堤防
1950-05-18	一九五零 庚寅[虎]年	四月小	初二	周四	庚寅 辛巳 癸丑 丁巳	无	小满 (5, 21)	无	无	无	虎	金牛座	出行、宴会、上表章、上官、入学、进人口、竖柱上梁、经络、开市、纳财、安碓硙、缮城郭、裁制、上册、修宫室、覃恩、庆赐、恤孤茕、雪冤、布政事、施恩、立券交易、临政、纳畜、举正直、酝酿、筑堤防	冠带、取鱼、选将、远回、出师、乘船渡水
1950-05-19	一九五零 庚寅[虎]年	四月小	初三	周五	庚寅 辛巳 甲寅 己巳	无	小满 (5, 21)	无	无	无	虎	金牛座	捕捉、诉讼、赴任	祭祀、出行、结婚姻、宴会、嫁娶、安床、剃头、修造、求医疗病、上表章、上官、冠带、进人口、竖柱上梁、经络、开市、纳财、修置产室、开渠、穿井、安碓硙、平治道涂、破屋坏垣、栽种、牧养、破土、安葬、启攒、搬移、祈福、缮城郭、裁制、上册、开仓、修宫室、颁诏、求嗣、庆赐、补垣、招贤、整容、布政事、宣政事、安抚边境、施恩、立券交易、修饰垣墙、临政、纳畜、举正直、解除、塞穴、修仓库、酝酿、选将、鼓铸、营建、纳采、整手足甲、出师、筑堤防
1950-05-20	一九五零 庚寅[虎]年	四月小	初四	周六	庚寅 辛巳 乙卯 辛巳	无	小满 (5, 21)	无	文殊菩萨诞	无	虎	金牛座	祭祀、出行、结婚姻、宴会、嫁娶、修造、求医疗病、上表章、上官、入学、竖柱上梁、开市、纳财、修置产室、安碓硙、栽种、牧养、搬移、祈福、缮城郭、裁制、上册、修宫室、颁诏、求嗣、覃恩、恤孤茕、雪冤、庆赐、招贤、宣政事、入宅、安抚边境、施恩、立券交易、临政、纳畜、举正直、解除、修仓库、赴任、选将、营建、纳采、出师	剃头、冠带、穿井、破屋坏垣、伐木、畋猎、补垣、取鱼、整容、鼓铸、布政事、整手足甲、筑堤防、塞穴、开仓、修饰垣墙
1950-05-21	一九五零 庚寅[虎]年	四月小	初五	周日	庚寅 辛巳 丙辰 癸巳	小满	芒种 (6, 6)	无	无	无	虎	双子座	祭祀、覃恩、恤孤茕、雪冤	出行、结婚姻、宴会、嫁娶、安床、剃头、修造、求医疗病、上表章、上官、冠带、进人口、竖柱上梁、经络、开市、纳财、修置产室、开渠、穿井、安碓硙、破屋坏垣、畋猎、栽种、牧养、破土、安葬、启攒、搬移、祈福、缮城郭、开仓、上册、修宫室、裁制、颁诏、求嗣、庆赐、补垣、取鱼、针刺、招贤、整容、布政事、宣政事、安抚边境、施恩、疗目、立券交易、临政、修饰垣墙、纳畜、举正直、解除、塞穴、乘船渡水、修仓库、酝酿、选将、鼓铸、营建、纳采、整手足甲、出师、筑堤防
1950-05-22	一九五零 庚寅[虎]年	四月小	初六	周一	庚寅 辛巳 丁巳 乙巳	无	芒种 (6, 6)	无	无	无	虎	双子座	宴会、上官、进人口、经络、纳财、裁制、颁诏、覃恩、庆赐、恤孤茕、雪冤、招贤、宣政事、施恩、立券交易、临政、纳畜、举正直、酝酿	出行、剃头、求医疗病、上表章、修置产室、开渠、穿井、平治道涂、破屋坏垣、伐木、畋猎、栽种、破土、安葬、启攒、祈福、开仓、上册、求嗣、补垣、整容、修饰垣墙、解除、营建、整手足甲、筑堤防
1950-05-23	一九五零 庚寅[虎]年	四月小	初七	周二	庚寅 辛巳 戊午 丁巳	无	芒种 (6, 6)	无	无	世界读书日	虎	双子座	祭祀、宴会、沐浴、剃头、扫舍宇、裁制、庆赐、整容、整手足甲	嫁娶、上表章、冠带、立券、修置产室、取鱼、纳畜、招贤、苫盖、开张、营建、筑堤防、乘船渡水、上册、修仓库
1950-05-24	一九五零 庚寅[虎]年	四月小	初八	周三	庚寅 辛巳 己未 己巳	无	芒种 (6, 6)	无	释迦牟尼佛诞	无	虎	双子座	诸事不宜	祭祀、嫁娶、剃头、冠带、修置产室、开渠、穿井、安碓硙、平治道涂、破屋坏垣、伐木、破土、启攒、颁诏、补垣、取鱼、招贤、整容、布政事、宣政事、安抚边境、修饰垣墙、纳畜、乘船渡水、选将、远回、鼓铸、营建、整手足甲、出师、筑堤防
1950-05-25	一九五零 庚寅[虎]年	四月小	初九	周四	庚寅 辛巳 庚申 辛巳	无	芒种 (6, 6)	无	无	无	虎	双子座	祭祀、出行、结婚姻、宴会、嫁娶、沐浴、剃头、修造、求医疗病、上表章、上官、进人口、竖柱上梁、经络、开市、纳财、扫舍宇、平治道涂、栽种、牧养、安葬、搬移、祈福、缮城郭、开仓、裁制、上册、颁诏、求嗣、覃恩、恤孤茕、雪冤、庆赐、招贤、整容、入宅、宣政事、安抚边境、施恩、修饰垣墙、立券交易、临政、纳畜、举正直、解除、修仓库、酝酿、选将、营建、纳采、整手足甲、出师	安床、冠带、修置产室、开渠、穿井、安碓硙、破屋坏垣、畋猎、补垣、取鱼、针刺、鼓铸、布政事、筑堤防、塞穴、修宫室
1950-05-26	一九五零 庚寅[虎]年	四月小	初十	周五	庚寅 辛巳 辛酉 癸巳	无	芒种 (6, 6)	无	无	无	虎	双子座	祭祀、沐浴、剃头、修造、上官、冠带、进人口、竖柱上梁、经络、安碓硙、扫舍宇、牧养、安葬、搬移、祈福、缮城郭、裁制、修宫室、颁诏、求嗣、覃恩、恤孤茕、雪冤、招贤、整容、宣政事、施恩、临政、纳畜、举正直、营建、整手足甲	宴会、修置产室、畋猎、取鱼、开仓、苫盖
1950-05-27	一九五零 庚寅[虎]年	四月小	十一	周六	庚寅 辛巳 壬戌 乙巳	无	芒种 (6, 6)	无	无	上海解放日	虎	双子座	沐浴、剃头、求医疗病、上表章、捕捉、整容、整手足甲、解除	出行、嫁娶、修造、开渠、穿井、安葬、开仓、修仓库
1950-05-28	一九五零 庚寅[虎]年	四月小	十二	周日	庚寅 辛巳 癸亥 丁巳	无	芒种 (6, 6)	无	无	无	虎	双子座	沐浴、破屋坏垣	祭祀、结婚姻、宴会、嫁娶、安床、剃头、修造、上表章、上官、冠带、竖柱上梁、经络、开市、修置产室、开渠、穿井、安碓硙、伐木、捕捉、畋猎、栽种、牧养、破土、安葬、启攒、祈福、缮城郭、开仓、裁制、上册、修宫室、颁诏、求嗣、庆赐、补垣、取鱼、招贤、整容、布政事、宣政事、施恩、立券交易、修饰垣墙、临政、举正直、解除、塞穴、修仓库、酝酿、鼓铸、营建、纳采、整手足甲、筑堤防
1950-05-29	一九五零 庚寅[虎]年	四月小	十三	周一	庚寅 辛巳 甲子 己巳	无	芒种 (6, 6)	无	无	无	虎	双子座	宴会、沐浴、覃恩、庆赐、恤孤茕、雪冤、布政事	结婚姻、修造、求医疗病、冠带、进人口、竖柱上梁、开市、纳财、修置产室、栽种、牧养、安葬、祈福、缮城郭、开仓、上册、修宫室、求嗣、招贤、施恩、立券交易、纳畜、举正直、解除、修仓库、营建、纳采、筑堤防
1950-05-30	一九五零 庚寅[虎]年	四月小	十四	周二	庚寅 辛巳 乙丑 辛巳	无	芒种 (6, 6)	无	纯阳祖师诞	无	虎	双子座	祭祀、结婚姻、宴会、修造、求医疗病、上表章、上官、入学、进人口、竖柱上梁、经络、开市、纳财、安碓硙、牧养、安葬、祈福、缮城郭、裁制、上册、修宫室、颁诏、求嗣、覃恩、恤孤茕、雪冤、庆赐、招贤、入宅、宣政事、施恩、立券交易、临政、纳畜、举正直、解除、修仓库、赴任、酝酿、营建、纳采、筑堤防	冠带、畋猎、取鱼、远回、乘船渡水
1950-05-31	一九五零 庚寅[虎]年	四月小	十五	周三	庚寅 辛巳 丙寅 癸巳	无	芒种 (6, 6)	无	钟离祖师诞	世界无烟日	虎	双子座	出行、结婚姻、宴会、嫁娶、修造、求医疗病、上表章、上官、进人口、竖柱上梁、纳财、捕捉、栽种、牧养、安葬、诉讼、搬移、祈福、缮城郭、裁制、上册、颁诏、求嗣、覃恩、恤孤茕、雪冤、庆赐、招贤、宣政事、安抚边境、施恩、立券交易、临政、纳畜、举正直、解除、修仓库、赴任、选将、营建、纳采、出师	祭祀、剃头、冠带、修置产室、开渠、穿井、安碓硙、平治道涂、破屋坏垣、畋猎、开仓、修宫室、补垣、取鱼、整容、修饰垣墙、塞穴、鼓铸、整手足甲、筑堤防
