1960-05-01	1960-4-6	29	收	日	庚子 庚辰 己丑	无	立夏 (5, 5)	劳动节	无	无	祭祀 馀事勿取	嫁娶 安床 造庙
1960-05-02	1960-4-7	29	开	一	庚子 庚辰 庚寅	无	立夏 (5, 5)	无	无	无	交易 会亲友 出行 动土 启钻 嫁娶 开市 栽种 破土 移柩 立券 纳财 纳采 订盟 谢土 赴任 进人口 除服	入宅 入殓 安床 安葬
1960-05-03	1960-4-8	29	闭	二	庚子 庚辰 辛卯	无	立夏 (5, 5)	无	无	无	入殓 合帐 启钻 安床 安葬 成服 破土 祈福 祭祀 移柩 立碑 裁衣 谢土 造畜稠 除服	嫁娶 安门 掘井 纳采
1960-05-04	1960-4-9	29	建	三	庚子 庚辰 壬辰	无	立夏 (5, 5)	青年节	无	无	冠笄 出行 嫁娶 安床 扫舍 祭祀 裁衣 解除 进人口	动土 安葬 开光 掘井 破土
1960-05-05	1960-4-10	29	建	四	庚子 辛巳 癸巳	立夏	小满 (5, 21)	无	无	无	塞穴 断蚁 畋猎 结网 馀事勿取	入宅 出行 动土 嫁娶 安葬 词讼
1960-05-06	1960-4-11	29	除	五	庚子 辛巳 甲午	无	小满 (5, 21)	无	无	无	入宅 入殓 出火 出行 动土 嫁娶 安葬 开光 栽种 求嗣 牧养 破土 祈福 祭祀 移徙 纳畜 纳采 解除 订盟	作灶 安床 开仓 盖屋
1960-05-07	1960-4-12	29	满	六	庚子 辛巳 乙未	无	小满 (5, 21)	无	无	无	作灶 冠笄 塞穴 安床 开光 纳采 裁衣 进人口 造仓	伐木 作梁 修造 出行 动土 嫁娶 安葬 栽种 谢土
1960-05-08	1960-4-13	29	平	日	庚子 辛巳 丙申	无	小满 (5, 21)	母亲节	无	无	上梁 交易 修造 出行 动土 嫁娶 开市 挂匾 栽种 理发 移徙 立券 纳畜 纳采 裁衣 进人口	伐木 安床 安葬 祈福 祭祀
1960-05-09	1960-4-14	29	定	一	庚子 辛巳 丁酉	无	小满 (5, 21)	无	无	无	交易 修造 出行 动土 启钻 安床 安机械 安葬 定磉 开市 成服 挂匾 斋醮 盖屋 破土 祈福 祭祀 立券 立碑 起基 除服	作灶 入宅 嫁娶 理发 移徙
1960-05-10	1960-4-15	29	执	二	庚子 辛巳 戊戌	无	小满 (5, 21)	无	无	无	修造 入宅 入殓 出火 出行 动土 嫁娶 安床 安葬 开光 拆卸 挂匾 栽种 求嗣 破土 祈福 祭祀 移徙 移柩 纳采 解除 订盟 谢土 进人口	合寿木 开市 立券 造船
1960-05-11	1960-4-16	29	破	三	庚子 辛巳 己亥	无	小满 (5, 21)	无	无	无	坏垣 沐浴 破屋 祭祀 解除 馀事勿取	安葬 开光
1960-05-12	1960-4-17	29	危	四	庚子 辛巳 庚子	无	小满 (5, 21)	无	无	无	修坟 入宅 出火 出行 动土 嫁娶 安床 安葬 开光 拆卸 栽种 求嗣 破土 祈福 祭祀 移徙 纳畜 纳采 解除 订盟 谢土	作灶 开市 经络
1960-05-13	1960-4-18	29	成	五	庚子 辛巳 辛丑	无	小满 (5, 21)	无	无	无	交易 动土 安葬 开光 开市 开池 栽种 求嗣 破土 祈福 祭祀 立券 纳畜 纳财 纳采 解除 订盟 起基 进人口 造仓	上梁 入宅 嫁娶 安床 裁衣
1960-05-14	1960-4-19	29	收	六	庚子 辛巳 壬寅	无	小满 (5, 21)	无	无	无	捕捉 祭祀 结网 馀事勿取	嫁娶 开市 探病
1960-05-15	1960-4-20	29	开	日	庚子 辛巳 癸卯	无	小满 (5, 21)	全国助残日	无	无	习艺 交易 会亲友 修坟 出行 动土 启钻 嫁娶 安碓磑 开光 开市 开池 开渠 拆卸 放水 栽种 求嗣 破土 祈福 祭祀 立券 立碑 纳采 订盟 谢土 起基 造仓	入宅 安葬 安门
1960-05-16	1960-4-21	29	闭	一	庚子 辛巳 甲辰	无	小满 (5, 21)	无	无	无	作灶 入宅 入殓 冠笄 出行 启钻 塞穴 嫁娶 开厕 成服 破土 祭祀 移徙 补垣 造车器 除服	上梁 安葬 安门 盖屋 造桥
1960-05-17	1960-4-22	29	建	二	庚子 辛巳 乙巳	无	小满 (5, 21)	无	无	无	会亲友 断蚁 祭祀 解除 馀事勿取	嫁娶 安葬
1960-05-18	1960-4-23	29	除	三	庚子 辛巳 丙午	无	小满 (5, 21)	无	无	无	修造 入宅 动土 嫁娶 治病 祈福 祭祀 移徙 纳采 订盟 造车器	作灶 出行 安床 安葬 开市
1960-05-19	1960-4-24	29	满	四	庚子 辛巳 丁未	无	小满 (5, 21)	无	无	无	会亲友 冠笄 嫁娶 安机械 求嗣 祭祀 纳采 经络 结网 订盟 进人口	作灶 动土 安葬 开市 行丧
1960-05-20	1960-4-25	29	平	五	庚子 辛巳 戊申	无	小满 (5, 21)	无	无	无	安葬 平治道涂 扫舍 沐浴 破土 祭祀 移徙	作灶 入宅 嫁娶 安床 祈福
1960-05-21	1960-4-26	29	定	六	庚子 辛巳 己酉	小满	芒种 (6, 6)	无	无	无	上梁 作灶 入宅 出火 启钻 塑绘 安机械 安葬 安门 安香 开光 斋醮 求嗣 盖屋 祈福 祭祀 移徙 竖柱 纳畜 起基	动土 嫁娶 破土
1960-05-22	1960-4-27	29	执	日	庚子 辛巳 庚戌	无	芒种 (6, 6)	无	无	无	会亲友 入殓 动土 嫁娶 安葬 开光 捕捉 斋醮 求医 治病 牧养 破土 祈福 祭祀 纳畜 纳采 解除 订盟	入宅 架马 盖屋 移徙
1960-05-23	1960-4-28	29	破	一	庚子 辛巳 辛亥	无	芒种 (6, 6)	无	无	无	坏垣 沐浴 破屋 祭祀 解除 馀事勿取	安葬 行丧
1960-05-24	1960-4-29	29	危	二	庚子 辛巳 壬子	无	芒种 (6, 6)	无	无	无	扫舍 沐浴 馀事勿取	作灶 嫁娶 开市 斋醮
1960-05-25	1960-5-1	30	成	三	庚子 辛巳 癸丑	无	芒种 (6, 6)	无	无	无	上梁 交易 会亲友 作灶 修造 动土 安机械 安葬 安门 定磉 开光 开厕 开市 开池 放水 栽种 求医 治病 牧养 盖屋 破土 立券 立碑 竖柱 起基 造畜稠	入宅 出火 嫁娶 移徙
1960-05-26	1960-5-2	30	收	四	庚子 辛巳 甲寅	无	芒种 (6, 6)	无	无	无	捕捉 栽种 畋猎 馀事勿取	动土 安葬 开市 探病 斋醮 祭祀
1960-05-27	1960-5-3	30	开	五	庚子 辛巳 乙卯	无	芒种 (6, 6)	无	无	无	习艺 会亲友 修坟 修造 出行 动土 嫁娶 安床 定磉 成服 拆卸 放水 斋醮 求嗣 牧养 理发 破土 祈福 祭祀 立碑 竖柱 纳畜 纳采 解除 订盟 起基 针灸 除服	入宅 出火 开市 探病 盖屋
1960-05-28	1960-5-4	30	闭	六	庚子 辛巳 丙辰	无	芒种 (6, 6)	无	无	无	馀事勿取	无
1960-05-29	1960-5-5	30	建	日	庚子 辛巳 丁巳	无	芒种 (6, 6)	无	无	无	塞穴 断蚁 结网 馀事勿取	安葬 破土
1960-05-30	1960-5-6	30	除	一	庚子 辛巳 戊午	无	芒种 (6, 6)	无	无	无	伐木 入宅 入殓 出火 出行 嫁娶 安葬 开光 开市 成服 拆卸 架马 移徙 移柩 纳采 造庙 造桥 造畜稠 造船 除服	无
1960-05-31	1960-5-7	30	满	二	庚子 辛巳 己未	无	芒种 (6, 6)	无	无	无	塞穴 牧养 结网 置产 进人口 馀事勿取	诸事不宜
