1960-01-01	一九五九 己亥[猪]年	腊月小	初三	周五	己亥 丙子 戊子 丁巳	无	小寒 (1, 6)	元旦节	无	无	猪	摩羯座	诸事不宜	诸事不宜
1960-01-02	一九五九 己亥[猪]年	腊月小	初四	周六	己亥 丙子 己丑 己巳	无	小寒 (1, 6)	无	无	无	猪	摩羯座	祭祀、出行、结婚姻、宴会、嫁娶、沐浴、剃头、上官、进人口、经络、纳财、扫舍宇、安葬、搬移、祈福、恤孤茕、雪冤、整容、入宅、施恩、立券交易、临政、举正直、解除、赴任、酝酿、纳采、整手足甲	冠带
1960-01-03	一九五九 己亥[猪]年	腊月小	初五	周日	己亥 丙子 庚寅 辛巳	无	小寒 (1, 6)	无	无	无	猪	摩羯座	宴会、嫁娶、上表章、进人口、竖柱上梁、开市、纳财、栽种、牧养、祈福、缮城郭、裁制、上册、修宫室、求嗣、庆赐、补垣、安抚边境、立券交易、解除、塞穴、选将	祭祀、招贤、乘船渡水、远回
1960-01-04	一九五九 己亥[猪]年	腊月小	初六	周一	己亥 丙子 辛卯 癸巳	无	小寒 (1, 6)	无	无	无	猪	摩羯座	诸事不宜	诸事不宜
1960-01-05	一九五九 己亥[猪]年	腊月小	初七	周二	己亥 丙子 壬辰 乙巳	无	小寒 (1, 6)	无	无	无	猪	摩羯座	祭祀、宴会、经络、安碓硙、诉讼、祈福、裁制、颁诏、求嗣、覃恩、恤孤茕、雪冤、庆赐、招贤、宣政事、施恩、举正直、赴任、酝酿	安床、开市、修置产室、开渠、穿井、畋猎、破土、启攒、取鱼、筑堤防、开仓
1960-01-06	一九五九 己亥[猪]年	腊月小	初八	周三	己亥 丁丑 癸巳 丁巳	小寒	大寒 (1, 21)	无	腊八节-释迦如来成佛之辰	无	猪	摩羯座	结婚姻、宴会、冠带、竖柱上梁、经络、安碓硙、缮城郭、裁制、修宫室、庆赐、临政、纳畜、酝酿、纳采	出行、求医疗病、上表章、开市、修置产室、栽种、破土、安葬、启攒、搬移、开仓、上册、补垣、取鱼、安抚边境、解除、塞穴、乘船渡水、选将、鼓铸、出师
1960-01-07	一九五九 己亥[猪]年	腊月小	初九	周四	己亥 丁丑 甲午 己巳	无	大寒 (1, 21)	无	无	无	猪	摩羯座	祭祀、出行、结婚姻、宴会、嫁娶、沐浴、剃头、修造、求医疗病、上表章、上官、竖柱上梁、纳财、捕捉、畋猎、栽种、牧养、安葬、诉讼、搬移、祈福、缮城郭、开仓、裁制、修宫室、求嗣、庆赐、整容、入宅、安抚边境、临政、解除、赴任、纳采、整手足甲	冠带、修置产室、取鱼、纳畜、招贤、苫盖、选将、营建、出师、筑堤防、乘船渡水、上册、修仓库
1960-01-08	一九五九 己亥[猪]年	腊月小	初十	周五	己亥 丁丑 乙未 辛巳	无	大寒 (1, 21)	无	无	无	猪	摩羯座	覃恩、恤孤茕、雪冤、解除	剃头、冠带、修置产室、开渠、穿井、安碓硙、平治道涂、伐木、畋猎、启攒、补垣、取鱼、整容、布政事、修饰垣墙、塞穴、鼓铸、整手足甲、筑堤防
1960-01-09	一九五九 己亥[猪]年	腊月小	十一	周六	己亥 丁丑 丙申 癸巳	无	大寒 (1, 21)	无	无	无	猪	摩羯座	祭祀、沐浴、剃头、经络、开市、纳财、扫舍宇、伐木、畋猎、栽种、牧养、安葬、开仓、整容、安抚边境、纳畜、酝酿、选将、整手足甲	结婚姻、宴会、求嗣、庆赐、纳采
1960-01-10	一九五九 己亥[猪]年	腊月小	十二	周日	己亥 丁丑 丁酉 乙巳	无	大寒 (1, 21)	无	无	中国公安110宣传日	猪	摩羯座	出行、沐浴、求医疗病、上表章、上官、入学、进人口、竖柱上梁、经络、开市、纳财、安碓硙、扫舍宇、栽种、牧养、安葬、缮城郭、裁制、上册、修宫室、施恩、临政、举正直、解除、修仓库、酝酿、整手足甲、筑堤防	宴会、剃头、畋猎、选将、出师、苫盖
1960-01-11	一九五九 己亥[猪]年	腊月小	十三	周一	己亥 丁丑 戊戌 丁巳	无	大寒 (1, 21)	无	无	无	猪	摩羯座	祭祀、捕捉、畋猎	出行、结婚姻、宴会、嫁娶、安床、剃头、修造、求医疗病、上表章、上官、冠带、进人口、竖柱上梁、经络、开市、纳财、修置产室、开渠、穿井、安碓硙、破屋坏垣、栽种、牧养、破土、安葬、启攒、搬移、祈福、缮城郭、开仓、裁制、上册、修宫室、颁诏、求嗣、庆赐、补垣、招贤、整容、布政事、宣政事、安抚边境、施恩、立券交易、修饰垣墙、临政、纳畜、举正直、解除、塞穴、修仓库、酝酿、选将、鼓铸、营建、纳采、整手足甲、出师、筑堤防
1960-01-12	一九五九 己亥[猪]年	腊月小	十四	周二	己亥 丁丑 己亥 己巳	无	大寒 (1, 21)	无	无	无	猪	摩羯座	祭祀、出行、宴会、沐浴、修造、求医疗病、上表章、上官、入学、开市、修置产室、开渠、穿井、安碓硙、栽种、牧养、搬移、祈福、缮城郭、裁制、上册、修宫室、求嗣、覃恩、恤孤茕、雪冤、庆赐、入宅、安抚边境、临政、解除、修仓库、赴任、选将、纳采	结婚姻、嫁娶、剃头、冠带、竖柱上梁、平治道涂、破屋坏垣、伐木、畋猎、破土、安葬、启攒、开仓、补垣、取鱼、整容、布政事、修饰垣墙、纳畜、塞穴、乘船渡水、远回、鼓铸、营建、整手足甲、出师、筑堤防
1960-01-13	一九五九 己亥[猪]年	腊月小	十五	周三	己亥 丁丑 庚子 辛巳	无	大寒 (1, 21)	无	无	无	猪	摩羯座	祭祀、沐浴、安葬、裁制、覃恩、恤孤茕、雪冤、塞穴、酝酿	安床、剃头、冠带、开市、修置产室、开渠、穿井、安碓硙、平治道涂、破屋坏垣、畋猎、开仓、修宫室、取鱼、针刺、整容、布政事、疗目、修饰垣墙、远回、整手足甲
1960-01-14	一九五九 己亥[猪]年	腊月小	十六	周四	己亥 丁丑 辛丑 癸巳	无	大寒 (1, 21)	无	南岳大帝诞	无	猪	摩羯座	祭祀、宴会、经络、纳财、牧养、裁制、庆赐、施恩、立券交易、纳畜、举正直	剃头、上表章、冠带、修置产室、开渠、穿井、平治道涂、破屋坏垣、伐木、捕捉、畋猎、破土、安葬、启攒、上册、颁诏、补垣、取鱼、整容、宣政事、修饰垣墙、营建、整手足甲、筑堤防
1960-01-15	一九五九 己亥[猪]年	腊月小	十七	周五	己亥 丁丑 壬寅 乙巳	无	大寒 (1, 21)	无	无	无	猪	摩羯座	沐浴、扫舍宇	祭祀、上表章、开渠、穿井、启攒、上册、颁诏、补垣、招贤、布政事、宣政事、塞穴、营建、筑堤防
1960-01-16	一九五九 己亥[猪]年	腊月小	十八	周六	己亥 丁丑 癸卯 丁巳	无	大寒 (1, 21)	无	无	无	猪	摩羯座	诸事不宜	祭祀、出行、结婚姻、宴会、嫁娶、安床、剃头、修造、求医疗病、上表章、上官、冠带、进人口、竖柱上梁、经络、开市、纳财、修置产室、开渠、穿井、安碓硙、破屋坏垣、栽种、牧养、破土、安葬、启攒、搬移、祈福、缮城郭、裁制、上册、开仓、修宫室、颁诏、求嗣、庆赐、补垣、招贤、整容、布政事、宣政事、安抚边境、入宅、施恩、立券交易、修饰垣墙、临政、纳畜、举正直、解除、塞穴、修仓库、酝酿、选将、鼓铸、营建、纳采、整手足甲、出师、筑堤防
1960-01-17	一九五九 己亥[猪]年	腊月小	十九	周日	己亥 丁丑 甲辰 己巳	无	大寒 (1, 21)	无	无	无	猪	摩羯座	祭祀、平治道涂、入宅	出行、结婚姻、宴会、嫁娶、安床、剃头、修造、求医疗病、上表章、上官、冠带、进人口、竖柱上梁、经络、开市、立券、纳财、修置产室、开渠、穿井、安碓硙、破屋坏垣、栽种、牧养、破土、安葬、启攒、搬移、祈福、缮城郭、裁制、上册、开仓、修宫室、颁诏、求嗣、庆赐、补垣、招贤、整容、布政事、宣政事、安抚边境、施恩、立券交易、修饰垣墙、临政、纳畜、开张、举正直、解除、塞穴、修仓库、酝酿、选将、鼓铸、营建、纳采、整手足甲、出师、筑堤防
1960-01-18	一九五九 己亥[猪]年	腊月小	二十	周一	己亥 丁丑 乙巳 辛巳	无	大寒 (1, 21)	无	无	无	猪	摩羯座	祭祀、结婚姻、宴会、上官、冠带、竖柱上梁、经络、牧养、祈福、裁制、颁诏、求嗣、覃恩、恤孤茕、雪冤、庆赐、招贤、宣政事、施恩、临政、纳畜、举正直、酝酿、纳采	出行、修置产室、开渠、穿井、平治道涂、破屋坏垣、畋猎、破土、启攒、补垣、取鱼、鼓铸、筑堤防、塞穴、乘船渡水、修饰垣墙
1960-01-19	一九五九 己亥[猪]年	腊月小	廿一	周二	己亥 丁丑 丙午 癸巳	无	大寒 (1, 21)	无	天猷上帝诞	无	猪	摩羯座	沐浴、剃头、捕捉、畋猎、诉讼、赴任、整容	出行、结婚姻、宴会、嫁娶、安床、修造、求医疗病、上表章、上官、冠带、进人口、竖柱上梁、经络、开市、纳财、修置产室、开渠、穿井、安碓硙、平治道涂、破屋坏垣、栽种、牧养、破土、安葬、启攒、搬移、祈福、缮城郭、开仓、上册、裁制、修宫室、颁诏、求嗣、庆赐、补垣、取鱼、招贤、布政事、宣政事、安抚边境、立券交易、施恩、修饰垣墙、临政、纳畜、举正直、解除、塞穴、乘船渡水、修仓库、酝酿、选将、鼓铸、营建、纳采、整手足甲、出师、筑堤防、苫盖
1960-01-20	一九五九 己亥[猪]年	腊月小	廿二	周三	己亥 丁丑 丁未 乙巳	无	大寒 (1, 21)	无	无	无	猪	水瓶座	诸事不宜	祭祀、出行、结婚姻、宴会、安床、剃头、修造、上表章、上官、冠带、进人口、竖柱上梁、经络、开市、纳财、修置产室、开渠、穿井、安碓硙、平治道涂、伐木、栽种、牧养、安葬、启攒、搬移、祈福、缮城郭、开仓、裁制、上册、修宫室、颁诏、求嗣、庆赐、补垣、招贤、整容、布政事、宣政事、安抚边境、施恩、立券交易、修饰垣墙、临政、纳畜、举正直、塞穴、修仓库、酝酿、选将、鼓铸、营建、纳采、整手足甲、出师、筑堤防
1960-01-21	一九五九 己亥[猪]年	腊月小	廿三	周四	己亥 丁丑 戊申 丁巳	大寒	立春 (2, 5)	无	小年	列宁逝世纪念日	猪	水瓶座	祭祀、沐浴、剃头、经络、开市、纳财、扫舍宇、伐木、畋猎、牧养、开仓、整容、安抚边境、纳畜、酝酿、选将	出行、结婚姻、宴会、修造、修置产室、开渠、穿井、安碓硙、平治道涂、破屋坏垣、缮城郭、修宫室、求嗣、庆赐、补垣、修饰垣墙、乘船渡水、修仓库、营建、纳采、筑堤防
1960-01-22	一九五九 己亥[猪]年	腊月小	廿四	周五	己亥 丁丑 己酉 己巳	无	立春 (2, 5)	无	子时灶君上天朝玉帝	无	猪	水瓶座	出行、沐浴、剃头、求医疗病、上表章、上官、入学、进人口、竖柱上梁、经络、开市、纳财、扫舍宇、牧养、裁制、上册、覃恩、恤孤茕、雪冤、整容、布政事、入宅、施恩、临政、举正直、解除、赴任、酝酿、整手足甲	宴会、修置产室、开渠、穿井、平治道涂、破屋坏垣、畋猎、补垣、修饰垣墙、选将、营建、出师、苫盖
1960-01-23	一九五九 己亥[猪]年	腊月小	廿五	周六	己亥 丁丑 庚戌 辛巳	无	立春 (2, 5)	无	无	无	猪	水瓶座	祭祀、捕捉、覃恩、恤孤茕、雪冤	安床、剃头、冠带、经络、开市、修置产室、开渠、穿井、安碓硙、平治道涂、破屋坏垣、破土、启攒、开仓、修宫室、补垣、取鱼、整容、立券交易、修饰垣墙、塞穴、酝酿、鼓铸、整手足甲、筑堤防
1960-01-24	一九五九 己亥[猪]年	腊月小	廿六	周日	己亥 丁丑 辛亥 癸巳	无	立春 (2, 5)	无	无	无	猪	水瓶座	沐浴、入学、覃恩、恤孤茕、雪冤	祭祀、出行、结婚姻、宴会、嫁娶、安床、剃头、修造、求医疗病、上表章、上官、冠带、进人口、竖柱上梁、经络、开市、纳财、修置产室、开渠、穿井、安碓硙、平治道涂、破屋坏垣、伐木、畋猎、栽种、牧养、破土、安葬、启攒、搬移、祈福、缮城郭、裁制、上册、开仓、修宫室、颁诏、求嗣、庆赐、补垣、取鱼、招贤、整容、布政事、宣政事、安抚边境、施恩、立券交易、修饰垣墙、临政、纳畜、举正直、解除、塞穴、修仓库、酝酿、选将、远回、鼓铸、营建、纳采、整手足甲、出师、筑堤防
1960-01-25	一九五九 己亥[猪]年	腊月小	廿七	周一	己亥 丁丑 壬子 乙巳	无	立春 (2, 5)	无	无	无	猪	水瓶座	祭祀、沐浴、经络、覃恩、恤孤茕、雪冤、塞穴、酝酿	出行、结婚姻、宴会、嫁娶、安床、修造、求医疗病、上表章、上官、冠带、进人口、竖柱上梁、开市、纳财、修置产室、开渠、穿井、安碓硙、平治道涂、破屋坏垣、栽种、牧养、破土、安葬、搬移、祈福、缮城郭、开仓、上册、修宫室、颁诏、求嗣、庆赐、补垣、针刺、招贤、布政事、宣政事、安抚边境、疗目、施恩、立券交易、临政、修饰垣墙、纳畜、举正直、解除、修仓库、选将、远回、营建、纳采、出师、筑堤防
1960-01-26	一九五九 己亥[猪]年	腊月小	廿八	周二	己亥 丁丑 癸丑 丁巳	无	立春 (2, 5)	无	无	国际海关日	猪	水瓶座	宴会、经络、纳财、裁制、覃恩、庆赐、恤孤茕、雪冤、布政事、施恩、立券交易、纳畜、举正直、酝酿	剃头、求医疗病、上表章、冠带、修置产室、开渠、穿井、平治道涂、破屋坏垣、伐木、捕捉、畋猎、栽种、破土、安葬、启攒、搬移、祈福、开仓、上册、颁诏、求嗣、补垣、取鱼、整容、宣政事、修饰垣墙、解除、营建、整手足甲、筑堤防
1960-01-27	一九五九 己亥[猪]年	腊月小	廿九	周三	己亥 丁丑 甲寅 己巳	无	立春 (2, 5)	无	华严菩萨诞	无	猪	水瓶座	出行、结婚姻、宴会、嫁娶、沐浴、剃头、修造、求医疗病、上表章、上官、竖柱上梁、纳财、扫舍宇、栽种、牧养、安葬、搬移、祈福、缮城郭、开仓、裁制、修宫室、求嗣、庆赐、整容、入宅、安抚边境、立券交易、临政、解除、选将、纳采、整手足甲、出师	祭祀、冠带、修置产室、开渠、穿井、安碓硙、平治道涂、破屋坏垣、上册、颁诏、补垣、取鱼、招贤、布政事、宣政事、修饰垣墙、塞穴、乘船渡水、修仓库、鼓铸、营建、筑堤防
1960-01-28	一九六零 庚子[鼠]年	正月大	初一	周四	庚子 丁丑 乙卯 辛巳	无	立春 (2, 5)	春节	弥勒佛圣诞	无	鼠	水瓶座	出行、结婚姻、宴会、嫁娶、修造、求医疗病、上表章、上官、进人口、竖柱上梁、经络、开市、纳财、栽种、牧养、安葬、搬移、祈福、缮城郭、裁制、开仓、上册、修宫室、颁诏、求嗣、覃恩、补垣、恤孤茕、雪冤、庆赐、招贤、入宅、宣政事、安抚边境、立券交易、施恩、临政、纳畜、举正直、解除、塞穴、修仓库、赴任、选将、营建、纳采、出师	祭祀、剃头、冠带、修置产室、开渠、穿井、安碓硙、平治道涂、破屋坏垣、畋猎、取鱼、整容、鼓铸、布政事、整手足甲、筑堤防、修饰垣墙
1960-01-29	一九六零 庚子[鼠]年	正月大	初二	周五	庚子 丁丑 丙辰 癸巳	无	立春 (2, 5)	无	无	无	鼠	水瓶座	诸事不宜	诸事不宜
1960-01-30	一九六零 庚子[鼠]年	正月大	初三	周六	庚子 丁丑 丁巳 乙巳	无	立春 (2, 5)	无	无	无	鼠	水瓶座	诸事不宜	出行、安床、剃头、求医疗病、上表章、上官、开市、修置产室、开渠、穿井、平治道涂、破屋坏垣、栽种、牧养、破土、安葬、启攒、搬移、祈福、开仓、上册、颁诏、求嗣、补垣、取鱼、招贤、整容、布政事、宣政事、安抚边境、施恩、修饰垣墙、举正直、解除、塞穴、乘船渡水、选将、鼓铸、营建、出师、筑堤防
1960-01-31	一九六零 庚子[鼠]年	正月大	初四	周日	庚子 丁丑 戊午 丁巳	无	立春 (2, 5)	无	无	无	鼠	水瓶座	沐浴、剃头、捕捉、畋猎、诉讼、赴任、整容、整手足甲	出行、结婚姻、宴会、嫁娶、安床、修造、求医疗病、上表章、上官、冠带、进人口、竖柱上梁、经络、开市、纳财、修置产室、开渠、穿井、安碓硙、平治道涂、破屋坏垣、栽种、牧养、破土、安葬、启攒、搬移、祈福、缮城郭、开仓、上册、修宫室、求嗣、庆赐、补垣、取鱼、招贤、安抚边境、立券交易、施恩、修饰垣墙、临政、纳畜、举正直、解除、乘船渡水、修仓库、酝酿、选将、营建、纳采、出师、筑堤防、苫盖
