1961-09-01	1961-7-22	30	除	五	辛丑 丙申 丁酉	无	白露 (9, 8)	无	无	无	订盟 纳采 祭祀 祈福 修造 动土 上梁 破土 安葬	嫁娶 开市
1961-09-02	1961-7-23	30	满	六	辛丑 丙申 戊戌	无	白露 (9, 8)	无	无	无	订盟 纳采 出行 会亲友 修造 上梁 移徙 入宅	开市 安葬
1961-09-03	1961-7-24	30	平	日	辛丑 丙申 己亥	无	白露 (9, 8)	无	无	无	沐浴 修饰垣墙 平治道涂 馀事勿取	嫁娶 祈福
1961-09-04	1961-7-25	30	定	一	辛丑 丙申 庚子	无	白露 (9, 8)	无	无	无	嫁娶 祭祀 祈福 斋醮 动土 移徙 入宅	开市 安葬
1961-09-05	1961-7-26	30	执	二	辛丑 丙申 辛丑	无	白露 (9, 8)	无	无	无	捕捉 结网 入殓 破土 安葬	嫁娶 入宅
1961-09-06	1961-7-27	30	破	三	辛丑 丙申 壬寅	无	白露 (9, 8)	无	无	无	沐浴 治病 破屋 坏垣 馀事勿取	诸事不宜
1961-09-07	1961-7-28	30	危	四	辛丑 丙申 癸卯	无	白露 (9, 8)	无	无	无	嫁娶 订盟 纳采 出行 开市 祭祀 祈福 移徙 入宅 启钻 安葬	动土 破土
1961-09-08	1961-7-29	30	危	五	辛丑 丁酉 甲辰	白露	秋分 (9, 23)	无	无	无	嫁娶 纳采 订盟 祭祀 祈福 求嗣 开光 出行 出火 拆卸 修造 动土 进人口 入宅 移徙 安床 上梁 合脊 放水 掘井 破土 移柩 谢土 除服 成服	开市 开仓 安门 安葬
1961-09-09	1961-7-30	30	成	六	辛丑 丁酉 乙巳	无	秋分 (9, 23)	无	无	无	嫁娶 纳采 订盟 祭祀 祈福 求嗣 开光 解除 进人口 入宅 移徙 出火 安床 开市 交易 立券 挂匾	安葬 纳畜 出行 行丧 伐木 栽种 造庙 造桥
1961-09-10	1961-8-1	30	收	日	辛丑 丁酉 丙午	无	秋分 (9, 23)	教师节	无	无	祭祀 冠笄 捕捉 馀事勿取	嫁娶 开市 盖屋 作梁 合寿木
1961-09-11	1961-8-2	30	开	一	辛丑 丁酉 丁未	无	秋分 (9, 23)	无	无	无	祭祀 解除 结网 畋猎 取渔 会亲友 入学 移柩 启钻 除服 成服	开市 祈福 动土 破土 入殓 安葬 造船
1961-09-12	1961-8-3	30	闭	二	辛丑 丁酉 戊申	无	秋分 (9, 23)	无	无	无	冠笄 沐浴 出行 修造 动土 移徙 入宅 破土 安葬	嫁娶 开市 祭祀 祈福 斋醮 纳采 修坟
1961-09-13	1961-8-4	30	建	三	辛丑 丁酉 己酉	无	秋分 (9, 23)	无	无	无	祭祀 出行	嫁娶 入宅 修造 动土 会亲友 破土
1961-09-14	1961-8-5	30	除	四	辛丑 丁酉 庚戌	无	秋分 (9, 23)	无	无	无	嫁娶 订盟 纳采 祭祀 祈福 出行 修造 动土 移徙 入宅	针灸 伐木 作梁 造庙 行丧 安葬
1961-09-15	1961-8-6	30	满	五	辛丑 丁酉 辛亥	无	秋分 (9, 23)	无	无	无	出行 开市 交易 立券 安机械 出火 上梁 移徙	嫁娶 安葬 动土 造桥
1961-09-16	1961-8-7	30	平	六	辛丑 丁酉 壬子	无	秋分 (9, 23)	全民国防教育日	无	无	祭祀 沐浴 修饰垣墙 平治道涂 馀事勿取	斋醮 嫁娶 移徙 出行 上梁 入宅
1961-09-17	1961-8-8	30	定	日	辛丑 丁酉 癸丑	无	秋分 (9, 23)	无	无	无	嫁娶 造车器 安机械 祭祀 祈福 开光 安香 出火 出行 开市 立券 修造 动土 移徙 入宅 破土 安葬	纳采 订盟 架马 词讼 开渠
1961-09-18	1961-8-9	30	执	一	辛丑 丁酉 甲寅	无	秋分 (9, 23)	无	无	无	沐浴 捕捉 入殓 除服 成服 破土 启钻 安葬	祭祀 嫁娶 安床 开市 入宅 探病 上梁
1961-09-19	1961-8-10	30	破	二	辛丑 丁酉 乙卯	无	秋分 (9, 23)	无	无	无	馀事勿取	探病
1961-09-20	1961-8-11	30	危	三	辛丑 丁酉 丙辰	无	秋分 (9, 23)	无	无	无	订盟 纳采 祭祀 祈福 安香 出火 修造 动土 上梁 安门 起基 竖柱 定磉 开池 移徙 入宅 立券 破土	嫁娶 造庙 造桥 造船 作灶 安葬
1961-09-21	1961-8-12	30	成	四	辛丑 丁酉 丁巳	无	秋分 (9, 23)	无	无	无	开光 求嗣 雕刻 嫁娶 订盟 纳采 出火 拆卸 修造 动土 起基 上梁 放水 移徙 入宅 造仓 造船 开市 开池 纳畜 牧养 挂匾	行丧 安葬 合寿木
1961-09-22	1961-8-13	30	收	五	辛丑 丁酉 戊午	无	秋分 (9, 23)	无	无	无	祭祀 嫁娶 捕捉	开光 动土 破土 开市 修造 入宅 安门
1961-09-23	1961-8-14	30	开	六	辛丑 丁酉 己未	秋分	寒露 (10, 8)	无	无	无	祭祀 普渡 解除 会亲友 捕捉 畋猎 启钻 除服 成服 移柩	嫁娶 开市 动土 掘井 开池 安葬
1961-09-24	1961-8-15	30	闭	日	辛丑 丁酉 庚申	无	寒露 (10, 8)	无	无	无	出行 解除 冠笄 嫁娶 伐木 架马 开柱眼 修造 动土 移徙 入宅 开生坟 合寿木 入殓 移柩 破土 安葬 修坟	祭祀 祈福 开光 开市 安床
1961-09-25	1961-8-16	30	建	一	辛丑 丁酉 辛酉	无	寒露 (10, 8)	无	无	无	祭祀 祈福 求嗣 出行 沐浴 交易 扫舍 教牛马	动土 作灶 行丧 安葬 修坟
1961-09-26	1961-8-17	30	除	二	辛丑 丁酉 壬戌	无	寒露 (10, 8)	无	无	无	出行 解除 纳采 冠笄 雕刻 修造 动土 起基 上梁 合脊 安床 移徙 入宅 开市 栽种 开厕	造庙 安门 行丧 安葬
1961-09-27	1961-8-18	30	满	三	辛丑 丁酉 癸亥	无	寒露 (10, 8)	无	无	无	开光 塑绘 出行 解除 冠笄 裁衣 挂匾 作灶 开市 开池 开厕 补垣 塞穴	无
1961-09-28	1961-8-19	30	平	四	辛丑 丁酉 甲子	无	寒露 (10, 8)	无	无	无	祭祀 祈福 修饰垣墙 平治道涂 入殓 移柩	嫁娶 入宅 上梁 安门
1961-09-29	1961-8-20	30	定	五	辛丑 丁酉 乙丑	无	寒露 (10, 8)	无	无	无	祭祀 会亲友 纳采 嫁娶 开光 塑绘 斋醮 安香 开市 立券 除服 成服 入殓 移柩 安葬 赴任 进人口 出行 裁衣 修造 动土 上梁 经络 交易	入宅 伐木
1961-09-30	1961-8-21	30	执	六	辛丑 丁酉 丙寅	无	寒露 (10, 8)	无	无	无	祭祀 冠笄 会亲友 拆卸 起基 除服 成服 移柩 启钻 安葬 沐浴 捕捉 开光 塑绘	作灶 入宅 嫁娶
