1961-07-01	一九六一 辛丑[牛]年	五月大	十九	周六	辛丑 甲午 乙未 辛巳	牛	巨蟹座	无	小暑 (7, 7)	无	无	中国共产党诞生日,香港回归纪念日	结婚姻、宴会、沐浴、剃头、上官、进人口、经络、纳财、扫舍宇、破土、安葬、立券交易、举正直、选将、纳畜、酝酿、整容、解除、施恩、临政、安抚边境	修造、栽种、修仓库、搬移
1961-07-02	一九六一 辛丑[牛]年	五月大	二十	周日	辛丑 甲午 丙申 癸巳	牛	巨蟹座	无	小暑 (7, 7)	无	无	无	出行、嫁娶、沐浴、剃头、修造、上表章、进人口、竖柱上梁、经络、开市、纳财、扫舍宇、栽种、牧养、安葬、雪冤、裁制、覃恩、缮城郭、选将、塞穴、纳畜、上册、颁诏、入宅、出师、祈福、安抚边境、整容、补垣、解除、整手足甲、搬移、营建、恤孤茕、宣政事、求嗣、修宫室	祭祀、安床、畋猎、取鱼
1961-07-03	一九六一 辛丑[牛]年	五月大	廿一	周一	辛丑 甲午 丁酉 乙巳	牛	巨蟹座	无	小暑 (7, 7)	无	无	无	沐浴、扫舍宇、平治道涂、修饰垣墙	祭祀、出行、结婚姻、宴会、嫁娶、安床、剃头、修造、求医疗病、上表章、上官、冠带、进人口、竖柱上梁、经络、开市、纳财、修置产室、开渠、穿井、栽种、牧养、破土、安葬、启攒、立券交易、裁制、缮城郭、招贤、布政事、举正直、选将、纳畜、上册、颁诏、出师、祈福、酝酿、庆赐、开仓、鼓铸、整容、解除、修宫室、施恩、纳采、整手足甲、修仓库、临政、搬移、营建、筑堤防、宣政事、求嗣、安抚边境
1961-07-04	一九六一 辛丑[牛]年	五月大	廿二	周二	辛丑 甲午 戊戌 丁巳	牛	巨蟹座	无	小暑 (7, 7)	无	孝娥神诞	无	祭祀、出行、宴会、修造、上官、冠带、进人口、竖柱上梁、经络、安碓硙、牧养、裁制、缮城郭、举正直、纳畜、祈福、酝酿、庆赐、修宫室、纳采、施恩、临政、搬移、求嗣	修置产室
1961-07-05	一九六一 辛丑[牛]年	五月大	廿三	周三	辛丑 甲午 己亥 己巳	牛	巨蟹座	无	小暑 (7, 7)	无	无	无	祭祀、沐浴、捕捉、雪冤、覃恩、恤孤茕	嫁娶、剃头、冠带、修置产室、开渠、穿井、安碓硙、破屋坏垣、畋猎、破土、启攒、乘船渡水、布政事、塞穴、取鱼、修饰垣墙、整容、鼓铸、补垣、整手足甲、筑堤防
1961-07-06	一九六一 辛丑[牛]年	五月大	廿四	周四	辛丑 甲午 庚子 辛巳	牛	巨蟹座	无	小暑 (7, 7)	无	无	无	诸事不宜	诸事不宜
1961-07-07	一九六一 辛丑[牛]年	五月大	廿五	周五	辛丑 乙未 辛丑 癸巳	牛	巨蟹座	小暑	大暑 (7, 23)	无	无	中国人民抗日战争纪念日	祭祀、赴任、入宅	出行、结婚姻、宴会、嫁娶、安床、剃头、修造、求医疗病、上表章、上官、冠带、进人口、竖柱上梁、经络、开市、纳财、修置产室、开渠、穿井、安碓硙、破屋坏垣、伐木、栽种、牧养、破土、安葬、启攒、立券交易、裁制、缮城郭、招贤、布政事、举正直、选将、塞穴、解除、纳畜、上册、颁诏、修饰垣墙、出师、祈福、酝酿、庆赐、整容、鼓铸、开仓、补垣、修宫室、施恩、纳采、整手足甲、修仓库、临政、搬移、营建、筑堤防、宣政事、求嗣、安抚边境
1961-07-08	一九六一 辛丑[牛]年	五月大	廿六	周六	辛丑 乙未 壬寅 乙巳	牛	巨蟹座	无	大暑 (7, 23)	无	无	无	结婚姻、宴会、安床、经络、开市、纳财、栽种、牧养、安葬、选将、立券交易、纳畜、安抚边境、酝酿、开仓	祭祀、求医疗病、开渠、穿井、祈福、解除、求嗣
1961-07-09	一九六一 辛丑[牛]年	五月大	廿七	周日	辛丑 乙未 癸卯 丁巳	牛	巨蟹座	无	大暑 (7, 23)	无	无	无	出行、宴会、上表章、上官、入学、进人口、竖柱上梁、经络、开市、纳财、安碓硙、栽种、牧养、立券交易、裁制、缮城郭、举正直、上册、酝酿、庆赐、修宫室、纳采、施恩、修仓库、临政、筑堤防	穿井、选将、苫盖、出师
1961-07-10	一九六一 辛丑[牛]年	五月大	廿八	周一	辛丑 乙未 甲辰 己巳	牛	巨蟹座	无	大暑 (7, 23)	无	无	无	祭祀、进人口、纳财、捕捉、栽种、牧养、雪冤、覃恩、纳畜、恤孤茕	冠带、修置产室、开渠、穿井、畋猎、破土、启攒、乘船渡水、取鱼、筑堤防、布政事、鼓铸
1961-07-11	一九六一 辛丑[牛]年	五月大	廿九	周二	辛丑 乙未 乙巳 辛巳	牛	巨蟹座	无	大暑 (7, 23)	无	无	世界人口日	入学、雪冤、覃恩、恤孤茕	祭祀、出行、结婚姻、宴会、嫁娶、安床、剃头、修造、求医疗病、上表章、上官、冠带、进人口、竖柱上梁、经络、开市、纳财、修置产室、开渠、穿井、安碓硙、平治道涂、破屋坏垣、伐木、畋猎、栽种、牧养、破土、安葬、启攒、立券交易、裁制、缮城郭、远回、招贤、布政事、举正直、选将、塞穴、纳畜、取鱼、上册、颁诏、修饰垣墙、出师、祈福、酝酿、庆赐、整容、鼓铸、开仓、补垣、解除、修宫室、施恩、纳采、整手足甲、修仓库、临政、搬移、营建、筑堤防、宣政事、求嗣、安抚边境
1961-07-12	一九六一 辛丑[牛]年	五月大	三十	周三	辛丑 乙未 丙午 癸巳	牛	巨蟹座	无	大暑 (7, 23)	无	无	无	经络、安葬、赴任、诉讼、塞穴、入宅、酝酿、补垣	出行、安床、上表章、冠带、竖柱上梁、开市、修置产室、开渠、穿井、捕捉、畋猎、栽种、牧养、疗目、针刺、缮城郭、苫盖、招贤、布政事、举正直、选将、取鱼、上册、颁诏、出师、祈福、安抚边境、庆赐、开仓、解除、修宫室、施恩、修仓库、营建、宣政事、求嗣
1961-07-13	一九六一 辛丑[牛]年	六月小	初一	周四	辛丑 乙未 丁未 乙巳	牛	巨蟹座	无	大暑 (7, 23)	无	无	无	宴会、上官、进人口、经络、纳财、立券交易、裁制、招贤、举正直、纳畜、酝酿、庆赐、施恩、临政	剃头、求医疗病、上表章、修置产室、开渠、穿井、平治道涂、破屋坏垣、伐木、栽种、安葬、启攒、上册、修饰垣墙、整容、开仓、补垣、解除、整手足甲、搬移、营建、筑堤防、求嗣
1961-07-14	一九六一 辛丑[牛]年	六月小	初二	周五	辛丑 乙未 戊申 丁巳	牛	巨蟹座	无	大暑 (7, 23)	无	无	无	祭祀、沐浴、扫舍宇	上表章、立券、开渠、穿井、安葬、启攒、招贤、布政事、塞穴、上册、颁诏、补垣、筑堤防、营建、宣政事、开张
1961-07-15	一九六一 辛丑[牛]年	六月小	初三	周六	辛丑 乙未 己酉 己巳	牛	巨蟹座	无	大暑 (7, 23)	无	无	无	出行、结婚姻、嫁娶、沐浴、剃头、修造、求医疗病、上表章、上官、进人口、竖柱上梁、经络、开市、纳财、扫舍宇、栽种、牧养、安葬、立券交易、雪冤、裁制、覃恩、缮城郭、招贤、举正直、选将、塞穴、纳畜、上册、颁诏、出师、祈福、安抚边境、开仓、整容、补垣、解除、施恩、纳采、整手足甲、修仓库、临政、搬移、营建、恤孤茕、宣政事、求嗣、修宫室	祭祀、宴会、冠带、修置产室、开渠、穿井、安碓硙、破屋坏垣、畋猎、启攒、针刺、修饰垣墙、入宅、取鱼、筑堤防、鼓铸
1961-07-16	一九六一 辛丑[牛]年	六月小	初四	周日	辛丑 乙未 庚戌 辛巳	牛	巨蟹座	无	大暑 (7, 23)	无	无	无	诸事不宜	诸事不宜
1961-07-17	一九六一 辛丑[牛]年	六月小	初五	周一	辛丑 乙未 辛亥 癸巳	牛	巨蟹座	无	大暑 (7, 23)	无	无	无	祭祀、结婚姻、宴会、沐浴、修造、上官、冠带、进人口、竖柱上梁、经络、安碓硙、牧养、雪冤、赴任、裁制、缮城郭、覃恩、布政事、举正直、纳畜、入宅、祈福、庆赐、纳采、施恩、临政、搬移、求嗣、恤孤茕、修宫室	嫁娶、上表章、修置产室、破土、安葬、启攒、选将、出师、上册、乘船渡水、取鱼、安抚边境
1961-07-18	一九六一 辛丑[牛]年	六月小	初六	周二	辛丑 乙未 壬子 乙巳	牛	巨蟹座	无	大暑 (7, 23)	无	无	无	沐浴、剃头、捕捉、雪冤、覃恩、整容、恤孤茕	出行、结婚姻、宴会、嫁娶、安床、修造、求医疗病、上表章、上官、冠带、进人口、竖柱上梁、经络、开市、纳财、修置产室、开渠、穿井、安碓硙、栽种、牧养、破土、安葬、启攒、立券交易、乘船渡水、裁制、缮城郭、远回、招贤、布政事、选将、举正直、塞穴、纳畜、取鱼、上册、颁诏、修饰垣墙、出师、祈福、安抚边境、酝酿、庆赐、开仓、鼓铸、补垣、解除、纳采、整手足甲、施恩、修仓库、临政、搬移、营建、修宫室、宣政事、筑堤防、求嗣
1961-07-19	一九六一 辛丑[牛]年	六月小	初七	周三	辛丑 乙未 癸丑 丁巳	牛	巨蟹座	无	大暑 (7, 23)	无	无	无	诸事不宜	诸事不宜
1961-07-20	一九六一 辛丑[牛]年	六月小	初八	周四	辛丑 乙未 甲寅 己巳	牛	巨蟹座	无	大暑 (7, 23)	无	无	无	出行、宴会、安床、上表章、上官、竖柱上梁、经络、开市、纳财、栽种、牧养、安葬、立券交易、雪冤、裁制、覃恩、缮城郭、招贤、举正直、纳畜、上册、颁诏、酝酿、庆赐、施恩、临政、搬移、营建、恤孤茕、宣政事	祭祀、畋猎、取鱼
1961-07-21	一九六一 辛丑[牛]年	六月小	初九	周五	辛丑 乙未 乙卯 辛巳	牛	巨蟹座	无	大暑 (7, 23)	无	无	无	出行、结婚姻、宴会、上表章、上官、入学、进人口、竖柱上梁、经络、牧养、裁制、举正直、上册、酝酿、庆赐、纳采、施恩、临政	修置产室、开渠、穿井、平治道涂、破屋坏垣、选将、补垣、修饰垣墙、出师、苫盖、开仓、营建
1961-07-22	一九六一 辛丑[牛]年	六月小	初十	周六	辛丑 乙未 丙辰 癸巳	牛	巨蟹座	无	大暑 (7, 23)	无	无	无	祭祀、进人口、纳财、捕捉、牧养、纳畜、入宅	上表章、冠带、修置产室、开渠、穿井、安碓硙、平治道涂、破屋坏垣、破土、启攒、招贤、布政事、选将、上册、颁诏、修饰垣墙、出师、鼓铸、补垣、修仓库、筑堤防、营建、宣政事、安抚边境
1961-07-23	一九六一 辛丑[牛]年	六月小	十一	周日	辛丑 乙未 丁巳 乙巳	牛	狮子座	大暑	立秋 (8, 8)	无	无	无	入学、雪冤、覃恩、恤孤茕	祭祀、出行、结婚姻、宴会、嫁娶、安床、剃头、修造、求医疗病、上表章、上官、冠带、进人口、竖柱上梁、经络、开市、纳财、修置产室、开渠、穿井、安碓硙、平治道涂、破屋坏垣、伐木、畋猎、栽种、牧养、破土、安葬、启攒、立券交易、裁制、缮城郭、远回、招贤、布政事、举正直、选将、塞穴、纳畜、取鱼、上册、颁诏、修饰垣墙、出师、祈福、安抚边境、酝酿、庆赐、整容、鼓铸、开仓、补垣、解除、修宫室、施恩、纳采、整手足甲、修仓库、临政、搬移、营建、筑堤防、宣政事、求嗣
1961-07-24	一九六一 辛丑[牛]年	六月小	十二	周一	辛丑 乙未 戊午 丁巳	牛	狮子座	无	立秋 (8, 8)	无	无	无	祭祀、经络、雪冤、赴任、裁制、诉讼、覃恩、塞穴、酝酿、恤孤茕	出行、结婚姻、宴会、嫁娶、安床、剃头、修造、求医疗病、上表章、上官、冠带、进人口、竖柱上梁、开市、纳财、修置产室、开渠、穿井、安碓硙、平治道涂、破屋坏垣、捕捉、畋猎、栽种、牧养、破土、安葬、立券交易、疗目、针刺、缮城郭、苫盖、招贤、布政事、举正直、选将、纳畜、取鱼、上册、颁诏、出师、祈福、修饰垣墙、安抚边境、庆赐、开仓、整容、补垣、解除、施恩、纳采、修仓库、临政、搬移、营建、求嗣、宣政事、筑堤防、修宫室
1961-07-25	一九六一 辛丑[牛]年	六月小	十三	周二	辛丑 乙未 己未 己巳	牛	狮子座	无	立秋 (8, 8)	无	无	无	宴会、上官、进人口、经络、纳财、牧养、立券交易、雪冤、裁制、覃恩、招贤、举正直、纳畜、颁诏、酝酿、庆赐、施恩、临政、恤孤茕、宣政事	剃头、修置产室、开渠、穿井、平治道涂、破屋坏垣、伐木、畋猎、破土、启攒、补垣、修饰垣墙、整容、整手足甲、取鱼、筑堤防
1961-07-26	一九六一 辛丑[牛]年	六月小	十四	周三	辛丑 乙未 庚申 辛巳	牛	狮子座	无	立秋 (8, 8)	无	无	无	祭祀、沐浴、扫舍宇	结婚姻、宴会、嫁娶、安床、修造、冠带、进人口、竖柱上梁、经络、开市、纳财、修置产室、开渠、穿井、安碓硙、平治道涂、破屋坏垣、栽种、牧养、启攒、立券交易、裁制、乘船渡水、缮城郭、招贤、布政事、塞穴、纳畜、上册、颁诏、修饰垣墙、酝酿、庆赐、开仓、鼓铸、补垣、修宫室、纳采、修仓库、搬移、营建、筑堤防、宣政事
1961-07-27	一九六一 辛丑[牛]年	六月小	十五	周四	辛丑 乙未 辛酉 癸巳	牛	狮子座	无	立秋 (8, 8)	无	无	无	出行、结婚姻、嫁娶、沐浴、剃头、修造、求医疗病、上表章、上官、进人口、竖柱上梁、经络、开市、纳财、扫舍宇、栽种、牧养、安葬、立券交易、赴任、裁制、缮城郭、选将、塞穴、纳畜、上册、入宅、出师、祈福、开仓、整容、补垣、解除、修宫室、纳采、整手足甲、修仓库、临政、搬移、求嗣、安抚边境	祭祀、宴会、冠带、修置产室、开渠、穿井、安碓硙、平治道涂、破屋坏垣、启攒、针刺、招贤、布政事、颁诏、修饰垣墙、鼓铸、筑堤防、营建、宣政事
1961-07-28	一九六一 辛丑[牛]年	六月小	十六	周五	辛丑 乙未 壬戌 乙巳	牛	狮子座	无	立秋 (8, 8)	无	无	无	诸事不宜	诸事不宜
1961-07-29	一九六一 辛丑[牛]年	六月小	十七	周六	辛丑 乙未 癸亥 丁巳	牛	狮子座	无	立秋 (8, 8)	无	无	无	沐浴、雪冤、恤孤茕	出行、嫁娶、安床、求医疗病、上表章、上官、开市、修置产室、开渠、穿井、平治道涂、破屋坏垣、栽种、牧养、破土、安葬、启攒、乘船渡水、招贤、布政事、选将、举正直、塞穴、取鱼、上册、颁诏、修饰垣墙、出师、祈福、安抚边境、开仓、鼓铸、补垣、解除、施恩、搬移、营建、筑堤防、宣政事、求嗣
1961-07-30	一九六一 辛丑[牛]年	六月小	十八	周日	辛丑 乙未 甲子 己巳	牛	狮子座	无	立秋 (8, 8)	无	无	无	祭祀、出行、结婚姻、宴会、嫁娶、沐浴、剃头、修造、求医疗病、上表章、上官、竖柱上梁、捕捉、栽种、牧养、安葬、雪冤、裁制、覃恩、缮城郭、招贤、举正直、选将、纳畜、上册、颁诏、出师、祈福、庆赐、整容、解除、施恩、纳采、整手足甲、修仓库、临政、搬移、营建、恤孤茕、宣政事、求嗣、安抚边境	诸事不忌
1961-07-31	一九六一 辛丑[牛]年	六月小	十九	周一	辛丑 乙未 乙丑 辛巳	牛	狮子座	无	立秋 (8, 8)	无	观世音菩萨成道日	无	诸事不宜	诸事不宜
