1965-12-01	一九六五 乙巳[蛇]年 冬月大初九	周三	无	无	世界艾滋病日	乙巳 丁亥 己丑 己巳	无	大雪 (12, 7)	蛇	射手座	覃恩、恤孤茕、雪冤	祭祀、剃头、冠带、修置产室、开渠、穿井、安碓硙、平治道涂、破屋坏垣、伐木、畋猎、破土、启攒、补垣、鼓铸、布政事、整容、筑堤防、取鱼、修饰垣墙、远回、整手足甲
1965-12-02	一九六五 乙巳[蛇]年 冬月大初十	周四	无	无	无	乙巳 丁亥 庚寅 辛巳	无	大雪 (12, 7)	蛇	射手座	出行、结婚姻、宴会、嫁娶、修造、求医疗病、上表章、上官、进人口、竖柱上梁、经络、开市、纳财、平治道涂、栽种、牧养、安葬、庆赐、临政、搬移、裁制、开仓、纳采、修仓库、赴任、颁诏、恤孤茕、入宅、出师、解除、纳畜、招贤、选将、覃恩、举正直、酝酿、求嗣、雪冤、营建、缮城郭、修饰垣墙、施恩、宣政事、安抚边境、上册、修宫室、立券交易、祈福、诉讼	祭祀、冠带、修置产室、开渠、穿井、畋猎、启攒、筑堤防、布政事、取鱼、鼓铸
1965-12-03	一九六五 乙巳[蛇]年 冬月大十一	周五	无	太乙救苦天尊诞	无	乙巳 丁亥 辛卯 癸巳	无	大雪 (12, 7)	蛇	射手座	结婚姻、宴会、嫁娶、修造、冠带、进人口、竖柱上梁、经络、安碓硙、牧养、庆赐、搬移、裁制、纳采、恤孤茕、纳畜、雪冤、缮城郭、修宫室	求医疗病、上表章、修置产室、穿井、安葬、上册、苫盖、解除、开仓
1965-12-04	一九六五 乙巳[蛇]年 冬月大十二	周六	无	无	无	乙巳 丁亥 壬辰 乙巳	无	大雪 (12, 7)	蛇	射手座	沐浴、上表章、捕捉、畋猎、裁制、整手足甲	出行、结婚姻、安床、修造、上官、冠带、进人口、竖柱上梁、开市、修置产室、开渠、穿井、安碓硙、平治道涂、破屋坏垣、栽种、牧养、破土、启攒、补垣、临政、搬移、开仓、纳采、修仓库、纳畜、筑堤防、营建、缮城郭、修饰垣墙、修宫室、立券交易
1965-12-05	一九六五 乙巳[蛇]年 冬月大十三	周日	无	无	无	乙巳 丁亥 癸巳 丁巳	无	大雪 (12, 7)	蛇	射手座	求医疗病、破屋坏垣	出行、结婚姻、宴会、安床、剃头、修造、上表章、上官、冠带、竖柱上梁、经络、开市、修置产室、开渠、穿井、安碓硙、伐木、栽种、牧养、破土、安葬、启攒、庆赐、补垣、临政、裁制、开仓、纳采、立券交易、修仓库、鼓铸、颁诏、招贤、布政事、整容、筑堤防、举正直、酝酿、求嗣、营建、缮城郭、施恩、修饰垣墙、宣政事、上册、塞穴、整手足甲、修宫室、祈福
1965-12-06	一九六五 乙巳[蛇]年 冬月大十四	周一	无	无	无	乙巳 丁亥 甲午 己巳	无	大雪 (12, 7)	蛇	射手座	祭祀、出行、结婚姻、宴会、嫁娶、安床、修造、求医疗病、上表章、上官、竖柱上梁、纳财、伐木、栽种、牧养、安葬、庆赐、临政、搬移、裁制、开仓、纳采、修仓库、颁诏、恤孤茕、解除、出师、纳畜、招贤、选将、覃恩、举正直、求嗣、雪冤、营建、缮城郭、安抚边境、施恩、宣政事、上册、修宫室、祈福	冠带、修置产室、畋猎、筑堤防、取鱼、苫盖、乘船渡水
1965-12-07	一九六五 乙巳[蛇]年 冬月大十五	周二	无	无	无	乙巳 戊子 乙未 辛巳	大雪	冬至 (12, 22)	蛇	射手座	祭祀、伐木、畋猎、赴任、入宅	剃头、上表章、冠带、修置产室、开渠、穿井、安碓硙、破屋坏垣、安葬、启攒、补垣、修仓库、鼓铸、颁诏、纳畜、出师、招贤、整容、布政事、筑堤防、营建、修饰垣墙、宣政事、上册、塞穴、整手足甲
1965-12-08	一九六五 乙巳[蛇]年 冬月大十六	周三	无	无	无	乙巳 戊子 丙申 癸巳	无	冬至 (12, 22)	蛇	射手座	出行、沐浴、剃头、上表章、上官、入学、竖柱上梁、经络、扫舍宇、牧养、安葬、临政、裁制、解除、整容、举正直、酝酿、施恩、整手足甲	安床、修置产室、开渠、穿井、平治道涂、破屋坏垣、补垣、开仓、鼓铸、乘船渡水、出师、选将、营建、取鱼、修饰垣墙、塞穴
1965-12-09	一九六五 乙巳[蛇]年 冬月大十七	周四	无	阿弥陀佛诞	无	乙巳 戊子 丁酉 乙巳	无	冬至 (12, 22)	蛇	射手座	沐浴、扫舍宇、捕捉、恤孤茕、覃恩、雪冤、整手足甲	宴会、剃头、冠带、修置产室、开渠、穿井、畋猎、启攒、开仓、筑堤防、布政事、取鱼、鼓铸、修宫室、乘船渡水
1965-12-10	一九六五 乙巳[蛇]年 冬月大十八	周五	无	无	无	乙巳 戊子 戊戌 丁巳	无	冬至 (12, 22)	蛇	射手座	宴会、修造、入学、开市、修置产室、开渠、穿井、安碓硙、栽种、牧养、庆赐、裁制、解除、恤孤茕、覃恩、举正直、求嗣、雪冤、缮城郭、施恩、修宫室、祈福	结婚姻、嫁娶、进人口、伐木、捕捉、畋猎、开仓、出师、选将、取鱼、安抚边境
1965-12-11	一九六五 乙巳[蛇]年 冬月大十九	周六	无	太阳日宫诞	无	乙巳 戊子 己亥 己巳	无	冬至 (12, 22)	蛇	射手座	沐浴、补垣、裁制、恤孤茕、筑堤防、选将、覃恩、雪冤、安抚边境、塞穴	出行、结婚姻、宴会、嫁娶、安床、修造、求医疗病、上表章、上官、进人口、竖柱上梁、开市、修置产室、开渠、穿井、破土、安葬、启攒、庆赐、临政、搬移、开仓、纳采、颁诏、解除、出师、招贤、布政事、举正直、疗目、针刺、求嗣、营建、施恩、宣政事、上册、修宫室、整手足甲、祈福
1965-12-12	一九六五 乙巳[蛇]年 冬月大二十	周日	无	无	西安事变纪念日	乙巳 戊子 庚子 辛巳	无	冬至 (12, 22)	蛇	射手座	沐浴、入宅	出行、结婚姻、宴会、嫁娶、安床、剃头、修造、求医疗病、上表章、上官、冠带、进人口、竖柱上梁、经络、开市、纳财、修置产室、开渠、穿井、安碓硙、平治道涂、破屋坏垣、伐木、栽种、牧养、破土、安葬、启攒、庆赐、补垣、临政、搬移、裁制、开仓、纳采、修仓库、鼓铸、颁诏、解除、纳畜、出师、招贤、整容、布政事、选将、筑堤防、举正直、酝酿、求嗣、营建、缮城郭、施恩、宣政事、安抚边境、修饰垣墙、上册、远回、塞穴、整手足甲、修宫室、立券交易、祈福
1965-12-13	一九六五 乙巳[蛇]年 冬月大廿一	周一	无	无	南京大屠杀纪念日	乙巳 戊子 辛丑 癸巳	无	冬至 (12, 22)	蛇	射手座	祭祀、出行、结婚姻、宴会、沐浴、剃头、上官、进人口、经络、纳财、扫舍宇、安葬、临政、解除、恤孤茕、出师、整容、选将、举正直、雪冤、施恩、安抚边境、立券交易、祈福	修造、冠带、立券、开张
1965-12-14	一九六五 乙巳[蛇]年 冬月大廿二	周二	无	无	无	乙巳 戊子 壬寅 乙巳	无	冬至 (12, 22)	蛇	射手座	宴会、修造、上表章、进人口、竖柱上梁、经络、开市、纳财、栽种、牧养、庆赐、补垣、裁制、立券交易、颁诏、恤孤茕、解除、出师、纳畜、选将、覃恩、求嗣、雪冤、营建、缮城郭、安抚边境、宣政事、塞穴、上册、修宫室、祈福	祭祀、开渠、穿井、畋猎、取鱼、远回
1965-12-15	一九六五 乙巳[蛇]年 冬月大廿三	周三	无	张仙诞	无	乙巳 戊子 癸卯 丁巳	无	冬至 (12, 22)	蛇	射手座	诸事不宜	诸事不宜
1965-12-16	一九六五 乙巳[蛇]年 冬月大廿四	周四	无	无	无	乙巳 戊子 甲辰 己巳	无	冬至 (12, 22)	蛇	射手座	祭祀、出行、结婚姻、宴会、嫁娶、上官、冠带、进人口、竖柱上梁、经络、安碓硙、牧养、安葬、庆赐、临政、搬移、裁制、纳采、赴任、纳畜、举正直、酝酿、求嗣、缮城郭、施恩、修宫室、祈福、诉讼	修置产室
1965-12-17	一九六五 乙巳[蛇]年 冬月大廿五	周五	无	无	无	乙巳 戊子 乙巳 辛巳	无	冬至 (12, 22)	蛇	射手座	祭祀、捕捉、赴任、入宅、恤孤茕、覃恩、雪冤	出行、剃头、冠带、修置产室、开渠、穿井、安碓硙、破屋坏垣、畋猎、破土、启攒、补垣、鼓铸、布政事、整容、筑堤防、取鱼、修饰垣墙、塞穴、整手足甲
1965-12-18	一九六五 乙巳[蛇]年 冬月大廿六	周六	无	北方五道诞	无	乙巳 戊子 丙午 癸巳	无	冬至 (12, 22)	蛇	射手座	诸事不宜	诸事不宜
1965-12-19	一九六五 乙巳[蛇]年 冬月大廿七	周日	无	无	无	乙巳 戊子 丁未 乙巳	无	冬至 (12, 22)	蛇	射手座	祭祀、伐木、恤孤茕、覃恩、雪冤	剃头、冠带、修置产室、开渠、穿井、安碓硙、破屋坏垣、畋猎、启攒、补垣、开仓、鼓铸、整容、布政事、筑堤防、取鱼、修饰垣墙、塞穴、整手足甲、修宫室
1965-12-20	一九六五 乙巳[蛇]年 冬月大廿八	周一	无	无	无	乙巳 戊子 戊申 丁巳	无	冬至 (12, 22)	蛇	射手座	出行、沐浴、剃头、求医疗病、上官、入学、竖柱上梁、经络、扫舍宇、牧养、临政、裁制、解除、整容、举正直、酝酿、施恩、整手足甲	安床、修置产室、开渠、穿井、平治道涂、破屋坏垣、补垣、开仓、鼓铸、乘船渡水、出师、选将、营建、取鱼、修饰垣墙、塞穴
1965-12-21	一九六五 乙巳[蛇]年 冬月大廿九	周二	无	无	无	乙巳 戊子 己酉 己巳	无	冬至 (12, 22)	蛇	射手座	沐浴、剃头、扫舍宇、捕捉、畋猎、恤孤茕、整容、覃恩、雪冤、整手足甲	祭祀、出行、结婚姻、宴会、嫁娶、安床、修造、求医疗病、上表章、上官、冠带、进人口、竖柱上梁、经络、开市、纳财、修置产室、开渠、穿井、栽种、牧养、破土、安葬、启攒、庆赐、临政、搬移、裁制、开仓、纳采、修仓库、鼓铸、颁诏、解除、纳畜、出师、乘船渡水、招贤、布政事、选将、筑堤防、举正直、酝酿、求嗣、营建、缮城郭、施恩、安抚边境、宣政事、取鱼、上册、修宫室、立券交易、祈福
1965-12-22	一九六五 乙巳[蛇]年 冬月大三十	周三	无	无	无	乙巳 戊子 庚戌 辛巳	冬至	小寒 (1, 6)	蛇	射手座	宴会、修造、入学、开市、修置产室、开渠、穿井、安碓硙、栽种、牧养、庆赐、裁制、纳采、解除、恤孤茕、入宅、布政事、覃恩、举正直、求嗣、雪冤、缮城郭、施恩、修宫室、祈福	进人口、经络、伐木、捕捉、畋猎、开仓、出师、选将、取鱼、安抚边境
1965-12-23	一九六五 乙巳[蛇]年 腊月小初一	周四	无	无	无	乙巳 戊子 辛亥 癸巳	无	小寒 (1, 6)	蛇	摩羯座	沐浴、补垣、裁制、恤孤茕、筑堤防、选将、覃恩、雪冤、安抚边境、塞穴	出行、结婚姻、宴会、嫁娶、安床、修造、求医疗病、上表章、上官、进人口、竖柱上梁、开市、修置产室、开渠、穿井、破土、安葬、启攒、庆赐、临政、搬移、开仓、纳采、颁诏、解除、出师、招贤、布政事、举正直、酝酿、疗目、针刺、求嗣、营建、施恩、宣政事、上册、修宫室、整手足甲、祈福
1965-12-24	一九六五 乙巳[蛇]年 腊月小初二	周五	无	无	平安夜	乙巳 戊子 壬子 乙巳	无	小寒 (1, 6)	蛇	摩羯座	祭祀、沐浴、覃恩、恤孤茕、雪冤	出行、结婚姻、宴会、嫁娶、安床、剃头、修造、求医疗病、上表章、上官、冠带、进人口、竖柱上梁、经络、开市、纳财、修置产室、开渠、穿井、安碓硙、平治道涂、破屋坏垣、伐木、畋猎、栽种、牧养、破土、安葬、启攒、庆赐、补垣、临政、搬移、裁制、开仓、纳采、修仓库、鼓铸、颁诏、解除、纳畜、出师、招贤、整容、布政事、选将、筑堤防、举正直、酝酿、求嗣、营建、缮城郭、取鱼、施恩、宣政事、安抚边境、修饰垣墙、上册、远回、塞穴、整手足甲、修宫室、立券交易、祈福
1965-12-25	一九六五 乙巳[蛇]年 腊月小初三	周六	无	无	圣诞节	乙巳 戊子 癸丑 丁巳	无	小寒 (1, 6)	蛇	摩羯座	祭祀、出行、宴会、沐浴、剃头、上官、进人口、经络、纳财、扫舍宇、庆赐、临政、裁制、解除、恤孤茕、整容、布政事、覃恩、酝酿、举正直、雪冤、施恩、整手足甲、立券交易、祈福	修造、冠带、破土、启攒、纳采
1965-12-26	一九六五 乙巳[蛇]年 腊月小初四	周日	无	无	毛泽东诞辰纪念日	乙巳 戊子 甲寅 己巳	无	小寒 (1, 6)	蛇	摩羯座	宴会、上表章、进人口、竖柱上梁、经络、开市、纳财、栽种、牧养、庆赐、补垣、裁制、立券交易、解除、求嗣、缮城郭、塞穴、上册、修宫室、祈福	祭祀、嫁娶、招贤、取鱼、远回、乘船渡水
1965-12-27	一九六五 乙巳[蛇]年 腊月小初五	周一	无	无	无	乙巳 戊子 乙卯 辛巳	无	小寒 (1, 6)	蛇	摩羯座	祭祀、平治道涂、赴任、入宅	出行、结婚姻、宴会、嫁娶、安床、剃头、修造、求医疗病、上表章、上官、冠带、进人口、竖柱上梁、经络、开市、纳财、修置产室、开渠、穿井、安碓硙、破屋坏垣、畋猎、栽种、牧养、破土、安葬、启攒、庆赐、补垣、临政、搬移、裁制、开仓、纳采、修仓库、鼓铸、颁诏、解除、纳畜、出师、乘船渡水、招贤、布政事、选将、筑堤防、整容、举正直、酝酿、求嗣、营建、缮城郭、施恩、安抚边境、宣政事、修饰垣墙、上册、塞穴、修宫室、整手足甲、立券交易、祈福
1965-12-28	一九六五 乙巳[蛇]年 腊月小初六	周二	无	无	无	乙巳 戊子 丙辰 癸巳	无	小寒 (1, 6)	蛇	摩羯座	祭祀、结婚姻、宴会、嫁娶、修造、上官、冠带、进人口、竖柱上梁、经络、安碓硙、安葬、庆赐、临政、裁制、纳采、赴任、纳畜、酝酿、缮城郭、修宫室、祈福、诉讼	求医疗病、开市、修置产室、栽种、开仓、整手足甲、解除
1965-12-29	一九六五 乙巳[蛇]年 腊月小初七	周三	无	无	无	乙巳 戊子 丁巳 乙巳	无	小寒 (1, 6)	蛇	摩羯座	祭祀、捕捉、恤孤茕、覃恩、雪冤	出行、剃头、冠带、修置产室、开渠、穿井、安碓硙、破屋坏垣、畋猎、破土、启攒、补垣、鼓铸、整容、布政事、筑堤防、取鱼、修饰垣墙、塞穴、整手足甲、修宫室
1965-12-30	一九六五 乙巳[蛇]年 腊月小初八	周四	无	腊八节-释迦如来成佛之辰	无	乙巳 戊子 戊午 丁巳	无	小寒 (1, 6)	蛇	摩羯座	诸事不宜	诸事不宜
1965-12-31	一九六五 乙巳[蛇]年 腊月小初九	周五	无	无	无	乙巳 戊子 己未 己巳	无	小寒 (1, 6)	蛇	摩羯座	伐木、畋猎	出行、结婚姻、宴会、嫁娶、安床、剃头、修造、求医疗病、上表章、上官、冠带、进人口、竖柱上梁、经络、开市、纳财、修置产室、开渠、穿井、安碓硙、破屋坏垣、栽种、牧养、破土、安葬、启攒、庆赐、补垣、临政、搬移、裁制、开仓、纳采、修仓库、鼓铸、颁诏、解除、纳畜、出师、招贤、布政事、选将、整容、筑堤防、举正直、酝酿、求嗣、营建、缮城郭、施恩、安抚边境、宣政事、修饰垣墙、上册、塞穴、整手足甲、修宫室、立券交易、祈福
