1966-10-01	1966-8-17	29	成	六	丙午 丁酉 癸巳	无	寒露 (10, 9)	国庆节	无	无	开市 交易 立券 纳财 挂匾 栽种 祭祀 祈福 开光 拆卸 动土 安床	嫁娶 破土 进人口 出行 入宅 移徙 出火 纳畜 词讼 安葬
1966-10-02	1966-8-18	29	收	日	丙午 丁酉 甲午	无	寒露 (10, 9)	无	无	无	嫁娶 祭祀 理发 进人口 作灶 移柩 冠笄 会亲友	开仓 出货财 伐木 纳畜 开市 上梁 盖屋 破土 启钻 栽种
1966-10-03	1966-8-19	29	开	一	丙午 丁酉 乙未	无	寒露 (10, 9)	世界住房日	无	无	祭祀 修坟 除服 成服 启钻 移柩 馀事勿取	开市 入宅 嫁娶 动土 破土 安葬
1966-10-04	1966-8-20	29	闭	二	丙午 丁酉 丙申	无	寒露 (10, 9)	无	无	无	嫁娶 冠笄 安机械 解除 纳畜 牧养 沐浴 伐木 架马 作梁 安门 扫舍 合寿木 安葬 启钻 立碑 修坟	祈福 开光 开市 入宅 动土
1966-10-05	1966-8-21	29	建	三	丙午 丁酉 丁酉	无	寒露 (10, 9)	无	无	无	祭祀 出行 沐浴 扫舍 安葬 馀事勿取	动土 破土 置产 掘井
1966-10-06	1966-8-22	29	除	四	丙午 丁酉 戊戌	无	寒露 (10, 9)	无	无	无	嫁娶 纳采 祭祀 解除 出行 修造 动土 开市 上梁 安床 整手足甲 扫舍 求医 治病 起基 定磉 盖屋 合脊	造庙 行丧 安葬 伐木 作灶 造船
1966-10-07	1966-8-23	29	满	五	丙午 丁酉 己亥	无	寒露 (10, 9)	无	无	无	纳采 订盟 开市 交易 立券 挂匾 纳财 栽种 进人口 入宅 移徙 安床 开光 出火 拆卸 安门 修造	斋醮 嫁娶 行丧 动土 作灶 安葬 破土
1966-10-08	1966-8-24	29	平	六	丙午 丁酉 庚子	无	寒露 (10, 9)	无	无	无	祭祀 沐浴 修饰垣墙 平治道涂 馀事勿取	嫁娶 入宅 安床 出行
1966-10-09	1966-8-25	29	平	日	丙午 戊戌 辛丑	寒露	霜降 (10, 24)	无	无	无	祭祀 结网 造畜稠 馀事勿取	无
1966-10-10	1966-8-26	29	定	一	丙午 戊戌 壬寅	无	霜降 (10, 24)	无	无	无	入殓 除服 成服 移柩 破土 启钻 安葬	移徙 入宅
1966-10-11	1966-8-27	29	执	二	丙午 戊戌 癸卯	无	霜降 (10, 24)	无	无	无	嫁娶 订盟 纳采 出行 祭祀 祈福 动土 移徙 入宅 破土 安葬	开市 赴任
1966-10-12	1966-8-28	29	破	三	丙午 戊戌 甲辰	无	霜降 (10, 24)	无	无	无	祭祀 解除 破屋 坏垣 馀事勿取	无
1966-10-13	1966-8-29	29	危	四	丙午 戊戌 乙巳	无	霜降 (10, 24)	无	无	无	订盟 纳采 会亲友 安机械 纳财 牧养	祈福 安葬
1966-10-14	1966-9-1	29	成	五	丙午 戊戌 丙午	无	霜降 (10, 24)	无	无	无	嫁娶 订盟 纳采 出行 开市 祭祀 祈福 动土 移徙 入宅 破土 安葬	斋醮 安门
1966-10-15	1966-9-2	29	收	六	丙午 戊戌 丁未	无	霜降 (10, 24)	无	无	无	祭祀 塞穴 馀事勿取	诸事不宜
1966-10-16	1966-9-3	29	开	日	丙午 戊戌 戊申	无	霜降 (10, 24)	无	无	无	祭祀 祈福 求嗣 开光 开市 出行 解除 动土 起基 置产 栽种	嫁娶 作灶 修坟 安门 入宅 立碑 安葬 安床
1966-10-17	1966-9-4	29	闭	一	丙午 戊戌 己酉	无	霜降 (10, 24)	无	无	无	祭祀 解除 裁衣 理发 安床 作灶 造畜稠 放水 筑堤 补垣 塞穴 整手足甲 扫舍	嫁娶 开光 会亲友 掘井 安门 栽种
1966-10-18	1966-9-5	29	建	二	丙午 戊戌 庚戌	无	霜降 (10, 24)	无	无	无	祭祀 出行 裁衣 冠笄 会亲友 造畜稠 嫁娶 竖柱 上梁 移徙 纳财 纳畜	动土 伐木 作梁 行丧 安葬 开生坟
1966-10-19	1966-9-6	29	除	三	丙午 戊戌 辛亥	无	霜降 (10, 24)	无	无	无	祭祀 祈福 求嗣 开光 出行 解除 移徙 伐木 安床 纳畜 出火 拆卸	安葬 修坟 作灶 破土 造庙 动土 嫁娶 纳采
1966-10-20	1966-9-7	29	满	四	丙午 戊戌 壬子	无	霜降 (10, 24)	无	无	无	开市 交易 立券 纳财 会亲友 开光 理发 入殓 移柩 安葬 启钻	嫁娶 作灶 出火 出行 入宅 移徙 安床 祈福 上梁
1966-10-21	1966-9-8	29	平	五	丙午 戊戌 癸丑	无	霜降 (10, 24)	无	无	无	造畜稠 平治道涂 馀事勿取	诸事不宜
1966-10-22	1966-9-9	29	定	六	丙午 戊戌 甲寅	无	霜降 (10, 24)	无	无	无	入殓 破土 安葬 启钻 除服 成服 馀事勿取	无
1966-10-23	1966-9-10	29	执	日	丙午 戊戌 乙卯	无	霜降 (10, 24)	无	无	无	祭祀 入殓 移柩 开生坟 破土 启钻 安葬 除服 成服 馀事勿取	无
1966-10-24	1966-9-11	29	破	一	丙午 戊戌 丙辰	霜降	立冬 (11, 8)	无	无	无	祭祀 解除 破屋 坏垣 馀事勿取	诸事不宜
1966-10-25	1966-9-12	29	危	二	丙午 戊戌 丁巳	无	立冬 (11, 8)	无	无	无	嫁娶 求嗣 纳采 进人口 纳财 结网 纳畜 牧养 会亲友	上梁 作灶 伐木 出行 安葬 安门 理发
1966-10-26	1966-9-13	29	成	三	丙午 戊戌 戊午	无	立冬 (11, 8)	无	无	无	嫁娶 祭祀 开市 开光 出行 入宅 移徙 出火 拆卸 修造 安床	纳畜 伐木 置产 作梁 行丧 安葬 修坟 立碑
1966-10-27	1966-9-14	29	收	四	丙午 戊戌 己未	无	立冬 (11, 8)	无	无	无	嫁娶 祭祀 作灶 纳财	安葬 开市 修坟 立碑
1966-10-28	1966-9-15	29	开	五	丙午 戊戌 庚申	无	立冬 (11, 8)	无	无	无	嫁娶 祭祀 祈福 求嗣 开光 出行 解除 出火 进人口 开市 交易 立券 挂匾 纳财 入宅 移徙 栽种 破土 谢土	安床 安葬
1966-10-29	1966-9-16	29	闭	六	丙午 戊戌 辛酉	无	立冬 (11, 8)	无	无	无	嫁娶 祭祀 祈福 求嗣 动土 安床 扫舍 入殓 移柩 破土 启钻 安葬 作灶 整手足甲 补垣 除服 成服	开光 栽种
1966-10-30	1966-9-17	29	建	日	丙午 戊戌 壬戌	无	立冬 (11, 8)	无	无	无	祭祀 祈福 求嗣 开光 出行 解除 上梁 入宅 移徙 安床 安门 纳财 纳畜 造畜稠	伐木 行丧 破土 嫁娶 安葬 开渠
1966-10-31	1966-9-18	29	除	一	丙午 戊戌 癸亥	无	立冬 (11, 8)	万圣节前夜	无	无	祭祀 开光 出行 解除 理发 伐木 出火 拆卸 上梁 合脊 安床 造畜稠	嫁娶 安葬 行丧 词讼 造桥 作灶 破土 动土
