1967-07-01	1967-5-24	30	成	六	丁未 丙午 丙寅	无	小暑 (7, 8)	建党节	无	无	开市 交易 立券 挂匾 开光 解除 拆卸 动土 安床 修造 上梁 置产 栽种 破土 安葬	作灶 出火 祭祀 嫁娶 入宅
1967-07-02	1967-5-25	30	收	日	丁未 丙午 丁卯	无	小暑 (7, 8)	无	无	无	祭祀 结网 馀事勿取	入宅 出行 掘井 安葬
1967-07-03	1967-5-26	30	开	一	丁未 丙午 戊辰	无	小暑 (7, 8)	无	无	无	嫁娶 纳采 订盟 冠笄 造车器 祭祀 开光 祈福 求嗣 出行 解除 伐木 出火 入宅 拆卸 修造 动土 上梁 安床 栽种 破土	行丧 置产 安葬
1967-07-04	1967-5-27	30	闭	二	丁未 丙午 己巳	无	小暑 (7, 8)	无	无	无	嫁娶 合帐 裁衣 冠笄 伐木 上梁 出火 拆卸 移徙 修造 动土 安门 纳财 筑堤 栽种 塞穴	安床 祈福 出行 安葬 行丧 开光
1967-07-05	1967-5-28	30	建	三	丁未 丙午 庚午	无	小暑 (7, 8)	无	无	无	出行 教牛马 割蜜 馀事勿取	斋醮 盖屋 动土 破土
1967-07-06	1967-5-29	30	除	四	丁未 丙午 辛未	无	小暑 (7, 8)	无	无	无	嫁娶 祭祀 祈福 求嗣 开光 出行 解除 出火 拆卸 修造 进人口 入宅 移徙 动土 安床 纳畜 栽种 纳财 交易 立券 挂匾 造畜稠	安葬 开生坟 行丧
1967-07-07	1967-5-30	30	满	五	丁未 丙午 壬申	无	小暑 (7, 8)	无	无	无	安机械 祭祀 祈福 求嗣 沐浴 解除 纳采 开市 修造 竖柱 上梁 开柱眼 安碓磑 归岫 补垣 塞穴 拆卸 放水 出火 扫舍 开生坟 合寿木 安葬 谢土 启钻 除服 成服	嫁娶 安床 作灶 动土 破土 造船
1967-07-08	1967-6-1	29	满	六	丁未 丁未 癸酉	小暑	大暑 (7, 23)	无	无	无	嫁娶 出行 开市 安床 入殓 启钻 安葬	祈福 动土 破土
1967-07-09	1967-6-2	29	平	日	丁未 丁未 甲戌	无	大暑 (7, 23)	无	无	无	嫁娶 祭祀 裁衣 结网 冠笄 沐浴	开仓 出货财 置产 安葬 动土 破土 掘井 栽种
1967-07-10	1967-6-3	29	定	一	丁未 丁未 乙亥	无	大暑 (7, 23)	无	无	无	入宅 移徙 安床 开光 祈福 求嗣 进人口 开市 交易 立券 出火 拆卸 修造 动土	嫁娶 破土 置产 栽种 安葬 修坟 行丧
1967-07-11	1967-6-4	29	执	二	丁未 丁未 丙子	无	大暑 (7, 23)	无	无	无	祭祀 解除 沐浴 整手足甲 入殓 移柩 破土 启钻 安葬	嫁娶 入宅 移徙 作灶 开市 交易 安门 栽种
1967-07-12	1967-6-5	29	破	三	丁未 丁未 丁丑	无	大暑 (7, 23)	无	无	无	破屋 坏垣 馀事勿取	诸事不宜
1967-07-13	1967-6-6	29	危	四	丁未 丁未 戊寅	无	大暑 (7, 23)	无	无	无	嫁娶 开光 出行 理发 作梁 出火 拆卸 修造 开市 交易 立券 挂匾 动土 入宅 移徙 安床 栽种	伐木 祭祀 纳畜
1967-07-14	1967-6-7	29	成	五	丁未 丁未 己卯	无	大暑 (7, 23)	无	无	无	嫁娶 开光 出行 祈福 求嗣 解除 拆卸 动土 修造 进人口 开市 交易 立券 挂匾 入宅 移徙 安床 栽种 纳畜 入殓 移柩 安葬	无
1967-07-15	1967-6-8	29	收	六	丁未 丁未 庚辰	无	大暑 (7, 23)	无	无	无	祭祀 作灶 纳财 栽种 纳畜 进人口	安葬 经络 修坟 破土 开市 安床 启钻 立碑
1967-07-16	1967-6-9	29	开	日	丁未 丁未 辛巳	无	大暑 (7, 23)	无	无	无	祭祀 祈福 求嗣 开光 开市 牧养 理发	嫁娶 出行 安葬 入殓 入宅 作灶 冠笄 上梁
1967-07-17	1967-6-10	29	闭	一	丁未 丁未 壬午	无	大暑 (7, 23)	无	无	无	祭祀 入殓 破土 除服 成服 移柩 启钻 安葬 谢土 馀事勿取	无
1967-07-18	1967-6-11	29	建	二	丁未 丁未 癸未	无	大暑 (7, 23)	无	无	无	祭祀 出行 交易 割蜜 造畜稠	嫁娶 作灶 安葬 动土 词讼 作梁 伐木 掘井 破土 移徙
1967-07-19	1967-6-12	29	除	三	丁未 丁未 甲申	无	大暑 (7, 23)	无	无	无	嫁娶 祭祀 祈福 求嗣 开光 出火 拆卸 修造 动土 进人口 开市 交易 立券 挂匾 入宅 移徙 栽种 纳畜 入殓 启钻 除服 成服	无
1967-07-20	1967-6-13	29	满	四	丁未 丁未 乙酉	无	大暑 (7, 23)	无	无	无	嫁娶 开光 解除 安床 牧养 理发 开市 入殓 启钻 移柩 安葬 扫舍	作灶 动土 上梁 栽种 入宅 移徙 修造 祈福
1967-07-21	1967-6-14	29	平	五	丁未 丁未 丙戌	无	大暑 (7, 23)	无	无	无	祭祀 解除 馀事勿取	诸事不宜
1967-07-22	1967-6-15	29	定	六	丁未 丁未 丁亥	无	大暑 (7, 23)	无	无	无	祭祀 祈福 求嗣 开光 伐木 出火 拆卸 入宅 安床 修造 动土 上梁 挂匾 纳畜	嫁娶 栽种 行丧 理发 修坟 作灶
1967-07-23	1967-6-16	29	执	日	丁未 丁未 戊子	大暑	立秋 (8, 8)	无	无	无	解除 祭祀 理发 入殓 安葬 破土	嫁娶 开市 出火 作灶 置产 斋醮 入宅 移徙 安门
1967-07-24	1967-6-17	29	破	一	丁未 丁未 己丑	无	立秋 (8, 8)	无	无	无	破屋 坏垣 馀事勿取	诸事不宜
1967-07-25	1967-6-18	29	危	二	丁未 丁未 庚寅	无	立秋 (8, 8)	无	无	无	开市 交易 立券 纳财 动土 开光 出行 嫁娶 纳采 订盟 入学 开仓 出货财 纳畜 牧养 栽种 破土 启钻 安葬 立碑	入宅 移徙 作灶 祭祀 谢土
1967-07-26	1967-6-19	29	成	三	丁未 丁未 辛卯	无	立秋 (8, 8)	无	无	无	嫁娶 纳采 订盟 祭祀 祈福 求嗣 开光 出火 出行 拆卸 修造 动土 进人口 开市 交易 立券 挂匾 入宅 移徙 安床 栽种 入殓 破土 谢土 安葬	掘井 伐木 纳畜 合寿木
1967-07-27	1967-6-20	29	收	四	丁未 丁未 壬辰	无	立秋 (8, 8)	无	无	无	祭祀 冠笄 作灶 交易 纳财 栽种 结网 纳畜 牧养 进人口	开渠 造船 安床 安葬 破土 出行 修坟 掘井 开市 开生坟
1967-07-28	1967-6-21	29	开	五	丁未 丁未 癸巳	无	立秋 (8, 8)	无	无	无	嫁娶 订盟 祭祀 祈福 求嗣 纳采 裁衣 冠笄 开光 安床 作梁 修造 动土 作灶 起基 上梁 盖屋 纳畜 牧养	移徙 栽种 出行 行丧 破土 安葬 词讼
1967-07-29	1967-6-22	29	闭	六	丁未 丁未 甲午	无	立秋 (8, 8)	无	无	无	经络 祭祀 沐浴 补垣 塞穴 除服 成服 移柩 入殓 启钻 立碑	开光 治病 嫁娶 掘井 破土 安葬
1967-07-30	1967-6-23	29	建	日	丁未 丁未 乙未	无	立秋 (8, 8)	无	无	无	嫁娶 祭祀 出行 裁衣 冠笄 交易 雕刻 纳财 造畜稠 造车器 教牛马	移徙 入宅 栽种 动土 破土 作灶 安葬 行丧 伐木 上梁
1967-07-31	1967-6-24	29	除	一	丁未 丁未 丙申	无	立秋 (8, 8)	无	无	无	修造 动土 安机械 祭祀 沐浴 解除 拆卸 治病 作灶 盖屋 起基 开池 扫舍 造畜稠 开生坟 合寿木 安葬 破土 启钻 移柩 入殓 立碑	开市 入宅 出行 安床
