1968-10-01	1968-8-10	30	危	二	戊申 辛酉 甲辰	无	寒露 (10, 8)	国庆节	无	无	上梁 修造 入宅 出火 出行 动土 合脊 嫁娶 安床 开光 成服 拆卸 掘井 放水 求嗣 破土 祈福 祭祀 移徙 移柩 纳采 订盟 谢土 进人口 除服	安葬 安门 开仓 开市
1968-10-02	1968-8-11	30	成	三	戊申 辛酉 乙巳	无	寒露 (10, 8)	无	无	无	交易 入宅 出火 嫁娶 安床 开光 开市 挂匾 求嗣 祈福 祭祀 移徙 立券 纳采 解除 订盟 进人口	伐木 出行 安葬 栽种 纳畜 行丧 造庙 造桥
1968-10-03	1968-8-12	30	收	四	戊申 辛酉 丙午	无	寒露 (10, 8)	无	无	无	冠笄 捕捉 祭祀 馀事勿取	作梁 合寿木 嫁娶 开市 盖屋
1968-10-04	1968-8-13	30	开	五	戊申 辛酉 丁未	无	寒露 (10, 8)	无	无	无	会亲友 入学 取渔 启钻 成服 畋猎 祭祀 移柩 结网 解除 除服	入殓 动土 安葬 开市 破土 祈福 造船
1968-10-05	1968-8-14	30	闭	六	戊申 辛酉 戊申	无	寒露 (10, 8)	无	无	无	修造 入宅 冠笄 出行 动土 安葬 沐浴 破土 移徙	修坟 嫁娶 开市 斋醮 祈福 祭祀 纳采
1968-10-06	1968-8-15	30	建	日	戊申 辛酉 己酉	无	寒露 (10, 8)	无	无	无	出行 祭祀	会亲友 修造 入宅 动土 嫁娶 破土
1968-10-07	1968-8-16	30	除	一	戊申 辛酉 庚戌	无	寒露 (10, 8)	世界住房日	无	无	修造 入宅 出行 动土 嫁娶 祈福 祭祀 移徙 纳采 订盟	伐木 作梁 安葬 行丧 造庙 针灸
1968-10-08	1968-8-17	30	除	二	戊申 壬戌 辛亥	寒露	霜降 (10, 23)	无	无	无	伐木 出火 出行 安床 开光 拆卸 求嗣 祈福 祭祀 移徙 纳畜 解除	作灶 修坟 动土 嫁娶 安葬 破土 纳采 造庙
1968-10-09	1968-8-18	30	满	三	戊申 壬戌 壬子	无	霜降 (10, 23)	无	无	无	交易 会亲友 入殓 启钻 安葬 开光 开市 理发 移柩 立券 纳财	上梁 作灶 入宅 出火 出行 嫁娶 安床 祈福 移徙
1968-10-10	1968-8-19	30	平	四	戊申 壬戌 癸丑	无	霜降 (10, 23)	无	无	无	平治道涂 造畜稠 馀事勿取	诸事不宜
1968-10-11	1968-8-20	30	定	五	戊申 壬戌 甲寅	无	霜降 (10, 23)	无	无	无	入殓 启钻 安葬 成服 破土 除服 馀事勿取	无
1968-10-12	1968-8-21	30	执	六	戊申 壬戌 乙卯	无	霜降 (10, 23)	无	无	无	入殓 启钻 安葬 开生坟 成服 破土 祭祀 移柩 除服 馀事勿取	无
1968-10-13	1968-8-22	30	破	日	戊申 壬戌 丙辰	无	霜降 (10, 23)	无	无	无	坏垣 破屋 祭祀 解除 馀事勿取	诸事不宜
1968-10-14	1968-8-23	30	危	一	戊申 壬戌 丁巳	无	霜降 (10, 23)	无	无	无	会亲友 嫁娶 求嗣 牧养 纳畜 纳财 纳采 结网 进人口	上梁 伐木 作灶 出行 安葬 安门 理发
1968-10-15	1968-8-24	30	成	二	戊申 壬戌 戊午	无	霜降 (10, 23)	无	无	无	修造 入宅 出火 出行 嫁娶 安床 开光 开市 拆卸 祭祀 移徙	伐木 作梁 修坟 安葬 立碑 纳畜 置产 行丧
1968-10-16	1968-8-25	30	收	三	戊申 壬戌 己未	无	霜降 (10, 23)	无	无	无	作灶 嫁娶 祭祀 纳财	修坟 安葬 开市 立碑
1968-10-17	1968-8-26	30	开	四	戊申 壬戌 庚申	无	霜降 (10, 23)	无	无	无	交易 入宅 出火 出行 嫁娶 开光 开市 挂匾 栽种 求嗣 破土 祈福 祭祀 移徙 立券 纳财 解除 谢土 进人口	安床 安葬
1968-10-18	1968-8-27	30	闭	五	戊申 壬戌 辛酉	无	霜降 (10, 23)	无	无	无	作灶 入殓 动土 启钻 嫁娶 安床 安葬 成服 扫舍 整手足甲 求嗣 破土 祈福 祭祀 移柩 补垣 除服	开光 栽种
1968-10-19	1968-8-28	30	建	六	戊申 壬戌 壬戌	无	霜降 (10, 23)	无	无	无	上梁 入宅 出行 安床 安门 开光 求嗣 祈福 祭祀 移徙 纳畜 纳财 解除 造畜稠	伐木 嫁娶 安葬 开渠 破土 行丧
1968-10-20	1968-8-29	30	除	日	戊申 壬戌 癸亥	无	霜降 (10, 23)	无	无	无	上梁 伐木 出火 出行 合脊 安床 开光 拆卸 理发 祭祀 解除 造畜稠	作灶 动土 嫁娶 安葬 破土 行丧 词讼 造桥
1968-10-21	1968-8-30	30	满	一	戊申 壬戌 甲子	无	霜降 (10, 23)	无	无	无	会亲友 冠笄 启钻 安床 安葬 开生坟 成服 沐浴 理发 移柩 纳采 裁衣 订盟 除服	上梁 修坟 入宅 出行 动土 嫁娶 安门 开市 祈福 谢土
1968-10-22	1968-9-1	29	平	二	戊申 壬戌 乙丑	无	霜降 (10, 23)	无	无	无	修饰垣墙 平治道涂 祭祀 解除 造畜稠 馀事勿取	交易 入学 入宅 嫁娶 安葬 开市
1968-10-23	1968-9-2	29	定	三	戊申 壬戌 丙寅	霜降	立冬 (11, 7)	无	无	无	入殓 启钻 安葬 成服 破土 除服 馀事勿取	入宅 塞穴 开市 祭祀 置产 补垣
1968-10-24	1968-9-3	29	执	四	戊申 壬戌 丁卯	无	立冬 (11, 7)	无	无	无	上梁 修造 入殓 出行 动土 嫁娶 安床 开光 拆卸 求嗣 破土 祈福 祭祀 纳畜	交易 伐木 作灶 入宅 开市 掘井 理发 移徙
1968-10-25	1968-9-4	29	破	五	戊申 壬戌 戊辰	无	立冬 (11, 7)	无	无	无	坏垣 沐浴 破屋 祭祀 馀事勿取	上梁 入宅 出行 嫁娶 安葬
1968-10-26	1968-9-5	29	危	六	戊申 壬戌 己巳	无	立冬 (11, 7)	无	无	无	会亲友 冠笄 割蜜 安床 安门 放水 求嗣 牧养 畋猎 祭祀 纳财 经络 进人口	入宅 嫁娶 安葬 斋醮 祈福 纳采 订盟
1968-10-27	1968-9-6	29	成	日	戊申 壬戌 庚午	无	立冬 (11, 7)	无	无	无	交易 修造 入宅 入殓 出行 动土 启钻 嫁娶 安床 安葬 安门 开光 开市 成服 拆卸 挂匾 栽种 破土 祈福 祭祀 移徙 立券 立碑 纳采 订盟 造车器 除服	伐木 作梁 探病 盖屋 纳畜 起基
1968-10-28	1968-9-7	29	收	一	戊申 壬戌 辛未	无	立冬 (11, 7)	无	无	无	会亲友 冠笄 捕捉 理发 祭祀 移徙 纳财	嫁娶 开厕 开市 开池 破土
1968-10-29	1968-9-8	29	开	二	戊申 壬戌 壬申	无	立冬 (11, 7)	无	无	无	上梁 入学 出行 出货财 动土 嫁娶 开仓 开光 开生坟 扫舍 斋醮 栽种 求医 求嗣 治病 牧养 破土 祈福 祭祀 立碑 竖柱 置产 谢土 起基	入宅 安床 安葬 安门 裁衣
1968-10-30	1968-9-9	29	闭	三	戊申 壬戌 癸酉	无	立冬 (11, 7)	无	无	无	入殓 冠笄 出行 合帐 塞穴 嫁娶 安床 安葬 破土 祭祀 移徙 移柩 裁衣	安门 开光 开市 掘井 栽种 置产 词讼
1968-10-31	1968-9-10	29	建	四	戊申 壬戌 甲戌	无	立冬 (11, 7)	万圣节前夜	无	无	上梁 修造 出行 安床 安门 教牛马 盖屋 祭祀 造畜稠 造车器	伐木 出货财 动土 安葬 开仓 开渠 栽种 破土 行丧
