1968-05-01	1968-4-5	30	平	三	戊申 丙辰 辛未	无	立夏 (5, 5)	劳动节	无	无	祭祀 作灶 平治道涂 馀事勿取	安床 入宅 安碓磑 栽种
1968-05-02	1968-4-6	30	定	四	戊申 丙辰 壬申	无	立夏 (5, 5)	无	无	无	祭祀 祈福 求嗣 斋醮 沐浴 纳畜 入殓 破土 安葬	移徙 入宅 嫁娶 出行 安床
1968-05-03	1968-4-7	30	执	五	戊申 丙辰 癸酉	无	立夏 (5, 5)	无	无	无	纳采 祭祀 祈福 求嗣 斋醮 出行 起基 盖屋 定磉 安门 入殓 安葬	嫁娶 开市 纳财 出火
1968-05-04	1968-4-8	30	破	六	戊申 丙辰 甲戌	无	立夏 (5, 5)	青年节	无	无	祭祀 沐浴 解除 求医 治病 破屋 坏垣 馀事勿取	祈福 斋醮 开市 安葬
1968-05-05	1968-4-9	30	破	日	戊申 丁巳 乙亥	立夏	小满 (5, 21)	无	无	无	祭祀 解除 破屋 坏垣 馀事勿取	诸事不宜
1968-05-06	1968-4-10	30	危	一	戊申 丁巳 丙子	无	小满 (5, 21)	无	无	无	嫁娶 祭祀 祈福 求嗣 开光 出行 拆卸 动土 上梁 出火 进人口 入宅 移徙 安床 栽种 纳畜 牧养 竖柱 安门 修造 解除 会亲友	无
1968-05-07	1968-4-11	30	成	二	戊申 丁巳 丁丑	无	小满 (5, 21)	无	无	无	开市 交易 立券 祭祀 祈福 开光 伐木 进人口 安床 拆卸 修造 动土 栽种 破土 移柩 安葬	入宅 移徙 理发 出火 嫁娶 出行
1968-05-08	1968-4-12	30	收	三	戊申 丁巳 戊寅	无	小满 (5, 21)	无	无	无	结网 解除 馀事勿取	诸事不宜
1968-05-09	1968-4-13	30	开	四	戊申 丁巳 己卯	无	小满 (5, 21)	无	无	无	嫁娶 祭祀 祈福 求嗣 开光 开市 交易 立券 安床 出行 拆卸	纳畜 入宅 移徙 安葬 探病 伐木 上梁 安门 入殓 动土
1968-05-10	1968-4-14	30	闭	五	戊申 丁巳 庚辰	无	小满 (5, 21)	无	无	无	嫁娶 祭祀 祈福 求嗣 出行 出火 拆卸 修造 动土 入宅 移徙 安床 作灶 塞穴 栽种 破土 安葬	开光 掘井 开仓
1968-05-11	1968-4-15	30	建	六	戊申 丁巳 辛巳	无	小满 (5, 21)	无	无	无	解除 扫舍 馀事勿取	诸事不宜
1968-05-12	1968-4-16	30	除	日	戊申 丁巳 壬午	无	小满 (5, 21)	母亲节	无	无	开市 交易 立券 挂匾 开光 出行 拆卸 进人口 入宅 移柩 动土 安门 上梁 栽种 破土 修坟 安葬	嫁娶 安床 探病 作灶
1968-05-13	1968-4-17	30	满	一	戊申 丁巳 癸未	无	小满 (5, 21)	无	无	无	进人口 会亲友	塞穴 上梁 动土 伐木 安葬 词讼
1968-05-14	1968-4-18	30	平	二	戊申 丁巳 甲申	无	小满 (5, 21)	无	无	无	沐浴 平治道涂 扫舍 入殓 破土 安葬 除服 成服	嫁娶 移徙 伐木 作梁 安床 祭祀 祈福 盖屋
1968-05-15	1968-4-19	30	定	三	戊申 丁巳 乙酉	无	小满 (5, 21)	无	无	无	嫁娶 祭祀 祈福 求嗣 开光 出火 出行 拆卸 动土 解除 进人口 开市 交易 立券 挂匾 入宅 移徙 安床 安门 上梁 安葬 破土 谢土	无
1968-05-16	1968-4-20	30	执	四	戊申 丁巳 丙戌	无	小满 (5, 21)	无	无	无	祭祀 祈福 求嗣 开光 解除 合帐 冠笄 伐木 架马 作梁 修造 进人口 嫁娶 裁衣 安床 动土 起基 上梁 竖柱 放水 会亲友	无
1968-05-17	1968-4-21	30	破	五	戊申 丁巳 丁亥	无	小满 (5, 21)	无	无	无	破屋 坏垣 沐浴 解除 馀事勿取	诸事不宜
1968-05-18	1968-4-22	30	危	六	戊申 丁巳 戊子	无	小满 (5, 21)	无	无	无	纳采 订盟 嫁娶 造车器 祭祀 祈福 求嗣 开光 出火 拆卸 修造 动土 进人口 挂匾 入宅 移徙 安床 栽种 入殓 破土 安葬 除服 成服	开市 立券
1968-05-19	1968-4-23	30	成	日	戊申 丁巳 己丑	无	小满 (5, 21)	全国助残日	无	无	开市 交易 立券 祭祀 祈福 开光 动土 安床 出行 栽种 纳畜 牧养 竖柱 上梁 解除 破土	嫁娶 掘井 入宅 移徙 安葬
1968-05-20	1968-4-24	30	收	一	戊申 丁巳 庚寅	无	小满 (5, 21)	无	无	无	解除 出行 纳采 冠笄 竖柱 上梁 移徙 作灶 进人口 入宅 纳畜 牧养	祭祀 伐木 架马 安床 修造 动土 安葬 修坟 破土
1968-05-21	1968-4-25	30	开	二	戊申 丁巳 辛卯	小满	芒种 (6, 5)	无	无	无	祭祀 祈福 求嗣 开光 出行 开市 交易 立券 栽种 安床 纳畜 移徙 起基 动土 定磉 造仓 置产 破土 启钻 修坟	入宅 修造 安门 伐木 入殓 安葬 盖屋
1968-05-22	1968-4-26	30	闭	三	戊申 丁巳 壬辰	无	芒种 (6, 5)	无	无	无	嫁娶 交易 立券 开厕 补垣 塞穴 畋猎 取渔 开生坟	安床 开渠 上梁 修造 开市 开光 入宅 移徙
1968-05-23	1968-4-27	30	建	四	戊申 丁巳 癸巳	无	芒种 (6, 5)	无	无	无	塞穴 断蚁 结网 畋猎 馀事勿取	嫁娶 安葬 入宅 出行 动土 词讼
1968-05-24	1968-4-28	30	除	五	戊申 丁巳 甲午	无	芒种 (6, 5)	无	无	无	纳采 订盟 嫁娶 祭祀 祈福 求嗣 开光 解除 出行 出火 入宅 移徙 栽种 纳畜 牧养 动土 破土 入殓 安葬	作灶 安床 开仓 盖屋
1968-05-25	1968-4-29	30	满	六	戊申 丁巳 乙未	无	芒种 (6, 5)	无	无	无	开光 纳采 裁衣 冠笄 安床 作灶 进人口 造仓 塞穴	嫁娶 栽种 修造 动土 出行 伐木 作梁 安葬 谢土
1968-05-26	1968-4-30	30	平	日	戊申 丁巳 丙申	无	芒种 (6, 5)	无	无	无	纳采 嫁娶 裁衣 理发 出行 修造 动土 进人口 开市 交易 立券 挂匾 移徙 上梁 栽种 纳畜	伐木 安葬 安床 祭祀 祈福
1968-05-27	1968-5-1	30	定	一	戊申 丁巳 丁酉	无	芒种 (6, 5)	无	无	无	开市 交易 立券 挂匾 祭祀 祈福 斋醮 出行 盖屋 起基 修造 动土 定磉 安床 安机械 安葬 破土 启钻 除服 成服 立碑	作灶 嫁娶 移徙 入宅 理发
1968-05-28	1968-5-2	30	执	二	戊申 丁巳 戊戌	无	芒种 (6, 5)	无	无	无	嫁娶 纳采 订盟 祭祀 祈福 求嗣 开光 出火 出行 拆卸 动土 修造 进人口 入宅 移徙 安床 解除 挂匾 栽种 破土 谢土 入殓 移柩 安葬	开市 立券 造船 合寿木
1968-05-29	1968-5-3	30	破	三	戊申 丁巳 己亥	无	芒种 (6, 5)	无	无	无	祭祀 沐浴 解除 破屋 坏垣 馀事勿取	开光 安葬
1968-05-30	1968-5-4	30	危	四	戊申 丁巳 庚子	无	芒种 (6, 5)	无	无	无	订盟 纳采 嫁娶 解除 祭祀 祈福 求嗣 开光 出行 出火 拆卸 入宅 移徙 安床 栽种 纳畜 动土 破土 谢土 安葬 修坟	作灶 开市 经络
1968-05-31	1968-5-5	30	成	五	戊申 丁巳 辛丑	无	芒种 (6, 5)	无	无	无	祭祀 祈福 求嗣 开光 订盟 纳采 解除 动土 起基 进人口 开市 交易 立券 纳财 造仓 开池 栽种 纳畜 破土 安葬	安床 上梁 裁衣 入宅 嫁娶
