1975-10-01	1975-8-26	29	危	三	乙卯 乙酉 庚辰	无	寒露 (10, 9)	国庆节	无	无	嫁娶 祈福 求嗣 出行 出火 拆卸 修造 动土 上梁 开光 进人口 开市 交易 立券 挂匾 安床 入宅 移徙 栽种 伐木 入殓 破土 除服 成服	无
1975-10-02	1975-8-27	29	成	四	乙卯 乙酉 辛巳	无	寒露 (10, 9)	无	无	无	开市 交易 立券 挂匾 祭祀 开光 进人口 入宅 安床 出火 拆卸 修造 动土 栽种	嫁娶 立碑 出行 伐木 安葬 行丧 移徙 纳畜
1975-10-03	1975-8-28	29	收	五	乙卯 乙酉 壬午	无	寒露 (10, 9)	无	无	无	祭祀 理发 会亲友 进人口 嫁娶 针灸 入殓 移柩	探病 开渠 安葬 伐木 作灶 入宅
1975-10-04	1975-8-29	29	开	六	乙卯 乙酉 癸未	无	寒露 (10, 9)	无	无	无	祭祀 立碑 修坟 启钻 除服 成服 馀事勿取	无
1975-10-05	1975-9-1	29	闭	日	乙卯 乙酉 甲申	无	寒露 (10, 9)	无	无	无	嫁娶 出行 伐木 拆卸 修造 动土 移徙 安葬 破土 修坟 立碑	掘井 祈福 安床 开市 入宅 挂匾 开光
1975-10-06	1975-9-2	29	建	一	乙卯 乙酉 乙酉	无	寒露 (10, 9)	世界住房日	无	无	祭祀 出行 扫舍 馀事勿取	诸事不宜
1975-10-07	1975-9-3	29	除	二	乙卯 乙酉 丙戌	无	寒露 (10, 9)	无	无	无	嫁娶 祭祀 塑绘 开光 出行 解除 理发 整手足甲 动土 安床 开池 放水 扫舍	伐木 行丧 作灶 作梁 安葬
1975-10-08	1975-9-4	29	满	三	乙卯 乙酉 丁亥	无	寒露 (10, 9)	无	无	无	开市 交易 立券 挂匾 开光 出行 入宅 移徙 安床 出火 上梁	作灶 行丧 理发 乘船 嫁娶 安葬
1975-10-09	1975-9-5	29	满	四	乙卯 丙戌 戊子	寒露	霜降 (10, 24)	无	无	无	沐浴 理发 冠笄 安床 开市 立券 会亲友 交易 纳财 结网 教牛马	移徙 入宅 出行 祈福 嫁娶
1975-10-10	1975-9-6	29	平	五	乙卯 丙戌 己丑	无	霜降 (10, 24)	无	无	无	祭祀 造畜稠 修饰垣墙 平治道涂 馀事勿取	嫁娶 开市 安床 掘井
1975-10-11	1975-9-7	29	定	六	乙卯 丙戌 庚寅	无	霜降 (10, 24)	无	无	无	捕捉 结网 入殓 除服 成服 移柩 破土 安葬 启钻 立碑	嫁娶 祭祀 入宅 盖屋 移徙
1975-10-12	1975-9-8	29	执	日	乙卯 丙戌 辛卯	无	霜降 (10, 24)	无	无	无	祭祀 祈福 求嗣 斋醮 造庙 出火 安机械 会亲友 开市 交易 立券 纳财 习艺 经络 求医 治病 开池 开厕 畋猎 结网 栽种 牧养 安葬 破土 启钻	开光 嫁娶 掘井 伐木 作梁
1975-10-13	1975-9-9	29	破	一	乙卯 丙戌 壬辰	无	霜降 (10, 24)	无	无	无	破屋 坏垣 馀事勿取	诸事不宜
1975-10-14	1975-9-10	29	危	二	乙卯 丙戌 癸巳	无	霜降 (10, 24)	无	无	无	会亲友 嫁娶 订盟 纳采 纳婿 拆卸 修造 动土 起基 竖柱 上梁 安床 纳财	出行 祈福 安葬 作灶
1975-10-15	1975-9-11	29	成	三	乙卯 丙戌 甲午	无	霜降 (10, 24)	无	无	无	祭祀 塑绘 开光 祈福 斋醮 出行 订盟 纳采 裁衣 嫁娶 拆卸 修造 安床 入宅 安香 入殓 启钻 安葬 谢土 赴任 会亲友 进人口 移徙 上梁 经络 开市 交易 立券 纳财	开仓 冠笄 伐木 作梁
1975-10-16	1975-9-12	29	收	四	乙卯 丙戌 乙未	无	霜降 (10, 24)	无	无	无	祭祀 作灶 入殓 除服 成服 畋猎	栽种 动土 安葬 开市
1975-10-17	1975-9-13	29	开	五	乙卯 丙戌 丙申	无	霜降 (10, 24)	无	无	无	祭祀 祈福 斋醮 沐浴 竖柱 订盟 纳采 嫁娶 拆卸 入宅 移柩 启钻 谢土 赴任 出火 纳畜	作灶 入殓 安葬 安床
1975-10-18	1975-9-14	29	闭	六	乙卯 丙戌 丁酉	无	霜降 (10, 24)	无	无	无	嫁娶 祭祀 安机械 入殓 破土 安葬	动土 上梁
1975-10-19	1975-9-15	29	建	日	乙卯 丙戌 戊戌	无	霜降 (10, 24)	无	无	无	作灶 造畜稠	行丧 安葬
1975-10-20	1975-9-16	29	除	一	乙卯 丙戌 己亥	无	霜降 (10, 24)	无	无	无	沐浴 理发 入学 习艺 进人口	嫁娶 入宅
1975-10-21	1975-9-17	29	满	二	乙卯 丙戌 庚子	无	霜降 (10, 24)	无	无	无	开光 针灸 会亲友 启钻 安葬	开市 动土 破土
1975-10-22	1975-9-18	29	平	三	乙卯 丙戌 辛丑	无	霜降 (10, 24)	无	无	无	祭祀 结网 造畜稠 馀事勿取	无
1975-10-23	1975-9-19	29	定	四	乙卯 丙戌 壬寅	无	霜降 (10, 24)	无	无	无	入殓 除服 成服 移柩 破土 启钻 安葬	移徙 入宅
1975-10-24	1975-9-20	29	执	五	乙卯 丙戌 癸卯	霜降	立冬 (11, 8)	无	无	无	嫁娶 订盟 纳采 出行 祭祀 祈福 动土 移徙 入宅 破土 安葬	开市 赴任
1975-10-25	1975-9-21	29	破	六	乙卯 丙戌 甲辰	无	立冬 (11, 8)	无	无	无	祭祀 解除 破屋 坏垣 馀事勿取	无
1975-10-26	1975-9-22	29	危	日	乙卯 丙戌 乙巳	无	立冬 (11, 8)	无	无	无	订盟 纳采 会亲友 安机械 纳财 牧养	祈福 安葬
1975-10-27	1975-9-23	29	成	一	乙卯 丙戌 丙午	无	立冬 (11, 8)	无	无	无	嫁娶 订盟 纳采 出行 开市 祭祀 祈福 动土 移徙 入宅 破土 安葬	斋醮 安门
1975-10-28	1975-9-24	29	收	二	乙卯 丙戌 丁未	无	立冬 (11, 8)	无	无	无	祭祀 塞穴 馀事勿取	诸事不宜
1975-10-29	1975-9-25	29	开	三	乙卯 丙戌 戊申	无	立冬 (11, 8)	无	无	无	祭祀 祈福 求嗣 开光 开市 出行 解除 动土 起基 置产 栽种	嫁娶 作灶 修坟 安门 入宅 立碑 安葬 安床
1975-10-30	1975-9-26	29	闭	四	乙卯 丙戌 己酉	无	立冬 (11, 8)	无	无	无	祭祀 解除 裁衣 理发 安床 作灶 造畜稠 放水 筑堤 补垣 塞穴 整手足甲 扫舍	嫁娶 开光 会亲友 掘井 安门 栽种
1975-10-31	1975-9-27	29	建	五	乙卯 丙戌 庚戌	无	立冬 (11, 8)	万圣节前夜	无	无	祭祀 出行 裁衣 冠笄 会亲友 造畜稠 嫁娶 竖柱 上梁 移徙 纳财 纳畜	动土 伐木 作梁 行丧 安葬 开生坟
