1981-10-01	一九八一 辛酉[鸡]年	九月大	初四	周四	辛酉 丁酉 壬子 乙巳	鸡	天秤座	无	寒露 (10, 8)	国庆节	无	无	祭祀、沐浴、平治道涂、雪冤、覃恩、修饰垣墙、恤孤茕	出行、结婚姻、宴会、嫁娶、安床、修造、求医疗病、上表章、上官、冠带、进人口、竖柱上梁、经络、开市、纳财、修置产室、开渠、穿井、捕捉、畋猎、栽种、牧养、破土、安葬、启攒、立券交易、裁制、缮城郭、招贤、布政事、举正直、选将、纳畜、取鱼、上册、颁诏、出师、祈福、酝酿、庆赐、开仓、鼓铸、解除、修宫室、施恩、纳采、修仓库、临政、搬移、营建、筑堤防、宣政事、求嗣、安抚边境
1981-10-02	一九八一 辛酉[鸡]年	九月大	初五	周五	辛酉 丁酉 癸丑 丁巳	鸡	天秤座	无	寒露 (10, 8)	无	无	无	祭祀、宴会、修造、上官、进人口、竖柱上梁、经络、安碓硙、牧养、雪冤、裁制、缮城郭、覃恩、布政事、举正直、纳畜、祈福、酝酿、庆赐、施恩、临政、搬移、求嗣、恤孤茕、修宫室	上表章、修置产室、选将、出师、乘船渡水、上册、安抚边境
1981-10-03	一九八一 辛酉[鸡]年	九月大	初六	周六	辛酉 丁酉 甲寅 己巳	鸡	天秤座	无	寒露 (10, 8)	无	无	无	沐浴、捕捉、雪冤、覃恩、恤孤茕	祭祀、安床、冠带、进人口、经络、开市、纳财、修置产室、开渠、穿井、安碓硙、破屋坏垣、畋猎、远回、布政事、塞穴、取鱼、修饰垣墙、酝酿、开仓、鼓铸、补垣、修宫室、筑堤防
1981-10-04	一九八一 辛酉[鸡]年	九月大	初七	周日	辛酉 丁酉 乙卯 辛巳	鸡	天秤座	无	寒露 (10, 8)	无	无	世界动物日	诸事不宜	诸事不宜
1981-10-05	一九八一 辛酉[鸡]年	九月大	初八	周一	辛酉 丁酉 丙辰 癸巳	鸡	天秤座	无	寒露 (10, 8)	无	无	无	祭祀、出行、结婚姻、宴会、嫁娶、安床、修造、上表章、上官、进人口、竖柱上梁、经络、开市、纳财、栽种、牧养、安葬、立券交易、雪冤、裁制、覃恩、缮城郭、招贤、选将、举正直、纳畜、上册、颁诏、入宅、祈福、酝酿、庆赐、纳采、施恩、修仓库、临政、搬移、求嗣、恤孤茕、宣政事、营建、安抚边境	剃头、求医疗病、冠带、修置产室、开渠、穿井、安碓硙、破屋坏垣、布政事、塞穴、修饰垣墙、出师、整容、开仓、补垣、鼓铸、解除、整手足甲、筑堤防、修宫室
1981-10-06	一九八一 辛酉[鸡]年	九月大	初九	周二	辛酉 丁酉 丁巳 乙巳	鸡	天秤座	无	寒露 (10, 8)	无	重阳节-酆都大帝诞	无	祭祀、结婚姻、宴会、上表章、上官、入学、进人口、竖柱上梁、经络、开市、纳财、立券交易、裁制、举正直、纳畜、上册、祈福、酝酿、庆赐、纳采、施恩、临政、搬移	出行、剃头、修置产室、开渠、穿井、平治道涂、破屋坏垣、栽种、破土、安葬、启攒、补垣、修饰垣墙、整容、营建
1981-10-07	一九八一 辛酉[鸡]年	九月大	初十	周三	辛酉 丁酉 戊午 丁巳	鸡	天秤座	无	寒露 (10, 8)	无	无	无	祭祀、捕捉	出行、结婚姻、宴会、嫁娶、安床、修造、求医疗病、上表章、上官、冠带、进人口、竖柱上梁、经络、开市、纳财、修置产室、开渠、穿井、栽种、牧养、破土、安葬、启攒、立券交易、裁制、乘船渡水、缮城郭、苫盖、招贤、布政事、举正直、选将、塞穴、纳畜、取鱼、上册、颁诏、出师、祈福、安抚边境、酝酿、庆赐、开仓、鼓铸、补垣、解除、修宫室、施恩、纳采、修仓库、临政、搬移、营建、筑堤防、宣政事、求嗣
1981-10-08	一九八一 辛酉[鸡]年	九月大	十一	周四	辛酉 戊戌 己未 己巳	鸡	天秤座	寒露	霜降 (10, 23)	无	无	无	捕捉	出行、结婚姻、宴会、嫁娶、安床、剃头、修造、求医疗病、上表章、上官、冠带、进人口、竖柱上梁、经络、开市、纳财、修置产室、开渠、穿井、安碓硙、破屋坏垣、栽种、牧养、破土、安葬、启攒、立券交易、裁制、缮城郭、招贤、布政事、举正直、选将、塞穴、纳畜、上册、颁诏、修饰垣墙、出师、祈福、安抚边境、酝酿、庆赐、开仓、鼓铸、整容、补垣、解除、修宫室、施恩、纳采、整手足甲、修仓库、临政、搬移、营建、筑堤防、宣政事、求嗣
1981-10-09	一九八一 辛酉[鸡]年	九月大	十二	周五	辛酉 戊戌 庚申 辛巳	鸡	天秤座	无	霜降 (10, 23)	无	无	无	出行、沐浴、修造、求医疗病、上表章、上官、入学、竖柱上梁、开市、纳财、修置产室、开渠、穿井、安碓硙、扫舍宇、栽种、牧养、雪冤、裁制、覃恩、缮城郭、招贤、举正直、上册、颁诏、祈福、开仓、解除、修宫室、施恩、整手足甲、修仓库、临政、搬移、求嗣、恤孤茕、宣政事	嫁娶、伐木、畋猎、出师、乘船渡水、取鱼
1981-10-10	一九八一 辛酉[鸡]年	九月大	十三	周六	辛酉 戊戌 辛酉 癸巳	鸡	天秤座	无	霜降 (10, 23)	无	孟婆尊神诞	辛亥革命纪念日	祭祀、沐浴、剃头、扫舍宇、雪冤、赴任、裁制、覃恩、塞穴、入宅、整容、补垣、整手足甲、恤孤茕	宴会、冠带、修置产室、开渠、穿井、畋猎、启攒、疗目、针刺、修宫室、取鱼、开仓、布政事
1981-10-11	一九八一 辛酉[鸡]年	九月大	十四	周日	辛酉 戊戌 壬戌 乙巳	鸡	天秤座	无	霜降 (10, 23)	无	无	无	祭祀、宴会、嫁娶、上官、进人口、经络、纳财、牧养、立券交易、裁制、招贤、举正直、纳畜、酝酿、庆赐、施恩、临政、搬移	剃头、修置产室、开渠、穿井、平治道涂、破屋坏垣、伐木、破土、安葬、启攒、补垣、修饰垣墙、上册、整容、乘船渡水、整手足甲、筑堤防、营建
1981-10-12	一九八一 辛酉[鸡]年	九月大	十五	周一	辛酉 戊戌 癸亥 丁巳	鸡	天秤座	无	霜降 (10, 23)	无	无	无	祭祀、沐浴、扫舍宇	嫁娶、上表章、开渠、穿井、破土、安葬、启攒、招贤、布政事、塞穴、上册、颁诏、补垣、筑堤防、营建、宣政事
1981-10-13	一九八一 辛酉[鸡]年	九月大	十六	周二	辛酉 戊戌 甲子 己巳	鸡	天秤座	无	霜降 (10, 23)	无	无	中国少年先锋队诞辰日	沐浴、雪冤、赴任、诉讼、覃恩、恤孤茕	祭祀、出行、结婚姻、宴会、嫁娶、安床、剃头、修造、求医疗病、上表章、上官、冠带、进人口、竖柱上梁、经络、开市、纳财、修置产室、开渠、穿井、安碓硙、破屋坏垣、栽种、牧养、破土、安葬、启攒、立券交易、裁制、缮城郭、远回、苫盖、招贤、布政事、举正直、选将、塞穴、纳畜、上册、颁诏、修饰垣墙、出师、祈福、入宅、安抚边境、酝酿、庆赐、开仓、整容、鼓铸、补垣、宣政事、解除、修宫室、纳采、施恩、整手足甲、修仓库、临政、搬移、营建、筑堤防、求嗣
1981-10-14	一九八一 辛酉[鸡]年	九月大	十七	周三	辛酉 戊戌 乙丑 辛巳	鸡	天秤座	无	霜降 (10, 23)	无	金龙四大王诞	无	诸事不宜	诸事不宜
1981-10-15	一九八一 辛酉[鸡]年	九月大	十八	周四	辛酉 戊戌 丙寅 癸巳	鸡	天秤座	无	霜降 (10, 23)	无	无	无	雪冤、入宅、覃恩、恤孤茕、布政事	祭祀、安床、剃头、开市、修置产室、开渠、穿井、平治道涂、破屋坏垣、伐木、畋猎、乘船渡水、远回、塞穴、取鱼、修饰垣墙、整容、开仓、补垣、鼓铸、整手足甲、筑堤防
1981-10-16	一九八一 辛酉[鸡]年	九月大	十九	周五	辛酉 戊戌 丁卯 乙巳	鸡	天秤座	无	霜降 (10, 23)	无	观世音菩萨出家	无	祭祀、结婚姻、宴会、嫁娶、上官、进人口、经络、纳财、捕捉、安葬、立券交易、雪冤、覃恩、布政事、纳畜、祈福、酝酿、庆赐、临政、恤孤茕、安抚边境	出行、安床、剃头、修造、求医疗病、上表章、冠带、竖柱上梁、开市、修置产室、穿井、栽种、牧养、乘船渡水、缮城郭、招贤、举正直、选将、取鱼、上册、出师、整容、开仓、解除、修宫室、施恩、整手足甲、纳采、修仓库、搬移、营建、筑堤防、求嗣
1981-10-17	一九八一 辛酉[鸡]年	九月大	二十	周六	辛酉 戊戌 戊辰 丁巳	鸡	天秤座	无	霜降 (10, 23)	无	无	无	祭祀、沐浴、雪冤、覃恩、恤孤茕	出行、结婚姻、安床、修造、上官、冠带、进人口、竖柱上梁、经络、开市、修置产室、开渠、穿井、安碓硙、平治道涂、伐木、捕捉、畋猎、破土、安葬、启攒、立券交易、缮城郭、招贤、举正直、塞穴、取鱼、上册、颁诏、修饰垣墙、酝酿、鼓铸、开仓、补垣、修宫室、施恩、纳采、修仓库、临政、搬移、营建、筑堤防、宣政事
1981-10-18	一九八一 辛酉[鸡]年	九月大	廿一	周日	辛酉 戊戌 己巳 己巳	鸡	天秤座	无	霜降 (10, 23)	无	无	无	祭祀、安床、选将、雪冤、恤孤茕、安抚边境	出行、嫁娶、修造、求医疗病、破土、安葬、启攒、针刺、纳畜、解除、整手足甲、修仓库、开仓
1981-10-19	一九八一 辛酉[鸡]年	九月大	廿二	周一	辛酉 戊戌 庚午 辛巳	鸡	天秤座	无	霜降 (10, 23)	无	无	无	祭祀、出行、宴会、修造、上官、入学、进人口、竖柱上梁、开市、纳财、安碓硙、栽种、牧养、安葬、立券交易、裁制、缮城郭、举正直、纳畜、祈福、酝酿、庆赐、开仓、解除、纳采、施恩、修宫室、修仓库、临政、筑堤防、搬移、求嗣	苫盖
1981-10-20	一九八一 辛酉[鸡]年	九月大	廿三	周二	辛酉 戊戌 辛未 癸巳	鸡	天秤座	无	霜降 (10, 23)	无	无	无	祭祀、捕捉、雪冤、赴任、覃恩、入宅、恤孤茕	剃头、冠带、修置产室、开渠、穿井、安碓硙、平治道涂、破屋坏垣、畋猎、启攒、乘船渡水、布政事、塞穴、取鱼、修饰垣墙、整容、开仓、补垣、鼓铸、整手足甲、筑堤防、修宫室
1981-10-21	一九八一 辛酉[鸡]年	九月大	廿四	周三	辛酉 戊戌 壬申 乙巳	鸡	天秤座	无	霜降 (10, 23)	无	无	无	出行、沐浴、剃头、求医疗病、上表章、上官、入学、竖柱上梁、开市、纳财、扫舍宇、牧养、雪冤、裁制、覃恩、招贤、举正直、选将、上册、颁诏、祈福、开仓、整容、解除、施恩、整手足甲、临政、搬移、求嗣、恤孤茕、宣政事、安抚边境	嫁娶、开渠、平治道涂、破屋坏垣、伐木、畋猎、补垣、修饰垣墙、乘船渡水、取鱼、筑堤防、营建
1981-10-22	一九八一 辛酉[鸡]年	九月大	廿五	周四	辛酉 戊戌 癸酉 丁巳	鸡	天秤座	无	霜降 (10, 23)	无	无	无	祭祀、沐浴、剃头、扫舍宇、裁制、塞穴、整容、整手足甲	出行、结婚姻、宴会、嫁娶、安床、修造、求医疗病、上表章、上官、冠带、进人口、竖柱上梁、经络、开市、立券、纳财、修置产室、开渠、穿井、安碓硙、平治道涂、破屋坏垣、栽种、牧养、破土、安葬、启攒、立券交易、疗目、针刺、缮城郭、招贤、布政事、举正直、选将、纳畜、上册、颁诏、修饰垣墙、出师、祈福、开张、酝酿、庆赐、开仓、补垣、修宫室、施恩、纳采、解除、修仓库、临政、搬移、营建、筑堤防、宣政事、求嗣、安抚边境
1981-10-23	一九八一 辛酉[鸡]年	九月大	廿六	周五	辛酉 戊戌 甲戌 己巳	鸡	天蝎座	霜降	立冬 (11, 7)	无	无	无	出行、宴会、嫁娶、上官、进人口、经络、纳财、牧养、立券交易、裁制、招贤、举正直、选将、纳畜、酝酿、庆赐、施恩、临政、搬移、安抚边境	剃头、求医疗病、上表章、修置产室、开渠、穿井、平治道涂、破屋坏垣、伐木、破土、安葬、启攒、上册、修饰垣墙、祈福、整容、开仓、补垣、解除、整手足甲、筑堤防、营建、求嗣
1981-10-24	一九八一 辛酉[鸡]年	九月大	廿七	周六	辛酉 戊戌 乙亥 辛巳	鸡	天蝎座	无	立冬 (11, 7)	无	无	无	沐浴、扫舍宇	结婚姻、宴会、嫁娶、安床、修造、上表章、冠带、进人口、竖柱上梁、修置产室、开渠、穿井、安碓硙、平治道涂、破屋坏垣、破土、安葬、启攒、裁制、缮城郭、招贤、布政事、塞穴、上册、颁诏、修饰垣墙、祈福、庆赐、鼓铸、补垣、纳采、修仓库、搬移、营建、筑堤防、宣政事、求嗣、修宫室
1981-10-25	一九八一 辛酉[鸡]年	九月大	廿八	周日	辛酉 戊戌 丙子 癸巳	鸡	天蝎座	无	立冬 (11, 7)	无	无	抗美援朝纪念日	出行、结婚姻、宴会、嫁娶、沐浴、修造、求医疗病、上表章、上官、进人口、竖柱上梁、经络、开市、纳财、栽种、牧养、安葬、立券交易、雪冤、赴任、裁制、诉讼、覃恩、缮城郭、招贤、举正直、选将、塞穴、纳畜、上册、颁诏、入宅、出师、祈福、安抚边境、庆赐、开仓、补垣、解除、纳采、施恩、修仓库、临政、搬移、营建、恤孤茕、宣政事、求嗣、修宫室	祭祀、剃头、冠带、修置产室、开渠、穿井、安碓硙、平治道涂、破屋坏垣、畋猎、远回、苫盖、布政事、取鱼、修饰垣墙、整容、鼓铸、整手足甲、筑堤防
1981-10-26	一九八一 辛酉[鸡]年	九月大	廿九	周一	辛酉 戊戌 丁丑 乙巳	鸡	天蝎座	无	立冬 (11, 7)	无	无	无	诸事不宜	诸事不宜
1981-10-27	一九八一 辛酉[鸡]年	九月大	三十	周二	辛酉 戊戌 戊寅 丁巳	鸡	天蝎座	无	立冬 (11, 7)	无	药师琉璃光佛诞	无	诸事不宜	祭祀、出行、结婚姻、宴会、嫁娶、安床、剃头、修造、求医疗病、上表章、上官、冠带、进人口、竖柱上梁、经络、开市、纳财、修置产室、开渠、穿井、安碓硙、平治道涂、破屋坏垣、伐木、畋猎、栽种、牧养、破土、安葬、启攒、立券交易、裁制、乘船渡水、缮城郭、远回、招贤、布政事、选将、举正直、塞穴、纳畜、取鱼、上册、颁诏、修饰垣墙、出师、祈福、酝酿、庆赐、整容、鼓铸、开仓、补垣、解除、修宫室、施恩、纳采、整手足甲、修仓库、临政、搬移、营建、筑堤防、宣政事、求嗣、安抚边境
1981-10-28	一九八一 辛酉[鸡]年	十月小	初一	周三	辛酉 戊戌 己卯 己巳	鸡	天蝎座	无	立冬 (11, 7)	无	寒衣节	无	祭祀、结婚姻、宴会、嫁娶、上官、进人口、经络、纳财、捕捉、畋猎、破土、安葬、立券交易、雪冤、覃恩、布政事、纳畜、祈福、酝酿、庆赐、临政、恤孤茕、安抚边境	出行、安床、修造、求医疗病、上表章、冠带、竖柱上梁、开市、修置产室、开渠、穿井、安碓硙、平治道涂、破屋坏垣、栽种、牧养、乘船渡水、缮城郭、招贤、举正直、选将、取鱼、上册、修饰垣墙、出师、开仓、补垣、解除、施恩、整手足甲、纳采、修仓库、搬移、营建、筑堤防、求嗣、修宫室
1981-10-29	一九八一 辛酉[鸡]年	十月小	初二	周四	辛酉 戊戌 庚辰 辛巳	鸡	天蝎座	无	立冬 (11, 7)	无	无	无	祭祀、沐浴、雪冤、覃恩、解除、恤孤茕	冠带、修置产室、开渠、穿井、安碓硙、平治道涂、伐木、捕捉、畋猎、破土、安葬、启攒、招贤、塞穴、取鱼、上册、颁诏、修饰垣墙、鼓铸、补垣、修仓库、筑堤防、营建、宣政事
1981-10-30	一九八一 辛酉[鸡]年	十月小	初三	周五	辛酉 戊戌 辛巳 癸巳	鸡	天蝎座	无	立冬 (11, 7)	无	三茅诞	无	祭祀、宴会、安床、上表章、上官、竖柱上梁、牧养、雪冤、赴任、裁制、覃恩、招贤、举正直、上册、颁诏、入宅、庆赐、纳采、施恩、临政、搬移、恤孤茕、宣政事	出行、修置产室、开渠、穿井、安碓硙、平治道涂、破屋坏垣、畋猎、破土、启攒、补垣、修饰垣墙、针刺、修宫室、取鱼、开仓、筑堤防
1981-10-31	一九八一 辛酉[鸡]年	十月小	初四	周六	辛酉 戊戌 壬午 乙巳	鸡	天蝎座	无	立冬 (11, 7)	无	无	无	祭祀、出行、结婚姻、宴会、嫁娶、求医疗病、上表章、上官、入学、进人口、竖柱上梁、经络、开市、纳财、牧养、安葬、立券交易、雪冤、裁制、覃恩、布政事、举正直、选将、纳畜、出师、祈福、酝酿、庆赐、开仓、解除、纳采、施恩、临政、搬移、恤孤茕、求嗣、安抚边境	修置产室、开渠、穿井、平治道涂、破屋坏垣、补垣、修饰垣墙、苫盖、营建
