1982-05-01 10:00:00	一九八二 壬戌[狗]年 四月小初八	星期六	国、际、劳、动、节、释、迦、牟、尼、佛、诞	壬戌 甲辰 甲申 己巳	无	立夏 (5, 6)	狗	金牛座	沐浴、扫舍宇	出行、结婚姻、宴会、嫁娶、安床、剃头、修造、求医疗病、上表章、上官、冠带、进人口、竖柱上梁、经络、开市、纳财、修置产室、开渠、穿井、安碓硙、平治道涂、破屋坏垣、伐木、捕捉、畋猎、栽种、牧养、破土、安葬、启攒、营建、开仓、纳畜、招贤、选将、施恩、解除、颁诏、整容、修饰垣墙、出师、布政事、修仓库、祈福、缮城郭、补垣、取鱼、鼓铸、上册、整手足甲、远回、纳采、求嗣、宣政事、举正直、筑堤防、立券交易、塞穴、酝酿、裁制、搬移、安抚边境、庆赐、临政、修宫室
1982-05-02 10:00:00	一九八二 壬戌[狗]年 四月小初九	星期日	无	壬戌 甲辰 乙酉 辛巳	无	立夏 (5, 6)	狗	金牛座	祭祀、出行、结婚姻、嫁娶、沐浴、剃头、修造、求医疗病、上表章、上官、进人口、竖柱上梁、经络、开市、纳财、扫舍宇、捕捉、栽种、牧养、安葬、营建、纳畜、招贤、施恩、选将、解除、颁诏、整容、修仓库、祈福、缮城郭、取鱼、上册、整手足甲、纳采、求嗣、宣政事、举正直、覃恩、恤孤茕、立券交易、酝酿、裁制、搬移、安抚边境、雪冤、临政	宴会、冠带、修置产室、开渠、穿井、安碓硙、平治道涂、破屋坏垣、乘船渡水、开仓、补垣、筑堤防、修宫室、修饰垣墙、出师
1982-05-03 10:00:00	一九八二 壬戌[狗]年 四月小初十	星期一	世、界、新、闻、自、由、日	壬戌 甲辰 丙戌 癸巳	无	立夏 (5, 6)	狗	金牛座	祭祀、沐浴、求医疗病、解除	冠带、修置产室、开渠、穿井、安碓硙、平治道涂、伐木、破土、安葬、启攒、营建、纳畜、招贤、颁诏、修饰垣墙、修仓库、布政事、补垣、取鱼、鼓铸、上册、乘船渡水、宣政事、筑堤防、塞穴
1982-05-04 10:00:00	一九八二 壬戌[狗]年 四月小十一	星期二	中、国、青、年、节	壬戌 甲辰 丁亥 乙巳	无	立夏 (5, 6)	狗	金牛座	祭祀、结婚姻、宴会、安床、沐浴、上表章、上官、竖柱上梁、纳财、牧养、赴任、纳畜、招贤、施恩、颁诏、入宅、上册、纳采、宣政事、举正直、覃恩、恤孤茕、裁制、搬移、庆赐、雪冤、临政	嫁娶、剃头、修置产室、开渠、穿井、安碓硙、平治道涂、破屋坏垣、畋猎、破土、启攒、取鱼、补垣、筑堤防、整容、修饰垣墙
1982-05-05 10:00:00	一九八二 壬戌[狗]年 四月小十二	星期三	马、克、思、诞、辰、纪、念、日	壬戌 甲辰 戊子 丁巳	无	立夏 (5, 6)	狗	金牛座	结婚姻、宴会、沐浴、入学、竖柱上梁、经络、纳财、牧养、赴任、纳畜、施恩、选将、出师、祈福、纳采、举正直、酝酿、诉讼、裁制、安抚边境、庆赐、临政	剃头、修置产室、开渠、穿井、平治道涂、破屋坏垣、破土、启攒、营建、整容、修饰垣墙、补垣、远回
1982-05-06 10:00:00	一九八二 壬戌[狗]年 四月小十三	星期四	无	壬戌 乙巳 己丑 己巳	立夏	小满 (5, 21)	狗	金牛座	祭祀、出行、宴会、求医疗病、上表章、上官、入学、进人口、竖柱上梁、经络、开市、纳财、牧养、开仓、纳畜、施恩、解除、祈福、上册、纳采、求嗣、举正直、立券交易、酝酿、裁制、庆赐、临政	冠带、修置产室、开渠、穿井、平治道涂、破屋坏垣、破土、营建、乘船渡水、取鱼、远回、选将、补垣、修饰垣墙、出师
1982-05-07 10:00:00	一九八二 壬戌[狗]年 四月小十四	星期五	纯、阳、祖、师、诞	壬戌 乙巳 庚寅 辛巳	无	小满 (5, 21)	狗	金牛座	出行、结婚姻、宴会、嫁娶、修造、求医疗病、上表章、上官、进人口、竖柱上梁、纳财、捕捉、栽种、牧养、安葬、赴任、营建、纳畜、招贤、施恩、选将、解除、颁诏、修仓库、出师、祈福、缮城郭、上册、纳采、求嗣、宣政事、举正直、覃恩、恤孤茕、立券交易、诉讼、裁制、搬移、安抚边境、庆赐、雪冤、临政	祭祀、安床、剃头、冠带、经络、开市、修置产室、开渠、穿井、安碓硙、平治道涂、破屋坏垣、畋猎、启攒、开仓、整容、修饰垣墙、布政事、补垣、取鱼、鼓铸、整手足甲、乘船渡水、筑堤防、塞穴、酝酿、修宫室
1982-05-08 10:00:00	一九八二 壬戌[狗]年 四月小十五	星期六	世、界、红、十、字、日、钟、离、祖、师、诞	壬戌 乙巳 辛卯 癸巳	无	小满 (5, 21)	狗	金牛座	祭祀、出行、结婚姻、宴会、嫁娶、修造、求医疗病、上表章、上官、入学、竖柱上梁、开市、纳财、修置产室、安碓硙、栽种、牧养、营建、纳畜、招贤、施恩、选将、解除、颁诏、出师、修仓库、祈福、缮城郭、上册、纳采、求嗣、宣政事、举正直、修宫室、覃恩、恤孤茕、立券交易、裁制、搬移、安抚边境、庆赐、雪冤、临政	安床、剃头、冠带、进人口、经络、穿井、破屋坏垣、伐木、畋猎、开仓、整容、修饰垣墙、布政事、补垣、入宅、取鱼、鼓铸、整手足甲、筑堤防、塞穴、酝酿
1982-05-09 10:00:00	一九八二 壬戌[狗]年 四月小十六	星期日	母、亲、节	壬戌 乙巳 壬辰 乙巳	无	小满 (5, 21)	狗	金牛座	祭祀、入宅	出行、结婚姻、宴会、嫁娶、安床、剃头、修造、求医疗病、上表章、上官、冠带、进人口、竖柱上梁、经络、开市、纳财、修置产室、开渠、穿井、安碓硙、破屋坏垣、栽种、牧养、安葬、营建、开仓、纳畜、招贤、施恩、选将、解除、针刺、颁诏、整容、修饰垣墙、出师、布政事、修仓库、祈福、缮城郭、补垣、鼓铸、上册、整手足甲、疗目、纳采、求嗣、宣政事、举正直、筑堤防、立券交易、塞穴、酝酿、裁制、搬移、安抚边境、庆赐、临政、修宫室
1982-05-10 10:00:00	一九八二 壬戌[狗]年 四月小十七	星期一	十、殿、转、轮、王、诞	壬戌 乙巳 癸巳 丁巳	无	小满 (5, 21)	狗	金牛座	宴会、上官、进人口、经络、纳财、纳畜、招贤、施恩、选将、颁诏、宣政事、举正直、覃恩、恤孤茕、立券交易、酝酿、裁制、安抚边境、庆赐、雪冤、临政	出行、剃头、求医疗病、上表章、修置产室、开渠、穿井、平治道涂、破屋坏垣、伐木、畋猎、栽种、破土、安葬、启攒、营建、开仓、解除、整容、修饰垣墙、祈福、补垣、上册、整手足甲、求嗣、筑堤防
1982-05-11 10:00:00	一九八二 壬戌[狗]年 四月小十八	星期二	世、界、肥、胖、日、紫、徽、大、帝、诞	壬戌 乙巳 甲午 己巳	无	小满 (5, 21)	狗	金牛座	祭祀、宴会、沐浴、剃头、扫舍宇、安葬、颁诏、整容、整手足甲、宣政事、覃恩、恤孤茕、裁制、庆赐、雪冤	冠带、修置产室、畋猎、乘船渡水、开仓、苫盖、修宫室、筑堤防、取鱼
1982-05-12 10:00:00	一九八二 壬戌[狗]年 四月小十九	星期三	无	壬戌 乙巳 乙未 辛巳	无	小满 (5, 21)	狗	金牛座	雪冤、覃恩、恤孤茕	祭祀、剃头、冠带、修置产室、开渠、穿井、安碓硙、平治道涂、破屋坏垣、伐木、畋猎、启攒、整容、修饰垣墙、布政事、补垣、取鱼、鼓铸、整手足甲、乘船渡水、远回、筑堤防
1982-05-13 10:00:00	一九八二 壬戌[狗]年 四月小二十	星期四	眼、光、圣、母、诞	壬戌 乙巳 丙申 癸巳	无	小满 (5, 21)	狗	金牛座	祭祀、出行、结婚姻、宴会、嫁娶、沐浴、剃头、修造、求医疗病、上表章、上官、进人口、竖柱上梁、经络、开市、纳财、扫舍宇、平治道涂、栽种、牧养、安葬、营建、开仓、纳畜、招贤、施恩、选将、解除、颁诏、整容、修饰垣墙、修仓库、出师、祈福、缮城郭、上册、整手足甲、纳采、求嗣、宣政事、举正直、覃恩、恤孤茕、立券交易、酝酿、裁制、搬移、安抚边境、庆赐、雪冤、临政	诸事不忌
1982-05-14 10:00:00	一九八二 壬戌[狗]年 四月小廿一	星期五	无	壬戌 乙巳 丁酉 乙巳	无	小满 (5, 21)	狗	金牛座	沐浴、修造、冠带、进人口、竖柱上梁、经络、安碓硙、扫舍宇、牧养、安葬、赴任、纳畜、缮城郭、入宅、酝酿、裁制、搬移、修宫室	宴会、剃头、上表章、修置产室、开仓、苫盖、上册
1982-05-15 10:00:00	一九八二 壬戌[狗]年 四月小廿二	星期六	无	壬戌 乙巳 戊戌 丁巳	无	小满 (5, 21)	狗	金牛座	祭祀、宴会、沐浴、剃头、修造、上表章、上官、竖柱上梁、纳财、捕捉、栽种、牧养、施恩、解除、整容、祈福、缮城郭、整手足甲、纳采、求嗣、举正直、裁制、搬移、庆赐、临政、修宫室	修仓库
1982-05-16 10:00:00	一九八二 壬戌[狗]年 四月小廿三	星期日	无	壬戌 乙巳 己亥 己巳	无	小满 (5, 21)	狗	金牛座	沐浴、破屋坏垣、解除	嫁娶、剃头、上表章、冠带、修置产室、开渠、穿井、安碓硙、伐木、捕捉、畋猎、破土、安葬、启攒、营建、招贤、颁诏、整容、修饰垣墙、修仓库、布政事、补垣、取鱼、鼓铸、上册、整手足甲、乘船渡水、宣政事、筑堤防、塞穴
1982-05-17 10:00:00	一九八二 壬戌[狗]年 四月小廿四	星期一	无	壬戌 乙巳 庚子 辛巳	无	小满 (5, 21)	狗	金牛座	祭祀、宴会、沐浴、颁诏、宣政事、覃恩、恤孤茕、裁制、庆赐、雪冤	冠带、进人口、经络、开市、纳财、修置产室、畋猎、开仓、取鱼、筑堤防、立券交易、修宫室
1982-05-18 10:00:00	一九八二 壬戌[狗]年 四月小廿五	星期二	无	壬戌 乙巳 辛丑 癸巳	无	小满 (5, 21)	狗	金牛座	祭祀、出行、结婚姻、宴会、修造、求医疗病、上表章、上官、入学、进人口、竖柱上梁、经络、开市、纳财、安碓硙、栽种、牧养、安葬、营建、纳畜、招贤、施恩、解除、颁诏、修仓库、祈福、缮城郭、上册、纳采、求嗣、宣政事、举正直、筑堤防、覃恩、恤孤茕、立券交易、裁制、庆赐、雪冤、临政、修宫室	冠带、畋猎、乘船渡水、取鱼、远回
1982-05-19 10:00:00	一九八二 壬戌[狗]年 四月小廿六	星期三	无	壬戌 乙巳 壬寅 乙巳	无	小满 (5, 21)	狗	金牛座	结婚姻、宴会、嫁娶、修造、进人口、纳财、捕捉、栽种、牧养、安葬、赴任、纳畜、搬移、纳采、入宅、立券交易、诉讼	祭祀、出行、安床、剃头、求医疗病、上表章、上官、冠带、竖柱上梁、经络、开市、修置产室、开渠、穿井、安碓硙、平治道涂、破屋坏垣、启攒、营建、开仓、招贤、施恩、选将、解除、颁诏、整容、修饰垣墙、出师、修仓库、布政事、祈福、缮城郭、补垣、鼓铸、上册、整手足甲、求嗣、宣政事、举正直、修宫室、筑堤防、塞穴、酝酿、裁制、安抚边境、庆赐、临政
1982-05-20 10:00:00	一九八二 壬戌[狗]年 四月小廿七	星期四	无	壬戌 乙巳 癸卯 丁巳	无	小满 (5, 21)	狗	金牛座	入学、覃恩、恤孤茕、雪冤	竖柱上梁、经络、穿井、伐木、畋猎、安葬、营建、开仓、选将、出师、布政事、补垣、入宅、取鱼、纳采、筑堤防、塞穴、酝酿、安抚边境
1982-05-21 10:00:00	一九八二 壬戌[狗]年 四月小廿八	星期五	无	壬戌 乙巳 甲辰 己巳	小满	芒种 (6, 6)	狗	双子座	诸事不宜	诸事不宜
1982-05-22 10:00:00	一九八二 壬戌[狗]年 四月小廿九	星期六	无	壬戌 乙巳 乙巳 辛巳	无	芒种 (6, 6)	狗	双子座	祭祀、宴会、上官、进人口、经络、纳财、牧养、纳畜、招贤、施恩、选将、颁诏、宣政事、举正直、覃恩、恤孤茕、立券交易、酝酿、裁制、搬移、安抚边境、庆赐、雪冤、临政	出行、剃头、修置产室、开渠、穿井、平治道涂、破屋坏垣、伐木、畋猎、破土、启攒、修饰垣墙、开仓、补垣、筑堤防、整容、取鱼、整手足甲
1982-05-23 10:00:00	一九八二 壬戌[狗]年 闰四月小初一	星期日	世、界、读、书、日、八、殿、都、市、王、诞	壬戌 乙巳 丙午 癸巳	无	芒种 (6, 6)	狗	双子座	祭祀、宴会、沐浴、剃头、扫舍宇、颁诏、整容、宣政事、覃恩、恤孤茕、裁制、庆赐、雪冤	冠带、修置产室、畋猎、启攒、乘船渡水、开仓、苫盖、修宫室、筑堤防、取鱼
1982-05-24 10:00:00	一九八二 壬戌[狗]年 闰四月小初二	星期一	无	壬戌 乙巳 丁未 乙巳	无	芒种 (6, 6)	狗	双子座	赴任、入宅	祭祀、结婚姻、剃头、上官、冠带、修置产室、开渠、穿井、安碓硙、平治道涂、破屋坏垣、伐木、栽种、牧养、启攒、营建、纳畜、招贤、施恩、选将、解除、颁诏、整容、修饰垣墙、出师、布政事、补垣、取鱼、鼓铸、整手足甲、乘船渡水、远回、宣政事、举正直、筑堤防、安抚边境、临政
1982-05-25 10:00:00	一九八二 壬戌[狗]年 闰四月小初三	星期二	无	壬戌 乙巳 戊申 丁巳	无	芒种 (6, 6)	狗	双子座	祭祀、沐浴、扫舍宇、平治道涂	上表章、开渠、穿井、启攒、营建、招贤、选将、针刺、颁诏、出师、布政事、补垣、上册、宣政事、筑堤防、塞穴、安抚边境
1982-05-26 10:00:00	一九八二 壬戌[狗]年 闰四月小初四	星期三	文、殊、菩、萨、诞	壬戌 乙巳 己酉 己巳	无	芒种 (6, 6)	狗	双子座	祭祀、沐浴、剃头、修造、上官、冠带、进人口、竖柱上梁、经络、安碓硙、扫舍宇、牧养、安葬、纳畜、施恩、整容、布政事、缮城郭、祈福、整手足甲、求嗣、举正直、覃恩、恤孤茕、酝酿、裁制、搬移、雪冤、临政、修宫室	宴会、上表章、修置产室、苫盖、上册
1982-05-27 10:00:00	一九八二 壬戌[狗]年 闰四月小初五	星期四	上、海、解、放、日	壬戌 乙巳 庚戌 辛巳	无	芒种 (6, 6)	狗	双子座	祭祀、结婚姻、宴会、嫁娶、沐浴、剃头、修造、求医疗病、上表章、上官、竖柱上梁、捕捉、栽种、牧养、安葬、营建、纳畜、招贤、施恩、选将、解除、颁诏、整容、出师、祈福、缮城郭、上册、整手足甲、纳采、求嗣、宣政事、举正直、覃恩、恤孤茕、裁制、搬移、安抚边境、庆赐、雪冤、临政	经络、畋猎、乘船渡水、开仓、取鱼
1982-05-28 10:00:00	一九八二 壬戌[狗]年 闰四月小初六	星期五	无	壬戌 乙巳 辛亥 癸巳	无	芒种 (6, 6)	狗	双子座	沐浴、破屋坏垣、解除、覃恩、恤孤茕、雪冤	嫁娶、安床、剃头、冠带、经络、开市、修置产室、开渠、穿井、安碓硙、伐木、捕捉、畋猎、破土、启攒、开仓、整容、修饰垣墙、补垣、取鱼、鼓铸、整手足甲、修宫室、筑堤防、立券交易、塞穴、酝酿
1982-05-29 10:00:00	一九八二 壬戌[狗]年 闰四月小初七	星期六	无	壬戌 乙巳 壬子 乙巳	无	芒种 (6, 6)	狗	双子座	沐浴、入宅、覃恩、恤孤茕、雪冤	结婚姻、求医疗病、上表章、冠带、进人口、竖柱上梁、经络、开市、立券、纳财、修置产室、开渠、穿井、安碓硙、栽种、牧养、安葬、营建、开仓、纳畜、招贤、施恩、解除、开张、颁诏、修饰垣墙、修仓库、祈福、缮城郭、补垣、鼓铸、上册、求嗣、宣政事、举正直、修宫室、筑堤防、立券交易、塞穴、酝酿、裁制
1982-05-30 10:00:00	一九八二 壬戌[狗]年 闰四月小初八	星期日	释、迦、牟、尼、佛、诞	壬戌 乙巳 癸丑 丁巳	无	芒种 (6, 6)	狗	双子座	出行、宴会、上表章、上官、入学、进人口、竖柱上梁、经络、开市、纳财、安碓硙、纳畜、施恩、布政事、缮城郭、上册、举正直、筑堤防、覃恩、恤孤茕、立券交易、酝酿、裁制、庆赐、雪冤、临政、修宫室	求医疗病、冠带、乘船渡水、远回、选将、出师、取鱼
1982-05-31 10:00:00	一九八二 壬戌[狗]年 闰四月小初九	星期一	世、界、无、烟、日	壬戌 乙巳 甲寅 己巳	无	芒种 (6, 6)	狗	双子座	捕捉、赴任、诉讼	祭祀、出行、结婚姻、宴会、嫁娶、安床、剃头、修造、求医疗病、上表章、上官、冠带、进人口、竖柱上梁、经络、开市、纳财、修置产室、开渠、穿井、安碓硙、平治道涂、破屋坏垣、栽种、牧养、破土、安葬、启攒、营建、开仓、纳畜、招贤、施恩、选将、解除、颁诏、整容、修饰垣墙、出师、布政事、修仓库、祈福、缮城郭、补垣、鼓铸、上册、整手足甲、纳采、求嗣、宣政事、举正直、筑堤防、立券交易、塞穴、酝酿、裁制、搬移、安抚边境、庆赐、临政、修宫室
