1988-01-01	一九八七 丁卯[兔]年	冬月小	十二	周五	元旦节	无	无	丁卯 壬子 乙卯 辛巳	无	小寒 (1, 6)	兔	摩羯座	诸事不宜	诸事不宜
1988-01-02	一九八七 丁卯[兔]年	冬月小	十三	周六	无	无	无	丁卯 壬子 丙辰 癸巳	无	小寒 (1, 6)	兔	摩羯座	祭祀、宴会、修造、上官、冠带、进人口、竖柱上梁、经络、安碓硙、安葬、赴任、纳畜、纳采、缮城郭、裁制、临政、诉讼、酝酿、祈福、庆赐、修宫室	求医疗病、开市、修置产室、栽种、开仓、解除
1988-01-03	一九八七 丁卯[兔]年	冬月小	十四	周日	无	无	无	丁卯 壬子 丁巳 乙巳	无	小寒 (1, 6)	兔	摩羯座	祭祀、捕捉、赴任、雪冤、入宅、覃恩、恤孤茕	出行、剃头、冠带、修置产室、开渠、穿井、安碓硙、破屋坏垣、畋猎、破土、启攒、布政事、取鱼、补垣、整手足甲、鼓铸、乘船渡水、筑堤防、塞穴、修饰垣墙、整容、修宫室
1988-01-04	一九八七 丁卯[兔]年	冬月小	十五	周一	无	无	无	丁卯 壬子 戊午 丁巳	无	小寒 (1, 6)	兔	摩羯座	诸事不宜	诸事不宜
1988-01-05	一九八七 丁卯[兔]年	冬月小	十六	周二	无	无	无	丁卯 壬子 己未 己巳	无	小寒 (1, 6)	兔	摩羯座	伐木、畋猎	出行、结婚姻、宴会、嫁娶、安床、剃头、修造、求医疗病、上表章、上官、冠带、进人口、竖柱上梁、经络、开市、纳财、修置产室、开渠、穿井、安碓硙、破屋坏垣、栽种、牧养、破土、安葬、启攒、布政事、纳畜、颁诏、纳采、补垣、举正直、安抚边境、修仓库、整手足甲、缮城郭、鼓铸、裁制、宣政事、临政、酝酿、立券交易、招贤、开仓、祈福、解除、施恩、筑堤防、求嗣、塞穴、修饰垣墙、上册、庆赐、整容、修宫室、选将、营建、出师、搬移
1988-01-06	一九八七 丁卯[兔]年	冬月小	十七	周三	无	阿弥陀佛诞	无	丁卯 癸丑 庚申 辛巳	小寒	大寒 (1, 21)	兔	摩羯座	祭祀、出行、沐浴、剃头、上表章、上官、竖柱上梁、开市、纳财、扫舍宇、伐木、栽种、牧养、安葬、纳畜、颁诏、举正直、雪冤、整手足甲、缮城郭、裁制、宣政事、临政、酝酿、招贤、开仓、施恩、覃恩、上册、整容、恤孤茕、营建、搬移	取鱼
1988-01-07	一九八七 丁卯[兔]年	冬月小	十八	周四	无	无	无	丁卯 癸丑 辛酉 癸巳	无	大寒 (1, 21)	兔	摩羯座	祭祀、沐浴、剃头、求医疗病、上表章、上官、入学、进人口、竖柱上梁、经络、安碓硙、扫舍宇、栽种、牧养、安葬、举正直、整手足甲、缮城郭、裁制、临政、筑堤防、施恩、祈福、解除、求嗣、上册、整容、修宫室	宴会、畋猎、苫盖、选将、出师
1988-01-08	一九八七 丁卯[兔]年	冬月小	十九	周五	无	太阳日宫诞	周恩来逝世纪念日	丁卯 癸丑 壬戌 乙巳	无	大寒 (1, 21)	兔	摩羯座	祭祀、捕捉、畋猎、入宅	出行、结婚姻、宴会、安床、剃头、求医疗病、上表章、上官、冠带、竖柱上梁、经络、开市、修置产室、开渠、穿井、安碓硙、破屋坏垣、栽种、牧养、破土、安葬、启攒、布政事、出师、颁诏、补垣、举正直、安抚边境、修仓库、整手足甲、缮城郭、鼓铸、裁制、宣政事、临政、酝酿、立券交易、招贤、开仓、解除、施恩、筑堤防、求嗣、塞穴、修饰垣墙、上册、庆赐、整容、修宫室、选将、营建
1988-01-09	一九八七 丁卯[兔]年	冬月小	二十	周六	无	无	无	丁卯 癸丑 癸亥 丁巳	无	大寒 (1, 21)	兔	摩羯座	沐浴、入学、雪冤、恤孤茕、覃恩	祭祀、出行、结婚姻、宴会、嫁娶、安床、剃头、修造、求医疗病、上表章、上官、冠带、进人口、竖柱上梁、经络、开市、纳财、修置产室、开渠、穿井、安碓硙、平治道涂、破屋坏垣、伐木、畋猎、栽种、牧养、破土、安葬、启攒、布政事、出师、纳畜、取鱼、颁诏、纳采、补垣、举正直、安抚边境、修仓库、整手足甲、缮城郭、鼓铸、裁制、宣政事、临政、酝酿、立券交易、招贤、开仓、祈福、解除、施恩、筑堤防、求嗣、塞穴、修饰垣墙、上册、庆赐、整容、修宫室、选将、营建、远回、搬移
1988-01-10	一九八七 丁卯[兔]年	冬月小	廿一	周日	无	无	中国公安110宣传日	丁卯 癸丑 甲子 己巳	无	大寒 (1, 21)	兔	摩羯座	祭祀、沐浴、经络、安葬、雪冤、裁制、酝酿、塞穴、覃恩、恤孤茕	出行、结婚姻、宴会、嫁娶、安床、修造、求医疗病、上表章、上官、冠带、进人口、竖柱上梁、开市、立券、纳财、修置产室、开渠、穿井、安碓硙、平治道涂、破屋坏垣、畋猎、栽种、牧养、破土、布政事、出师、纳畜、取鱼、颁诏、纳采、举正直、补垣、开张、安抚边境、修仓库、整手足甲、缮城郭、宣政事、临政、针刺、立券交易、招贤、开仓、祈福、解除、施恩、求嗣、筑堤防、修饰垣墙、上册、庆赐、修宫室、选将、营建、远回、疗目、搬移
1988-01-11	一九八七 丁卯[兔]年	冬月小	廿二	周一	无	无	无	丁卯 癸丑 乙丑 辛巳	无	大寒 (1, 21)	兔	摩羯座	祭祀、宴会、经络、纳财、牧养、布政事、纳畜、举正直、雪冤、裁制、酝酿、立券交易、施恩、覃恩、庆赐、恤孤茕	剃头、冠带、修置产室、开渠、穿井、平治道涂、破屋坏垣、伐木、捕捉、畋猎、破土、启攒、整容、整手足甲、取鱼、筑堤防、补垣、修饰垣墙
1988-01-12	一九八七 丁卯[兔]年	冬月小	廿三	周二	无	张仙诞	无	丁卯 癸丑 丙寅 癸巳	无	大寒 (1, 21)	兔	摩羯座	沐浴、扫舍宇、雪冤、覃恩、恤孤茕	祭祀、上表章、开渠、穿井、安葬、颁诏、补垣、宣政事、乘船渡水、招贤、筑堤防、塞穴、上册、营建
1988-01-13	一九八七 丁卯[兔]年	冬月小	廿四	周三	无	无	无	丁卯 癸丑 丁卯 乙巳	无	大寒 (1, 21)	兔	摩羯座	出行、结婚姻、宴会、嫁娶、修造、求医疗病、上表章、进人口、竖柱上梁、经络、开市、纳财、栽种、牧养、安葬、赴任、布政事、纳畜、补垣、纳采、安抚边境、修仓库、雪冤、缮城郭、裁制、立券交易、开仓、祈福、入宅、塞穴、覃恩、上册、庆赐、恤孤茕、修宫室、选将、出师、搬移	祭祀、剃头、上官、冠带、修置产室、开渠、穿井、安碓硙、破屋坏垣、颁诏、举正直、整手足甲、鼓铸、宣政事、临政、招贤、解除、施恩、筑堤防、求嗣、修饰垣墙、整容、营建
1988-01-14	一九八七 丁卯[兔]年	冬月小	廿五	周四	无	无	无	丁卯 癸丑 戊辰 丁巳	无	大寒 (1, 21)	兔	摩羯座	诸事不宜	诸事不宜
1988-01-15	一九八七 丁卯[兔]年	冬月小	廿六	周五	无	北方五道诞	无	丁卯 癸丑 己巳 己巳	无	大寒 (1, 21)	兔	摩羯座	结婚姻、宴会、修造、冠带、竖柱上梁、经络、安碓硙、纳畜、纳采、缮城郭、裁制、临政、酝酿、庆赐、修宫室	出行、求医疗病、上表章、开市、修置产室、栽种、破土、安葬、启攒、取鱼、补垣、安抚边境、鼓铸、乘船渡水、开仓、解除、塞穴、上册、选将、出师
1988-01-16	一九八七 丁卯[兔]年	冬月小	廿七	周六	无	无	无	丁卯 癸丑 庚午 辛巳	无	大寒 (1, 21)	兔	摩羯座	祭祀、出行、结婚姻、宴会、嫁娶、沐浴、剃头、修造、求医疗病、上表章、上官、竖柱上梁、捕捉、畋猎、栽种、牧养、安葬、赴任、出师、纳畜、颁诏、纳采、举正直、安抚边境、修仓库、雪冤、整手足甲、缮城郭、裁制、宣政事、临政、诉讼、招贤、祈福、解除、施恩、求嗣、覃恩、上册、庆赐、整容、恤孤茕、选将、营建、搬移	安床、冠带、进人口、经络、开市、纳财、修置产室、启攒、取鱼、苫盖、乘船渡水、酝酿、立券交易、开仓、筑堤防、修宫室
1988-01-17	一九八七 丁卯[兔]年	冬月小	廿八	周日	无	无	无	丁卯 癸丑 辛未 癸巳	无	大寒 (1, 21)	兔	摩羯座	解除	嫁娶、剃头、上表章、冠带、修置产室、开渠、穿井、安碓硙、平治道涂、伐木、安葬、启攒、布政事、纳畜、颁诏、补垣、安抚边境、修仓库、整手足甲、鼓铸、宣政事、招贤、筑堤防、塞穴、修饰垣墙、上册、整容、选将、营建、出师
1988-01-18	一九八七 丁卯[兔]年	冬月小	廿九	周一	无	无	无	丁卯 癸丑 壬申 乙巳	无	大寒 (1, 21)	兔	摩羯座	祭祀、嫁娶、沐浴、剃头、经络、开市、纳财、扫舍宇、伐木、畋猎、牧养、安葬、纳畜、安抚边境、整手足甲、酝酿、开仓、入宅、整容、选将、搬移	结婚姻、宴会、修置产室、开渠、穿井、安碓硙、平治道涂、破屋坏垣、庆赐、修仓库、修宫室、缮城郭、营建、求嗣、筑堤防、补垣、修饰垣墙
1988-01-19	一九八七 丁卯[兔]年	腊月小	初一	周二	无	无	无	丁卯 癸丑 癸酉 丁巳	无	大寒 (1, 21)	兔	摩羯座	沐浴、剃头、上表章、上官、入学、进人口、竖柱上梁、经络、开市、纳财、扫舍宇、牧养、安葬、举正直、裁制、临政、酝酿、施恩、解除、上册、整容	宴会、修置产室、开渠、穿井、平治道涂、破屋坏垣、畋猎、苫盖、选将、营建、补垣、出师、修饰垣墙
1988-01-20	一九八七 丁卯[兔]年	腊月小	初二	周三	无	无	无	丁卯 癸丑 甲戌 己巳	无	大寒 (1, 21)	兔	水瓶座	祭祀、捕捉、畋猎	出行、结婚姻、宴会、嫁娶、安床、剃头、修造、求医疗病、上表章、上官、冠带、进人口、竖柱上梁、经络、开市、纳财、修置产室、开渠、穿井、安碓硙、平治道涂、破屋坏垣、栽种、牧养、破土、安葬、启攒、布政事、出师、纳畜、取鱼、颁诏、纳采、补垣、举正直、安抚边境、修仓库、整手足甲、缮城郭、鼓铸、裁制、宣政事、临政、乘船渡水、酝酿、立券交易、招贤、开仓、祈福、解除、施恩、筑堤防、求嗣、塞穴、修饰垣墙、上册、庆赐、整容、修宫室、选将、营建、搬移
1988-01-21	一九八七 丁卯[兔]年	腊月小	初三	周四	无	无	列宁逝世纪念日	丁卯 癸丑 乙亥 辛巳	大寒	立春 (2, 4)	兔	水瓶座	祭祀、出行、结婚姻、宴会、沐浴、修造、求医疗病、上表章、上官、入学、竖柱上梁、开市、纳财、修置产室、开渠、穿井、安碓硙、栽种、牧养、出师、纳畜、纳采、安抚边境、修仓库、雪冤、缮城郭、裁制、临政、开仓、祈福、解除、求嗣、覃恩、上册、庆赐、恤孤茕、修宫室、选将、营建、搬移	嫁娶、剃头、冠带、平治道涂、破屋坏垣、伐木、畋猎、破土、启攒、布政事、取鱼、补垣、整手足甲、鼓铸、筑堤防、塞穴、修饰垣墙、整容、远回
1988-01-22	一九八七 丁卯[兔]年	腊月小	初四	周五	无	无	无	丁卯 癸丑 丙子 癸巳	无	立春 (2, 4)	兔	水瓶座	祭祀、沐浴、经络、安葬、酝酿、塞穴	出行、结婚姻、宴会、嫁娶、安床、修造、求医疗病、上表章、上官、冠带、进人口、竖柱上梁、开市、纳财、修置产室、开渠、穿井、安碓硙、平治道涂、破屋坏垣、栽种、牧养、破土、布政事、纳畜、颁诏、纳采、补垣、举正直、安抚边境、修仓库、缮城郭、宣政事、临政、针刺、立券交易、招贤、开仓、祈福、解除、施恩、筑堤防、求嗣、修饰垣墙、上册、庆赐、修宫室、选将、营建、远回、出师、疗目、搬移
1988-01-23	一九八七 丁卯[兔]年	腊月小	初五	周六	无	无	无	丁卯 癸丑 丁丑 乙巳	无	立春 (2, 4)	兔	水瓶座	宴会、经络、纳财、赴任、纳畜、举正直、裁制、酝酿、立券交易、入宅、施恩、庆赐	剃头、求医疗病、上表章、冠带、修置产室、开渠、穿井、平治道涂、破屋坏垣、伐木、捕捉、畋猎、栽种、破土、安葬、启攒、取鱼、颁诏、补垣、整手足甲、宣政事、乘船渡水、开仓、祈福、解除、筑堤防、求嗣、修饰垣墙、上册、整容、营建
1988-01-24	一九八七 丁卯[兔]年	腊月小	初六	周日	无	无	无	丁卯 癸丑 戊寅 丁巳	无	立春 (2, 4)	兔	水瓶座	沐浴、扫舍宇	祭祀、上表章、开渠、穿井、安葬、启攒、布政事、颁诏、补垣、宣政事、招贤、筑堤防、塞穴、上册、营建
1988-01-25	一九八七 丁卯[兔]年	腊月小	初七	周一	无	无	无	丁卯 癸丑 己卯 己巳	无	立春 (2, 4)	兔	水瓶座	雪冤、覃恩、恤孤茕	祭祀、出行、结婚姻、宴会、嫁娶、安床、剃头、修造、求医疗病、上表章、上官、冠带、进人口、竖柱上梁、经络、开市、纳财、修置产室、开渠、穿井、安碓硙、平治道涂、破屋坏垣、栽种、牧养、破土、安葬、启攒、布政事、出师、纳畜、颁诏、纳采、补垣、举正直、安抚边境、修仓库、整手足甲、缮城郭、鼓铸、裁制、宣政事、临政、酝酿、立券交易、招贤、开仓、入宅、祈福、解除、施恩、筑堤防、求嗣、塞穴、修饰垣墙、上册、庆赐、整容、修宫室、选将、营建、搬移
1988-01-26	一九八七 丁卯[兔]年	腊月小	初八	周二	无	腊八节-释迦如来成佛之辰	国际海关日	丁卯 癸丑 庚辰 辛巳	无	立春 (2, 4)	兔	水瓶座	祭祀、雪冤、覃恩、恤孤茕	出行、结婚姻、宴会、嫁娶、安床、剃头、修造、求医疗病、上表章、上官、冠带、进人口、竖柱上梁、经络、开市、纳财、修置产室、开渠、穿井、安碓硙、平治道涂、破屋坏垣、畋猎、栽种、牧养、破土、安葬、启攒、布政事、纳畜、取鱼、颁诏、纳采、举正直、补垣、安抚边境、修仓库、整手足甲、缮城郭、鼓铸、裁制、宣政事、临政、酝酿、立券交易、招贤、开仓、祈福、解除、施恩、筑堤防、求嗣、塞穴、修饰垣墙、上册、庆赐、整容、修宫室、选将、营建、出师、搬移
1988-01-27	一九八七 丁卯[兔]年	腊月小	初九	周三	无	无	无	丁卯 癸丑 辛巳 癸巳	无	立春 (2, 4)	兔	水瓶座	祭祀、结婚姻、宴会、上官、冠带、竖柱上梁、经络、牧养、布政事、纳畜、纳采、举正直、雪冤、裁制、临政、祈福、施恩、求嗣、覃恩、庆赐、恤孤茕、搬移	出行、上表章、修置产室、开渠、穿井、平治道涂、破屋坏垣、破土、安葬、启攒、取鱼、补垣、安抚边境、鼓铸、乘船渡水、筑堤防、塞穴、修饰垣墙、上册、选将、营建、出师
1988-01-28	一九八七 丁卯[兔]年	腊月小	初十	周四	无	无	无	丁卯 癸丑 壬午 乙巳	无	立春 (2, 4)	兔	水瓶座	宴会、嫁娶、沐浴、剃头、修造、求医疗病、上表章、上官、捕捉、畋猎、安葬、赴任、布政事、纳采、安抚边境、雪冤、整手足甲、临政、诉讼、入宅、解除、覃恩、庆赐、整容、恤孤茕、搬移	出行、结婚姻、安床、冠带、进人口、竖柱上梁、经络、开市、纳财、修置产室、开渠、穿井、安碓硙、平治道涂、破屋坏垣、栽种、牧养、启攒、纳畜、取鱼、补垣、举正直、苫盖、修仓库、缮城郭、乘船渡水、酝酿、立券交易、招贤、开仓、祈福、施恩、筑堤防、求嗣、修饰垣墙、上册、修宫室、选将、营建、出师
1988-01-29	一九八七 丁卯[兔]年	腊月小	十一	周五	无	无	无	丁卯 癸丑 癸未 丁巳	无	立春 (2, 4)	兔	水瓶座	雪冤、覃恩、恤孤茕	剃头、冠带、修置产室、开渠、穿井、安碓硙、平治道涂、伐木、启攒、补垣、整手足甲、鼓铸、开仓、筑堤防、塞穴、修饰垣墙、整容、修宫室、出师
1988-01-30	一九八七 丁卯[兔]年	腊月小	十二	周六	无	无	无	丁卯 癸丑 甲申 己巳	无	立春 (2, 4)	兔	水瓶座	祭祀、出行、沐浴、上表章、上官、竖柱上梁、经络、开市、纳财、扫舍宇、伐木、畋猎、牧养、安葬、纳畜、举正直、整手足甲、裁制、临政、酝酿、施恩、搬移	修置产室、开渠、穿井、安碓硙、平治道涂、破屋坏垣、修仓库、营建、筑堤防、出师、补垣、修饰垣墙
1988-01-31	一九八七 丁卯[兔]年	腊月小	十三	周日	无	无	无	丁卯 癸丑 乙酉 辛巳	无	立春 (2, 4)	兔	水瓶座	祭祀、沐浴、剃头、求医疗病、上表章、上官、入学、进人口、竖柱上梁、经络、开市、纳财、扫舍宇、牧养、安葬、颁诏、举正直、雪冤、整手足甲、裁制、宣政事、临政、酝酿、招贤、开仓、祈福、施恩、解除、求嗣、覃恩、上册、整容、恤孤茕	宴会、修置产室、开渠、穿井、平治道涂、破屋坏垣、畋猎、苫盖、取鱼、补垣、修饰垣墙
