1989-07-01	1989-5-28	29	定	六	己巳 庚午 壬戌	无	小暑 (7, 7)	建党节	无	无	嫁娶 纳采 订盟 祭祀 祈福 求嗣 开光 出火 出行 拆卸 修造 动土 进人口 入宅 移徙 安床 交易 立券 挂匾 纳财 入殓 安葬 启钻 除服 成服	掘井 破土
1989-07-02	1989-5-29	29	执	日	己巳 庚午 癸亥	无	小暑 (7, 7)	无	无	无	畋猎 捕捉 结网 取渔 祭祀 沐浴 馀事勿取	嫁娶 开市 安葬 启钻 行丧
1989-07-03	1989-6-1	30	破	一	己巳 庚午 甲子	无	小暑 (7, 7)	无	无	无	祭祀 破屋 坏垣 馀事勿取	移徙 入宅 开仓 出货财
1989-07-04	1989-6-2	30	危	二	己巳 庚午 乙丑	无	小暑 (7, 7)	无	无	无	祭祀 斋醮 塑绘 开光 出行 修造 动土 造畜稠 安床 放水 掘井 开池 开厕 结网 破土	出火 入宅
1989-07-05	1989-6-3	30	成	三	己巳 庚午 丙寅	无	小暑 (7, 7)	无	无	无	开市 交易 立券 挂匾 开光 解除 拆卸 动土 安床 修造 上梁 置产 栽种 破土 安葬	作灶 出火 祭祀 嫁娶 入宅
1989-07-06	1989-6-4	30	收	四	己巳 庚午 丁卯	无	小暑 (7, 7)	无	无	无	祭祀 结网 馀事勿取	入宅 出行 掘井 安葬
1989-07-07	1989-6-5	30	收	五	己巳 辛未 戊辰	小暑	大暑 (7, 23)	无	无	无	祭祀 作灶 纳财 捕捉	开市 破土
1989-07-08	1989-6-6	30	开	六	己巳 辛未 己巳	无	大暑 (7, 23)	无	无	无	嫁娶 开市 立券 祭祀 祈福 动土 移徙 入宅	造庙 安葬
1989-07-09	1989-6-7	30	闭	日	己巳 辛未 庚午	无	大暑 (7, 23)	无	无	无	补垣 塞穴 结网 入殓 除服 成服 移柩 安葬 启钻 馀事勿取	诸事不宜
1989-07-10	1989-6-8	30	建	一	己巳 辛未 辛未	无	大暑 (7, 23)	无	无	无	嫁娶 纳采 出行 祭祀 祈福 解除 移徙 入宅	动土 安葬
1989-07-11	1989-6-9	30	除	二	己巳 辛未 壬申	无	大暑 (7, 23)	无	无	无	嫁娶 祭祀 祈福 斋醮 治病 破土 安葬	开市 入宅
1989-07-12	1989-6-10	30	满	三	己巳 辛未 癸酉	无	大暑 (7, 23)	无	无	无	嫁娶 出行 开市 安床 入殓 启钻 安葬	祈福 动土 破土
1989-07-13	1989-6-11	30	平	四	己巳 辛未 甲戌	无	大暑 (7, 23)	无	无	无	嫁娶 祭祀 裁衣 结网 冠笄 沐浴	开仓 出货财 置产 安葬 动土 破土 掘井 栽种
1989-07-14	1989-6-12	30	定	五	己巳 辛未 乙亥	无	大暑 (7, 23)	无	无	无	入宅 移徙 安床 开光 祈福 求嗣 进人口 开市 交易 立券 出火 拆卸 修造 动土	嫁娶 破土 置产 栽种 安葬 修坟 行丧
1989-07-15	1989-6-13	30	执	六	己巳 辛未 丙子	无	大暑 (7, 23)	无	无	无	祭祀 解除 沐浴 整手足甲 入殓 移柩 破土 启钻 安葬	嫁娶 入宅 移徙 作灶 开市 交易 安门 栽种
1989-07-16	1989-6-14	30	破	日	己巳 辛未 丁丑	无	大暑 (7, 23)	无	无	无	破屋 坏垣 馀事勿取	诸事不宜
1989-07-17	1989-6-15	30	危	一	己巳 辛未 戊寅	无	大暑 (7, 23)	无	无	无	嫁娶 开光 出行 理发 作梁 出火 拆卸 修造 开市 交易 立券 挂匾 动土 入宅 移徙 安床 栽种	伐木 祭祀 纳畜
1989-07-18	1989-6-16	30	成	二	己巳 辛未 己卯	无	大暑 (7, 23)	无	无	无	嫁娶 开光 出行 祈福 求嗣 解除 拆卸 动土 修造 进人口 开市 交易 立券 挂匾 入宅 移徙 安床 栽种 纳畜 入殓 移柩 安葬	无
1989-07-19	1989-6-17	30	收	三	己巳 辛未 庚辰	无	大暑 (7, 23)	无	无	无	祭祀 作灶 纳财 栽种 纳畜 进人口	安葬 经络 修坟 破土 开市 安床 启钻 立碑
1989-07-20	1989-6-18	30	开	四	己巳 辛未 辛巳	无	大暑 (7, 23)	无	无	无	祭祀 祈福 求嗣 开光 开市 牧养 理发	嫁娶 出行 安葬 入殓 入宅 作灶 冠笄 上梁
1989-07-21	1989-6-19	30	闭	五	己巳 辛未 壬午	无	大暑 (7, 23)	无	无	无	祭祀 入殓 破土 除服 成服 移柩 启钻 安葬 谢土 馀事勿取	无
1989-07-22	1989-6-20	30	建	六	己巳 辛未 癸未	无	大暑 (7, 23)	无	无	无	祭祀 出行 交易 割蜜 造畜稠	嫁娶 作灶 安葬 动土 词讼 作梁 伐木 掘井 破土 移徙
1989-07-23	1989-6-21	30	除	日	己巳 辛未 甲申	大暑	立秋 (8, 7)	无	无	无	嫁娶 祭祀 祈福 求嗣 开光 出火 拆卸 修造 动土 进人口 开市 交易 立券 挂匾 入宅 移徙 栽种 纳畜 入殓 启钻 除服 成服	无
1989-07-24	1989-6-22	30	满	一	己巳 辛未 乙酉	无	立秋 (8, 7)	无	无	无	嫁娶 开光 解除 安床 牧养 理发 开市 入殓 启钻 移柩 安葬 扫舍	作灶 动土 上梁 栽种 入宅 移徙 修造 祈福
1989-07-25	1989-6-23	30	平	二	己巳 辛未 丙戌	无	立秋 (8, 7)	无	无	无	祭祀 解除 馀事勿取	诸事不宜
1989-07-26	1989-6-24	30	定	三	己巳 辛未 丁亥	无	立秋 (8, 7)	无	无	无	祭祀 祈福 求嗣 开光 伐木 出火 拆卸 入宅 安床 修造 动土 上梁 挂匾 纳畜	嫁娶 栽种 行丧 理发 修坟 作灶
1989-07-27	1989-6-25	30	执	四	己巳 辛未 戊子	无	立秋 (8, 7)	无	无	无	解除 祭祀 理发 入殓 安葬 破土	嫁娶 开市 出火 作灶 置产 斋醮 入宅 移徙 安门
1989-07-28	1989-6-26	30	破	五	己巳 辛未 己丑	无	立秋 (8, 7)	无	无	无	破屋 坏垣 馀事勿取	诸事不宜
1989-07-29	1989-6-27	30	危	六	己巳 辛未 庚寅	无	立秋 (8, 7)	无	无	无	开市 交易 立券 纳财 动土 开光 出行 嫁娶 纳采 订盟 入学 开仓 出货财 纳畜 牧养 栽种 破土 启钻 安葬 立碑	入宅 移徙 作灶 祭祀 谢土
1989-07-30	1989-6-28	30	成	日	己巳 辛未 辛卯	无	立秋 (8, 7)	无	无	无	嫁娶 纳采 订盟 祭祀 祈福 求嗣 开光 出火 出行 拆卸 修造 动土 进人口 开市 交易 立券 挂匾 入宅 移徙 安床 栽种 入殓 破土 谢土 安葬	掘井 伐木 纳畜 合寿木
1989-07-31	1989-6-29	30	收	一	己巳 辛未 壬辰	无	立秋 (8, 7)	无	无	无	祭祀 冠笄 作灶 交易 纳财 栽种 结网 纳畜 牧养 进人口	开渠 造船 安床 安葬 破土 出行 修坟 掘井 开市 开生坟
