1991-07-01	1991-5-20	30	满	一	辛未 甲午 壬申	无	小暑 (7, 7)	建党节	无	无	安机械 祭祀 祈福 求嗣 沐浴 解除 纳采 开市 修造 竖柱 上梁 开柱眼 安碓磑 归岫 补垣 塞穴 拆卸 放水 出火 扫舍 开生坟 合寿木 安葬 谢土 启钻 除服 成服	嫁娶 安床 作灶 动土 破土 造船
1991-07-02	1991-5-21	30	平	二	辛未 甲午 癸酉	无	小暑 (7, 7)	无	无	无	祭祀 沐浴 理发 整手足甲 修饰垣墙 平治道涂 馀事勿取	开市 入宅 出行 修造 词讼
1991-07-03	1991-5-22	30	定	三	辛未 甲午 甲戌	无	小暑 (7, 7)	无	无	无	嫁娶 纳采 祭祀 祈福 出行 立券 移徙 入宅 动土 破土 安葬	开光 作灶 盖屋 架马 开仓
1991-07-04	1991-5-23	30	执	四	辛未 甲午 乙亥	无	小暑 (7, 7)	无	无	无	纳采 订盟 冠笄 祭祀 祈福 斋醮 出行 修造 动土 移徙 入宅 安香 出火 拆卸 盖屋 起基 竖柱 上梁 定磉 安门 开池	嫁娶 开市 合寿木 安葬
1991-07-05	1991-5-24	30	破	五	辛未 甲午 丙子	无	小暑 (7, 7)	无	无	无	祭祀 沐浴 破屋 坏垣 馀事勿取	入宅 嫁娶 移徙
1991-07-06	1991-5-25	30	危	六	辛未 甲午 丁丑	无	小暑 (7, 7)	无	无	无	嫁娶 安机械 交易 出行 祭祀 祈福 求嗣 斋醮 塑绘 开光 合帐 裁衣 放水 开池 掘井	作灶 理发 造桥 行丧 安葬
1991-07-07	1991-5-26	30	危	日	辛未 乙未 戊寅	小暑	大暑 (7, 23)	无	无	无	嫁娶 开光 出行 理发 作梁 出火 拆卸 修造 开市 交易 立券 挂匾 动土 入宅 移徙 安床 栽种	伐木 祭祀 纳畜
1991-07-08	1991-5-27	30	成	一	辛未 乙未 己卯	无	大暑 (7, 23)	无	无	无	嫁娶 开光 出行 祈福 求嗣 解除 拆卸 动土 修造 进人口 开市 交易 立券 挂匾 入宅 移徙 安床 栽种 纳畜 入殓 移柩 安葬	无
1991-07-09	1991-5-28	30	收	二	辛未 乙未 庚辰	无	大暑 (7, 23)	无	无	无	祭祀 作灶 纳财 栽种 纳畜 进人口	安葬 经络 修坟 破土 开市 安床 启钻 立碑
1991-07-10	1991-5-29	30	开	三	辛未 乙未 辛巳	无	大暑 (7, 23)	无	无	无	祭祀 祈福 求嗣 开光 开市 牧养 理发	嫁娶 出行 安葬 入殓 入宅 作灶 冠笄 上梁
1991-07-11	1991-5-30	30	闭	四	辛未 乙未 壬午	无	大暑 (7, 23)	无	无	无	祭祀 入殓 破土 除服 成服 移柩 启钻 安葬 谢土 馀事勿取	无
1991-07-12	1991-6-1	29	建	五	辛未 乙未 癸未	无	大暑 (7, 23)	无	无	无	祭祀 出行 交易 割蜜 造畜稠	嫁娶 作灶 安葬 动土 词讼 作梁 伐木 掘井 破土 移徙
1991-07-13	1991-6-2	29	除	六	辛未 乙未 甲申	无	大暑 (7, 23)	无	无	无	嫁娶 祭祀 祈福 求嗣 开光 出火 拆卸 修造 动土 进人口 开市 交易 立券 挂匾 入宅 移徙 栽种 纳畜 入殓 启钻 除服 成服	无
1991-07-14	1991-6-3	29	满	日	辛未 乙未 乙酉	无	大暑 (7, 23)	无	无	无	嫁娶 开光 解除 安床 牧养 理发 开市 入殓 启钻 移柩 安葬 扫舍	作灶 动土 上梁 栽种 入宅 移徙 修造 祈福
1991-07-15	1991-6-4	29	平	一	辛未 乙未 丙戌	无	大暑 (7, 23)	无	无	无	祭祀 解除 馀事勿取	诸事不宜
1991-07-16	1991-6-5	29	定	二	辛未 乙未 丁亥	无	大暑 (7, 23)	无	无	无	祭祀 祈福 求嗣 开光 伐木 出火 拆卸 入宅 安床 修造 动土 上梁 挂匾 纳畜	嫁娶 栽种 行丧 理发 修坟 作灶
1991-07-17	1991-6-6	29	执	三	辛未 乙未 戊子	无	大暑 (7, 23)	无	无	无	解除 祭祀 理发 入殓 安葬 破土	嫁娶 开市 出火 作灶 置产 斋醮 入宅 移徙 安门
1991-07-18	1991-6-7	29	破	四	辛未 乙未 己丑	无	大暑 (7, 23)	无	无	无	破屋 坏垣 馀事勿取	诸事不宜
1991-07-19	1991-6-8	29	危	五	辛未 乙未 庚寅	无	大暑 (7, 23)	无	无	无	开市 交易 立券 纳财 动土 开光 出行 嫁娶 纳采 订盟 入学 开仓 出货财 纳畜 牧养 栽种 破土 启钻 安葬 立碑	入宅 移徙 作灶 祭祀 谢土
1991-07-20	1991-6-9	29	成	六	辛未 乙未 辛卯	无	大暑 (7, 23)	无	无	无	嫁娶 纳采 订盟 祭祀 祈福 求嗣 开光 出火 出行 拆卸 修造 动土 进人口 开市 交易 立券 挂匾 入宅 移徙 安床 栽种 入殓 破土 谢土 安葬	掘井 伐木 纳畜 合寿木
1991-07-21	1991-6-10	29	收	日	辛未 乙未 壬辰	无	大暑 (7, 23)	无	无	无	祭祀 冠笄 作灶 交易 纳财 栽种 结网 纳畜 牧养 进人口	开渠 造船 安床 安葬 破土 出行 修坟 掘井 开市 开生坟
1991-07-22	1991-6-11	29	开	一	辛未 乙未 癸巳	无	大暑 (7, 23)	无	无	无	嫁娶 订盟 祭祀 祈福 求嗣 纳采 裁衣 冠笄 开光 安床 作梁 修造 动土 作灶 起基 上梁 盖屋 纳畜 牧养	移徙 栽种 出行 行丧 破土 安葬 词讼
1991-07-23	1991-6-12	29	闭	二	辛未 乙未 甲午	大暑	立秋 (8, 8)	无	无	无	经络 祭祀 沐浴 补垣 塞穴 除服 成服 移柩 入殓 启钻 立碑	开光 治病 嫁娶 掘井 破土 安葬
1991-07-24	1991-6-13	29	建	三	辛未 乙未 乙未	无	立秋 (8, 8)	无	无	无	嫁娶 祭祀 出行 裁衣 冠笄 交易 雕刻 纳财 造畜稠 造车器 教牛马	移徙 入宅 栽种 动土 破土 作灶 安葬 行丧 伐木 上梁
1991-07-25	1991-6-14	29	除	四	辛未 乙未 丙申	无	立秋 (8, 8)	无	无	无	修造 动土 安机械 祭祀 沐浴 解除 拆卸 治病 作灶 盖屋 起基 开池 扫舍 造畜稠 开生坟 合寿木 安葬 破土 启钻 移柩 入殓 立碑	开市 入宅 出行 安床
1991-07-26	1991-6-15	29	满	五	辛未 乙未 丁酉	无	立秋 (8, 8)	无	无	无	嫁娶 纳采 订盟 造车器 开光 出行 拆卸 起基 安床 除服 成服 开市 交易 立券 栽种 牧养 入殓 移柩 启钻	上梁 入宅 修造 动土 破土 祭祀 祈福 斋醮
1991-07-27	1991-6-16	29	平	六	辛未 乙未 戊戌	无	立秋 (8, 8)	无	无	无	祭祀 嫁娶 畋猎 结网	动土 破土 治病 开渠
1991-07-28	1991-6-17	29	定	日	辛未 乙未 己亥	无	立秋 (8, 8)	无	无	无	纳采 订盟 会亲友 入学 祭祀 祈福 求嗣 开光 出行 解除 理发 动土 起基 开市 交易 立券 纳财 造仓 栽种 纳畜 牧养	嫁娶 作灶 出火 置产 入宅 安葬
1991-07-29	1991-6-18	29	执	一	辛未 乙未 庚子	无	立秋 (8, 8)	无	无	无	祭祀 祈福 解除 整手足甲 安床 沐浴 入殓 移柩 破土 启钻 安葬 谢土	嫁娶 斋醮 开市 出火 入宅 移徙 出行 作灶 安门 伐木
1991-07-30	1991-6-19	29	破	二	辛未 乙未 辛丑	无	立秋 (8, 8)	无	无	无	破屋 坏垣 解除 馀事勿取	嫁娶 安葬
1991-07-31	1991-6-20	29	危	三	辛未 乙未 壬寅	无	立秋 (8, 8)	无	无	无	嫁娶 开市 立券 移徙 入宅 安机械 会亲友 经络 安门 安床 挂匾 拆卸 开仓 出货财 开池 栽种 纳畜 牧养 破土 安葬 启钻 移柩 入殓 立碑	祭祀 祈福 探病 谢土 造桥
