1994-04-01	1994-2-21	30	满	五	甲戌 丁卯 丁巳	无	清明 (4, 5)	愚人节	无	无	塑绘 开光 订盟 纳采 裁衣 合帐 冠笄 安机械 会亲友 纳财 开市 立券 交易 安床 竖柱 上梁 结网 栽种 解除 经络	作灶 出行 入宅 安葬
1994-04-02	1994-2-22	30	平	六	甲戌 丁卯 戊午	无	清明 (4, 5)	无	无	无	祭祀 嫁娶 纳婿 除服 成服 入殓 移柩	动土 作灶 入宅 开光 安床
1994-04-03	1994-2-23	30	定	日	甲戌 丁卯 己未	无	清明 (4, 5)	无	无	无	祈福 求嗣 开光 塑绘 斋醮 订盟 纳采 嫁娶 拆卸 安床 入宅 安香 移柩 修坟 安葬 谢土 栽种 解除 冠笄 裁衣 移徙 修造 动土 竖柱 放水 启钻 立碑	赴任
1994-04-04	1994-2-24	30	执	一	甲戌 丁卯 庚申	无	清明 (4, 5)	无	无	无	祭祀 解除 入殓 除服 成服 移柩 启钻 安葬 修坟 立碑 谢土 沐浴 扫舍 捕捉 取渔 结网 畋猎 理发	安床 嫁娶 作灶 入宅
1994-04-05	1994-2-25	30	执	二	甲戌 戊辰 辛酉	清明	谷雨 (4, 20)	无	无	无	祭祀 解除 入殓 移柩 启钻 安葬 整手足甲 捕捉 畋猎 取渔 除服 成服 扫舍 谢土 斋醮	动土 破土
1994-04-06	1994-2-26	30	破	三	甲戌 戊辰 壬戌	无	谷雨 (4, 20)	无	无	无	祭祀 沐浴 解除 破屋 坏垣 求医 治病 馀事勿取	嫁娶 开市
1994-04-07	1994-2-27	30	危	四	甲戌 戊辰 癸亥	无	谷雨 (4, 20)	无	无	无	沐浴 塞穴 畋猎 结网 取渔 扫舍 馀事勿取	祈福 安葬
1994-04-08	1994-2-28	30	成	五	甲戌 戊辰 甲子	无	谷雨 (4, 20)	无	无	无	开市 交易 立券 挂匾 祭祀 开光 祈福 求嗣 安床 解除 修造 安葬	纳采 问名 订盟 嫁娶 入宅 开仓 出火 动土 破土 纳畜 伐木
1994-04-09	1994-2-29	30	收	六	甲戌 戊辰 乙丑	无	谷雨 (4, 20)	无	无	无	祭祀 修门 取渔 纳财 纳畜 馀事勿取	嫁娶 入宅
1994-04-10	1994-2-30	30	开	日	甲戌 戊辰 丙寅	无	谷雨 (4, 20)	无	无	无	安香 出火 纳采 订盟 嫁娶 开市 立券 交易 挂匾 开光 出行 解除 安床 栽种 置产 拆卸 修造 动土	作灶 安葬 祭祀 入殓
1994-04-11	1994-3-1	30	闭	一	甲戌 戊辰 丁卯	无	谷雨 (4, 20)	无	无	无	祭祀 出行 修造 动土 合帐 造畜稠 安床 移徙 入殓 移柩 破土 启钻 安葬 开生坟 合寿木 补垣 塞穴	入宅 作灶 理发 开光 安门
1994-04-12	1994-3-2	30	建	二	甲戌 戊辰 戊辰	无	谷雨 (4, 20)	无	无	无	祭祀 修饰垣墙 馀事勿取	开光 修造 动土 破土
1994-04-13	1994-3-3	30	除	三	甲戌 戊辰 己巳	无	谷雨 (4, 20)	无	无	无	嫁娶 祭祀 祈福 求嗣 斋醮 开光 出火 移徙 入宅 竖柱 上梁 会亲友 盖屋 起基 治病 安门 造车器 掘井 开池	纳采 出行 修坟 安葬 开市 立券 作灶
1994-04-14	1994-3-4	30	满	四	甲戌 戊辰 庚午	无	谷雨 (4, 20)	无	无	无	祭祀 塑绘 开光 纳采 嫁娶 开市 出行 会亲友 安床 结网 除服 成服 启钻 安葬 移柩	祈福 入宅 盖屋 动土 破土 探病
1994-04-15	1994-3-5	30	平	五	甲戌 戊辰 辛未	无	谷雨 (4, 20)	无	无	无	祭祀 作灶 平治道涂 馀事勿取	安床 入宅 安碓磑 栽种
1994-04-16	1994-3-6	30	定	六	甲戌 戊辰 壬申	无	谷雨 (4, 20)	无	无	无	祭祀 祈福 求嗣 斋醮 沐浴 纳畜 入殓 破土 安葬	移徙 入宅 嫁娶 出行 安床
1994-04-17	1994-3-7	30	执	日	甲戌 戊辰 癸酉	无	谷雨 (4, 20)	无	无	无	纳采 祭祀 祈福 求嗣 斋醮 出行 起基 盖屋 定磉 安门 入殓 安葬	嫁娶 开市 纳财 出火
1994-04-18	1994-3-8	30	破	一	甲戌 戊辰 甲戌	无	谷雨 (4, 20)	无	无	无	祭祀 沐浴 解除 求医 治病 破屋 坏垣 馀事勿取	祈福 斋醮 开市 安葬
1994-04-19	1994-3-9	30	危	二	甲戌 戊辰 乙亥	无	谷雨 (4, 20)	无	无	无	沐浴 捕捉 畋猎 结网 取渔	祭祀 嫁娶 入宅 作灶 安葬
1994-04-20	1994-3-10	30	成	三	甲戌 戊辰 丙子	谷雨	立夏 (5, 6)	无	无	无	祭祀 祈福 求嗣 斋醮 纳采 订盟 开光 竖柱 上梁 开仓 出货财 盖屋 起基 定磉 安门 诸事不宜 破土 入殓 启钻 谢土	出火 嫁娶 开市
1994-04-21	1994-3-11	30	收	四	甲戌 戊辰 丁丑	无	立夏 (5, 6)	无	无	无	祭祀 捕捉 解除 馀事勿取	嫁娶 安葬
1994-04-22	1994-3-12	30	开	五	甲戌 戊辰 戊寅	无	立夏 (5, 6)	无	无	无	纳采 嫁娶 出行 开市 立券 纳畜 牧养 出火 移徙 入宅	祈福 动土 破土 安葬 入殓
1994-04-23	1994-3-13	30	闭	六	甲戌 戊辰 己卯	无	立夏 (5, 6)	无	无	无	祭祀 祈福 求嗣 斋醮 冠笄 作灶 纳财 交易	开光 嫁娶 掘井 安葬 安门 探病
1994-04-24	1994-3-14	30	建	日	甲戌 戊辰 庚辰	无	立夏 (5, 6)	无	无	无	祭祀 解除 教牛马 出行 馀事勿取	动土 破土 行丧 开光 作梁 安葬 探病
1994-04-25	1994-3-15	30	除	一	甲戌 戊辰 辛巳	无	立夏 (5, 6)	无	无	无	沐浴 斋醮 解除 求医 治病 会亲友 造畜稠 栽种 理发 扫舍	开市 嫁娶 移徙 入宅 掘井 安葬
1994-04-26	1994-3-16	30	满	二	甲戌 戊辰 壬午	无	立夏 (5, 6)	无	无	无	求嗣 出行 解除 订盟 纳采 嫁娶 会亲友 进人口 安床 开市 交易 纳畜 牧养 入殓 除服 成服 移柩 安葬 启钻	祈福 修造 动土 破土 谢土
1994-04-27	1994-3-17	30	平	三	甲戌 戊辰 癸未	无	立夏 (5, 6)	无	无	无	祭祀 作灶 平治道涂 馀事勿取	嫁娶 安葬 动土 安床 治病
1994-04-28	1994-3-18	30	定	四	甲戌 戊辰 甲申	无	立夏 (5, 6)	无	无	无	造车器 祭祀 祈福 求嗣 斋醮 开市 交易 安机械 雕刻 开光 盖屋 合脊 起基 定磉 安门 纳畜 安葬 开生坟 立碑 谢土	入宅 动土 开仓 出货财
1994-04-29	1994-3-19	30	执	五	甲戌 戊辰 乙酉	无	立夏 (5, 6)	无	无	无	祭祀 祈福 开光 求嗣 斋醮 纳采 订盟 求医 治病 起基 定磉 造船 取渔 解除 安葬 启钻 谢土 入殓	开市 动土 掘井 开池
1994-04-30	1994-3-20	30	破	六	甲戌 戊辰 丙戌	无	立夏 (5, 6)	无	无	无	祭祀 沐浴 破屋 坏垣 求医 治病 解除 馀事勿取	嫁娶 开市 交易 入宅 安葬
