1995-02-01	一九九五 乙亥[猪]年	正月小	初二	周三	无	无	无	乙亥 丁丑 癸亥 丁巳	无	立春 (2, 4)	猪	水瓶座	沐浴、入学、雪冤、恤孤茕、覃恩	祭祀、出行、结婚姻、宴会、嫁娶、安床、剃头、修造、求医疗病、上表章、上官、冠带、进人口、竖柱上梁、经络、开市、纳财、修置产室、开渠、穿井、安碓硙、平治道涂、破屋坏垣、伐木、畋猎、栽种、牧养、破土、安葬、启攒、布政事、出师、纳畜、取鱼、颁诏、纳采、补垣、举正直、安抚边境、修仓库、整手足甲、缮城郭、鼓铸、裁制、宣政事、临政、酝酿、立券交易、招贤、开仓、祈福、解除、施恩、筑堤防、求嗣、塞穴、修饰垣墙、上册、庆赐、整容、修宫室、选将、营建、远回、搬移
1995-02-02	一九九五 乙亥[猪]年	正月小	初三	周四	无	无	世界湿地日	乙亥 丁丑 甲子 己巳	无	立春 (2, 4)	猪	水瓶座	祭祀、沐浴、经络、安葬、雪冤、裁制、酝酿、塞穴、覃恩、恤孤茕	出行、结婚姻、宴会、嫁娶、安床、修造、求医疗病、上表章、上官、冠带、进人口、竖柱上梁、开市、纳财、修置产室、开渠、穿井、安碓硙、平治道涂、破屋坏垣、畋猎、栽种、牧养、破土、布政事、纳畜、取鱼、颁诏、纳采、举正直、补垣、安抚边境、修仓库、缮城郭、宣政事、临政、针刺、立券交易、招贤、开仓、祈福、解除、施恩、筑堤防、求嗣、修饰垣墙、上册、庆赐、修宫室、选将、营建、远回、出师、疗目、搬移
1995-02-03	一九九五 乙亥[猪]年	正月小	初四	周五	无	无	无	乙亥 丁丑 乙丑 辛巳	无	立春 (2, 4)	猪	水瓶座	宴会、经络、纳财、牧养、赴任、布政事、纳畜、举正直、雪冤、裁制、酝酿、入宅、施恩、覃恩、庆赐、恤孤茕	剃头、冠带、修置产室、开渠、穿井、平治道涂、破屋坏垣、伐木、捕捉、畋猎、破土、启攒、整容、整手足甲、取鱼、筑堤防、补垣、修饰垣墙
1995-02-04	一九九五 乙亥[猪]年	正月小	初五	周六	无	无	世界抗癌日	乙亥 戊寅 丙寅 癸巳	立春	雨水 (2, 19)	猪	水瓶座	宴会、经络、纳财、牧养、布政事、纳畜、举正直、雪冤、裁制、酝酿、立券交易、施恩、覃恩、庆赐、恤孤茕	祭祀、剃头、修置产室、开渠、穿井、平治道涂、破屋坏垣、伐木、捕捉、畋猎、乘船渡水、整容、整手足甲、取鱼、筑堤防、补垣、修饰垣墙
1995-02-05	一九九五 乙亥[猪]年	正月小	初六	周日	无	无	无	乙亥 戊寅 丁卯 乙巳	无	雨水 (2, 19)	猪	水瓶座	祭祀、出行、结婚姻、宴会、嫁娶、沐浴、修造、求医疗病、上表章、上官、竖柱上梁、纳财、扫舍宇、栽种、牧养、安葬、出师、纳畜、颁诏、纳采、举正直、安抚边境、修仓库、雪冤、整手足甲、缮城郭、裁制、宣政事、临政、立券交易、招贤、开仓、祈福、解除、施恩、求嗣、覃恩、上册、庆赐、恤孤茕、修宫室、选将、营建、搬移	剃头、冠带、修置产室、穿井、畋猎、乘船渡水、取鱼、筑堤防
1995-02-06	一九九五 乙亥[猪]年	正月小	初七	周一	无	无	无	乙亥 戊寅 戊辰 丁巳	无	雨水 (2, 19)	猪	水瓶座	宴会、上表章、竖柱上梁、经络、安葬、布政事、雪冤、缮城郭、裁制、覃恩、上册、庆赐、恤孤茕、修宫室	祭祀、结婚姻、嫁娶、上官、栽种、安抚边境、乘船渡水、鼓铸、取鱼、招贤、选将、施恩、出师、纳采、举正直
1995-02-07	一九九五 乙亥[猪]年	正月小	初八	周二	无	五殿阎罗天子诞	京汉铁路罢工纪念	乙亥 戊寅 己巳 己巳	无	雨水 (2, 19)	猪	水瓶座	平治道涂	祭祀、出行、结婚姻、宴会、嫁娶、安床、剃头、修造、求医疗病、上表章、上官、冠带、进人口、竖柱上梁、经络、开市、纳财、修置产室、开渠、穿井、安碓硙、破屋坏垣、栽种、牧养、破土、安葬、启攒、布政事、出师、纳畜、颁诏、补垣、纳采、举正直、安抚边境、修仓库、整手足甲、缮城郭、鼓铸、裁制、宣政事、临政、酝酿、立券交易、招贤、开仓、祈福、解除、施恩、筑堤防、求嗣、塞穴、修饰垣墙、上册、庆赐、整容、修宫室、选将、营建、搬移
1995-02-08	一九九五 乙亥[猪]年	正月小	初九	周三	无	玉皇上帝诞	无	乙亥 戊寅 庚午 辛巳	无	雨水 (2, 19)	猪	水瓶座	祭祀、结婚姻、宴会、上官、冠带、进人口、竖柱上梁、牧养、纳畜、纳采、举正直、裁制、临政、酝酿、入宅、祈福、施恩、求嗣、庆赐、搬移	修置产室、开渠、穿井、平治道涂、破屋坏垣、苫盖、安抚边境、选将、营建、筑堤防、出师、补垣、修饰垣墙
1995-02-09	一九九五 乙亥[猪]年	正月小	初十	周四	无	无	无	乙亥 戊寅 辛未 癸巳	无	雨水 (2, 19)	猪	水瓶座	祭祀、出行、结婚姻、宴会、嫁娶、上表章、上官、竖柱上梁、捕捉、栽种、牧养、破土、安葬、颁诏、纳采、举正直、安抚边境、雪冤、缮城郭、裁制、宣政事、临政、招贤、祈福、解除、施恩、求嗣、覃恩、上册、庆赐、恤孤茕、选将、营建、搬移	畋猎、取鱼
1995-02-10	一九九五 乙亥[猪]年	正月小	十一	周五	无	无	国际气象节	乙亥 戊寅 壬申 乙巳	无	雨水 (2, 19)	猪	水瓶座	祭祀、沐浴、求医疗病、扫舍宇、破屋坏垣、雪冤、解除、覃恩、恤孤茕	冠带、修置产室、开渠、穿井、安碓硙、伐木、畋猎、启攒、布政事、修宫室、鼓铸、取鱼、开仓、筑堤防、塞穴、补垣、修饰垣墙
1995-02-11	一九九五 乙亥[猪]年	正月小	十二	周六	无	无	无	乙亥 戊寅 癸酉 丁巳	无	雨水 (2, 19)	猪	水瓶座	祭祀、沐浴、扫舍宇、雪冤、恤孤茕、整手足甲	出行、结婚姻、宴会、嫁娶、安床、剃头、修造、求医疗病、上表章、上官、冠带、进人口、竖柱上梁、开市、纳财、修置产室、栽种、牧养、安葬、纳畜、纳采、举正直、安抚边境、修仓库、缮城郭、临政、立券交易、招贤、开仓、祈福、解除、施恩、筑堤防、求嗣、上册、庆赐、整容、修宫室、选将、营建、出师、搬移
1995-02-12	一九九五 乙亥[猪]年	正月小	十三	周日	无	无	无	乙亥 戊寅 甲戌 己巳	无	雨水 (2, 19)	猪	水瓶座	入学、赴任、诉讼	出行、结婚姻、宴会、嫁娶、安床、剃头、修造、求医疗病、上表章、上官、冠带、进人口、竖柱上梁、经络、开市、立券、纳财、修置产室、开渠、穿井、安碓硙、平治道涂、破屋坏垣、伐木、畋猎、栽种、牧养、破土、安葬、启攒、布政事、出师、纳畜、颁诏、补垣、纳采、举正直、开张、安抚边境、修仓库、整手足甲、缮城郭、鼓铸、裁制、宣政事、临政、酝酿、立券交易、招贤、开仓、祈福、解除、施恩、筑堤防、求嗣、塞穴、修饰垣墙、上册、庆赐、整容、修宫室、选将、营建、远回、搬移
1995-02-13	一九九五 乙亥[猪]年	正月小	十四	周一	无	无	无	乙亥 戊寅 乙亥 辛巳	无	雨水 (2, 19)	猪	水瓶座	祭祀、出行、结婚姻、宴会、沐浴、修造、进人口、经络、开市、纳财、捕捉、栽种、牧养、赴任、纳畜、纳采、酝酿、立券交易、开仓、祈福、入宅、搬移	嫁娶、剃头、求医疗病、上表章、上官、冠带、竖柱上梁、修置产室、开渠、穿井、安碓硙、破屋坏垣、破土、安葬、启攒、布政事、出师、颁诏、补垣、举正直、安抚边境、修仓库、整手足甲、缮城郭、鼓铸、裁制、宣政事、临政、乘船渡水、招贤、解除、施恩、筑堤防、塞穴、求嗣、修饰垣墙、上册、庆赐、整容、修宫室、选将、营建
1995-02-14	一九九五 乙亥[猪]年	正月小	十五	周二	无	元宵节	情人节	乙亥 戊寅 丙子 癸巳	无	雨水 (2, 19)	猪	水瓶座	祭祀、出行、结婚姻、宴会、嫁娶、沐浴、修造、求医疗病、上表章、上官、入学、竖柱上梁、开市、纳财、修置产室、开渠、穿井、安碓硙、栽种、牧养、纳畜、颁诏、纳采、举正直、安抚边境、修仓库、雪冤、缮城郭、裁制、宣政事、临政、招贤、开仓、祈福、解除、施恩、求嗣、覃恩、上册、庆赐、恤孤茕、修宫室、选将、营建、出师、搬移	剃头、冠带、破屋坏垣、伐木、畋猎、苫盖、整容、布政事、整手足甲、鼓铸、取鱼、入宅、筑堤防、塞穴、补垣、修饰垣墙
1995-02-15	一九九五 乙亥[猪]年	正月小	十六	周三	无	无	无	乙亥 戊寅 丁丑 乙巳	无	雨水 (2, 19)	猪	水瓶座	祭祀、雪冤、覃恩、恤孤茕	出行、结婚姻、宴会、嫁娶、安床、剃头、修造、求医疗病、上表章、上官、冠带、进人口、竖柱上梁、经络、开市、纳财、修置产室、开渠、穿井、安碓硙、平治道涂、破屋坏垣、畋猎、栽种、牧养、破土、安葬、布政事、出师、纳畜、取鱼、颁诏、纳采、补垣、举正直、安抚边境、修仓库、整手足甲、缮城郭、鼓铸、裁制、宣政事、临政、乘船渡水、针刺、酝酿、立券交易、招贤、开仓、祈福、解除、施恩、筑堤防、求嗣、塞穴、修饰垣墙、上册、庆赐、整容、修宫室、选将、营建、远回、疗目、搬移
1995-02-16	一九九五 乙亥[猪]年	正月小	十七	周四	无	无	无	乙亥 戊寅 戊寅 丁巳	无	雨水 (2, 19)	猪	水瓶座	宴会、经络、纳财、牧养、纳畜、举正直、雪冤、裁制、酝酿、立券交易、施恩、覃恩、庆赐、恤孤茕	祭祀、剃头、修置产室、开渠、穿井、平治道涂、破屋坏垣、伐木、捕捉、畋猎、启攒、整容、整手足甲、取鱼、开仓、筑堤防、补垣、修饰垣墙
1995-02-17	一九九五 乙亥[猪]年	正月小	十八	周五	无	无	无	乙亥 戊寅 己卯 己巳	无	雨水 (2, 19)	猪	水瓶座	出行、结婚姻、宴会、沐浴、剃头、求医疗病、上官、扫舍宇、破土、布政事、安抚边境、雪冤、整手足甲、临政、立券交易、解除、覃恩、庆赐、整容、恤孤茕、选将、出师	嫁娶、安床、修造、上表章、冠带、进人口、竖柱上梁、开市、纳财、修置产室、穿井、栽种、牧养、纳畜、取鱼、纳采、修仓库、缮城郭、乘船渡水、招贤、开仓、祈福、筑堤防、求嗣、上册、修宫室、营建、搬移
1995-02-18	一九九五 乙亥[猪]年	正月小	十九	周六	无	无	无	乙亥 戊寅 庚辰 辛巳	无	雨水 (2, 19)	猪	水瓶座	宴会、上表章、竖柱上梁、布政事、雪冤、缮城郭、裁制、入宅、覃恩、上册、庆赐、恤孤茕、修宫室、搬移	祭祀、结婚姻、上官、栽种、乘船渡水、出师、整手足甲、鼓铸、取鱼、招贤、施恩、举正直
1995-02-19	一九九五 乙亥[猪]年	正月小	二十	周日	无	无	邓小平逝世纪念日	乙亥 戊寅 辛巳 癸巳	雨水	惊蛰 (3, 6)	猪	双鱼座	平治道涂、雪冤、覃恩、恤孤茕	出行、剃头、冠带、修置产室、开渠、穿井、安碓硙、破屋坏垣、畋猎、破土、启攒、取鱼、补垣、整手足甲、鼓铸、开仓、筑堤防、塞穴、整容、修宫室
1995-02-20	一九九五 乙亥[猪]年	正月小	廿一	周一	无	无	无	乙亥 戊寅 壬午 乙巳	无	惊蛰 (3, 6)	猪	双鱼座	祭祀、结婚姻、宴会、嫁娶、修造、上官、冠带、进人口、竖柱上梁、经络、安碓硙、牧养、纳畜、颁诏、纳采、举正直、雪冤、缮城郭、裁制、宣政事、临政、酝酿、招贤、祈福、施恩、求嗣、覃恩、庆赐、恤孤茕、修宫室、营建、搬移	修置产室、开渠、穿井、畋猎、苫盖、整手足甲、取鱼
1995-02-21	一九九五 乙亥[猪]年	正月小	廿二	周二	无	无	国际母语日	乙亥 戊寅 癸未 丁巳	无	惊蛰 (3, 6)	猪	双鱼座	宴会、捕捉、破土、庆赐、布政事、雪冤、恤孤茕、取鱼、覃恩	结婚姻、嫁娶、修造、求医疗病、安抚边境、纳畜、选将、出师
1995-02-22	一九九五 乙亥[猪]年	正月小	廿三	周三	无	无	无	乙亥 戊寅 甲申 己巳	无	惊蛰 (3, 6)	猪	双鱼座	祭祀、沐浴、扫舍宇、破屋坏垣、赴任、诉讼、解除	结婚姻、宴会、嫁娶、安床、修造、上官、冠带、进人口、竖柱上梁、经络、开市、纳财、修置产室、开渠、穿井、安碓硙、伐木、栽种、牧养、启攒、布政事、纳畜、颁诏、纳采、补垣、举正直、安抚边境、修仓库、缮城郭、鼓铸、宣政事、临政、乘船渡水、酝酿、立券交易、招贤、开仓、筑堤防、施恩、求嗣、塞穴、修饰垣墙、上册、庆赐、修宫室、选将、营建、出师
1995-02-23	一九九五 乙亥[猪]年	正月小	廿四	周四	无	无	无	乙亥 戊寅 乙酉 辛巳	无	惊蛰 (3, 6)	猪	双鱼座	祭祀、出行、嫁娶、安床、沐浴、剃头、修造、求医疗病、上官、扫舍宇、安葬、赴任、取鱼、纳采、安抚边境、雪冤、整手足甲、临政、祈福、入宅、解除、整容、恤孤茕、选将、搬移	结婚姻、宴会、上表章、冠带、竖柱上梁、修置产室、栽种、牧养、纳畜、举正直、修仓库、缮城郭、招贤、开仓、筑堤防、施恩、求嗣、上册、庆赐、修宫室、营建、出师
1995-02-24	一九九五 乙亥[猪]年	正月小	廿五	周五	无	无	第三世界青年日	乙亥 戊寅 丙戌 癸巳	无	惊蛰 (3, 6)	猪	双鱼座	祭祀、出行、结婚姻、宴会、嫁娶、修造、求医疗病、上表章、上官、入学、进人口、竖柱上梁、经络、开市、纳财、安碓硙、栽种、牧养、安葬、纳畜、纳采、安抚边境、修仓库、雪冤、缮城郭、裁制、临政、酝酿、立券交易、开仓、祈福、筑堤防、解除、求嗣、覃恩、上册、庆赐、恤孤茕、修宫室、选将、营建、出师、搬移	剃头、冠带、修置产室、开渠、穿井、平治道涂、破屋坏垣、伐木、畋猎、破土、启攒、布政事、取鱼、补垣、整手足甲、鼓铸、塞穴、修饰垣墙、整容、远回
1995-02-25	一九九五 乙亥[猪]年	正月小	廿六	周六	无	无	无	乙亥 戊寅 丁亥 乙巳	无	惊蛰 (3, 6)	猪	双鱼座	祭祀、出行、结婚姻、宴会、沐浴、修造、求医疗病、上表章、上官、进人口、竖柱上梁、经络、开市、纳财、捕捉、栽种、牧养、安葬、出师、纳畜、颁诏、纳采、举正直、安抚边境、修仓库、雪冤、缮城郭、裁制、宣政事、临政、酝酿、立券交易、招贤、开仓、祈福、解除、施恩、求嗣、覃恩、上册、庆赐、恤孤茕、修宫室、选将、营建、搬移	嫁娶、剃头、冠带、修置产室、开渠、穿井、安碓硙、破屋坏垣、畋猎、破土、启攒、布政事、取鱼、补垣、整手足甲、鼓铸、筑堤防、塞穴、修饰垣墙、整容
1995-02-26	一九九五 乙亥[猪]年	正月小	廿七	周日	无	无	无	乙亥 戊寅 戊子 丁巳	无	惊蛰 (3, 6)	猪	双鱼座	沐浴、入学、雪冤、覃恩、恤孤茕	结婚姻、冠带、进人口、竖柱上梁、经络、伐木、畋猎、破土、安葬、启攒、布政事、取鱼、纳采、补垣、酝酿、开仓、入宅、筑堤防、塞穴、营建
1995-02-27	一九九五 乙亥[猪]年	正月小	廿八	周一	无	无	无	乙亥 戊寅 己丑 己巳	无	惊蛰 (3, 6)	猪	双鱼座	诸事不宜	诸事不宜
1995-02-28	一九九五 乙亥[猪]年	正月小	廿九	周二	无	无	无	乙亥 戊寅 庚寅 辛巳	无	惊蛰 (3, 6)	猪	双鱼座	宴会、纳财、纳畜、举正直、雪冤、裁制、酝酿、立券交易、入宅、施恩、覃恩、庆赐、恤孤茕	祭祀、剃头、求医疗病、上表章、修置产室、开渠、穿井、平治道涂、破屋坏垣、伐木、捕捉、畋猎、栽种、启攒、取鱼、补垣、整手足甲、开仓、祈福、解除、筑堤防、求嗣、修饰垣墙、上册、整容、营建
