1998-02-01	一九九八 戊寅[虎]年	正月大	初五	周日	戊寅 癸丑 己卯 己巳	无	立春 (2, 4)	无	无	无	虎	水瓶座	覃恩、恤孤茕、雪冤	祭祀、出行、结婚姻、宴会、嫁娶、安床、剃头、修造、求医疗病、上表章、上官、冠带、进人口、竖柱上梁、经络、开市、纳财、修置产室、开渠、穿井、安碓硙、平治道涂、破屋坏垣、栽种、牧养、破土、安葬、启攒、搬移、祈福、缮城郭、裁制、上册、开仓、修宫室、颁诏、求嗣、庆赐、补垣、招贤、整容、布政事、宣政事、安抚边境、入宅、施恩、立券交易、修饰垣墙、临政、纳畜、举正直、解除、塞穴、乘船渡水、修仓库、酝酿、选将、鼓铸、营建、纳采、整手足甲、出师、筑堤防
1998-02-02	一九九八 戊寅[虎]年	正月大	初六	周一	戊寅 癸丑 庚辰 辛巳	无	立春 (2, 4)	无	无	世界湿地日	虎	水瓶座	祭祀、覃恩、恤孤茕、雪冤	出行、结婚姻、宴会、嫁娶、安床、剃头、修造、求医疗病、上表章、上官、冠带、进人口、竖柱上梁、经络、开市、纳财、修置产室、开渠、穿井、安碓硙、平治道涂、破屋坏垣、畋猎、栽种、牧养、破土、安葬、启攒、搬移、祈福、缮城郭、裁制、上册、开仓、修宫室、颁诏、求嗣、庆赐、补垣、取鱼、招贤、整容、布政事、宣政事、安抚边境、施恩、立券交易、修饰垣墙、临政、纳畜、举正直、解除、塞穴、修仓库、酝酿、选将、鼓铸、营建、纳采、整手足甲、出师、筑堤防
1998-02-03	一九九八 戊寅[虎]年	正月大	初七	周二	戊寅 癸丑 辛巳 癸巳	无	立春 (2, 4)	无	无	无	虎	水瓶座	宴会、冠带、竖柱上梁、经络、牧养、祈福、裁制、覃恩、庆赐、恤孤茕、雪冤、求嗣、布政事、施恩、临政、纳畜、举正直、纳采	出行、上表章、修置产室、开渠、穿井、平治道涂、破屋坏垣、破土、安葬、启攒、上册、补垣、取鱼、安抚边境、修饰垣墙、塞穴、乘船渡水、选将、鼓铸、营建、出师、筑堤防
1998-02-04	一九九八 戊寅[虎]年	正月大	初八	周三	戊寅 甲寅 壬午 乙巳	立春	雨水 (2, 19)	无	五殿阎罗天子诞	世界抗癌日	虎	水瓶座	祭祀、结婚姻、宴会、嫁娶、上官、冠带、进人口、竖柱上梁、经络、安碓硙、牧养、搬移、祈福、缮城郭、裁制、修宫室、颁诏、求嗣、覃恩、恤孤茕、雪冤、庆赐、招贤、宣政事、施恩、临政、纳畜、举正直、酝酿、营建、纳采	修置产室、开渠、穿井、畋猎、取鱼、苫盖
1998-02-05	一九九八 戊寅[虎]年	正月大	初九	周四	戊寅 甲寅 癸未 丁巳	无	雨水 (2, 19)	无	玉皇上帝诞	无	虎	水瓶座	出行、宴会、嫁娶、捕捉、破土、覃恩、庆赐、恤孤茕、雪冤、赴任、布政事、搬移、入宅、纳采	求医疗病、纳畜、选将、安抚边境、出师、修仓库
1998-02-06	一九九八 戊寅[虎]年	正月大	初十	周五	戊寅 甲寅 甲申 己巳	无	雨水 (2, 19)	无	无	无	虎	水瓶座	祭祀、沐浴、求医疗病、扫舍宇、破屋坏垣、诉讼、赴任、解除	结婚姻、宴会、嫁娶、安床、修造、上官、冠带、进人口、竖柱上梁、经络、开市、纳财、修置产室、开渠、穿井、安碓硙、伐木、栽种、牧养、启攒、缮城郭、开仓、上册、修宫室、颁诏、求嗣、庆赐、补垣、招贤、布政事、宣政事、安抚边境、施恩、立券交易、修饰垣墙、临政、纳畜、举正直、塞穴、修仓库、酝酿、选将、鼓铸、营建、纳采、出师、筑堤防
1998-02-07	一九九八 戊寅[虎]年	正月大	十一	周六	戊寅 甲寅 乙酉 辛巳	无	雨水 (2, 19)	无	无	京汉铁路罢工纪念	虎	水瓶座	祭祀、沐浴、剃头、扫舍宇、恤孤茕、雪冤、整容、整手足甲	出行、结婚姻、宴会、嫁娶、安床、修造、求医疗病、上表章、上官、冠带、进人口、竖柱上梁、开市、纳财、修置产室、栽种、牧养、安葬、搬移、祈福、缮城郭、开仓、上册、修宫室、求嗣、庆赐、招贤、安抚边境、施恩、立券交易、临政、纳畜、举正直、解除、修仓库、选将、营建、纳采、出师、筑堤防
1998-02-08	一九九八 戊寅[虎]年	正月大	十二	周日	戊寅 甲寅 丙戌 癸巳	无	雨水 (2, 19)	无	无	无	虎	水瓶座	祭祀、出行、结婚姻、宴会、嫁娶、修造、求医疗病、上表章、上官、入学、进人口、竖柱上梁、经络、开市、纳财、安碓硙、栽种、牧养、安葬、搬移、祈福、缮城郭、裁制、开仓、上册、修宫室、求嗣、覃恩、恤孤茕、雪冤、庆赐、安抚边境、立券交易、临政、纳畜、解除、修仓库、酝酿、选将、营建、纳采、筑堤防、出师	剃头、冠带、修置产室、开渠、穿井、平治道涂、破屋坏垣、伐木、畋猎、破土、启攒、补垣、取鱼、整容、布政事、修饰垣墙、塞穴、远回、鼓铸、整手足甲
1998-02-09	一九九八 戊寅[虎]年	正月大	十三	周一	戊寅 甲寅 丁亥 乙巳	无	雨水 (2, 19)	无	无	无	虎	水瓶座	祭祀、出行、结婚姻、宴会、沐浴、修造、求医疗病、上表章、上官、进人口、竖柱上梁、经络、开市、纳财、捕捉、栽种、牧养、安葬、搬移、祈福、缮城郭、开仓、裁制、上册、修宫室、颁诏、求嗣、覃恩、恤孤茕、雪冤、庆赐、招贤、宣政事、安抚边境、施恩、立券交易、临政、纳畜、举正直、解除、修仓库、酝酿、选将、营建、纳采、出师	嫁娶、剃头、冠带、立券、修置产室、开渠、穿井、安碓硙、破屋坏垣、畋猎、破土、启攒、补垣、取鱼、整容、布政事、修饰垣墙、开张、塞穴、鼓铸、整手足甲、筑堤防
1998-02-10	一九九八 戊寅[虎]年	正月大	十四	周二	戊寅 甲寅 戊子 丁巳	无	雨水 (2, 19)	无	无	国际气象节	虎	水瓶座	祭祀、出行、宴会、嫁娶、沐浴、修造、求医疗病、上表章、上官、入学、开市、纳财、修置产室、开渠、穿井、安碓硙、栽种、牧养、搬移、祈福、缮城郭、裁制、上册、修宫室、颁诏、求嗣、覃恩、恤孤茕、雪冤、庆赐、招贤、宣政事、入宅、安抚边境、施恩、临政、纳畜、举正直、解除、修仓库、选将、纳采、出师	结婚姻、安床、剃头、冠带、进人口、竖柱上梁、经络、破屋坏垣、伐木、畋猎、破土、安葬、启攒、开仓、补垣、取鱼、整容、布政事、修饰垣墙、塞穴、乘船渡水、酝酿、鼓铸、营建、整手足甲、筑堤防、苫盖
1998-02-11	一九九八 戊寅[虎]年	正月大	十五	周三	戊寅 甲寅 己丑 己巳	无	雨水 (2, 19)	无	元宵节	无	虎	水瓶座	诸事不宜	诸事不宜
1998-02-12	一九九八 戊寅[虎]年	正月大	十六	周四	戊寅 甲寅 庚寅 辛巳	无	雨水 (2, 19)	无	无	无	虎	水瓶座	宴会、纳财、裁制、覃恩、庆赐、恤孤茕、雪冤、施恩、立券交易、纳畜、举正直、酝酿	祭祀、剃头、求医疗病、上表章、修置产室、开渠、穿井、平治道涂、破屋坏垣、伐木、捕捉、畋猎、栽种、启攒、搬移、祈福、开仓、上册、求嗣、补垣、取鱼、整容、修饰垣墙、解除、营建、整手足甲、筑堤防
1998-02-13	一九九八 戊寅[虎]年	正月大	十七	周五	戊寅 甲寅 辛卯 癸巳	无	雨水 (2, 19)	无	无	无	虎	水瓶座	祭祀、出行、结婚姻、宴会、嫁娶、沐浴、剃头、修造、求医疗病、上表章、上官、竖柱上梁、扫舍宇、栽种、牧养、安葬、搬移、祈福、缮城郭、裁制、上册、颁诏、求嗣、覃恩、恤孤茕、雪冤、庆赐、招贤、整容、宣政事、安抚边境、施恩、立券交易、临政、纳畜、举正直、解除、修仓库、选将、营建、纳采、整手足甲、出师	冠带、修置产室、穿井、畋猎、取鱼、乘船渡水、筑堤防、开仓、修宫室
1998-02-14	一九九八 戊寅[虎]年	正月大	十八	周六	戊寅 甲寅 壬辰 乙巳	无	雨水 (2, 19)	无	无	情人节	虎	水瓶座	出行、宴会、上表章、竖柱上梁、经络、牧养、安葬、搬移、祈福、缮城郭、裁制、上册、修宫室、颁诏、求嗣、覃恩、恤孤茕、雪冤、庆赐、宣政事、纳畜、解除、营建	祭祀、开渠、穿井、畋猎、取鱼、鼓铸、乘船渡水
1998-02-15	一九九八 戊寅[虎]年	正月大	十九	周日	戊寅 甲寅 癸巳 丁巳	无	雨水 (2, 19)	无	无	无	虎	水瓶座	平治道涂、赴任、入宅	祭祀、出行、结婚姻、宴会、剃头、求医疗病、上表章、冠带、竖柱上梁、修置产室、开渠、穿井、安碓硙、破屋坏垣、栽种、牧养、破土、安葬、启攒、祈福、缮城郭、裁制、上册、开仓、修宫室、颁诏、求嗣、庆赐、补垣、招贤、整容、布政事、宣政事、安抚边境、施恩、纳畜、举正直、解除、塞穴、修仓库、选将、鼓铸、营建、整手足甲、出师、筑堤防
1998-02-16	一九九八 戊寅[虎]年	正月大	二十	周一	戊寅 甲寅 甲午 己巳	无	雨水 (2, 19)	无	无	无	虎	水瓶座	祭祀、结婚姻、宴会、修造、上官、冠带、进人口、竖柱上梁、经络、安碓硙、牧养、诉讼、搬移、祈福、缮城郭、裁制、修宫室、颁诏、求嗣、庆赐、覃恩、恤孤茕、雪冤、招贤、宣政事、施恩、临政、纳畜、举正直、赴任、酝酿、营建、纳采	修置产室、苫盖、出师
1998-02-17	一九九八 戊寅[虎]年	正月大	廿一	周二	戊寅 甲寅 乙未 辛巳	无	雨水 (2, 19)	无	无	无	虎	水瓶座	捕捉	出行、结婚姻、嫁娶、安床、修造、求医疗病、上官、冠带、进人口、竖柱上梁、开市、修置产室、栽种、牧养、安葬、启攒、搬移、缮城郭、修宫室、安抚边境、立券交易、临政、纳畜、解除、选将、营建、纳采、整手足甲、出师、筑堤防
1998-02-18	一九九八 戊寅[虎]年	正月大	廿二	周三	戊寅 甲寅 丙申 癸巳	无	雨水 (2, 19)	无	无	无	虎	水瓶座	祭祀、沐浴、扫舍宇、破屋坏垣、覃恩、恤孤茕、雪冤、解除	冠带、修置产室、开渠、穿井、安碓硙、伐木、畋猎、启攒、补垣、取鱼、鼓铸、布政事、筑堤防、塞穴、修饰垣墙
1998-02-19	一九九八 戊寅[虎]年	正月大	廿三	周四	戊寅 甲寅 丁酉 乙巳	雨水	惊蛰 (3, 6)	无	无	邓小平逝世纪念日	虎	双鱼座	祭祀、出行、结婚姻、嫁娶、安床、沐浴、修造、求医疗病、上表章、上官、竖柱上梁、纳财、扫舍宇、栽种、牧养、安葬、搬移、祈福、缮城郭、开仓、裁制、上册、修宫室、颁诏、求嗣、覃恩、恤孤茕、雪冤、招贤、宣政事、安抚边境、施恩、临政、纳畜、举正直、解除、修仓库、选将、营建、纳采、整手足甲、出师	宴会、剃头、冠带、修置产室、畋猎、取鱼、筑堤防、乘船渡水
1998-02-20	一九九八 戊寅[虎]年	正月大	廿四	周五	戊寅 甲寅 戊戌 丁巳	无	惊蛰 (3, 6)	无	无	无	虎	双鱼座	出行、结婚姻、宴会、嫁娶、修造、上官、入学、进人口、竖柱上梁、经络、开市、纳财、安碓硙、搬移、缮城郭、裁制、修宫室、庆赐、入宅、安抚边境、立券交易、临政、纳畜、修仓库、酝酿、纳采、筑堤防	安床、剃头、求医疗病、上表章、冠带、修置产室、开渠、穿井、平治道涂、破屋坏垣、伐木、畋猎、栽种、牧养、破土、安葬、启攒、祈福、开仓、上册、颁诏、求嗣、补垣、招贤、整容、布政事、宣政事、修饰垣墙、解除、塞穴、选将、远回、鼓铸、营建、整手足甲、出师
1998-02-21	一九九八 戊寅[虎]年	正月大	廿五	周六	戊寅 甲寅 己亥 己巳	无	惊蛰 (3, 6)	无	无	国际母语日	虎	双鱼座	祭祀、结婚姻、宴会、沐浴、进人口、经络、开市、纳财、捕捉、栽种、牧养、安葬、祈福、开仓、取鱼、立券交易、纳畜、酝酿	出行、嫁娶、安床、剃头、修造、求医疗病、上表章、上官、冠带、竖柱上梁、修置产室、开渠、穿井、安碓硙、破屋坏垣、破土、启攒、搬移、缮城郭、裁制、上册、修宫室、颁诏、求嗣、庆赐、补垣、招贤、整容、布政事、宣政事、安抚边境、施恩、修饰垣墙、临政、举正直、解除、塞穴、修仓库、选将、鼓铸、营建、纳采、整手足甲、出师、筑堤防
1998-02-22	一九九八 戊寅[虎]年	正月大	廿六	周日	戊寅 甲寅 庚子 辛巳	无	惊蛰 (3, 6)	无	无	无	虎	双鱼座	沐浴、入学、覃恩、恤孤茕、雪冤	结婚姻、冠带、进人口、竖柱上梁、经络、伐木、畋猎、安葬、开仓、补垣、取鱼、布政事、入宅、塞穴、酝酿、营建、纳采、筑堤防
1998-02-23	一九九八 戊寅[虎]年	正月大	廿七	周一	戊寅 甲寅 辛丑 癸巳	无	惊蛰 (3, 6)	无	无	无	虎	双鱼座	祭祀、覃恩、恤孤茕、雪冤	出行、结婚姻、宴会、嫁娶、安床、剃头、修造、求医疗病、上表章、上官、冠带、进人口、竖柱上梁、经络、开市、纳财、修置产室、开渠、穿井、安碓硙、平治道涂、破屋坏垣、畋猎、栽种、牧养、破土、安葬、搬移、祈福、缮城郭、开仓、上册、修宫室、裁制、颁诏、求嗣、庆赐、补垣、取鱼、针刺、招贤、整容、布政事、宣政事、安抚边境、施恩、疗目、立券交易、临政、修饰垣墙、纳畜、举正直、解除、塞穴、修仓库、酝酿、选将、远回、鼓铸、营建、纳采、整手足甲、出师、筑堤防
1998-02-24	一九九八 戊寅[虎]年	正月大	廿八	周二	戊寅 甲寅 壬寅 乙巳	无	惊蛰 (3, 6)	无	无	第三世界青年日	虎	双鱼座	宴会、经络、纳财、牧养、裁制、覃恩、恤孤茕、雪冤、庆赐、施恩、立券交易、纳畜、举正直、酝酿	祭祀、剃头、修置产室、开渠、穿井、平治道涂、破屋坏垣、伐木、捕捉、畋猎、启攒、补垣、取鱼、整容、整手足甲、筑堤防、开仓、修饰垣墙
1998-02-25	一九九八 戊寅[虎]年	正月大	廿九	周三	戊寅 甲寅 癸卯 丁巳	无	惊蛰 (3, 6)	无	无	无	虎	双鱼座	出行、结婚姻、宴会、嫁娶、沐浴、剃头、修造、求医疗病、上官、扫舍宇、搬移、整容、入宅、安抚边境、立券交易、临政、解除、赴任、选将、纳采、整手足甲、出师	上表章、冠带、竖柱上梁、修置产室、穿井、栽种、牧养、祈福、缮城郭、开仓、上册、修宫室、求嗣、取鱼、招贤、纳畜、乘船渡水、修仓库、营建、筑堤防
1998-02-26	一九九八 戊寅[虎]年	正月大	三十	周四	戊寅 甲寅 甲辰 己巳	无	惊蛰 (3, 6)	无	无	无	虎	双鱼座	宴会、上表章、竖柱上梁、经络、诉讼、缮城郭、裁制、上册、修宫室、庆赐、赴任	祭祀、结婚姻、嫁娶、上官、栽种、破土、启攒、取鱼、招贤、鼓铸、举正直、纳采、乘船渡水、施恩
1998-02-27	一九九八 戊寅[虎]年	二月小	初一	周五	戊寅 甲寅 乙巳 辛巳	无	惊蛰 (3, 6)	无	一殿秦广王诞	无	虎	双鱼座	平治道涂	祭祀、出行、结婚姻、宴会、嫁娶、安床、剃头、修造、求医疗病、上表章、上官、冠带、进人口、竖柱上梁、经络、开市、纳财、修置产室、开渠、穿井、安碓硙、破屋坏垣、栽种、牧养、破土、安葬、启攒、搬移、祈福、缮城郭、裁制、上册、开仓、修宫室、颁诏、求嗣、庆赐、补垣、招贤、整容、布政事、宣政事、安抚边境、施恩、立券交易、修饰垣墙、临政、纳畜、举正直、解除、塞穴、修仓库、酝酿、选将、鼓铸、营建、纳采、整手足甲、出师、筑堤防
1998-02-28	一九九八 戊寅[虎]年	二月小	初二	周六	戊寅 甲寅 丙午 癸巳	无	惊蛰 (3, 6)	无	春龙节-福德土地正神诞	无	虎	双鱼座	祭祀、结婚姻、宴会、嫁娶、修造、上官、冠带、进人口、竖柱上梁、经络、安碓硙、牧养、搬移、祈福、缮城郭、裁制、修宫室、颁诏、求嗣、覃恩、恤孤茕、雪冤、庆赐、招贤、宣政事、施恩、临政、纳畜、举正直、酝酿、营建、纳采	修置产室、畋猎、取鱼、苫盖
