1998-11-01	1998-9-13	30	满	日	戊寅 壬戌 壬子	无	立冬 (11, 7)	万圣节	无	无	交易 会亲友 入殓 启钻 安葬 开光 开市 理发 移柩 立券 纳财	上梁 作灶 入宅 出火 出行 嫁娶 安床 祈福 移徙
1998-11-02	1998-9-14	30	平	一	戊寅 壬戌 癸丑	无	立冬 (11, 7)	无	无	无	平治道涂 造畜稠 馀事勿取	诸事不宜
1998-11-03	1998-9-15	30	定	二	戊寅 壬戌 甲寅	无	立冬 (11, 7)	无	无	无	入殓 启钻 安葬 成服 破土 除服 馀事勿取	无
1998-11-04	1998-9-16	30	执	三	戊寅 壬戌 乙卯	无	立冬 (11, 7)	无	无	无	入殓 启钻 安葬 开生坟 成服 破土 祭祀 移柩 除服 馀事勿取	无
1998-11-05	1998-9-17	30	破	四	戊寅 壬戌 丙辰	无	立冬 (11, 7)	无	无	无	坏垣 破屋 祭祀 解除 馀事勿取	诸事不宜
1998-11-06	1998-9-18	30	危	五	戊寅 壬戌 丁巳	无	立冬 (11, 7)	无	无	无	会亲友 嫁娶 求嗣 牧养 纳畜 纳财 纳采 结网 进人口	上梁 伐木 作灶 出行 安葬 安门 理发
1998-11-07	1998-9-19	30	危	六	戊寅 癸亥 戊午	立冬	小雪 (11, 22)	无	无	无	伐木 作梁 作灶 入殓 冠笄 启钻 嫁娶 安床 安葬 定磉 开厕 开柱眼 开池 成服 架马 畋猎 祭祀 移徙 移柩 纳采 结网 裁衣 订盟 除服	动土 盖屋 破土 造船
1998-11-08	1998-9-20	30	成	日	戊寅 癸亥 己未	无	小雪 (11, 22)	无	无	无	交易 会亲友 入学 入殓 动土 安葬 定磉 开光 开池 斋醮 栽种 求嗣 牧养 破土 祈福 祭祀 立券 立碑 纳畜 纳财 纳采 经络 解除 订盟 起基	入宅 出火 嫁娶 开市 移徙
1998-11-09	1998-9-21	30	收	一	戊寅 癸亥 庚申	无	小雪 (11, 22)	无	无	无	会亲友 入殓 成服 捕捉 畋猎 移柩 解除 除服 馀事勿取	修坟 安床 安葬 安门 破土
1998-11-10	1998-9-22	30	开	二	戊寅 癸亥 辛酉	无	小雪 (11, 22)	无	无	无	冠笄 出行 动土 启钻 安碓磑 定磉 开池 成服 扫舍 拆卸 掘井 斋醮 求嗣 沐浴 理发 祈福 祭祀 移柩 立碑 解除 谢土 起基 除服	作梁 入宅 安葬 安门 移徙
1998-11-11	1998-9-23	30	闭	三	戊寅 癸亥 壬戌	无	小雪 (11, 22)	无	无	无	会亲友 冠笄 塞穴 嫁娶 安床 捕捉 纳采 置产 造畜稠	修坟 安葬 开光 掘井 谢土
1998-11-12	1998-9-24	30	建	四	戊寅 癸亥 癸亥	无	小雪 (11, 22)	无	无	无	沐浴 祭祀 馀事勿取	诸事不宜
1998-11-13	1998-9-25	30	除	五	戊寅 癸亥 甲子	无	小雪 (11, 22)	无	无	无	上梁 伐木 会亲友 修造 入殓 出行 动土 启钻 塑绘 嫁娶 开光 成服 扫舍 栽种 沐浴 祈福 祭祀 移柩 竖柱 纳畜 纳财 纳采 裁衣 订盟 赴任 除服	作灶 入宅 安床 开仓
1998-11-14	1998-9-26	30	满	六	戊寅 癸亥 乙丑	无	小雪 (11, 22)	无	无	无	会亲友 塞穴 理发 结网 补垣	入宅 嫁娶 安门 移徙
1998-11-15	1998-9-27	30	平	日	戊寅 癸亥 丙寅	无	小雪 (11, 22)	无	无	无	上梁 交易 会亲友 修造 入宅 入殓 出行 动土 安床 安葬 安香 开仓 开市 成服 拆卸 祈福 祭祀 移徙 移柩 立券 竖柱 纳财 纳采 经络 裁衣 订盟 谢土 赴任 起基 进人口 除服	伐木 作梁 作灶 治病
1998-11-16	1998-9-28	30	定	一	戊寅 癸亥 丁卯	无	小雪 (11, 22)	无	无	无	会亲友 修造 入宅 入殓 动土 安床 安葬 安香 拆卸 祈福 祭祀 移徙 移柩 纳采 裁衣 订盟 谢土 赴任 起基 进人口	作灶 治病
1998-11-17	1998-9-29	30	执	二	戊寅 癸亥 戊辰	无	小雪 (11, 22)	无	无	无	入殓 启钻 塑绘 嫁娶 安床 安葬 开光 成服 祭祀 移柩 立碑 纳采 订盟 进人口 除服	交易 作灶 开市 破土
1998-11-18	1998-9-30	30	破	三	戊寅 癸亥 己巳	无	小雪 (11, 22)	无	无	无	坏垣 破屋 祭祀 解除 馀事勿取	诸事不宜
1998-11-19	1998-10-1	30	危	四	戊寅 癸亥 庚午	无	小雪 (11, 22)	无	无	无	上梁 伐木 修造 入殓 冠笄 出行 动土 启钻 塑绘 安床 安葬 开光 成服 拆卸 斋醮 栽种 破土 祈福 祭祀 移徙 移柩 竖柱 纳畜 纳采 裁衣 解除 订盟 赴任 除服	治病 盖屋
1998-11-20	1998-10-2	30	成	五	戊寅 癸亥 辛未	无	小雪 (11, 22)	无	无	无	上梁 交易 会亲友 入殓 冠笄 合帐 启钻 安床 安机械 安葬 开市 成服 祈福 祭祀 移柩 立券 竖柱 筑堤 纳畜 纳财 纳采 经络 裁衣 订盟 谢土 造畜稠 除服	入宅 嫁娶 治病 赴任
1998-11-21	1998-10-3	30	收	六	戊寅 癸亥 壬申	无	小雪 (11, 22)	无	无	无	扫舍 沐浴 馀事勿取	诸事不宜
1998-11-22	1998-10-4	30	开	日	戊寅 癸亥 癸酉	小雪	大雪 (12, 7)	无	无	无	诸事不宜	无
1998-11-23	1998-10-5	30	闭	一	戊寅 癸亥 甲戌	无	大雪 (12, 7)	无	无	无	入殓 出行 安葬 斋醮 破土 祈福 移柩 立碑 纳采 结网 订盟	作灶 入宅
1998-11-24	1998-10-6	30	建	二	戊寅 癸亥 乙亥	无	大雪 (12, 7)	无	无	无	冠笄 出行 沐浴 祭祀 进人口 馀事勿取	作灶 动土 嫁娶 安葬
1998-11-25	1998-10-7	30	除	三	戊寅 癸亥 丙子	无	大雪 (12, 7)	无	无	无	作梁 修坟 入学 入宅 入殓 冠笄 启钻 塑绘 嫁娶 安葬 安香 开光 拆卸 整手足甲 斋醮 沐浴 治病 理发 破土 祈福 祭祀 移徙 移柩 纳采 裁衣 订盟 谢土 赴任	开市
1998-11-26	1998-10-8	30	满	四	戊寅 癸亥 丁丑	无	大雪 (12, 7)	感恩节	无	无	诸事不宜	无
1998-11-27	1998-10-9	30	平	五	戊寅 癸亥 戊寅	无	大雪 (12, 7)	无	无	无	交易 入宅 入殓 出行 安床 安葬 开光 开市 挂匾 移徙 移柩 立券 纳畜 纳财	作灶 动土 嫁娶 栽种 破土 祈福 祭祀 置产
1998-11-28	1998-10-10	30	定	六	戊寅 癸亥 己卯	无	大雪 (12, 7)	无	无	无	修造 入宅 入殓 出火 出行 动土 嫁娶 安床 安葬 开光 成服 拆卸 栽种 求嗣 祈福 祭祀 移徙 立碑 纳畜 解除 进人口 除服	无
1998-11-29	1998-10-11	30	执	日	戊寅 癸亥 庚辰	无	大雪 (12, 7)	无	无	无	修造 入殓 动土 启钻 安床 安葬 开光 拆卸 纳畜 解除	作灶 入宅 出火 分居 嫁娶 安香 开市 掘井 栽种 破土 移徙
1998-11-30	1998-10-12	30	破	一	戊寅 癸亥 辛巳	无	大雪 (12, 7)	无	无	无	坏垣 破屋 馀事勿取	诸事不宜
