1999-09-01	一九九九 己卯[兔]年 七月大廿二	周三	无	增福财神诞	无	己卯 壬申 丙辰 癸巳	无	白露 (9, 8)	兔	处女座	祭祀、入学	出行、结婚姻、宴会、嫁娶、安床、剃头、修造、求医疗病、上表章、上官、冠带、进人口、竖柱上梁、经络、开市、纳财、修置产室、开渠、穿井、安碓硙、平治道涂、破屋坏垣、伐木、栽种、牧养、破土、安葬、启攒、纳畜、纳采、针刺、鼓铸、举正直、整手足甲、临政、布政事、修仓库、求嗣、解除、上册、酝酿、颁诏、裁制、庆赐、开仓、整容、筑堤防、安抚边境、营建、补垣、宣政事、选将、施恩、修宫室、搬移、修饰垣墙、塞穴、招贤、祈福、缮城郭、立券交易、远回、出师
1999-09-02	一九九九 己卯[兔]年 七月大廿三	周四	无	无	无	己卯 壬申 丁巳 乙巳	无	白露 (9, 8)	兔	处女座	祭祀、结婚姻、宴会、嫁娶、修造、求医疗病、上表章、上官、进人口、竖柱上梁、经络、开市、纳财、捕捉、栽种、牧养、安葬、纳畜、纳采、举正直、临政、恤孤茕、修仓库、求嗣、解除、上册、酝酿、颁诏、裁制、庆赐、开仓、覃恩、安抚边境、营建、宣政事、选将、施恩、雪冤、搬移、招贤、祈福、缮城郭、立券交易	出行、剃头、冠带、修置产室、开渠、穿井、安碓硙、破屋坏垣、畋猎、破土、启攒、鼓铸、整手足甲、布政事、乘船渡水、整容、筑堤防、补垣、修宫室、修饰垣墙、塞穴、取鱼
1999-09-03	一九九九 己卯[兔]年 七月大廿四	周五	无	无	中国抗日战争胜利纪念日	己卯 壬申 戊午 丁巳	无	白露 (9, 8)	兔	处女座	祭祀、出行、结婚姻、宴会、嫁娶、修造、求医疗病、上表章、上官、入学、竖柱上梁、开市、修置产室、开渠、穿井、安碓硙、栽种、牧养、纳畜、纳采、举正直、临政、恤孤茕、修仓库、求嗣、解除、上册、颁诏、裁制、庆赐、覃恩、安抚边境、营建、宣政事、选将、施恩、修宫室、雪冤、搬移、招贤、祈福、缮城郭、出师	剃头、冠带、破屋坏垣、伐木、畋猎、破土、鼓铸、整手足甲、布政事、开仓、入宅、整容、筑堤防、补垣、修饰垣墙、塞穴、苫盖、取鱼
1999-09-04	一九九九 己卯[兔]年 七月大廿五	周六	无	无	无	己卯 壬申 己未 己巳	无	白露 (9, 8)	兔	处女座	赴任、入宅	出行、结婚姻、宴会、嫁娶、安床、剃头、修造、求医疗病、上表章、上官、冠带、进人口、竖柱上梁、经络、开市、纳财、修置产室、开渠、穿井、安碓硙、破屋坏垣、栽种、牧养、安葬、纳畜、纳采、针刺、鼓铸、举正直、整手足甲、临政、布政事、修仓库、求嗣、解除、上册、酝酿、颁诏、裁制、庆赐、开仓、整容、筑堤防、营建、安抚边境、补垣、宣政事、选将、施恩、修宫室、搬移、修饰垣墙、塞穴、招贤、祈福、缮城郭、立券交易、出师、疗目
1999-09-05	一九九九 己卯[兔]年 七月大廿六	周日	无	无	无	己卯 壬申 庚申 辛巳	无	白露 (9, 8)	兔	处女座	出行、沐浴、上官、进人口、纳财、扫舍宇、纳畜、举正直、临政、恤孤茕、酝酿、颁诏、裁制、覃恩、宣政事、施恩、雪冤、招贤	安床、上表章、修置产室、开渠、穿井、平治道涂、破屋坏垣、伐木、栽种、启攒、求嗣、上册、开仓、筑堤防、营建、补垣、修饰垣墙、祈福
1999-09-06	一九九九 己卯[兔]年 七月大廿七	周一	无	无	无	己卯 壬申 辛酉 癸巳	无	白露 (9, 8)	兔	处女座	出行、沐浴、剃头、求医疗病、上官、扫舍宇、安葬、整手足甲、临政、恤孤茕、解除、整容、安抚边境、选将、雪冤、出师	结婚姻、宴会、嫁娶、安床、修造、上表章、冠带、进人口、竖柱上梁、开市、纳财、修置产室、捕捉、畋猎、栽种、牧养、纳畜、纳采、鼓铸、修仓库、求嗣、上册、酝酿、颁诏、乘船渡水、开仓、庆赐、筑堤防、补垣、营建、宣政事、修宫室、搬移、塞穴、招贤、祈福、缮城郭、立券交易、取鱼
1999-09-07	一九九九 己卯[兔]年 七月大廿八	周二	无	无	无	己卯 壬申 壬戌 乙巳	无	白露 (9, 8)	兔	处女座	出行、宴会、修造、上表章、进人口、竖柱上梁、经络、开市、纳财、栽种、牧养、安葬、纳畜、恤孤茕、修仓库、求嗣、解除、上册、颁诏、裁制、开仓、庆赐、覃恩、补垣、营建、宣政事、修宫室、雪冤、搬移、塞穴、祈福、缮城郭、立券交易	祭祀、开渠、穿井、畋猎、取鱼、乘船渡水
1999-09-08	一九九九 己卯[兔]年 七月大廿九	周三	无	杨公忌	世界扫盲日	己卯 癸酉 癸亥 丁巳	白露	秋分 (9, 23)	兔	处女座	出行、宴会、沐浴、上表章、进人口、竖柱上梁、经络、开市、纳财、栽种、牧养、求嗣、解除、上册、裁制、庆赐、补垣、修宫室、塞穴、祈福、缮城郭、立券交易	祭祀、嫁娶、立券、破土、启攒、纳畜、安抚边境、选将、开张、出师、招贤
1999-09-09	一九九九 己卯[兔]年 七月大三十	周四	无	地藏菩萨诞	毛泽东逝世纪念日	己卯 癸酉 甲子 己巳	无	秋分 (9, 23)	兔	处女座	祭祀、沐浴、平治道涂、恤孤茕、入宅、覃恩、修饰垣墙、雪冤	冠带、修置产室、开渠、穿井、捕捉、畋猎、破土、安葬、启攒、鼓铸、修仓库、上册、颁诏、筑堤防、安抚边境、营建、宣政事、选将、招贤、出师、取鱼
1999-09-10	一九九九 己卯[兔]年 八月小初一	周五	无	许真君诞	中国教师节	己卯 癸酉 乙丑 辛巳	无	秋分 (9, 23)	兔	处女座	祭祀、出行、结婚姻、宴会、修造、上官、进人口、竖柱上梁、经络、安碓硙、牧养、纳畜、纳采、举正直、临政、恤孤茕、求嗣、酝酿、颁诏、裁制、庆赐、覃恩、营建、宣政事、施恩、修宫室、雪冤、搬移、招贤、祈福、缮城郭	修置产室、畋猎、整手足甲、取鱼、开仓
1999-09-11	一九九九 己卯[兔]年 八月小初二	周六	无	无	无	己卯 癸酉 丙寅 癸巳	无	秋分 (9, 23)	兔	处女座	沐浴、捕捉、恤孤茕、覃恩、雪冤	祭祀、安床、冠带、进人口、经络、开市、纳财、修置产室、开渠、穿井、安碓硙、破屋坏垣、畋猎、鼓铸、酝酿、开仓、筑堤防、补垣、修宫室、修饰垣墙、塞穴、远回、取鱼
1999-09-12	一九九九 己卯[兔]年 八月小初三	周日	无	司命灶君诞	无	己卯 癸酉 丁卯 乙巳	无	秋分 (9, 23)	兔	处女座	诸事不宜	诸事不宜
1999-09-13	一九九九 己卯[兔]年 八月小初四	周一	无	无	无	己卯 癸酉 戊辰 丁巳	无	秋分 (9, 23)	兔	处女座	恤孤茕、覃恩、雪冤	出行、剃头、修造、求医疗病、上表章、上官、竖柱上梁、修置产室、开渠、穿井、安碓硙、破屋坏垣、纳采、鼓铸、举正直、整手足甲、临政、修仓库、求嗣、解除、上册、颁诏、裁制、开仓、整容、筑堤防、营建、补垣、宣政事、施恩、修宫室、修饰垣墙、塞穴、招贤、祈福、缮城郭、出师
1999-09-14	一九九九 己卯[兔]年 八月小初五	周二	无	雷声大帝诞	世界清洁地球日	己卯 癸酉 己巳 己巳	无	秋分 (9, 23)	兔	处女座	祭祀、结婚姻、宴会、修造、上表章、上官、入学、进人口、竖柱上梁、经络、开市、纳财、安碓硙、纳畜、纳采、举正直、临政、修仓库、赴任、上册、酝酿、裁制、庆赐、入宅、筑堤防、安抚边境、选将、修宫室、施恩、搬移、祈福、缮城郭、立券交易	出行、破土、安葬、启攒、乘船渡水
1999-09-15	一九九九 己卯[兔]年 八月小初六	周三	无	无	无	己卯 癸酉 庚午 辛巳	无	秋分 (9, 23)	兔	处女座	祭祀、捕捉、恤孤茕、覃恩、雪冤	安床、冠带、经络、开市、修置产室、开渠、穿井、畋猎、启攒、鼓铸、整手足甲、布政事、酝酿、乘船渡水、开仓、筑堤防、补垣、修宫室、塞穴、苫盖、立券交易、取鱼
1999-09-16	一九九九 己卯[兔]年 八月小初七	周四	无	无	无	己卯 癸酉 辛未 癸巳	无	秋分 (9, 23)	兔	处女座	出行、宴会、上表章、上官、入学、进人口、开市、纳财、牧养、纳畜、举正直、临政、恤孤茕、求嗣、解除、上册、颁诏、裁制、庆赐、覃恩、安抚边境、宣政事、选将、施恩、雪冤、搬移、招贤、祈福	结婚姻、平治道涂、破屋坏垣、伐木、畋猎、安葬、启攒、酝酿、乘船渡水、开仓、筑堤防、营建、补垣、修饰垣墙、取鱼
1999-09-17	一九九九 己卯[兔]年 八月小初八	周五	无	无	无	己卯 癸酉 壬申 乙巳	无	秋分 (9, 23)	兔	处女座	祭祀、沐浴、剃头、经络、纳财、扫舍宇、栽种、牧养、整手足甲、恤孤茕、酝酿、裁制、整容、筑堤防、覃恩、补垣、安抚边境、选将、雪冤、塞穴、缮城郭	出行、结婚姻、宴会、嫁娶、安床、修造、求医疗病、上表章、上官、进人口、竖柱上梁、开市、修置产室、开渠、穿井、安葬、纳畜、纳采、针刺、举正直、临政、布政事、求嗣、解除、上册、颁诏、庆赐、开仓、营建、宣政事、施恩、修宫室、搬移、招贤、祈福、立券交易、出师、疗目
1999-09-18	一九九九 己卯[兔]年 八月小初九	周六	无	无	“九·一八”事变纪念日	己卯 癸酉 癸酉 丁巳	无	秋分 (9, 23)	兔	处女座	祭祀、沐浴、扫舍宇	出行、结婚姻、宴会、嫁娶、安床、剃头、修造、求医疗病、上表章、上官、冠带、进人口、竖柱上梁、经络、开市、纳财、修置产室、开渠、穿井、安碓硙、平治道涂、破屋坏垣、伐木、栽种、牧养、破土、安葬、启攒、纳畜、纳采、鼓铸、举正直、整手足甲、临政、布政事、修仓库、求嗣、解除、上册、酝酿、颁诏、乘船渡水、裁制、开仓、庆赐、整容、筑堤防、营建、安抚边境、补垣、宣政事、选将、修宫室、施恩、搬移、修饰垣墙、塞穴、招贤、祈福、缮城郭、苫盖、立券交易、出师、取鱼
1999-09-19	一九九九 己卯[兔]年 八月小初十	周日	无	北斗大帝诞	无	己卯 癸酉 甲戌 己巳	无	秋分 (9, 23)	兔	处女座	祭祀、出行、嫁娶、沐浴、剃头、修造、求医疗病、上表章、上官、纳财、扫舍宇、栽种、牧养、安葬、纳畜、纳采、举正直、整手足甲、临政、求嗣、解除、赴任、入宅、整容、安抚边境、选将、施恩、搬移、祈福、诉讼、出师	宴会、进人口、经络、开市、修置产室、破土、启攒、针刺、修仓库、上册、酝酿、开仓、庆赐、立券交易
1999-09-20	一九九九 己卯[兔]年 八月小十一	周一	无	无	全国爱牙日	己卯 癸酉 乙亥 辛巳	无	秋分 (9, 23)	兔	处女座	出行、宴会、沐浴、上表章、进人口、竖柱上梁、经络、开市、纳财、牧养、恤孤茕、求嗣、解除、上册、颁诏、裁制、庆赐、覃恩、补垣、营建、宣政事、修宫室、雪冤、塞穴、祈福、缮城郭、立券交易	祭祀、嫁娶、畋猎、破土、启攒、取鱼
1999-09-21	一九九九 己卯[兔]年 八月小十二	周二	无	西方五道诞	国际和平日	己卯 癸酉 丙子 癸巳	无	秋分 (9, 23)	兔	处女座	祭祀、沐浴、平治道涂、修饰垣墙	出行、结婚姻、宴会、嫁娶、安床、剃头、修造、求医疗病、上表章、上官、冠带、进人口、竖柱上梁、经络、开市、纳财、修置产室、开渠、穿井、捕捉、畋猎、栽种、牧养、破土、安葬、启攒、纳畜、纳采、鼓铸、举正直、临政、布政事、修仓库、求嗣、解除、上册、酝酿、颁诏、裁制、庆赐、开仓、整容、筑堤防、安抚边境、营建、宣政事、选将、施恩、修宫室、搬移、招贤、祈福、缮城郭、立券交易、出师、取鱼
1999-09-22	一九九九 己卯[兔]年 八月小十三	周三	无	无	无	己卯 癸酉 丁丑 乙巳	无	秋分 (9, 23)	兔	处女座	宴会、修造、进人口、竖柱上梁、经络、安碓硙、牧养、纳畜、纳采、酝酿、裁制、庆赐、修宫室、缮城郭	出行、剃头、求医疗病、上表章、开市、修置产室、安抚边境、上册、选将、出师、开仓、整容、解除
1999-09-23	一九九九 己卯[兔]年 八月小十四	周四	无	无	无	己卯 癸酉 戊寅 丁巳	秋分	寒露 (10, 9)	兔	天秤座	沐浴、捕捉、恤孤茕、覃恩、雪冤	祭祀、安床、冠带、进人口、经络、开市、纳财、修置产室、开渠、穿井、安碓硙、破屋坏垣、畋猎、启攒、鼓铸、布政事、酝酿、乘船渡水、开仓、筑堤防、补垣、修宫室、修饰垣墙、塞穴、远回、取鱼
1999-09-24	一九九九 己卯[兔]年 八月小十五	周五	中秋节	无	无	己卯 癸酉 己卯 己巳	无	寒露 (10, 9)	兔	天秤座	诸事不宜	诸事不宜
1999-09-25	一九九九 己卯[兔]年 八月小十六	周六	无	天曹掠刷真君降	无	己卯 癸酉 庚辰 辛巳	无	寒露 (10, 9)	兔	天秤座	祭祀、出行、结婚姻、宴会、嫁娶、安床、修造、求医疗病、上表章、上官、进人口、竖柱上梁、经络、纳财、栽种、牧养、安葬、纳畜、纳采、举正直、临政、恤孤茕、修仓库、求嗣、解除、上册、酝酿、颁诏、裁制、庆赐、覃恩、安抚边境、营建、宣政事、选将、施恩、雪冤、搬移、招贤、祈福、缮城郭、立券交易、出师	诸事不忌
1999-09-26	一九九九 己卯[兔]年 八月小十七	周日	无	无	无	己卯 癸酉 辛巳 癸巳	无	寒露 (10, 9)	兔	天秤座	祭祀、结婚姻、宴会、上表章、上官、入学、进人口、竖柱上梁、经络、开市、纳财、安碓硙、纳畜、纳采、举正直、临政、恤孤茕、布政事、上册、裁制、庆赐、筑堤防、覃恩、修宫室、施恩、搬移、雪冤、祈福、缮城郭、立券交易	出行、破土、安葬、启攒
1999-09-27	一九九九 己卯[兔]年 八月小十八	周一	无	天人兴福之辰	世界旅游日	己卯 癸酉 壬午 乙巳	无	寒露 (10, 9)	兔	天秤座	祭祀、捕捉、恤孤茕、覃恩、雪冤	出行、结婚姻、宴会、嫁娶、安床、修造、求医疗病、上表章、上官、冠带、进人口、竖柱上梁、经络、开市、纳财、修置产室、开渠、穿井、栽种、牧养、破土、安葬、启攒、纳畜、纳采、鼓铸、举正直、临政、布政事、修仓库、求嗣、解除、上册、酝酿、颁诏、乘船渡水、裁制、庆赐、开仓、筑堤防、安抚边境、营建、补垣、宣政事、选将、施恩、修宫室、搬移、塞穴、招贤、祈福、缮城郭、苫盖、立券交易、出师、取鱼
1999-09-28	一九九九 己卯[兔]年 八月小十九	周二	无	无	无	己卯 癸酉 癸未 丁巳	无	寒露 (10, 9)	兔	天秤座	出行、结婚姻、宴会、嫁娶、上表章、上官、入学、进人口、竖柱上梁、开市、纳财、牧养、纳畜、纳采、举正直、临政、恤孤茕、求嗣、解除、上册、颁诏、裁制、庆赐、覃恩、宣政事、施恩、雪冤、搬移、招贤、祈福	平治道涂、破屋坏垣、伐木、畋猎、营建、补垣、整手足甲、取鱼、修饰垣墙、筑堤防
1999-09-29	一九九九 己卯[兔]年 八月小二十	周三	无	无	无	己卯 癸酉 甲申 己巳	无	寒露 (10, 9)	兔	天秤座	祭祀、沐浴、剃头、经络、纳财、扫舍宇、栽种、牧养、整手足甲、恤孤茕、酝酿、裁制、入宅、整容、筑堤防、覃恩、补垣、雪冤、塞穴	结婚姻、安床、进人口、竖柱上梁、修置产室、开渠、穿井、针刺、布政事、求嗣、上册、营建、修宫室、疗目
1999-09-30	一九九九 己卯[兔]年 八月小廿一	周四	无	无	无	己卯 癸酉 乙酉 辛巳	无	寒露 (10, 9)	兔	天秤座	祭祀、沐浴、扫舍宇、恤孤茕、覃恩、雪冤	宴会、冠带、修置产室、开渠、穿井、平治道涂、破屋坏垣、伐木、畋猎、启攒、鼓铸、布政事、乘船渡水、开仓、筑堤防、补垣、修饰垣墙、塞穴、苫盖、取鱼
