2000-09-01	二零零零 庚辰[龙]年	八月大	初四	周五	无	无	无	庚辰 甲申 壬戌 乙巳	无	白露 (9, 7)	龙	处女座	宴会、上表章、进人口、竖柱上梁、经络、开市、纳财、栽种、牧养、安葬、纳畜、颁诏、补垣、修仓库、雪冤、缮城郭、裁制、宣政事、立券交易、开仓、祈福、解除、塞穴、求嗣、覃恩、上册、庆赐、恤孤茕、修宫室、营建	祭祀、开渠、穿井、畋猎、乘船渡水、取鱼
2000-09-02	二零零零 庚辰[龙]年	八月大	初五	周六	无	雷声大帝诞	无	庚辰 甲申 癸亥 丁巳	无	白露 (9, 7)	龙	处女座	祭祀、出行、结婚姻、宴会、沐浴、修造、求医疗病、上表章、上官、竖柱上梁、纳财、平治道涂、栽种、牧养、安葬、出师、纳畜、颁诏、纳采、举正直、安抚边境、修仓库、雪冤、缮城郭、裁制、宣政事、临政、招贤、开仓、祈福、解除、施恩、求嗣、覃恩、修饰垣墙、上册、庆赐、恤孤茕、修宫室、选将、营建、搬移	嫁娶、冠带、修置产室、开渠、穿井、畋猎、破土、启攒、乘船渡水、布政事、鼓铸、取鱼、筑堤防
2000-09-03	二零零零 庚辰[龙]年	八月大	初六	周日	无	无	中国抗日战争胜利纪念日	庚辰 甲申 甲子 己巳	无	白露 (9, 7)	龙	处女座	祭祀、出行、结婚姻、宴会、沐浴、修造、上官、冠带、进人口、竖柱上梁、经络、安碓硙、牧养、赴任、布政事、纳畜、纳采、举正直、雪冤、缮城郭、裁制、临政、诉讼、酝酿、祈福、施恩、求嗣、覃恩、庆赐、修宫室、恤孤茕、搬移	修置产室、安抚边境、整手足甲、选将、出师
2000-09-04	二零零零 庚辰[龙]年	八月大	初七	周一	无	无	无	庚辰 甲申 乙丑 辛巳	无	白露 (9, 7)	龙	处女座	宴会、修造、纳财、捕捉、牧养、赴任、庆赐、布政事、雪冤、纳畜、恤孤茕、入宅、纳采、覃恩	结婚姻、求医疗病、冠带、畋猎、远回
2000-09-05	二零零零 庚辰[龙]年	八月大	初八	周二	无	无	无	庚辰 甲申 丙寅 癸巳	无	白露 (9, 7)	龙	处女座	诸事不宜	诸事不宜
2000-09-06	二零零零 庚辰[龙]年	八月大	初九	周三	无	无	无	庚辰 甲申 丁卯 乙巳	无	白露 (9, 7)	龙	处女座	祭祀、出行、结婚姻、宴会、嫁娶、安床、修造、求医疗病、上表章、上官、竖柱上梁、栽种、牧养、安葬、出师、纳畜、颁诏、纳采、举正直、安抚边境、修仓库、雪冤、缮城郭、裁制、宣政事、临政、立券交易、招贤、祈福、解除、施恩、求嗣、覃恩、上册、庆赐、恤孤茕、选将、营建、搬移	剃头、冠带、修置产室、开渠、穿井、安碓硙、平治道涂、破屋坏垣、畋猎、整容、修宫室、取鱼、开仓、筑堤防、补垣、修饰垣墙
2000-09-07	二零零零 庚辰[龙]年	八月大	初十	周四	无	北斗大帝诞	无	庚辰 乙酉 戊辰 丁巳	白露	秋分 (9, 23)	龙	处女座	雪冤、覃恩、恤孤茕	出行、剃头、修造、求医疗病、上表章、上官、竖柱上梁、修置产室、开渠、穿井、安碓硙、破屋坏垣、出师、颁诏、补垣、纳采、举正直、修仓库、整手足甲、缮城郭、鼓铸、裁制、宣政事、临政、招贤、开仓、祈福、解除、施恩、筑堤防、求嗣、塞穴、修饰垣墙、上册、整容、修宫室、营建
2000-09-08	二零零零 庚辰[龙]年	八月大	十一	周五	无	无	世界扫盲日	庚辰 乙酉 己巳 己巳	无	秋分 (9, 23)	龙	处女座	祭祀、结婚姻、宴会、修造、上表章、上官、入学、进人口、竖柱上梁、经络、开市、纳财、安碓硙、纳畜、纳采、举正直、安抚边境、修仓库、缮城郭、裁制、临政、酝酿、立券交易、筑堤防、施恩、祈福、上册、庆赐、修宫室、选将、搬移	出行、破土、安葬、启攒
2000-09-09	二零零零 庚辰[龙]年	八月大	十二	周六	无	西方五道诞	毛泽东逝世纪念日	庚辰 乙酉 庚午 辛巳	无	秋分 (9, 23)	龙	处女座	祭祀、捕捉、雪冤、入宅、覃恩、恤孤茕	安床、剃头、冠带、经络、开市、修置产室、开渠、穿井、畋猎、启攒、布政事、取鱼、补垣、苫盖、鼓铸、乘船渡水、酝酿、立券交易、开仓、筑堤防、塞穴、整容、修宫室
2000-09-10	二零零零 庚辰[龙]年	八月大	十三	周日	无	无	中国教师节	庚辰 乙酉 辛未 癸巳	无	秋分 (9, 23)	龙	处女座	出行、宴会、上表章、上官、入学、进人口、开市、纳财、牧养、纳畜、颁诏、举正直、安抚边境、雪冤、裁制、宣政事、临政、招贤、祈福、解除、施恩、求嗣、覃恩、上册、庆赐、恤孤茕、选将、出师、搬移	结婚姻、平治道涂、破屋坏垣、伐木、畋猎、安葬、启攒、取鱼、补垣、乘船渡水、酝酿、开仓、筑堤防、修饰垣墙、营建
2000-09-11	二零零零 庚辰[龙]年	八月大	十四	周一	无	无	无	庚辰 乙酉 壬申 乙巳	无	秋分 (9, 23)	龙	处女座	祭祀、沐浴、剃头、经络、纳财、扫舍宇、栽种、牧养、补垣、安抚边境、雪冤、整手足甲、缮城郭、裁制、酝酿、筑堤防、塞穴、覃恩、整容、恤孤茕、选将	出行、结婚姻、宴会、嫁娶、安床、修造、求医疗病、上表章、上官、进人口、竖柱上梁、开市、修置产室、开渠、穿井、安葬、布政事、出师、纳畜、颁诏、纳采、举正直、宣政事、临政、乘船渡水、针刺、立券交易、招贤、开仓、祈福、解除、施恩、求嗣、上册、庆赐、修宫室、营建、疗目、搬移
2000-09-12	二零零零 庚辰[龙]年	八月大	十五	周二	中秋节	无	无	庚辰 乙酉 癸酉 丁巳	无	秋分 (9, 23)	龙	处女座	祭祀、沐浴、扫舍宇	出行、结婚姻、宴会、嫁娶、安床、剃头、修造、求医疗病、上表章、上官、冠带、进人口、竖柱上梁、经络、开市、纳财、修置产室、开渠、穿井、安碓硙、平治道涂、破屋坏垣、伐木、栽种、牧养、破土、安葬、启攒、布政事、出师、纳畜、取鱼、颁诏、补垣、纳采、举正直、安抚边境、修仓库、苫盖、整手足甲、缮城郭、鼓铸、裁制、宣政事、临政、乘船渡水、酝酿、立券交易、招贤、开仓、祈福、解除、施恩、求嗣、筑堤防、塞穴、修饰垣墙、上册、庆赐、整容、修宫室、选将、营建、搬移
2000-09-13	二零零零 庚辰[龙]年	八月大	十六	周三	无	天曹掠刷真君降	无	庚辰 乙酉 甲戌 己巳	无	秋分 (9, 23)	龙	处女座	祭祀、沐浴、剃头、扫舍宇、栽种、赴任、举正直、整手足甲、临政、诉讼、解除、施恩、整容	出行、宴会、嫁娶、修造、求医疗病、上表章、上官、进人口、经络、开市、纳财、修置产室、牧养、破土、安葬、启攒、出师、纳畜、纳采、安抚边境、修仓库、针刺、酝酿、立券交易、开仓、祈福、求嗣、上册、庆赐、选将、搬移
2000-09-14	二零零零 庚辰[龙]年	八月大	十七	周四	无	无	世界清洁地球日	庚辰 乙酉 乙亥 辛巳	无	秋分 (9, 23)	龙	处女座	出行、宴会、沐浴、上表章、进人口、竖柱上梁、经络、开市、纳财、牧养、赴任、颁诏、补垣、雪冤、缮城郭、裁制、宣政事、立券交易、祈福、入宅、塞穴、解除、求嗣、覃恩、上册、庆赐、恤孤茕、修宫室、营建	祭祀、嫁娶、畋猎、破土、启攒、取鱼
2000-09-15	二零零零 庚辰[龙]年	八月大	十八	周五	无	天人兴福之辰	无	庚辰 乙酉 丙子 癸巳	无	秋分 (9, 23)	龙	处女座	祭祀、沐浴、平治道涂、修饰垣墙	出行、结婚姻、宴会、嫁娶、安床、修造、求医疗病、上表章、上官、冠带、进人口、竖柱上梁、经络、开市、纳财、修置产室、开渠、穿井、捕捉、畋猎、栽种、牧养、破土、安葬、启攒、布政事、出师、纳畜、取鱼、颁诏、纳采、举正直、安抚边境、修仓库、缮城郭、鼓铸、裁制、宣政事、临政、酝酿、立券交易、招贤、开仓、祈福、解除、施恩、筑堤防、求嗣、上册、庆赐、修宫室、选将、营建、搬移
2000-09-16	二零零零 庚辰[龙]年	八月大	十九	周六	无	无	无	庚辰 乙酉 丁丑 乙巳	无	秋分 (9, 23)	龙	处女座	结婚姻、宴会、嫁娶、进人口、竖柱上梁、经络、安碓硙、牧养、纳畜、纳采、缮城郭、裁制、酝酿、庆赐、修宫室	剃头、求医疗病、上表章、开市、修置产室、上册、安抚边境、整容、整手足甲、选将、开仓、解除、出师
2000-09-17	二零零零 庚辰[龙]年	八月大	二十	周日	无	无	无	庚辰 乙酉 戊寅 丁巳	无	秋分 (9, 23)	龙	处女座	沐浴、捕捉、雪冤、覃恩、恤孤茕	祭祀、安床、冠带、进人口、经络、开市、纳财、修置产室、开渠、穿井、安碓硙、破屋坏垣、畋猎、启攒、布政事、取鱼、补垣、鼓铸、酝酿、开仓、筑堤防、塞穴、修饰垣墙、修宫室、远回
2000-09-18	二零零零 庚辰[龙]年	八月大	廿一	周一	无	无	“九·一八”事变纪念日	庚辰 乙酉 己卯 己巳	无	秋分 (9, 23)	龙	处女座	诸事不宜	诸事不宜
2000-09-19	二零零零 庚辰[龙]年	八月大	廿二	周二	无	无	无	庚辰 乙酉 庚辰 辛巳	无	秋分 (9, 23)	龙	处女座	祭祀、出行、结婚姻、宴会、嫁娶、安床、修造、求医疗病、上表章、上官、进人口、竖柱上梁、经络、纳财、栽种、牧养、安葬、出师、纳畜、颁诏、纳采、举正直、安抚边境、修仓库、雪冤、缮城郭、裁制、宣政事、临政、酝酿、立券交易、招贤、祈福、入宅、施恩、解除、求嗣、覃恩、上册、庆赐、恤孤茕、选将、营建、搬移	诸事不忌
2000-09-20	二零零零 庚辰[龙]年	八月大	廿三	周三	无	汉恒候张显王诞	全国爱牙日	庚辰 乙酉 辛巳 癸巳	无	秋分 (9, 23)	龙	处女座	祭祀、结婚姻、宴会、修造、上表章、上官、入学、进人口、竖柱上梁、经络、开市、纳财、安碓硙、布政事、纳畜、纳采、举正直、修仓库、雪冤、缮城郭、裁制、临政、立券交易、筑堤防、施恩、祈福、覃恩、上册、庆赐、修宫室、恤孤茕、搬移	出行、求医疗病、破土、安葬、启攒、乘船渡水、整手足甲
2000-09-21	二零零零 庚辰[龙]年	八月大	廿四	周四	无	灶君夫人诞	国际和平日	庚辰 乙酉 壬午 乙巳	无	秋分 (9, 23)	龙	处女座	祭祀、捕捉、雪冤、覃恩、恤孤茕	出行、结婚姻、宴会、嫁娶、安床、修造、求医疗病、上表章、上官、冠带、进人口、竖柱上梁、经络、开市、纳财、修置产室、开渠、穿井、栽种、牧养、破土、安葬、启攒、布政事、纳畜、取鱼、颁诏、补垣、纳采、举正直、安抚边境、苫盖、修仓库、缮城郭、鼓铸、裁制、宣政事、临政、乘船渡水、酝酿、立券交易、招贤、开仓、祈福、解除、施恩、筑堤防、求嗣、塞穴、上册、庆赐、修宫室、选将、营建、出师、搬移
2000-09-22	二零零零 庚辰[龙]年	八月大	廿五	周五	无	无	无	庚辰 乙酉 癸未 丁巳	无	秋分 (9, 23)	龙	处女座	结婚姻、宴会、上表章、上官、入学、进人口、竖柱上梁、开市、纳财、牧养、纳畜、颁诏、纳采、举正直、雪冤、裁制、宣政事、临政、招贤、祈福、解除、施恩、求嗣、覃恩、上册、庆赐、恤孤茕、搬移	平治道涂、破屋坏垣、伐木、畋猎、取鱼、营建、筑堤防、补垣、修饰垣墙
2000-09-23	二零零零 庚辰[龙]年	八月大	廿六	周六	无	无	无	庚辰 乙酉 甲申 己巳	秋分	寒露 (10, 8)	龙	天秤座	祭祀、沐浴、剃头、经络、纳财、扫舍宇、栽种、牧养、补垣、雪冤、整手足甲、裁制、酝酿、筑堤防、塞穴、覃恩、整容、恤孤茕	出行、结婚姻、宴会、嫁娶、安床、修造、求医疗病、上表章、上官、进人口、竖柱上梁、开市、修置产室、开渠、穿井、安葬、布政事、纳畜、颁诏、纳采、举正直、安抚边境、宣政事、临政、针刺、立券交易、招贤、开仓、祈福、解除、施恩、求嗣、上册、庆赐、修宫室、选将、营建、出师、疗目、搬移
2000-09-24	二零零零 庚辰[龙]年	八月大	廿七	周日	无	无	无	庚辰 乙酉 乙酉 辛巳	无	寒露 (10, 8)	龙	天秤座	祭祀、沐浴、扫舍宇、赴任、雪冤、入宅、覃恩、恤孤茕	宴会、冠带、立券、修置产室、开渠、穿井、平治道涂、破屋坏垣、伐木、畋猎、启攒、布政事、取鱼、补垣、开张、苫盖、鼓铸、乘船渡水、开仓、筑堤防、塞穴、修饰垣墙
2000-09-25	二零零零 庚辰[龙]年	八月大	廿八	周一	无	无	无	庚辰 乙酉 丙戌 癸巳	无	寒露 (10, 8)	龙	天秤座	祭祀、沐浴、剃头、扫舍宇、栽种、赴任、举正直、整手足甲、临政、诉讼、解除、施恩、整容	出行、宴会、嫁娶、修造、求医疗病、上表章、上官、进人口、经络、开市、纳财、修置产室、牧养、破土、安葬、启攒、出师、纳畜、纳采、安抚边境、修仓库、针刺、酝酿、立券交易、开仓、祈福、求嗣、上册、庆赐、选将、搬移
2000-09-26	二零零零 庚辰[龙]年	八月大	廿九	周二	无	至圣先师孔子诞	无	庚辰 乙酉 丁亥 乙巳	无	寒露 (10, 8)	龙	天秤座	出行、宴会、沐浴、上表章、进人口、竖柱上梁、经络、开市、纳财、补垣、缮城郭、裁制、立券交易、塞穴、上册、庆赐、修宫室	祭祀、结婚姻、嫁娶、剃头、修造、破土、启攒、安抚边境、整容、纳畜、招贤、选将、施恩、出师、纳采、举正直
2000-09-27	二零零零 庚辰[龙]年	八月大	三十	周三	无	无	世界旅游日	庚辰 乙酉 戊子 丁巳	无	寒露 (10, 8)	龙	天秤座	祭祀、沐浴、平治道涂、修饰垣墙	出行、结婚姻、宴会、嫁娶、安床、修造、求医疗病、上表章、上官、冠带、进人口、竖柱上梁、经络、开市、纳财、修置产室、开渠、穿井、捕捉、畋猎、栽种、牧养、破土、安葬、启攒、布政事、出师、纳畜、取鱼、颁诏、纳采、举正直、安抚边境、修仓库、缮城郭、鼓铸、裁制、宣政事、临政、酝酿、立券交易、招贤、开仓、祈福、解除、施恩、筑堤防、求嗣、上册、庆赐、修宫室、选将、营建、搬移
2000-09-28	二零零零 庚辰[龙]年	九月小	初一	周四	无	北斗九星降世	无	庚辰 乙酉 己丑 己巳	无	寒露 (10, 8)	龙	天秤座	结婚姻、宴会、嫁娶、修造、进人口、竖柱上梁、经络、安碓硙、牧养、纳畜、纳采、缮城郭、裁制、酝酿、庆赐、修宫室	求医疗病、上表章、开市、修置产室、上册、安抚边境、整手足甲、选将、开仓、解除、出师
2000-09-29	二零零零 庚辰[龙]年	九月小	初二	周五	无	无	无	庚辰 乙酉 庚寅 辛巳	无	寒露 (10, 8)	龙	天秤座	沐浴、捕捉、雪冤、入宅、覃恩、恤孤茕	祭祀、安床、冠带、进人口、经络、开市、纳财、修置产室、开渠、穿井、安碓硙、破屋坏垣、畋猎、启攒、布政事、取鱼、补垣、鼓铸、酝酿、开仓、筑堤防、塞穴、修饰垣墙、修宫室、远回
2000-09-30	二零零零 庚辰[龙]年	九月小	初三	周六	无	五瘟神诞	无	庚辰 乙酉 辛卯 癸巳	无	寒露 (10, 8)	龙	天秤座	诸事不宜	诸事不宜
