2007-04-01	2007-2-14	29	开	日	丁亥 癸卯 乙丑	无	清明 (4, 5)	愚人节	无	无	祭祀 开光 塑绘 酬神 斋醮 订盟 纳采 嫁娶 裁衣 动土 起基 出火 拆卸 移徙 入宅 安香 修造 竖柱 上梁 纳畜 牧养 祈福 求嗣 解除 伐木 定磉 盖屋 安门	栽种 安葬
2007-04-02	2007-2-15	29	闭	一	丁亥 癸卯 丙寅	无	清明 (4, 5)	无	无	无	订盟 纳采 冠笄 拆卸 修造 动土 安床 入殓 除服 成服 移柩 安葬 破土 启钻 造仓	作灶 开光 嫁娶 开市 入宅
2007-04-03	2007-2-16	29	建	二	丁亥 癸卯 丁卯	无	清明 (4, 5)	无	无	无	祈福 开光 塑绘 酬神 订盟 纳采 裁衣 安床 开市 立券 入殓 除服 成服 移柩 启钻 安葬 立碑 赴任 会亲友 出行 交易 竖柱	作灶 掘井 动土 栽种
2007-04-04	2007-2-17	29	除	三	丁亥 癸卯 戊辰	无	清明 (4, 5)	无	无	无	祭祀 扫舍 塞穴	栽种 作灶 安葬 嫁娶
2007-04-05	2007-2-18	29	除	四	丁亥 甲辰 己巳	清明	谷雨 (4, 20)	无	无	无	嫁娶 祭祀 祈福 求嗣 斋醮 开光 出火 移徙 入宅 竖柱 上梁 会亲友 盖屋 起基 治病 安门 造车器 掘井 开池	纳采 出行 修坟 安葬 开市 立券 作灶
2007-04-06	2007-2-19	29	满	五	丁亥 甲辰 庚午	无	谷雨 (4, 20)	无	无	无	祭祀 塑绘 开光 纳采 嫁娶 开市 出行 会亲友 安床 结网 除服 成服 启钻 安葬 移柩	祈福 入宅 盖屋 动土 破土 探病
2007-04-07	2007-2-20	29	平	六	丁亥 甲辰 辛未	无	谷雨 (4, 20)	无	无	无	祭祀 作灶 平治道涂 馀事勿取	安床 入宅 安碓磑 栽种
2007-04-08	2007-2-21	29	定	日	丁亥 甲辰 壬申	无	谷雨 (4, 20)	无	无	无	祭祀 祈福 求嗣 斋醮 沐浴 纳畜 入殓 破土 安葬	移徙 入宅 嫁娶 出行 安床
2007-04-09	2007-2-22	29	执	一	丁亥 甲辰 癸酉	无	谷雨 (4, 20)	无	无	无	纳采 祭祀 祈福 求嗣 斋醮 出行 起基 盖屋 定磉 安门 入殓 安葬	嫁娶 开市 纳财 出火
2007-04-10	2007-2-23	29	破	二	丁亥 甲辰 甲戌	无	谷雨 (4, 20)	无	无	无	祭祀 沐浴 解除 求医 治病 破屋 坏垣 馀事勿取	祈福 斋醮 开市 安葬
2007-04-11	2007-2-24	29	危	三	丁亥 甲辰 乙亥	无	谷雨 (4, 20)	无	无	无	沐浴 捕捉 畋猎 结网 取渔	祭祀 嫁娶 入宅 作灶 安葬
2007-04-12	2007-2-25	29	成	四	丁亥 甲辰 丙子	无	谷雨 (4, 20)	无	无	无	祭祀 祈福 求嗣 斋醮 纳采 订盟 开光 竖柱 上梁 开仓 出货财 盖屋 起基 定磉 安门 诸事不宜 破土 入殓 启钻 谢土	出火 嫁娶 开市
2007-04-13	2007-2-26	29	收	五	丁亥 甲辰 丁丑	无	谷雨 (4, 20)	无	无	无	祭祀 捕捉 解除 馀事勿取	嫁娶 安葬
2007-04-14	2007-2-27	29	开	六	丁亥 甲辰 戊寅	无	谷雨 (4, 20)	无	无	无	纳采 嫁娶 出行 开市 立券 纳畜 牧养 出火 移徙 入宅	祈福 动土 破土 安葬 入殓
2007-04-15	2007-2-28	29	闭	日	丁亥 甲辰 己卯	无	谷雨 (4, 20)	无	无	无	祭祀 祈福 求嗣 斋醮 冠笄 作灶 纳财 交易	开光 嫁娶 掘井 安葬 安门 探病
2007-04-16	2007-2-29	29	建	一	丁亥 甲辰 庚辰	无	谷雨 (4, 20)	无	无	无	祭祀 解除 教牛马 出行 馀事勿取	动土 破土 行丧 开光 作梁 安葬 探病
2007-04-17	2007-3-1	30	除	二	丁亥 甲辰 辛巳	无	谷雨 (4, 20)	无	无	无	沐浴 斋醮 解除 求医 治病 会亲友 造畜稠 栽种 理发 扫舍	开市 嫁娶 移徙 入宅 掘井 安葬
2007-04-18	2007-3-2	30	满	三	丁亥 甲辰 壬午	无	谷雨 (4, 20)	无	无	无	求嗣 出行 解除 订盟 纳采 嫁娶 会亲友 进人口 安床 开市 交易 纳畜 牧养 入殓 除服 成服 移柩 安葬 启钻	祈福 修造 动土 破土 谢土
2007-04-19	2007-3-3	30	平	四	丁亥 甲辰 癸未	无	谷雨 (4, 20)	无	无	无	祭祀 作灶 平治道涂 馀事勿取	嫁娶 安葬 动土 安床 治病
2007-04-20	2007-3-4	30	定	五	丁亥 甲辰 甲申	谷雨	立夏 (5, 6)	无	无	无	造车器 祭祀 祈福 求嗣 斋醮 开市 交易 安机械 雕刻 开光 盖屋 合脊 起基 定磉 安门 纳畜 安葬 开生坟 立碑 谢土	入宅 动土 开仓 出货财
2007-04-21	2007-3-5	30	执	六	丁亥 甲辰 乙酉	无	立夏 (5, 6)	无	无	无	祭祀 祈福 开光 求嗣 斋醮 纳采 订盟 求医 治病 起基 定磉 造船 取渔 解除 安葬 启钻 谢土 入殓	开市 动土 掘井 开池
2007-04-22	2007-3-6	30	破	日	丁亥 甲辰 丙戌	无	立夏 (5, 6)	无	无	无	祭祀 沐浴 破屋 坏垣 求医 治病 解除 馀事勿取	嫁娶 开市 交易 入宅 安葬
2007-04-23	2007-3-7	30	危	一	丁亥 甲辰 丁亥	无	立夏 (5, 6)	无	无	无	诸事不宜	无
2007-04-24	2007-3-8	30	成	二	丁亥 甲辰 戊子	无	立夏 (5, 6)	无	无	无	祭祀 塑绘 开光 订盟 纳采 冠笄 裁衣 安机械 拆卸 修造 动土 安床 经络 开市	出火 入宅 安葬 伐木
2007-04-25	2007-3-9	30	收	三	丁亥 甲辰 己丑	无	立夏 (5, 6)	无	无	无	祭祀 馀事勿取	造庙 嫁娶 安床
2007-04-26	2007-3-10	30	开	四	丁亥 甲辰 庚寅	无	立夏 (5, 6)	无	无	无	订盟 纳采 嫁娶 进人口 会亲友 交易 立券 动土 除服 谢土 移柩 破土 启钻 赴任 出行 开市 纳财 栽种	入殓 安葬 入宅 安床
2007-04-27	2007-3-11	30	闭	五	丁亥 甲辰 辛卯	无	立夏 (5, 6)	无	无	无	祭祀 祈福 裁衣 合帐 安床 入殓 除服 成服 移柩 破土 启钻 安葬 谢土 立碑 造畜稠	掘井 安门 嫁娶 纳采
2007-04-28	2007-3-12	30	建	六	丁亥 甲辰 壬辰	无	立夏 (5, 6)	无	工	劳动节 2007-05-01	祭祀 进人口 嫁娶 安床 解除 冠笄 出行 裁衣 扫舍	掘井 动土 破土 安葬 开光
2007-04-29	2007-3-13	30	除	日	丁亥 甲辰 癸巳	无	立夏 (5, 6)	无	工	劳动节 2007-05-01	纳采 开光 求医 治病 动土 上梁 移徙 入宅	嫁娶 开市 安葬
2007-04-30	2007-3-14	30	满	一	丁亥 甲辰 甲午	无	立夏 (5, 6)	无	无	无	祭祀 会亲友 开市 安床 启钻 安葬	嫁娶 动土 破土
