2009-02-01	二零零九 己丑[牛]年 正月大初七	周日	无	无	无	己丑 乙丑 丁丑 乙巳	无	立春 (2, 4)	牛	水瓶座	宴会、经络、纳财、庆赐、裁制、纳畜、举正直、酝酿、施恩、立券交易	剃头、求医疗病、上表章、冠带、修置产室、开渠、穿井、平治道涂、破屋坏垣、伐木、捕捉、畋猎、栽种、破土、安葬、启攒、补垣、搬移、开仓、颁诏、解除、整容、筑堤防、求嗣、营建、取鱼、修饰垣墙、宣政事、上册、整手足甲、祈福
2009-02-02	二零零九 己丑[牛]年 正月大初八	周一	无	五殿阎罗天子诞	世界湿地日	己丑 乙丑 戊寅 丁巳	无	立春 (2, 4)	牛	水瓶座	沐浴、扫舍宇	祭祀、上表章、开渠、穿井、安葬、启攒、补垣、颁诏、招贤、布政事、筑堤防、营建、宣政事、上册、塞穴
2009-02-03	二零零九 己丑[牛]年 正月大初九	周二	无	玉皇上帝诞	无	己丑 乙丑 己卯 己巳	无	立春 (2, 4)	牛	水瓶座	出行、结婚姻、宴会、嫁娶、修造、求医疗病、上表章、进人口、竖柱上梁、经络、开市、纳财、栽种、牧养、破土、安葬、庆赐、补垣、搬移、裁制、开仓、纳采、立券交易、修仓库、赴任、入宅、纳畜、恤孤茕、出师、布政事、选将、覃恩、雪冤、缮城郭、安抚边境、塞穴、上册、修宫室、祈福	祭祀、剃头、上官、冠带、修置产室、开渠、穿井、安碓硙、平治道涂、破屋坏垣、启攒、临政、鼓铸、颁诏、解除、招贤、整容、筑堤防、举正直、求嗣、营建、施恩、修饰垣墙、宣政事、整手足甲
2009-02-04	二零零九 己丑[牛]年 正月大初十	周三	无	无	世界抗癌日	己丑 丙寅 庚辰 辛巳	立春	雨水 (2, 18)	牛	水瓶座	宴会、上表章、竖柱上梁、庆赐、裁制、恤孤茕、布政事、覃恩、雪冤、缮城郭、上册、修宫室	祭祀、结婚姻、嫁娶、上官、栽种、招贤、举正直、施恩、取鱼、鼓铸、乘船渡水、纳采
2009-02-05	二零零九 己丑[牛]年 正月大十一	周四	无	无	无	己丑 丙寅 辛巳 癸巳	无	雨水 (2, 18)	牛	水瓶座	平治道涂、恤孤茕、覃恩、雪冤	出行、剃头、冠带、修置产室、开渠、穿井、安碓硙、破屋坏垣、畋猎、破土、启攒、补垣、开仓、鼓铸、筑堤防、整容、取鱼、塞穴、修宫室、整手足甲
2009-02-06	二零零九 己丑[牛]年 正月大十二	周五	无	无	无	己丑 丙寅 壬午 乙巳	无	雨水 (2, 18)	牛	水瓶座	祭祀、结婚姻、宴会、嫁娶、修造、上官、冠带、进人口、竖柱上梁、经络、安碓硙、牧养、庆赐、临政、搬移、裁制、纳采、颁诏、恤孤茕、纳畜、招贤、覃恩、举正直、酝酿、求嗣、雪冤、营建、缮城郭、施恩、宣政事、修宫室、祈福	剃头、修置产室、开渠、穿井、畋猎、整容、取鱼、苫盖
2009-02-07	二零零九 己丑[牛]年 正月大十三	周六	无	无	京汉铁路罢工纪念	己丑 丙寅 癸未 丁巳	无	雨水 (2, 18)	牛	水瓶座	宴会、捕捉、破土、庆赐、布政事、覃恩、恤孤茕、雪冤	出行、结婚姻、嫁娶、修造、求医疗病、立券、选将、安抚边境、纳畜、开张、搬移、出师
2009-02-08	二零零九 己丑[牛]年 正月大十四	周日	无	无	无	己丑 丙寅 甲申 己巳	无	雨水 (2, 18)	牛	水瓶座	祭祀、沐浴、求医疗病、扫舍宇、破屋坏垣、赴任、解除、入宅、诉讼	结婚姻、宴会、安床、上官、冠带、进人口、竖柱上梁、经络、开市、纳财、修置产室、开渠、穿井、安碓硙、伐木、栽种、牧养、启攒、庆赐、补垣、临政、开仓、修仓库、鼓铸、颁诏、乘船渡水、纳畜、出师、招贤、布政事、选将、筑堤防、举正直、酝酿、求嗣、营建、缮城郭、施恩、安抚边境、宣政事、修饰垣墙、上册、塞穴、修宫室、立券交易
2009-02-09	二零零九 己丑[牛]年 正月大十五	周一	无	元宵节	无	己丑 丙寅 乙酉 辛巳	无	雨水 (2, 18)	牛	水瓶座	祭祀、沐浴、扫舍宇、恤孤茕、雪冤	出行、结婚姻、宴会、嫁娶、安床、剃头、修造、求医疗病、上表章、上官、冠带、进人口、竖柱上梁、开市、纳财、修置产室、栽种、牧养、安葬、庆赐、临政、搬移、开仓、纳采、立券交易、修仓库、解除、纳畜、出师、招贤、整容、选将、筑堤防、举正直、求嗣、营建、缮城郭、施恩、安抚边境、上册、整手足甲、修宫室、祈福
2009-02-10	二零零九 己丑[牛]年 正月大十六	周二	无	无	国际气象节	己丑 丙寅 丙戌 癸巳	无	雨水 (2, 18)	牛	水瓶座	祭祀、出行、结婚姻、宴会、嫁娶、修造、求医疗病、上表章、上官、入学、进人口、竖柱上梁、经络、开市、纳财、安碓硙、栽种、牧养、安葬、庆赐、临政、搬移、裁制、开仓、纳采、立券交易、修仓库、恤孤茕、解除、出师、纳畜、筑堤防、选将、覃恩、酝酿、求嗣、雪冤、营建、缮城郭、安抚边境、上册、修宫室、祈福	剃头、冠带、修置产室、开渠、穿井、平治道涂、破屋坏垣、伐木、畋猎、破土、启攒、补垣、鼓铸、布政事、整容、取鱼、修饰垣墙、塞穴、远回、整手足甲
2009-02-11	二零零九 己丑[牛]年 正月大十七	周三	无	无	无	己丑 丙寅 丁亥 乙巳	无	雨水 (2, 18)	牛	水瓶座	祭祀、出行、结婚姻、宴会、沐浴、修造、求医疗病、上表章、上官、进人口、竖柱上梁、经络、开市、纳财、捕捉、栽种、牧养、安葬、庆赐、临政、搬移、裁制、开仓、纳采、修仓库、颁诏、恤孤茕、纳畜、出师、解除、招贤、选将、覃恩、举正直、酝酿、求嗣、雪冤、营建、缮城郭、施恩、安抚边境、宣政事、上册、修宫室、立券交易、祈福	嫁娶、剃头、冠带、修置产室、开渠、穿井、安碓硙、破屋坏垣、畋猎、破土、启攒、补垣、鼓铸、布政事、筑堤防、整容、取鱼、修饰垣墙、塞穴、整手足甲
2009-02-12	二零零九 己丑[牛]年 正月大十八	周四	无	无	无	己丑 丙寅 戊子 丁巳	无	雨水 (2, 18)	牛	水瓶座	沐浴、入学、恤孤茕、覃恩、雪冤	结婚姻、冠带、进人口、竖柱上梁、经络、伐木、畋猎、破土、安葬、启攒、补垣、开仓、纳采、入宅、布政事、筑堤防、酝酿、营建、取鱼、塞穴
2009-02-13	二零零九 己丑[牛]年 正月大十九	周五	无	无	无	己丑 丙寅 己丑 己巳	无	雨水 (2, 18)	牛	水瓶座	祭祀、赴任、入宅	出行、结婚姻、宴会、嫁娶、安床、剃头、修造、求医疗病、上表章、上官、冠带、进人口、竖柱上梁、经络、开市、纳财、修置产室、开渠、穿井、安碓硙、平治道涂、破屋坏垣、栽种、牧养、破土、安葬、庆赐、补垣、临政、搬移、裁制、开仓、纳采、立券交易、修仓库、鼓铸、颁诏、解除、纳畜、出师、招贤、布政事、选将、整容、筑堤防、举正直、酝酿、针刺、求嗣、营建、缮城郭、施恩、安抚边境、宣政事、修饰垣墙、上册、塞穴、远回、修宫室、整手足甲、疗目、祈福
2009-02-14	二零零九 己丑[牛]年 正月大二十	周六	无	无	情人节	己丑 丙寅 庚寅 辛巳	无	雨水 (2, 18)	牛	水瓶座	宴会、纳财、庆赐、裁制、立券交易、恤孤茕、纳畜、举正直、酝酿、覃恩、雪冤、施恩	祭祀、剃头、求医疗病、上表章、修置产室、开渠、穿井、平治道涂、破屋坏垣、伐木、捕捉、畋猎、栽种、启攒、补垣、搬移、开仓、解除、整容、筑堤防、求嗣、营建、取鱼、修饰垣墙、上册、整手足甲、祈福
2009-02-15	二零零九 己丑[牛]年 正月大廿一	周日	无	无	无	己丑 丙寅 辛卯 癸巳	无	雨水 (2, 18)	牛	水瓶座	祭祀、出行、结婚姻、宴会、嫁娶、沐浴、剃头、修造、求医疗病、上表章、上官、竖柱上梁、扫舍宇、栽种、牧养、安葬、庆赐、临政、搬移、裁制、纳采、修仓库、颁诏、解除、恤孤茕、出师、纳畜、招贤、整容、选将、覃恩、举正直、求嗣、雪冤、营建、缮城郭、施恩、安抚边境、宣政事、上册、整手足甲、立券交易、祈福	冠带、修置产室、穿井、畋猎、开仓、筑堤防、取鱼、修宫室、乘船渡水
2009-02-16	二零零九 己丑[牛]年 正月大廿二	周一	无	无	无	己丑 丙寅 壬辰 乙巳	无	雨水 (2, 18)	牛	水瓶座	出行、宴会、修造、上表章、竖柱上梁、经络、牧养、安葬、庆赐、搬移、裁制、颁诏、恤孤茕、解除、纳畜、覃恩、求嗣、雪冤、营建、缮城郭、宣政事、上册、修宫室、祈福	祭祀、开渠、穿井、畋猎、取鱼、鼓铸、乘船渡水
2009-02-17	二零零九 己丑[牛]年 正月大廿三	周二	无	无	无	己丑 丙寅 癸巳 丁巳	无	雨水 (2, 18)	牛	水瓶座	平治道涂	祭祀、出行、结婚姻、宴会、嫁娶、安床、剃头、修造、求医疗病、上表章、上官、冠带、进人口、竖柱上梁、经络、开市、纳财、修置产室、开渠、穿井、安碓硙、破屋坏垣、栽种、牧养、破土、安葬、启攒、庆赐、补垣、临政、搬移、裁制、开仓、纳采、修仓库、鼓铸、颁诏、解除、纳畜、出师、乘船渡水、招贤、布政事、选将、筑堤防、整容、举正直、酝酿、求嗣、营建、缮城郭、施恩、安抚边境、宣政事、修饰垣墙、上册、塞穴、修宫室、整手足甲、立券交易、祈福
2009-02-18	二零零九 己丑[牛]年 正月大廿四	周三	无	无	无	己丑 丙寅 甲午 己巳	雨水	惊蛰 (3, 5)	牛	水瓶座	祭祀、结婚姻、宴会、上官、冠带、进人口、竖柱上梁、经络、安碓硙、牧养、庆赐、临政、搬移、裁制、纳采、赴任、颁诏、入宅、纳畜、恤孤茕、招贤、举正直、酝酿、覃恩、求嗣、雪冤、营建、缮城郭、施恩、宣政事、修宫室、祈福、诉讼	修置产室、苫盖、出师
2009-02-19	二零零九 己丑[牛]年 正月大廿五	周四	无	无	邓小平逝世纪念日	己丑 丙寅 乙未 辛巳	无	惊蛰 (3, 5)	牛	双鱼座	捕捉、取鱼	出行、结婚姻、安床、修造、求医疗病、上官、冠带、进人口、竖柱上梁、开市、修置产室、栽种、牧养、安葬、启攒、临政、搬移、纳采、修仓库、解除、纳畜、出师、筑堤防、选将、营建、缮城郭、安抚边境、修宫室、立券交易
2009-02-20	二零零九 己丑[牛]年 正月大廿六	周五	无	无	无	己丑 丙寅 丙申 癸巳	无	惊蛰 (3, 5)	牛	双鱼座	祭祀、沐浴、求医疗病、扫舍宇、破屋坏垣、恤孤茕、解除、覃恩、雪冤	冠带、修置产室、开渠、穿井、安碓硙、伐木、畋猎、启攒、布政事、筑堤防、补垣、取鱼、修饰垣墙、鼓铸、塞穴
2009-02-21	二零零九 己丑[牛]年 正月大廿七	周六	无	无	国际母语日	己丑 丙寅 丁酉 乙巳	无	惊蛰 (3, 5)	牛	双鱼座	祭祀、出行、结婚姻、嫁娶、安床、沐浴、修造、求医疗病、上表章、上官、竖柱上梁、纳财、扫舍宇、栽种、牧养、安葬、临政、搬移、裁制、开仓、纳采、修仓库、颁诏、恤孤茕、解除、出师、纳畜、招贤、选将、覃恩、举正直、求嗣、雪冤、营建、缮城郭、安抚边境、施恩、宣政事、上册、修宫室、整手足甲、祈福	宴会、剃头、冠带、修置产室、畋猎、筑堤防、取鱼
2009-02-22	二零零九 己丑[牛]年 正月大廿八	周日	无	无	无	己丑 丙寅 戊戌 丁巳	无	惊蛰 (3, 5)	牛	双鱼座	入学	出行、结婚姻、宴会、嫁娶、安床、剃头、修造、求医疗病、上表章、上官、冠带、进人口、竖柱上梁、经络、开市、纳财、修置产室、开渠、穿井、安碓硙、平治道涂、破屋坏垣、伐木、畋猎、栽种、牧养、破土、安葬、启攒、庆赐、补垣、临政、搬移、裁制、开仓、纳采、立券交易、修仓库、鼓铸、颁诏、解除、纳畜、出师、招贤、布政事、选将、整容、筑堤防、举正直、酝酿、求嗣、营建、缮城郭、施恩、安抚边境、宣政事、修饰垣墙、上册、远回、塞穴、整手足甲、修宫室、祈福
2009-02-23	二零零九 己丑[牛]年 正月大廿九	周一	无	无	无	己丑 丙寅 己亥 己巳	无	惊蛰 (3, 5)	牛	双鱼座	祭祀、出行、结婚姻、宴会、沐浴、修造、进人口、经络、开市、纳财、捕捉、栽种、牧养、安葬、搬移、开仓、纳采、立券交易、赴任、入宅、纳畜、酝酿、取鱼、祈福	嫁娶、剃头、求医疗病、上表章、上官、冠带、竖柱上梁、修置产室、开渠、穿井、安碓硙、破屋坏垣、破土、启攒、庆赐、补垣、临政、裁制、修仓库、鼓铸、颁诏、解除、出师、招贤、布政事、选将、筑堤防、整容、举正直、求嗣、营建、缮城郭、施恩、安抚边境、修饰垣墙、宣政事、上册、塞穴、修宫室、整手足甲
2009-02-24	二零零九 己丑[牛]年 正月大三十	周二	无	无	第三世界青年日	己丑 丙寅 庚子 辛巳	无	惊蛰 (3, 5)	牛	双鱼座	沐浴、入学、恤孤茕、覃恩、雪冤	结婚姻、冠带、进人口、竖柱上梁、经络、伐木、畋猎、安葬、补垣、开仓、纳采、入宅、布政事、筑堤防、酝酿、营建、取鱼、塞穴
2009-02-25	二零零九 己丑[牛]年 二月大初一	周三	无	一殿秦广王诞	无	己丑 丙寅 辛丑 癸巳	无	惊蛰 (3, 5)	牛	双鱼座	祭祀、恤孤茕、覃恩、雪冤	出行、结婚姻、宴会、嫁娶、安床、剃头、修造、求医疗病、上表章、上官、冠带、进人口、竖柱上梁、经络、开市、纳财、修置产室、开渠、穿井、安碓硙、平治道涂、破屋坏垣、畋猎、栽种、牧养、破土、安葬、庆赐、补垣、临政、搬移、裁制、开仓、纳采、立券交易、修仓库、鼓铸、颁诏、解除、纳畜、出师、招贤、布政事、选将、整容、筑堤防、举正直、酝酿、针刺、求嗣、营建、缮城郭、施恩、取鱼、宣政事、安抚边境、修饰垣墙、上册、塞穴、远回、修宫室、整手足甲、疗目、祈福
2009-02-26	二零零九 己丑[牛]年 二月大初二	周四	无	春龙节-福德土地正神诞	无	己丑 丙寅 壬寅 乙巳	无	惊蛰 (3, 5)	牛	双鱼座	宴会、经络、纳财、牧养、庆赐、裁制、恤孤茕、纳畜、举正直、覃恩、酝酿、雪冤、施恩、立券交易	祭祀、剃头、修置产室、开渠、穿井、平治道涂、破屋坏垣、伐木、捕捉、畋猎、启攒、整容、筑堤防、补垣、取鱼、修饰垣墙、整手足甲、开仓
2009-02-27	二零零九 己丑[牛]年 二月大初三	周五	无	文昌帝君诞	无	己丑 丙寅 癸卯 丁巳	无	惊蛰 (3, 5)	牛	双鱼座	出行、结婚姻、宴会、沐浴、剃头、求医疗病、上官、扫舍宇、临政、解除、出师、整容、选将、安抚边境、整手足甲、立券交易	嫁娶、安床、修造、上表章、冠带、进人口、竖柱上梁、开市、纳财、修置产室、穿井、栽种、牧养、搬移、开仓、纳采、修仓库、乘船渡水、纳畜、招贤、筑堤防、求嗣、营建、缮城郭、取鱼、上册、修宫室、祈福
2009-02-28	二零零九 己丑[牛]年 二月大初四	周六	无	无	无	己丑 丙寅 甲辰 己巳	无	惊蛰 (3, 5)	牛	双鱼座	宴会、上表章、竖柱上梁、经络、庆赐、搬移、裁制、赴任、入宅、缮城郭、上册、修宫室、诉讼	祭祀、结婚姻、上官、栽种、破土、启攒、招贤、举正直、施恩、取鱼、鼓铸、乘船渡水、出师
