2010-10-01	二零一零 庚寅[虎]年	八月大	廿四	周五	庚寅 乙酉 甲申 己巳	无	寒露 (10, 8)	国庆节	灶君夫人诞	无	虎	天秤座	祭祀、沐浴、剃头、经络、纳财、扫舍宇、栽种、牧养、裁制、覃恩、恤孤茕、补垣、雪冤、整容、塞穴、酝酿、整手足甲、筑堤防	出行、结婚姻、宴会、嫁娶、安床、修造、求医疗病、上表章、上官、进人口、竖柱上梁、开市、修置产室、开渠、穿井、安葬、搬移、祈福、开仓、上册、修宫室、颁诏、求嗣、庆赐、针刺、招贤、布政事、宣政事、安抚边境、疗目、施恩、立券交易、临政、纳畜、举正直、解除、选将、营建、纳采、出师
2010-10-02	二零一零 庚寅[虎]年	八月大	廿五	周六	庚寅 乙酉 乙酉 辛巳	无	寒露 (10, 8)	无	无	无	虎	天秤座	祭祀、沐浴、扫舍宇、覃恩、恤孤茕、雪冤、入宅、赴任	宴会、冠带、修置产室、开渠、穿井、平治道涂、破屋坏垣、伐木、畋猎、启攒、开仓、补垣、取鱼、布政事、修饰垣墙、塞穴、乘船渡水、鼓铸、筑堤防、苫盖
2010-10-03	二零一零 庚寅[虎]年	八月大	廿六	周日	庚寅 乙酉 丙戌 癸巳	无	寒露 (10, 8)	无	无	无	虎	天秤座	祭祀、出行、沐浴、剃头、扫舍宇、栽种、诉讼、整容、施恩、临政、举正直、解除、赴任、整手足甲	宴会、嫁娶、修造、求医疗病、上表章、上官、进人口、经络、开市、纳财、修置产室、牧养、破土、安葬、启攒、祈福、开仓、上册、求嗣、庆赐、针刺、安抚边境、立券交易、纳畜、修仓库、酝酿、选将、纳采、出师
2010-10-04	二零一零 庚寅[虎]年	八月大	廿七	周一	庚寅 乙酉 丁亥 乙巳	无	寒露 (10, 8)	无	无	世界动物日	虎	天秤座	出行、宴会、沐浴、上表章、进人口、竖柱上梁、经络、开市、纳财、缮城郭、裁制、上册、修宫室、庆赐、补垣、立券交易、塞穴	祭祀、结婚姻、嫁娶、剃头、修造、立券、破土、启攒、招贤、纳畜、整容、选将、开张、安抚边境、举正直、纳采、出师、施恩
2010-10-05	二零一零 庚寅[虎]年	八月大	廿八	周二	庚寅 乙酉 戊子 丁巳	无	寒露 (10, 8)	无	无	无	虎	天秤座	祭祀、沐浴、平治道涂、修饰垣墙	出行、结婚姻、宴会、嫁娶、安床、修造、求医疗病、上表章、上官、冠带、进人口、竖柱上梁、经络、开市、纳财、修置产室、开渠、穿井、捕捉、畋猎、栽种、牧养、破土、安葬、启攒、搬移、祈福、缮城郭、开仓、裁制、上册、修宫室、颁诏、求嗣、庆赐、取鱼、招贤、布政事、宣政事、安抚边境、施恩、立券交易、临政、纳畜、举正直、解除、修仓库、酝酿、选将、鼓铸、营建、纳采、出师、筑堤防
2010-10-06	二零一零 庚寅[虎]年	八月大	廿九	周三	庚寅 乙酉 己丑 己巳	无	寒露 (10, 8)	无	至圣先师孔子诞	无	虎	天秤座	结婚姻、宴会、嫁娶、修造、进人口、竖柱上梁、经络、安碓硙、牧养、缮城郭、裁制、修宫室、庆赐、纳畜、酝酿、纳采	求医疗病、上表章、开市、修置产室、选将、安抚边境、解除、出师、开仓、上册
2010-10-07	二零一零 庚寅[虎]年	八月大	三十	周四	庚寅 乙酉 庚寅 辛巳	无	寒露 (10, 8)	无	无	无	虎	天秤座	沐浴、捕捉、覃恩、恤孤茕、雪冤、入宅	祭祀、安床、冠带、进人口、经络、开市、纳财、修置产室、开渠、穿井、安碓硙、破屋坏垣、畋猎、启攒、开仓、修宫室、补垣、取鱼、布政事、修饰垣墙、塞穴、酝酿、远回、鼓铸、筑堤防
2010-10-08	二零一零 庚寅[虎]年	九月小	初一	周五	庚寅 丙戌 辛卯 癸巳	寒露	霜降 (10, 23)	无	北斗九星降世	无	虎	天秤座	祭祀、出行、结婚姻、宴会、嫁娶、修造、求医疗病、上表章、上官、进人口、竖柱上梁、经络、开市、纳财、捕捉、栽种、牧养、安葬、搬移、祈福、缮城郭、裁制、上册、颁诏、求嗣、覃恩、恤孤茕、雪冤、庆赐、招贤、宣政事、安抚边境、施恩、立券交易、临政、纳畜、举正直、解除、修仓库、酝酿、选将、营建、纳采、出师	诸事不忌
2010-10-09	二零一零 庚寅[虎]年	九月小	初二	周六	庚寅 丙戌 壬辰 乙巳	无	霜降 (10, 23)	无	无	无	虎	天秤座	祭祀、沐浴、破屋坏垣、解除	冠带、修置产室、开渠、穿井、安碓硙、伐木、捕捉、畋猎、破土、启攒、上册、颁诏、补垣、取鱼、招贤、布政事、宣政事、修饰垣墙、塞穴、修仓库、鼓铸、营建、筑堤防
2010-10-10	二零一零 庚寅[虎]年	九月小	初三	周日	庚寅 丙戌 癸巳 丁巳	无	霜降 (10, 23)	无	五瘟神诞	辛亥革命纪念日	虎	天秤座	祭祀、宴会、安床、上官、竖柱上梁、纳财、栽种、牧养、搬移、缮城郭、裁制、修宫室、庆赐、恤孤茕、雪冤、安抚边境、施恩、临政、举正直、选将、纳采	出行、破土、安葬、启攒、针刺、纳畜、修仓库
2010-10-11	二零一零 庚寅[虎]年	九月小	初四	周一	庚寅 丙戌 甲午 己巳	无	霜降 (10, 23)	无	无	无	虎	天秤座	出行、结婚姻、宴会、嫁娶、修造、上官、入学、进人口、竖柱上梁、经络、开市、纳财、安碓硙、搬移、缮城郭、裁制、修宫室、庆赐、安抚边境、施恩、立券交易、临政、纳畜、举正直、修仓库、酝酿、选将、纳采、筑堤防、出师	开仓、苫盖
2010-10-12	二零一零 庚寅[虎]年	九月小	初五	周二	庚寅 丙戌 乙未 辛巳	无	霜降 (10, 23)	无	无	无	虎	天秤座	捕捉、赴任、入宅	结婚姻、宴会、剃头、求医疗病、上表章、上官、冠带、竖柱上梁、修置产室、开渠、穿井、安碓硙、破屋坏垣、安葬、启攒、祈福、缮城郭、裁制、上册、开仓、修宫室、颁诏、求嗣、庆赐、补垣、招贤、整容、布政事、宣政事、施恩、修饰垣墙、临政、举正直、解除、塞穴、乘船渡水、修仓库、鼓铸、营建、整手足甲、筑堤防
2010-10-13	二零一零 庚寅[虎]年	九月小	初六	周三	庚寅 丙戌 丙申 癸巳	无	霜降 (10, 23)	无	无	中国少年先锋队诞辰日	虎	天秤座	沐浴、剃头、求医疗病、上表章、上官、入学、竖柱上梁、开市、修置产室、开渠、穿井、安碓硙、扫舍宇、栽种、牧养、祈福、缮城郭、裁制、上册、修宫室、颁诏、求嗣、覃恩、恤孤茕、雪冤、招贤、整容、宣政事、安抚边境、施恩、临政、纳畜、举正直、解除、修仓库、选将、营建、出师	安床、伐木、畋猎、取鱼、乘船渡水、立券交易
2010-10-14	二零一零 庚寅[虎]年	九月小	初七	周四	庚寅 丙戌 丁酉 乙巳	无	霜降 (10, 23)	无	无	无	虎	天秤座	沐浴、扫舍宇、补垣、整手足甲、塞穴	出行、结婚姻、宴会、嫁娶、安床、剃头、修造、求医疗病、上表章、上官、冠带、进人口、竖柱上梁、经络、开市、纳财、修置产室、开渠、穿井、栽种、牧养、破土、安葬、启攒、搬移、祈福、缮城郭、开仓、上册、修宫室、颁诏、求嗣、庆赐、针刺、招贤、整容、布政事、宣政事、安抚边境、施恩、疗目、立券交易、临政、纳畜、举正直、解除、修仓库、酝酿、选将、营建、纳采、出师、筑堤防
2010-10-15	二零一零 庚寅[虎]年	九月小	初八	周五	庚寅 丙戌 戊戌 丁巳	无	霜降 (10, 23)	无	无	无	虎	天秤座	出行、宴会、嫁娶、上官、进人口、经络、纳财、牧养、搬移、裁制、庆赐、招贤、施恩、立券交易、临政、纳畜、举正直、酝酿	剃头、求医疗病、上表章、修置产室、开渠、穿井、平治道涂、破屋坏垣、伐木、破土、安葬、启攒、祈福、开仓、上册、求嗣、补垣、整容、修饰垣墙、解除、营建、整手足甲、筑堤防
2010-10-16	二零一零 庚寅[虎]年	九月小	初九	周六	庚寅 丙戌 己亥 己巳	无	霜降 (10, 23)	无	重阳节-酆都大帝诞	无	虎	天秤座	沐浴、扫舍宇	结婚姻、宴会、嫁娶、安床、修造、上表章、冠带、进人口、竖柱上梁、修置产室、开渠、穿井、安碓硙、平治道涂、破屋坏垣、破土、安葬、启攒、搬移、祈福、缮城郭、裁制、上册、修宫室、颁诏、求嗣、庆赐、补垣、招贤、布政事、宣政事、修饰垣墙、塞穴、修仓库、鼓铸、营建、纳采、筑堤防
2010-10-17	二零一零 庚寅[虎]年	九月小	初十	周日	庚寅 丙戌 庚子 辛巳	无	霜降 (10, 23)	无	无	无	虎	天秤座	出行、结婚姻、宴会、嫁娶、沐浴、修造、求医疗病、上表章、上官、进人口、竖柱上梁、经络、开市、纳财、栽种、牧养、诉讼、搬移、祈福、缮城郭、裁制、开仓、上册、修宫室、求嗣、庆赐、补垣、入宅、立券交易、临政、纳畜、解除、塞穴、修仓库、赴任、纳采	祭祀、剃头、冠带、修置产室、开渠、穿井、安碓硙、破屋坏垣、安葬、颁诏、招贤、整容、布政事、宣政事、安抚边境、修饰垣墙、选将、远回、鼓铸、营建、整手足甲、出师、筑堤防、苫盖
2010-10-18	二零一零 庚寅[虎]年	九月小	十一	周一	庚寅 丙戌 辛丑 癸巳	无	霜降 (10, 23)	无	无	无	虎	天秤座	平治道涂、覃恩、恤孤茕、雪冤	祭祀、出行、结婚姻、宴会、嫁娶、安床、剃头、修造、求医疗病、上表章、上官、冠带、进人口、竖柱上梁、经络、开市、纳财、修置产室、开渠、穿井、安碓硙、破屋坏垣、畋猎、栽种、牧养、破土、安葬、启攒、搬移、祈福、缮城郭、开仓、裁制、上册、修宫室、颁诏、求嗣、庆赐、补垣、取鱼、招贤、整容、布政事、宣政事、安抚边境、施恩、立券交易、修饰垣墙、临政、纳畜、举正直、解除、塞穴、修仓库、酝酿、选将、鼓铸、营建、纳采、整手足甲、出师、筑堤防
2010-10-19	二零一零 庚寅[虎]年	九月小	十二	周二	庚寅 丙戌 壬寅 乙巳	无	霜降 (10, 23)	无	无	无	虎	天秤座	诸事不宜	祭祀、出行、结婚姻、宴会、嫁娶、安床、剃头、修造、求医疗病、上表章、上官、冠带、进人口、竖柱上梁、经络、开市、纳财、修置产室、开渠、穿井、安碓硙、平治道涂、破屋坏垣、伐木、畋猎、栽种、牧养、破土、安葬、启攒、搬移、祈福、缮城郭、开仓、裁制、上册、修宫室、颁诏、求嗣、庆赐、补垣、取鱼、招贤、整容、布政事、宣政事、安抚边境、施恩、立券交易、修饰垣墙、临政、纳畜、举正直、解除、塞穴、乘船渡水、修仓库、酝酿、选将、远回、鼓铸、营建、纳采、整手足甲、出师、筑堤防
2010-10-20	二零一零 庚寅[虎]年	九月小	十三	周三	庚寅 丙戌 癸卯 丁巳	无	霜降 (10, 23)	无	孟婆尊神诞	无	虎	天秤座	祭祀、出行、结婚姻、宴会、嫁娶、修造、求医疗病、上官、进人口、竖柱上梁、经络、纳财、捕捉、栽种、牧养、安葬、搬移、祈福、缮城郭、开仓、裁制、修宫室、求嗣、庆赐、安抚边境、立券交易、临政、纳畜、解除、酝酿、纳采	上表章、冠带、修置产室、开渠、穿井、安碓硙、平治道涂、破屋坏垣、上册、补垣、取鱼、招贤、修饰垣墙、乘船渡水、修仓库、选将、营建、出师、筑堤防
2010-10-21	二零一零 庚寅[虎]年	九月小	十四	周四	庚寅 丙戌 甲辰 己巳	无	霜降 (10, 23)	无	无	无	虎	天秤座	祭祀、沐浴、解除	出行、结婚姻、宴会、嫁娶、安床、修造、上官、冠带、进人口、竖柱上梁、经络、开市、修置产室、开渠、穿井、安碓硙、平治道涂、伐木、捕捉、畋猎、破土、启攒、搬移、缮城郭、开仓、上册、裁制、修宫室、颁诏、庆赐、补垣、取鱼、招贤、布政事、宣政事、施恩、立券交易、修饰垣墙、临政、举正直、塞穴、乘船渡水、修仓库、酝酿、鼓铸、营建、纳采、筑堤防
2010-10-22	二零一零 庚寅[虎]年	九月小	十五	周五	庚寅 丙戌 乙巳 辛巳	无	霜降 (10, 23)	无	无	无	虎	天秤座	祭祀、嫁娶、安床、恤孤茕、雪冤、赴任、选将、搬移、安抚边境、纳采、入宅	出行、剃头、求医疗病、修置产室、开渠、穿井、安碓硙、平治道涂、破屋坏垣、栽种、破土、启攒、缮城郭、开仓、修宫室、补垣、针刺、整容、修饰垣墙、纳畜、解除、修仓库、营建、整手足甲、筑堤防
2010-10-23	二零一零 庚寅[虎]年	九月小	十六	周六	庚寅 丙戌 丙午 癸巳	霜降	立冬 (11, 7)	无	无	无	虎	天蝎座	祭祀、出行、结婚姻、宴会、嫁娶、求医疗病、上表章、上官、入学、进人口、竖柱上梁、经络、开市、纳财、牧养、安葬、搬移、祈福、裁制、上册、颁诏、求嗣、覃恩、恤孤茕、雪冤、庆赐、招贤、宣政事、施恩、立券交易、临政、纳畜、举正直、解除、酝酿、纳采	修置产室、开渠、穿井、平治道涂、破屋坏垣、畋猎、补垣、取鱼、修饰垣墙、苫盖
2010-10-24	二零一零 庚寅[虎]年	九月小	十七	周日	庚寅 丙戌 丁未 乙巳	无	立冬 (11, 7)	无	金龙四大王诞	无	虎	天蝎座	捕捉、畋猎	出行、结婚姻、宴会、嫁娶、安床、剃头、修造、求医疗病、上表章、上官、冠带、进人口、竖柱上梁、经络、开市、纳财、修置产室、开渠、穿井、安碓硙、平治道涂、破屋坏垣、栽种、牧养、破土、安葬、启攒、搬移、祈福、缮城郭、裁制、上册、开仓、修宫室、颁诏、求嗣、庆赐、补垣、取鱼、招贤、整容、布政事、宣政事、安抚边境、施恩、立券交易、修饰垣墙、临政、纳畜、举正直、解除、塞穴、乘船渡水、修仓库、酝酿、选将、鼓铸、营建、纳采、整手足甲、出师、筑堤防
2010-10-25	二零一零 庚寅[虎]年	九月小	十八	周一	庚寅 丙戌 戊申 丁巳	无	立冬 (11, 7)	无	无	抗美援朝纪念日	虎	天蝎座	沐浴、剃头、求医疗病、上表章、上官、入学、竖柱上梁、开市、扫舍宇、牧养、祈福、裁制、上册、颁诏、求嗣、覃恩、恤孤茕、雪冤、招贤、整容、宣政事、安抚边境、施恩、临政、纳畜、举正直、解除、选将、整手足甲	平治道涂、破屋坏垣、伐木、畋猎、启攒、补垣、取鱼、筑堤防、乘船渡水、修饰垣墙
2010-10-26	二零一零 庚寅[虎]年	九月小	十九	周二	庚寅 丙戌 己酉 己巳	无	立冬 (11, 7)	无	观世音菩萨出家	无	虎	天蝎座	沐浴、剃头、扫舍宇、覃恩、恤孤茕、雪冤、整容、塞穴	出行、结婚姻、宴会、嫁娶、安床、修造、求医疗病、上表章、上官、冠带、进人口、竖柱上梁、经络、开市、纳财、修置产室、开渠、穿井、安碓硙、平治道涂、破屋坏垣、栽种、牧养、破土、安葬、启攒、搬移、祈福、缮城郭、开仓、上册、修宫室、颁诏、求嗣、庆赐、补垣、针刺、招贤、布政事、宣政事、安抚边境、疗目、施恩、立券交易、临政、修饰垣墙、纳畜、举正直、解除、修仓库、酝酿、选将、营建、纳采、整手足甲、出师、筑堤防
2010-10-27	二零一零 庚寅[虎]年	九月小	二十	周三	庚寅 丙戌 庚戌 辛巳	无	立冬 (11, 7)	无	无	无	虎	天蝎座	祭祀、出行、宴会、嫁娶、上官、进人口、纳财、牧养、搬移、裁制、覃恩、庆赐、恤孤茕、雪冤、招贤、布政事、入宅、安抚边境、施恩、立券交易、临政、纳畜、举正直、酝酿、选将、出师	剃头、上表章、修置产室、开渠、穿井、平治道涂、破屋坏垣、伐木、破土、安葬、启攒、补垣、整容、营建、整手足甲、筑堤防、上册、修饰垣墙
2010-10-28	二零一零 庚寅[虎]年	九月小	廿一	周四	庚寅 丙戌 辛亥 癸巳	无	立冬 (11, 7)	无	无	无	虎	天蝎座	祭祀、出行、结婚姻、宴会、沐浴、剃头、修造、求医疗病、上表章、上官、竖柱上梁、经络、开市、纳财、扫舍宇、栽种、牧养、搬移、祈福、缮城郭、开仓、裁制、上册、颁诏、求嗣、覃恩、恤孤茕、雪冤、庆赐、招贤、整容、宣政事、安抚边境、施恩、立券交易、临政、纳畜、举正直、解除、修仓库、酝酿、选将、营建、纳采、整手足甲、出师	嫁娶、冠带、修置产室、开渠、穿井、安碓硙、平治道涂、破屋坏垣、畋猎、破土、安葬、补垣、取鱼、修宫室、鼓铸、筑堤防、塞穴、修饰垣墙
2010-10-29	二零一零 庚寅[虎]年	九月小	廿二	周五	庚寅 丙戌 壬子 乙巳	无	立冬 (11, 7)	无	无	无	虎	天蝎座	沐浴、诉讼、覃恩、恤孤茕、雪冤、赴任	祭祀、出行、结婚姻、宴会、嫁娶、安床、剃头、修造、求医疗病、上表章、上官、冠带、进人口、竖柱上梁、经络、开市、纳财、修置产室、开渠、穿井、安碓硙、平治道涂、破屋坏垣、栽种、牧养、破土、安葬、启攒、搬移、祈福、缮城郭、裁制、上册、开仓、修宫室、颁诏、求嗣、庆赐、补垣、招贤、整容、布政事、宣政事、安抚边境、入宅、施恩、立券交易、修饰垣墙、临政、纳畜、举正直、解除、塞穴、修仓库、酝酿、选将、远回、鼓铸、营建、纳采、整手足甲、出师、筑堤防、苫盖
2010-10-30	二零一零 庚寅[虎]年	九月小	廿三	周六	庚寅 丙戌 癸丑 丁巳	无	立冬 (11, 7)	无	无	无	虎	天蝎座	诸事不宜	诸事不宜
2010-10-31	二零一零 庚寅[虎]年	九月小	廿四	周日	庚寅 丙戌 甲寅 己巳	无	立冬 (11, 7)	无	无	无	虎	天蝎座	诸事不宜	祭祀、出行、结婚姻、宴会、嫁娶、安床、剃头、修造、求医疗病、上表章、上官、冠带、进人口、竖柱上梁、经络、开市、纳财、修置产室、开渠、穿井、安碓硙、平治道涂、破屋坏垣、伐木、畋猎、栽种、牧养、破土、安葬、启攒、搬移、祈福、缮城郭、开仓、上册、裁制、修宫室、颁诏、求嗣、庆赐、补垣、取鱼、招贤、整容、布政事、宣政事、安抚边境、施恩、立券交易、修饰垣墙、临政、纳畜、举正直、解除、塞穴、乘船渡水、修仓库、酝酿、选将、远回、鼓铸、营建、纳采、整手足甲、出师、筑堤防
