2010-12-01	2010-10-26	30	开	三	庚寅 丁亥 乙酉	无	大雪 (12, 7)	无	无	无	解除 馀事勿取	无
2010-12-02	2010-10-27	30	闭	四	庚寅 丁亥 丙戌	无	大雪 (12, 7)	无	无	无	安床 祭祀 开池 补垣 入殓 移柩 破土 启钻	入宅 移徙 嫁娶 掘井 作灶 出火 进人口 开市 开光
2010-12-03	2010-10-28	30	建	五	庚寅 丁亥 丁亥	无	大雪 (12, 7)	无	无	无	祭祀 沐浴 馀事勿取	无
2010-12-04	2010-10-29	30	除	六	庚寅 丁亥 戊子	无	大雪 (12, 7)	无	无	无	嫁娶 开光 出行 解除 出火 拆卸 修造 进人口 动土 入宅 移徙 栽种 纳畜 掘井 安葬 除服 成服	置产 安床
2010-12-05	2010-10-30	30	满	日	庚寅 丁亥 己丑	无	大雪 (12, 7)	无	无	无	开光 裁衣 安门 会亲友 安床 结网 理发	嫁娶 冠笄 出行 祈福 安葬 伐木 入宅 移徙 出火 栽种 动土 上梁
2010-12-06	2010-11-1	29	平	一	庚寅 丁亥 庚寅	无	大雪 (12, 7)	无	无	无	嫁娶 开光 出行 出火 拆卸 修造 动土 入宅 移徙 安床 上梁 开市 交易 立券 栽种	祈福 祭祀 伐木 掘井 作灶 谢土
2010-12-07	2010-11-2	29	平	二	庚寅 戊子 辛卯	大雪	冬至 (12, 22)	无	无	无	祭祀 入殓 移柩 馀事勿取	入宅 修造 动土 破土 安门 上梁
2010-12-08	2010-11-3	29	定	三	庚寅 戊子 壬辰	无	冬至 (12, 22)	无	无	无	塑绘 开光 订盟 纳采 裁衣 冠笄 拆卸 修造 安床 入宅 出火 安葬 谢土 赴任	掘井 伐木 斋醮 作灶
2010-12-09	2010-11-4	29	执	四	庚寅 戊子 癸巳	无	冬至 (12, 22)	无	无	无	祭祀 塑绘 开光 裁衣 冠笄 嫁娶 纳采 拆卸 修造 动土 竖柱 上梁 安床 移徙 入宅 安香 结网 捕捉 畋猎 伐木 进人口 放水	出行 安葬 修坟 开市
2010-12-10	2010-11-5	29	破	五	庚寅 戊子 甲午	无	冬至 (12, 22)	无	无	无	祭祀 求医 破屋 坏垣 馀事勿取	诸事不宜
2010-12-11	2010-11-6	29	危	六	庚寅 戊子 乙未	无	冬至 (12, 22)	无	无	无	祭祀 祈福 斋醮 出行 冠笄 安机械 移徙 入宅 安香 安床 除服 成服 移柩 启钻	开光 栽种 治病 安门 作灶
2010-12-12	2010-11-7	29	成	日	庚寅 戊子 丙申	无	冬至 (12, 22)	无	无	无	塑绘 斋醮 出行 拆卸 解除 修造 移徙 造船 入殓 除服 成服 移柩 启钻 修坟 立碑 谢土	无
2010-12-13	2010-11-8	29	收	一	庚寅 戊子 丁酉	无	冬至 (12, 22)	无	无	无	祭祀 沐浴 安床 纳财 畋猎 捕捉	开市 破土
2010-12-14	2010-11-9	29	开	二	庚寅 戊子 戊戌	无	冬至 (12, 22)	无	无	无	订盟 纳采 祭祀 祈福 修造 动土 上梁 破土	嫁娶 作灶
2010-12-15	2010-11-10	29	闭	三	庚寅 戊子 己亥	无	冬至 (12, 22)	无	无	无	出行 沐浴 理发 补垣 塞穴	入宅 安葬
2010-12-16	2010-11-11	29	建	四	庚寅 戊子 庚子	无	冬至 (12, 22)	无	无	无	教牛马 馀事勿取	入宅 动土 破土
2010-12-17	2010-11-12	29	除	五	庚寅 戊子 辛丑	无	冬至 (12, 22)	无	无	无	嫁娶 出行 求医 治病 祭祀 祈福 上梁 纳畜	开市 安葬
2010-12-18	2010-11-13	29	满	六	庚寅 戊子 壬寅	无	冬至 (12, 22)	无	无	无	开市 立券 开光 解除 安机械 上梁 启钻 安葬	嫁娶 祈福
2010-12-19	2010-11-14	29	平	日	庚寅 戊子 癸卯	无	冬至 (12, 22)	无	无	无	平治道涂 馀事勿取	诸事不宜
2010-12-20	2010-11-15	29	定	一	庚寅 戊子 甲辰	无	冬至 (12, 22)	无	无	无	求嗣 斋醮 塑绘 订盟 纳采 出火 拆卸 修造 动土 造桥 安机械 栽种 纳畜 牧养 入殓 除服 成服 移柩 破土 安葬	开市 嫁娶
2010-12-21	2010-11-16	29	执	二	庚寅 戊子 乙巳	无	冬至 (12, 22)	无	无	无	嫁娶 订盟 纳采 祭祀 祈福 修造 动土 移徙 入宅	开市 安葬
2010-12-22	2010-11-17	29	破	三	庚寅 戊子 丙午	冬至	小寒 (1, 6)	无	无	无	治病 破屋 坏垣 馀事勿取	诸事不宜
2010-12-23	2010-11-18	29	危	四	庚寅 戊子 丁未	无	小寒 (1, 6)	无	无	无	祭祀 祈福 求嗣 斋醮 开光 入学 订盟 冠笄 伐木 修造 动土 起基 放水 交易 开池	造桥 安门 理发 造庙 栽种 作灶
2010-12-24	2010-11-19	29	成	五	庚寅 戊子 戊申	无	小寒 (1, 6)	平安夜	无	无	解除 坏垣 馀事勿取	诸事不宜
2010-12-25	2010-11-20	29	收	六	庚寅 戊子 己酉	无	小寒 (1, 6)	圣诞节	无	无	沐浴 理发 扫舍	伐木 纳畜 上梁 入宅 作灶 造畜稠 嫁娶 安葬 作梁 造船 安门
2010-12-26	2010-11-21	29	开	日	庚寅 戊子 庚戌	无	小寒 (1, 6)	无	无	无	祭祀 开光 祈福 解除 作梁 动土 安床 掘井 栽种 纳畜 破土 移柩	嫁娶 出行 赴任 盖屋 入殓 入宅 移徙 出火 进人口 安葬
2010-12-27	2010-11-22	29	闭	一	庚寅 戊子 辛亥	无	小寒 (1, 6)	无	无	无	作梁 修造 动土 安门 作灶 塞穴 开池 开厕 筑堤 补垣 栽种	嫁娶 祈福 掘井 行丧 安葬 安床
2010-12-28	2010-11-23	29	建	二	庚寅 戊子 壬子	无	小寒 (1, 6)	无	无	无	安葬 启钻 移柩 入殓 除服 成服	馀事勿取
2010-12-29	2010-11-24	29	除	三	庚寅 戊子 癸丑	无	小寒 (1, 6)	无	无	无	嫁娶 祭祀 祈福 求嗣 出行 出火 拆卸 开市 交易 立券 挂匾 入宅 移徙 安床 栽种	作灶 塑绘 行丧 词讼 伐木 安葬
2010-12-30	2010-11-25	29	满	四	庚寅 戊子 甲寅	无	小寒 (1, 6)	无	无	无	理发 开光 解除 拆卸 修造 安葬 开市 交易 立券 挂匾 安床 栽种	入宅 移徙 作灶 祈福 祭祀 嫁娶 谢土 掘井 盖屋 探病
2010-12-31	2010-11-26	29	平	五	庚寅 戊子 乙卯	无	小寒 (1, 6)	无	无	无	祭祀 修饰垣墙 馀事勿取	诸事不宜
