2011-06-01	二零一一 辛卯[兔]年	四月大	三十	周三	辛卯 癸巳 丁亥 乙巳	无	芒种 (6, 6)	无	无	国际儿童节	兔	双子座	沐浴、破屋坏垣	祭祀、结婚姻、宴会、嫁娶、安床、剃头、修造、上表章、上官、冠带、竖柱上梁、经络、开市、修置产室、开渠、穿井、安碓硙、伐木、捕捉、畋猎、栽种、牧养、破土、安葬、启攒、祈福、缮城郭、开仓、裁制、上册、修宫室、颁诏、求嗣、庆赐、补垣、取鱼、招贤、整容、布政事、宣政事、施恩、立券交易、修饰垣墙、临政、举正直、塞穴、修仓库、酝酿、鼓铸、营建、纳采、整手足甲、筑堤防
2011-06-02	二零一一 辛卯[兔]年	五月小	初一	周四	辛卯 癸巳 戊子 丁巳	无	芒种 (6, 6)	无	南极长生大帝诞	无	兔	双子座	祭祀、宴会、沐浴、裁制、庆赐	上表章、冠带、修置产室、安葬、纳畜、招贤、营建、整手足甲、筑堤防、上册、修仓库
2011-06-03	二零一一 辛卯[兔]年	五月小	初二	周五	辛卯 癸巳 己丑 己巳	无	芒种 (6, 6)	无	无	无	兔	双子座	祭祀、出行、结婚姻、宴会、求医疗病、上表章、上官、入学、进人口、竖柱上梁、经络、开市、纳财、牧养、祈福、开仓、裁制、上册、求嗣、庆赐、立券交易、施恩、临政、纳畜、举正直、解除、酝酿、纳采	冠带、修置产室、开渠、穿井、平治道涂、破屋坏垣、破土、补垣、取鱼、选将、远回、营建、出师、乘船渡水、修饰垣墙
2011-06-04	二零一一 辛卯[兔]年	五月小	初三	周六	辛卯 癸巳 庚寅 辛巳	无	芒种 (6, 6)	无	无	无	兔	双子座	出行、结婚姻、宴会、嫁娶、修造、求医疗病、上表章、上官、进人口、竖柱上梁、纳财、捕捉、栽种、牧养、安葬、诉讼、搬移、祈福、缮城郭、裁制、上册、颁诏、求嗣、覃恩、恤孤茕、雪冤、庆赐、招贤、宣政事、安抚边境、施恩、立券交易、临政、纳畜、举正直、解除、修仓库、赴任、选将、营建、纳采、出师	祭祀、安床、剃头、冠带、经络、开市、修置产室、开渠、穿井、安碓硙、平治道涂、破屋坏垣、畋猎、启攒、开仓、修宫室、补垣、取鱼、整容、布政事、修饰垣墙、塞穴、酝酿、鼓铸、整手足甲、筑堤防
2011-06-05	二零一一 辛卯[兔]年	五月小	初四	周日	辛卯 癸巳 辛卯 癸巳	无	芒种 (6, 6)	无	无	世界环境日	兔	双子座	祭祀、出行、结婚姻、宴会、嫁娶、修造、求医疗病、上表章、上官、入学、竖柱上梁、开市、纳财、修置产室、安碓硙、栽种、牧养、搬移、祈福、缮城郭、裁制、上册、修宫室、颁诏、求嗣、覃恩、恤孤茕、雪冤、庆赐、招贤、宣政事、入宅、安抚边境、施恩、立券交易、临政、纳畜、举正直、解除、修仓库、赴任、选将、营建、纳采、出师	剃头、冠带、穿井、破屋坏垣、伐木、畋猎、补垣、取鱼、整容、鼓铸、布政事、整手足甲、筑堤防、塞穴、开仓、修饰垣墙
2011-06-06	二零一一 辛卯[兔]年	五月小	初五	周一	辛卯 甲午 壬辰 乙巳	芒种	夏至 (6, 22)	端午节	无	全国爱眼日	兔	双子座	结婚姻、宴会、求医疗病、上表章、上官、入学、竖柱上梁、开市、纳财、修置产室、安碓硙、栽种、牧养、诉讼、搬移、祈福、缮城郭、裁制、上册、修宫室、颁诏、求嗣、覃恩、恤孤茕、雪冤、庆赐、招贤、宣政事、施恩、临政、举正直、解除、赴任、纳采	嫁娶、立券、开渠、伐木、畋猎、取鱼、选将、开张、安抚边境、出师、乘船渡水
2011-06-07	二零一一 辛卯[兔]年	五月小	初六	周二	辛卯 甲午 癸巳 丁巳	无	夏至 (6, 22)	无	无	无	兔	双子座	裁制、覃恩、恤孤茕、补垣、雪冤、安抚边境、塞穴、选将、筑堤防	出行、结婚姻、宴会、嫁娶、安床、修造、求医疗病、上表章、上官、进人口、竖柱上梁、开市、修置产室、开渠、穿井、破土、安葬、启攒、搬移、祈福、开仓、上册、修宫室、颁诏、求嗣、庆赐、针刺、招贤、布政事、宣政事、疗目、施恩、临政、举正直、解除、营建、纳采、整手足甲、出师
2011-06-08	二零一一 辛卯[兔]年	五月小	初七	周三	辛卯 甲午 甲午 己巳	无	夏至 (6, 22)	无	无	世界海洋日	兔	双子座	诸事不宜	诸事不宜
2011-06-09	二零一一 辛卯[兔]年	五月小	初八	周四	辛卯 甲午 乙未 辛巳	无	夏至 (6, 22)	无	南方五道诞	无	兔	双子座	出行、结婚姻、宴会、嫁娶、沐浴、剃头、上官、进人口、经络、纳财、扫舍宇、破土、安葬、整容、安抚边境、施恩、立券交易、临政、纳畜、举正直、解除、酝酿、选将、整手足甲、出师	栽种
2011-06-10	二零一一 辛卯[兔]年	五月小	初九	周五	辛卯 甲午 丙申 癸巳	无	夏至 (6, 22)	无	无	无	兔	双子座	出行、嫁娶、沐浴、剃头、修造、上表章、进人口、竖柱上梁、经络、开市、纳财、扫舍宇、栽种、牧养、安葬、搬移、祈福、缮城郭、裁制、上册、修宫室、颁诏、求嗣、覃恩、补垣、恤孤茕、雪冤、整容、入宅、宣政事、安抚边境、纳畜、解除、塞穴、选将、营建、整手足甲、出师	祭祀、安床、畋猎、取鱼
2011-06-11	二零一一 辛卯[兔]年	五月小	初十	周六	辛卯 甲午 丁酉 乙巳	无	夏至 (6, 22)	无	无	中国人口日	兔	双子座	沐浴、扫舍宇、平治道涂、修饰垣墙、整手足甲	祭祀、出行、结婚姻、宴会、嫁娶、安床、剃头、修造、求医疗病、上表章、上官、冠带、进人口、竖柱上梁、经络、开市、纳财、修置产室、开渠、穿井、栽种、牧养、破土、安葬、启攒、搬移、祈福、缮城郭、开仓、裁制、上册、修宫室、颁诏、求嗣、庆赐、招贤、整容、布政事、宣政事、安抚边境、施恩、立券交易、临政、纳畜、举正直、解除、修仓库、酝酿、选将、鼓铸、营建、纳采、出师、筑堤防
2011-06-12	二零一一 辛卯[兔]年	五月小	十一	周日	辛卯 甲午 戊戌 丁巳	无	夏至 (6, 22)	无	天下都城隍诞	无	兔	双子座	祭祀、出行、结婚姻、宴会、嫁娶、修造、上官、冠带、进人口、竖柱上梁、经络、安碓硙、牧养、搬移、祈福、缮城郭、裁制、修宫室、求嗣、庆赐、施恩、临政、纳畜、举正直、酝酿、纳采	修置产室
2011-06-13	二零一一 辛卯[兔]年	五月小	十二	周一	辛卯 甲午 己亥 己巳	无	夏至 (6, 22)	无	炳灵公诞	无	兔	双子座	祭祀、沐浴、捕捉、覃恩、恤孤茕、雪冤	嫁娶、剃头、冠带、修置产室、开渠、穿井、安碓硙、破屋坏垣、畋猎、破土、启攒、补垣、取鱼、整容、布政事、修饰垣墙、塞穴、鼓铸、整手足甲、筑堤防
2011-06-14	二零一一 辛卯[兔]年	五月小	十三	周二	辛卯 甲午 庚子 辛巳	无	夏至 (6, 22)	无	关圣降	世界献血日	兔	双子座	诸事不宜	诸事不宜
2011-06-15	二零一一 辛卯[兔]年	五月小	十四	周三	辛卯 甲午 辛丑 癸巳	无	夏至 (6, 22)	无	无	无	兔	双子座	祭祀、覃恩、恤孤茕、雪冤、入宅、赴任	剃头、冠带、修置产室、开渠、穿井、安碓硙、破屋坏垣、畋猎、破土、启攒、开仓、修宫室、补垣、取鱼、整容、布政事、修饰垣墙、塞穴、乘船渡水、鼓铸、整手足甲、筑堤防
2011-06-16	二零一一 辛卯[兔]年	五月小	十五	周四	辛卯 甲午 壬寅 乙巳	无	夏至 (6, 22)	无	无	无	兔	双子座	结婚姻、宴会、上表章、上官、入学、进人口、竖柱上梁、经络、开市、纳财、安碓硙、栽种、牧养、祈福、缮城郭、裁制、修宫室、求嗣、庆赐、施恩、立券交易、临政、举正直、修仓库、酝酿、纳采、筑堤防	祭祀、剃头、求医疗病、开渠、穿井、整容、远回、选将、整手足甲、出师
2011-06-17	二零一一 辛卯[兔]年	五月小	十六	周五	辛卯 甲午 癸卯 丁巳	无	夏至 (6, 22)	无	天地元气造化万物之辰	无	兔	双子座	祭祀	出行、结婚姻、宴会、嫁娶、安床、修造、求医疗病、上表章、上官、冠带、进人口、竖柱上梁、经络、开市、纳财、修置产室、开渠、穿井、捕捉、畋猎、栽种、牧养、破土、安葬、启攒、搬移、祈福、缮城郭、裁制、上册、开仓、修宫室、颁诏、求嗣、庆赐、补垣、取鱼、针刺、招贤、布政事、宣政事、安抚边境、施恩、立券交易、临政、纳畜、举正直、解除、塞穴、乘船渡水、修仓库、酝酿、选将、鼓铸、营建、纳采、出师、筑堤防
2011-06-18	二零一一 辛卯[兔]年	五月小	十七	周六	辛卯 甲午 甲辰 己巳	无	夏至 (6, 22)	无	无	无	兔	双子座	出行、结婚姻、宴会、修造、求医疗病、上表章、上官、入学、竖柱上梁、开市、纳财、修置产室、开渠、穿井、安碓硙、栽种、牧养、诉讼、搬移、祈福、缮城郭、裁制、上册、修宫室、颁诏、求嗣、覃恩、恤孤茕、雪冤、庆赐、招贤、宣政事、施恩、临政、举正直、解除、赴任、纳采	伐木、畋猎、乘船渡水、取鱼
2011-06-19	二零一一 辛卯[兔]年	五月小	十八	周日	辛卯 甲午 乙巳 辛巳	无	夏至 (6, 22)	无	张天师诞	父亲节	兔	双子座	裁制、覃恩、恤孤茕、补垣、雪冤、安抚边境、塞穴、选将、筑堤防	出行、结婚姻、宴会、嫁娶、安床、修造、求医疗病、上表章、上官、进人口、竖柱上梁、开市、修置产室、开渠、穿井、栽种、破土、安葬、启攒、搬移、祈福、开仓、上册、修宫室、颁诏、求嗣、庆赐、针刺、招贤、布政事、宣政事、施恩、疗目、临政、举正直、解除、营建、纳采、出师
2011-06-20	二零一一 辛卯[兔]年	五月小	十九	周一	辛卯 甲午 丙午 癸巳	无	夏至 (6, 22)	无	无	无	兔	双子座	祭祀、覃恩、恤孤茕、雪冤、入宅	出行、结婚姻、宴会、嫁娶、安床、剃头、修造、求医疗病、上表章、上官、冠带、进人口、竖柱上梁、经络、开市、纳财、修置产室、开渠、穿井、安碓硙、平治道涂、破屋坏垣、伐木、畋猎、栽种、牧养、破土、安葬、启攒、搬移、祈福、缮城郭、裁制、开仓、上册、修宫室、颁诏、求嗣、庆赐、补垣、取鱼、招贤、整容、布政事、宣政事、安抚边境、施恩、立券交易、修饰垣墙、临政、纳畜、举正直、解除、塞穴、修仓库、酝酿、选将、远回、鼓铸、营建、纳采、整手足甲、出师、筑堤防、苫盖
2011-06-21	二零一一 辛卯[兔]年	五月小	二十	周二	辛卯 甲午 丁未 乙巳	无	夏至 (6, 22)	无	无	无	兔	双子座	宴会、沐浴、上官、进人口、经络、纳财、扫舍宇、裁制、施恩、立券交易、临政、纳畜、举正直、解除、酝酿、整手足甲	剃头、启攒、纳采
2011-06-22	二零一一 辛卯[兔]年	五月小	廿一	周三	辛卯 甲午 戊申 丁巳	夏至	小暑 (7, 7)	无	无	无	兔	巨蟹座	出行、嫁娶、沐浴、剃头、修造、上表章、进人口、竖柱上梁、经络、开市、纳财、扫舍宇、栽种、牧养、破土、安葬、搬移、祈福、缮城郭、裁制、上册、修宫室、求嗣、补垣、整容、安抚边境、解除、塞穴、选将、出师	祭祀、招贤
2011-06-23	二零一一 辛卯[兔]年	五月小	廿二	周四	辛卯 甲午 己酉 己巳	无	小暑 (7, 7)	无	孝娥神诞	无	兔	巨蟹座	沐浴、剃头、扫舍宇、平治道涂、覃恩、恤孤茕、雪冤、整容、修饰垣墙、整手足甲	祭祀、出行、结婚姻、宴会、嫁娶、安床、修造、求医疗病、上表章、上官、冠带、进人口、竖柱上梁、经络、开市、纳财、修置产室、开渠、穿井、栽种、牧养、破土、安葬、启攒、搬移、祈福、缮城郭、开仓、裁制、上册、修宫室、颁诏、求嗣、庆赐、招贤、布政事、宣政事、安抚边境、施恩、立券交易、临政、纳畜、举正直、解除、修仓库、酝酿、选将、鼓铸、营建、纳采、出师、筑堤防
2011-06-24	二零一一 辛卯[兔]年	五月小	廿三	周五	辛卯 甲午 庚戌 辛巳	无	小暑 (7, 7)	无	无	无	兔	巨蟹座	祭祀、结婚姻、宴会、嫁娶、上官、冠带、进人口、竖柱上梁、安碓硙、祈福、缮城郭、裁制、修宫室、覃恩、庆赐、恤孤茕、雪冤、布政事、临政、纳畜、酝酿、纳采	出行、求医疗病、开市、修置产室、栽种、开仓、解除、乘船渡水、整手足甲
2011-06-25	二零一一 辛卯[兔]年	五月小	廿四	周六	辛卯 甲午 辛亥 癸巳	无	小暑 (7, 7)	无	无	无	兔	巨蟹座	祭祀、沐浴、捕捉、覃恩、恤孤茕、雪冤、入宅、赴任	嫁娶、剃头、冠带、修置产室、开渠、穿井、安碓硙、破屋坏垣、畋猎、破土、启攒、修宫室、补垣、取鱼、整容、修饰垣墙、塞穴、鼓铸、整手足甲、筑堤防
2011-06-26	二零一一 辛卯[兔]年	五月小	廿五	周日	辛卯 甲午 壬子 乙巳	无	小暑 (7, 7)	无	无	无	兔	巨蟹座	诸事不宜	诸事不宜
2011-06-27	二零一一 辛卯[兔]年	五月小	廿六	周一	辛卯 甲午 癸丑 丁巳	无	小暑 (7, 7)	无	无	无	兔	巨蟹座	祭祀、覃恩、恤孤茕、雪冤	出行、结婚姻、宴会、嫁娶、安床、剃头、修造、求医疗病、上表章、上官、冠带、进人口、竖柱上梁、经络、开市、纳财、修置产室、开渠、穿井、安碓硙、破屋坏垣、栽种、牧养、破土、安葬、启攒、搬移、祈福、缮城郭、裁制、上册、修宫室、开仓、颁诏、求嗣、庆赐、补垣、招贤、整容、布政事、宣政事、安抚边境、施恩、立券交易、修饰垣墙、临政、纳畜、举正直、解除、塞穴、修仓库、酝酿、选将、鼓铸、营建、纳采、整手足甲、出师、筑堤防
2011-06-28	二零一一 辛卯[兔]年	五月小	廿七	周二	辛卯 甲午 甲寅 己巳	无	小暑 (7, 7)	无	无	无	兔	巨蟹座	宴会、上官、入学、进人口、竖柱上梁、经络、开市、纳财、安碓硙、栽种、牧养、祈福、缮城郭、裁制、修宫室、求嗣、庆赐、施恩、立券交易、临政、举正直、修仓库、酝酿、筑堤防	祭祀、选将、远回、出师、开仓
2011-06-29	二零一一 辛卯[兔]年	五月小	廿八	周三	辛卯 甲午 乙卯 辛巳	无	小暑 (7, 7)	无	无	无	兔	巨蟹座	祭祀	出行、结婚姻、宴会、嫁娶、安床、修造、求医疗病、上表章、上官、冠带、进人口、竖柱上梁、经络、开市、纳财、修置产室、开渠、穿井、捕捉、畋猎、栽种、牧养、破土、安葬、启攒、搬移、祈福、缮城郭、裁制、上册、开仓、修宫室、颁诏、求嗣、庆赐、补垣、取鱼、针刺、招贤、布政事、宣政事、安抚边境、施恩、立券交易、临政、纳畜、举正直、解除、塞穴、乘船渡水、修仓库、酝酿、选将、鼓铸、营建、纳采、出师、筑堤防
2011-06-30	二零一一 辛卯[兔]年	五月小	廿九	周四	辛卯 甲午 丙辰 癸巳	无	小暑 (7, 7)	无	无	无	兔	巨蟹座	出行、结婚姻、宴会、嫁娶、修造、求医疗病、上表章、上官、入学、竖柱上梁、开市、纳财、修置产室、开渠、穿井、安碓硙、栽种、牧养、诉讼、搬移、祈福、缮城郭、裁制、上册、修宫室、颁诏、求嗣、覃恩、恤孤茕、雪冤、庆赐、招贤、宣政事、入宅、安抚边境、施恩、临政、纳畜、举正直、解除、赴任、选将、营建、纳采、出师	伐木、畋猎、取鱼
