2016-06-01	2016-4-26	29	收	三	丙申 癸巳 甲寅	无	芒种 (6, 5)	儿童节	无	无	栽种 捕捉 畋猎 馀事勿取	开市 动土 祭祀 斋醮 安葬 探病
2016-06-02	2016-4-27	29	开	四	丙申 癸巳 乙卯	无	芒种 (6, 5)	无	无	无	嫁娶 祭祀 祈福 求嗣 斋醮 订盟 纳采 解除 出行 动土 破土 习艺 针灸 理发 会亲友 起基 修造 竖柱 定磉 安床 拆卸 纳畜 牧养 放水 除服 成服 修坟 立碑	开市 入宅 探病 出火 盖屋
2016-06-03	2016-4-28	29	闭	五	丙申 癸巳 丙辰	无	芒种 (6, 5)	无	无	无	馀事勿取	无
2016-06-04	2016-4-29	29	建	六	丙申 癸巳 丁巳	无	芒种 (6, 5)	无	无	无	塞穴 断蚁 结网 馀事勿取	破土 安葬
2016-06-05	2016-5-1	29	建	日	丙申 甲午 戊午	芒种	夏至 (6, 21)	无	无	无	祭祀 教牛马 断蚁 馀事勿取	斋醮 移徙 入宅 动土
2016-06-06	2016-5-2	29	除	一	丙申 甲午 己未	无	夏至 (6, 21)	无	无	无	纳采 订盟 嫁娶 祭祀 祈福 开市 纳财 立券 移徙 出行 修造 动土 起基 定磉 竖柱 拆卸 扫舍 放水 安香 安床 造船 开池 掘井 造畜稠 栽种	行丧 安葬 破土 作灶 伐木 斋醮
2016-06-07	2016-5-3	29	满	二	丙申 甲午 庚申	无	夏至 (6, 21)	无	无	无	嫁娶 开光 祭祀 祈福 出行 解除 移徙 入宅 开市 纳财 起基 修造 竖柱 上梁 盖屋 作灶 出火 安香 补垣 塞穴 拆卸 放水 扫舍 造仓 造船 栽种 安葬	纳采 订盟 安床 谢土 破土 动土
2016-06-08	2016-5-4	29	平	三	丙申 甲午 辛酉	无	夏至 (6, 21)	无	无	无	嫁娶 祭祀 理发 作灶 修饰垣墙 平治道涂 整手足甲 沐浴 冠笄	破土 出行 栽种
2016-06-09	2016-5-5	29	定	四	丙申 甲午 壬戌	无	夏至 (6, 21)	无	休	端午节 2016-06-09	嫁娶 纳采 订盟 祭祀 祈福 求嗣 开光 出火 出行 拆卸 修造 动土 进人口 入宅 移徙 安床 交易 立券 挂匾 纳财 入殓 安葬 启钻 除服 成服	掘井 破土
2016-06-10	2016-5-6	29	执	五	丙申 甲午 癸亥	无	夏至 (6, 21)	无	休	端午节 2016-06-09	畋猎 捕捉 结网 取渔 祭祀 沐浴 馀事勿取	嫁娶 开市 安葬 启钻 行丧
2016-06-11	2016-5-7	29	破	六	丙申 甲午 甲子	无	夏至 (6, 21)	无	休	端午节 2016-06-09	祭祀 破屋 坏垣 馀事勿取	移徙 入宅 开仓 出货财
2016-06-12	2016-5-8	29	危	日	丙申 甲午 乙丑	无	夏至 (6, 21)	无	工	端午节 2016-06-09	祭祀 斋醮 塑绘 开光 出行 修造 动土 造畜稠 安床 放水 掘井 开池 开厕 结网 破土	出火 入宅
2016-06-13	2016-5-9	29	成	一	丙申 甲午 丙寅	无	夏至 (6, 21)	无	无	无	开市 交易 立券 挂匾 开光 解除 拆卸 动土 安床 修造 上梁 置产 栽种 破土 安葬	作灶 出火 祭祀 嫁娶 入宅
2016-06-14	2016-5-10	29	收	二	丙申 甲午 丁卯	无	夏至 (6, 21)	无	无	无	祭祀 结网 馀事勿取	入宅 出行 掘井 安葬
2016-06-15	2016-5-11	29	开	三	丙申 甲午 戊辰	无	夏至 (6, 21)	无	无	无	嫁娶 纳采 订盟 冠笄 造车器 祭祀 开光 祈福 求嗣 出行 解除 伐木 出火 入宅 拆卸 修造 动土 上梁 安床 栽种 破土	行丧 置产 安葬
2016-06-16	2016-5-12	29	闭	四	丙申 甲午 己巳	无	夏至 (6, 21)	无	无	无	嫁娶 合帐 裁衣 冠笄 伐木 上梁 出火 拆卸 移徙 修造 动土 安门 纳财 筑堤 栽种 塞穴	安床 祈福 出行 安葬 行丧 开光
2016-06-17	2016-5-13	29	建	五	丙申 甲午 庚午	无	夏至 (6, 21)	无	无	无	出行 教牛马 割蜜 馀事勿取	斋醮 盖屋 动土 破土
2016-06-18	2016-5-14	29	除	六	丙申 甲午 辛未	无	夏至 (6, 21)	无	无	无	嫁娶 祭祀 祈福 求嗣 开光 出行 解除 出火 拆卸 修造 进人口 入宅 移徙 动土 安床 纳畜 栽种 纳财 交易 立券 挂匾 造畜稠	安葬 开生坟 行丧
2016-06-19	2016-5-15	29	满	日	丙申 甲午 壬申	无	夏至 (6, 21)	父亲节	无	无	安机械 祭祀 祈福 求嗣 沐浴 解除 纳采 开市 修造 竖柱 上梁 开柱眼 安碓磑 归岫 补垣 塞穴 拆卸 放水 出火 扫舍 开生坟 合寿木 安葬 谢土 启钻 除服 成服	嫁娶 安床 作灶 动土 破土 造船
2016-06-20	2016-5-16	29	平	一	丙申 甲午 癸酉	无	夏至 (6, 21)	无	无	无	祭祀 沐浴 理发 整手足甲 修饰垣墙 平治道涂 馀事勿取	开市 入宅 出行 修造 词讼
2016-06-21	2016-5-17	29	定	二	丙申 甲午 甲戌	夏至	小暑 (7, 7)	无	无	无	嫁娶 纳采 祭祀 祈福 出行 立券 移徙 入宅 动土 破土 安葬	开光 作灶 盖屋 架马 开仓
2016-06-22	2016-5-18	29	执	三	丙申 甲午 乙亥	无	小暑 (7, 7)	无	无	无	纳采 订盟 冠笄 祭祀 祈福 斋醮 出行 修造 动土 移徙 入宅 安香 出火 拆卸 盖屋 起基 竖柱 上梁 定磉 安门 开池	嫁娶 开市 合寿木 安葬
2016-06-23	2016-5-19	29	破	四	丙申 甲午 丙子	无	小暑 (7, 7)	无	无	无	祭祀 沐浴 破屋 坏垣 馀事勿取	入宅 嫁娶 移徙
2016-06-24	2016-5-20	29	危	五	丙申 甲午 丁丑	无	小暑 (7, 7)	无	无	无	嫁娶 安机械 交易 出行 祭祀 祈福 求嗣 斋醮 塑绘 开光 合帐 裁衣 放水 开池 掘井	作灶 理发 造桥 行丧 安葬
2016-06-25	2016-5-21	29	成	六	丙申 甲午 戊寅	无	小暑 (7, 7)	无	无	无	纳采 冠笄 求医 治病 开市 立券 修造 动土 安机械 破土 安葬	斋醮 祭祀 移徙 入宅 上梁 嫁娶
2016-06-26	2016-5-22	29	收	日	丙申 甲午 己卯	无	小暑 (7, 7)	无	无	无	祭祀 作灶 馀事勿取	开市 安葬 破土 修坟 掘井
2016-06-27	2016-5-23	29	开	一	丙申 甲午 庚辰	无	小暑 (7, 7)	无	无	无	祭祀 祈福 求嗣 斋醮 安香 解除 移徙 入宅 会亲友 求医 治病 动土 破土 开生坟 合寿木	合帐 上梁 经络 安葬 入殓
2016-06-28	2016-5-24	29	闭	二	丙申 甲午 辛巳	无	小暑 (7, 7)	无	无	无	嫁娶 冠笄 修造 动土 作灶 移徙 入宅 补垣 塞穴 纳畜 牧养 架马 起基 定磉 开池 造船	祈福 开光 掘井 开市 安葬
2016-06-29	2016-5-25	29	建	三	丙申 甲午 壬午	无	小暑 (7, 7)	无	无	无	祭祀 交易 纳财	斋醮 开渠 上梁 动土 破土
2016-06-30	2016-5-26	29	除	四	丙申 甲午 癸未	无	小暑 (7, 7)	无	无	无	嫁娶 订盟 纳采 冠笄 会亲友 安机械 造车器 祭祀 出行 纳财 入宅 安香 出火 入学 塑绘 开光 拆卸 起基 修造 动土 牧养 栽种 安门 开厕	行丧 伐木 作梁 作灶
