2019-12-01	二零一九 己亥[猪]年	冬月大	初六	周日	己亥 乙亥 壬申 乙巳	猪	射手座	无	大雪 (12, 7)	无	西岳大帝诞	世界艾滋病日	沐浴、扫舍宇、捕捉	出行、结婚姻、宴会、嫁娶、安床、剃头、修造、求医疗病、上表章、上官、冠带、进人口、竖柱上梁、经络、开市、纳财、修置产室、开渠、穿井、安碓硙、破屋坏垣、畋猎、栽种、牧养、破土、安葬、启攒、立券交易、裁制、缮城郭、招贤、布政事、举正直、选将、塞穴、纳畜、上册、颁诏、修饰垣墙、出师、祈福、安抚边境、酝酿、庆赐、开仓、鼓铸、整容、补垣、宣政事、解除、修宫室、施恩、纳采、整手足甲、修仓库、临政、搬移、营建、筑堤防、求嗣
2019-12-02	二零一九 己亥[猪]年	冬月大	初七	周一	己亥 乙亥 癸酉 丁巳	猪	射手座	无	大雪 (12, 7)	无	无	无	沐浴、入学、扫舍宇、雪冤、覃恩、恤孤茕	结婚姻、宴会、嫁娶、冠带、进人口、竖柱上梁、经络、伐木、畋猎、启攒、布政事、选将、塞穴、取鱼、入宅、出师、酝酿、开仓、补垣、纳采、筑堤防、营建、安抚边境
2019-12-03	二零一九 己亥[猪]年	冬月大	初八	周二	己亥 乙亥 甲戌 己巳	猪	射手座	无	大雪 (12, 7)	无	无	无	祭祀、雪冤、覃恩、入宅、恤孤茕	出行、结婚姻、宴会、嫁娶、安床、剃头、修造、求医疗病、上表章、上官、冠带、进人口、竖柱上梁、经络、开市、纳财、修置产室、开渠、穿井、安碓硙、破屋坏垣、畋猎、栽种、牧养、安葬、立券交易、疗目、针刺、裁制、乘船渡水、缮城郭、招贤、布政事、举正直、选将、塞穴、纳畜、取鱼、上册、颁诏、修饰垣墙、出师、祈福、安抚边境、酝酿、庆赐、开仓、整容、鼓铸、补垣、解除、施恩、纳采、整手足甲、修仓库、临政、搬移、营建、筑堤防、宣政事、求嗣、修宫室
2019-12-04	二零一九 己亥[猪]年	冬月大	初九	周三	己亥 乙亥 乙亥 辛巳	猪	射手座	无	大雪 (12, 7)	无	无	无	沐浴、雪冤、覃恩、恤孤茕	嫁娶、剃头、冠带、修置产室、开渠、穿井、平治道涂、破屋坏垣、伐木、畋猎、破土、启攒、针刺、乘船渡水、布政事、塞穴、取鱼、修饰垣墙、整容、鼓铸、补垣、整手足甲、筑堤防
2019-12-05	二零一九 己亥[猪]年	冬月大	初十	周四	己亥 乙亥 丙子 癸巳	猪	射手座	无	大雪 (12, 7)	无	无	无	出行、沐浴、剃头、求医疗病、上官、扫舍宇、选将、出师、解除、整容、整手足甲、安抚边境、临政、搬移	结婚姻、嫁娶、安床、修造、上表章、冠带、进人口、竖柱上梁、开市、纳财、修置产室、栽种、牧养、安葬、立券交易、乘船渡水、缮城郭、招贤、纳畜、取鱼、上册、祈福、开仓、纳采、修仓库、筑堤防、营建、求嗣、修宫室
2019-12-06	二零一九 己亥[猪]年	冬月大	十一	周五	己亥 乙亥 丁丑 乙巳	猪	射手座	无	大雪 (12, 7)	无	太乙救苦天尊诞	无	诸事不宜	祭祀、出行、结婚姻、宴会、嫁娶、安床、剃头、修造、求医疗病、上表章、上官、冠带、进人口、竖柱上梁、经络、开市、纳财、修置产室、开渠、穿井、安碓硙、平治道涂、破屋坏垣、伐木、栽种、牧养、破土、安葬、启攒、立券交易、裁制、缮城郭、远回、招贤、布政事、举正直、选将、塞穴、纳畜、上册、颁诏、修饰垣墙、出师、祈福、安抚边境、酝酿、庆赐、整容、鼓铸、开仓、补垣、解除、修宫室、施恩、纳采、整手足甲、修仓库、临政、搬移、营建、筑堤防、宣政事、求嗣
2019-12-07	二零一九 己亥[猪]年	冬月大	十二	周六	己亥 丙子 戊寅 丁巳	猪	射手座	大雪	冬至 (12, 22)	无	无	无	宴会、嫁娶、修造、上表章、进人口、竖柱上梁、经络、开市、纳财、栽种、牧养、破土、立券交易、裁制、缮城郭、塞穴、上册、祈福、庆赐、补垣、解除、修宫室、求嗣	祭祀、剃头、远回、招贤、整容
2019-12-08	二零一九 己亥[猪]年	冬月大	十三	周日	己亥 丙子 己卯 己巳	猪	射手座	无	冬至 (12, 22)	无	无	无	平治道涂、雪冤、赴任、覃恩、入宅、恤孤茕	出行、结婚姻、宴会、嫁娶、安床、剃头、修造、求医疗病、上表章、上官、冠带、进人口、竖柱上梁、经络、开市、纳财、修置产室、开渠、穿井、安碓硙、破屋坏垣、畋猎、栽种、牧养、破土、安葬、启攒、立券交易、裁制、缮城郭、招贤、布政事、举正直、选将、塞穴、纳畜、上册、颁诏、修饰垣墙、出师、祈福、酝酿、庆赐、开仓、鼓铸、整容、补垣、解除、修宫室、施恩、整手足甲、纳采、修仓库、临政、搬移、营建、筑堤防、宣政事、求嗣、安抚边境
2019-12-09	二零一九 己亥[猪]年	冬月大	十四	周一	己亥 丙子 庚辰 辛巳	猪	射手座	无	冬至 (12, 22)	无	无	无	祭祀、结婚姻、宴会、嫁娶、上官、冠带、进人口、竖柱上梁、安碓硙、安葬、雪冤、赴任、裁制、诉讼、缮城郭、覃恩、布政事、纳畜、祈福、酝酿、庆赐、修宫室、纳采、临政、恤孤茕	出行、求医疗病、开市、修置产室、栽种、解除、乘船渡水、开仓
2019-12-10	二零一九 己亥[猪]年	冬月大	十五	周二	己亥 丙子 辛巳 癸巳	猪	射手座	无	冬至 (12, 22)	无	无	无	祭祀、捕捉、雪冤、覃恩、恤孤茕	出行、安床、剃头、冠带、进人口、修置产室、开渠、穿井、安碓硙、破屋坏垣、破土、启攒、塞穴、取鱼、修饰垣墙、整容、鼓铸、补垣、修宫室、整手足甲、筑堤防
2019-12-11	二零一九 己亥[猪]年	冬月大	十六	周三	己亥 丙子 壬午 乙巳	猪	射手座	无	冬至 (12, 22)	无	无	无	祭祀、沐浴、雪冤、覃恩、恤孤茕	出行、结婚姻、宴会、嫁娶、安床、剃头、修造、求医疗病、上表章、上官、冠带、进人口、竖柱上梁、经络、开市、纳财、修置产室、开渠、穿井、安碓硙、破屋坏垣、伐木、畋猎、栽种、牧养、破土、安葬、启攒、立券交易、针刺、裁制、乘船渡水、缮城郭、苫盖、招贤、布政事、举正直、选将、塞穴、纳畜、取鱼、上册、颁诏、修饰垣墙、出师、祈福、入宅、酝酿、庆赐、整容、鼓铸、开仓、补垣、宣政事、解除、修宫室、施恩、纳采、整手足甲、修仓库、临政、搬移、营建、筑堤防、求嗣、安抚边境
2019-12-12	二零一九 己亥[猪]年	冬月大	十七	周四	己亥 丙子 癸未 丁巳	猪	射手座	无	冬至 (12, 22)	无	阿弥陀佛诞	西安事变纪念日	伐木、畋猎、雪冤、覃恩、恤孤茕	出行、结婚姻、宴会、嫁娶、安床、剃头、修造、求医疗病、上表章、上官、冠带、进人口、竖柱上梁、经络、开市、纳财、修置产室、开渠、穿井、安碓硙、破屋坏垣、栽种、牧养、破土、安葬、启攒、立券交易、裁制、缮城郭、招贤、布政事、举正直、选将、塞穴、纳畜、上册、颁诏、修饰垣墙、出师、祈福、酝酿、庆赐、整容、鼓铸、开仓、补垣、解除、修宫室、施恩、纳采、整手足甲、修仓库、临政、搬移、营建、筑堤防、宣政事、求嗣、安抚边境
2019-12-13	二零一九 己亥[猪]年	冬月大	十八	周五	己亥 丙子 甲申 己巳	猪	射手座	无	冬至 (12, 22)	无	无	南京大屠杀纪念日	祭祀、出行、沐浴、剃头、求医疗病、上官、入学、竖柱上梁、经络、扫舍宇、牧养、安葬、裁制、举正直、入宅、祈福、酝酿、整容、解除、施恩、整手足甲、临政、求嗣	修置产室、开渠、穿井、平治道涂、破屋坏垣、选将、补垣、修饰垣墙、塞穴、出师、乘船渡水、取鱼、营建、鼓铸
2019-12-14	二零一九 己亥[猪]年	冬月大	十九	周六	己亥 丙子 乙酉 辛巳	猪	射手座	无	冬至 (12, 22)	无	太阳日宫诞	无	沐浴、剃头、扫舍宇、捕捉、畋猎、整容	祭祀、出行、结婚姻、宴会、嫁娶、安床、修造、求医疗病、上表章、上官、冠带、进人口、竖柱上梁、经络、开市、纳财、修置产室、开渠、穿井、栽种、牧养、破土、安葬、启攒、立券交易、乘船渡水、裁制、缮城郭、招贤、布政事、举正直、选将、纳畜、取鱼、上册、颁诏、出师、祈福、安抚边境、酝酿、庆赐、开仓、鼓铸、宣政事、解除、修宫室、施恩、纳采、整手足甲、修仓库、临政、搬移、营建、筑堤防、求嗣
2019-12-15	二零一九 己亥[猪]年	冬月大	二十	周日	己亥 丙子 丙戌 癸巳	猪	射手座	无	冬至 (12, 22)	无	无	无	宴会、修造、入学、开市、修置产室、开渠、穿井、安碓硙、栽种、牧养、雪冤、裁制、覃恩、缮城郭、举正直、祈福、庆赐、解除、修宫室、施恩、求嗣、恤孤茕	嫁娶、进人口、伐木、捕捉、畋猎、选将、取鱼、出师、开仓、安抚边境
2019-12-16	二零一九 己亥[猪]年	冬月大	廿一	周一	己亥 丙子 丁亥 乙巳	猪	射手座	无	冬至 (12, 22)	无	无	无	祭祀、沐浴、栽种、牧养、雪冤、裁制、覃恩、缮城郭、塞穴、纳畜、补垣、修仓库、筑堤防、恤孤茕	嫁娶、剃头、立券、修置产室、开渠、穿井、畋猎、破土、启攒、疗目、针刺、修宫室、整手足甲、开张、取鱼、开仓、布政事、整容
2019-12-17	二零一九 己亥[猪]年	冬月大	廿二	周二	己亥 丙子 戊子 丁巳	猪	射手座	无	冬至 (12, 22)	无	无	无	诸事不宜	诸事不宜
2019-12-18	二零一九 己亥[猪]年	冬月大	廿三	周三	己亥 丙子 己丑 己巳	猪	射手座	无	冬至 (12, 22)	无	张仙诞	无	祭祀、结婚姻、宴会、嫁娶、沐浴、剃头、上官、进人口、经络、纳财、扫舍宇、安葬、立券交易、雪冤、赴任、举正直、入宅、祈福、酝酿、整容、解除、纳采、施恩、临政、搬移、恤孤茕	冠带、乘船渡水
2019-12-19	二零一九 己亥[猪]年	冬月大	廿四	周四	己亥 丙子 庚寅 辛巳	猪	射手座	无	冬至 (12, 22)	无	无	无	宴会、嫁娶、上表章、进人口、竖柱上梁、开市、纳财、栽种、牧养、立券交易、裁制、缮城郭、选将、塞穴、上册、祈福、庆赐、补垣、解除、修宫室、求嗣、安抚边境	祭祀、远回、招贤
2019-12-20	二零一九 己亥[猪]年	冬月大	廿五	周五	己亥 丙子 辛卯 癸巳	猪	射手座	无	冬至 (12, 22)	无	无	无	诸事不宜	诸事不宜
2019-12-21	二零一九 己亥[猪]年	冬月大	廿六	周六	己亥 丙子 壬辰 乙巳	猪	射手座	无	冬至 (12, 22)	无	北方五道诞	无	祭祀、宴会、经络、安碓硙、雪冤、赴任、裁制、诉讼、覃恩、招贤、举正直、颁诏、祈福、酝酿、庆赐、施恩、恤孤茕、宣政事、求嗣	安床、开市、修置产室、开渠、穿井、畋猎、破土、启攒、取鱼、开仓、筑堤防
2019-12-22	二零一九 己亥[猪]年	冬月大	廿七	周日	己亥 丙子 癸巳 丁巳	猪	射手座	冬至	小寒 (1, 6)	无	无	无	祭祀、捕捉、雪冤、覃恩、恤孤茕	出行、安床、剃头、冠带、进人口、修置产室、开渠、穿井、安碓硙、破屋坏垣、破土、启攒、布政事、塞穴、取鱼、修饰垣墙、整容、鼓铸、补垣、修宫室、整手足甲、筑堤防
2019-12-23	二零一九 己亥[猪]年	冬月大	廿八	周一	己亥 丙子 甲午 己巳	猪	摩羯座	无	小寒 (1, 6)	无	无	无	祭祀、沐浴	出行、结婚姻、宴会、嫁娶、安床、剃头、修造、求医疗病、上表章、上官、冠带、进人口、竖柱上梁、经络、开市、纳财、修置产室、开渠、穿井、安碓硙、破屋坏垣、伐木、栽种、牧养、破土、安葬、启攒、立券交易、针刺、裁制、乘船渡水、缮城郭、苫盖、招贤、布政事、举正直、选将、塞穴、解除、纳畜、取鱼、上册、颁诏、修饰垣墙、出师、祈福、入宅、酝酿、庆赐、开仓、整容、鼓铸、补垣、修宫室、施恩、纳采、整手足甲、修仓库、临政、搬移、营建、筑堤防、宣政事、求嗣、安抚边境
2019-12-24	二零一九 己亥[猪]年	冬月大	廿九	周二	己亥 丙子 乙未 辛巳	猪	摩羯座	无	小寒 (1, 6)	无	无	平安夜	祭祀、伐木、畋猎	出行、结婚姻、宴会、嫁娶、安床、剃头、修造、求医疗病、上表章、上官、冠带、进人口、竖柱上梁、经络、开市、纳财、修置产室、开渠、穿井、安碓硙、破屋坏垣、栽种、牧养、破土、安葬、启攒、立券交易、裁制、缮城郭、招贤、布政事、举正直、选将、塞穴、纳畜、上册、颁诏、修饰垣墙、出师、祈福、酝酿、庆赐、整容、鼓铸、开仓、补垣、解除、修宫室、施恩、纳采、整手足甲、修仓库、临政、搬移、营建、筑堤防、宣政事、求嗣、安抚边境
2019-12-25	二零一九 己亥[猪]年	冬月大	三十	周三	己亥 丙子 丙申 癸巳	猪	摩羯座	无	小寒 (1, 6)	无	无	圣诞节	出行、沐浴、剃头、求医疗病、上表章、上官、入学、竖柱上梁、经络、扫舍宇、牧养、安葬、裁制、举正直、酝酿、整容、解除、施恩、整手足甲、临政	安床、修置产室、开渠、穿井、平治道涂、破屋坏垣、乘船渡水、选将、塞穴、取鱼、修饰垣墙、出师、开仓、鼓铸、补垣、营建
2019-12-26	二零一九 己亥[猪]年	腊月大	初一	周四	己亥 丙子 丁酉 乙巳	猪	摩羯座	无	小寒 (1, 6)	无	无	毛泽东诞辰纪念日	沐浴、扫舍宇、捕捉、雪冤、覃恩、恤孤茕	宴会、剃头、冠带、修置产室、开渠、穿井、畋猎、启攒、乘船渡水、取鱼、筑堤防、开仓、布政事、修宫室、鼓铸
2019-12-27	二零一九 己亥[猪]年	腊月大	初二	周五	己亥 丙子 戊戌 丁巳	猪	摩羯座	无	小寒 (1, 6)	无	无	无	宴会、修造、入学、开市、修置产室、开渠、穿井、安碓硙、栽种、牧养、雪冤、裁制、覃恩、缮城郭、举正直、祈福、庆赐、解除、修宫室、施恩、求嗣、恤孤茕	嫁娶、进人口、伐木、捕捉、畋猎、选将、取鱼、出师、开仓、安抚边境
2019-12-28	二零一九 己亥[猪]年	腊月大	初三	周六	己亥 丙子 己亥 己巳	猪	摩羯座	无	小寒 (1, 6)	无	无	无	沐浴、雪冤、赴任、裁制、覃恩、选将、塞穴、入宅、补垣、筑堤防、恤孤茕、安抚边境	结婚姻、嫁娶、上表章、竖柱上梁、修置产室、开渠、穿井、破土、安葬、启攒、疗目、针刺、布政事、上册、出师、祈福、开仓、解除、修宫室、营建、求嗣
2019-12-29	二零一九 己亥[猪]年	腊月大	初四	周日	己亥 丙子 庚子 辛巳	猪	摩羯座	无	小寒 (1, 6)	无	无	无	诸事不宜	诸事不宜
2019-12-30	二零一九 己亥[猪]年	腊月大	初五	周一	己亥 丙子 辛丑 癸巳	猪	摩羯座	无	小寒 (1, 6)	无	无	无	祭祀、结婚姻、宴会、嫁娶、沐浴、剃头、上官、进人口、经络、纳财、扫舍宇、安葬、立券交易、雪冤、举正直、选将、祈福、整容、解除、施恩、整手足甲、临政、恤孤茕、安抚边境	修造、冠带、乘船渡水、修仓库
2019-12-31	二零一九 己亥[猪]年	腊月大	初六	周二	己亥 丙子 壬寅 乙巳	猪	摩羯座	无	小寒 (1, 6)	无	无	无	宴会、嫁娶、修造、上表章、进人口、竖柱上梁、经络、开市、纳财、栽种、牧养、立券交易、雪冤、裁制、覃恩、缮城郭、选将、塞穴、纳畜、上册、颁诏、出师、祈福、安抚边境、庆赐、补垣、解除、营建、恤孤茕、宣政事、求嗣、修宫室	祭祀、开渠、穿井、畋猎、整手足甲、远回、取鱼
