2020-01-01	二零一九 己亥[猪]年	腊月大	初七	周三	己亥 丙子 癸卯 丁巳	无	小寒 (1, 6)	元旦节	无	无	猪	摩羯座	诸事不宜	诸事不宜
2020-01-02	二零一九 己亥[猪]年	腊月大	初八	周四	己亥 丙子 甲辰 己巳	无	小寒 (1, 6)	无	腊八节-释迦如来成佛之辰	无	猪	摩羯座	祭祀、出行、结婚姻、宴会、嫁娶、修造、上官、冠带、进人口、竖柱上梁、经络、安碓硙、牧养、安葬、诉讼、搬移、祈福、缮城郭、裁制、修宫室、求嗣、庆赐、入宅、施恩、临政、纳畜、举正直、赴任、酝酿、纳采	修置产室
2020-01-03	二零一九 己亥[猪]年	腊月大	初九	周五	己亥 丙子 乙巳 辛巳	无	小寒 (1, 6)	无	无	无	猪	摩羯座	祭祀、捕捉、覃恩、恤孤茕、雪冤	出行、剃头、冠带、修置产室、开渠、穿井、安碓硙、破屋坏垣、畋猎、破土、启攒、补垣、取鱼、整容、布政事、修饰垣墙、塞穴、鼓铸、整手足甲、筑堤防
2020-01-04	二零一九 己亥[猪]年	腊月大	初十	周六	己亥 丙子 丙午 癸巳	无	小寒 (1, 6)	无	无	无	猪	摩羯座	诸事不宜	诸事不宜
2020-01-05	二零一九 己亥[猪]年	腊月大	十一	周日	己亥 丙子 丁未 乙巳	无	小寒 (1, 6)	无	无	无	猪	摩羯座	祭祀、伐木、覃恩、恤孤茕、雪冤	剃头、冠带、修置产室、开渠、穿井、安碓硙、破屋坏垣、畋猎、启攒、开仓、修宫室、补垣、取鱼、整容、布政事、修饰垣墙、塞穴、鼓铸、整手足甲、筑堤防
2020-01-06	二零一九 己亥[猪]年	腊月大	十二	周一	己亥 丁丑 戊申 丁巳	小寒	大寒 (1, 20)	无	无	无	猪	摩羯座	祭祀、嫁娶、沐浴、经络、开市、纳财、扫舍宇、伐木、畋猎、栽种、牧养、破土、开仓、安抚边境、纳畜、酝酿、选将、整手足甲	结婚姻、宴会、求嗣、庆赐、纳采
2020-01-07	二零一九 己亥[猪]年	腊月大	十三	周二	己亥 丁丑 己酉 己巳	无	大寒 (1, 20)	无	无	无	猪	摩羯座	出行、沐浴、剃头、求医疗病、上表章、上官、入学、进人口、竖柱上梁、经络、开市、纳财、安碓硙、扫舍宇、栽种、牧养、缮城郭、裁制、上册、修宫室、覃恩、恤孤茕、雪冤、整容、布政事、入宅、施恩、临政、举正直、解除、修仓库、赴任、酝酿、整手足甲、筑堤防	宴会、畋猎、选将、出师、苫盖
2020-01-08	二零一九 己亥[猪]年	腊月大	十四	周三	己亥 丁丑 庚戌 辛巳	无	大寒 (1, 20)	无	无	周恩来逝世纪念日	猪	摩羯座	祭祀、捕捉、覃恩、恤孤茕、雪冤	安床、剃头、冠带、经络、开市、修置产室、开渠、穿井、安碓硙、破屋坏垣、破土、启攒、开仓、修宫室、补垣、取鱼、整容、立券交易、修饰垣墙、塞穴、乘船渡水、酝酿、鼓铸、整手足甲、筑堤防
2020-01-09	二零一九 己亥[猪]年	腊月大	十五	周四	己亥 丁丑 辛亥 癸巳	无	大寒 (1, 20)	无	无	无	猪	摩羯座	沐浴、入学、覃恩、恤孤茕、雪冤	祭祀、出行、结婚姻、宴会、嫁娶、安床、剃头、修造、求医疗病、上表章、上官、冠带、进人口、竖柱上梁、经络、开市、纳财、修置产室、开渠、穿井、安碓硙、平治道涂、破屋坏垣、伐木、畋猎、栽种、牧养、破土、安葬、启攒、搬移、祈福、缮城郭、裁制、上册、开仓、修宫室、颁诏、求嗣、庆赐、补垣、取鱼、招贤、整容、布政事、宣政事、安抚边境、施恩、立券交易、修饰垣墙、临政、纳畜、举正直、解除、塞穴、修仓库、酝酿、选将、远回、鼓铸、营建、纳采、整手足甲、出师、筑堤防
2020-01-10	二零一九 己亥[猪]年	腊月大	十六	周五	己亥 丁丑 壬子 乙巳	无	大寒 (1, 20)	无	南岳大帝诞	中国公安110宣传日	猪	摩羯座	祭祀、沐浴、经络、覃恩、恤孤茕、雪冤、塞穴、酝酿	出行、结婚姻、宴会、嫁娶、安床、修造、求医疗病、上表章、上官、冠带、进人口、竖柱上梁、开市、纳财、修置产室、开渠、穿井、安碓硙、平治道涂、破屋坏垣、栽种、牧养、破土、安葬、搬移、祈福、缮城郭、开仓、上册、修宫室、颁诏、求嗣、庆赐、补垣、针刺、招贤、布政事、宣政事、安抚边境、疗目、施恩、立券交易、临政、修饰垣墙、纳畜、举正直、解除、修仓库、选将、远回、营建、纳采、出师、筑堤防
2020-01-11	二零一九 己亥[猪]年	腊月大	十七	周六	己亥 丁丑 癸丑 丁巳	无	大寒 (1, 20)	无	无	无	猪	摩羯座	宴会、经络、纳财、裁制、覃恩、庆赐、恤孤茕、雪冤、布政事、施恩、立券交易、纳畜、举正直、酝酿	剃头、求医疗病、上表章、冠带、修置产室、开渠、穿井、平治道涂、破屋坏垣、伐木、捕捉、畋猎、栽种、破土、安葬、启攒、搬移、祈福、开仓、上册、颁诏、求嗣、补垣、取鱼、整容、宣政事、修饰垣墙、解除、营建、整手足甲、筑堤防
2020-01-12	二零一九 己亥[猪]年	腊月大	十八	周日	己亥 丁丑 甲寅 己巳	无	大寒 (1, 20)	无	无	无	猪	摩羯座	出行、结婚姻、宴会、嫁娶、沐浴、剃头、修造、求医疗病、上表章、上官、竖柱上梁、纳财、扫舍宇、栽种、牧养、安葬、搬移、祈福、缮城郭、开仓、裁制、修宫室、求嗣、庆赐、整容、入宅、安抚边境、立券交易、临政、解除、选将、纳采、整手足甲、出师	祭祀、冠带、修置产室、开渠、穿井、安碓硙、破屋坏垣、上册、颁诏、补垣、取鱼、招贤、布政事、宣政事、修饰垣墙、塞穴、乘船渡水、修仓库、鼓铸、营建、筑堤防
2020-01-13	二零一九 己亥[猪]年	腊月大	十九	周一	己亥 丁丑 乙卯 辛巳	无	大寒 (1, 20)	无	无	无	猪	摩羯座	出行、结婚姻、宴会、嫁娶、修造、求医疗病、上表章、上官、进人口、竖柱上梁、经络、开市、纳财、栽种、牧养、安葬、搬移、祈福、缮城郭、裁制、开仓、上册、修宫室、颁诏、求嗣、覃恩、补垣、恤孤茕、雪冤、庆赐、招贤、宣政事、安抚边境、施恩、立券交易、临政、纳畜、举正直、解除、塞穴、修仓库、选将、营建、纳采、出师	祭祀、剃头、冠带、立券、修置产室、开渠、穿井、安碓硙、破屋坏垣、畋猎、取鱼、整容、布政事、入宅、修饰垣墙、开张、鼓铸、整手足甲、筑堤防
2020-01-14	二零一九 己亥[猪]年	腊月大	二十	周二	己亥 丁丑 丙辰 癸巳	无	大寒 (1, 20)	无	无	无	猪	摩羯座	诸事不宜	诸事不宜
2020-01-15	二零一九 己亥[猪]年	腊月大	廿一	周三	己亥 丁丑 丁巳 乙巳	无	大寒 (1, 20)	无	天猷上帝诞	无	猪	摩羯座	诸事不宜	出行、安床、剃头、求医疗病、上表章、上官、开市、修置产室、开渠、穿井、栽种、牧养、破土、安葬、启攒、搬移、祈福、开仓、上册、颁诏、求嗣、补垣、取鱼、招贤、整容、布政事、宣政事、安抚边境、施恩、修饰垣墙、举正直、解除、塞穴、乘船渡水、选将、鼓铸、营建、整手足甲、出师、筑堤防
2020-01-16	二零一九 己亥[猪]年	腊月大	廿二	周四	己亥 丁丑 戊午 丁巳	无	大寒 (1, 20)	无	无	无	猪	摩羯座	沐浴、剃头、捕捉、畋猎、诉讼、赴任、整容、整手足甲	出行、结婚姻、宴会、嫁娶、安床、修造、求医疗病、上表章、上官、冠带、进人口、竖柱上梁、经络、开市、纳财、修置产室、栽种、牧养、破土、安葬、启攒、搬移、祈福、缮城郭、开仓、上册、修宫室、求嗣、庆赐、取鱼、招贤、安抚边境、立券交易、施恩、临政、纳畜、举正直、解除、乘船渡水、修仓库、酝酿、选将、营建、纳采、出师、筑堤防、苫盖
2020-01-17	二零一九 己亥[猪]年	腊月大	廿三	周五	己亥 丁丑 己未 己巳	无	大寒 (1, 20)	无	小年	无	猪	摩羯座	赴任、入宅	祭祀、结婚姻、宴会、剃头、上表章、上官、冠带、竖柱上梁、修置产室、开渠、穿井、安碓硙、平治道涂、伐木、栽种、牧养、破土、安葬、启攒、祈福、缮城郭、开仓、裁制、上册、修宫室、颁诏、求嗣、庆赐、补垣、招贤、整容、布政事、宣政事、安抚边境、施恩、修饰垣墙、临政、纳畜、举正直、塞穴、乘船渡水、修仓库、选将、鼓铸、营建、整手足甲、出师、筑堤防
2020-01-18	二零一九 己亥[猪]年	腊月大	廿四	周六	己亥 丁丑 庚申 辛巳	无	大寒 (1, 20)	无	子时灶君上天朝玉帝	无	猪	摩羯座	祭祀、出行、沐浴、剃头、上表章、上官、竖柱上梁、开市、纳财、扫舍宇、伐木、牧养、安葬、搬移、开仓、裁制、上册、颁诏、覃恩、恤孤茕、雪冤、招贤、整容、宣政事、施恩、临政、纳畜、举正直、酝酿、整手足甲	修置产室、开渠、穿井、安碓硙、平治道涂、破屋坏垣、修宫室、补垣、取鱼、修饰垣墙、筑堤防
2020-01-19	二零一九 己亥[猪]年	腊月大	廿五	周日	己亥 丁丑 辛酉 癸巳	无	大寒 (1, 20)	无	无	无	猪	摩羯座	祭祀、出行、沐浴、剃头、求医疗病、上表章、上官、入学、进人口、竖柱上梁、经络、扫舍宇、牧养、安葬、祈福、裁制、上册、求嗣、整容、施恩、临政、举正直、解除、整手足甲	宴会、修置产室、开渠、穿井、平治道涂、破屋坏垣、畋猎、补垣、修饰垣墙、选将、营建、出师、苫盖
2020-01-20	二零一九 己亥[猪]年	腊月大	廿六	周一	己亥 丁丑 壬戌 乙巳	大寒	立春 (2, 4)	无	无	无	猪	水瓶座	祭祀、捕捉、畋猎	出行、结婚姻、宴会、嫁娶、安床、剃头、修造、求医疗病、上表章、上官、冠带、进人口、竖柱上梁、经络、开市、纳财、修置产室、开渠、穿井、安碓硙、平治道涂、破屋坏垣、栽种、牧养、破土、安葬、启攒、搬移、祈福、缮城郭、裁制、上册、开仓、修宫室、颁诏、求嗣、庆赐、补垣、招贤、整容、布政事、宣政事、安抚边境、施恩、立券交易、修饰垣墙、临政、纳畜、举正直、解除、塞穴、修仓库、酝酿、选将、鼓铸、营建、纳采、整手足甲、出师、筑堤防
2020-01-21	二零一九 己亥[猪]年	腊月大	廿七	周二	己亥 丁丑 癸亥 丁巳	无	立春 (2, 4)	无	无	列宁逝世纪念日	猪	水瓶座	沐浴、入学、覃恩、恤孤茕、雪冤	祭祀、出行、结婚姻、宴会、嫁娶、安床、剃头、修造、求医疗病、上表章、上官、冠带、进人口、竖柱上梁、经络、开市、纳财、修置产室、开渠、穿井、安碓硙、平治道涂、破屋坏垣、伐木、畋猎、栽种、牧养、破土、安葬、启攒、搬移、祈福、缮城郭、开仓、裁制、上册、修宫室、颁诏、求嗣、庆赐、补垣、取鱼、招贤、整容、布政事、宣政事、安抚边境、施恩、立券交易、修饰垣墙、临政、纳畜、举正直、解除、塞穴、修仓库、酝酿、选将、远回、鼓铸、营建、纳采、整手足甲、出师、筑堤防
2020-01-22	二零一九 己亥[猪]年	腊月大	廿八	周三	己亥 丁丑 甲子 己巳	无	立春 (2, 4)	无	无	无	猪	水瓶座	祭祀、沐浴、经络、安葬、裁制、覃恩、恤孤茕、雪冤、入宅、塞穴、酝酿	诸事不忌
2020-01-23	二零一九 己亥[猪]年	腊月大	廿九	周四	己亥 丁丑 乙丑 辛巳	无	立春 (2, 4)	无	华严菩萨诞	无	猪	水瓶座	祭祀、宴会、经络、纳财、牧养、裁制、覃恩、恤孤茕、雪冤、庆赐、布政事、施恩、立券交易、纳畜、举正直、酝酿	剃头、冠带、修置产室、开渠、穿井、平治道涂、破屋坏垣、伐木、捕捉、畋猎、破土、启攒、补垣、取鱼、整容、整手足甲、筑堤防、修饰垣墙
2020-01-24	二零一九 己亥[猪]年	腊月大	三十	周五	己亥 丁丑 丙寅 癸巳	无	立春 (2, 4)	无	除夕	无	猪	水瓶座	沐浴、扫舍宇、覃恩、恤孤茕、雪冤	祭祀、上表章、开渠、穿井、安葬、上册、颁诏、补垣、招贤、宣政事、塞穴、营建、筑堤防
2020-01-25	二零二零 庚子[鼠]年	正月小	初一	周六	庚子 丁丑 丁卯 乙巳	无	立春 (2, 4)	春节	弥勒佛圣诞	无	鼠	水瓶座	覃恩、恤孤茕、雪冤	祭祀、出行、结婚姻、宴会、嫁娶、安床、剃头、修造、求医疗病、上表章、上官、冠带、进人口、竖柱上梁、经络、开市、纳财、修置产室、开渠、穿井、安碓硙、平治道涂、破屋坏垣、栽种、牧养、破土、安葬、启攒、搬移、祈福、缮城郭、开仓、裁制、上册、修宫室、颁诏、求嗣、庆赐、补垣、招贤、整容、布政事、宣政事、安抚边境、入宅、施恩、立券交易、修饰垣墙、临政、纳畜、举正直、解除、塞穴、修仓库、酝酿、选将、鼓铸、营建、纳采、整手足甲、出师、筑堤防
2020-01-26	二零二零 庚子[鼠]年	正月小	初二	周日	庚子 丁丑 戊辰 丁巳	无	立春 (2, 4)	无	无	国际海关日	鼠	水瓶座	诸事不宜	诸事不宜
2020-01-27	二零二零 庚子[鼠]年	正月小	初三	周一	庚子 丁丑 己巳 己巳	无	立春 (2, 4)	无	无	无	鼠	水瓶座	宴会、冠带、竖柱上梁、经络、裁制、庆赐、临政、纳畜、酝酿、纳采	出行、求医疗病、上表章、开市、修置产室、开渠、穿井、平治道涂、破屋坏垣、栽种、破土、安葬、启攒、开仓、上册、补垣、取鱼、安抚边境、修饰垣墙、解除、塞穴、乘船渡水、选将、鼓铸、营建、出师、筑堤防
2020-01-28	二零二零 庚子[鼠]年	正月小	初四	周二	庚子 丁丑 庚午 辛巳	无	立春 (2, 4)	无	无	无	鼠	水瓶座	祭祀、出行、结婚姻、宴会、嫁娶、沐浴、剃头、修造、求医疗病、上表章、上官、竖柱上梁、捕捉、畋猎、栽种、牧养、安葬、诉讼、搬移、祈福、缮城郭、裁制、上册、颁诏、求嗣、覃恩、恤孤茕、雪冤、庆赐、招贤、整容、入宅、宣政事、安抚边境、施恩、临政、纳畜、举正直、解除、修仓库、赴任、选将、营建、纳采、整手足甲、出师	安床、冠带、进人口、经络、开市、纳财、修置产室、开渠、穿井、安碓硙、平治道涂、破屋坏垣、启攒、开仓、修宫室、补垣、取鱼、立券交易、修饰垣墙、乘船渡水、酝酿、筑堤防、苫盖
2020-01-29	二零二零 庚子[鼠]年	正月小	初五	周三	庚子 丁丑 辛未 癸巳	无	立春 (2, 4)	无	无	无	鼠	水瓶座	解除	剃头、上表章、冠带、修置产室、开渠、穿井、安碓硙、平治道涂、伐木、安葬、启攒、上册、颁诏、补垣、招贤、整容、布政事、宣政事、安抚边境、修饰垣墙、纳畜、塞穴、乘船渡水、修仓库、选将、鼓铸、营建、整手足甲、出师、筑堤防
2020-01-30	二零二零 庚子[鼠]年	正月小	初六	周四	庚子 丁丑 壬申 乙巳	无	立春 (2, 4)	无	无	无	鼠	水瓶座	祭祀、沐浴、剃头、经络、开市、纳财、扫舍宇、伐木、畋猎、牧养、安葬、开仓、整容、安抚边境、纳畜、酝酿、选将	结婚姻、宴会、修造、修置产室、开渠、穿井、安碓硙、平治道涂、破屋坏垣、缮城郭、修宫室、求嗣、庆赐、补垣、修饰垣墙、修仓库、营建、纳采、筑堤防
2020-01-31	二零二零 庚子[鼠]年	正月小	初七	周五	庚子 丁丑 癸酉 丁巳	无	立春 (2, 4)	无	无	无	鼠	水瓶座	出行、沐浴、剃头、上表章、上官、入学、进人口、竖柱上梁、经络、开市、纳财、扫舍宇、牧养、安葬、裁制、上册、整容、施恩、临政、举正直、解除、酝酿、整手足甲	宴会、修置产室、开渠、穿井、平治道涂、破屋坏垣、畋猎、补垣、苫盖、选将、营建、出师、修饰垣墙
