2021-01-01	二零二零 庚子[鼠]年	冬月小	十八	周五	元旦节	无	无	庚子 戊子 己酉 己巳	无	小寒 (1, 5)	鼠	摩羯座	沐浴、剃头、扫舍宇、捕捉、畋猎、雪冤、整手足甲、覃恩、整容、恤孤茕	祭祀、出行、结婚姻、宴会、嫁娶、安床、修造、求医疗病、上表章、上官、冠带、进人口、竖柱上梁、经络、开市、纳财、修置产室、开渠、穿井、栽种、牧养、破土、安葬、启攒、布政事、纳畜、取鱼、颁诏、纳采、举正直、安抚边境、修仓库、缮城郭、鼓铸、裁制、宣政事、临政、乘船渡水、酝酿、立券交易、招贤、开仓、祈福、解除、施恩、筑堤防、求嗣、上册、庆赐、修宫室、选将、营建、出师、搬移
2021-01-02	二零二零 庚子[鼠]年	冬月小	十九	周六	无	太阳日宫诞	无	庚子 戊子 庚戌 辛巳	无	小寒 (1, 5)	鼠	摩羯座	宴会、修造、入学、开市、修置产室、开渠、穿井、安碓硙、栽种、牧养、布政事、纳采、举正直、雪冤、缮城郭、裁制、祈福、解除、施恩、入宅、求嗣、覃恩、庆赐、恤孤茕、修宫室	进人口、经络、伐木、捕捉、畋猎、出师、取鱼、安抚边境、整手足甲、开仓、选将
2021-01-03	二零二零 庚子[鼠]年	冬月小	二十	周日	无	无	无	庚子 戊子 辛亥 癸巳	无	小寒 (1, 5)	鼠	摩羯座	沐浴、补垣、安抚边境、雪冤、裁制、筑堤防、塞穴、覃恩、恤孤茕、选将	出行、结婚姻、宴会、嫁娶、安床、修造、求医疗病、上表章、上官、进人口、竖柱上梁、开市、修置产室、开渠、穿井、破土、安葬、启攒、布政事、出师、颁诏、纳采、举正直、宣政事、临政、针刺、酝酿、招贤、开仓、祈福、解除、施恩、求嗣、上册、庆赐、修宫室、营建、疗目、搬移
2021-01-04	二零二零 庚子[鼠]年	冬月小	廿一	周一	无	无	无	庚子 戊子 壬子 乙巳	无	小寒 (1, 5)	鼠	摩羯座	祭祀、沐浴、雪冤、恤孤茕、覃恩	出行、结婚姻、宴会、嫁娶、安床、剃头、修造、求医疗病、上表章、上官、冠带、进人口、竖柱上梁、经络、开市、立券、纳财、修置产室、开渠、穿井、安碓硙、平治道涂、破屋坏垣、伐木、畋猎、栽种、牧养、破土、安葬、启攒、布政事、出师、纳畜、取鱼、颁诏、补垣、纳采、举正直、开张、安抚边境、修仓库、整手足甲、缮城郭、鼓铸、裁制、宣政事、临政、酝酿、立券交易、招贤、开仓、祈福、解除、施恩、求嗣、筑堤防、塞穴、修饰垣墙、上册、庆赐、整容、修宫室、选将、营建、远回、搬移
2021-01-05	二零二零 庚子[鼠]年	冬月小	廿二	周二	无	无	无	庚子 己丑 癸丑 丁巳	小寒	大寒 (1, 20)	鼠	摩羯座	宴会、经络、纳财、布政事、纳畜、举正直、雪冤、裁制、酝酿、立券交易、施恩、覃恩、庆赐、恤孤茕	剃头、求医疗病、上表章、冠带、修置产室、开渠、穿井、平治道涂、破屋坏垣、伐木、捕捉、畋猎、栽种、破土、安葬、启攒、取鱼、颁诏、补垣、整手足甲、宣政事、开仓、祈福、解除、筑堤防、求嗣、修饰垣墙、上册、整容、营建、搬移
2021-01-06	二零二零 庚子[鼠]年	冬月小	廿三	周三	无	张仙诞	无	庚子 己丑 甲寅 己巳	无	大寒 (1, 20)	鼠	摩羯座	沐浴、扫舍宇	祭祀、开渠、穿井、布政事、取鱼、颁诏、补垣、宣政事、乘船渡水、招贤、筑堤防、塞穴、上册、营建
2021-01-07	二零二零 庚子[鼠]年	冬月小	廿四	周四	无	无	无	庚子 己丑 乙卯 辛巳	无	大寒 (1, 20)	鼠	摩羯座	出行、结婚姻、宴会、嫁娶、修造、求医疗病、上表章、上官、进人口、竖柱上梁、经络、开市、纳财、栽种、牧养、安葬、赴任、出师、纳畜、颁诏、补垣、纳采、举正直、安抚边境、修仓库、雪冤、缮城郭、裁制、宣政事、临政、立券交易、招贤、开仓、祈福、入宅、施恩、塞穴、解除、求嗣、覃恩、上册、庆赐、恤孤茕、修宫室、选将、营建、搬移	祭祀、剃头、冠带、修置产室、开渠、穿井、安碓硙、破屋坏垣、畋猎、布政事、整容、整手足甲、鼓铸、取鱼、筑堤防、修饰垣墙
2021-01-08	二零二零 庚子[鼠]年	冬月小	廿五	周五	无	无	周恩来逝世纪念日	庚子 己丑 丙辰 癸巳	无	大寒 (1, 20)	鼠	摩羯座	诸事不宜	诸事不宜
2021-01-09	二零二零 庚子[鼠]年	冬月小	廿六	周六	无	北方五道诞	无	庚子 己丑 丁巳 乙巳	无	大寒 (1, 20)	鼠	摩羯座	诸事不宜	出行、安床、剃头、求医疗病、上表章、上官、开市、修置产室、开渠、穿井、栽种、牧养、破土、安葬、启攒、布政事、取鱼、颁诏、补垣、举正直、安抚边境、鼓铸、宣政事、乘船渡水、招贤、开仓、祈福、解除、施恩、筑堤防、塞穴、求嗣、修饰垣墙、上册、整容、选将、营建、出师、搬移
2021-01-10	二零二零 庚子[鼠]年	冬月小	廿七	周日	无	无	中国公安110宣传日	庚子 己丑 戊午 丁巳	无	大寒 (1, 20)	鼠	摩羯座	沐浴、剃头、捕捉、畋猎、赴任、整容、诉讼、整手足甲	出行、结婚姻、宴会、嫁娶、安床、修造、求医疗病、上表章、上官、冠带、进人口、竖柱上梁、经络、开市、纳财、修置产室、栽种、牧养、破土、安葬、启攒、出师、纳畜、取鱼、纳采、举正直、苫盖、安抚边境、修仓库、缮城郭、临政、乘船渡水、酝酿、立券交易、招贤、开仓、祈福、解除、施恩、筑堤防、求嗣、上册、庆赐、修宫室、选将、营建、搬移
2021-01-11	二零二零 庚子[鼠]年	冬月小	廿八	周一	无	无	无	庚子 己丑 己未 己巳	无	大寒 (1, 20)	鼠	摩羯座	破屋坏垣	祭祀、出行、结婚姻、宴会、嫁娶、安床、剃头、修造、上表章、上官、冠带、进人口、竖柱上梁、经络、开市、纳财、修置产室、开渠、穿井、安碓硙、伐木、栽种、牧养、破土、安葬、启攒、布政事、纳畜、颁诏、纳采、补垣、举正直、安抚边境、修仓库、整手足甲、缮城郭、鼓铸、裁制、宣政事、临政、酝酿、立券交易、招贤、开仓、祈福、筑堤防、施恩、求嗣、塞穴、修饰垣墙、上册、庆赐、整容、修宫室、选将、营建、出师、搬移
2021-01-12	二零二零 庚子[鼠]年	冬月小	廿九	周二	无	无	无	庚子 己丑 庚申 辛巳	无	大寒 (1, 20)	鼠	摩羯座	祭祀、出行、沐浴、剃头、修造、上表章、上官、竖柱上梁、开市、纳财、扫舍宇、伐木、栽种、牧养、安葬、纳畜、颁诏、举正直、修仓库、雪冤、整手足甲、缮城郭、裁制、宣政事、临政、酝酿、招贤、开仓、入宅、施恩、覃恩、上册、整容、恤孤茕、营建、搬移	取鱼
2021-01-13	二零二零 庚子[鼠]年	腊月大	初一	周三	无	无	无	庚子 己丑 辛酉 癸巳	无	大寒 (1, 20)	鼠	摩羯座	祭祀、出行、沐浴、剃头、上表章、上官、入学、进人口、竖柱上梁、经络、安碓硙、扫舍宇、栽种、牧养、安葬、举正直、缮城郭、裁制、临政、筑堤防、施恩、祈福、解除、求嗣、上册、整容、修宫室	宴会、畋猎、苫盖、选将、出师
2021-01-14	二零二零 庚子[鼠]年	腊月大	初二	周四	无	无	无	庚子 己丑 壬戌 乙巳	无	大寒 (1, 20)	鼠	摩羯座	祭祀、捕捉、畋猎	出行、结婚姻、宴会、嫁娶、安床、剃头、修造、求医疗病、上表章、上官、冠带、进人口、竖柱上梁、经络、开市、纳财、修置产室、开渠、穿井、安碓硙、破屋坏垣、栽种、牧养、破土、安葬、启攒、布政事、纳畜、颁诏、补垣、纳采、举正直、安抚边境、修仓库、整手足甲、缮城郭、鼓铸、裁制、宣政事、临政、酝酿、立券交易、招贤、开仓、祈福、解除、施恩、筑堤防、求嗣、塞穴、修饰垣墙、上册、庆赐、整容、修宫室、选将、营建、出师、搬移
2021-01-15	二零二零 庚子[鼠]年	腊月大	初三	周五	无	无	无	庚子 己丑 癸亥 丁巳	无	大寒 (1, 20)	鼠	摩羯座	沐浴、入学、雪冤、恤孤茕、覃恩	祭祀、出行、结婚姻、宴会、嫁娶、安床、剃头、修造、求医疗病、上表章、上官、冠带、进人口、竖柱上梁、经络、开市、纳财、修置产室、开渠、穿井、安碓硙、平治道涂、破屋坏垣、伐木、畋猎、栽种、牧养、破土、安葬、启攒、布政事、出师、纳畜、取鱼、颁诏、纳采、补垣、举正直、安抚边境、修仓库、整手足甲、缮城郭、鼓铸、裁制、宣政事、临政、酝酿、立券交易、招贤、开仓、祈福、解除、施恩、筑堤防、求嗣、塞穴、修饰垣墙、上册、庆赐、整容、修宫室、选将、营建、远回、搬移
2021-01-16	二零二零 庚子[鼠]年	腊月大	初四	周六	无	无	无	庚子 己丑 甲子 己巳	无	大寒 (1, 20)	鼠	摩羯座	祭祀、沐浴、经络、安葬、雪冤、裁制、酝酿、塞穴、覃恩、恤孤茕	诸事不忌
2021-01-17	二零二零 庚子[鼠]年	腊月大	初五	周日	无	无	无	庚子 己丑 乙丑 辛巳	无	大寒 (1, 20)	鼠	摩羯座	祭祀、宴会、经络、纳财、牧养、赴任、布政事、纳畜、举正直、雪冤、裁制、酝酿、立券交易、入宅、施恩、覃恩、庆赐、恤孤茕	剃头、冠带、修置产室、开渠、穿井、平治道涂、破屋坏垣、伐木、捕捉、畋猎、破土、启攒、取鱼、补垣、整手足甲、乘船渡水、筑堤防、修饰垣墙、整容
2021-01-18	二零二零 庚子[鼠]年	腊月大	初六	周一	无	无	无	庚子 己丑 丙寅 癸巳	无	大寒 (1, 20)	鼠	摩羯座	沐浴、扫舍宇、雪冤、覃恩、恤孤茕	祭祀、上表章、开渠、穿井、安葬、颁诏、补垣、宣政事、招贤、筑堤防、塞穴、上册、营建
2021-01-19	二零二零 庚子[鼠]年	腊月大	初七	周二	无	无	无	庚子 己丑 丁卯 乙巳	无	大寒 (1, 20)	鼠	摩羯座	雪冤、覃恩、恤孤茕	祭祀、出行、结婚姻、宴会、嫁娶、安床、剃头、修造、求医疗病、上表章、上官、冠带、进人口、竖柱上梁、经络、开市、纳财、修置产室、开渠、穿井、安碓硙、平治道涂、破屋坏垣、栽种、牧养、破土、安葬、启攒、布政事、纳畜、颁诏、补垣、纳采、举正直、安抚边境、修仓库、整手足甲、缮城郭、鼓铸、裁制、宣政事、临政、酝酿、立券交易、招贤、开仓、入宅、祈福、解除、施恩、筑堤防、求嗣、塞穴、修饰垣墙、上册、庆赐、整容、修宫室、选将、营建、出师、搬移
2021-01-20	二零二零 庚子[鼠]年	腊月大	初八	周三	无	腊八节-释迦如来成佛之辰	无	庚子 己丑 戊辰 丁巳	大寒	立春 (2, 3)	鼠	水瓶座	诸事不宜	诸事不宜
2021-01-21	二零二零 庚子[鼠]年	腊月大	初九	周四	无	无	列宁逝世纪念日	庚子 己丑 己巳 己巳	无	立春 (2, 3)	鼠	水瓶座	结婚姻、宴会、冠带、竖柱上梁、经络、纳畜、纳采、裁制、临政、酝酿、庆赐	出行、求医疗病、上表章、开市、修置产室、开渠、穿井、平治道涂、破屋坏垣、栽种、破土、安葬、启攒、取鱼、补垣、安抚边境、鼓铸、乘船渡水、开仓、解除、筑堤防、塞穴、修饰垣墙、上册、选将、营建、出师
2021-01-22	二零二零 庚子[鼠]年	腊月大	初十	周五	无	无	无	庚子 己丑 庚午 辛巳	无	立春 (2, 3)	鼠	水瓶座	祭祀、出行、结婚姻、宴会、嫁娶、沐浴、剃头、修造、求医疗病、上表章、上官、竖柱上梁、捕捉、畋猎、栽种、牧养、安葬、赴任、出师、纳畜、颁诏、纳采、举正直、安抚边境、修仓库、雪冤、整手足甲、缮城郭、裁制、宣政事、临政、诉讼、招贤、祈福、入宅、施恩、解除、求嗣、覃恩、上册、庆赐、整容、恤孤茕、选将、营建、搬移	安床、冠带、进人口、经络、开市、纳财、修置产室、开渠、穿井、安碓硙、平治道涂、破屋坏垣、启攒、取鱼、补垣、苫盖、乘船渡水、酝酿、立券交易、开仓、筑堤防、修饰垣墙、修宫室
2021-01-23	二零二零 庚子[鼠]年	腊月大	十一	周六	无	无	无	庚子 己丑 辛未 癸巳	无	立春 (2, 3)	鼠	水瓶座	解除	嫁娶、剃头、上表章、冠带、修置产室、开渠、穿井、安碓硙、平治道涂、伐木、安葬、启攒、布政事、纳畜、颁诏、补垣、安抚边境、修仓库、整手足甲、鼓铸、宣政事、招贤、筑堤防、塞穴、修饰垣墙、上册、整容、选将、营建、出师
2021-01-24	二零二零 庚子[鼠]年	腊月大	十二	周日	无	无	无	庚子 己丑 壬申 乙巳	无	立春 (2, 3)	鼠	水瓶座	祭祀、沐浴、经络、开市、纳财、扫舍宇、伐木、畋猎、牧养、安葬、纳畜、安抚边境、整手足甲、酝酿、开仓、选将	结婚姻、宴会、修造、修置产室、开渠、穿井、安碓硙、平治道涂、破屋坏垣、补垣、纳采、修仓库、缮城郭、筑堤防、求嗣、修饰垣墙、庆赐、修宫室、营建
2021-01-25	二零二零 庚子[鼠]年	腊月大	十三	周一	无	无	无	庚子 己丑 癸酉 丁巳	无	立春 (2, 3)	鼠	水瓶座	出行、沐浴、剃头、求医疗病、上表章、上官、入学、进人口、竖柱上梁、经络、开市、纳财、扫舍宇、牧养、安葬、举正直、整手足甲、裁制、临政、酝酿、施恩、解除、上册、整容	宴会、修置产室、开渠、穿井、平治道涂、破屋坏垣、畋猎、苫盖、选将、营建、补垣、出师、修饰垣墙
2021-01-26	二零二零 庚子[鼠]年	腊月大	十四	周二	无	无	国际海关日	庚子 己丑 甲戌 己巳	无	立春 (2, 3)	鼠	水瓶座	祭祀、捕捉、畋猎	出行、结婚姻、宴会、嫁娶、安床、剃头、修造、求医疗病、上表章、上官、冠带、进人口、竖柱上梁、经络、开市、纳财、修置产室、开渠、穿井、安碓硙、平治道涂、破屋坏垣、栽种、牧养、破土、安葬、启攒、布政事、出师、纳畜、取鱼、颁诏、纳采、补垣、举正直、安抚边境、修仓库、整手足甲、缮城郭、鼓铸、裁制、宣政事、临政、乘船渡水、酝酿、立券交易、招贤、开仓、祈福、解除、施恩、筑堤防、求嗣、塞穴、修饰垣墙、上册、庆赐、整容、修宫室、选将、营建、搬移
2021-01-27	二零二零 庚子[鼠]年	腊月大	十五	周三	无	无	无	庚子 己丑 乙亥 辛巳	无	立春 (2, 3)	鼠	水瓶座	祭祀、出行、结婚姻、宴会、沐浴、修造、求医疗病、上表章、上官、入学、竖柱上梁、开市、纳财、修置产室、开渠、穿井、安碓硙、栽种、牧养、赴任、出师、纳畜、纳采、安抚边境、修仓库、雪冤、缮城郭、裁制、临政、开仓、祈福、解除、入宅、求嗣、覃恩、上册、庆赐、恤孤茕、修宫室、选将、营建、搬移	嫁娶、剃头、冠带、平治道涂、破屋坏垣、伐木、畋猎、破土、启攒、布政事、取鱼、补垣、整手足甲、鼓铸、筑堤防、塞穴、修饰垣墙、整容、远回
2021-01-28	二零二零 庚子[鼠]年	腊月大	十六	周四	无	南岳大帝诞	无	庚子 己丑 丙子 癸巳	无	立春 (2, 3)	鼠	水瓶座	祭祀、沐浴、经络、安葬、酝酿、塞穴	出行、结婚姻、宴会、嫁娶、安床、修造、求医疗病、上表章、上官、冠带、进人口、竖柱上梁、开市、纳财、修置产室、开渠、穿井、安碓硙、平治道涂、破屋坏垣、栽种、牧养、破土、布政事、出师、纳畜、颁诏、纳采、补垣、举正直、安抚边境、修仓库、缮城郭、宣政事、临政、针刺、立券交易、招贤、开仓、祈福、解除、施恩、筑堤防、求嗣、修饰垣墙、上册、庆赐、修宫室、选将、营建、远回、疗目、搬移
2021-01-29	二零二零 庚子[鼠]年	腊月大	十七	周五	无	无	无	庚子 己丑 丁丑 乙巳	无	立春 (2, 3)	鼠	水瓶座	宴会、经络、纳财、纳畜、举正直、裁制、酝酿、立券交易、施恩、庆赐	剃头、求医疗病、上表章、冠带、修置产室、开渠、穿井、平治道涂、破屋坏垣、伐木、捕捉、畋猎、栽种、破土、安葬、启攒、取鱼、颁诏、补垣、整手足甲、宣政事、开仓、祈福、解除、筑堤防、求嗣、修饰垣墙、上册、整容、营建、搬移
2021-01-30	二零二零 庚子[鼠]年	腊月大	十八	周六	无	无	无	庚子 己丑 戊寅 丁巳	无	立春 (2, 3)	鼠	水瓶座	沐浴、扫舍宇	祭祀、上表章、开渠、穿井、安葬、启攒、布政事、颁诏、补垣、宣政事、招贤、筑堤防、塞穴、上册、营建
2021-01-31	二零二零 庚子[鼠]年	腊月大	十九	周日	无	无	无	庚子 己丑 己卯 己巳	无	立春 (2, 3)	鼠	水瓶座	雪冤、覃恩、恤孤茕	祭祀、出行、结婚姻、宴会、嫁娶、安床、剃头、修造、求医疗病、上表章、上官、冠带、进人口、竖柱上梁、经络、开市、立券、纳财、修置产室、开渠、穿井、安碓硙、平治道涂、破屋坏垣、栽种、牧养、破土、安葬、启攒、布政事、出师、纳畜、颁诏、纳采、补垣、举正直、开张、安抚边境、修仓库、整手足甲、缮城郭、鼓铸、裁制、宣政事、临政、酝酿、立券交易、招贤、开仓、入宅、祈福、解除、施恩、筑堤防、求嗣、塞穴、修饰垣墙、上册、庆赐、整容、修宫室、选将、营建、搬移
