2026-08-01	二零二六 丙午[马]年	六月大	十九	周六	无	观世音菩萨成道日	中国人民解放军建军节	丙午 乙未 丁未 乙巳	无	立秋 (8, 7)	马	狮子座	出行、宴会、上官、进人口、经络、纳财、纳畜、举正直、裁制、临政、酝酿、立券交易、招贤、施恩、庆赐	剃头、求医疗病、上表章、修置产室、开渠、穿井、平治道涂、破屋坏垣、伐木、栽种、安葬、启攒、补垣、整手足甲、开仓、解除、筑堤防、求嗣、修饰垣墙、上册、整容、营建
2026-08-02	二零二六 丙午[马]年	六月大	二十	周日	无	无	无	丙午 乙未 戊申 丁巳	无	立秋 (8, 7)	马	狮子座	祭祀、沐浴、扫舍宇	上表章、开渠、穿井、安葬、启攒、布政事、颁诏、补垣、宣政事、招贤、筑堤防、塞穴、上册、营建
2026-08-03	二零二六 丙午[马]年	六月大	廿一	周一	无	无	无	丙午 乙未 己酉 己巳	无	立秋 (8, 7)	马	狮子座	出行、结婚姻、嫁娶、沐浴、剃头、修造、求医疗病、上表章、上官、进人口、竖柱上梁、经络、开市、纳财、扫舍宇、栽种、牧养、安葬、出师、纳畜、颁诏、纳采、补垣、举正直、安抚边境、修仓库、雪冤、整手足甲、缮城郭、裁制、宣政事、临政、立券交易、招贤、开仓、祈福、解除、施恩、塞穴、求嗣、覃恩、上册、整容、恤孤茕、修宫室、选将、营建、搬移	祭祀、宴会、冠带、修置产室、开渠、穿井、安碓硙、平治道涂、破屋坏垣、畋猎、启攒、针刺、鼓铸、取鱼、入宅、筑堤防、修饰垣墙
2026-08-04	二零二六 丙午[马]年	六月大	廿二	周二	无	无	无	丙午 乙未 庚戌 辛巳	无	立秋 (8, 7)	马	狮子座	诸事不宜	诸事不宜
2026-08-05	二零二六 丙午[马]年	六月大	廿三	周三	无	无	恩格斯逝世纪念日	丙午 乙未 辛亥 癸巳	无	立秋 (8, 7)	马	狮子座	祭祀、结婚姻、宴会、沐浴、上官、冠带、进人口、竖柱上梁、经络、牧养、赴任、布政事、纳畜、纳采、举正直、雪冤、裁制、临政、入宅、祈福、施恩、求嗣、覃恩、庆赐、恤孤茕、搬移	嫁娶、上表章、修置产室、开渠、穿井、平治道涂、破屋坏垣、破土、安葬、启攒、取鱼、补垣、安抚边境、整手足甲、乘船渡水、筑堤防、修饰垣墙、上册、选将、营建、出师
2026-08-06	二零二六 丙午[马]年	六月大	廿四	周四	无	关帝诞	国际电影节	丙午 乙未 壬子 乙巳	无	立秋 (8, 7)	马	狮子座	沐浴、剃头、捕捉、雪冤、整手足甲、覃恩、整容、恤孤茕	祭祀、出行、结婚姻、宴会、嫁娶、安床、修造、求医疗病、上表章、上官、冠带、进人口、竖柱上梁、经络、开市、纳财、修置产室、开渠、穿井、安碓硙、平治道涂、破屋坏垣、栽种、牧养、破土、安葬、启攒、布政事、纳畜、取鱼、颁诏、补垣、纳采、举正直、安抚边境、修仓库、缮城郭、鼓铸、裁制、宣政事、临政、乘船渡水、酝酿、立券交易、招贤、开仓、祈福、解除、施恩、筑堤防、求嗣、塞穴、修饰垣墙、上册、庆赐、修宫室、选将、营建、远回、出师、搬移
2026-08-07	二零二六 丙午[马]年	六月大	廿五	周五	无	无	无	丙午 丙申 癸丑 丁巳	立秋	处暑 (8, 23)	马	狮子座	祭祀、宴会、求医疗病、上表章、上官、竖柱上梁、纳财、捕捉、栽种、牧养、安葬、纳畜、颁诏、举正直、雪冤、缮城郭、裁制、宣政事、临政、招贤、开仓、祈福、解除、施恩、求嗣、覃恩、上册、庆赐、恤孤茕、修宫室、营建	冠带、畋猎、远回、取鱼
2026-08-08	二零二六 丙午[马]年	六月大	廿六	周六	无	无	无	丙午 丙申 甲寅 己巳	无	处暑 (8, 23)	马	狮子座	诸事不宜	诸事不宜
2026-08-09	二零二六 丙午[马]年	六月大	廿七	周日	无	无	无	丙午 丙申 乙卯 辛巳	无	处暑 (8, 23)	马	狮子座	祭祀	出行、结婚姻、宴会、嫁娶、安床、修造、求医疗病、上表章、上官、冠带、进人口、竖柱上梁、经络、开市、纳财、修置产室、开渠、穿井、安碓硙、平治道涂、破屋坏垣、栽种、牧养、破土、安葬、启攒、布政事、纳畜、颁诏、补垣、纳采、举正直、安抚边境、修仓库、缮城郭、鼓铸、裁制、宣政事、临政、酝酿、立券交易、招贤、开仓、祈福、解除、施恩、筑堤防、求嗣、塞穴、修饰垣墙、上册、庆赐、修宫室、选将、营建、出师、搬移
2026-08-10	二零二六 丙午[马]年	六月大	廿八	周一	无	无	无	丙午 丙申 丙辰 癸巳	无	处暑 (8, 23)	马	狮子座	祭祀、出行、结婚姻、宴会、嫁娶、修造、上表章、上官、入学、进人口、竖柱上梁、经络、开市、纳财、安碓硙、栽种、牧养、安葬、纳畜、纳采、安抚边境、修仓库、缮城郭、裁制、临政、酝酿、立券交易、筑堤防、入宅、祈福、求嗣、庆赐、修宫室、搬移	安床、剃头、求医疗病、冠带、修置产室、开渠、穿井、平治道涂、破屋坏垣、伐木、破土、启攒、布政事、颁诏、补垣、整手足甲、鼓铸、宣政事、针刺、招贤、开仓、解除、塞穴、修饰垣墙、上册、整容、选将、营建、远回、出师
2026-08-11	二零二六 丙午[马]年	六月大	廿九	周二	无	无	无	丙午 丙申 丁巳 乙巳	无	处暑 (8, 23)	马	狮子座	祭祀、结婚姻、宴会、嫁娶、修造、求医疗病、上表章、上官、进人口、竖柱上梁、经络、开市、纳财、捕捉、栽种、牧养、安葬、纳畜、颁诏、纳采、举正直、安抚边境、修仓库、雪冤、缮城郭、裁制、宣政事、临政、酝酿、立券交易、招贤、开仓、祈福、解除、施恩、求嗣、覃恩、上册、庆赐、恤孤茕、选将、营建、搬移	出行、剃头、冠带、修置产室、开渠、穿井、安碓硙、破屋坏垣、畋猎、破土、启攒、布政事、取鱼、补垣、整手足甲、鼓铸、筑堤防、塞穴、修饰垣墙、整容、修宫室
2026-08-12	二零二六 丙午[马]年	六月大	三十	周三	无	无	国际青年日	丙午 丙申 戊午 丁巳	无	处暑 (8, 23)	马	狮子座	祭祀、出行、结婚姻、宴会、嫁娶、修造、求医疗病、上表章、上官、入学、竖柱上梁、开市、修置产室、开渠、穿井、安碓硙、栽种、牧养、纳畜、颁诏、纳采、举正直、安抚边境、修仓库、雪冤、缮城郭、裁制、宣政事、临政、招贤、祈福、解除、施恩、求嗣、覃恩、上册、庆赐、恤孤茕、修宫室、选将、营建、出师、搬移	剃头、冠带、破屋坏垣、伐木、畋猎、破土、布政事、取鱼、补垣、苫盖、整手足甲、鼓铸、开仓、入宅、筑堤防、塞穴、修饰垣墙、整容
2026-08-13	二零二六 丙午[马]年	七月小	初一	周四	无	无	无	丙午 丙申 己未 己巳	无	处暑 (8, 23)	马	狮子座	诸事不宜	诸事不宜
2026-08-14	二零二六 丙午[马]年	七月小	初二	周五	无	无	无	丙午 丙申 庚申 辛巳	无	处暑 (8, 23)	马	狮子座	出行、沐浴、上官、进人口、纳财、扫舍宇、纳畜、颁诏、举正直、雪冤、裁制、宣政事、临政、酝酿、招贤、施恩、覃恩、恤孤茕	安床、上表章、修置产室、开渠、穿井、平治道涂、破屋坏垣、伐木、栽种、启攒、补垣、开仓、祈福、筑堤防、求嗣、修饰垣墙、上册、营建
2026-08-15	二零二六 丙午[马]年	七月小	初三	周六	无	无	无	丙午 丙申 辛酉 癸巳	无	处暑 (8, 23)	马	狮子座	出行、嫁娶、沐浴、剃头、修造、求医疗病、上官、扫舍宇、安葬、赴任、纳采、安抚边境、雪冤、整手足甲、临政、解除、入宅、整容、恤孤茕、选将、出师、搬移	结婚姻、宴会、上表章、冠带、竖柱上梁、修置产室、捕捉、畋猎、栽种、牧养、纳畜、取鱼、颁诏、补垣、修仓库、鼓铸、缮城郭、宣政事、乘船渡水、招贤、开仓、祈福、筑堤防、塞穴、求嗣、上册、庆赐、修宫室、营建
2026-08-16	二零二六 丙午[马]年	七月小	初四	周日	无	无	无	丙午 丙申 壬戌 乙巳	无	处暑 (8, 23)	马	狮子座	出行、宴会、上表章、进人口、竖柱上梁、经络、开市、纳财、栽种、牧养、安葬、纳畜、颁诏、补垣、雪冤、缮城郭、裁制、宣政事、立券交易、开仓、祈福、解除、塞穴、求嗣、覃恩、上册、庆赐、恤孤茕、修宫室、营建、搬移	祭祀、开渠、穿井、畋猎、乘船渡水、取鱼
2026-08-17	二零二六 丙午[马]年	七月小	初五	周一	无	无	无	丙午 丙申 癸亥 丁巳	无	处暑 (8, 23)	马	狮子座	祭祀、出行、结婚姻、宴会、沐浴、修造、求医疗病、上表章、上官、竖柱上梁、纳财、平治道涂、栽种、牧养、安葬、出师、纳畜、颁诏、纳采、举正直、安抚边境、修仓库、雪冤、缮城郭、裁制、宣政事、临政、招贤、开仓、祈福、解除、施恩、求嗣、覃恩、修饰垣墙、上册、庆赐、恤孤茕、修宫室、选将、营建、搬移	嫁娶、冠带、修置产室、开渠、穿井、畋猎、破土、启攒、乘船渡水、布政事、鼓铸、取鱼、筑堤防
2026-08-18	二零二六 丙午[马]年	七月小	初六	周二	无	无	无	丙午 丙申 甲子 己巳	无	处暑 (8, 23)	马	狮子座	祭祀、结婚姻、宴会、沐浴、上官、冠带、进人口、竖柱上梁、经络、安碓硙、牧养、赴任、布政事、纳畜、纳采、举正直、雪冤、缮城郭、裁制、临政、诉讼、酝酿、祈福、施恩、求嗣、覃恩、庆赐、修宫室、恤孤茕	修置产室、安抚边境、整手足甲、选将、出师
2026-08-19	二零二六 丙午[马]年	七月小	初七	周三	无	七夕-魁星诞	无	丙午 丙申 乙丑 辛巳	无	处暑 (8, 23)	马	狮子座	宴会、纳财、捕捉、牧养、庆赐、布政事、雪冤、纳畜、恤孤茕、覃恩	出行、结婚姻、嫁娶、求医疗病、冠带、畋猎、远回、搬移
2026-08-20	二零二六 丙午[马]年	七月小	初八	周四	无	无	无	丙午 丙申 丙寅 癸巳	无	处暑 (8, 23)	马	狮子座	沐浴、雪冤、入宅、覃恩、恤孤茕	祭祀、出行、结婚姻、宴会、嫁娶、安床、剃头、修造、求医疗病、上表章、上官、冠带、进人口、竖柱上梁、经络、开市、纳财、修置产室、开渠、穿井、安碓硙、平治道涂、破屋坏垣、伐木、栽种、牧养、破土、安葬、启攒、布政事、出师、纳畜、颁诏、补垣、纳采、举正直、解除、安抚边境、修仓库、整手足甲、缮城郭、鼓铸、裁制、宣政事、临政、酝酿、立券交易、招贤、开仓、祈福、筑堤防、施恩、求嗣、塞穴、修饰垣墙、上册、庆赐、整容、修宫室、选将、营建、搬移
2026-08-21	二零二六 丙午[马]年	七月小	初九	周五	无	无	无	丙午 丙申 丁卯 乙巳	无	处暑 (8, 23)	马	狮子座	祭祀、出行、结婚姻、宴会、嫁娶、安床、修造、求医疗病、上表章、上官、竖柱上梁、栽种、牧养、安葬、出师、纳畜、颁诏、纳采、举正直、安抚边境、修仓库、雪冤、缮城郭、裁制、宣政事、临政、立券交易、招贤、祈福、解除、施恩、求嗣、覃恩、上册、庆赐、恤孤茕、选将、营建、搬移	剃头、冠带、修置产室、开渠、穿井、安碓硙、平治道涂、破屋坏垣、畋猎、整容、修宫室、取鱼、开仓、筑堤防、补垣、修饰垣墙
2026-08-22	二零二六 丙午[马]年	七月小	初十	周六	无	无	邓小平诞辰纪念日	丙午 丙申 戊辰 丁巳	无	处暑 (8, 23)	马	狮子座	祭祀、出行、结婚姻、宴会、嫁娶、修造、求医疗病、上表章、上官、入学、进人口、竖柱上梁、经络、开市、纳财、安碓硙、栽种、牧养、安葬、布政事、纳畜、纳采、安抚边境、修仓库、雪冤、缮城郭、裁制、临政、酝酿、立券交易、祈福、筑堤防、解除、求嗣、覃恩、上册、庆赐、恤孤茕、修宫室、选将、营建、出师、搬移	剃头、冠带、修置产室、开渠、穿井、平治道涂、破屋坏垣、伐木、畋猎、破土、启攒、取鱼、补垣、整手足甲、鼓铸、针刺、开仓、塞穴、修饰垣墙、整容、远回
2026-08-23	二零二六 丙午[马]年	七月小	十一	周日	无	无	无	丙午 丙申 己巳 己巳	处暑	白露 (9, 7)	马	处女座	结婚姻、宴会、嫁娶、进人口、经络、开市、纳财、捕捉、栽种、牧养、安葬、酝酿、纳畜、立券交易、开仓	祭祀、出行、安床、剃头、修造、求医疗病、上表章、上官、冠带、竖柱上梁、修置产室、开渠、穿井、安碓硙、破屋坏垣、破土、启攒、布政事、出师、颁诏、补垣、纳采、举正直、安抚边境、修仓库、整手足甲、缮城郭、鼓铸、裁制、宣政事、临政、招贤、祈福、解除、施恩、筑堤防、求嗣、塞穴、修饰垣墙、上册、庆赐、整容、修宫室、选将、营建、搬移
2026-08-24	二零二六 丙午[马]年	七月小	十二	周一	无	无	无	丙午 丙申 庚午 辛巳	无	白露 (9, 7)	马	处女座	入学、雪冤、覃恩、恤孤茕	结婚姻、嫁娶、冠带、进人口、竖柱上梁、经络、伐木、畋猎、启攒、布政事、取鱼、纳采、补垣、酝酿、开仓、入宅、筑堤防、塞穴、营建
2026-08-25	二零二六 丙午[马]年	七月小	十三	周二	无	长真谭真人诞-大势至菩萨诞	无	丙午 丙申 辛未 癸巳	无	白露 (9, 7)	马	处女座	破土、赴任、入宅	出行、结婚姻、宴会、嫁娶、安床、剃头、修造、求医疗病、上表章、上官、冠带、进人口、竖柱上梁、经络、开市、纳财、修置产室、开渠、穿井、安碓硙、破屋坏垣、栽种、牧养、安葬、布政事、纳畜、取鱼、颁诏、纳采、补垣、举正直、安抚边境、修仓库、整手足甲、缮城郭、鼓铸、裁制、宣政事、临政、乘船渡水、针刺、酝酿、立券交易、招贤、开仓、祈福、解除、施恩、筑堤防、求嗣、塞穴、修饰垣墙、上册、庆赐、整容、修宫室、选将、营建、出师、疗目、搬移
2026-08-26	二零二六 丙午[马]年	七月小	十四	周三	无	无	无	丙午 丙申 壬申 乙巳	无	白露 (9, 7)	马	处女座	祭祀、嫁娶、沐浴、上官、进人口、经络、纳财、扫舍宇、牧养、纳畜、颁诏、举正直、安抚边境、雪冤、裁制、宣政事、临政、酝酿、招贤、施恩、覃恩、恤孤茕、选将、搬移	修置产室、开渠、穿井、平治道涂、破屋坏垣、伐木、畋猎、启攒、乘船渡水、取鱼、筑堤防、补垣、修饰垣墙
2026-08-27	二零二六 丙午[马]年	七月小	十五	周四	无	中元节	无	丙午 丙申 癸酉 丁巳	无	白露 (9, 7)	马	处女座	祭祀、出行、结婚姻、嫁娶、沐浴、剃头、修造、求医疗病、上表章、上官、竖柱上梁、纳财、扫舍宇、栽种、牧养、安葬、布政事、纳畜、颁诏、纳采、举正直、安抚边境、修仓库、雪冤、整手足甲、缮城郭、裁制、临政、招贤、开仓、祈福、解除、施恩、求嗣、覃恩、上册、整容、恤孤茕、修宫室、选将、营建、出师、搬移	宴会、冠带、修置产室、捕捉、畋猎、乘船渡水、鼓铸、取鱼、塞穴、筑堤防、补垣
2026-08-28	二零二六 丙午[马]年	七月小	十六	周五	无	无	无	丙午 丙申 甲戌 己巳	无	白露 (9, 7)	马	处女座	宴会、上表章、进人口、竖柱上梁、经络、开市、纳财、栽种、牧养、赴任、纳畜、补垣、修仓库、缮城郭、裁制、诉讼、立券交易、塞穴、上册、庆赐、修宫室	祭祀、结婚姻、上官、乘船渡水、取鱼、招贤、施恩、纳采、举正直
2026-08-29	二零二六 丙午[马]年	七月小	十七	周六	无	无	无	丙午 丙申 乙亥 辛巳	无	白露 (9, 7)	马	处女座	祭祀、沐浴、平治道涂、修饰垣墙	出行、结婚姻、宴会、嫁娶、安床、修造、求医疗病、上表章、上官、冠带、进人口、竖柱上梁、经络、开市、纳财、修置产室、开渠、穿井、栽种、牧养、破土、安葬、启攒、布政事、纳畜、颁诏、纳采、举正直、安抚边境、修仓库、缮城郭、鼓铸、裁制、宣政事、临政、酝酿、立券交易、招贤、开仓、祈福、解除、施恩、筑堤防、求嗣、上册、庆赐、修宫室、选将、营建、出师、搬移
2026-08-30	二零二六 丙午[马]年	七月小	十八	周日	无	西王母诞	无	丙午 丙申 丙子 癸巳	无	白露 (9, 7)	马	处女座	祭祀、宴会、沐浴、上官、冠带、进人口、竖柱上梁、经络、安碓硙、牧养、纳畜、纳采、举正直、缮城郭、裁制、临政、酝酿、入宅、祈福、施恩、求嗣、庆赐、修宫室	修置产室、出师、安抚边境、选将
2026-08-31	二零二六 丙午[马]年	七月小	十九	周一	无	太岁诞	无	丙午 丙申 丁丑 乙巳	无	白露 (9, 7)	马	处女座	祭祀、结婚姻、宴会、嫁娶、修造、求医疗病、上表章、上官、竖柱上梁、纳财、捕捉、栽种、牧养、安葬、出师、纳畜、颁诏、纳采、举正直、安抚边境、修仓库、雪冤、缮城郭、裁制、宣政事、临政、招贤、祈福、解除、施恩、求嗣、覃恩、上册、庆赐、恤孤茕、选将、营建	剃头、冠带、畋猎、整容、整手足甲、取鱼、远回
