2030-05-01 10:00:00	二零三零 庚戌[狗]年 三月小廿九	星期三	国、际、劳、动、节	庚戌 庚辰 丙申 癸巳	无	立夏 (5, 5)	狗	金牛座	祭祀、沐浴、扫舍宇	出行、结婚姻、宴会、嫁娶、安床、剃头、修造、求医疗病、上表章、上官、冠带、进人口、竖柱上梁、经络、开市、纳财、修置产室、开渠、穿井、安碓硙、平治道涂、破屋坏垣、伐木、捕捉、畋猎、栽种、牧养、破土、安葬、启攒、营建、开仓、纳畜、招贤、选将、施恩、解除、颁诏、整容、修饰垣墙、出师、布政事、修仓库、祈福、缮城郭、补垣、取鱼、鼓铸、上册、整手足甲、远回、纳采、求嗣、宣政事、举正直、筑堤防、立券交易、塞穴、酝酿、裁制、搬移、安抚边境、庆赐、临政、修宫室
2030-05-02 10:00:00	二零三零 庚戌[狗]年 四月大初一	星期四	八、殿、都、市、王、诞	庚戌 庚辰 丁酉 乙巳	无	立夏 (5, 5)	狗	金牛座	祭祀、出行、结婚姻、嫁娶、沐浴、修造、求医疗病、上表章、上官、进人口、竖柱上梁、经络、纳财、扫舍宇、捕捉、栽种、牧养、安葬、营建、开仓、纳畜、招贤、施恩、选将、解除、颁诏、修仓库、出师、祈福、缮城郭、上册、整手足甲、纳采、求嗣、宣政事、举正直、覃恩、恤孤茕、立券交易、酝酿、裁制、搬移、安抚边境、雪冤、临政、修宫室	宴会、剃头、冠带、修置产室、开渠、穿井、安碓硙、平治道涂、破屋坏垣、畋猎、修饰垣墙、乘船渡水、补垣、筑堤防、取鱼
2030-05-03 10:00:00	二零三零 庚戌[狗]年 四月大初二	星期五	世、界、新、闻、自、由、日	庚戌 庚辰 戊戌 丁巳	无	立夏 (5, 5)	狗	金牛座	祭祀、沐浴、求医疗病、解除	结婚姻、宴会、安床、修造、上官、冠带、进人口、竖柱上梁、经络、开市、纳财、修置产室、开渠、穿井、安碓硙、平治道涂、伐木、栽种、牧养、破土、安葬、启攒、营建、开仓、纳畜、招贤、施恩、颁诏、修饰垣墙、布政事、修仓库、缮城郭、补垣、取鱼、鼓铸、上册、乘船渡水、纳采、求嗣、宣政事、举正直、筑堤防、立券交易、塞穴、酝酿、庆赐、临政、修宫室
2030-05-04 10:00:00	二零三零 庚戌[狗]年 四月大初三	星期六	中、国、青、年、节	庚戌 庚辰 己亥 己巳	无	立夏 (5, 5)	狗	金牛座	安床、沐浴、纳财、牧养、纳畜、选将、安抚边境、取鱼、出师	祭祀、出行、结婚姻、嫁娶、修造、求医疗病、上官、进人口、开市、修置产室、开渠、穿井、安碓硙、平治道涂、破屋坏垣、畋猎、破土、安葬、启攒、营建、开仓、解除、修饰垣墙、修仓库、缮城郭、祈福、补垣、求嗣、筑堤防、立券交易、搬移、修宫室
2030-05-05 10:00:00	二零三零 庚戌[狗]年 四月大初四	星期日	马、克、思、诞、辰、纪、念、日、文、殊、菩、萨、诞	庚戌 辛巳 庚子 辛巳	立夏	小满 (5, 21)	狗	金牛座	祭祀、宴会、沐浴、颁诏、入宅、宣政事、覃恩、恤孤茕、裁制、庆赐、雪冤	冠带、进人口、经络、开市、纳财、修置产室、畋猎、开仓、取鱼、筑堤防、立券交易、修宫室
2030-05-06 10:00:00	二零三零 庚戌[狗]年 四月大初五	星期一	无	庚戌 辛巳 辛丑 癸巳	无	小满 (5, 21)	狗	金牛座	祭祀、结婚姻、宴会、修造、求医疗病、上表章、上官、入学、进人口、竖柱上梁、经络、开市、纳财、安碓硙、栽种、牧养、安葬、营建、纳畜、招贤、施恩、解除、颁诏、修仓库、祈福、缮城郭、上册、纳采、求嗣、宣政事、举正直、筑堤防、覃恩、恤孤茕、立券交易、裁制、庆赐、雪冤、临政、修宫室	冠带、畋猎、乘船渡水、取鱼、远回
2030-05-07 10:00:00	二零三零 庚戌[狗]年 四月大初六	星期二	无	庚戌 辛巳 壬寅 乙巳	无	小满 (5, 21)	狗	金牛座	捕捉、赴任、诉讼	祭祀、出行、结婚姻、宴会、嫁娶、安床、剃头、修造、求医疗病、上表章、上官、冠带、进人口、竖柱上梁、经络、开市、纳财、修置产室、开渠、穿井、安碓硙、平治道涂、破屋坏垣、栽种、牧养、破土、安葬、启攒、营建、开仓、纳畜、招贤、施恩、选将、解除、颁诏、整容、修饰垣墙、出师、布政事、修仓库、祈福、缮城郭、补垣、鼓铸、上册、整手足甲、纳采、求嗣、宣政事、举正直、筑堤防、立券交易、塞穴、酝酿、裁制、搬移、安抚边境、庆赐、临政、修宫室
2030-05-08 10:00:00	二零三零 庚戌[狗]年 四月大初七	星期三	世、界、红、十、字、日	庚戌 辛巳 癸卯 丁巳	无	小满 (5, 21)	狗	金牛座	入学、覃恩、恤孤茕、雪冤	竖柱上梁、经络、立券、穿井、伐木、畋猎、安葬、营建、开仓、选将、开张、出师、布政事、补垣、入宅、取鱼、纳采、筑堤防、塞穴、酝酿、安抚边境
2030-05-09 10:00:00	二零三零 庚戌[狗]年 四月大初八	星期四	释、迦、牟、尼、佛、诞	庚戌 辛巳 甲辰 己巳	无	小满 (5, 21)	狗	金牛座	诸事不宜	诸事不宜
2030-05-10 10:00:00	二零三零 庚戌[狗]年 四月大初九	星期五	无	庚戌 辛巳 乙巳 辛巳	无	小满 (5, 21)	狗	金牛座	祭祀、宴会、上官、进人口、经络、纳财、牧养、赴任、纳畜、招贤、施恩、选将、颁诏、入宅、宣政事、举正直、覃恩、恤孤茕、立券交易、酝酿、裁制、搬移、安抚边境、庆赐、雪冤、临政	出行、剃头、修置产室、开渠、穿井、平治道涂、破屋坏垣、伐木、畋猎、破土、启攒、修饰垣墙、开仓、补垣、筑堤防、整容、取鱼、整手足甲
2030-05-11 10:00:00	二零三零 庚戌[狗]年 四月大初十	星期六	世、界、肥、胖、日	庚戌 辛巳 丙午 癸巳	无	小满 (5, 21)	狗	金牛座	祭祀、宴会、沐浴、剃头、扫舍宇、颁诏、整容、整手足甲、宣政事、覃恩、恤孤茕、裁制、庆赐、雪冤	冠带、修置产室、畋猎、启攒、乘船渡水、开仓、苫盖、修宫室、筑堤防、取鱼
2030-05-12 10:00:00	二零三零 庚戌[狗]年 四月大十一	星期日	母、亲、节	庚戌 辛巳 丁未 乙巳	无	小满 (5, 21)	狗	金牛座	诸事不宜	祭祀、出行、结婚姻、安床、剃头、修造、上官、冠带、修置产室、开渠、穿井、安碓硙、平治道涂、破屋坏垣、伐木、栽种、牧养、启攒、营建、纳畜、招贤、施恩、选将、解除、颁诏、整容、修饰垣墙、出师、布政事、补垣、取鱼、鼓铸、整手足甲、乘船渡水、远回、纳采、宣政事、举正直、筑堤防、酝酿、搬移、安抚边境、临政
2030-05-13 10:00:00	二零三零 庚戌[狗]年 四月大十二	星期一	无	庚戌 辛巳 戊申 丁巳	无	小满 (5, 21)	狗	金牛座	祭祀、沐浴、扫舍宇、平治道涂	上表章、开渠、穿井、启攒、营建、招贤、选将、针刺、颁诏、出师、布政事、补垣、上册、宣政事、筑堤防、塞穴、安抚边境
2030-05-14 10:00:00	二零三零 庚戌[狗]年 四月大十三	星期二	无	庚戌 辛巳 己酉 己巳	无	小满 (5, 21)	狗	金牛座	祭祀、沐浴、剃头、修造、上官、冠带、进人口、竖柱上梁、经络、安碓硙、扫舍宇、牧养、安葬、纳畜、施恩、整容、布政事、缮城郭、祈福、整手足甲、求嗣、举正直、覃恩、恤孤茕、酝酿、裁制、搬移、雪冤、临政、修宫室	宴会、上表章、修置产室、苫盖、上册
2030-05-15 10:00:00	二零三零 庚戌[狗]年 四月大十四	星期三	纯、阳、祖、师、诞	庚戌 辛巳 庚戌 辛巳	无	小满 (5, 21)	狗	金牛座	祭祀、结婚姻、宴会、嫁娶、沐浴、剃头、修造、求医疗病、上表章、上官、竖柱上梁、捕捉、栽种、牧养、安葬、营建、纳畜、招贤、施恩、选将、解除、颁诏、整容、出师、祈福、缮城郭、入宅、上册、整手足甲、纳采、求嗣、宣政事、举正直、覃恩、恤孤茕、裁制、搬移、安抚边境、庆赐、雪冤、临政	经络、畋猎、乘船渡水、开仓、取鱼
2030-05-16 10:00:00	二零三零 庚戌[狗]年 四月大十五	星期四	钟、离、祖、师、诞	庚戌 辛巳 辛亥 癸巳	无	小满 (5, 21)	狗	金牛座	沐浴、破屋坏垣、解除、覃恩、恤孤茕、雪冤	嫁娶、安床、剃头、冠带、经络、开市、修置产室、开渠、穿井、安碓硙、伐木、捕捉、畋猎、破土、启攒、开仓、整容、修饰垣墙、补垣、取鱼、鼓铸、整手足甲、修宫室、筑堤防、立券交易、塞穴、酝酿
2030-05-17 10:00:00	二零三零 庚戌[狗]年 四月大十六	星期五	无	庚戌 辛巳 壬子 乙巳	无	小满 (5, 21)	狗	金牛座	沐浴、雪冤、覃恩、恤孤茕	结婚姻、嫁娶、修造、求医疗病、上表章、冠带、进人口、竖柱上梁、经络、开市、纳财、修置产室、开渠、穿井、安碓硙、栽种、牧养、安葬、营建、开仓、纳畜、招贤、施恩、解除、颁诏、修饰垣墙、修仓库、祈福、缮城郭、补垣、鼓铸、上册、纳采、求嗣、宣政事、举正直、修宫室、筑堤防、立券交易、塞穴、酝酿、裁制
2030-05-18 10:00:00	二零三零 庚戌[狗]年 四月大十七	星期六	十、殿、转、轮、王、诞	庚戌 辛巳 癸丑 丁巳	无	小满 (5, 21)	狗	金牛座	出行、宴会、上表章、上官、入学、进人口、竖柱上梁、经络、开市、纳财、安碓硙、纳畜、施恩、布政事、缮城郭、上册、举正直、筑堤防、覃恩、恤孤茕、立券交易、酝酿、裁制、庆赐、雪冤、临政、修宫室	冠带、乘船渡水、远回、选将、出师、取鱼
2030-05-19 10:00:00	二零三零 庚戌[狗]年 四月大十八	星期日	紫、徽、大、帝、诞	庚戌 辛巳 甲寅 己巳	无	小满 (5, 21)	狗	金牛座	捕捉、赴任、诉讼	祭祀、出行、结婚姻、宴会、嫁娶、安床、剃头、修造、求医疗病、上表章、上官、冠带、进人口、竖柱上梁、经络、开市、纳财、修置产室、开渠、穿井、安碓硙、平治道涂、破屋坏垣、栽种、牧养、破土、安葬、启攒、营建、开仓、纳畜、招贤、施恩、选将、解除、颁诏、整容、修饰垣墙、出师、布政事、修仓库、祈福、缮城郭、补垣、鼓铸、上册、整手足甲、纳采、求嗣、宣政事、举正直、筑堤防、立券交易、塞穴、酝酿、裁制、搬移、安抚边境、庆赐、临政、修宫室
2030-05-20 10:00:00	二零三零 庚戌[狗]年 四月大十九	星期一	无	庚戌 辛巳 乙卯 辛巳	无	小满 (5, 21)	狗	金牛座	祭祀、出行、结婚姻、宴会、嫁娶、修造、求医疗病、上表章、上官、入学、竖柱上梁、开市、纳财、修置产室、安碓硙、栽种、牧养、赴任、营建、纳畜、招贤、施恩、选将、解除、颁诏、出师、修仓库、祈福、缮城郭、入宅、上册、纳采、求嗣、宣政事、举正直、修宫室、覃恩、恤孤茕、立券交易、裁制、搬移、安抚边境、庆赐、雪冤、临政	剃头、冠带、穿井、破屋坏垣、伐木、畋猎、开仓、取鱼、补垣、整容、筑堤防、塞穴、修饰垣墙、鼓铸、整手足甲、布政事
2030-05-21 10:00:00	二零三零 庚戌[狗]年 四月大二十	星期二	眼、光、圣、母、诞	庚戌 辛巳 丙辰 癸巳	小满	芒种 (6, 5)	狗	双子座	祭祀、覃恩、恤孤茕、雪冤	出行、结婚姻、宴会、嫁娶、安床、剃头、修造、求医疗病、上表章、上官、冠带、进人口、竖柱上梁、经络、开市、纳财、修置产室、开渠、穿井、安碓硙、破屋坏垣、畋猎、栽种、牧养、破土、安葬、启攒、营建、开仓、纳畜、招贤、施恩、选将、解除、针刺、颁诏、整容、修饰垣墙、出师、布政事、修仓库、祈福、缮城郭、补垣、取鱼、鼓铸、上册、整手足甲、疗目、纳采、求嗣、宣政事、举正直、修宫室、筑堤防、立券交易、塞穴、酝酿、裁制、搬移、安抚边境、庆赐、临政
2030-05-22 10:00:00	二零三零 庚戌[狗]年 四月大廿一	星期三	无	庚戌 辛巳 丁巳 乙巳	无	芒种 (6, 5)	狗	双子座	宴会、上官、进人口、经络、纳财、纳畜、招贤、施恩、颁诏、宣政事、举正直、覃恩、恤孤茕、立券交易、酝酿、裁制、庆赐、雪冤、临政	出行、剃头、求医疗病、上表章、修置产室、开渠、穿井、平治道涂、破屋坏垣、伐木、畋猎、栽种、破土、安葬、启攒、营建、开仓、解除、整容、修饰垣墙、祈福、补垣、上册、整手足甲、求嗣、筑堤防
2030-05-23 10:00:00	二零三零 庚戌[狗]年 四月大廿二	星期四	世、界、读、书、日	庚戌 辛巳 戊午 丁巳	无	芒种 (6, 5)	狗	双子座	祭祀、宴会、沐浴、剃头、扫舍宇、整容、整手足甲、裁制、庆赐	嫁娶、上表章、冠带、修置产室、营建、乘船渡水、纳畜、招贤、苫盖、上册、筑堤防、取鱼、修仓库
2030-05-24 10:00:00	二零三零 庚戌[狗]年 四月大廿三	星期五	无	庚戌 辛巳 己未 己巳	无	芒种 (6, 5)	狗	双子座	诸事不宜	祭祀、嫁娶、剃头、冠带、修置产室、开渠、穿井、安碓硙、平治道涂、破屋坏垣、伐木、破土、启攒、营建、纳畜、招贤、选将、颁诏、整容、修饰垣墙、出师、布政事、补垣、取鱼、鼓铸、整手足甲、乘船渡水、远回、宣政事、筑堤防、安抚边境
2030-05-25 10:00:00	二零三零 庚戌[狗]年 四月大廿四	星期六	无	庚戌 辛巳 庚申 辛巳	无	芒种 (6, 5)	狗	双子座	祭祀、出行、结婚姻、宴会、嫁娶、沐浴、剃头、修造、求医疗病、上表章、上官、进人口、竖柱上梁、经络、开市、纳财、扫舍宇、平治道涂、栽种、牧养、安葬、营建、开仓、纳畜、招贤、施恩、选将、解除、颁诏、整容、修饰垣墙、修仓库、出师、祈福、缮城郭、入宅、上册、整手足甲、纳采、求嗣、宣政事、举正直、覃恩、恤孤茕、立券交易、酝酿、裁制、搬移、安抚边境、庆赐、雪冤、临政	安床、冠带、修置产室、开渠、穿井、安碓硙、破屋坏垣、畋猎、鼓铸、补垣、修宫室、筑堤防、针刺、塞穴、取鱼、布政事
2030-05-26 10:00:00	二零三零 庚戌[狗]年 四月大廿五	星期日	无	庚戌 辛巳 辛酉 癸巳	无	芒种 (6, 5)	狗	双子座	祭祀、沐浴、剃头、修造、上官、冠带、进人口、竖柱上梁、经络、安碓硙、扫舍宇、牧养、安葬、营建、纳畜、招贤、施恩、颁诏、整容、祈福、缮城郭、整手足甲、求嗣、宣政事、举正直、覃恩、恤孤茕、裁制、搬移、雪冤、临政、修宫室	宴会、修置产室、畋猎、开仓、苫盖、取鱼
2030-05-27 10:00:00	二零三零 庚戌[狗]年 四月大廿六	星期一	上、海、解、放、日	庚戌 辛巳 壬戌 乙巳	无	芒种 (6, 5)	狗	双子座	沐浴、剃头、求医疗病、上表章、捕捉、解除、整手足甲、整容	出行、嫁娶、修造、开渠、穿井、安葬、开仓、修仓库
2030-05-28 10:00:00	二零三零 庚戌[狗]年 四月大廿七	星期二	无	庚戌 辛巳 癸亥 丁巳	无	芒种 (6, 5)	狗	双子座	沐浴、破屋坏垣	祭祀、结婚姻、宴会、嫁娶、安床、剃头、修造、上表章、上官、冠带、竖柱上梁、经络、开市、修置产室、开渠、穿井、安碓硙、伐木、捕捉、畋猎、栽种、牧养、破土、安葬、启攒、营建、开仓、招贤、施恩、解除、颁诏、整容、修饰垣墙、修仓库、布政事、祈福、缮城郭、补垣、取鱼、鼓铸、上册、整手足甲、纳采、求嗣、宣政事、举正直、修宫室、筑堤防、立券交易、塞穴、酝酿、裁制、庆赐、临政
2030-05-29 10:00:00	二零三零 庚戌[狗]年 四月大廿八	星期三	无	庚戌 辛巳 甲子 己巳	无	芒种 (6, 5)	狗	双子座	宴会、沐浴、庆赐、雪冤、覃恩、恤孤茕、布政事	结婚姻、修造、求医疗病、冠带、进人口、竖柱上梁、开市、纳财、修置产室、栽种、牧养、安葬、营建、开仓、纳畜、招贤、施恩、解除、修仓库、祈福、缮城郭、上册、纳采、求嗣、举正直、筑堤防、立券交易、修宫室
2030-05-30 10:00:00	二零三零 庚戌[狗]年 四月大廿九	星期四	无	庚戌 辛巳 乙丑 辛巳	无	芒种 (6, 5)	狗	双子座	祭祀、出行、结婚姻、宴会、修造、求医疗病、上表章、上官、入学、进人口、竖柱上梁、经络、开市、纳财、安碓硙、牧养、安葬、赴任、营建、纳畜、招贤、施恩、解除、颁诏、修仓库、祈福、缮城郭、入宅、上册、纳采、求嗣、宣政事、举正直、筑堤防、覃恩、恤孤茕、立券交易、酝酿、裁制、庆赐、雪冤、临政、修宫室	冠带、畋猎、乘船渡水、远回、取鱼
2030-05-31 10:00:00	二零三零 庚戌[狗]年 四月大三十	星期五	世、界、无、烟、日	庚戌 辛巳 丙寅 癸巳	无	芒种 (6, 5)	狗	双子座	出行、结婚姻、宴会、嫁娶、修造、求医疗病、上表章、上官、进人口、竖柱上梁、纳财、捕捉、栽种、牧养、安葬、赴任、营建、纳畜、招贤、施恩、选将、解除、颁诏、修仓库、出师、祈福、缮城郭、上册、纳采、求嗣、宣政事、举正直、覃恩、恤孤茕、立券交易、诉讼、裁制、搬移、安抚边境、庆赐、雪冤、临政	祭祀、剃头、冠带、修置产室、开渠、穿井、安碓硙、平治道涂、破屋坏垣、畋猎、开仓、整容、修饰垣墙、补垣、取鱼、鼓铸、整手足甲、修宫室、筑堤防、塞穴
