2030-08-01	二零三零 庚戌[狗]年	七月大	初三	周四	庚戌 癸未 戊辰 丁巳	无	立秋 (8, 7)	无	无	中国人民解放军建军节	狗	狮子座	祭祀、纳财、捕捉、覃恩、恤孤茕、雪冤	嫁娶、上表章、冠带、修置产室、开渠、穿井、安碓硙、平治道涂、破屋坏垣、破土、安葬、启攒、上册、颁诏、补垣、招贤、宣政事、安抚边境、修饰垣墙、修仓库、选将、鼓铸、营建、出师、筑堤防
2030-08-02	二零三零 庚戌[狗]年	七月大	初四	周五	庚戌 癸未 己巳 己巳	无	立秋 (8, 7)	无	无	无	狗	狮子座	祭祀、结婚姻、宴会、嫁娶、修造、求医疗病、上表章、上官、入学、竖柱上梁、开市、纳财、修置产室、开渠、穿井、安碓硙、栽种、牧养、搬移、祈福、缮城郭、裁制、上册、开仓、修宫室、求嗣、覃恩、恤孤茕、雪冤、庆赐、安抚边境、临政、纳畜、解除、修仓库、选将、营建、纳采	出行、剃头、冠带、平治道涂、破屋坏垣、伐木、畋猎、破土、启攒、补垣、取鱼、整容、布政事、修饰垣墙、塞穴、远回、鼓铸、整手足甲、筑堤防
2030-08-03	二零三零 庚戌[狗]年	七月大	初五	周六	庚戌 癸未 庚午 辛巳	无	立秋 (8, 7)	无	无	无	狗	狮子座	安葬、诉讼、入宅、塞穴、赴任、酝酿	出行、安床、冠带、竖柱上梁、开市、修置产室、开渠、穿井、安碓硙、平治道涂、破屋坏垣、捕捉、畋猎、栽种、牧养、祈福、缮城郭、开仓、上册、修宫室、颁诏、求嗣、庆赐、取鱼、针刺、招贤、布政事、宣政事、安抚边境、疗目、施恩、修饰垣墙、举正直、解除、乘船渡水、修仓库、选将、营建、出师、苫盖
2030-08-04	二零三零 庚戌[狗]年	七月大	初六	周日	庚戌 癸未 辛未 癸巳	无	立秋 (8, 7)	无	无	无	狗	狮子座	出行、宴会、嫁娶、上官、进人口、经络、纳财、牧养、搬移、裁制、庆赐、招贤、安抚边境、施恩、立券交易、临政、纳畜、举正直、选将、出师	剃头、上表章、修置产室、开渠、穿井、平治道涂、破屋坏垣、伐木、安葬、启攒、补垣、整容、营建、整手足甲、筑堤防、上册、修饰垣墙
2030-08-05	二零三零 庚戌[狗]年	七月大	初七	周一	庚戌 癸未 壬申 乙巳	无	立秋 (8, 7)	无	七夕-魁星诞	恩格斯逝世纪念日	狗	狮子座	祭祀、沐浴、扫舍宇	结婚姻、宴会、安床、修造、上表章、冠带、进人口、竖柱上梁、经络、开市、纳财、修置产室、开渠、穿井、安碓硙、平治道涂、破屋坏垣、栽种、牧养、启攒、搬移、缮城郭、裁制、上册、开仓、修宫室、颁诏、庆赐、补垣、招贤、布政事、宣政事、立券交易、修饰垣墙、纳畜、塞穴、修仓库、酝酿、鼓铸、营建、纳采、筑堤防
2030-08-06	二零三零 庚戌[狗]年	七月大	初八	周二	庚戌 癸未 癸酉 丁巳	无	立秋 (8, 7)	无	无	国际电影节	狗	狮子座	沐浴、扫舍宇	祭祀、出行、结婚姻、宴会、嫁娶、安床、剃头、修造、求医疗病、上表章、上官、冠带、进人口、竖柱上梁、经络、开市、纳财、修置产室、开渠、穿井、安碓硙、平治道涂、破屋坏垣、栽种、牧养、破土、安葬、启攒、搬移、祈福、缮城郭、裁制、上册、开仓、修宫室、颁诏、求嗣、庆赐、补垣、针刺、招贤、整容、布政事、宣政事、安抚边境、入宅、施恩、立券交易、修饰垣墙、临政、纳畜、举正直、解除、塞穴、修仓库、酝酿、选将、鼓铸、营建、纳采、整手足甲、出师、筑堤防
2030-08-07	二零三零 庚戌[狗]年	七月大	初九	周三	庚戌 甲申 甲戌 己巳	立秋	处暑 (8, 23)	无	无	无	狗	狮子座	宴会、上表章、进人口、竖柱上梁、经络、开市、纳财、栽种、牧养、诉讼、缮城郭、裁制、上册、修宫室、庆赐、补垣、立券交易、纳畜、塞穴、修仓库、赴任	祭祀、结婚姻、嫁娶、上官、取鱼、招贤、举正直、纳采、乘船渡水、施恩
2030-08-08	二零三零 庚戌[狗]年	七月大	初十	周四	庚戌 甲申 乙亥 辛巳	无	处暑 (8, 23)	无	无	无	狗	狮子座	祭祀、出行、沐浴、修造、上官、平治道涂、临政、赴任、搬移、入宅、纳采、祈福、修饰垣墙	结婚姻、宴会、嫁娶、求医疗病、上表章、冠带、竖柱上梁、修置产室、开渠、穿井、栽种、牧养、破土、安葬、启攒、缮城郭、开仓、裁制、上册、修宫室、颁诏、求嗣、庆赐、招贤、布政事、宣政事、安抚边境、施恩、纳畜、举正直、解除、修仓库、选将、鼓铸、营建、出师、筑堤防
2030-08-09	二零三零 庚戌[狗]年	七月大	十一	周五	庚戌 甲申 丙子 癸巳	无	处暑 (8, 23)	无	无	无	狗	狮子座	祭祀、出行、结婚姻、宴会、嫁娶、沐浴、修造、上官、冠带、进人口、竖柱上梁、经络、安碓硙、牧养、搬移、祈福、缮城郭、裁制、修宫室、求嗣、庆赐、施恩、临政、纳畜、举正直、酝酿、纳采	修置产室、出师、选将、安抚边境
2030-08-10	二零三零 庚戌[狗]年	七月大	十二	周六	庚戌 甲申 丁丑 乙巳	无	处暑 (8, 23)	无	无	无	狗	狮子座	祭祀、结婚姻、宴会、嫁娶、修造、求医疗病、上表章、上官、竖柱上梁、纳财、捕捉、栽种、牧养、安葬、祈福、缮城郭、裁制、上册、颁诏、求嗣、覃恩、恤孤茕、雪冤、庆赐、招贤、宣政事、安抚边境、施恩、临政、纳畜、举正直、解除、修仓库、选将、营建、纳采、出师	剃头、冠带、畋猎、取鱼、整容、远回
2030-08-11	二零三零 庚戌[狗]年	七月大	十三	周日	庚戌 甲申 戊寅 丁巳	无	处暑 (8, 23)	无	长真谭真人诞-大势至菩萨诞	无	狗	狮子座	沐浴、覃恩、恤孤茕、雪冤	祭祀、出行、结婚姻、宴会、嫁娶、安床、剃头、修造、求医疗病、上表章、上官、冠带、进人口、竖柱上梁、经络、开市、纳财、修置产室、开渠、穿井、安碓硙、破屋坏垣、伐木、畋猎、栽种、牧养、破土、安葬、启攒、搬移、祈福、缮城郭、开仓、裁制、上册、修宫室、颁诏、求嗣、庆赐、补垣、取鱼、招贤、整容、布政事、宣政事、安抚边境、施恩、立券交易、修饰垣墙、临政、纳畜、举正直、解除、塞穴、修仓库、酝酿、选将、鼓铸、营建、纳采、整手足甲、出师、筑堤防
2030-08-12	二零三零 庚戌[狗]年	七月大	十四	周一	庚戌 甲申 己卯 己巳	无	处暑 (8, 23)	无	无	国际青年日	狗	狮子座	祭祀、宴会、覃恩、庆赐、恤孤茕、雪冤、布政事	出行、结婚姻、嫁娶、安床、修造、求医疗病、上表章、上官、冠带、进人口、竖柱上梁、开市、纳财、修置产室、开渠、穿井、安碓硙、平治道涂、破屋坏垣、栽种、牧养、破土、搬移、祈福、缮城郭、开仓、上册、修宫室、求嗣、补垣、招贤、安抚边境、施恩、立券交易、修饰垣墙、临政、纳畜、举正直、解除、乘船渡水、修仓库、选将、营建、纳采、出师、筑堤防
2030-08-13	二零三零 庚戌[狗]年	七月大	十五	周二	庚戌 甲申 庚辰 辛巳	无	处暑 (8, 23)	无	中元节	无	狗	狮子座	祭祀、出行、结婚姻、宴会、嫁娶、修造、上官、入学、进人口、竖柱上梁、经络、开市、纳财、安碓硙、栽种、牧养、搬移、祈福、缮城郭、裁制、修宫室、覃恩、庆赐、恤孤茕、雪冤、求嗣、布政事、入宅、安抚边境、立券交易、临政、纳畜、修仓库、酝酿、纳采、筑堤防	安床、剃头、求医疗病、上表章、冠带、修置产室、开渠、穿井、平治道涂、破屋坏垣、伐木、破土、安葬、启攒、开仓、上册、颁诏、补垣、针刺、招贤、整容、宣政事、修饰垣墙、解除、塞穴、选将、远回、鼓铸、营建、整手足甲、出师
2030-08-14	二零三零 庚戌[狗]年	七月大	十六	周三	庚戌 甲申 辛巳 癸巳	无	处暑 (8, 23)	无	无	无	狗	狮子座	结婚姻、宴会、嫁娶、进人口、经络、开市、纳财、捕捉、栽种、牧养、安葬、开仓、覃恩、恤孤茕、庆赐、雪冤、布政事、立券交易、纳畜、酝酿	祭祀、出行、安床、剃头、修造、求医疗病、上表章、上官、冠带、竖柱上梁、修置产室、开渠、穿井、安碓硙、破屋坏垣、破土、启攒、搬移、祈福、缮城郭、裁制、上册、修宫室、颁诏、求嗣、补垣、招贤、整容、宣政事、安抚边境、施恩、修饰垣墙、临政、举正直、解除、塞穴、修仓库、选将、鼓铸、营建、纳采、整手足甲、出师、筑堤防
2030-08-15	二零三零 庚戌[狗]年	七月大	十七	周四	庚戌 甲申 壬午 乙巳	无	处暑 (8, 23)	无	无	无	狗	狮子座	祭祀、出行、结婚姻、宴会、嫁娶、修造、求医疗病、上表章、上官、入学、竖柱上梁、开市、纳财、修置产室、安碓硙、栽种、牧养、搬移、祈福、缮城郭、开仓、裁制、上册、修宫室、颁诏、求嗣、覃恩、恤孤茕、雪冤、庆赐、招贤、宣政事、安抚边境、施恩、临政、纳畜、举正直、解除、修仓库、选将、营建、纳采、出师	剃头、冠带、开渠、破屋坏垣、伐木、畋猎、补垣、取鱼、苫盖、整容、鼓铸、入宅、整手足甲、筑堤防、塞穴、修饰垣墙
2030-08-16	二零三零 庚戌[狗]年	七月大	十八	周五	庚戌 甲申 癸未 丁巳	无	处暑 (8, 23)	无	西王母诞	无	狗	狮子座	祭祀、破土、覃恩、恤孤茕、雪冤	出行、结婚姻、宴会、嫁娶、安床、剃头、修造、求医疗病、上表章、上官、冠带、进人口、竖柱上梁、经络、开市、纳财、修置产室、开渠、穿井、安碓硙、破屋坏垣、畋猎、栽种、牧养、安葬、搬移、祈福、缮城郭、开仓、上册、修宫室、裁制、颁诏、求嗣、庆赐、补垣、取鱼、针刺、招贤、整容、布政事、宣政事、安抚边境、施恩、疗目、立券交易、临政、修饰垣墙、纳畜、举正直、解除、塞穴、修仓库、酝酿、选将、鼓铸、营建、纳采、整手足甲、出师、筑堤防
2030-08-17	二零三零 庚戌[狗]年	七月大	十九	周六	庚戌 甲申 甲申 己巳	无	处暑 (8, 23)	无	太岁诞	无	狗	狮子座	出行、沐浴、上官、进人口、经络、纳财、扫舍宇、诉讼、裁制、颁诏、覃恩、恤孤茕、雪冤、招贤、宣政事、施恩、临政、纳畜、举正直、赴任、酝酿	安床、上表章、修置产室、开渠、穿井、平治道涂、破屋坏垣、伐木、栽种、启攒、祈福、开仓、上册、求嗣、补垣、修饰垣墙、营建、筑堤防
2030-08-18	二零三零 庚戌[狗]年	七月大	二十	周日	庚戌 甲申 乙酉 辛巳	无	处暑 (8, 23)	无	无	无	狗	狮子座	出行、嫁娶、沐浴、剃头、修造、求医疗病、上官、扫舍宇、安葬、搬移、恤孤茕、雪冤、整容、入宅、安抚边境、临政、解除、赴任、选将、纳采、整手足甲、出师	结婚姻、宴会、上表章、冠带、竖柱上梁、修置产室、捕捉、畋猎、栽种、牧养、祈福、缮城郭、开仓、上册、修宫室、颁诏、求嗣、庆赐、补垣、取鱼、招贤、宣政事、纳畜、塞穴、乘船渡水、修仓库、鼓铸、营建、筑堤防
2030-08-19	二零三零 庚戌[狗]年	七月大	廿一	周一	庚戌 甲申 丙戌 癸巳	无	处暑 (8, 23)	无	无	无	狗	狮子座	宴会、上表章、进人口、竖柱上梁、经络、开市、纳财、栽种、牧养、安葬、缮城郭、裁制、开仓、上册、修宫室、庆赐、补垣、立券交易、纳畜、塞穴、修仓库	祭祀、结婚姻、嫁娶、上官、取鱼、招贤、举正直、纳采、整手足甲、乘船渡水、施恩
2030-08-20	二零三零 庚戌[狗]年	七月大	廿二	周二	庚戌 甲申 丁亥 乙巳	无	处暑 (8, 23)	无	增福财神诞	无	狗	狮子座	祭祀、出行、结婚姻、宴会、沐浴、修造、求医疗病、上表章、上官、竖柱上梁、平治道涂、栽种、牧养、安葬、搬移、祈福、缮城郭、裁制、上册、颁诏、求嗣、覃恩、恤孤茕、雪冤、庆赐、招贤、宣政事、安抚边境、施恩、修饰垣墙、临政、纳畜、举正直、解除、修仓库、选将、营建、纳采、出师	嫁娶、剃头、冠带、修置产室、开渠、穿井、畋猎、破土、启攒、取鱼、整容、鼓铸、布政事、筑堤防、开仓、修宫室
2030-08-21	二零三零 庚戌[狗]年	七月大	廿三	周三	庚戌 甲申 戊子 丁巳	无	处暑 (8, 23)	无	无	无	狗	狮子座	祭祀、结婚姻、宴会、嫁娶、沐浴、修造、上官、冠带、进人口、竖柱上梁、经络、安碓硙、牧养、安葬、搬移、祈福、缮城郭、裁制、修宫室、颁诏、求嗣、覃恩、恤孤茕、雪冤、庆赐、招贤、宣政事、施恩、临政、纳畜、举正直、酝酿、营建、纳采	修置产室、畋猎、取鱼、整手足甲、乘船渡水
2030-08-22	二零三零 庚戌[狗]年	七月大	廿四	周四	庚戌 甲申 己丑 己巳	无	处暑 (8, 23)	无	无	邓小平诞辰纪念日	狗	狮子座	纳财、捕捉、栽种、牧养、纳畜	出行、冠带、畋猎、选将、远回、搬移、安抚边境、出师
2030-08-23	二零三零 庚戌[狗]年	七月大	廿五	周五	庚戌 甲申 庚寅 辛巳	处暑	白露 (9, 7)	无	无	无	狗	处女座	沐浴、入宅	祭祀、出行、结婚姻、宴会、嫁娶、安床、剃头、修造、求医疗病、上表章、上官、冠带、进人口、竖柱上梁、经络、开市、纳财、修置产室、开渠、穿井、安碓硙、破屋坏垣、伐木、栽种、牧养、破土、安葬、启攒、搬移、祈福、缮城郭、开仓、裁制、上册、修宫室、颁诏、求嗣、庆赐、补垣、招贤、整容、布政事、宣政事、安抚边境、施恩、立券交易、修饰垣墙、临政、纳畜、举正直、解除、塞穴、修仓库、酝酿、选将、鼓铸、营建、纳采、整手足甲、出师、筑堤防
2030-08-24	二零三零 庚戌[狗]年	七月大	廿六	周六	庚戌 甲申 辛卯 癸巳	无	白露 (9, 7)	无	无	无	狗	处女座	祭祀、宴会	出行、结婚姻、嫁娶、安床、修造、求医疗病、上表章、上官、冠带、进人口、竖柱上梁、开市、纳财、修置产室、开渠、穿井、安碓硙、平治道涂、破屋坏垣、栽种、牧养、破土、搬移、祈福、缮城郭、开仓、上册、修宫室、求嗣、补垣、招贤、安抚边境、施恩、立券交易、修饰垣墙、临政、纳畜、举正直、解除、修仓库、酝酿、选将、营建、纳采、出师、筑堤防
2030-08-25	二零三零 庚戌[狗]年	七月大	廿七	周日	庚戌 甲申 壬辰 乙巳	无	白露 (9, 7)	无	无	无	狗	处女座	祭祀、出行、结婚姻、宴会、嫁娶、修造、求医疗病、上表章、上官、入学、进人口、竖柱上梁、经络、开市、纳财、安碓硙、栽种、牧养、安葬、搬移、祈福、缮城郭、裁制、开仓、上册、修宫室、求嗣、覃恩、恤孤茕、雪冤、庆赐、安抚边境、立券交易、临政、纳畜、解除、修仓库、酝酿、选将、营建、纳采、筑堤防、出师	剃头、冠带、修置产室、开渠、穿井、平治道涂、破屋坏垣、伐木、畋猎、破土、启攒、补垣、取鱼、针刺、整容、布政事、修饰垣墙、塞穴、远回、鼓铸、整手足甲
2030-08-26	二零三零 庚戌[狗]年	七月大	廿八	周一	庚戌 甲申 癸巳 丁巳	无	白露 (9, 7)	无	无	无	狗	处女座	祭祀、结婚姻、宴会、嫁娶、修造、求医疗病、上表章、上官、进人口、竖柱上梁、经络、开市、纳财、捕捉、栽种、牧养、安葬、搬移、祈福、缮城郭、开仓、裁制、上册、修宫室、颁诏、求嗣、覃恩、恤孤茕、雪冤、庆赐、招贤、宣政事、安抚边境、施恩、立券交易、临政、纳畜、举正直、解除、修仓库、酝酿、选将、营建、纳采	出行、剃头、冠带、修置产室、开渠、穿井、安碓硙、破屋坏垣、畋猎、破土、启攒、补垣、取鱼、整容、布政事、修饰垣墙、塞穴、鼓铸、整手足甲、筑堤防
2030-08-27	二零三零 庚戌[狗]年	七月大	廿九	周二	庚戌 甲申 甲午 己巳	无	白露 (9, 7)	无	杨公忌	无	狗	处女座	入学、诉讼、覃恩、恤孤茕、雪冤、赴任	结婚姻、冠带、进人口、竖柱上梁、经络、立券、伐木、畋猎、开仓、补垣、取鱼、布政事、入宅、开张、塞穴、酝酿、营建、纳采、筑堤防
2030-08-28	二零三零 庚戌[狗]年	七月大	三十	周三	庚戌 甲申 乙未 辛巳	无	白露 (9, 7)	无	地藏菩萨诞	无	狗	处女座	破土、入宅、赴任	出行、结婚姻、宴会、嫁娶、安床、剃头、修造、求医疗病、上表章、上官、冠带、进人口、竖柱上梁、经络、开市、纳财、修置产室、开渠、穿井、安碓硙、破屋坏垣、栽种、牧养、安葬、搬移、祈福、缮城郭、开仓、上册、修宫室、裁制、颁诏、求嗣、庆赐、补垣、针刺、招贤、整容、布政事、宣政事、安抚边境、施恩、疗目、立券交易、临政、修饰垣墙、纳畜、举正直、解除、塞穴、修仓库、酝酿、选将、鼓铸、营建、纳采、整手足甲、出师、筑堤防
2030-08-29	二零三零 庚戌[狗]年	八月小	初一	周四	庚戌 甲申 丙申 癸巳	无	白露 (9, 7)	无	许真君诞	无	狗	处女座	出行、嫁娶、沐浴、上官、进人口、经络、纳财、扫舍宇、裁制、颁诏、覃恩、恤孤茕、雪冤、招贤、宣政事、安抚边境、施恩、临政、纳畜、举正直、酝酿、选将、出师	安床、修置产室、开渠、穿井、平治道涂、破屋坏垣、伐木、栽种、启攒、祈福、开仓、上册、求嗣、补垣、修饰垣墙、营建、筑堤防
2030-08-30	二零三零 庚戌[狗]年	八月小	初二	周五	庚戌 甲申 丁酉 乙巳	无	白露 (9, 7)	无	无	无	狗	处女座	祭祀、出行、结婚姻、嫁娶、沐浴、修造、求医疗病、上表章、上官、竖柱上梁、扫舍宇、栽种、牧养、安葬、搬移、祈福、缮城郭、裁制、上册、颁诏、求嗣、覃恩、恤孤茕、雪冤、招贤、布政事、安抚边境、施恩、临政、纳畜、举正直、解除、修仓库、选将、营建、纳采、整手足甲、出师	宴会、剃头、冠带、修置产室、捕捉、畋猎、补垣、取鱼、鼓铸、开仓、筑堤防、塞穴、乘船渡水、修宫室
2030-08-31	二零三零 庚戌[狗]年	八月小	初三	周六	庚戌 甲申 戊戌 丁巳	无	白露 (9, 7)	无	司命灶君诞	无	狗	处女座	出行、宴会、修造、上表章、进人口、竖柱上梁、经络、开市、纳财、栽种、牧养、安葬、搬移、祈福、缮城郭、裁制、开仓、上册、修宫室、颁诏、求嗣、覃恩、补垣、恤孤茕、雪冤、庆赐、宣政事、立券交易、纳畜、解除、塞穴、修仓库、营建	祭祀、畋猎、取鱼、乘船渡水
