2031-07-01	二零三一 辛亥[猪]年	五月小	十二	周二	辛亥 甲午 壬寅 乙巳	无	小暑 (7, 7)	无	炳灵公诞	中国共产党诞生日,香港回归纪念日	猪	巨蟹座	结婚姻、宴会、上表章、上官、入学、进人口、竖柱上梁、经络、开市、纳财、安碓硙、栽种、牧养、祈福、缮城郭、裁制、修宫室、求嗣、庆赐、施恩、立券交易、临政、举正直、修仓库、酝酿、纳采、筑堤防	祭祀、剃头、开渠、穿井、整容、远回、选将、出师
2031-07-02	二零三一 辛亥[猪]年	五月小	十三	周三	辛亥 甲午 癸卯 丁巳	无	小暑 (7, 7)	无	关圣降	无	猪	巨蟹座	祭祀	出行、结婚姻、宴会、嫁娶、安床、修造、求医疗病、上表章、上官、冠带、进人口、竖柱上梁、经络、开市、纳财、修置产室、开渠、穿井、捕捉、畋猎、栽种、牧养、破土、安葬、启攒、搬移、祈福、缮城郭、裁制、上册、开仓、修宫室、颁诏、求嗣、庆赐、补垣、取鱼、针刺、招贤、布政事、宣政事、安抚边境、施恩、立券交易、临政、纳畜、举正直、解除、塞穴、乘船渡水、修仓库、酝酿、选将、鼓铸、营建、纳采、出师、筑堤防
2031-07-03	二零三一 辛亥[猪]年	五月小	十四	周四	辛亥 甲午 甲辰 己巳	无	小暑 (7, 7)	无	无	无	猪	巨蟹座	结婚姻、宴会、修造、求医疗病、上表章、上官、入学、竖柱上梁、开市、纳财、修置产室、开渠、穿井、安碓硙、栽种、牧养、诉讼、搬移、祈福、缮城郭、裁制、上册、修宫室、颁诏、求嗣、覃恩、恤孤茕、雪冤、庆赐、招贤、宣政事、施恩、临政、举正直、解除、赴任、纳采	伐木、畋猎、乘船渡水、取鱼
2031-07-04	二零三一 辛亥[猪]年	五月小	十五	周五	辛亥 甲午 乙巳 辛巳	无	小暑 (7, 7)	无	无	无	猪	巨蟹座	裁制、覃恩、恤孤茕、补垣、雪冤、安抚边境、塞穴、选将、筑堤防	出行、结婚姻、宴会、嫁娶、安床、剃头、修造、求医疗病、上表章、上官、进人口、竖柱上梁、开市、修置产室、开渠、穿井、栽种、破土、安葬、启攒、搬移、祈福、开仓、上册、修宫室、颁诏、求嗣、庆赐、针刺、招贤、整容、布政事、宣政事、施恩、疗目、临政、举正直、解除、营建、纳采、整手足甲、出师
2031-07-05	二零三一 辛亥[猪]年	五月小	十六	周六	辛亥 甲午 丙午 癸巳	无	小暑 (7, 7)	无	天地元气造化万物之辰	无	猪	巨蟹座	祭祀、覃恩、恤孤茕、雪冤、入宅	出行、结婚姻、宴会、嫁娶、安床、剃头、修造、求医疗病、上表章、上官、冠带、进人口、竖柱上梁、经络、开市、纳财、修置产室、开渠、穿井、安碓硙、平治道涂、破屋坏垣、伐木、畋猎、栽种、牧养、破土、安葬、启攒、搬移、祈福、缮城郭、裁制、开仓、上册、修宫室、颁诏、求嗣、庆赐、补垣、取鱼、招贤、整容、布政事、宣政事、安抚边境、施恩、立券交易、修饰垣墙、临政、纳畜、举正直、解除、塞穴、修仓库、酝酿、选将、远回、鼓铸、营建、纳采、整手足甲、出师、筑堤防、苫盖
2031-07-06	二零三一 辛亥[猪]年	五月小	十七	周日	辛亥 甲午 丁未 乙巳	无	小暑 (7, 7)	无	无	无	猪	巨蟹座	出行、宴会、沐浴、上官、进人口、经络、纳财、扫舍宇、裁制、施恩、立券交易、临政、纳畜、举正直、解除、酝酿、整手足甲	剃头、启攒、纳采
2031-07-07	二零三一 辛亥[猪]年	五月小	十八	周一	辛亥 乙未 戊申 丁巳	小暑	大暑 (7, 23)	无	张天师诞	中国人民抗日战争纪念日	猪	巨蟹座	祭祀、沐浴、扫舍宇	上表章、开渠、穿井、安葬、启攒、上册、颁诏、补垣、招贤、布政事、宣政事、塞穴、营建、筑堤防
2031-07-08	二零三一 辛亥[猪]年	五月小	十九	周二	辛亥 乙未 己酉 己巳	无	大暑 (7, 23)	无	无	无	猪	巨蟹座	出行、结婚姻、嫁娶、沐浴、剃头、修造、求医疗病、上表章、上官、进人口、竖柱上梁、经络、开市、纳财、扫舍宇、栽种、牧养、安葬、搬移、祈福、缮城郭、裁制、开仓、上册、修宫室、颁诏、求嗣、覃恩、补垣、恤孤茕、雪冤、招贤、整容、宣政事、安抚边境、施恩、立券交易、临政、纳畜、举正直、解除、塞穴、修仓库、选将、营建、纳采、整手足甲、出师	祭祀、宴会、冠带、修置产室、开渠、穿井、安碓硙、破屋坏垣、畋猎、启攒、取鱼、针刺、鼓铸、入宅、筑堤防、修饰垣墙
2031-07-09	二零三一 辛亥[猪]年	五月小	二十	周三	辛亥 乙未 庚戌 辛巳	无	大暑 (7, 23)	无	无	无	猪	巨蟹座	诸事不宜	诸事不宜
2031-07-10	二零三一 辛亥[猪]年	五月小	廿一	周四	辛亥 乙未 辛亥 癸巳	无	大暑 (7, 23)	无	无	无	猪	巨蟹座	祭祀、出行、结婚姻、宴会、沐浴、上官、冠带、进人口、竖柱上梁、经络、安碓硙、牧养、搬移、祈福、缮城郭、裁制、修宫室、覃恩、庆赐、恤孤茕、雪冤、求嗣、布政事、入宅、施恩、临政、纳畜、举正直、赴任、纳采	嫁娶、上表章、修置产室、破土、安葬、启攒、取鱼、选将、安抚边境、整手足甲、出师、乘船渡水、上册
2031-07-11	二零三一 辛亥[猪]年	五月小	廿二	周五	辛亥 乙未 壬子 乙巳	无	大暑 (7, 23)	无	孝娥神诞	世界人口日	猪	巨蟹座	沐浴、剃头、捕捉、覃恩、恤孤茕、雪冤、整容、整手足甲	出行、结婚姻、宴会、嫁娶、安床、修造、求医疗病、上表章、上官、冠带、进人口、竖柱上梁、经络、开市、纳财、修置产室、开渠、穿井、安碓硙、栽种、牧养、破土、安葬、启攒、搬移、祈福、缮城郭、裁制、开仓、上册、修宫室、颁诏、求嗣、庆赐、补垣、取鱼、招贤、布政事、宣政事、安抚边境、立券交易、施恩、修饰垣墙、临政、纳畜、举正直、解除、塞穴、乘船渡水、修仓库、酝酿、选将、远回、鼓铸、营建、纳采、出师、筑堤防
2031-07-12	二零三一 辛亥[猪]年	五月小	廿三	周六	辛亥 乙未 癸丑 丁巳	无	大暑 (7, 23)	无	无	无	猪	巨蟹座	诸事不宜	诸事不宜
2031-07-13	二零三一 辛亥[猪]年	五月小	廿四	周日	辛亥 乙未 甲寅 己巳	无	大暑 (7, 23)	无	无	无	猪	巨蟹座	出行、宴会、安床、修造、上表章、上官、竖柱上梁、经络、开市、纳财、栽种、牧养、安葬、搬移、缮城郭、裁制、上册、颁诏、覃恩、恤孤茕、雪冤、庆赐、招贤、宣政事、施恩、立券交易、临政、纳畜、举正直、修仓库、酝酿、营建	祭祀、畋猎、取鱼
2031-07-14	二零三一 辛亥[猪]年	五月小	廿五	周一	辛亥 乙未 乙卯 辛巳	无	大暑 (7, 23)	无	无	无	猪	巨蟹座	出行、结婚姻、宴会、上表章、上官、入学、进人口、竖柱上梁、经络、安碓硙、牧养、缮城郭、裁制、上册、修宫室、庆赐、施恩、临政、举正直、酝酿、纳采、筑堤防	穿井、选将、出师、开仓、苫盖
2031-07-15	二零三一 辛亥[猪]年	五月小	廿六	周二	辛亥 乙未 丙辰 癸巳	无	大暑 (7, 23)	无	无	无	猪	巨蟹座	祭祀、进人口、纳财、捕捉、栽种、牧养、入宅、纳畜	上表章、冠带、修置产室、开渠、穿井、破土、启攒、上册、颁诏、招贤、布政事、宣政事、安抚边境、修仓库、选将、鼓铸、营建、出师、筑堤防
2031-07-16	二零三一 辛亥[猪]年	五月小	廿七	周三	辛亥 乙未 丁巳 乙巳	无	大暑 (7, 23)	无	无	无	猪	巨蟹座	入学、覃恩、恤孤茕、雪冤	祭祀、出行、结婚姻、宴会、嫁娶、安床、剃头、修造、求医疗病、上表章、上官、冠带、进人口、竖柱上梁、经络、开市、纳财、修置产室、开渠、穿井、安碓硙、平治道涂、破屋坏垣、伐木、畋猎、栽种、牧养、破土、安葬、启攒、搬移、祈福、缮城郭、开仓、裁制、上册、修宫室、颁诏、求嗣、庆赐、补垣、取鱼、招贤、整容、布政事、宣政事、安抚边境、施恩、立券交易、修饰垣墙、临政、纳畜、举正直、解除、塞穴、修仓库、酝酿、选将、远回、鼓铸、营建、纳采、整手足甲、出师、筑堤防
2031-07-17	二零三一 辛亥[猪]年	五月小	廿八	周四	辛亥 乙未 戊午 丁巳	无	大暑 (7, 23)	无	无	无	猪	巨蟹座	祭祀、经络、诉讼、裁制、补垣、覃恩、恤孤茕、雪冤、塞穴、赴任、酝酿	出行、结婚姻、宴会、嫁娶、安床、修造、求医疗病、上表章、上官、冠带、进人口、竖柱上梁、开市、纳财、修置产室、开渠、穿井、捕捉、畋猎、栽种、牧养、安葬、搬移、祈福、缮城郭、开仓、上册、修宫室、颁诏、求嗣、庆赐、取鱼、针刺、招贤、布政事、宣政事、安抚边境、疗目、施恩、立券交易、临政、纳畜、举正直、解除、修仓库、选将、营建、纳采、出师、筑堤防、苫盖
2031-07-18	二零三一 辛亥[猪]年	五月小	廿九	周五	辛亥 乙未 己未 己巳	无	大暑 (7, 23)	无	无	无	猪	巨蟹座	出行、宴会、上官、进人口、经络、纳财、牧养、搬移、裁制、颁诏、覃恩、恤孤茕、雪冤、庆赐、招贤、宣政事、施恩、立券交易、临政、纳畜、举正直、酝酿	剃头、修置产室、开渠、穿井、平治道涂、破屋坏垣、伐木、畋猎、破土、启攒、补垣、取鱼、整容、整手足甲、筑堤防、修饰垣墙
2031-07-19	二零三一 辛亥[猪]年	六月大	初一	周六	辛亥 乙未 庚申 辛巳	无	大暑 (7, 23)	无	无	无	猪	巨蟹座	祭祀、沐浴、扫舍宇	结婚姻、宴会、嫁娶、安床、修造、冠带、进人口、竖柱上梁、经络、开市、纳财、修置产室、开渠、穿井、安碓硙、破屋坏垣、栽种、牧养、启攒、搬移、缮城郭、开仓、裁制、上册、修宫室、颁诏、庆赐、补垣、招贤、布政事、宣政事、立券交易、修饰垣墙、纳畜、塞穴、修仓库、酝酿、鼓铸、营建、纳采、筑堤防
2031-07-20	二零三一 辛亥[猪]年	六月大	初二	周日	辛亥 乙未 辛酉 癸巳	无	大暑 (7, 23)	无	无	无	猪	巨蟹座	出行、结婚姻、嫁娶、沐浴、剃头、修造、求医疗病、上表章、上官、进人口、竖柱上梁、经络、开市、纳财、扫舍宇、栽种、牧养、安葬、搬移、祈福、缮城郭、裁制、开仓、上册、修宫室、求嗣、补垣、整容、入宅、安抚边境、立券交易、临政、纳畜、解除、塞穴、修仓库、赴任、选将、纳采、整手足甲、出师	祭祀、宴会、冠带、立券、修置产室、开渠、穿井、安碓硙、破屋坏垣、启攒、颁诏、针刺、招贤、布政事、宣政事、修饰垣墙、开张、鼓铸、营建、筑堤防
2031-07-21	二零三一 辛亥[猪]年	六月大	初三	周一	辛亥 乙未 壬戌 乙巳	无	大暑 (7, 23)	无	无	无	猪	巨蟹座	诸事不宜	诸事不宜
2031-07-22	二零三一 辛亥[猪]年	六月大	初四	周二	辛亥 乙未 癸亥 丁巳	无	大暑 (7, 23)	无	无	无	猪	巨蟹座	沐浴、恤孤茕、雪冤	出行、嫁娶、安床、求医疗病、上表章、上官、开市、修置产室、开渠、穿井、平治道涂、破屋坏垣、栽种、牧养、破土、安葬、启攒、搬移、祈福、开仓、上册、颁诏、求嗣、补垣、取鱼、招贤、布政事、宣政事、安抚边境、施恩、修饰垣墙、举正直、解除、塞穴、乘船渡水、选将、鼓铸、营建、出师、筑堤防
2031-07-23	二零三一 辛亥[猪]年	六月大	初五	周三	辛亥 乙未 甲子 己巳	大暑	立秋 (8, 8)	无	无	无	猪	狮子座	祭祀、出行、结婚姻、宴会、嫁娶、沐浴、剃头、修造、求医疗病、上表章、上官、竖柱上梁、捕捉、栽种、牧养、安葬、搬移、祈福、缮城郭、裁制、上册、颁诏、求嗣、覃恩、恤孤茕、雪冤、庆赐、招贤、整容、宣政事、安抚边境、施恩、临政、纳畜、举正直、解除、修仓库、选将、营建、纳采、整手足甲、出师	诸事不忌
2031-07-24	二零三一 辛亥[猪]年	六月大	初六	周四	辛亥 乙未 乙丑 辛巳	无	立秋 (8, 8)	无	无	无	猪	狮子座	诸事不宜	诸事不宜
2031-07-25	二零三一 辛亥[猪]年	六月大	初七	周五	辛亥 乙未 丙寅 癸巳	无	立秋 (8, 8)	无	无	无	猪	狮子座	宴会、安床、经络、开市、纳财、牧养、搬移、开仓、覃恩、恤孤茕、庆赐、雪冤、布政事、入宅、安抚边境、立券交易、纳畜、酝酿、选将、纳采	祭祀、求医疗病、修置产室、开渠、穿井、安碓硙、平治道涂、破屋坏垣、求嗣、补垣、修饰垣墙、修仓库、营建、祈福、解除、筑堤防、缮城郭、修宫室
2031-07-26	二零三一 辛亥[猪]年	六月大	初八	周六	辛亥 乙未 丁卯 乙巳	无	立秋 (8, 8)	无	无	无	猪	狮子座	出行、结婚姻、宴会、上表章、上官、入学、进人口、竖柱上梁、经络、开市、纳财、牧养、裁制、上册、覃恩、庆赐、恤孤茕、雪冤、布政事、立券交易、施恩、临政、举正直、酝酿、纳采	剃头、求医疗病、修置产室、开渠、穿井、平治道涂、破屋坏垣、补垣、修饰垣墙、整容、选将、营建、出师、苫盖
2031-07-27	二零三一 辛亥[猪]年	六月大	初九	周日	辛亥 乙未 戊辰 丁巳	无	立秋 (8, 8)	无	无	无	猪	狮子座	祭祀、纳财、捕捉、覃恩、恤孤茕、雪冤	嫁娶、上表章、冠带、修置产室、开渠、穿井、安碓硙、平治道涂、破屋坏垣、破土、安葬、启攒、上册、颁诏、补垣、招贤、宣政事、安抚边境、修饰垣墙、修仓库、选将、鼓铸、营建、出师、筑堤防
2031-07-28	二零三一 辛亥[猪]年	六月大	初十	周一	辛亥 乙未 己巳 己巳	无	立秋 (8, 8)	无	无	无	猪	狮子座	祭祀、结婚姻、宴会、嫁娶、修造、求医疗病、上表章、上官、入学、竖柱上梁、开市、纳财、修置产室、开渠、穿井、安碓硙、栽种、牧养、搬移、祈福、缮城郭、裁制、上册、开仓、修宫室、求嗣、覃恩、恤孤茕、雪冤、庆赐、安抚边境、临政、纳畜、解除、修仓库、选将、营建、纳采	出行、剃头、冠带、平治道涂、破屋坏垣、伐木、畋猎、破土、启攒、补垣、取鱼、整容、布政事、修饰垣墙、塞穴、远回、鼓铸、整手足甲、筑堤防
2031-07-29	二零三一 辛亥[猪]年	六月大	十一	周二	辛亥 乙未 庚午 辛巳	无	立秋 (8, 8)	无	无	无	猪	狮子座	安葬、诉讼、塞穴、赴任、酝酿	出行、结婚姻、宴会、嫁娶、安床、修造、求医疗病、上表章、上官、冠带、进人口、竖柱上梁、经络、开市、纳财、修置产室、开渠、穿井、安碓硙、平治道涂、破屋坏垣、捕捉、畋猎、栽种、牧养、破土、搬移、祈福、缮城郭、开仓、上册、修宫室、颁诏、求嗣、庆赐、补垣、取鱼、针刺、招贤、布政事、宣政事、安抚边境、疗目、施恩、立券交易、临政、修饰垣墙、纳畜、举正直、解除、修仓库、选将、营建、纳采、出师、筑堤防、苫盖
2031-07-30	二零三一 辛亥[猪]年	六月大	十二	周三	辛亥 乙未 辛未 癸巳	无	立秋 (8, 8)	无	无	无	猪	狮子座	出行、宴会、嫁娶、上官、进人口、经络、纳财、牧养、搬移、裁制、庆赐、招贤、入宅、安抚边境、施恩、立券交易、临政、纳畜、举正直、赴任、选将	剃头、上表章、修置产室、开渠、穿井、平治道涂、破屋坏垣、伐木、安葬、启攒、补垣、整容、营建、整手足甲、筑堤防、上册、修饰垣墙
2031-07-31	二零三一 辛亥[猪]年	六月大	十三	周四	辛亥 乙未 壬申 乙巳	无	立秋 (8, 8)	无	无	无	猪	狮子座	祭祀、沐浴、扫舍宇	结婚姻、宴会、安床、修造、上表章、冠带、进人口、竖柱上梁、经络、开市、纳财、修置产室、开渠、穿井、安碓硙、平治道涂、破屋坏垣、栽种、牧养、启攒、搬移、缮城郭、裁制、上册、开仓、修宫室、颁诏、庆赐、补垣、招贤、布政事、宣政事、立券交易、修饰垣墙、纳畜、塞穴、修仓库、酝酿、鼓铸、营建、纳采、筑堤防
