2033-07-01	二零三三 癸丑[牛]年	六月小	初五	周五	无	无	中国共产党诞生日,香港回归纪念日	癸丑 戊午 癸丑 丁巳	无	小暑 (7, 7)	牛	巨蟹座	祭祀、赴任、雪冤、恤孤茕、入宅、覃恩	结婚姻、剃头、求医疗病、上表章、上官、冠带、竖柱上梁、修置产室、开渠、穿井、安碓硙、破屋坏垣、栽种、牧养、破土、安葬、启攒、出师、纳畜、颁诏、补垣、举正直、修仓库、整手足甲、缮城郭、鼓铸、裁制、宣政事、临政、乘船渡水、招贤、开仓、解除、施恩、筑堤防、塞穴、求嗣、修饰垣墙、上册、整容、修宫室、营建
2033-07-02	二零三三 癸丑[牛]年	六月小	初六	周六	无	无	无	癸丑 戊午 甲寅 己巳	无	小暑 (7, 7)	牛	巨蟹座	宴会、上官、入学、进人口、竖柱上梁、经络、开市、纳财、安碓硙、栽种、牧养、举正直、缮城郭、裁制、临政、酝酿、立券交易、筑堤防、施恩、祈福、求嗣、庆赐、修宫室	祭祀、整手足甲、选将、开仓、远回、出师
2033-07-03	二零三三 癸丑[牛]年	六月小	初七	周日	无	无	无	癸丑 戊午 乙卯 辛巳	无	小暑 (7, 7)	牛	巨蟹座	祭祀	出行、结婚姻、宴会、嫁娶、安床、修造、求医疗病、上表章、上官、冠带、进人口、竖柱上梁、经络、开市、纳财、修置产室、开渠、穿井、捕捉、畋猎、栽种、牧养、破土、安葬、启攒、布政事、出师、纳畜、取鱼、颁诏、补垣、纳采、举正直、安抚边境、修仓库、缮城郭、鼓铸、裁制、宣政事、临政、乘船渡水、针刺、酝酿、立券交易、招贤、开仓、祈福、解除、施恩、筑堤防、求嗣、塞穴、上册、庆赐、修宫室、选将、营建、搬移
2033-07-04	二零三三 癸丑[牛]年	六月小	初八	周一	无	无	无	癸丑 戊午 丙辰 癸巳	无	小暑 (7, 7)	牛	巨蟹座	出行、结婚姻、宴会、嫁娶、修造、上表章、上官、入学、竖柱上梁、开市、纳财、修置产室、开渠、穿井、安碓硙、栽种、牧养、赴任、纳畜、颁诏、纳采、举正直、安抚边境、雪冤、缮城郭、裁制、宣政事、临政、诉讼、招贤、祈福、解除、施恩、求嗣、覃恩、上册、庆赐、恤孤茕、修宫室、选将、营建、出师、搬移	伐木、畋猎、取鱼
2033-07-05	二零三三 癸丑[牛]年	六月小	初九	周二	无	无	无	癸丑 戊午 丁巳 乙巳	无	小暑 (7, 7)	牛	巨蟹座	补垣、雪冤、裁制、筑堤防、塞穴、覃恩、恤孤茕	出行、结婚姻、宴会、嫁娶、安床、剃头、修造、求医疗病、上表章、上官、进人口、竖柱上梁、开市、修置产室、开渠、穿井、破土、安葬、启攒、布政事、颁诏、纳采、举正直、安抚边境、宣政事、临政、针刺、招贤、开仓、祈福、解除、施恩、求嗣、上册、庆赐、整容、修宫室、选将、营建、出师、疗目、搬移
2033-07-06	二零三三 癸丑[牛]年	六月小	初十	周三	无	无	无	癸丑 戊午 戊午 丁巳	无	小暑 (7, 7)	牛	巨蟹座	祭祀、入宅	出行、结婚姻、宴会、嫁娶、安床、剃头、修造、求医疗病、上表章、上官、冠带、进人口、竖柱上梁、经络、开市、纳财、修置产室、开渠、穿井、安碓硙、平治道涂、破屋坏垣、伐木、栽种、牧养、破土、安葬、启攒、布政事、出师、纳畜、颁诏、补垣、纳采、举正直、苫盖、修仓库、安抚边境、整手足甲、缮城郭、鼓铸、裁制、宣政事、临政、酝酿、立券交易、招贤、开仓、祈福、解除、施恩、求嗣、筑堤防、塞穴、修饰垣墙、上册、庆赐、整容、修宫室、选将、营建、远回、搬移
2033-07-07	二零三三 癸丑[牛]年	六月小	十一	周四	无	无	中国人民抗日战争纪念日	癸丑 己未 己未 己巳	小暑	大暑 (7, 22)	牛	巨蟹座	宴会、上官、进人口、经络、纳财、牧养、纳畜、颁诏、举正直、雪冤、裁制、宣政事、临政、酝酿、立券交易、招贤、施恩、覃恩、庆赐、恤孤茕	剃头、修置产室、开渠、穿井、平治道涂、破屋坏垣、伐木、畋猎、破土、启攒、整容、整手足甲、取鱼、筑堤防、补垣、修饰垣墙
2033-07-08	二零三三 癸丑[牛]年	六月小	十二	周五	无	无	无	癸丑 己未 庚申 辛巳	无	大暑 (7, 22)	牛	巨蟹座	祭祀、沐浴、扫舍宇	结婚姻、宴会、嫁娶、安床、修造、冠带、进人口、竖柱上梁、经络、开市、纳财、修置产室、开渠、穿井、安碓硙、破屋坏垣、栽种、牧养、启攒、布政事、纳畜、颁诏、补垣、纳采、修仓库、缮城郭、鼓铸、裁制、宣政事、酝酿、立券交易、招贤、开仓、筑堤防、塞穴、修饰垣墙、上册、庆赐、修宫室、营建、搬移
2033-07-09	二零三三 癸丑[牛]年	六月小	十三	周六	无	无	无	癸丑 己未 辛酉 癸巳	无	大暑 (7, 22)	牛	巨蟹座	沐浴、扫舍宇	祭祀、出行、结婚姻、宴会、嫁娶、安床、剃头、修造、求医疗病、上表章、上官、冠带、进人口、竖柱上梁、经络、开市、纳财、修置产室、开渠、穿井、安碓硙、破屋坏垣、栽种、牧养、破土、安葬、启攒、布政事、出师、纳畜、颁诏、纳采、补垣、举正直、安抚边境、修仓库、整手足甲、缮城郭、鼓铸、裁制、宣政事、临政、针刺、酝酿、立券交易、招贤、开仓、入宅、祈福、解除、施恩、筑堤防、求嗣、塞穴、修饰垣墙、上册、庆赐、整容、修宫室、选将、营建、搬移
2033-07-10	二零三三 癸丑[牛]年	六月小	十四	周日	无	无	无	癸丑 己未 壬戌 乙巳	无	大暑 (7, 22)	牛	巨蟹座	诸事不宜	诸事不宜
2033-07-11	二零三三 癸丑[牛]年	六月小	十五	周一	无	无	世界人口日	癸丑 己未 癸亥 丁巳	无	大暑 (7, 22)	牛	巨蟹座	沐浴、赴任、雪冤、入宅、恤孤茕	嫁娶、剃头、求医疗病、上表章、上官、修置产室、开渠、穿井、栽种、牧养、破土、安葬、启攒、布政事、取鱼、颁诏、补垣、举正直、安抚边境、整手足甲、鼓铸、宣政事、乘船渡水、招贤、开仓、祈福、解除、施恩、筑堤防、塞穴、求嗣、修饰垣墙、上册、整容、选将、营建、出师
2033-07-12	二零三三 癸丑[牛]年	六月小	十六	周二	无	无	无	癸丑 己未 甲子 己巳	无	大暑 (7, 22)	牛	巨蟹座	祭祀、出行、结婚姻、宴会、嫁娶、沐浴、剃头、修造、求医疗病、上表章、上官、竖柱上梁、捕捉、栽种、牧养、安葬、出师、纳畜、颁诏、纳采、举正直、安抚边境、修仓库、雪冤、整手足甲、缮城郭、裁制、宣政事、临政、招贤、祈福、解除、施恩、求嗣、覃恩、上册、庆赐、整容、恤孤茕、选将、营建、搬移	诸事不忌
2033-07-13	二零三三 癸丑[牛]年	六月小	十七	周三	无	无	无	癸丑 己未 乙丑 辛巳	无	大暑 (7, 22)	牛	巨蟹座	诸事不宜	诸事不宜
2033-07-14	二零三三 癸丑[牛]年	六月小	十八	周四	无	无	无	癸丑 己未 丙寅 癸巳	无	大暑 (7, 22)	牛	巨蟹座	宴会、安床、经络、开市、纳财、栽种、牧养、布政事、纳畜、安抚边境、雪冤、酝酿、立券交易、开仓、覃恩、庆赐、恤孤茕、选将	祭祀、嫁娶、求医疗病、解除、祈福、求嗣
2033-07-15	二零三三 癸丑[牛]年	六月小	十九	周五	无	观世音菩萨成道日	无	癸丑 己未 丁卯 乙巳	无	大暑 (7, 22)	牛	巨蟹座	出行、结婚姻、宴会、上表章、上官、入学、进人口、竖柱上梁、经络、开市、纳财、安碓硙、栽种、牧养、布政事、纳采、举正直、修仓库、雪冤、缮城郭、裁制、临政、酝酿、立券交易、筑堤防、施恩、覃恩、上册、庆赐、修宫室、恤孤茕	剃头、穿井、苫盖、整容、整手足甲、选将、出师
2033-07-16	二零三三 癸丑[牛]年	六月小	二十	周六	无	无	无	癸丑 己未 戊辰 丁巳	无	大暑 (7, 22)	牛	巨蟹座	祭祀、纳财、捕捉、雪冤、入宅、覃恩、恤孤茕	上表章、冠带、修置产室、开渠、穿井、破土、安葬、启攒、颁诏、安抚边境、修仓库、鼓铸、宣政事、招贤、筑堤防、上册、选将、营建、出师
2033-07-17	二零三三 癸丑[牛]年	六月小	廿一	周日	无	无	无	癸丑 己未 己巳 己巳	无	大暑 (7, 22)	牛	巨蟹座	祭祀、结婚姻、宴会、嫁娶、修造、求医疗病、上表章、上官、入学、竖柱上梁、开市、纳财、修置产室、开渠、穿井、安碓硙、栽种、牧养、纳畜、纳采、安抚边境、修仓库、雪冤、缮城郭、裁制、临政、开仓、祈福、解除、求嗣、覃恩、上册、庆赐、恤孤茕、修宫室、选将、营建、搬移	出行、剃头、冠带、平治道涂、破屋坏垣、伐木、畋猎、破土、启攒、布政事、取鱼、补垣、整手足甲、鼓铸、筑堤防、塞穴、修饰垣墙、整容、远回
2033-07-18	二零三三 癸丑[牛]年	六月小	廿二	周一	无	无	无	癸丑 己未 庚午 辛巳	无	大暑 (7, 22)	牛	巨蟹座	安葬、赴任、补垣、诉讼、酝酿、塞穴	出行、结婚姻、宴会、嫁娶、安床、修造、求医疗病、上表章、上官、冠带、进人口、竖柱上梁、经络、开市、纳财、修置产室、开渠、穿井、捕捉、畋猎、栽种、牧养、布政事、出师、纳畜、取鱼、颁诏、纳采、举正直、苫盖、安抚边境、修仓库、缮城郭、宣政事、临政、针刺、立券交易、招贤、开仓、祈福、解除、施恩、筑堤防、求嗣、上册、庆赐、修宫室、选将、营建、疗目、搬移
2033-07-19	二零三三 癸丑[牛]年	六月小	廿三	周二	无	无	无	癸丑 己未 辛未 癸巳	无	大暑 (7, 22)	牛	巨蟹座	宴会、上官、进人口、经络、纳财、牧养、纳畜、举正直、安抚边境、裁制、临政、立券交易、招贤、施恩、庆赐、选将、出师	剃头、上表章、修置产室、开渠、穿井、平治道涂、破屋坏垣、伐木、安葬、启攒、上册、乘船渡水、整容、整手足甲、营建、筑堤防、补垣、修饰垣墙
2033-07-20	二零三三 癸丑[牛]年	六月小	廿四	周三	无	关帝诞	无	癸丑 己未 壬申 乙巳	无	大暑 (7, 22)	牛	巨蟹座	祭祀、沐浴、扫舍宇	结婚姻、宴会、安床、修造、上表章、冠带、进人口、竖柱上梁、经络、开市、纳财、修置产室、开渠、穿井、安碓硙、平治道涂、破屋坏垣、栽种、牧养、启攒、布政事、纳畜、颁诏、纳采、补垣、修仓库、缮城郭、鼓铸、裁制、宣政事、酝酿、立券交易、招贤、开仓、筑堤防、塞穴、修饰垣墙、上册、庆赐、修宫室、营建、搬移
2033-07-21	二零三三 癸丑[牛]年	六月小	廿五	周四	无	无	无	癸丑 己未 癸酉 丁巳	无	大暑 (7, 22)	牛	巨蟹座	出行、结婚姻、嫁娶、沐浴、剃头、修造、求医疗病、上表章、进人口、竖柱上梁、经络、开市、纳财、扫舍宇、栽种、牧养、安葬、赴任、纳畜、补垣、纳采、安抚边境、修仓库、整手足甲、缮城郭、裁制、立券交易、开仓、祈福、入宅、解除、塞穴、求嗣、上册、整容、修宫室、选将、出师、搬移	祭祀、宴会、上官、冠带、修置产室、开渠、穿井、安碓硙、平治道涂、破屋坏垣、启攒、布政事、颁诏、举正直、鼓铸、宣政事、临政、针刺、招贤、筑堤防、施恩、修饰垣墙、营建
2033-07-22	二零三三 癸丑[牛]年	六月小	廿六	周五	无	无	无	癸丑 己未 甲戌 己巳	大暑	立秋 (8, 7)	牛	巨蟹座	祭祀、雪冤、覃恩、恤孤茕	出行、结婚姻、宴会、嫁娶、安床、剃头、修造、求医疗病、上表章、上官、冠带、进人口、竖柱上梁、经络、开市、纳财、修置产室、开渠、穿井、安碓硙、平治道涂、破屋坏垣、畋猎、栽种、牧养、破土、安葬、启攒、布政事、出师、纳畜、取鱼、颁诏、纳采、举正直、补垣、安抚边境、修仓库、整手足甲、缮城郭、鼓铸、裁制、宣政事、临政、酝酿、立券交易、招贤、开仓、祈福、解除、施恩、筑堤防、求嗣、塞穴、修饰垣墙、上册、庆赐、整容、修宫室、选将、营建、搬移
2033-07-23	二零三三 癸丑[牛]年	六月小	廿七	周六	无	无	无	癸丑 己未 乙亥 辛巳	无	立秋 (8, 7)	牛	狮子座	宴会、沐浴、冠带、进人口、竖柱上梁、经络、纳畜、纳采、雪冤、裁制、临政、酝酿、庆赐、恤孤茕	嫁娶、求医疗病、上表章、开市、修置产室、开渠、穿井、平治道涂、破屋坏垣、栽种、破土、安葬、启攒、取鱼、补垣、安抚边境、乘船渡水、开仓、解除、筑堤防、修饰垣墙、上册、选将、营建、出师
2033-07-24	二零三三 癸丑[牛]年	六月小	廿八	周日	无	无	无	癸丑 己未 丙子 癸巳	无	立秋 (8, 7)	牛	狮子座	沐浴、剃头、捕捉、整容、整手足甲	出行、结婚姻、宴会、嫁娶、安床、修造、求医疗病、上表章、上官、冠带、进人口、竖柱上梁、经络、开市、纳财、修置产室、开渠、穿井、安碓硙、平治道涂、破屋坏垣、栽种、牧养、破土、安葬、启攒、纳畜、取鱼、补垣、纳采、举正直、安抚边境、修仓库、鼓铸、缮城郭、临政、乘船渡水、酝酿、立券交易、招贤、开仓、祈福、解除、施恩、塞穴、求嗣、筑堤防、修饰垣墙、上册、庆赐、修宫室、选将、营建、远回、出师、搬移
2033-07-25	二零三三 癸丑[牛]年	六月小	廿九	周一	无	无	无	癸丑 己未 丁丑 乙巳	无	立秋 (8, 7)	牛	狮子座	诸事不宜	诸事不宜
2033-07-26	二零三三 癸丑[牛]年	七月大	初一	周二	无	无	无	癸丑 己未 戊寅 丁巳	无	立秋 (8, 7)	牛	狮子座	出行、结婚姻、宴会、安床、上官、竖柱上梁、经络、开市、纳财、牧养、纳畜、纳采、举正直、裁制、临政、酝酿、立券交易、开仓、入宅、施恩、庆赐、搬移	祭祀、立券、修置产室、开渠、穿井、安碓硙、平治道涂、破屋坏垣、安葬、开张、修仓库、整手足甲、营建、筑堤防、出师、补垣、修饰垣墙
2033-07-27	二零三三 癸丑[牛]年	七月大	初二	周三	无	无	无	癸丑 己未 己卯 己巳	无	立秋 (8, 7)	牛	狮子座	祭祀、出行、结婚姻、宴会、求医疗病、上表章、上官、入学、进人口、竖柱上梁、经络、开市、纳财、牧养、颁诏、纳采、举正直、雪冤、裁制、宣政事、临政、酝酿、立券交易、招贤、开仓、祈福、施恩、解除、求嗣、覃恩、上册、庆赐、恤孤茕	修置产室、开渠、穿井、平治道涂、破屋坏垣、畋猎、苫盖、取鱼、补垣、修饰垣墙
2033-07-28	二零三三 癸丑[牛]年	七月大	初三	周四	无	无	无	癸丑 己未 庚辰 辛巳	无	立秋 (8, 7)	牛	狮子座	祭祀、进人口、纳财、捕捉、牧养、纳畜、雪冤、覃恩、恤孤茕	嫁娶、冠带、修置产室、开渠、穿井、安碓硙、平治道涂、破屋坏垣、破土、安葬、启攒、颁诏、补垣、安抚边境、修仓库、鼓铸、宣政事、招贤、筑堤防、修饰垣墙、上册、选将、营建、出师
2033-07-29	二零三三 癸丑[牛]年	七月大	初四	周五	无	无	无	癸丑 己未 辛巳 癸巳	无	立秋 (8, 7)	牛	狮子座	入学、雪冤、恤孤茕、覃恩	祭祀、出行、结婚姻、宴会、嫁娶、安床、剃头、修造、求医疗病、上表章、上官、冠带、进人口、竖柱上梁、经络、开市、纳财、修置产室、开渠、穿井、安碓硙、平治道涂、破屋坏垣、伐木、畋猎、栽种、牧养、破土、安葬、启攒、布政事、纳畜、取鱼、颁诏、补垣、纳采、举正直、安抚边境、修仓库、整手足甲、缮城郭、鼓铸、裁制、宣政事、临政、酝酿、立券交易、招贤、开仓、祈福、解除、施恩、筑堤防、求嗣、塞穴、修饰垣墙、上册、庆赐、整容、修宫室、选将、营建、远回、出师、搬移
2033-07-30	二零三三 癸丑[牛]年	七月大	初五	周六	无	无	无	癸丑 己未 壬午 乙巳	无	立秋 (8, 7)	牛	狮子座	经络、安葬、赴任、雪冤、诉讼、酝酿、塞穴、覃恩、恤孤茕	出行、结婚姻、宴会、嫁娶、安床、修造、求医疗病、上表章、上官、冠带、进人口、竖柱上梁、开市、纳财、修置产室、开渠、穿井、安碓硙、平治道涂、破屋坏垣、捕捉、畋猎、栽种、牧养、破土、布政事、出师、纳畜、取鱼、颁诏、补垣、纳采、举正直、苫盖、安抚边境、修仓库、缮城郭、宣政事、临政、乘船渡水、针刺、立券交易、招贤、开仓、祈福、解除、施恩、筑堤防、求嗣、修饰垣墙、上册、庆赐、修宫室、选将、营建、疗目、搬移
2033-07-31	二零三三 癸丑[牛]年	七月大	初六	周日	无	无	无	癸丑 己未 癸未 丁巳	无	立秋 (8, 7)	牛	狮子座	宴会、上官、进人口、经络、纳财、赴任、布政事、纳畜、举正直、雪冤、裁制、临政、酝酿、立券交易、招贤、入宅、施恩、覃恩、庆赐、恤孤茕	剃头、求医疗病、上表章、修置产室、开渠、穿井、平治道涂、破屋坏垣、伐木、栽种、安葬、启攒、补垣、整手足甲、开仓、解除、筑堤防、求嗣、修饰垣墙、上册、整容、营建
