2034-05-01	2034-3-13	29	除	一	甲寅 戊辰 丁巳	无	立夏 (5, 5)	劳动节	无	无	开光 扫舍 栽种 求嗣 牧养 祈福 祭祀 纳畜 纳采 解除 订盟 进人口	作灶 修坟 入宅 出行 安葬 盖屋 造桥
2034-05-02	2034-3-14	29	满	二	甲寅 戊辰 戊午	无	立夏 (5, 5)	无	无	无	交易 出行 塞穴 嫁娶 安床 开光 开市 理发	上梁 修造 入宅 出火 动土 安葬 破土 祈福 置产
2034-05-03	2034-3-15	29	平	三	甲寅 戊辰 己未	无	立夏 (5, 5)	无	无	无	作灶 修饰垣墙 平治道涂 畋猎 祭祀 结网 馀事勿取	嫁娶 安床 治病
2034-05-04	2034-3-16	29	定	四	甲寅 戊辰 庚申	无	立夏 (5, 5)	青年节	无	无	安葬 沐浴 破土 祭祀 移柩 解除 谢土 馀事勿取	上梁 入宅 嫁娶 开光 斋醮
2034-05-05	2034-3-17	29	定	五	甲寅 己巳 辛酉	立夏	小满 (5, 21)	无	无	无	入宅 出行 动土 嫁娶 安葬 开市 破土 祈福 祭祀 移徙 纳采	安门
2034-05-06	2034-3-18	29	执	六	甲寅 己巳 壬戌	无	小满 (5, 21)	无	无	无	修造 入宅 动土 嫁娶 安葬 求医 治病 破土 移徙 纳采	开光 开市
2034-05-07	2034-3-19	29	破	日	甲寅 己巳 癸亥	无	小满 (5, 21)	无	无	无	坏垣 破屋 祭祀 馀事勿取	诸事不宜
2034-05-08	2034-3-20	29	危	一	甲寅 己巳 甲子	无	小满 (5, 21)	无	无	无	上梁 入宅 出行 动土 嫁娶 安葬 破土 祈福 祭祀 移徙 纳采	斋醮
2034-05-09	2034-3-21	29	成	二	甲寅 己巳 乙丑	无	小满 (5, 21)	无	无	无	动土 开市 求医 治病 祈福 祭祀 纳畜 纳采	嫁娶 安葬
2034-05-10	2034-3-22	29	收	三	甲寅 己巳 丙寅	无	小满 (5, 21)	无	无	无	入宅 出行 嫁娶 移徙 纳采	动土 安葬 破土
2034-05-11	2034-3-23	29	开	四	甲寅 己巳 丁卯	无	小满 (5, 21)	无	无	无	交易 动土 破土 祭祀 立券 纳采 订盟	嫁娶 安葬
2034-05-12	2034-3-24	29	闭	五	甲寅 己巳 戊辰	无	小满 (5, 21)	无	无	无	作灶 入宅 出行 嫁娶 安床 安葬 破土 祭祀 移徙 裁衣	捕捉 赴任
2034-05-13	2034-3-25	29	建	六	甲寅 己巳 己巳	无	小满 (5, 21)	无	无	无	塞穴 结网 馀事勿取	诸事不宜
2034-05-14	2034-3-26	29	除	日	甲寅 己巳 庚午	无	小满 (5, 21)	母亲节	无	无	上梁 出行 动土 嫁娶 安葬 斋醮 破土 祈福 祭祀 纳采 订盟	入宅 移徙
2034-05-15	2034-3-27	29	满	一	甲寅 己巳 辛未	无	小满 (5, 21)	无	无	无	会亲友 作灶 安床 纳采 订盟 造畜稠	安葬 开市
2034-05-16	2034-3-28	29	平	二	甲寅 己巳 壬申	无	小满 (5, 21)	无	无	无	入殓 启钻 安葬 平治道涂 扫舍 沐浴 破土 移柩 馀事勿取	诸事不宜
2034-05-17	2034-3-29	29	定	三	甲寅 己巳 癸酉	无	小满 (5, 21)	无	无	无	上梁 交易 入宅 出火 出行 动土 嫁娶 安床 安葬 安门 开光 开市 拆卸 挂匾 栽种 求嗣 破土 祈福 祭祀 移徙 立券 进人口	无
2034-05-18	2034-4-1	29	执	四	甲寅 己巳 甲戌	无	小满 (5, 21)	无	无	无	入殓 出行 启钻 塑绘 安葬 开光 成服 破土 祭祀 移柩 裁衣 解除 除服	上梁 伐木 修造 入宅 出火 动土 嫁娶 开柱眼 拆卸 架马
2034-05-19	2034-4-2	29	破	五	甲寅 己巳 乙亥	无	小满 (5, 21)	无	无	无	坏垣 破屋 祭祀 解除 馀事勿取	诸事不宜
2034-05-20	2034-4-3	29	危	六	甲寅 己巳 丙子	无	小满 (5, 21)	无	无	无	上梁 会亲友 修造 入宅 出火 出行 动土 嫁娶 安床 安门 开光 拆卸 栽种 求嗣 牧养 祈福 祭祀 移徙 竖柱 纳畜 解除 进人口	无
2034-05-21	2034-4-4	29	成	日	甲寅 己巳 丁丑	小满	芒种 (6, 5)	全国助残日	无	无	交易 伐木 修造 动土 安床 安葬 开光 开市 拆卸 栽种 破土 祈福 祭祀 移柩 立券 进人口	入宅 出火 出行 嫁娶 理发 移徙
2034-05-22	2034-4-5	29	收	一	甲寅 己巳 戊寅	无	芒种 (6, 5)	无	无	无	结网 解除 馀事勿取	诸事不宜
2034-05-23	2034-4-6	29	开	二	甲寅 己巳 己卯	无	芒种 (6, 5)	无	无	无	交易 出行 嫁娶 安床 开光 开市 拆卸 求嗣 祈福 祭祀 立券	上梁 伐木 入宅 入殓 动土 安葬 安门 探病 移徙 纳畜
2034-05-24	2034-4-7	29	闭	三	甲寅 己巳 庚辰	无	芒种 (6, 5)	无	无	无	作灶 修造 入宅 出火 出行 动土 塞穴 嫁娶 安床 安葬 拆卸 栽种 求嗣 破土 祈福 祭祀 移徙	开仓 开光 掘井
2034-05-25	2034-4-8	29	建	四	甲寅 己巳 辛巳	无	芒种 (6, 5)	无	无	无	扫舍 解除 馀事勿取	诸事不宜
2034-05-26	2034-4-9	29	除	五	甲寅 己巳 壬午	无	芒种 (6, 5)	无	无	无	上梁 交易 修坟 入宅 出行 动土 安葬 安门 开光 开市 拆卸 挂匾 栽种 破土 移柩 立券 进人口	作灶 嫁娶 安床 探病
2034-05-27	2034-4-10	29	满	六	甲寅 己巳 癸未	无	芒种 (6, 5)	无	无	无	会亲友 进人口	上梁 伐木 动土 塞穴 安葬 词讼
2034-05-28	2034-4-11	29	平	日	甲寅 己巳 甲申	无	芒种 (6, 5)	无	无	无	入殓 安葬 平治道涂 成服 扫舍 沐浴 破土 除服	伐木 作梁 嫁娶 安床 盖屋 祈福 祭祀 移徙
2034-05-29	2034-4-12	29	定	一	甲寅 己巳 乙酉	无	芒种 (6, 5)	无	无	无	上梁 交易 入宅 出火 出行 动土 嫁娶 安床 安葬 安门 开光 开市 拆卸 挂匾 求嗣 破土 祈福 祭祀 移徙 立券 解除 谢土 进人口	无
2034-05-30	2034-4-13	29	执	二	甲寅 己巳 丙戌	无	芒种 (6, 5)	无	无	无	上梁 伐木 会亲友 作梁 修造 冠笄 动土 合帐 嫁娶 安床 开光 放水 架马 求嗣 祈福 祭祀 竖柱 裁衣 解除 起基 进人口	无
2034-05-31	2034-4-14	29	破	三	甲寅 己巳 丁亥	无	芒种 (6, 5)	无	无	无	坏垣 沐浴 破屋 解除 馀事勿取	诸事不宜
