2036-06-01	2036-5-7	29	破	日	丙辰 癸巳 己亥	无	芒种 (6, 5)	儿童节	无	无	祭祀 沐浴 解除 破屋 坏垣 馀事勿取	开光 安葬
2036-06-02	2036-5-8	29	危	一	丙辰 癸巳 庚子	无	芒种 (6, 5)	无	无	无	订盟 纳采 嫁娶 解除 祭祀 祈福 求嗣 开光 出行 出火 拆卸 入宅 移徙 安床 栽种 纳畜 动土 破土 谢土 安葬 修坟	作灶 开市 经络
2036-06-03	2036-5-9	29	成	二	丙辰 癸巳 辛丑	无	芒种 (6, 5)	无	无	无	祭祀 祈福 求嗣 开光 订盟 纳采 解除 动土 起基 进人口 开市 交易 立券 纳财 造仓 开池 栽种 纳畜 破土 安葬	安床 上梁 裁衣 入宅 嫁娶
2036-06-04	2036-5-10	29	收	三	丙辰 癸巳 壬寅	无	芒种 (6, 5)	无	无	无	祭祀 结网 捕捉 馀事勿取	探病 嫁娶 开市
2036-06-05	2036-5-11	29	收	四	丙辰 甲午 癸卯	芒种	夏至 (6, 21)	无	无	无	祭祀 栽种 馀事勿取	诸事不宜
2036-06-06	2036-5-12	29	开	五	丙辰 甲午 甲辰	无	夏至 (6, 21)	无	无	无	嫁娶 开光 祭祀 祈福 求嗣 出行 解除 伐木 入宅 移徙 安床 出火 拆卸 修造 上梁 栽种 移柩	安葬 开市 交易 立券
2036-06-07	2036-5-13	29	闭	六	丙辰 甲午 乙巳	无	夏至 (6, 21)	无	无	无	求嗣 嫁娶 纳采 合帐 裁衣 冠笄 伐木 作梁 修造 动土 起基 竖柱 上梁 安门 作灶 筑堤 造畜稠	安葬 出行 祈福 栽种
2036-06-08	2036-5-14	29	建	日	丙辰 甲午 丙午	无	夏至 (6, 21)	无	无	无	祭祀 解除 馀事勿取	诸事不宜
2036-06-09	2036-5-15	29	除	一	丙辰 甲午 丁未	无	夏至 (6, 21)	无	无	无	嫁娶 祭祀 祈福 出火 开光 求嗣 出行 拆卸 开市 交易 立券 挂匾 入宅 移徙 安床 栽种 动土	安葬 行丧 伐木 作梁
2036-06-10	2036-5-16	29	满	二	丙辰 甲午 戊申	无	夏至 (6, 21)	无	无	无	开光 求嗣 出行 解除 伐木 出火 拆卸 修造 上梁 起基 入宅 移徙 开市 交易 立券 栽种 牧养 入殓 安葬 除服 成服	置产 安床
2036-06-11	2036-5-17	29	平	三	丙辰 甲午 己酉	无	夏至 (6, 21)	无	无	无	祭祀 理发 修饰垣墙 平治道涂 沐浴 整手足甲 扫舍	出行 安门 修造 嫁娶 上梁 入宅
2036-06-12	2036-5-18	29	定	四	丙辰 甲午 庚戌	无	夏至 (6, 21)	无	无	无	嫁娶 祭祀 开光 祈福 求嗣 出行 出火 拆卸 动土 修造 进人口 入宅 移徙 安床 挂匾 交易 立券 栽种 纳畜 入殓 破土 启钻 安葬	无
2036-06-13	2036-5-19	29	执	五	丙辰 甲午 辛亥	无	夏至 (6, 21)	无	无	无	祭祀 祈福 求嗣 开光 出行 伐木 出火 拆卸 修造 动土 起基 安床 入宅 移徙	嫁娶 开市 交易 行丧 安葬 修坟
2036-06-14	2036-5-20	29	破	六	丙辰 甲午 壬子	无	夏至 (6, 21)	无	无	无	破屋 坏垣 馀事勿取	诸事不宜
2036-06-15	2036-5-21	29	危	日	丙辰 甲午 癸丑	无	夏至 (6, 21)	父亲节	无	无	开市 交易 立券 纳财 开池 开厕 结网 祭祀 修造 动土 安床 放水 经络 破土	嫁娶 造桥 词讼 移徙 安门 作灶 栽种
2036-06-16	2036-5-22	29	成	一	丙辰 甲午 甲寅	无	夏至 (6, 21)	无	无	无	开市 交易 立券 纳财 栽种 安床 拆卸 修造 动土 上梁 入殓 安葬 破土 除服 成服	嫁娶 出火 伐木 祭祀 入宅 移徙 纳畜 探病
2036-06-17	2036-5-23	29	收	二	丙辰 甲午 乙卯	无	夏至 (6, 21)	无	无	无	祭祀 作灶 馀事勿取	诸事不宜
2036-06-18	2036-5-24	29	开	三	丙辰 甲午 丙辰	无	夏至 (6, 21)	无	无	无	解除 坏垣 馀事勿取	诸事不宜
2036-06-19	2036-5-25	29	闭	四	丙辰 甲午 丁巳	无	夏至 (6, 21)	无	无	无	修造 动土 起基 安门 安床 栽种 筑堤 补垣 造畜稠	嫁娶 掘井 入宅 移徙 出火 出行 行丧 安葬 开光 理发 进人口
2036-06-20	2036-5-26	29	建	五	丙辰 甲午 戊午	无	夏至 (6, 21)	无	无	无	祭祀 教牛马 断蚁 馀事勿取	斋醮 移徙 入宅 动土
2036-06-21	2036-5-27	29	除	六	丙辰 甲午 己未	夏至	小暑 (7, 6)	无	无	无	纳采 订盟 嫁娶 祭祀 祈福 开市 纳财 立券 移徙 出行 修造 动土 起基 定磉 竖柱 拆卸 扫舍 放水 安香 安床 造船 开池 掘井 造畜稠 栽种	行丧 安葬 破土 作灶 伐木 斋醮
2036-06-22	2036-5-28	29	满	日	丙辰 甲午 庚申	无	小暑 (7, 6)	无	无	无	嫁娶 开光 祭祀 祈福 出行 解除 移徙 入宅 开市 纳财 起基 修造 竖柱 上梁 盖屋 作灶 出火 安香 补垣 塞穴 拆卸 放水 扫舍 造仓 造船 栽种 安葬	纳采 订盟 安床 谢土 破土 动土
2036-06-23	2036-5-29	29	平	一	丙辰 甲午 辛酉	无	小暑 (7, 6)	无	无	无	嫁娶 祭祀 理发 作灶 修饰垣墙 平治道涂 整手足甲 沐浴 冠笄	破土 出行 栽种
2036-06-24	2036-6-1	29	定	二	丙辰 甲午 壬戌	无	小暑 (7, 6)	无	无	无	嫁娶 纳采 订盟 祭祀 祈福 求嗣 开光 出火 出行 拆卸 修造 动土 进人口 入宅 移徙 安床 交易 立券 挂匾 纳财 入殓 安葬 启钻 除服 成服	掘井 破土
2036-06-25	2036-6-2	29	执	三	丙辰 甲午 癸亥	无	小暑 (7, 6)	无	无	无	畋猎 捕捉 结网 取渔 祭祀 沐浴 馀事勿取	嫁娶 开市 安葬 启钻 行丧
2036-06-26	2036-6-3	29	破	四	丙辰 甲午 甲子	无	小暑 (7, 6)	无	无	无	祭祀 破屋 坏垣 馀事勿取	移徙 入宅 开仓 出货财
2036-06-27	2036-6-4	29	危	五	丙辰 甲午 乙丑	无	小暑 (7, 6)	无	无	无	祭祀 斋醮 塑绘 开光 出行 修造 动土 造畜稠 安床 放水 掘井 开池 开厕 结网 破土	出火 入宅
2036-06-28	2036-6-5	29	成	六	丙辰 甲午 丙寅	无	小暑 (7, 6)	无	无	无	开市 交易 立券 挂匾 开光 解除 拆卸 动土 安床 修造 上梁 置产 栽种 破土 安葬	作灶 出火 祭祀 嫁娶 入宅
2036-06-29	2036-6-6	29	收	日	丙辰 甲午 丁卯	无	小暑 (7, 6)	无	无	无	祭祀 结网 馀事勿取	入宅 出行 掘井 安葬
2036-06-30	2036-6-7	29	开	一	丙辰 甲午 戊辰	无	小暑 (7, 6)	无	无	无	嫁娶 纳采 订盟 冠笄 造车器 祭祀 开光 祈福 求嗣 出行 解除 伐木 出火 入宅 拆卸 修造 动土 上梁 安床 栽种 破土	行丧 置产 安葬
