2039-04-01	二零三九 己未[羊]年	三月小	初八	周五	无	六殿卞城王诞	国际愚人节	己未 丁卯 癸丑 丁巳	无	清明 (4, 5)	羊	白羊座	宴会、上表章、上官、入学、牧养、纳畜、颁诏、举正直、雪冤、裁制、宣政事、临政、招贤、祈福、解除、施恩、求嗣、覃恩、上册、庆赐、恤孤茕	结婚姻、嫁娶、冠带、平治道涂、破屋坏垣、伐木、畋猎、破土、取鱼、补垣、纳采、鼓铸、乘船渡水、立券交易、开仓、筑堤防、塞穴、修饰垣墙、营建
2039-04-02	二零三九 己未[羊]年	三月小	初九	周六	无	无	国际儿童图书日	己未 丁卯 甲寅 己巳	无	清明 (4, 5)	羊	白羊座	经络、纳财、栽种、牧养、安葬、纳畜、补垣、修仓库、雪冤、缮城郭、裁制、酝酿、立券交易、筑堤防、入宅、塞穴、覃恩、恤孤茕	祭祀、安床、进人口、立券、修置产室、开渠、穿井、畋猎、开张、针刺、布政事、修宫室、取鱼、疗目、远回
2039-04-03	二零三九 己未[羊]年	三月小	初十	周日	无	无	无	己未 丁卯 乙卯 辛巳	无	清明 (4, 5)	羊	白羊座	出行、宴会、上官、进人口、经络、纳财、纳畜、举正直、裁制、临政、酝酿、立券交易、招贤、施恩、庆赐	剃头、求医疗病、上表章、修置产室、开渠、穿井、平治道涂、破屋坏垣、伐木、栽种、安葬、取鱼、补垣、苫盖、整手足甲、乘船渡水、开仓、解除、筑堤防、求嗣、修饰垣墙、上册、整容、营建、搬移
2039-04-04	二零三九 己未[羊]年	三月小	十一	周一	无	无	无	己未 丁卯 丙辰 癸巳	无	清明 (4, 5)	羊	白羊座	祭祀、出行、结婚姻、沐浴、剃头、竖柱上梁、扫舍宇、栽种、举正直、整手足甲、缮城郭、裁制、临政、解除、施恩、整容、修宫室、搬移	宴会、嫁娶、修造、求医疗病、上表章、上官、进人口、经络、开市、纳财、修置产室、畋猎、牧养、破土、安葬、启攒、出师、纳畜、纳采、安抚边境、修仓库、酝酿、立券交易、开仓、祈福、求嗣、上册、庆赐、选将
2039-04-05	二零三九 己未[羊]年	三月小	十二	周二	清明节	无	无	己未 戊辰 丁巳 乙巳	清明	谷雨 (4, 20)	羊	白羊座	祭祀、结婚姻、宴会、嫁娶、沐浴、修造、求医疗病、上表章、上官、竖柱上梁、经络、开市、纳财、扫舍宇、栽种、牧养、安葬、纳畜、颁诏、纳采、举正直、安抚边境、修仓库、雪冤、整手足甲、缮城郭、裁制、宣政事、临政、酝酿、立券交易、招贤、开仓、祈福、解除、施恩、求嗣、覃恩、上册、庆赐、恤孤茕、修宫室、选将、营建、搬移	出行、剃头、冠带、修置产室、开渠、穿井、安碓硙、破屋坏垣、畋猎、破土、布政事、鼓铸、取鱼、筑堤防、塞穴、补垣、修饰垣墙
2039-04-06	二零三九 己未[羊]年	三月小	十三	周三	无	无	无	己未 戊辰 戊午 丁巳	无	谷雨 (4, 20)	羊	白羊座	诸事不宜	祭祀、出行、结婚姻、宴会、嫁娶、安床、剃头、修造、求医疗病、上表章、上官、冠带、进人口、竖柱上梁、经络、开市、纳财、修置产室、开渠、穿井、安碓硙、破屋坏垣、栽种、牧养、破土、安葬、启攒、布政事、纳畜、颁诏、补垣、纳采、举正直、苫盖、安抚边境、修仓库、整手足甲、缮城郭、鼓铸、裁制、宣政事、临政、酝酿、立券交易、招贤、开仓、入宅、祈福、解除、施恩、筑堤防、求嗣、塞穴、修饰垣墙、上册、庆赐、整容、修宫室、选将、营建、出师、搬移
2039-04-07	二零三九 己未[羊]年	三月小	十四	周四	无	无	世界卫生日	己未 戊辰 己未 己巳	无	谷雨 (4, 20)	羊	白羊座	平治道涂、赴任、入宅	出行、结婚姻、宴会、嫁娶、安床、剃头、修造、求医疗病、上表章、上官、冠带、进人口、竖柱上梁、经络、开市、纳财、修置产室、开渠、穿井、安碓硙、破屋坏垣、栽种、牧养、破土、安葬、启攒、布政事、出师、纳畜、颁诏、纳采、补垣、举正直、安抚边境、修仓库、整手足甲、缮城郭、鼓铸、裁制、宣政事、临政、乘船渡水、酝酿、立券交易、招贤、开仓、祈福、解除、施恩、筑堤防、求嗣、塞穴、修饰垣墙、上册、庆赐、整容、修宫室、选将、营建、搬移
2039-04-08	二零三九 己未[羊]年	三月小	十五	周五	无	昊天上帝诞	无	己未 戊辰 庚申 辛巳	无	谷雨 (4, 20)	羊	白羊座	祭祀、沐浴、扫舍宇	出行、结婚姻、宴会、嫁娶、安床、剃头、修造、求医疗病、上表章、上官、冠带、进人口、竖柱上梁、经络、开市、纳财、修置产室、开渠、穿井、安碓硙、平治道涂、破屋坏垣、伐木、捕捉、畋猎、栽种、牧养、破土、安葬、启攒、布政事、出师、纳畜、取鱼、颁诏、补垣、纳采、举正直、安抚边境、修仓库、整手足甲、缮城郭、鼓铸、裁制、宣政事、临政、酝酿、立券交易、招贤、开仓、祈福、解除、施恩、筑堤防、求嗣、塞穴、修饰垣墙、上册、庆赐、整容、修宫室、选将、营建、远回、搬移
2039-04-09	二零三九 己未[羊]年	三月小	十六	周六	无	准提菩萨诞	无	己未 戊辰 辛酉 癸巳	无	谷雨 (4, 20)	羊	白羊座	祭祀、结婚姻、嫁娶、沐浴、剃头、求医疗病、上官、进人口、经络、纳财、扫舍宇、捕捉、安葬、纳畜、取鱼、安抚边境、整手足甲、临政、酝酿、立券交易、祈福、解除、整容	出行、宴会、安床、修造、上表章、冠带、竖柱上梁、开市、修置产室、开渠、穿井、安碓硙、平治道涂、破屋坏垣、栽种、牧养、启攒、布政事、颁诏、纳采、补垣、举正直、修仓库、缮城郭、鼓铸、裁制、宣政事、乘船渡水、招贤、开仓、筑堤防、施恩、塞穴、求嗣、修饰垣墙、上册、庆赐、修宫室、选将、营建、出师、搬移
2039-04-10	二零三九 己未[羊]年	三月小	十七	周日	无	无	无	己未 戊辰 壬戌 乙巳	无	谷雨 (4, 20)	羊	白羊座	祭祀、沐浴、求医疗病、破屋坏垣、雪冤、解除、覃恩、恤孤茕	安床、冠带、进人口、经络、开市、纳财、修置产室、开渠、穿井、安碓硙、伐木、畋猎、破土、启攒、布政事、取鱼、补垣、鼓铸、乘船渡水、酝酿、立券交易、开仓、筑堤防、塞穴、修饰垣墙、修宫室
2039-04-11	二零三九 己未[羊]年	三月小	十八	周一	无	无	无	己未 戊辰 癸亥 丁巳	无	谷雨 (4, 20)	羊	白羊座	安床、沐浴、纳财、栽种、牧养、纳畜、取鱼	出行、结婚姻、嫁娶、求医疗病、畋猎、破土、安葬、启攒、修仓库、开仓、祈福、解除、求嗣
2039-04-12	二零三九 己未[羊]年	三月小	十九	周二	无	中岳大帝诞	无	己未 戊辰 甲子 己巳	无	谷雨 (4, 20)	羊	白羊座	祭祀、宴会、沐浴、上官、入学、进人口、竖柱上梁、经络、开市、纳财、牧养、赴任、布政事、纳畜、举正直、雪冤、裁制、临政、诉讼、酝酿、立券交易、入宅、施恩、祈福、覃恩、庆赐、恤孤茕	修置产室、开渠、穿井、平治道涂、破屋坏垣、破土、安葬、整手足甲、营建、开仓、远回、补垣、修饰垣墙
2039-04-13	二零三九 己未[羊]年	三月小	二十	周三	无	子孙娘娘诞	无	己未 戊辰 乙丑 辛巳	无	谷雨 (4, 20)	羊	白羊座	进人口、纳财、捕捉、雪冤、纳畜、恤孤茕、取鱼、覃恩	出行、结婚姻、安床、修造、求医疗病、上表章、上官、冠带、竖柱上梁、经络、开市、修置产室、开渠、穿井、栽种、破土、安葬、启攒、颁诏、纳采、举正直、修仓库、缮城郭、鼓铸、裁制、宣政事、临政、酝酿、立券交易、招贤、开仓、解除、施恩、筑堤防、上册、修宫室、营建、搬移
2039-04-14	二零三九 己未[羊]年	三月小	廿一	周四	无	无	无	己未 戊辰 丙寅 癸巳	无	谷雨 (4, 20)	羊	白羊座	出行、结婚姻、宴会、修造、求医疗病、上表章、上官、入学、竖柱上梁、开市、纳财、修置产室、开渠、穿井、安碓硙、栽种、牧养、颁诏、纳采、举正直、安抚边境、修仓库、雪冤、缮城郭、裁制、宣政事、临政、立券交易、招贤、开仓、祈福、解除、施恩、求嗣、覃恩、上册、庆赐、恤孤茕、修宫室、选将、搬移	祭祀、嫁娶、伐木、畋猎、乘船渡水、针刺、整手足甲、取鱼
2039-04-15	二零三九 己未[羊]年	三月小	廿二	周五	无	无	无	己未 戊辰 丁卯 乙巳	无	谷雨 (4, 20)	羊	白羊座	祭祀、补垣、雪冤、裁制、塞穴、覃恩、恤孤茕	剃头、冠带、修置产室、开渠、穿井、畋猎、针刺、整容、取鱼、疗目
2039-04-16	二零三九 己未[羊]年	三月小	廿三	周六	无	无	无	己未 戊辰 戊辰 丁巳	无	谷雨 (4, 20)	羊	白羊座	雪冤、覃恩、恤孤茕	出行、结婚姻、宴会、嫁娶、安床、剃头、修造、求医疗病、上表章、上官、冠带、进人口、竖柱上梁、经络、开市、纳财、修置产室、开渠、穿井、安碓硙、平治道涂、破屋坏垣、伐木、栽种、牧养、破土、安葬、启攒、布政事、纳畜、颁诏、纳采、补垣、举正直、安抚边境、修仓库、整手足甲、缮城郭、鼓铸、裁制、宣政事、临政、乘船渡水、酝酿、立券交易、招贤、开仓、祈福、解除、施恩、求嗣、筑堤防、塞穴、修饰垣墙、上册、庆赐、整容、修宫室、选将、营建、出师、搬移
2039-04-17	二零三九 己未[羊]年	三月小	廿四	周日	无	无	无	己未 戊辰 己巳 己巳	无	谷雨 (4, 20)	羊	白羊座	嫁娶、沐浴、剃头、修造、求医疗病、上官、经络、开市、纳财、扫舍宇、栽种、牧养、赴任、纳畜、纳采、安抚边境、雪冤、整手足甲、临政、酝酿、立券交易、开仓、解除、入宅、整容、恤孤茕、选将、搬移	出行、结婚姻、宴会、上表章、冠带、竖柱上梁、修置产室、开渠、穿井、安碓硙、平治道涂、破屋坏垣、破土、安葬、启攒、布政事、颁诏、补垣、修仓库、缮城郭、鼓铸、裁制、宣政事、招贤、祈福、筑堤防、塞穴、求嗣、修饰垣墙、上册、庆赐、修宫室、营建
2039-04-18	二零三九 己未[羊]年	三月小	廿五	周一	无	无	无	己未 戊辰 庚午 辛巳	无	谷雨 (4, 20)	羊	白羊座	诸事不宜	祭祀、出行、结婚姻、宴会、嫁娶、安床、剃头、修造、求医疗病、上表章、上官、冠带、进人口、竖柱上梁、经络、开市、纳财、修置产室、开渠、穿井、安碓硙、平治道涂、破屋坏垣、栽种、牧养、破土、安葬、启攒、布政事、纳畜、颁诏、补垣、纳采、举正直、苫盖、安抚边境、修仓库、整手足甲、缮城郭、鼓铸、裁制、宣政事、临政、酝酿、立券交易、招贤、开仓、入宅、祈福、解除、施恩、筑堤防、求嗣、塞穴、修饰垣墙、上册、庆赐、整容、修宫室、选将、营建、出师、搬移
2039-04-19	二零三九 己未[羊]年	三月小	廿六	周二	无	无	无	己未 戊辰 辛未 癸巳	无	谷雨 (4, 20)	羊	白羊座	诸事不宜	诸事不宜
2039-04-20	二零三九 己未[羊]年	三月小	廿七	周三	无	七殿泰山王诞	无	己未 戊辰 壬申 乙巳	谷雨	立夏 (5, 5)	羊	白羊座	祭祀、沐浴、扫舍宇、雪冤、恤孤茕、覃恩	安床、开市、修置产室、开渠、穿井、平治道涂、破屋坏垣、伐木、捕捉、畋猎、启攒、布政事、取鱼、补垣、鼓铸、开仓、筑堤防、塞穴、修饰垣墙、远回
2039-04-21	二零三九 己未[羊]年	三月小	廿八	周四	无	苍颉至圣先师诞	无	己未 戊辰 癸酉 丁巳	无	立夏 (5, 5)	羊	金牛座	祭祀、结婚姻、嫁娶、沐浴、剃头、求医疗病、上官、进人口、经络、纳财、扫舍宇、捕捉、安葬、纳畜、取鱼、安抚边境、整手足甲、临政、酝酿、立券交易、祈福、解除、整容	出行、宴会、安床、修造、上表章、冠带、竖柱上梁、开市、修置产室、开渠、穿井、安碓硙、平治道涂、破屋坏垣、栽种、牧养、纳采、补垣、举正直、修仓库、缮城郭、乘船渡水、招贤、开仓、筑堤防、施恩、求嗣、修饰垣墙、上册、庆赐、修宫室、选将、营建、出师、搬移
2039-04-22	二零三九 己未[羊]年	三月小	廿九	周五	无	无	列宁诞辰纪念日	己未 戊辰 甲戌 己巳	无	立夏 (5, 5)	羊	金牛座	祭祀、沐浴、求医疗病、入宅、解除	结婚姻、宴会、安床、上官、冠带、进人口、竖柱上梁、经络、开市、纳财、修置产室、开渠、穿井、安碓硙、平治道涂、伐木、栽种、牧养、破土、安葬、启攒、布政事、纳畜、取鱼、颁诏、补垣、举正直、修仓库、缮城郭、鼓铸、裁制、宣政事、临政、乘船渡水、酝酿、立券交易、招贤、开仓、筑堤防、施恩、求嗣、塞穴、修饰垣墙、上册、庆赐、修宫室、营建
2039-04-23	二零三九 己未[羊]年	四月大	初一	周六	无	八殿都市王诞	世界图书和版权日	己未 戊辰 乙亥 辛巳	无	立夏 (5, 5)	羊	金牛座	安床、沐浴、牧养、纳畜、取鱼	出行、结婚姻、嫁娶、修造、求医疗病、进人口、开市、修置产室、开渠、穿井、安碓硙、平治道涂、破屋坏垣、畋猎、破土、安葬、启攒、纳采、补垣、修仓库、整手足甲、缮城郭、立券交易、开仓、筑堤防、祈福、解除、求嗣、修饰垣墙、修宫室、营建
2039-04-24	二零三九 己未[羊]年	四月大	初二	周日	无	无	无	己未 戊辰 丙子 癸巳	无	立夏 (5, 5)	羊	金牛座	祭祀、结婚姻、宴会、嫁娶、沐浴、求医疗病、上表章、上官、入学、进人口、竖柱上梁、经络、开市、纳财、牧养、安葬、赴任、纳畜、纳采、举正直、裁制、临政、诉讼、酝酿、立券交易、开仓、祈福、施恩、解除、求嗣、庆赐	修置产室、开渠、穿井、平治道涂、破屋坏垣、营建、远回、补垣、修饰垣墙
2039-04-25	二零三九 己未[羊]年	四月大	初三	周一	无	无	无	己未 戊辰 丁丑 乙巳	无	立夏 (5, 5)	羊	金牛座	进人口、纳财、捕捉、牧养、纳畜、雪冤、覃恩、恤孤茕	剃头、冠带、修置产室、开渠、穿井、安碓硙、平治道涂、破屋坏垣、畋猎、破土、启攒、布政事、取鱼、补垣、鼓铸、乘船渡水、筑堤防、修饰垣墙、整容
2039-04-26	二零三九 己未[羊]年	四月大	初四	周二	无	文殊菩萨诞	世界知识产权日	己未 戊辰 戊寅 丁巳	无	立夏 (5, 5)	羊	金牛座	出行、结婚姻、宴会、求医疗病、上表章、上官、入学、竖柱上梁、开市、牧养、纳畜、颁诏、纳采、举正直、雪冤、裁制、宣政事、临政、立券交易、招贤、祈福、解除、施恩、求嗣、覃恩、上册、庆赐、恤孤茕、搬移	祭祀、平治道涂、破屋坏垣、伐木、畋猎、启攒、乘船渡水、针刺、取鱼、筑堤防、出师、补垣、修饰垣墙
2039-04-27	二零三九 己未[羊]年	四月大	初五	周三	无	无	无	己未 戊辰 己卯 己巳	无	立夏 (5, 5)	羊	金牛座	赴任、雪冤、入宅、塞穴、覃恩、恤孤茕	上表章、冠带、竖柱上梁、修置产室、开渠、穿井、安碓硙、平治道涂、破屋坏垣、栽种、牧养、安葬、启攒、纳畜、颁诏、举正直、安抚边境、修仓库、缮城郭、宣政事、乘船渡水、针刺、招贤、开仓、祈福、解除、施恩、求嗣、修饰垣墙、上册、修宫室、选将、营建、出师、疗目
2039-04-28	二零三九 己未[羊]年	四月大	初六	周四	无	无	无	己未 戊辰 庚辰 辛巳	无	立夏 (5, 5)	羊	金牛座	祭祀、雪冤、覃恩、恤孤茕	出行、结婚姻、宴会、嫁娶、安床、剃头、修造、求医疗病、上表章、上官、冠带、进人口、竖柱上梁、经络、开市、纳财、修置产室、开渠、穿井、安碓硙、平治道涂、破屋坏垣、伐木、栽种、牧养、破土、安葬、启攒、布政事、纳畜、颁诏、纳采、补垣、举正直、安抚边境、修仓库、整手足甲、缮城郭、鼓铸、裁制、宣政事、临政、酝酿、立券交易、招贤、开仓、祈福、解除、施恩、求嗣、筑堤防、塞穴、修饰垣墙、上册、庆赐、整容、修宫室、选将、营建、出师、搬移
2039-04-29	二零三九 己未[羊]年	四月大	初七	周五	无	无	无	己未 戊辰 辛巳 癸巳	无	立夏 (5, 5)	羊	金牛座	沐浴、扫舍宇、雪冤、覃恩、恤孤茕	出行、结婚姻、嫁娶、安床、修造、上表章、冠带、进人口、竖柱上梁、立券、修置产室、开渠、穿井、安碓硙、平治道涂、破屋坏垣、破土、安葬、启攒、颁诏、纳采、补垣、开张、修仓库、缮城郭、鼓铸、裁制、宣政事、招贤、祈福、筑堤防、塞穴、求嗣、修饰垣墙、上册、修宫室、营建、搬移
2039-04-30	二零三九 己未[羊]年	四月大	初八	周六	无	释迦牟尼佛诞	无	己未 戊辰 壬午 乙巳	无	立夏 (5, 5)	羊	金牛座	出行、结婚姻、宴会、嫁娶、修造、求医疗病、上表章、上官、进人口、竖柱上梁、经络、开市、纳财、栽种、牧养、安葬、出师、纳畜、颁诏、纳采、补垣、举正直、安抚边境、修仓库、雪冤、缮城郭、裁制、宣政事、临政、立券交易、招贤、开仓、祈福、解除、施恩、塞穴、求嗣、覃恩、上册、庆赐、恤孤茕、修宫室、选将、营建、搬移	祭祀、剃头、冠带、修置产室、开渠、穿井、安碓硙、平治道涂、破屋坏垣、畋猎、启攒、取鱼、苫盖、整手足甲、鼓铸、入宅、筑堤防、修饰垣墙、整容
