2041-08-01	2041-7-5	30	危	四	辛酉 乙未 丙寅	无	立秋 (8, 7)	建军节	无	无	上梁 入宅 出行 动土 嫁娶 安葬 开市 破土 移徙 纳采	祈福 祭祀
2041-08-02	2041-7-6	30	成	五	辛酉 乙未 丁卯	无	立秋 (8, 7)	无	无	无	上梁 入宅 出行 动土 嫁娶 安葬 开市 破土 移徙 纳采	赴任
2041-08-03	2041-7-7	30	收	六	辛酉 乙未 戊辰	无	立秋 (8, 7)	无	无	无	作灶 捕捉 祭祀 纳财	开市 破土
2041-08-04	2041-7-8	30	开	日	辛酉 乙未 己巳	无	立秋 (8, 7)	无	无	无	入宅 动土 嫁娶 开市 祈福 祭祀 移徙 立券	安葬 造庙
2041-08-05	2041-7-9	30	闭	一	辛酉 乙未 庚午	无	立秋 (8, 7)	无	无	无	入殓 启钻 塞穴 安葬 成服 移柩 结网 补垣 除服 馀事勿取	诸事不宜
2041-08-06	2041-7-10	30	建	二	辛酉 乙未 辛未	无	立秋 (8, 7)	无	无	无	入宅 出行 嫁娶 祈福 祭祀 移徙 纳采 解除	动土 安葬
2041-08-07	2041-7-11	30	建	三	辛酉 丙申 壬申	立秋	处暑 (8, 23)	无	无	无	上梁 入宅 入殓 出行 启钻 嫁娶 安葬 求嗣 祈福 祭祀 移徙 竖柱 纳畜 纳财 纳采 解除 订盟	动土 安床 掘井 栽种 破土 置产
2041-08-08	2041-7-12	30	除	四	辛酉 丙申 癸酉	无	处暑 (8, 23)	无	无	无	上梁 修造 入殓 动土 合脊 安床 安葬 求嗣 盖屋 破土 祈福 祭祀 竖柱 纳畜 解除 起基	入宅 出火 出行 嫁娶 开光 开市 移徙 词讼 赴任 进人口
2041-08-09	2041-7-13	30	满	五	辛酉 丙申 甲戌	无	处暑 (8, 23)	无	无	无	会亲友 塑绘 塞穴 嫁娶 开光 栽种 沐浴 牧养 理发 经络 补垣	上梁 作灶 入宅 动土 安床 安葬 开仓 开市 破土 祈福
2041-08-10	2041-7-14	30	平	六	辛酉 丙申 乙亥	无	处暑 (8, 23)	无	无	无	作灶 修饰垣墙 平治道涂 沐浴 理发 祭祀	伐木 作梁 嫁娶 安葬 安门 栽种 祈福 造桥
2041-08-11	2041-7-15	30	定	日	辛酉 丙申 丙子	无	处暑 (8, 23)	无	无	无	上梁 修造 入宅 出行 动土 嫁娶 安机械 安葬 安门 定磉 开光 斋醮 普渡 盖屋 破土 祈福 祭祀 移徙 竖柱 纳采 订盟 起基	作灶 开市 立券 置产 造桥
2041-08-12	2041-7-16	30	执	一	辛酉 丙申 丁丑	无	处暑 (8, 23)	无	无	无	入殓 安葬 捕捉 普渡 畋猎 破土 祭祀 结网 解除	交易 入宅 嫁娶 开市
2041-08-13	2041-7-17	30	破	二	辛酉 丙申 戊寅	无	处暑 (8, 23)	无	无	无	坏垣 沐浴 破屋 馀事勿取	开市 斋醮
2041-08-14	2041-7-18	30	危	三	辛酉 丙申 己卯	无	处暑 (8, 23)	无	无	无	入宅 出火 启钻 安葬 安香 开市 挂匾 祈福 祭祀 立券 纳采 订盟 造桥	动土 嫁娶 安床 掘井 破土
2041-08-15	2041-7-19	30	成	四	辛酉 丙申 庚辰	无	处暑 (8, 23)	无	无	无	交易 修造 入宅 动土 嫁娶 安床 安香 开光 开市 捕捉 斋醮 普渡 治病 畋猎 祈福 祭祀 移徙 立券 结网 造车器	安葬 探病 纳采 经络 行丧 订盟
2041-08-16	2041-7-20	30	收	五	辛酉 丙申 辛巳	无	处暑 (8, 23)	无	无	无	会亲友 作灶 冠笄 嫁娶 安床 安机械 开市 牧养 立券 纳畜 纳财 纳采 裁衣 订盟	出行 安葬 掘井 破土 行丧
2041-08-17	2041-7-21	30	开	六	辛酉 丙申 壬午	无	处暑 (8, 23)	无	无	无	上梁 会亲友 修造 出行 出货财 动土 启钻 嫁娶 开仓 开光 开市 开池 斋醮 普渡 牧养 破土 祭祀 竖柱 纳畜 纳财 纳采 解除 订盟	入宅 出火 安葬 安门 盖屋
2041-08-18	2041-7-22	30	闭	日	辛酉 丙申 癸未	无	处暑 (8, 23)	无	无	无	入殓 塞穴 嫁娶 安葬 成服 断蚁 普渡 祈福 祭祀 筑堤 补垣 除服	上梁 动土 开光 掘井 破土 词讼
2041-08-19	2041-7-23	30	建	一	辛酉 丙申 甲申	无	处暑 (8, 23)	无	无	无	冠笄 出行 嫁娶 扫舍 普渡 沐浴 祭祀 纳畜 纳财 赴任	上梁 动土 安床 开仓 开市 破土
2041-08-20	2041-7-24	30	除	二	辛酉 丙申 乙酉	无	处暑 (8, 23)	无	无	无	入殓 冠笄 启钻 安葬 整手足甲 沐浴 理发 破土 祭祀 移柩 解除	入宅 出行 嫁娶 安门 开市
2041-08-21	2041-7-25	30	满	三	辛酉 丙申 丙戌	无	处暑 (8, 23)	无	无	无	会亲友 冠笄 塑绘 塞穴 嫁娶 捕捉 栽种 牧养 纳畜 经络 补垣 裁衣 进人口	动土 安葬 开市 祈福 行丧
2041-08-22	2041-7-26	30	平	四	辛酉 丙申 丁亥	无	处暑 (8, 23)	无	无	无	上梁 出行 沐浴 牧养 移徙 竖柱 纳畜 纳采 裁衣 订盟	动土 嫁娶 安葬 安门
2041-08-23	2041-7-27	30	定	五	辛酉 丙申 戊子	处暑	白露 (9, 7)	无	无	无	上梁 修造 入宅 出火 动土 启钻 嫁娶 安葬 安门 安香 开光 普渡 盖屋 破土 祈福 祭祀 移徙 竖柱 纳采 订盟 起基 造庙 造桥	作灶 开市 立券 纳财
2041-08-24	2041-7-28	30	执	六	辛酉 丙申 己丑	无	白露 (9, 7)	无	无	无	入殓 启钻 安葬 成服 捕捉 牧养 畋猎 破土 祭祀 移柩 纳畜 除服	入宅 嫁娶 开市 纳采 订盟
2041-08-25	2041-7-29	30	破	日	辛酉 丙申 庚寅	无	白露 (9, 7)	无	无	无	坏垣 治病 破屋 馀事勿取	安葬 行丧
2041-08-26	2041-7-30	30	危	一	辛酉 丙申 辛卯	无	白露 (9, 7)	无	无	无	交易 入宅 入殓 冠笄 出行 启钻 嫁娶 安葬 开市 开柱眼 成服 斋醮 破土 祈福 移柩 立券 纳财 造桥 除服 雕刻	动土 安床 开池 订盟
2041-08-27	2041-8-1	29	成	二	辛酉 丙申 壬辰	无	白露 (9, 7)	无	无	无	入殓 动土 安葬 开市 开生坟 成服 放水 求嗣 牧养 破土 祈福 移柩 纳畜 纳采 解除 订盟 起基 造仓 除服	无
2041-08-28	2041-8-2	29	收	三	辛酉 丙申 癸巳	无	白露 (9, 7)	无	无	无	交易 修造 入宅 出火 分居 动土 塑绘 嫁娶 安门 开光 开市 拆卸 牧养 移徙 立券 纳畜 纳财 纳采 解除 订盟 起基	无
2041-08-29	2041-8-3	29	开	四	辛酉 丙申 甲午	无	白露 (9, 7)	无	无	无	交易 出行 动土 嫁娶 安床 开市 开渠 成服 掘井 放水 栽种 破土 祈福 移柩 立券 纳采 裁衣 订盟 除服	无
2041-08-30	2041-8-4	29	闭	五	辛酉 丙申 乙未	无	白露 (9, 7)	无	无	无	作灶 入宅 嫁娶 斋醮 祈福 祭祀 移徙	动土 破土
2041-08-31	2041-8-5	29	建	六	辛酉 丙申 丙申	无	白露 (9, 7)	无	无	无	入殓 出行 启钻 嫁娶 安葬 祭祀 纳畜	作灶 动土 破土
