2042-12-01	二零四二 壬戌[狗]年	十月小	十九	周一	壬戌 辛亥 癸酉 丁巳	狗	射手座	无	大雪 (12, 7)	无	无	世界艾滋病日	沐浴、入学、扫舍宇、雪冤、覃恩、恤孤茕	结婚姻、宴会、嫁娶、冠带、进人口、竖柱上梁、经络、伐木、畋猎、启攒、布政事、选将、塞穴、取鱼、入宅、出师、酝酿、开仓、补垣、纳采、筑堤防、营建、安抚边境
2042-12-02	二零四二 壬戌[狗]年	十月小	二十	周二	壬戌 辛亥 甲戌 己巳	狗	射手座	无	大雪 (12, 7)	无	无	无	祭祀、雪冤、覃恩、恤孤茕	出行、结婚姻、宴会、嫁娶、安床、剃头、修造、求医疗病、上表章、上官、冠带、进人口、竖柱上梁、经络、开市、纳财、修置产室、开渠、穿井、安碓硙、破屋坏垣、畋猎、栽种、牧养、安葬、立券交易、疗目、针刺、裁制、乘船渡水、缮城郭、招贤、布政事、举正直、选将、塞穴、纳畜、取鱼、上册、颁诏、修饰垣墙、出师、祈福、安抚边境、酝酿、庆赐、开仓、整容、鼓铸、补垣、解除、修宫室、施恩、纳采、整手足甲、修仓库、临政、搬移、营建、筑堤防、宣政事、求嗣
2042-12-03	二零四二 壬戌[狗]年	十月小	廿一	周三	壬戌 辛亥 乙亥 辛巳	狗	射手座	无	大雪 (12, 7)	无	无	无	沐浴、雪冤、覃恩、恤孤茕	嫁娶、剃头、冠带、修置产室、开渠、穿井、平治道涂、破屋坏垣、伐木、畋猎、破土、启攒、针刺、乘船渡水、布政事、塞穴、取鱼、修饰垣墙、整容、鼓铸、补垣、整手足甲、筑堤防
2042-12-04	二零四二 壬戌[狗]年	十月小	廿二	周四	壬戌 辛亥 丙子 癸巳	狗	射手座	无	大雪 (12, 7)	无	无	无	出行、沐浴、剃头、求医疗病、上官、扫舍宇、选将、出师、解除、整容、整手足甲、安抚边境、临政、搬移	结婚姻、嫁娶、安床、修造、上表章、冠带、进人口、竖柱上梁、开市、纳财、修置产室、栽种、牧养、安葬、立券交易、乘船渡水、缮城郭、招贤、纳畜、取鱼、上册、祈福、开仓、纳采、修仓库、筑堤防、营建、求嗣、修宫室
2042-12-05	二零四二 壬戌[狗]年	十月小	廿三	周五	壬戌 辛亥 丁丑 乙巳	狗	射手座	无	大雪 (12, 7)	无	无	无	入宅、赴任	祭祀、结婚姻、剃头、上官、冠带、立券、修置产室、开渠、穿井、安碓硙、平治道涂、破屋坏垣、伐木、栽种、牧养、破土、启攒、乘船渡水、远回、招贤、布政事、举正直、选将、纳畜、颁诏、修饰垣墙、出师、祈福、开张、整容、鼓铸、补垣、解除、施恩、整手足甲、临政、筑堤防、营建、宣政事、求嗣、安抚边境
2042-12-06	二零四二 壬戌[狗]年	十月小	廿四	周六	壬戌 辛亥 戊寅 丁巳	狗	射手座	无	大雪 (12, 7)	无	无	无	出行、结婚姻、宴会、嫁娶、修造、求医疗病、上官、进人口、竖柱上梁、经络、开市、纳财、平治道涂、栽种、牧养、破土、安葬、立券交易、赴任、裁制、诉讼、缮城郭、纳畜、修饰垣墙、祈福、酝酿、庆赐、开仓、解除、修宫室、纳采、临政、搬移、求嗣	祭祀、上表章、冠带、修置产室、开渠、穿井、启攒、招贤、布政事、选将、上册、颁诏、出师、鼓铸、修仓库、筑堤防、营建、宣政事、安抚边境
2042-12-07	二零四二 壬戌[狗]年	十月小	廿五	周日	壬戌 壬子 己卯 己巳	狗	射手座	大雪	冬至 (12, 22)	无	无	无	诸事不宜	诸事不宜
2042-12-08	二零四二 壬戌[狗]年	十月小	廿六	周一	壬戌 壬子 庚辰 辛巳	狗	射手座	无	冬至 (12, 22)	无	无	无	祭祀、结婚姻、宴会、上官、冠带、进人口、竖柱上梁、安碓硙、安葬、雪冤、赴任、裁制、诉讼、缮城郭、覃恩、布政事、纳畜、祈福、酝酿、庆赐、修宫室、纳采、临政、恤孤茕	出行、求医疗病、开市、修置产室、栽种、开仓、解除、搬移
2042-12-09	二零四二 壬戌[狗]年	十月小	廿七	周二	壬戌 壬子 辛巳 癸巳	狗	射手座	无	冬至 (12, 22)	无	无	无	祭祀、捕捉、雪冤、覃恩、恤孤茕	出行、安床、剃头、冠带、进人口、修置产室、开渠、穿井、安碓硙、破屋坏垣、破土、启攒、塞穴、取鱼、修饰垣墙、整容、鼓铸、补垣、修宫室、整手足甲、筑堤防
2042-12-10	二零四二 壬戌[狗]年	十月小	廿八	周三	壬戌 壬子 壬午 乙巳	狗	射手座	无	冬至 (12, 22)	无	无	无	祭祀、沐浴、雪冤、覃恩、恤孤茕	出行、结婚姻、宴会、嫁娶、安床、剃头、修造、求医疗病、上表章、上官、冠带、进人口、竖柱上梁、经络、开市、纳财、修置产室、开渠、穿井、安碓硙、破屋坏垣、伐木、畋猎、栽种、牧养、破土、安葬、启攒、立券交易、针刺、裁制、乘船渡水、缮城郭、苫盖、招贤、布政事、举正直、选将、塞穴、纳畜、取鱼、上册、颁诏、修饰垣墙、出师、祈福、入宅、酝酿、庆赐、整容、鼓铸、开仓、补垣、宣政事、解除、修宫室、施恩、纳采、整手足甲、修仓库、临政、搬移、营建、筑堤防、求嗣、安抚边境
2042-12-11	二零四二 壬戌[狗]年	十月小	廿九	周四	壬戌 壬子 癸未 丁巳	狗	射手座	无	冬至 (12, 22)	无	无	无	伐木、畋猎、雪冤、覃恩、恤孤茕	出行、结婚姻、宴会、嫁娶、安床、剃头、修造、求医疗病、上表章、上官、冠带、进人口、竖柱上梁、经络、开市、纳财、修置产室、开渠、穿井、安碓硙、破屋坏垣、栽种、牧养、破土、安葬、启攒、立券交易、裁制、缮城郭、招贤、布政事、举正直、选将、塞穴、纳畜、上册、颁诏、修饰垣墙、出师、祈福、酝酿、庆赐、整容、鼓铸、开仓、补垣、解除、修宫室、施恩、纳采、整手足甲、修仓库、临政、搬移、营建、筑堤防、宣政事、求嗣、安抚边境
2042-12-12	二零四二 壬戌[狗]年	冬月大	初一	周五	壬戌 壬子 甲申 己巳	狗	射手座	无	冬至 (12, 22)	无	无	西安事变纪念日	祭祀、出行、沐浴、剃头、上官、入学、竖柱上梁、经络、扫舍宇、牧养、安葬、裁制、举正直、祈福、酝酿、整容、解除、施恩、临政、求嗣	修置产室、开渠、穿井、平治道涂、破屋坏垣、选将、补垣、修饰垣墙、塞穴、出师、乘船渡水、取鱼、营建、鼓铸
2042-12-13	二零四二 壬戌[狗]年	冬月大	初二	周六	壬戌 壬子 乙酉 辛巳	狗	射手座	无	冬至 (12, 22)	无	无	南京大屠杀纪念日	沐浴、剃头、扫舍宇、捕捉、畋猎、整容、整手足甲	祭祀、出行、结婚姻、宴会、嫁娶、安床、修造、求医疗病、上表章、上官、冠带、进人口、竖柱上梁、经络、开市、纳财、修置产室、开渠、穿井、栽种、牧养、破土、安葬、启攒、立券交易、乘船渡水、裁制、缮城郭、招贤、布政事、举正直、选将、纳畜、取鱼、上册、颁诏、出师、祈福、酝酿、庆赐、开仓、鼓铸、解除、修宫室、施恩、纳采、修仓库、临政、搬移、营建、筑堤防、宣政事、求嗣、安抚边境
2042-12-14	二零四二 壬戌[狗]年	冬月大	初三	周日	壬戌 壬子 丙戌 癸巳	狗	射手座	无	冬至 (12, 22)	无	无	无	宴会、修造、入学、开市、修置产室、开渠、穿井、安碓硙、栽种、牧养、雪冤、裁制、覃恩、缮城郭、举正直、祈福、庆赐、解除、修宫室、施恩、求嗣、恤孤茕	结婚姻、嫁娶、进人口、伐木、捕捉、畋猎、选将、取鱼、出师、开仓、安抚边境
2042-12-15	二零四二 壬戌[狗]年	冬月大	初四	周一	壬戌 壬子 丁亥 乙巳	狗	射手座	无	冬至 (12, 22)	无	至圣先师孔子诞	无	祭祀、沐浴、栽种、牧养、雪冤、赴任、裁制、覃恩、缮城郭、塞穴、纳畜、入宅、补垣、修仓库、筑堤防、恤孤茕	嫁娶、剃头、修置产室、开渠、穿井、畋猎、破土、启攒、疗目、针刺、修宫室、取鱼、开仓、布政事、整容
2042-12-16	二零四二 壬戌[狗]年	冬月大	初五	周二	壬戌 壬子 戊子 丁巳	狗	射手座	无	冬至 (12, 22)	无	无	无	诸事不宜	诸事不宜
2042-12-17	二零四二 壬戌[狗]年	冬月大	初六	周三	壬戌 壬子 己丑 己巳	狗	射手座	无	冬至 (12, 22)	无	西岳大帝诞	无	祭祀、出行、结婚姻、宴会、嫁娶、沐浴、剃头、上官、进人口、经络、纳财、扫舍宇、安葬、立券交易、雪冤、举正直、祈福、酝酿、整容、解除、施恩、临政、恤孤茕	修造、冠带
2042-12-18	二零四二 壬戌[狗]年	冬月大	初七	周四	壬戌 壬子 庚寅 辛巳	狗	射手座	无	冬至 (12, 22)	无	无	无	宴会、修造、上表章、进人口、竖柱上梁、开市、纳财、栽种、牧养、立券交易、裁制、缮城郭、选将、塞穴、上册、出师、祈福、庆赐、补垣、解除、修宫室、求嗣、安抚边境	祭祀、远回、招贤
2042-12-19	二零四二 壬戌[狗]年	冬月大	初八	周五	壬戌 壬子 辛卯 癸巳	狗	射手座	无	冬至 (12, 22)	无	无	无	诸事不宜	诸事不宜
2042-12-20	二零四二 壬戌[狗]年	冬月大	初九	周六	壬戌 壬子 壬辰 乙巳	狗	射手座	无	冬至 (12, 22)	无	无	无	祭祀、宴会、经络、安碓硙、雪冤、赴任、裁制、诉讼、覃恩、招贤、举正直、颁诏、入宅、祈福、酝酿、庆赐、施恩、恤孤茕、宣政事、求嗣	安床、开市、修置产室、开渠、穿井、畋猎、破土、启攒、取鱼、开仓、筑堤防
2042-12-21	二零四二 壬戌[狗]年	冬月大	初十	周日	壬戌 壬子 癸巳 丁巳	狗	射手座	无	冬至 (12, 22)	无	无	无	祭祀、捕捉、雪冤、覃恩、恤孤茕	出行、安床、剃头、冠带、进人口、修置产室、开渠、穿井、安碓硙、破屋坏垣、破土、启攒、布政事、塞穴、取鱼、修饰垣墙、整容、鼓铸、补垣、修宫室、整手足甲、筑堤防
2042-12-22	二零四二 壬戌[狗]年	冬月大	十一	周一	壬戌 壬子 甲午 己巳	狗	射手座	冬至	小寒 (1, 5)	无	太乙救苦天尊诞	无	诸事不宜	诸事不宜
2042-12-23	二零四二 壬戌[狗]年	冬月大	十二	周二	壬戌 壬子 乙未 辛巳	狗	摩羯座	无	小寒 (1, 5)	无	无	无	祭祀、伐木、畋猎	出行、结婚姻、宴会、嫁娶、安床、剃头、修造、求医疗病、上表章、上官、冠带、进人口、竖柱上梁、经络、开市、纳财、修置产室、开渠、穿井、安碓硙、破屋坏垣、栽种、牧养、破土、安葬、启攒、立券交易、裁制、缮城郭、招贤、布政事、举正直、选将、塞穴、纳畜、上册、颁诏、修饰垣墙、出师、祈福、酝酿、庆赐、整容、鼓铸、开仓、补垣、解除、修宫室、施恩、纳采、整手足甲、修仓库、临政、搬移、营建、筑堤防、宣政事、求嗣、安抚边境
2042-12-24	二零四二 壬戌[狗]年	冬月大	十三	周三	壬戌 壬子 丙申 癸巳	狗	摩羯座	无	小寒 (1, 5)	无	无	平安夜	出行、沐浴、剃头、求医疗病、上表章、上官、入学、竖柱上梁、经络、扫舍宇、牧养、安葬、裁制、举正直、酝酿、整容、解除、施恩、整手足甲、临政	安床、修置产室、开渠、穿井、平治道涂、破屋坏垣、乘船渡水、选将、塞穴、取鱼、修饰垣墙、出师、开仓、鼓铸、补垣、营建
2042-12-25	二零四二 壬戌[狗]年	冬月大	十四	周四	壬戌 壬子 丁酉 乙巳	狗	摩羯座	无	小寒 (1, 5)	无	无	圣诞节	沐浴、扫舍宇、捕捉、雪冤、赴任、覃恩、入宅、整手足甲、恤孤茕	宴会、剃头、冠带、修置产室、开渠、穿井、畋猎、启攒、乘船渡水、取鱼、筑堤防、开仓、布政事、修宫室、鼓铸
2042-12-26	二零四二 壬戌[狗]年	冬月大	十五	周五	壬戌 壬子 戊戌 丁巳	狗	摩羯座	无	小寒 (1, 5)	无	无	毛泽东诞辰纪念日	宴会、修造、入学、开市、修置产室、开渠、穿井、安碓硙、栽种、牧养、雪冤、裁制、覃恩、缮城郭、举正直、祈福、庆赐、解除、修宫室、施恩、求嗣、恤孤茕	嫁娶、剃头、进人口、伐木、捕捉、畋猎、选将、取鱼、出师、整容、开仓、整手足甲、安抚边境
2042-12-27	二零四二 壬戌[狗]年	冬月大	十六	周六	壬戌 壬子 己亥 己巳	狗	摩羯座	无	小寒 (1, 5)	无	无	无	沐浴、雪冤、裁制、覃恩、选将、塞穴、补垣、筑堤防、恤孤茕、安抚边境	出行、结婚姻、宴会、嫁娶、安床、修造、求医疗病、上表章、上官、进人口、竖柱上梁、开市、修置产室、开渠、穿井、破土、安葬、启攒、疗目、针刺、招贤、布政事、举正直、上册、颁诏、出师、祈福、庆赐、开仓、解除、修宫室、施恩、纳采、临政、搬移、营建、求嗣、宣政事
2042-12-28	二零四二 壬戌[狗]年	冬月大	十七	周日	壬戌 壬子 庚子 辛巳	狗	摩羯座	无	小寒 (1, 5)	无	阿弥陀佛诞	无	诸事不宜	诸事不宜
2042-12-29	二零四二 壬戌[狗]年	冬月大	十八	周一	壬戌 壬子 辛丑 癸巳	狗	摩羯座	无	小寒 (1, 5)	无	无	无	祭祀、出行、宴会、沐浴、剃头、上官、进人口、经络、纳财、扫舍宇、安葬、立券交易、雪冤、举正直、选将、出师、祈福、整容、解除、施恩、整手足甲、临政、恤孤茕、安抚边境	修造、冠带
2042-12-30	二零四二 壬戌[狗]年	冬月大	十九	周二	壬戌 壬子 壬寅 乙巳	狗	摩羯座	无	小寒 (1, 5)	无	太阳日宫诞	无	宴会、嫁娶、上表章、进人口、竖柱上梁、经络、开市、纳财、栽种、牧养、立券交易、雪冤、裁制、覃恩、缮城郭、选将、塞穴、纳畜、上册、颁诏、入宅、祈福、安抚边境、庆赐、补垣、解除、营建、恤孤茕、宣政事、求嗣、修宫室	祭祀、开渠、穿井、畋猎、整手足甲、远回、取鱼
2042-12-31	二零四二 壬戌[狗]年	冬月大	二十	周三	壬戌 壬子 癸卯 丁巳	狗	摩羯座	无	小寒 (1, 5)	无	无	无	诸事不宜	诸事不宜
