2046-03-01	二零四六 丙寅[虎]年	正月大	廿四	周四	无	无	国际海豹日	丙寅 庚寅 己未 己巳	无	惊蛰 (3, 5)	虎	双鱼座	捕捉、取鱼	结婚姻、修造、求医疗病、安抚边境、纳畜、选将、出师、纳采
2046-03-02	二零四六 丙寅[虎]年	正月大	廿五	周五	无	无	无	丙寅 庚寅 庚申 辛巳	无	惊蛰 (3, 5)	虎	双鱼座	祭祀、沐浴、扫舍宇、破屋坏垣	结婚姻、宴会、嫁娶、安床、修造、上官、冠带、进人口、竖柱上梁、经络、开市、纳财、修置产室、开渠、穿井、安碓硙、伐木、栽种、牧养、启攒、布政事、纳畜、颁诏、纳采、补垣、举正直、安抚边境、修仓库、缮城郭、鼓铸、裁制、宣政事、临政、酝酿、立券交易、招贤、开仓、筑堤防、施恩、求嗣、塞穴、修饰垣墙、上册、庆赐、修宫室、选将、营建、出师
2046-03-03	二零四六 丙寅[虎]年	正月大	廿六	周六	无	无	全国爱耳日	丙寅 庚寅 辛酉 癸巳	无	惊蛰 (3, 5)	虎	双鱼座	祭祀、出行、结婚姻、嫁娶、安床、沐浴、剃头、修造、求医疗病、上表章、上官、竖柱上梁、扫舍宇、栽种、牧养、安葬、赴任、出师、纳畜、颁诏、纳采、举正直、安抚边境、修仓库、雪冤、整手足甲、缮城郭、裁制、宣政事、临政、招贤、祈福、入宅、施恩、解除、求嗣、覃恩、上册、整容、恤孤茕、选将、营建、搬移	宴会、冠带、修置产室、开渠、穿井、安碓硙、畋猎、启攒、布政事、修宫室、鼓铸、取鱼、开仓、筑堤防、塞穴、补垣、修饰垣墙
2046-03-04	二零四六 丙寅[虎]年	正月大	廿七	周日	无	无	无	丙寅 庚寅 壬戌 乙巳	无	惊蛰 (3, 5)	虎	双鱼座	祭祀、出行、结婚姻、宴会、嫁娶、修造、求医疗病、上表章、上官、入学、进人口、竖柱上梁、经络、开市、纳财、安碓硙、栽种、牧养、安葬、纳畜、纳采、安抚边境、修仓库、雪冤、缮城郭、裁制、临政、酝酿、立券交易、祈福、筑堤防、解除、求嗣、覃恩、上册、庆赐、恤孤茕、修宫室、选将、营建、出师、搬移	剃头、冠带、修置产室、开渠、穿井、平治道涂、破屋坏垣、伐木、畋猎、破土、启攒、布政事、取鱼、补垣、整手足甲、鼓铸、开仓、塞穴、修饰垣墙、整容、远回
2046-03-05	二零四六 丙寅[虎]年	正月大	廿八	周一	无	无	周恩来诞辰纪念日,中国青年志愿者服务日	丙寅 辛卯 癸亥 丁巳	惊蛰	春分 (3, 20)	虎	双鱼座	出行、结婚姻、宴会、沐浴、上表章、上官、入学、进人口、竖柱上梁、经络、开市、纳财、安碓硙、栽种、牧养、纳畜、纳采、举正直、缮城郭、裁制、临政、酝酿、立券交易、筑堤防、施恩、上册、庆赐、修宫室、搬移	嫁娶、破土、安葬、启攒
2046-03-06	二零四六 丙寅[虎]年	正月大	廿九	周二	无	无	世界青光眼日	丙寅 辛卯 甲子 己巳	无	春分 (3, 20)	虎	双鱼座	祭祀、沐浴、捕捉、雪冤、覃恩、恤孤茕	出行、结婚姻、宴会、嫁娶、安床、剃头、修造、求医疗病、上表章、上官、冠带、进人口、竖柱上梁、经络、开市、纳财、修置产室、开渠、穿井、安碓硙、破屋坏垣、畋猎、栽种、牧养、破土、安葬、启攒、布政事、纳畜、取鱼、颁诏、纳采、补垣、举正直、安抚边境、修仓库、整手足甲、缮城郭、鼓铸、裁制、宣政事、临政、乘船渡水、酝酿、立券交易、招贤、开仓、祈福、解除、施恩、筑堤防、求嗣、塞穴、修饰垣墙、上册、庆赐、整容、修宫室、选将、营建、出师、搬移
2046-03-07	二零四六 丙寅[虎]年	正月大	三十	周三	无	无	无	丙寅 辛卯 乙丑 辛巳	无	春分 (3, 20)	虎	双鱼座	出行、宴会、修造、求医疗病、上表章、上官、入学、修置产室、开渠、穿井、安碓硙、牧养、纳畜、颁诏、举正直、安抚边境、雪冤、缮城郭、裁制、宣政事、临政、招贤、祈福、解除、施恩、求嗣、覃恩、上册、庆赐、恤孤茕、修宫室、选将、出师、搬移	冠带、伐木、畋猎、破土、安葬、启攒、取鱼、补垣、鼓铸、乘船渡水、立券交易、开仓、塞穴
2046-03-08	二零四六 丙寅[虎]年	二月小	初一	周四	无	一殿秦广王诞	国际劳动妇女节	丙寅 辛卯 丙寅 癸巳	无	春分 (3, 20)	虎	双鱼座	经络、纳财、栽种、牧养、纳畜、补垣、安抚边境、雪冤、缮城郭、裁制、酝酿、立券交易、筑堤防、入宅、塞穴、覃恩、恤孤茕、选将	祭祀、上表章、修置产室、开渠、穿井、上册、针刺、整手足甲、营建、远回、疗目
2046-03-09	二零四六 丙寅[虎]年	二月小	初二	周五	无	春龙节-福德土地正神诞	无	丙寅 辛卯 丁卯 乙巳	无	春分 (3, 20)	虎	双鱼座	出行、宴会、上官、进人口、经络、纳财、牧养、布政事、纳畜、举正直、安抚边境、雪冤、裁制、临政、酝酿、立券交易、招贤、施恩、覃恩、庆赐、恤孤茕、选将、出师、搬移	剃头、上表章、修置产室、开渠、穿井、平治道涂、破屋坏垣、伐木、安葬、取鱼、补垣、苫盖、整手足甲、乘船渡水、筑堤防、修饰垣墙、上册、整容、营建
2046-03-10	二零四六 丙寅[虎]年	二月小	初三	周六	无	文昌帝君诞	无	丙寅 辛卯 戊辰 丁巳	无	春分 (3, 20)	虎	双鱼座	出行、沐浴、剃头、扫舍宇、布政事、举正直、雪冤、整手足甲、临政、解除、施恩、覃恩、整容、恤孤茕	结婚姻、宴会、嫁娶、修造、求医疗病、上表章、上官、进人口、经络、开市、纳财、修置产室、畋猎、牧养、破土、安葬、启攒、出师、纳畜、纳采、安抚边境、修仓库、酝酿、立券交易、开仓、祈福、求嗣、上册、庆赐、选将
2046-03-11	二零四六 丙寅[虎]年	二月小	初四	周日	无	无	无	丙寅 辛卯 己巳 己巳	无	春分 (3, 20)	虎	双鱼座	宴会、竖柱上梁、经络、开市、纳财、牧养、雪冤、裁制、立券交易、祈福、解除、塞穴、求嗣、覃恩、庆赐、恤孤茕	祭祀、出行、修置产室、开渠、穿井、安碓硙、平治道涂、破屋坏垣、捕捉、畋猎、破土、启攒、取鱼、筑堤防、修饰垣墙
2046-03-12	二零四六 丙寅[虎]年	二月小	初五	周一	无	无	孙中山逝世纪念日,中国植树节	丙寅 辛卯 庚午 辛巳	无	春分 (3, 20)	虎	双鱼座	祭祀、平治道涂、修饰垣墙	出行、结婚姻、宴会、嫁娶、安床、修造、求医疗病、上表章、上官、冠带、进人口、竖柱上梁、经络、开市、纳财、修置产室、开渠、穿井、栽种、牧养、破土、安葬、启攒、布政事、出师、纳畜、颁诏、纳采、举正直、安抚边境、修仓库、苫盖、缮城郭、鼓铸、裁制、宣政事、临政、乘船渡水、酝酿、立券交易、招贤、开仓、祈福、解除、施恩、筑堤防、求嗣、上册、庆赐、修宫室、选将、营建、搬移
2046-03-13	二零四六 丙寅[虎]年	二月小	初六	周二	无	东华帝君诞	无	丙寅 辛卯 辛未 癸巳	无	春分 (3, 20)	虎	双鱼座	祭祀、出行、结婚姻、宴会、修造、冠带、进人口、竖柱上梁、经络、安碓硙、破土、赴任、纳畜、纳采、雪冤、缮城郭、裁制、入宅、祈福、求嗣、庆赐、修宫室、恤孤茕、搬移	求医疗病、上表章、修置产室、栽种、安葬、上册、安抚边境、针刺、整手足甲、选将、开仓、解除、出师
2046-03-14	二零四六 丙寅[虎]年	二月小	初七	周三	无	无	马克思逝世纪念日	丙寅 辛卯 壬申 乙巳	无	春分 (3, 20)	虎	双鱼座	祭祀、沐浴、扫舍宇、捕捉、雪冤、覃恩、恤孤茕	安床、冠带、进人口、经络、开市、纳财、修置产室、开渠、穿井、安碓硙、破屋坏垣、畋猎、启攒、布政事、补垣、鼓铸、酝酿、立券交易、开仓、筑堤防、塞穴、修饰垣墙、修宫室
2046-03-15	二零四六 丙寅[虎]年	二月小	初八	周四	无	释迦牟尼佛出家	国际消费者权益日	丙寅 辛卯 癸酉 丁巳	无	春分 (3, 20)	虎	双鱼座	诸事不宜	诸事不宜
2046-03-16	二零四六 丙寅[虎]年	二月小	初九	周五	无	无	无	丙寅 辛卯 甲戌 己巳	无	春分 (3, 20)	虎	双鱼座	祭祀、出行、结婚姻、宴会、嫁娶、安床、修造、求医疗病、上表章、上官、进人口、竖柱上梁、经络、开市、纳财、栽种、牧养、安葬、赴任、出师、纳畜、取鱼、颁诏、纳采、举正直、安抚边境、修仓库、雪冤、缮城郭、裁制、宣政事、临政、诉讼、酝酿、立券交易、招贤、祈福、解除、施恩、求嗣、覃恩、上册、庆赐、恤孤茕、选将、营建、搬移	诸事不忌
2046-03-17	二零四六 丙寅[虎]年	二月小	初十	周六	无	无	国际航海日	丙寅 辛卯 乙亥 辛巳	无	春分 (3, 20)	虎	双鱼座	出行、宴会、沐浴、修造、上表章、上官、入学、竖柱上梁、经络、安碓硙、牧养、纳畜、举正直、缮城郭、裁制、临政、酝酿、筑堤防、施恩、上册、庆赐、修宫室、搬移	嫁娶、破土、安葬、启攒、开仓
2046-03-18	二零四六 丙寅[虎]年	二月小	十一	周日	无	无	全国科技人才活动日	丙寅 辛卯 丙子 癸巳	无	春分 (3, 20)	虎	双鱼座	祭祀、沐浴、捕捉、入宅	出行、结婚姻、宴会、嫁娶、安床、剃头、修造、求医疗病、上表章、上官、冠带、进人口、竖柱上梁、经络、开市、立券、纳财、修置产室、开渠、穿井、安碓硙、破屋坏垣、栽种、牧养、破土、安葬、启攒、布政事、出师、纳畜、取鱼、颁诏、纳采、补垣、举正直、开张、安抚边境、修仓库、整手足甲、缮城郭、鼓铸、裁制、宣政事、临政、乘船渡水、酝酿、立券交易、招贤、开仓、祈福、解除、施恩、筑堤防、求嗣、塞穴、修饰垣墙、上册、庆赐、整容、修宫室、选将、营建、搬移
2046-03-19	二零四六 丙寅[虎]年	二月小	十二	周一	无	无	无	丙寅 辛卯 丁丑 乙巳	无	春分 (3, 20)	虎	双鱼座	结婚姻、宴会、修造、求医疗病、上表章、上官、入学、竖柱上梁、修置产室、开渠、穿井、安碓硙、牧养、纳畜、颁诏、纳采、举正直、安抚边境、雪冤、缮城郭、裁制、宣政事、临政、招贤、祈福、解除、施恩、求嗣、覃恩、上册、庆赐、恤孤茕、修宫室、选将、出师、搬移	剃头、冠带、伐木、畋猎、乘船渡水、整容、鼓铸、取鱼、补垣、塞穴
2046-03-20	二零四六 丙寅[虎]年	二月小	十三	周二	无	无	无	丙寅 辛卯 戊寅 丁巳	春分	清明 (4, 4)	虎	双鱼座	经络、纳财、栽种、牧养、破土、安葬、纳畜、补垣、修仓库、雪冤、缮城郭、裁制、酝酿、立券交易、筑堤防、塞穴、覃恩、恤孤茕	祭祀、出行、结婚姻、宴会、嫁娶、安床、修造、求医疗病、上表章、上官、进人口、竖柱上梁、开市、修置产室、开渠、穿井、畋猎、布政事、出师、取鱼、颁诏、纳采、举正直、安抚边境、宣政事、临政、针刺、招贤、开仓、祈福、解除、施恩、求嗣、上册、庆赐、修宫室、选将、营建、远回、疗目、搬移
2046-03-21	二零四六 丙寅[虎]年	二月小	十四	周三	无	无	世界森林日,世界睡眠日	丙寅 辛卯 己卯 己巳	无	清明 (4, 4)	虎	白羊座	宴会、上官、进人口、经络、纳财、牧养、纳畜、颁诏、举正直、雪冤、裁制、宣政事、临政、酝酿、立券交易、招贤、施恩、覃恩、庆赐、恤孤茕、搬移	剃头、修置产室、开渠、穿井、平治道涂、破屋坏垣、伐木、畋猎、启攒、苫盖、乘船渡水、整容、整手足甲、取鱼、开仓、筑堤防、补垣、修饰垣墙
2046-03-22	二零四六 丙寅[虎]年	二月小	十五	周四	无	释迦牟尼佛般涅槃	世界水日	丙寅 辛卯 庚辰 辛巳	无	清明 (4, 4)	虎	白羊座	出行、沐浴、扫舍宇、布政事、举正直、雪冤、临政、解除、施恩、覃恩、恤孤茕	宴会、嫁娶、剃头、修造、求医疗病、上表章、上官、进人口、经络、开市、纳财、修置产室、畋猎、牧养、破土、安葬、启攒、出师、纳畜、纳采、安抚边境、修仓库、整手足甲、酝酿、立券交易、开仓、祈福、求嗣、上册、庆赐、整容、选将
2046-03-23	二零四六 丙寅[虎]年	二月小	十六	周五	无	无	世界气象日	丙寅 辛卯 辛巳 癸巳	无	清明 (4, 4)	虎	白羊座	宴会、竖柱上梁、经络、开市、纳财、赴任、布政事、雪冤、裁制、立券交易、祈福、入宅、塞穴、覃恩、庆赐、恤孤茕	祭祀、出行、结婚姻、修置产室、开渠、穿井、安碓硙、平治道涂、破屋坏垣、捕捉、畋猎、栽种、破土、启攒、纳畜、取鱼、颁诏、举正直、安抚边境、宣政事、招贤、筑堤防、施恩、修饰垣墙、选将、营建、出师
2046-03-24	二零四六 丙寅[虎]年	二月小	十七	周六	无	东方杜将军诞	世界防治结核病日	丙寅 辛卯 壬午 乙巳	无	清明 (4, 4)	虎	白羊座	祭祀、平治道涂、雪冤、修饰垣墙、覃恩、恤孤茕	出行、结婚姻、宴会、嫁娶、安床、修造、求医疗病、上表章、上官、冠带、进人口、竖柱上梁、经络、开市、纳财、修置产室、开渠、穿井、栽种、牧养、破土、安葬、启攒、布政事、纳畜、颁诏、纳采、举正直、安抚边境、修仓库、苫盖、缮城郭、鼓铸、裁制、宣政事、临政、酝酿、立券交易、招贤、开仓、祈福、解除、施恩、筑堤防、求嗣、上册、庆赐、修宫室、选将、营建、出师、搬移
2046-03-25	二零四六 丙寅[虎]年	二月小	十八	周日	无	至圣先师孔子讳辰	无	丙寅 辛卯 癸未 丁巳	无	清明 (4, 4)	虎	白羊座	祭祀、宴会、冠带、进人口、竖柱上梁、经络、布政事、纳畜、纳采、雪冤、裁制、酝酿、祈福、求嗣、覃恩、庆赐、恤孤茕	求医疗病、上表章、开市、修置产室、开渠、穿井、平治道涂、破屋坏垣、栽种、补垣、安抚边境、针刺、开仓、解除、筑堤防、修饰垣墙、上册、选将、营建、出师
2046-03-26	二零四六 丙寅[虎]年	二月小	十九	周一	无	观音大士诞	无	丙寅 辛卯 甲申 己巳	无	清明 (4, 4)	虎	白羊座	祭祀、沐浴、扫舍宇、捕捉、雪冤、覃恩、恤孤茕	安床、冠带、进人口、经络、开市、纳财、修置产室、开渠、穿井、安碓硙、破屋坏垣、畋猎、启攒、布政事、补垣、鼓铸、酝酿、立券交易、开仓、筑堤防、塞穴、修饰垣墙、修宫室
2046-03-27	二零四六 丙寅[虎]年	二月小	二十	周二	无	无	无	丙寅 辛卯 乙酉 辛巳	无	清明 (4, 4)	虎	白羊座	诸事不宜	诸事不宜
2046-03-28	二零四六 丙寅[虎]年	二月小	廿一	周三	无	普贤菩萨诞	无	丙寅 辛卯 丙戌 癸巳	无	清明 (4, 4)	虎	白羊座	祭祀、出行、结婚姻、宴会、嫁娶、安床、修造、求医疗病、上官、进人口、竖柱上梁、经络、纳财、栽种、牧养、安葬、赴任、纳畜、取鱼、纳采、安抚边境、缮城郭、裁制、临政、诉讼、酝酿、立券交易、开仓、祈福、入宅、解除、求嗣、庆赐、修宫室、选将、搬移	剃头、上表章、冠带、修置产室、开渠、穿井、安碓硙、破屋坏垣、布政事、颁诏、补垣、修仓库、整手足甲、鼓铸、宣政事、招贤、筑堤防、塞穴、修饰垣墙、上册、整容、营建、出师
2046-03-29	二零四六 丙寅[虎]年	二月小	廿二	周四	无	无	无	丙寅 辛卯 丁亥 乙巳	无	清明 (4, 4)	虎	白羊座	祭祀、出行、宴会、沐浴、修造、上表章、上官、入学、进人口、竖柱上梁、经络、开市、纳财、安碓硙、栽种、牧养、纳畜、纳采、举正直、修仓库、缮城郭、裁制、临政、酝酿、立券交易、开仓、筑堤防、祈福、施恩、解除、求嗣、上册、庆赐、修宫室、搬移	嫁娶、剃头、破土、安葬、启攒、整容
2046-03-30	二零四六 丙寅[虎]年	二月小	廿三	周五	无	无	无	丙寅 辛卯 戊子 丁巳	无	清明 (4, 4)	虎	白羊座	诸事不宜	诸事不宜
2046-03-31	二零四六 丙寅[虎]年	二月小	廿四	周六	无	无	无	丙寅 辛卯 己丑 己巳	无	清明 (4, 4)	虎	白羊座	出行、结婚姻、宴会、嫁娶、修造、求医疗病、上表章、上官、入学、竖柱上梁、修置产室、开渠、穿井、安碓硙、牧养、纳畜、颁诏、纳采、举正直、雪冤、缮城郭、裁制、宣政事、临政、招贤、祈福、解除、施恩、求嗣、覃恩、上册、庆赐、恤孤茕、修宫室、营建、搬移	冠带、伐木、畋猎、乘船渡水、鼓铸、取鱼、开仓、塞穴、补垣
