2046-12-01	2046-11-4	29	危	六	丙寅 己亥 甲午	无	大雪 (12, 7)	无	无	无	纳采 订盟 嫁娶 祭祀 祈福 雕刻 移徙 开市 入宅 出行 动土 会亲友 入学 修造 起基 安门 安床 造庙 解除 纳财 开池 造畜稠 牧养	上梁 开仓 出货财 盖屋 造船
2046-12-02	2046-11-5	29	成	日	丙寅 己亥 乙未	无	大雪 (12, 7)	无	无	无	祭祀 祈福 求嗣 开光 解除 伐木 拆卸 修造 栽种 纳畜 安葬 修坟 立碑	嫁娶 进人口 入宅 移徙 出火 出行
2046-12-03	2046-11-6	29	收	一	丙寅 己亥 丙申	无	大雪 (12, 7)	无	无	无	沐浴 扫舍 捕捉 畋猎 解除 塞穴 馀事勿取	嫁娶 入宅 开市 安床 破土 修坟
2046-12-04	2046-11-7	29	开	二	丙寅 己亥 丁酉	无	大雪 (12, 7)	无	无	无	嫁娶 冠笄 祭祀 祈福 求嗣 斋醮 开光 出行 解除 动土 开市 交易 立券 挂匾 拆卸 破土	伐木 上梁 修造 入殓 理发 会亲友 入宅 安门 安葬 作灶
2046-12-05	2046-11-8	29	闭	三	丙寅 己亥 戊戌	无	大雪 (12, 7)	无	无	无	合帐 裁衣 嫁娶 安床 入殓 移柩 破土 造畜稠	置产 造船 开光 掘井 作灶
2046-12-06	2046-11-9	29	建	四	丙寅 己亥 己亥	无	大雪 (12, 7)	无	无	无	解除 修饰垣墙 冠笄 出行 馀事勿取	开市 动土 破土 嫁娶 安葬
2046-12-07	2046-11-10	29	建	五	丙寅 庚子 庚子	大雪	冬至 (12, 22)	无	无	无	教牛马 馀事勿取	入宅 动土 破土
2046-12-08	2046-11-11	29	除	六	丙寅 庚子 辛丑	无	冬至 (12, 22)	无	无	无	嫁娶 出行 求医 治病 祭祀 祈福 上梁 纳畜	开市 安葬
2046-12-09	2046-11-12	29	满	日	丙寅 庚子 壬寅	无	冬至 (12, 22)	无	无	无	开市 立券 开光 解除 安机械 上梁 启钻 安葬	嫁娶 祈福
2046-12-10	2046-11-13	29	平	一	丙寅 庚子 癸卯	无	冬至 (12, 22)	无	无	无	平治道涂 馀事勿取	诸事不宜
2046-12-11	2046-11-14	29	定	二	丙寅 庚子 甲辰	无	冬至 (12, 22)	无	无	无	求嗣 斋醮 塑绘 订盟 纳采 出火 拆卸 修造 动土 造桥 安机械 栽种 纳畜 牧养 入殓 除服 成服 移柩 破土 安葬	开市 嫁娶
2046-12-12	2046-11-15	29	执	三	丙寅 庚子 乙巳	无	冬至 (12, 22)	无	无	无	嫁娶 订盟 纳采 祭祀 祈福 修造 动土 移徙 入宅	开市 安葬
2046-12-13	2046-11-16	29	破	四	丙寅 庚子 丙午	无	冬至 (12, 22)	无	无	无	治病 破屋 坏垣 馀事勿取	诸事不宜
2046-12-14	2046-11-17	29	危	五	丙寅 庚子 丁未	无	冬至 (12, 22)	无	无	无	祭祀 祈福 求嗣 斋醮 开光 入学 订盟 冠笄 伐木 修造 动土 起基 放水 交易 开池	造桥 安门 理发 造庙 栽种 作灶
2046-12-15	2046-11-18	29	成	六	丙寅 庚子 戊申	无	冬至 (12, 22)	无	无	无	解除 坏垣 馀事勿取	诸事不宜
2046-12-16	2046-11-19	29	收	日	丙寅 庚子 己酉	无	冬至 (12, 22)	无	无	无	沐浴 理发 扫舍	伐木 纳畜 上梁 入宅 作灶 造畜稠 嫁娶 安葬 作梁 造船 安门
2046-12-17	2046-11-20	29	开	一	丙寅 庚子 庚戌	无	冬至 (12, 22)	无	无	无	祭祀 开光 祈福 解除 作梁 动土 安床 掘井 栽种 纳畜 破土 移柩	嫁娶 出行 赴任 盖屋 入殓 入宅 移徙 出火 进人口 安葬
2046-12-18	2046-11-21	29	闭	二	丙寅 庚子 辛亥	无	冬至 (12, 22)	无	无	无	作梁 修造 动土 安门 作灶 塞穴 开池 开厕 筑堤 补垣 栽种	嫁娶 祈福 掘井 行丧 安葬 安床
2046-12-19	2046-11-22	29	建	三	丙寅 庚子 壬子	无	冬至 (12, 22)	无	无	无	安葬 启钻 移柩 入殓 除服 成服	馀事勿取
2046-12-20	2046-11-23	29	除	四	丙寅 庚子 癸丑	无	冬至 (12, 22)	无	无	无	嫁娶 祭祀 祈福 求嗣 出行 出火 拆卸 开市 交易 立券 挂匾 入宅 移徙 安床 栽种	作灶 塑绘 行丧 词讼 伐木 安葬
2046-12-21	2046-11-24	29	满	五	丙寅 庚子 甲寅	无	冬至 (12, 22)	无	无	无	理发 开光 解除 拆卸 修造 安葬 开市 交易 立券 挂匾 安床 栽种	入宅 移徙 作灶 祈福 祭祀 嫁娶 谢土 掘井 盖屋 探病
2046-12-22	2046-11-25	29	平	六	丙寅 庚子 乙卯	冬至	小寒 (1, 5)	无	无	无	祭祀 修饰垣墙 馀事勿取	诸事不宜
2046-12-23	2046-11-26	29	定	日	丙寅 庚子 丙辰	无	小寒 (1, 5)	无	无	无	入宅 安床 开光 祭祀 出火 拆卸 动土 挂匾 入殓 破土 安葬 纳畜	嫁娶 开市 作灶 置产 作梁 伐木
2046-12-24	2046-11-27	29	执	一	丙寅 庚子 丁巳	无	小寒 (1, 5)	平安夜	无	无	祭祀 解除 馀事勿取	诸事不宜
2046-12-25	2046-11-28	29	破	二	丙寅 庚子 戊午	无	小寒 (1, 5)	圣诞节	无	无	破屋 坏垣 祭祀 沐浴 馀事勿取	诸事不宜
2046-12-26	2046-11-29	29	危	三	丙寅 庚子 己未	无	小寒 (1, 5)	无	无	无	安床 祭祀 祈福 求嗣 冠笄 伐木 架马 动土 开池 开厕 结网 入殓 除服 成服	安门 栽种 作灶 治病
2046-12-27	2046-12-1	30	成	四	丙寅 庚子 庚申	无	小寒 (1, 5)	无	无	无	解除 扫舍 馀事勿取	诸事不宜
2046-12-28	2046-12-2	30	收	五	丙寅 庚子 辛酉	无	小寒 (1, 5)	无	无	无	祭祀 开光 理发 整手足甲 安床 作灶 扫舍 教牛马	伐木 纳畜 破土 安葬 开生坟 嫁娶 开市 动土 交易 作梁
2046-12-29	2046-12-3	30	开	六	丙寅 庚子 壬戌	无	小寒 (1, 5)	无	无	无	祭祀 祈福 求嗣 开光 拆卸 修造 动土 上梁 安床 置产 栽种 破土	嫁娶 进人口 安葬 出行 赴任 入宅 移徙 入殓 开渠
2046-12-30	2046-12-4	30	闭	日	丙寅 庚子 癸亥	无	小寒 (1, 5)	无	无	无	沐浴 冠笄 补垣 塞穴 裁衣 修造 作梁 开柱眼 安碓磑 筑堤 开厕 断蚁	移徙 入宅 嫁娶 祈福 开光 掘井
2046-12-31	2046-12-5	30	建	一	丙寅 庚子 甲子	无	小寒 (1, 5)	无	无	无	交易 进人口 祭祀 沐浴 捕捉 入殓 除服 成服 安葬 谢土 启钻 修坟	斋醮 入宅 修造 动土 破土
