2049-04-01	二零四九 己巳[蛇]年	二月小	廿九	周四	己巳 丁卯 丙午 癸巳	无	清明 (4, 4)	无	无	国际愚人节	蛇	白羊座	祭祀、平治道涂、修饰垣墙	出行、结婚姻、宴会、嫁娶、安床、修造、求医疗病、上表章、上官、冠带、进人口、竖柱上梁、经络、开市、纳财、修置产室、开渠、穿井、栽种、牧养、破土、安葬、启攒、搬移、祈福、缮城郭、开仓、裁制、上册、修宫室、颁诏、求嗣、庆赐、招贤、布政事、宣政事、安抚边境、施恩、立券交易、临政、纳畜、举正直、解除、修仓库、酝酿、选将、鼓铸、营建、纳采、出师、筑堤防、苫盖
2049-04-02	二零四九 己巳[蛇]年	三月大	初一	周五	己巳 丁卯 丁未 乙巳	无	清明 (4, 4)	无	二殿楚江王诞	国际儿童图书日	蛇	白羊座	祭祀、出行、宴会、修造、上官、冠带、进人口、竖柱上梁、经络、安碓硙、牧养、破土、搬移、祈福、缮城郭、裁制、修宫室、求嗣、庆赐、恤孤茕、雪冤、施恩、临政、纳畜、举正直、酝酿	剃头、上表章、修置产室、针刺、选将、整容、安抚边境、整手足甲、出师、上册
2049-04-03	二零四九 己巳[蛇]年	三月大	初二	周六	己巳 丁卯 戊申 丁巳	无	清明 (4, 4)	无	无	无	蛇	白羊座	祭祀、沐浴、扫舍宇、捕捉、覃恩、恤孤茕、雪冤	安床、冠带、进人口、经络、开市、纳财、修置产室、开渠、穿井、安碓硙、破屋坏垣、畋猎、启攒、修宫室、开仓、补垣、布政事、立券交易、修饰垣墙、塞穴、酝酿、鼓铸、筑堤防
2049-04-04	二零四九 己巳[蛇]年	三月大	初三	周日	己巳 戊辰 己酉 己巳	清明	谷雨 (4, 19)	清明节	三月三-玄天上帝诞	无	蛇	白羊座	祭祀、出行、结婚姻、嫁娶、沐浴、剃头、修造、求医疗病、上官、进人口、经络、纳财、扫舍宇、捕捉、安葬、搬移、祈福、覃恩、恤孤茕、取鱼、雪冤、整容、布政事、入宅、安抚边境、立券交易、临政、纳畜、解除、赴任、酝酿、纳采、整手足甲	宴会、上表章、冠带、竖柱上梁、修置产室、开渠、穿井、安碓硙、平治道涂、破屋坏垣、栽种、牧养、缮城郭、开仓、上册、修宫室、求嗣、补垣、招贤、修饰垣墙、施恩、举正直、乘船渡水、修仓库、选将、营建、出师、筑堤防
2049-04-05	二零四九 己巳[蛇]年	三月大	初四	周一	己巳 戊辰 庚戌 辛巳	无	谷雨 (4, 19)	无	无	无	蛇	白羊座	祭祀、沐浴、求医疗病、破屋坏垣、覃恩、恤孤茕、雪冤、解除	嫁娶、冠带、修置产室、开渠、穿井、安碓硙、伐木、破土、安葬、启攒、上册、颁诏、补垣、取鱼、招贤、宣政事、修饰垣墙、纳畜、塞穴、乘船渡水、修仓库、鼓铸、营建、筑堤防
2049-04-06	二零四九 己巳[蛇]年	三月大	初五	周二	己巳 戊辰 辛亥 癸巳	无	谷雨 (4, 19)	无	无	无	蛇	白羊座	宴会、安床、沐浴、纳财、栽种、牧养、覃恩、庆赐、恤孤茕、取鱼、雪冤、纳畜、选将、布政事、安抚边境、出师	出行、嫁娶、修造、求医疗病、畋猎、破土、安葬、启攒、求嗣、酝酿、乘船渡水、搬移、祈福、解除、开仓、修仓库
2049-04-07	二零四九 己巳[蛇]年	三月大	初六	周三	己巳 戊辰 壬子 乙巳	无	谷雨 (4, 19)	无	无	世界卫生日	蛇	白羊座	祭祀、结婚姻、宴会、嫁娶、沐浴、修造、求医疗病、上表章、上官、入学、进人口、竖柱上梁、经络、安碓硙、栽种、牧养、安葬、诉讼、祈福、缮城郭、裁制、上册、修宫室、颁诏、求嗣、覃恩、恤孤茕、雪冤、庆赐、招贤、宣政事、施恩、临政、纳畜、举正直、解除、赴任、酝酿、营建、纳采、筑堤防	开渠、穿井、畋猎、取鱼、远回、整手足甲、开仓
2049-04-08	二零四九 己巳[蛇]年	三月大	初七	周四	己巳 戊辰 癸丑 丁巳	无	谷雨 (4, 19)	无	无	无	蛇	白羊座	进人口、纳财、捕捉、覃恩、恤孤茕、取鱼、雪冤、纳畜	出行、结婚姻、嫁娶、安床、修造、求医疗病、上表章、上官、冠带、竖柱上梁、经络、开市、修置产室、开渠、穿井、破土、安葬、启攒、搬移、缮城郭、裁制、上册、开仓、修宫室、颁诏、招贤、宣政事、施恩、立券交易、临政、举正直、解除、修仓库、酝酿、鼓铸、营建、纳采、筑堤防
2049-04-09	二零四九 己巳[蛇]年	三月大	初八	周五	己巳 戊辰 甲寅 己巳	无	谷雨 (4, 19)	无	六殿卞城王诞	无	蛇	白羊座	出行、宴会、上表章、上官、入学、开市、牧养、搬移、祈福、裁制、上册、颁诏、求嗣、覃恩、恤孤茕、雪冤、庆赐、招贤、宣政事、入宅、施恩、立券交易、临政、举正直、解除	祭祀、平治道涂、破屋坏垣、伐木、畋猎、补垣、取鱼、针刺、乘船渡水、营建、出师、筑堤防、开仓、修饰垣墙
2049-04-10	二零四九 己巳[蛇]年	三月大	初九	周六	己巳 戊辰 乙卯 辛巳	无	谷雨 (4, 19)	无	无	无	蛇	白羊座	补垣、塞穴	出行、结婚姻、宴会、嫁娶、安床、修造、求医疗病、上表章、上官、冠带、进人口、竖柱上梁、经络、开市、立券、纳财、修置产室、开渠、穿井、栽种、牧养、破土、安葬、启攒、搬移、祈福、缮城郭、开仓、上册、修宫室、颁诏、求嗣、庆赐、针刺、招贤、布政事、宣政事、安抚边境、施恩、疗目、立券交易、临政、纳畜、开张、举正直、解除、修仓库、酝酿、选将、营建、纳采、出师、筑堤防
2049-04-11	二零四九 己巳[蛇]年	三月大	初十	周日	己巳 戊辰 丙辰 癸巳	无	谷雨 (4, 19)	无	无	无	蛇	白羊座	祭祀	出行、结婚姻、宴会、嫁娶、安床、剃头、修造、求医疗病、上表章、上官、冠带、进人口、竖柱上梁、经络、开市、纳财、修置产室、开渠、穿井、安碓硙、平治道涂、破屋坏垣、伐木、栽种、牧养、破土、安葬、启攒、搬移、祈福、缮城郭、开仓、上册、修宫室、裁制、颁诏、求嗣、庆赐、补垣、招贤、整容、布政事、宣政事、安抚边境、施恩、立券交易、修饰垣墙、临政、纳畜、举正直、解除、塞穴、修仓库、酝酿、选将、鼓铸、营建、纳采、整手足甲、出师、筑堤防
2049-04-12	二零四九 己巳[蛇]年	三月大	十一	周一	己巳 戊辰 丁巳 乙巳	无	谷雨 (4, 19)	无	无	无	蛇	白羊座	祭祀、结婚姻、宴会、嫁娶、沐浴、修造、求医疗病、上表章、上官、竖柱上梁、经络、开市、纳财、扫舍宇、栽种、牧养、安葬、搬移、祈福、缮城郭、开仓、裁制、上册、修宫室、颁诏、求嗣、覃恩、恤孤茕、雪冤、庆赐、招贤、宣政事、安抚边境、施恩、立券交易、临政、纳畜、举正直、解除、修仓库、酝酿、选将、营建、纳采、整手足甲	出行、剃头、冠带、修置产室、开渠、穿井、安碓硙、破屋坏垣、畋猎、破土、补垣、取鱼、鼓铸、布政事、筑堤防、塞穴、修饰垣墙
2049-04-13	二零四九 己巳[蛇]年	三月大	十二	周二	己巳 戊辰 戊午 丁巳	无	谷雨 (4, 19)	无	无	无	蛇	白羊座	诸事不宜	祭祀、出行、结婚姻、宴会、嫁娶、安床、剃头、修造、求医疗病、上表章、上官、冠带、进人口、竖柱上梁、经络、开市、纳财、修置产室、开渠、穿井、安碓硙、破屋坏垣、栽种、牧养、破土、安葬、启攒、搬移、祈福、缮城郭、开仓、裁制、上册、修宫室、颁诏、求嗣、庆赐、补垣、招贤、整容、布政事、宣政事、安抚边境、入宅、施恩、立券交易、修饰垣墙、临政、纳畜、举正直、解除、塞穴、修仓库、酝酿、选将、鼓铸、营建、纳采、整手足甲、出师、筑堤防、苫盖
2049-04-14	二零四九 己巳[蛇]年	三月大	十三	周三	己巳 戊辰 己未 己巳	无	谷雨 (4, 19)	无	无	无	蛇	白羊座	平治道涂、赴任、入宅	出行、结婚姻、宴会、嫁娶、安床、剃头、修造、求医疗病、上表章、上官、冠带、进人口、竖柱上梁、经络、开市、纳财、修置产室、开渠、穿井、安碓硙、破屋坏垣、栽种、牧养、破土、安葬、启攒、搬移、祈福、缮城郭、开仓、裁制、上册、修宫室、颁诏、求嗣、庆赐、补垣、招贤、整容、布政事、宣政事、安抚边境、施恩、立券交易、修饰垣墙、临政、纳畜、举正直、解除、塞穴、修仓库、酝酿、选将、鼓铸、营建、纳采、整手足甲、出师、筑堤防
2049-04-15	二零四九 己巳[蛇]年	三月大	十四	周四	己巳 戊辰 庚申 辛巳	无	谷雨 (4, 19)	无	无	无	蛇	白羊座	祭祀、沐浴、扫舍宇	出行、结婚姻、宴会、嫁娶、安床、剃头、修造、求医疗病、上表章、上官、冠带、进人口、竖柱上梁、经络、开市、纳财、修置产室、开渠、穿井、安碓硙、平治道涂、破屋坏垣、伐木、捕捉、畋猎、栽种、牧养、破土、安葬、启攒、搬移、祈福、缮城郭、开仓、裁制、上册、修宫室、颁诏、求嗣、庆赐、补垣、取鱼、招贤、整容、布政事、宣政事、安抚边境、施恩、立券交易、修饰垣墙、临政、纳畜、举正直、解除、塞穴、乘船渡水、修仓库、酝酿、选将、远回、鼓铸、营建、纳采、整手足甲、出师、筑堤防
2049-04-16	二零四九 己巳[蛇]年	三月大	十五	周五	己巳 戊辰 辛酉 癸巳	无	谷雨 (4, 19)	无	昊天上帝诞	无	蛇	白羊座	祭祀、结婚姻、嫁娶、沐浴、剃头、求医疗病、上官、进人口、经络、纳财、扫舍宇、捕捉、安葬、祈福、取鱼、整容、安抚边境、立券交易、临政、纳畜、解除、酝酿、整手足甲	出行、宴会、安床、修造、上表章、冠带、竖柱上梁、开市、修置产室、开渠、穿井、安碓硙、平治道涂、破屋坏垣、栽种、牧养、启攒、搬移、缮城郭、裁制、上册、开仓、修宫室、颁诏、求嗣、庆赐、补垣、招贤、布政事、宣政事、施恩、修饰垣墙、举正直、塞穴、乘船渡水、修仓库、选将、鼓铸、营建、纳采、出师、筑堤防
2049-04-17	二零四九 己巳[蛇]年	三月大	十六	周六	己巳 戊辰 壬戌 乙巳	无	谷雨 (4, 19)	无	准提菩萨诞	无	蛇	白羊座	祭祀、沐浴、覃恩、恤孤茕、雪冤、解除	安床、冠带、进人口、经络、开市、纳财、修置产室、开渠、穿井、安碓硙、平治道涂、伐木、畋猎、破土、启攒、开仓、修宫室、补垣、取鱼、布政事、修饰垣墙、立券交易、塞穴、乘船渡水、酝酿、鼓铸、筑堤防
2049-04-18	二零四九 己巳[蛇]年	三月大	十七	周日	己巳 戊辰 癸亥 丁巳	无	谷雨 (4, 19)	无	无	无	蛇	白羊座	安床、沐浴、纳财、牧养、取鱼、纳畜	出行、嫁娶、修造、求医疗病、修置产室、开渠、穿井、安碓硙、平治道涂、破屋坏垣、畋猎、破土、安葬、启攒、搬移、祈福、缮城郭、开仓、修宫室、求嗣、补垣、修饰垣墙、解除、修仓库、营建、筑堤防
2049-04-19	二零四九 己巳[蛇]年	三月大	十八	周一	己巳 戊辰 甲子 己巳	谷雨	立夏 (5, 5)	无	无	无	蛇	白羊座	祭祀、宴会、沐浴、上官、入学、进人口、竖柱上梁、经络、开市、纳财、牧养、诉讼、祈福、裁制、覃恩、庆赐、恤孤茕、雪冤、布政事、入宅、立券交易、施恩、临政、纳畜、举正直、赴任、酝酿	修置产室、开渠、穿井、平治道涂、破屋坏垣、破土、安葬、补垣、远回、营建、开仓、修饰垣墙
2049-04-20	二零四九 己巳[蛇]年	三月大	十九	周二	己巳 戊辰 乙丑 辛巳	无	立夏 (5, 5)	无	中岳大帝诞	无	蛇	白羊座	进人口、纳财、捕捉、覃恩、恤孤茕、取鱼、雪冤、纳畜	出行、结婚姻、安床、修造、求医疗病、上表章、上官、冠带、竖柱上梁、经络、开市、修置产室、开渠、穿井、安碓硙、平治道涂、破屋坏垣、栽种、破土、安葬、启攒、搬移、缮城郭、裁制、上册、开仓、修宫室、颁诏、补垣、招贤、宣政事、施恩、立券交易、修饰垣墙、临政、举正直、解除、修仓库、酝酿、鼓铸、营建、纳采、整手足甲、筑堤防
2049-04-21	二零四九 己巳[蛇]年	三月大	二十	周三	己巳 戊辰 丙寅 癸巳	无	立夏 (5, 5)	无	子孙娘娘诞	无	蛇	金牛座	出行、结婚姻、宴会、求医疗病、上表章、上官、入学、竖柱上梁、开市、纳财、牧养、搬移、祈福、开仓、裁制、上册、颁诏、求嗣、覃恩、恤孤茕、雪冤、庆赐、招贤、宣政事、安抚边境、施恩、立券交易、临政、举正直、解除、选将、纳采	祭祀、嫁娶、平治道涂、破屋坏垣、伐木、畋猎、补垣、取鱼、针刺、营建、筑堤防、乘船渡水、修饰垣墙
2049-04-22	二零四九 己巳[蛇]年	三月大	廿一	周四	己巳 戊辰 丁卯 乙巳	无	立夏 (5, 5)	无	无	列宁诞辰纪念日	蛇	金牛座	祭祀、裁制、覃恩、恤孤茕、雪冤、塞穴	剃头、冠带、修置产室、开渠、穿井、安碓硙、平治道涂、破屋坏垣、畋猎、取鱼、针刺、整容、修饰垣墙、整手足甲、疗目
2049-04-23	二零四九 己巳[蛇]年	三月大	廿二	周五	己巳 戊辰 戊辰 丁巳	无	立夏 (5, 5)	无	无	世界图书和版权日	蛇	金牛座	覃恩、恤孤茕、雪冤	出行、结婚姻、宴会、嫁娶、安床、剃头、修造、求医疗病、上表章、上官、冠带、进人口、竖柱上梁、经络、开市、纳财、修置产室、开渠、穿井、安碓硙、平治道涂、破屋坏垣、伐木、栽种、牧养、破土、安葬、启攒、搬移、祈福、缮城郭、开仓、上册、修宫室、裁制、颁诏、求嗣、庆赐、补垣、招贤、整容、布政事、宣政事、安抚边境、施恩、立券交易、修饰垣墙、临政、纳畜、举正直、解除、塞穴、修仓库、酝酿、选将、鼓铸、营建、纳采、整手足甲、出师、筑堤防
2049-04-24	二零四九 己巳[蛇]年	三月大	廿三	周六	己巳 戊辰 己巳 己巳	无	立夏 (5, 5)	无	无	无	蛇	金牛座	嫁娶、沐浴、剃头、修造、求医疗病、上官、经络、开市、纳财、扫舍宇、栽种、牧养、搬移、开仓、恤孤茕、雪冤、整容、入宅、安抚边境、立券交易、临政、纳畜、解除、赴任、酝酿、选将、纳采、整手足甲	出行、结婚姻、宴会、上表章、冠带、竖柱上梁、修置产室、开渠、穿井、安碓硙、平治道涂、破屋坏垣、破土、安葬、启攒、祈福、缮城郭、裁制、上册、修宫室、颁诏、求嗣、庆赐、补垣、招贤、布政事、宣政事、修饰垣墙、塞穴、乘船渡水、修仓库、鼓铸、营建、筑堤防
2049-04-25	二零四九 己巳[蛇]年	三月大	廿四	周日	己巳 戊辰 庚午 辛巳	无	立夏 (5, 5)	无	无	无	蛇	金牛座	诸事不宜	祭祀、出行、结婚姻、宴会、嫁娶、安床、剃头、修造、求医疗病、上表章、上官、冠带、进人口、竖柱上梁、经络、开市、纳财、修置产室、开渠、穿井、安碓硙、平治道涂、破屋坏垣、栽种、牧养、破土、安葬、启攒、搬移、祈福、缮城郭、开仓、裁制、上册、修宫室、颁诏、求嗣、庆赐、补垣、招贤、整容、布政事、宣政事、安抚边境、入宅、施恩、立券交易、修饰垣墙、临政、纳畜、举正直、解除、塞穴、修仓库、酝酿、选将、鼓铸、营建、纳采、整手足甲、出师、筑堤防、苫盖
2049-04-26	二零四九 己巳[蛇]年	三月大	廿五	周一	己巳 戊辰 辛未 癸巳	无	立夏 (5, 5)	无	无	世界知识产权日	蛇	金牛座	诸事不宜	诸事不宜
2049-04-27	二零四九 己巳[蛇]年	三月大	廿六	周二	己巳 戊辰 壬申 乙巳	无	立夏 (5, 5)	无	无	无	蛇	金牛座	祭祀、沐浴、扫舍宇、覃恩、恤孤茕、雪冤	安床、开市、修置产室、开渠、穿井、平治道涂、破屋坏垣、伐木、捕捉、畋猎、启攒、开仓、补垣、取鱼、布政事、修饰垣墙、塞穴、远回、鼓铸、筑堤防
2049-04-28	二零四九 己巳[蛇]年	三月大	廿七	周三	己巳 戊辰 癸酉 丁巳	无	立夏 (5, 5)	无	七殿泰山王诞	无	蛇	金牛座	祭祀、结婚姻、嫁娶、沐浴、剃头、求医疗病、上官、进人口、经络、纳财、扫舍宇、捕捉、安葬、祈福、取鱼、整容、安抚边境、立券交易、临政、纳畜、解除、酝酿、整手足甲	出行、宴会、安床、修造、上表章、冠带、竖柱上梁、开市、修置产室、开渠、穿井、安碓硙、平治道涂、破屋坏垣、栽种、牧养、搬移、缮城郭、开仓、上册、修宫室、求嗣、庆赐、补垣、招贤、施恩、修饰垣墙、举正直、乘船渡水、修仓库、选将、营建、纳采、出师、筑堤防
2049-04-29	二零四九 己巳[蛇]年	三月大	廿八	周四	己巳 戊辰 甲戌 己巳	无	立夏 (5, 5)	无	苍颉至圣先师诞	无	蛇	金牛座	祭祀、沐浴、求医疗病、入宅、解除	结婚姻、宴会、安床、上官、冠带、进人口、竖柱上梁、经络、开市、纳财、修置产室、开渠、穿井、安碓硙、平治道涂、伐木、栽种、牧养、破土、安葬、启攒、缮城郭、开仓、上册、裁制、修宫室、颁诏、求嗣、庆赐、补垣、取鱼、招贤、布政事、宣政事、施恩、立券交易、修饰垣墙、临政、纳畜、举正直、塞穴、乘船渡水、修仓库、酝酿、鼓铸、营建、筑堤防
2049-04-30	二零四九 己巳[蛇]年	三月大	廿九	周五	己巳 戊辰 乙亥 辛巳	无	立夏 (5, 5)	无	无	无	蛇	金牛座	安床、沐浴、牧养、取鱼、纳畜	出行、结婚姻、嫁娶、修造、求医疗病、进人口、开市、修置产室、开渠、穿井、安碓硙、平治道涂、破屋坏垣、畋猎、破土、安葬、启攒、搬移、祈福、缮城郭、开仓、修宫室、求嗣、补垣、修饰垣墙、立券交易、解除、修仓库、营建、纳采、筑堤防
