2053-04-01	二零五三 癸酉[鸡]年 二月大十三	周二	无	无	国际愚人节	癸酉 乙卯 丁卯 乙巳	无	清明 (4, 4)	鸡	白羊座	宴会、上官、进人口、经络、纳财、牧养、庆赐、临政、裁制、纳畜、恤孤茕、出师、招贤、布政事、选将、举正直、酝酿、覃恩、雪冤、施恩、安抚边境、立券交易	剃头、上表章、修置产室、开渠、穿井、平治道涂、破屋坏垣、伐木、安葬、补垣、乘船渡水、整容、筑堤防、营建、取鱼、修饰垣墙、上册、苫盖、整手足甲
2053-04-02	二零五三 癸酉[鸡]年 二月大十四	周三	无	无	国际儿童图书日	癸酉 乙卯 戊辰 丁巳	无	清明 (4, 4)	鸡	白羊座	出行、宴会、嫁娶、沐浴、剃头、修造、求医疗病、上官、扫舍宇、庆赐、临政、搬移、纳采、解除、入宅、恤孤茕、出师、整容、布政事、选将、覃恩、举正直、雪冤、施恩、安抚边境、整手足甲	上表章、进人口、经络、开市、纳财、修置产室、畋猎、牧养、破土、安葬、启攒、开仓、修仓库、乘船渡水、纳畜、酝酿、求嗣、上册、立券交易、祈福
2053-04-03	二零五三 癸酉[鸡]年 二月大十五	周四	无	释迦牟尼佛般涅槃	无	癸酉 乙卯 己巳 己巳	无	清明 (4, 4)	鸡	白羊座	宴会、竖柱上梁、经络、开市、纳财、牧养、庆赐、裁制、立券交易、恤孤茕、解除、覃恩、求嗣、雪冤、塞穴、祈福	祭祀、出行、剃头、修置产室、开渠、穿井、安碓硙、平治道涂、破屋坏垣、捕捉、畋猎、破土、启攒、整容、筑堤防、取鱼、修饰垣墙、整手足甲
2053-04-04	二零五三 癸酉[鸡]年 二月大十六	周五	清明节	无	无	癸酉 丙辰 庚午 辛巳	清明	谷雨 (4, 19)	鸡	白羊座	诸事不宜	祭祀、出行、结婚姻、宴会、嫁娶、安床、剃头、修造、求医疗病、上表章、上官、冠带、进人口、竖柱上梁、经络、开市、纳财、修置产室、开渠、穿井、安碓硙、破屋坏垣、栽种、牧养、破土、安葬、启攒、庆赐、补垣、临政、搬移、裁制、开仓、纳采、立券交易、修仓库、鼓铸、颁诏、解除、纳畜、出师、入宅、招贤、布政事、选将、整容、筑堤防、举正直、酝酿、求嗣、营建、缮城郭、施恩、安抚边境、宣政事、修饰垣墙、上册、苫盖、塞穴、整手足甲、修宫室、祈福
2053-04-05	二零五三 癸酉[鸡]年 二月大十七	周六	无	东方杜将军诞	无	癸酉 丙辰 辛未 癸巳	无	谷雨 (4, 19)	鸡	白羊座	诸事不宜	诸事不宜
2053-04-06	二零五三 癸酉[鸡]年 二月大十八	周日	无	至圣先师孔子讳辰	无	癸酉 丙辰 壬申 乙巳	无	谷雨 (4, 19)	鸡	白羊座	祭祀、沐浴、扫舍宇、覃恩、恤孤茕、雪冤	安床、开市、修置产室、开渠、穿井、平治道涂、破屋坏垣、伐木、捕捉、畋猎、启攒、补垣、开仓、鼓铸、布政事、筑堤防、取鱼、修饰垣墙、塞穴、远回
2053-04-07	二零五三 癸酉[鸡]年 二月大十九	周一	无	观音大士诞	世界卫生日	癸酉 丙辰 癸酉 丁巳	无	谷雨 (4, 19)	鸡	白羊座	祭祀、出行、结婚姻、嫁娶、沐浴、剃头、修造、求医疗病、上官、进人口、经络、纳财、扫舍宇、捕捉、安葬、临政、搬移、纳采、立券交易、赴任、解除、入宅、纳畜、整容、酝酿、取鱼、安抚边境、整手足甲、祈福	宴会、上表章、冠带、竖柱上梁、修置产室、开渠、穿井、安碓硙、平治道涂、破屋坏垣、栽种、牧养、庆赐、补垣、开仓、修仓库、乘船渡水、出师、招贤、筑堤防、选将、举正直、求嗣、营建、缮城郭、施恩、修饰垣墙、上册、修宫室
2053-04-08	二零五三 癸酉[鸡]年 二月大二十	周二	无	无	无	癸酉 丙辰 甲戌 己巳	无	谷雨 (4, 19)	鸡	白羊座	祭祀、沐浴、求医疗病、破屋坏垣、解除	诸事不忌
2053-04-09	二零五三 癸酉[鸡]年 二月大廿一	周三	无	普贤菩萨诞	无	癸酉 丙辰 乙亥 辛巳	无	谷雨 (4, 19)	鸡	白羊座	安床、沐浴、牧养、取鱼、纳畜	出行、结婚姻、嫁娶、修造、求医疗病、进人口、开市、畋猎、破土、安葬、启攒、开仓、纳采、立券交易、修仓库、解除、求嗣、整手足甲、祈福
2053-04-10	二零五三 癸酉[鸡]年 二月大廿二	周四	无	无	无	癸酉 丙辰 丙子 癸巳	无	谷雨 (4, 19)	鸡	白羊座	祭祀、宴会、沐浴、修造、上表章、上官、入学、进人口、竖柱上梁、经络、开市、纳财、安碓硙、栽种、牧养、安葬、庆赐、临政、裁制、开仓、纳采、立券交易、修仓库、赴任、解除、纳畜、筑堤防、举正直、酝酿、求嗣、缮城郭、施恩、修宫室、祈福、诉讼	远回
2053-04-11	二零五三 癸酉[鸡]年 二月大廿三	周五	无	无	无	癸酉 丙辰 丁丑 乙巳	无	谷雨 (4, 19)	鸡	白羊座	进人口、纳财、捕捉、栽种、牧养、恤孤茕、纳畜、覃恩、雪冤	剃头、冠带、修置产室、开渠、穿井、畋猎、破土、启攒、整容、筑堤防、布政事、取鱼、鼓铸、整手足甲、乘船渡水
2053-04-12	二零五三 癸酉[鸡]年 二月大廿四	周六	无	无	无	癸酉 丙辰 戊寅 丁巳	无	谷雨 (4, 19)	鸡	白羊座	出行、结婚姻、宴会、修造、求医疗病、上表章、上官、入学、竖柱上梁、开市、修置产室、开渠、穿井、安碓硙、栽种、牧养、庆赐、临政、搬移、裁制、纳采、立券交易、修仓库、颁诏、恤孤茕、解除、入宅、纳畜、招贤、覃恩、举正直、求嗣、雪冤、营建、缮城郭、施恩、宣政事、上册、修宫室、祈福	祭祀、伐木、畋猎、启攒、取鱼、针刺、乘船渡水、出师
2053-04-13	二零五三 癸酉[鸡]年 二月大廿五	周日	无	无	无	癸酉 丙辰 己卯 己巳	无	谷雨 (4, 19)	鸡	白羊座	覃恩、补垣、塞穴、恤孤茕、雪冤	出行、结婚姻、宴会、嫁娶、安床、修造、求医疗病、上表章、上官、冠带、进人口、竖柱上梁、经络、开市、纳财、修置产室、开渠、穿井、栽种、牧养、破土、安葬、启攒、庆赐、临政、搬移、开仓、纳采、立券交易、修仓库、颁诏、解除、纳畜、出师、招贤、布政事、选将、筑堤防、举正直、酝酿、疗目、针刺、求嗣、营建、缮城郭、施恩、安抚边境、宣政事、上册、修宫室、祈福
2053-04-14	二零五三 癸酉[鸡]年 二月大廿六	周一	无	无	无	癸酉 丙辰 庚辰 辛巳	无	谷雨 (4, 19)	鸡	白羊座	祭祀、恤孤茕、覃恩、雪冤	出行、结婚姻、宴会、嫁娶、安床、剃头、修造、求医疗病、上表章、上官、冠带、进人口、竖柱上梁、经络、开市、纳财、修置产室、开渠、穿井、安碓硙、平治道涂、破屋坏垣、伐木、栽种、牧养、破土、安葬、启攒、庆赐、补垣、临政、搬移、裁制、开仓、纳采、立券交易、修仓库、鼓铸、颁诏、解除、纳畜、出师、招贤、整容、布政事、选将、筑堤防、举正直、酝酿、求嗣、营建、缮城郭、施恩、宣政事、安抚边境、修饰垣墙、上册、塞穴、整手足甲、修宫室、祈福
2053-04-15	二零五三 癸酉[鸡]年 二月大廿七	周二	无	无	无	癸酉 丙辰 辛巳 癸巳	无	谷雨 (4, 19)	鸡	白羊座	沐浴、扫舍宇、恤孤茕、覃恩、雪冤	出行、结婚姻、嫁娶、安床、修造、上表章、冠带、进人口、竖柱上梁、修置产室、开渠、穿井、安碓硙、破屋坏垣、破土、安葬、启攒、补垣、搬移、裁制、纳采、修仓库、鼓铸、颁诏、招贤、筑堤防、求嗣、营建、缮城郭、修饰垣墙、宣政事、上册、塞穴、修宫室、祈福
2053-04-16	二零五三 癸酉[鸡]年 二月大廿八	周三	无	无	无	癸酉 丙辰 壬午 乙巳	无	谷雨 (4, 19)	鸡	白羊座	出行、结婚姻、宴会、嫁娶、修造、求医疗病、上表章、上官、进人口、竖柱上梁、经络、开市、纳财、栽种、牧养、安葬、庆赐、补垣、临政、搬移、裁制、开仓、纳采、立券交易、修仓库、颁诏、恤孤茕、解除、出师、纳畜、招贤、选将、覃恩、举正直、求嗣、雪冤、营建、缮城郭、施恩、安抚边境、宣政事、塞穴、上册、修宫室、祈福	祭祀、剃头、冠带、修置产室、开渠、穿井、安碓硙、破屋坏垣、畋猎、启攒、整容、筑堤防、取鱼、修饰垣墙、鼓铸、苫盖、整手足甲、入宅
2053-04-17	二零五三 癸酉[鸡]年 二月大廿九	周四	无	无	无	癸酉 丙辰 癸未 丁巳	无	谷雨 (4, 19)	鸡	白羊座	入宅、覃恩、赴任、恤孤茕、雪冤	出行、结婚姻、宴会、嫁娶、安床、剃头、修造、求医疗病、上表章、上官、冠带、进人口、竖柱上梁、经络、开市、纳财、修置产室、开渠、穿井、安碓硙、平治道涂、破屋坏垣、栽种、牧养、破土、安葬、启攒、庆赐、补垣、临政、搬移、裁制、开仓、纳采、立券交易、修仓库、鼓铸、颁诏、解除、纳畜、出师、招贤、布政事、选将、筑堤防、整容、举正直、酝酿、求嗣、营建、缮城郭、施恩、安抚边境、宣政事、修饰垣墙、上册、塞穴、修宫室、整手足甲、祈福
2053-04-18	二零五三 癸酉[鸡]年 二月大三十	周五	无	无	无	癸酉 丙辰 甲申 己巳	无	谷雨 (4, 19)	鸡	白羊座	沐浴、扫舍宇	出行、结婚姻、宴会、嫁娶、安床、剃头、修造、求医疗病、上表章、上官、冠带、进人口、竖柱上梁、经络、开市、纳财、修置产室、开渠、穿井、安碓硙、平治道涂、破屋坏垣、伐木、捕捉、畋猎、栽种、牧养、破土、安葬、启攒、庆赐、补垣、临政、搬移、裁制、开仓、纳采、立券交易、修仓库、鼓铸、颁诏、解除、纳畜、出师、招贤、布政事、选将、整容、筑堤防、举正直、酝酿、求嗣、营建、缮城郭、安抚边境、施恩、宣政事、修饰垣墙、取鱼、上册、远回、塞穴、整手足甲、修宫室、祈福
2053-04-19	二零五三 癸酉[鸡]年 三月小初一	周六	无	二殿楚江王诞	无	癸酉 丙辰 乙酉 辛巳	谷雨	立夏 (5, 5)	鸡	白羊座	祭祀、出行、结婚姻、嫁娶、沐浴、剃头、修造、求医疗病、上表章、上官、进人口、竖柱上梁、经络、开市、纳财、扫舍宇、捕捉、栽种、牧养、安葬、临政、搬移、裁制、纳采、修仓库、颁诏、恤孤茕、纳畜、解除、招贤、整容、选将、覃恩、酝酿、举正直、求嗣、雪冤、营建、缮城郭、取鱼、安抚边境、施恩、宣政事、上册、整手足甲、立券交易、祈福	宴会、冠带、修置产室、开渠、穿井、安碓硙、平治道涂、破屋坏垣、开仓、筑堤防、补垣、修饰垣墙、修宫室、乘船渡水、出师
2053-04-20	二零五三 癸酉[鸡]年 三月小初二	周日	无	无	无	癸酉 丙辰 丙戌 癸巳	无	立夏 (5, 5)	鸡	白羊座	祭祀、沐浴、求医疗病、解除	冠带、修置产室、开渠、穿井、安碓硙、平治道涂、伐木、破土、安葬、启攒、补垣、修仓库、鼓铸、颁诏、乘船渡水、纳畜、招贤、布政事、筑堤防、营建、修饰垣墙、取鱼、宣政事、上册、塞穴
2053-04-21	二零五三 癸酉[鸡]年 三月小初三	周一	无	三月三-玄天上帝诞	无	癸酉 丙辰 丁亥 乙巳	无	立夏 (5, 5)	鸡	金牛座	祭祀、宴会、安床、沐浴、上表章、上官、竖柱上梁、纳财、牧养、庆赐、临政、搬移、裁制、纳采、颁诏、恤孤茕、纳畜、招贤、覃恩、举正直、雪冤、施恩、宣政事、上册	嫁娶、剃头、修置产室、开渠、穿井、安碓硙、平治道涂、破屋坏垣、畋猎、破土、启攒、整容、筑堤防、补垣、修饰垣墙、取鱼
2053-04-22	二零五三 癸酉[鸡]年 三月小初四	周二	无	无	列宁诞辰纪念日	癸酉 丙辰 戊子 丁巳	无	立夏 (5, 5)	鸡	金牛座	祭祀、结婚姻、宴会、嫁娶、沐浴、上官、入学、进人口、竖柱上梁、经络、开市、纳财、牧养、庆赐、临政、裁制、纳采、立券交易、赴任、入宅、纳畜、出师、选将、举正直、酝酿、安抚边境、施恩、祈福、诉讼	修置产室、开渠、穿井、平治道涂、破屋坏垣、破土、启攒、补垣、营建、修饰垣墙、远回
2053-04-23	二零五三 癸酉[鸡]年 三月小初五	周三	无	无	世界图书和版权日	癸酉 丙辰 己丑 己巳	无	立夏 (5, 5)	鸡	金牛座	进人口、纳财、捕捉、取鱼、纳畜	出行、结婚姻、宴会、嫁娶、安床、修造、求医疗病、上表章、上官、冠带、竖柱上梁、经络、开市、修置产室、开渠、穿井、安碓硙、平治道涂、破屋坏垣、栽种、破土、安葬、启攒、庆赐、补垣、临政、搬移、裁制、开仓、纳采、立券交易、修仓库、鼓铸、颁诏、解除、乘船渡水、招贤、布政事、筑堤防、举正直、酝酿、营建、缮城郭、施恩、宣政事、修饰垣墙、上册、修宫室
2053-04-24	二零五三 癸酉[鸡]年 三月小初六	周四	无	无	无	癸酉 丙辰 庚寅 辛巳	无	立夏 (5, 5)	鸡	金牛座	出行、结婚姻、宴会、求医疗病、上表章、上官、入学、竖柱上梁、开市、纳财、牧养、庆赐、临政、搬移、裁制、开仓、纳采、立券交易、颁诏、恤孤茕、解除、招贤、选将、覃恩、举正直、求嗣、雪冤、施恩、安抚边境、宣政事、上册、祈福	祭祀、嫁娶、平治道涂、破屋坏垣、伐木、畋猎、营建、筑堤防、取鱼、补垣、修饰垣墙、整手足甲、针刺、乘船渡水
2053-04-25	二零五三 癸酉[鸡]年 三月小初七	周五	无	无	无	癸酉 丙辰 辛卯 癸巳	无	立夏 (5, 5)	鸡	金牛座	塞穴	出行、结婚姻、宴会、嫁娶、安床、修造、求医疗病、上表章、上官、冠带、进人口、竖柱上梁、经络、开市、纳财、修置产室、开渠、穿井、安碓硙、平治道涂、破屋坏垣、栽种、牧养、破土、安葬、启攒、庆赐、补垣、临政、搬移、开仓、纳采、立券交易、修仓库、颁诏、解除、纳畜、出师、招贤、布政事、选将、筑堤防、举正直、酝酿、疗目、针刺、求嗣、营建、缮城郭、施恩、安抚边境、宣政事、修饰垣墙、上册、修宫室、祈福
2053-04-26	二零五三 癸酉[鸡]年 三月小初八	周六	无	六殿卞城王诞	世界知识产权日	癸酉 丙辰 壬辰 乙巳	无	立夏 (5, 5)	鸡	金牛座	祭祀、恤孤茕、覃恩、雪冤	安床、剃头、冠带、开市、修置产室、开渠、穿井、平治道涂、破屋坏垣、伐木、畋猎、破土、启攒、补垣、开仓、鼓铸、整容、布政事、筑堤防、取鱼、修饰垣墙、塞穴、整手足甲
2053-04-27	二零五三 癸酉[鸡]年 三月小初九	周日	无	无	无	癸酉 丙辰 癸巳 丁巳	无	立夏 (5, 5)	鸡	金牛座	嫁娶、沐浴、剃头、修造、求医疗病、上官、经络、开市、纳财、扫舍宇、栽种、牧养、临政、搬移、开仓、纳采、赴任、解除、恤孤茕、纳畜、入宅、整容、选将、酝酿、雪冤、安抚边境、整手足甲、立券交易	出行、结婚姻、宴会、上表章、冠带、竖柱上梁、立券、修置产室、开渠、穿井、安碓硙、平治道涂、破屋坏垣、破土、安葬、启攒、庆赐、补垣、开张、裁制、修仓库、鼓铸、颁诏、招贤、布政事、筑堤防、求嗣、营建、缮城郭、修饰垣墙、宣政事、上册、塞穴、修宫室、祈福
2053-04-28	二零五三 癸酉[鸡]年 三月小初十	周一	无	无	无	癸酉 丙辰 甲午 己巳	无	立夏 (5, 5)	鸡	金牛座	诸事不宜	祭祀、出行、结婚姻、宴会、嫁娶、安床、剃头、修造、求医疗病、上表章、上官、冠带、进人口、竖柱上梁、经络、开市、纳财、修置产室、开渠、穿井、安碓硙、平治道涂、破屋坏垣、栽种、牧养、破土、安葬、启攒、庆赐、补垣、临政、搬移、裁制、开仓、纳采、立券交易、修仓库、鼓铸、颁诏、解除、纳畜、出师、入宅、招贤、布政事、选将、整容、筑堤防、举正直、酝酿、求嗣、营建、缮城郭、施恩、安抚边境、宣政事、修饰垣墙、上册、苫盖、塞穴、整手足甲、修宫室、祈福
2053-04-29	二零五三 癸酉[鸡]年 三月小十一	周二	无	无	无	癸酉 丙辰 乙未 辛巳	无	立夏 (5, 5)	鸡	金牛座	诸事不宜	诸事不宜
2053-04-30	二零五三 癸酉[鸡]年 三月小十二	周三	无	无	无	癸酉 丙辰 丙申 癸巳	无	立夏 (5, 5)	鸡	金牛座	祭祀、沐浴、扫舍宇	出行、结婚姻、宴会、嫁娶、安床、剃头、修造、求医疗病、上表章、上官、冠带、进人口、竖柱上梁、经络、开市、纳财、修置产室、开渠、穿井、安碓硙、平治道涂、破屋坏垣、伐木、捕捉、畋猎、栽种、牧养、破土、安葬、启攒、庆赐、补垣、临政、搬移、裁制、开仓、纳采、立券交易、修仓库、鼓铸、颁诏、解除、纳畜、出师、招贤、整容、选将、布政事、筑堤防、举正直、酝酿、求嗣、营建、缮城郭、安抚边境、施恩、宣政事、修饰垣墙、取鱼、上册、远回、塞穴、整手足甲、修宫室、祈福
