2055-09-01	二零五五 乙亥[猪]年	七月小	初十	周三	乙亥 甲申 庚戌 辛巳	无	白露 (9, 7)	无	无	无	猪	处女座	宴会、上表章、进人口、竖柱上梁、开市、纳财、栽种、牧养、搬移、缮城郭、裁制、开仓、上册、修宫室、覃恩、恤孤茕、补垣、雪冤、庆赐、布政事、入宅、立券交易、纳畜、塞穴	祭祀、结婚姻、上官、破土、启攒、取鱼、招贤、举正直、出师、乘船渡水、施恩
2055-09-02	二零五五 乙亥[猪]年	七月小	十一	周四	乙亥 甲申 辛亥 癸巳	无	白露 (9, 7)	无	无	无	猪	处女座	祭祀、沐浴、平治道涂、覃恩、恤孤茕、雪冤、修饰垣墙	出行、结婚姻、宴会、嫁娶、安床、修造、求医疗病、上表章、上官、冠带、进人口、竖柱上梁、经络、开市、纳财、修置产室、开渠、穿井、栽种、牧养、破土、安葬、启攒、搬移、祈福、缮城郭、开仓、裁制、上册、修宫室、颁诏、求嗣、庆赐、招贤、布政事、宣政事、安抚边境、施恩、立券交易、临政、纳畜、举正直、解除、修仓库、酝酿、选将、鼓铸、营建、纳采、出师、筑堤防
2055-09-03	二零五五 乙亥[猪]年	七月小	十二	周五	乙亥 甲申 壬子 乙巳	无	白露 (9, 7)	无	无	中国抗日战争胜利纪念日	猪	处女座	祭祀、出行、结婚姻、宴会、嫁娶、沐浴、修造、上官、冠带、进人口、竖柱上梁、经络、安碓硙、牧养、安葬、搬移、祈福、缮城郭、裁制、修宫室、颁诏、求嗣、覃恩、恤孤茕、雪冤、庆赐、招贤、宣政事、施恩、临政、纳畜、举正直、酝酿、营建、纳采	剃头、修置产室、开渠、穿井、畋猎、取鱼、整容
2055-09-04	二零五五 乙亥[猪]年	七月小	十三	周六	乙亥 甲申 癸丑 丁巳	无	白露 (9, 7)	无	长真谭真人诞-大势至菩萨诞	无	猪	处女座	祭祀、宴会、修造、求医疗病、上表章、上官、竖柱上梁、纳财、捕捉、栽种、牧养、安葬、祈福、缮城郭、开仓、裁制、上册、修宫室、颁诏、求嗣、覃恩、恤孤茕、雪冤、庆赐、招贤、宣政事、施恩、临政、纳畜、举正直、解除、修仓库、营建	冠带、畋猎、远回、取鱼
2055-09-05	二零五五 乙亥[猪]年	七月小	十四	周日	乙亥 甲申 甲寅 己巳	无	白露 (9, 7)	无	无	无	猪	处女座	诸事不宜	诸事不宜
2055-09-06	二零五五 乙亥[猪]年	七月小	十五	周一	乙亥 甲申 乙卯 辛巳	无	白露 (9, 7)	无	中元节	无	猪	处女座	祭祀、出行、结婚姻、宴会、嫁娶、安床、修造、上官、搬移、祈福、求嗣、入宅、安抚边境、立券交易、临政、赴任、选将、纳采	剃头、求医疗病、上表章、冠带、竖柱上梁、修置产室、开渠、穿井、安碓硙、平治道涂、破屋坏垣、栽种、牧养、安葬、缮城郭、开仓、上册、裁制、修宫室、颁诏、庆赐、补垣、招贤、整容、布政事、宣政事、施恩、修饰垣墙、纳畜、举正直、解除、塞穴、修仓库、鼓铸、营建、整手足甲、出师、筑堤防
2055-09-07	二零五五 乙亥[猪]年	七月小	十六	周二	乙亥 乙酉 丙辰 癸巳	白露	秋分 (9, 23)	无	无	无	猪	处女座	祭祀、覃恩、恤孤茕、雪冤	剃头、求医疗病、开渠、穿井、开仓、补垣、整容、布政事、解除、塞穴、出师、筑堤防
2055-09-08	二零五五 乙亥[猪]年	七月小	十七	周三	乙亥 乙酉 丁巳 乙巳	无	秋分 (9, 23)	无	无	世界扫盲日	猪	处女座	祭祀、结婚姻、宴会、上表章、上官、入学、进人口、竖柱上梁、经络、开市、纳财、祈福、裁制、上册、庆赐、施恩、立券交易、临政、纳畜、举正直、酝酿、纳采	出行、剃头、修置产室、开渠、穿井、平治道涂、破屋坏垣、栽种、破土、安葬、启攒、补垣、整容、营建、修饰垣墙
2055-09-09	二零五五 乙亥[猪]年	七月小	十八	周四	乙亥 乙酉 戊午 丁巳	无	秋分 (9, 23)	无	西王母诞	毛泽东逝世纪念日	猪	处女座	祭祀、捕捉	出行、结婚姻、宴会、嫁娶、安床、修造、求医疗病、上表章、上官、冠带、进人口、竖柱上梁、经络、开市、纳财、修置产室、开渠、穿井、栽种、牧养、破土、安葬、启攒、搬移、祈福、缮城郭、开仓、裁制、上册、修宫室、颁诏、求嗣、庆赐、补垣、取鱼、招贤、布政事、宣政事、安抚边境、施恩、立券交易、临政、纳畜、举正直、解除、塞穴、乘船渡水、修仓库、酝酿、选将、鼓铸、营建、纳采、出师、筑堤防、苫盖
2055-09-10	二零五五 乙亥[猪]年	七月小	十九	周五	乙亥 乙酉 己未 己巳	无	秋分 (9, 23)	无	太岁诞	中国教师节	猪	处女座	出行、宴会、上表章、上官、入学、进人口、开市、纳财、牧养、搬移、祈福、裁制、上册、颁诏、求嗣、覃恩、恤孤茕、雪冤、庆赐、招贤、宣政事、施恩、临政、纳畜、举正直、解除	结婚姻、嫁娶、平治道涂、破屋坏垣、伐木、畋猎、破土、开仓、补垣、取鱼、修饰垣墙、营建、纳采、整手足甲、筑堤防
2055-09-11	二零五五 乙亥[猪]年	七月小	二十	周六	乙亥 乙酉 庚申 辛巳	无	秋分 (9, 23)	无	无	无	猪	处女座	祭祀、沐浴、剃头、纳财、扫舍宇、栽种、牧养、缮城郭、裁制、覃恩、补垣、恤孤茕、雪冤、整容、入宅、塞穴、酝酿、整手足甲、筑堤防	安床、进人口、修置产室、开渠、穿井、畋猎、修宫室、取鱼、针刺、布政事、疗目
2055-09-12	二零五五 乙亥[猪]年	七月小	廿一	周日	乙亥 乙酉 辛酉 癸巳	无	秋分 (9, 23)	无	无	无	猪	处女座	祭祀、沐浴、扫舍宇	出行、结婚姻、宴会、嫁娶、安床、剃头、修造、求医疗病、上表章、上官、冠带、进人口、竖柱上梁、经络、开市、纳财、修置产室、开渠、穿井、安碓硙、平治道涂、破屋坏垣、伐木、栽种、牧养、破土、安葬、启攒、搬移、祈福、缮城郭、裁制、开仓、上册、修宫室、颁诏、求嗣、庆赐、补垣、取鱼、招贤、整容、布政事、宣政事、安抚边境、施恩、立券交易、修饰垣墙、临政、纳畜、举正直、解除、塞穴、乘船渡水、修仓库、酝酿、选将、鼓铸、营建、纳采、整手足甲、出师、筑堤防、苫盖
2055-09-13	二零五五 乙亥[猪]年	七月小	廿二	周一	乙亥 乙酉 壬戌 乙巳	无	秋分 (9, 23)	无	增福财神诞	无	猪	处女座	祭祀、出行、沐浴、剃头、竖柱上梁、扫舍宇、栽种、诉讼、搬移、缮城郭、裁制、修宫室、整容、施恩、临政、举正直、解除、赴任、整手足甲	结婚姻、宴会、嫁娶、修造、求医疗病、上表章、上官、进人口、经络、开市、纳财、修置产室、开渠、穿井、牧养、破土、安葬、启攒、祈福、开仓、上册、求嗣、庆赐、针刺、安抚边境、立券交易、纳畜、修仓库、酝酿、选将、纳采、出师
2055-09-14	二零五五 乙亥[猪]年	七月小	廿三	周二	乙亥 乙酉 癸亥 丁巳	无	秋分 (9, 23)	无	无	世界清洁地球日	猪	处女座	宴会、沐浴、上表章、进人口、竖柱上梁、经络、开市、纳财、栽种、牧养、祈福、缮城郭、裁制、上册、修宫室、求嗣、庆赐、补垣、立券交易、解除、塞穴	祭祀、嫁娶、破土、启攒、纳畜、招贤、选将、安抚边境、整手足甲、出师、乘船渡水
2055-09-15	二零五五 乙亥[猪]年	七月小	廿四	周三	乙亥 乙酉 甲子 己巳	无	秋分 (9, 23)	无	无	无	猪	处女座	祭祀、沐浴、平治道涂、覃恩、恤孤茕、雪冤、修饰垣墙	出行、结婚姻、宴会、嫁娶、安床、修造、求医疗病、上表章、上官、冠带、进人口、竖柱上梁、经络、开市、纳财、修置产室、开渠、穿井、捕捉、畋猎、栽种、牧养、破土、安葬、启攒、搬移、祈福、缮城郭、开仓、裁制、上册、修宫室、颁诏、求嗣、庆赐、取鱼、招贤、布政事、宣政事、安抚边境、施恩、立券交易、临政、纳畜、举正直、解除、修仓库、酝酿、选将、鼓铸、营建、纳采、出师、筑堤防
2055-09-16	二零五五 乙亥[猪]年	七月小	廿五	周四	乙亥 乙酉 乙丑 辛巳	无	秋分 (9, 23)	无	无	无	猪	处女座	祭祀、出行、结婚姻、宴会、修造、上官、进人口、竖柱上梁、经络、安碓硙、牧养、搬移、祈福、缮城郭、裁制、修宫室、颁诏、求嗣、覃恩、恤孤茕、雪冤、庆赐、招贤、入宅、宣政事、施恩、临政、纳畜、举正直、赴任、酝酿、营建、纳采	修置产室、畋猎、开仓、取鱼
2055-09-17	二零五五 乙亥[猪]年	七月小	廿六	周五	乙亥 乙酉 丙寅 癸巳	无	秋分 (9, 23)	无	无	无	猪	处女座	沐浴、捕捉、覃恩、恤孤茕、雪冤	祭祀、安床、冠带、进人口、经络、开市、纳财、修置产室、开渠、穿井、安碓硙、破屋坏垣、畋猎、开仓、修宫室、补垣、取鱼、修饰垣墙、塞穴、酝酿、远回、鼓铸、筑堤防
2055-09-18	二零五五 乙亥[猪]年	七月小	廿七	周六	乙亥 乙酉 丁卯 乙巳	无	秋分 (9, 23)	无	无	“九·一八”事变纪念日	猪	处女座	诸事不宜	诸事不宜
2055-09-19	二零五五 乙亥[猪]年	七月小	廿八	周日	乙亥 乙酉 戊辰 丁巳	无	秋分 (9, 23)	无	无	无	猪	处女座	覃恩、恤孤茕、雪冤	出行、剃头、修造、求医疗病、上表章、上官、竖柱上梁、修置产室、开渠、穿井、安碓硙、破屋坏垣、祈福、缮城郭、开仓、裁制、上册、修宫室、颁诏、求嗣、补垣、招贤、整容、宣政事、施恩、修饰垣墙、临政、举正直、解除、塞穴、修仓库、鼓铸、营建、纳采、整手足甲、出师、筑堤防
2055-09-20	二零五五 乙亥[猪]年	七月小	廿九	周一	乙亥 乙酉 己巳 己巳	无	秋分 (9, 23)	无	杨公忌	全国爱牙日	猪	处女座	祭祀、结婚姻、宴会、上表章、上官、入学、进人口、竖柱上梁、经络、开市、纳财、安碓硙、祈福、缮城郭、裁制、上册、修宫室、庆赐、安抚边境、施恩、立券交易、临政、纳畜、举正直、修仓库、酝酿、选将、纳采、筑堤防	出行、立券、破土、安葬、启攒、开张
2055-09-21	二零五五 乙亥[猪]年	八月小	初一	周二	乙亥 乙酉 庚午 辛巳	无	秋分 (9, 23)	无	许真君诞	国际和平日	猪	处女座	祭祀、捕捉、覃恩、恤孤茕、雪冤、入宅	安床、冠带、经络、开市、修置产室、开渠、穿井、畋猎、启攒、开仓、修宫室、补垣、取鱼、布政事、立券交易、塞穴、乘船渡水、酝酿、鼓铸、整手足甲、筑堤防、苫盖
2055-09-22	二零五五 乙亥[猪]年	八月小	初二	周三	乙亥 乙酉 辛未 癸巳	无	秋分 (9, 23)	无	无	无	猪	处女座	宴会、上表章、上官、入学、进人口、开市、纳财、牧养、搬移、祈福、裁制、上册、颁诏、求嗣、覃恩、恤孤茕、雪冤、庆赐、招贤、宣政事、安抚边境、施恩、临政、纳畜、举正直、解除、选将	平治道涂、破屋坏垣、伐木、畋猎、安葬、启攒、开仓、补垣、取鱼、修饰垣墙、乘船渡水、酝酿、营建、筑堤防
2055-09-23	二零五五 乙亥[猪]年	八月小	初三	周四	乙亥 乙酉 壬申 乙巳	秋分	寒露 (10, 8)	无	司命灶君诞	无	猪	天秤座	祭祀、沐浴、剃头、经络、纳财、扫舍宇、栽种、牧养、缮城郭、裁制、补垣、覃恩、恤孤茕、雪冤、整容、安抚边境、塞穴、酝酿、选将、整手足甲、筑堤防	出行、结婚姻、宴会、嫁娶、安床、修造、求医疗病、上表章、上官、进人口、竖柱上梁、开市、修置产室、开渠、穿井、安葬、搬移、祈福、开仓、上册、修宫室、颁诏、求嗣、庆赐、针刺、招贤、布政事、宣政事、疗目、施恩、立券交易、临政、纳畜、举正直、解除、营建、纳采、出师
2055-09-24	二零五五 乙亥[猪]年	八月小	初四	周五	乙亥 乙酉 癸酉 丁巳	无	寒露 (10, 8)	无	无	无	猪	天秤座	祭祀、沐浴、扫舍宇	出行、结婚姻、宴会、嫁娶、安床、剃头、修造、求医疗病、上表章、上官、冠带、进人口、竖柱上梁、经络、开市、纳财、修置产室、开渠、穿井、安碓硙、平治道涂、破屋坏垣、伐木、栽种、牧养、破土、安葬、启攒、搬移、祈福、缮城郭、裁制、开仓、上册、修宫室、颁诏、求嗣、庆赐、补垣、取鱼、招贤、整容、布政事、宣政事、安抚边境、施恩、立券交易、修饰垣墙、临政、纳畜、举正直、解除、塞穴、乘船渡水、修仓库、酝酿、选将、鼓铸、营建、纳采、整手足甲、出师、筑堤防、苫盖
2055-09-25	二零五五 乙亥[猪]年	八月小	初五	周六	乙亥 乙酉 甲戌 己巳	无	寒露 (10, 8)	无	雷声大帝诞	无	猪	天秤座	祭祀、沐浴、剃头、扫舍宇、栽种、诉讼、整容、施恩、临政、举正直、解除、赴任、整手足甲	出行、宴会、嫁娶、修造、求医疗病、上表章、上官、进人口、经络、开市、纳财、修置产室、牧养、破土、安葬、启攒、祈福、开仓、上册、求嗣、庆赐、针刺、安抚边境、立券交易、纳畜、乘船渡水、修仓库、酝酿、选将、纳采、出师
2055-09-26	二零五五 乙亥[猪]年	八月小	初六	周日	乙亥 乙酉 乙亥 辛巳	无	寒露 (10, 8)	无	无	无	猪	天秤座	出行、宴会、沐浴、上表章、进人口、竖柱上梁、经络、开市、纳财、牧养、祈福、缮城郭、裁制、上册、修宫室、颁诏、求嗣、覃恩、补垣、恤孤茕、雪冤、庆赐、入宅、宣政事、立券交易、解除、塞穴、赴任、营建	祭祀、嫁娶、畋猎、破土、启攒、取鱼、整手足甲
2055-09-27	二零五五 乙亥[猪]年	八月小	初七	周一	乙亥 乙酉 丙子 癸巳	无	寒露 (10, 8)	无	无	世界旅游日	猪	天秤座	祭祀、沐浴、平治道涂、修饰垣墙	出行、结婚姻、宴会、嫁娶、安床、修造、求医疗病、上表章、上官、冠带、进人口、竖柱上梁、经络、开市、纳财、修置产室、开渠、穿井、捕捉、畋猎、栽种、牧养、破土、安葬、启攒、搬移、祈福、缮城郭、裁制、上册、开仓、修宫室、颁诏、求嗣、庆赐、取鱼、招贤、布政事、宣政事、安抚边境、施恩、立券交易、临政、纳畜、举正直、解除、修仓库、酝酿、选将、鼓铸、营建、纳采、出师、筑堤防
2055-09-28	二零五五 乙亥[猪]年	八月小	初八	周二	乙亥 乙酉 丁丑 乙巳	无	寒露 (10, 8)	无	无	无	猪	天秤座	结婚姻、宴会、嫁娶、修造、进人口、竖柱上梁、经络、安碓硙、牧养、缮城郭、裁制、修宫室、庆赐、纳畜、酝酿、纳采	剃头、求医疗病、上表章、开市、修置产室、整容、选将、安抚边境、解除、出师、开仓、上册
2055-09-29	二零五五 乙亥[猪]年	八月小	初九	周三	乙亥 乙酉 戊寅 丁巳	无	寒露 (10, 8)	无	无	无	猪	天秤座	沐浴、捕捉、覃恩、恤孤茕、雪冤	祭祀、安床、冠带、进人口、经络、开市、纳财、修置产室、开渠、穿井、安碓硙、破屋坏垣、畋猎、启攒、开仓、修宫室、补垣、取鱼、布政事、修饰垣墙、塞穴、酝酿、远回、鼓铸、筑堤防
2055-09-30	二零五五 乙亥[猪]年	八月小	初十	周四	乙亥 乙酉 己卯 己巳	无	寒露 (10, 8)	无	北斗大帝诞	无	猪	天秤座	诸事不宜	诸事不宜
