2055-01-01	2054-12-4	30	危	五	甲戌 丙子 丁未	无	小寒 (1, 5)	元旦节	无	无	祭祀 祈福 求嗣 斋醮 开光 入学 订盟 冠笄 伐木 修造 动土 起基 放水 交易 开池	造桥 安门 理发 造庙 栽种 作灶
2055-01-02	2054-12-5	30	成	六	甲戌 丙子 戊申	无	小寒 (1, 5)	无	无	无	解除 坏垣 馀事勿取	诸事不宜
2055-01-03	2054-12-6	30	收	日	甲戌 丙子 己酉	无	小寒 (1, 5)	无	无	无	沐浴 理发 扫舍	伐木 纳畜 上梁 入宅 作灶 造畜稠 嫁娶 安葬 作梁 造船 安门
2055-01-04	2054-12-7	30	开	一	甲戌 丙子 庚戌	无	小寒 (1, 5)	无	无	无	祭祀 开光 祈福 解除 作梁 动土 安床 掘井 栽种 纳畜 破土 移柩	嫁娶 出行 赴任 盖屋 入殓 入宅 移徙 出火 进人口 安葬
2055-01-05	2054-12-8	30	开	二	甲戌 丁丑 辛亥	小寒	大寒 (1, 20)	无	无	无	订盟 纳采 会亲友 祭祀 斋醮 沐浴 塑绘 出火 开光 竖柱 上梁 开市 交易 立券 作梁 开柱眼 伐木 架马 安门 安床 拆卸 牧养 造畜稠 掘井	造庙 嫁娶 出行 动土 安葬 行丧
2055-01-06	2054-12-9	30	闭	三	甲戌 丁丑 壬子	无	大寒 (1, 20)	无	无	无	交易 立券 纳财 安床 裁衣 造畜稠 安葬 谢土 启钻 除服 成服 修坟 立碑 移柩 入殓	开光 嫁娶 开市 动土 破土
2055-01-07	2054-12-10	30	建	四	甲戌 丁丑 癸丑	无	大寒 (1, 20)	无	无	无	祭祀 解除 教牛马 会亲友 馀事勿取	破土 动土 安葬
2055-01-08	2054-12-11	30	除	五	甲戌 丁丑 甲寅	无	大寒 (1, 20)	无	无	无	纳采 订盟 移徙 纳财 开市 交易 立券 入宅 会亲友 解除 求医 治病 入学 安床 安门 安香 出火 拆卸 扫舍 挂匾 开生坟 合寿木 破土 修坟 启钻 入殓	探病 祭祀 出行 上梁 盖屋 谢土 安葬
2055-01-09	2054-12-12	30	满	六	甲戌 丁丑 乙卯	无	大寒 (1, 20)	无	无	无	嫁娶 订盟 纳采 祭祀 祈福 求嗣 会亲友 解除 出行 入学 纳财 开市 交易 立券 习艺 经络 安床 开仓 出货财 纳畜 安葬 启钻 修坟 入殓	入宅 开光 动土
2055-01-10	2054-12-13	30	平	日	甲戌 丁丑 丙辰	无	大寒 (1, 20)	无	无	无	祭祀 冠笄 嫁娶 会亲友 进人口 裁衣 结网 平治道涂	移徙 入宅 造庙 作灶 治病 安葬
2055-01-11	2054-12-14	30	定	一	甲戌 丁丑 丁巳	无	大寒 (1, 20)	无	无	无	祭祀 安碓磑 结网 馀事勿取	嫁娶 安葬
2055-01-12	2054-12-15	30	执	二	甲戌 丁丑 戊午	无	大寒 (1, 20)	无	无	无	嫁娶 祭祀 沐浴 裁衣 出行 理发 移徙 捕捉 畋猎 放水 入宅 除服 成服 启钻 安葬 移柩 入殓	盖屋 开市 动土 破土
2055-01-13	2054-12-16	30	破	三	甲戌 丁丑 己未	无	大寒 (1, 20)	无	无	无	破屋 坏垣 馀事勿取	嫁娶 开市 安葬
2055-01-14	2054-12-17	30	危	四	甲戌 丁丑 庚申	无	大寒 (1, 20)	无	无	无	纳采 订盟 祭祀 求嗣 出火 塑绘 裁衣 会亲友 入学 拆卸 扫舍 造仓 挂匾 掘井 开池 结网 栽种 纳畜 破土 修坟 立碑 安葬 入殓	祈福 嫁娶 造庙 安床 谢土
2055-01-15	2054-12-18	30	成	五	甲戌 丁丑 辛酉	无	大寒 (1, 20)	无	无	无	入殓 除服 成服 移柩 启钻 安葬 修坟 立碑	开市 伐木 嫁娶 作梁
2055-01-16	2054-12-19	30	收	六	甲戌 丁丑 壬戌	无	大寒 (1, 20)	无	无	无	祭祀 作灶 入殓 除服 馀事勿取	开市 安床
2055-01-17	2054-12-20	30	开	日	甲戌 丁丑 癸亥	无	大寒 (1, 20)	无	无	无	塑绘 开光 沐浴 冠笄 会亲友 作灶 放水 造畜稠	嫁娶 入殓 安葬 出行
2055-01-18	2054-12-21	30	闭	一	甲戌 丁丑 甲子	无	大寒 (1, 20)	无	无	无	祭祀 沐浴 祈福 斋醮 订盟 纳采 裁衣 拆卸 起基 竖柱 上梁 安床 入殓 除服 成服 移柩 启钻 挂匾 求嗣 出行 合帐 造畜稠	开仓 嫁娶 移徙 入宅
2055-01-19	2054-12-22	30	建	二	甲戌 丁丑 乙丑	无	大寒 (1, 20)	无	无	无	祭祀 解除 馀事勿取	诸事不宜
2055-01-20	2054-12-23	30	除	三	甲戌 丁丑 丙寅	大寒	立春 (2, 4)	无	无	无	沐浴 解除 订盟 纳采 裁衣 冠笄 拆卸 修造 动土 移徙 入宅 除服 成服 移柩 破土 启钻 安葬 扫舍 修坟 伐木 纳财 交易 立券	作灶 祭祀 上梁 出行
2055-01-21	2054-12-24	30	满	四	甲戌 丁丑 丁卯	无	立春 (2, 4)	无	无	无	出行 嫁娶 订盟 纳采 入殓 安床 启钻 安葬 祭祀 裁衣 会亲友 进人口	无
2055-01-22	2054-12-25	30	平	五	甲戌 丁丑 戊辰	无	立春 (2, 4)	无	无	无	修饰垣墙 平治道涂 入殓 移柩 馀事勿取	嫁娶 移徙 入宅 开光
2055-01-23	2054-12-26	30	定	六	甲戌 丁丑 己巳	无	立春 (2, 4)	无	无	无	会亲友 纳采 进人口 修造 动土 竖柱 上梁 祭祀 开光 塑绘 祈福 斋醮 嫁娶 安床 移徙 入宅 安香 纳畜	出行 治病 安葬 开市
2055-01-24	2054-12-27	30	执	日	甲戌 丁丑 庚午	无	立春 (2, 4)	无	无	无	祭祀 会亲友 出行 订盟 纳采 沐浴 修造 动土 祈福 斋醮 嫁娶 拆卸 安床 入殓 移柩 安葬 谢土 赴任 裁衣 竖柱 上梁 伐木 捕捉 栽种 破土 安门	盖屋 开市 作灶 入宅
2055-01-25	2054-12-28	30	破	一	甲戌 丁丑 辛未	无	立春 (2, 4)	无	无	无	解除 破屋 坏垣 馀事勿取	诸事不宜
2055-01-26	2054-12-29	30	危	二	甲戌 丁丑 壬申	无	立春 (2, 4)	无	无	无	塑绘 开光 出行 订盟 纳采 除服 成服 嫁娶 纳婿 入殓 移柩 启钻 安葬 立碑	入宅 安床
2055-01-27	2054-12-30	30	成	三	甲戌 丁丑 癸酉	无	立春 (2, 4)	无	无	无	入殓 除服 成服 移柩 启钻 安葬 立碑 馀事勿取	破土 伐木
2055-01-28	2055-1-1	29	收	四	乙亥 丁丑 甲戌	无	立春 (2, 4)	无	无	无	祭祀 祈福 斋醮 塑绘 开光 除服 成服 入殓 作灶 嫁娶 捕捉 畋猎 纳财	开仓 盖屋 安葬 安床
2055-01-29	2055-1-2	29	开	五	乙亥 丁丑 乙亥	无	立春 (2, 4)	无	无	无	祭祀 出行 沐浴 裁衣 祈福 斋醮 订盟 纳采 嫁娶 安机械 开市 立券 安碓磑 纳畜	栽种 入殓 安葬
2055-01-30	2055-1-3	29	闭	六	乙亥 丁丑 丙子	无	立春 (2, 4)	无	无	无	祭祀 祈福 斋醮 沐浴 安床 安机械 造车器 入殓 移柩 启钻 安葬 立碑 合帐 经络 交易	作灶 掘井 嫁娶 入宅
2055-01-31	2055-1-4	29	建	日	乙亥 丁丑 丁丑	无	立春 (2, 4)	无	无	无	解除 扫舍 祭祀 教牛马 馀事勿取	无
