2056-08-01	二零五六 丙子[鼠]年	六月小	二十	周二	丙子 乙未 乙酉 辛巳	无	立秋 (8, 7)	无	无	中国人民解放军建军节	鼠	狮子座	沐浴、扫舍宇	祭祀、出行、结婚姻、宴会、嫁娶、安床、剃头、修造、求医疗病、上表章、上官、冠带、进人口、竖柱上梁、经络、开市、纳财、修置产室、开渠、穿井、安碓硙、平治道涂、破屋坏垣、栽种、牧养、破土、安葬、启攒、搬移、祈福、缮城郭、裁制、上册、开仓、修宫室、颁诏、求嗣、庆赐、补垣、针刺、招贤、整容、布政事、宣政事、安抚边境、入宅、施恩、立券交易、修饰垣墙、临政、纳畜、举正直、解除、塞穴、修仓库、酝酿、选将、鼓铸、营建、纳采、整手足甲、出师、筑堤防
2056-08-02	二零五六 丙子[鼠]年	六月小	廿一	周三	丙子 乙未 丙戌 癸巳	无	立秋 (8, 7)	无	无	无	鼠	狮子座	入宅	出行、结婚姻、宴会、嫁娶、安床、剃头、修造、求医疗病、上表章、上官、冠带、进人口、竖柱上梁、经络、开市、纳财、修置产室、开渠、穿井、安碓硙、平治道涂、破屋坏垣、栽种、牧养、破土、安葬、启攒、搬移、祈福、缮城郭、裁制、上册、开仓、修宫室、颁诏、求嗣、庆赐、补垣、招贤、整容、布政事、宣政事、安抚边境、施恩、立券交易、修饰垣墙、临政、纳畜、举正直、解除、塞穴、修仓库、酝酿、选将、鼓铸、营建、纳采、整手足甲、出师、筑堤防
2056-08-03	二零五六 丙子[鼠]年	六月小	廿二	周四	丙子 乙未 丁亥 乙巳	无	立秋 (8, 7)	无	无	无	鼠	狮子座	宴会、沐浴、冠带、竖柱上梁、经络、裁制、恤孤茕、庆赐、雪冤、临政、纳畜、酝酿	嫁娶、剃头、求医疗病、上表章、开市、修置产室、开渠、穿井、平治道涂、破屋坏垣、栽种、破土、安葬、启攒、开仓、上册、补垣、取鱼、整容、安抚边境、修饰垣墙、解除、乘船渡水、选将、营建、出师、筑堤防
2056-08-04	二零五六 丙子[鼠]年	六月小	廿三	周五	丙子 乙未 戊子 丁巳	无	立秋 (8, 7)	无	无	无	鼠	狮子座	祭祀、沐浴、剃头、捕捉、裁制、整容	出行、结婚姻、宴会、嫁娶、安床、修造、求医疗病、上表章、上官、冠带、进人口、竖柱上梁、经络、开市、纳财、修置产室、开渠、穿井、安碓硙、平治道涂、破屋坏垣、栽种、牧养、破土、安葬、启攒、搬移、祈福、缮城郭、开仓、上册、修宫室、求嗣、庆赐、补垣、取鱼、招贤、安抚边境、立券交易、施恩、修饰垣墙、临政、纳畜、举正直、解除、塞穴、乘船渡水、修仓库、酝酿、选将、远回、鼓铸、营建、纳采、整手足甲、出师、筑堤防
2056-08-05	二零五六 丙子[鼠]年	六月小	廿四	周六	丙子 乙未 己丑 己巳	无	立秋 (8, 7)	无	关帝诞	恩格斯逝世纪念日	鼠	狮子座	祭祀、覃恩、恤孤茕、雪冤	出行、结婚姻、宴会、嫁娶、安床、剃头、修造、求医疗病、上表章、上官、冠带、进人口、竖柱上梁、经络、开市、纳财、修置产室、开渠、穿井、安碓硙、平治道涂、破屋坏垣、伐木、畋猎、栽种、牧养、破土、安葬、启攒、搬移、祈福、缮城郭、裁制、上册、修宫室、开仓、颁诏、求嗣、庆赐、补垣、取鱼、招贤、整容、布政事、宣政事、安抚边境、施恩、立券交易、修饰垣墙、临政、纳畜、举正直、解除、塞穴、修仓库、酝酿、选将、鼓铸、营建、纳采、整手足甲、出师、筑堤防
2056-08-06	二零五六 丙子[鼠]年	六月小	廿五	周日	丙子 乙未 庚寅 辛巳	无	立秋 (8, 7)	无	无	国际电影节	鼠	狮子座	结婚姻、宴会、安床、上表章、纳财、牧养、安葬、纳畜、酝酿、选将、安抚边境、开仓	祭祀、出行、嫁娶、修造、求医疗病、上官、进人口、修置产室、开渠、穿井、安碓硙、平治道涂、破屋坏垣、搬移、祈福、缮城郭、修宫室、求嗣、补垣、修饰垣墙、解除、修仓库、营建、筑堤防
2056-08-07	二零五六 丙子[鼠]年	六月小	廿六	周一	丙子 丙申 辛卯 癸巳	立秋	处暑 (8, 22)	无	无	无	鼠	狮子座	祭祀、出行、结婚姻、宴会、嫁娶、安床、修造、上官、搬移、祈福、求嗣、入宅、安抚边境、立券交易、临政、赴任、选将、纳采	求医疗病、上表章、冠带、竖柱上梁、修置产室、开渠、穿井、安碓硙、平治道涂、破屋坏垣、栽种、牧养、缮城郭、开仓、上册、修宫室、补垣、招贤、修饰垣墙、施恩、纳畜、举正直、解除、修仓库、营建、出师、筑堤防
2056-08-08	二零五六 丙子[鼠]年	六月小	廿七	周二	丙子 丙申 壬辰 乙巳	无	处暑 (8, 22)	无	无	无	鼠	狮子座	祭祀、出行、结婚姻、宴会、嫁娶、修造、求医疗病、上表章、上官、入学、进人口、竖柱上梁、经络、开市、纳财、安碓硙、栽种、牧养、安葬、搬移、祈福、缮城郭、裁制、开仓、上册、修宫室、求嗣、覃恩、恤孤茕、雪冤、庆赐、安抚边境、立券交易、临政、纳畜、解除、修仓库、酝酿、选将、营建、纳采、筑堤防、出师	剃头、冠带、修置产室、开渠、穿井、平治道涂、破屋坏垣、伐木、畋猎、破土、启攒、补垣、取鱼、针刺、整容、布政事、修饰垣墙、塞穴、远回、鼓铸、整手足甲
2056-08-09	二零五六 丙子[鼠]年	六月小	廿八	周三	丙子 丙申 癸巳 丁巳	无	处暑 (8, 22)	无	无	无	鼠	狮子座	祭祀、结婚姻、宴会、嫁娶、修造、求医疗病、上表章、上官、进人口、竖柱上梁、经络、开市、纳财、捕捉、栽种、牧养、安葬、搬移、祈福、缮城郭、开仓、裁制、上册、修宫室、颁诏、求嗣、覃恩、恤孤茕、雪冤、庆赐、招贤、宣政事、安抚边境、施恩、立券交易、临政、纳畜、举正直、解除、修仓库、酝酿、选将、营建、纳采	出行、剃头、冠带、修置产室、开渠、穿井、安碓硙、破屋坏垣、畋猎、破土、启攒、补垣、取鱼、整容、布政事、修饰垣墙、塞穴、鼓铸、整手足甲、筑堤防
2056-08-10	二零五六 丙子[鼠]年	六月小	廿九	周四	丙子 丙申 甲午 己巳	无	处暑 (8, 22)	无	无	无	鼠	狮子座	入学、诉讼、覃恩、恤孤茕、雪冤、赴任	结婚姻、冠带、进人口、竖柱上梁、经络、伐木、畋猎、开仓、补垣、取鱼、布政事、入宅、塞穴、酝酿、营建、纳采、筑堤防
2056-08-11	二零五六 丙子[鼠]年	七月大	初一	周五	丙子 丙申 乙未 辛巳	无	处暑 (8, 22)	无	无	无	鼠	狮子座	诸事不宜	诸事不宜
2056-08-12	二零五六 丙子[鼠]年	七月大	初二	周六	丙子 丙申 丙申 癸巳	无	处暑 (8, 22)	无	无	国际青年日	鼠	狮子座	出行、嫁娶、沐浴、上官、进人口、经络、纳财、扫舍宇、搬移、裁制、颁诏、覃恩、恤孤茕、雪冤、招贤、入宅、宣政事、安抚边境、施恩、临政、纳畜、举正直、酝酿、选将	安床、修置产室、开渠、穿井、平治道涂、破屋坏垣、伐木、栽种、启攒、祈福、开仓、上册、求嗣、补垣、修饰垣墙、营建、筑堤防
2056-08-13	二零五六 丙子[鼠]年	七月大	初三	周日	丙子 丙申 丁酉 乙巳	无	处暑 (8, 22)	无	无	无	鼠	狮子座	祭祀、出行、结婚姻、嫁娶、沐浴、修造、求医疗病、上表章、上官、竖柱上梁、扫舍宇、栽种、牧养、安葬、搬移、祈福、缮城郭、裁制、上册、颁诏、求嗣、覃恩、恤孤茕、雪冤、招贤、布政事、安抚边境、施恩、临政、纳畜、举正直、解除、修仓库、选将、营建、纳采、整手足甲、出师	宴会、剃头、冠带、修置产室、捕捉、畋猎、补垣、取鱼、鼓铸、开仓、筑堤防、塞穴、乘船渡水、修宫室
2056-08-14	二零五六 丙子[鼠]年	七月大	初四	周一	丙子 丙申 戊戌 丁巳	无	处暑 (8, 22)	无	无	无	鼠	狮子座	出行、宴会、修造、上表章、进人口、竖柱上梁、经络、开市、纳财、栽种、牧养、安葬、搬移、祈福、缮城郭、裁制、开仓、上册、修宫室、颁诏、求嗣、覃恩、补垣、恤孤茕、雪冤、庆赐、宣政事、立券交易、纳畜、解除、塞穴、修仓库、营建	祭祀、畋猎、取鱼、乘船渡水
2056-08-15	二零五六 丙子[鼠]年	七月大	初五	周二	丙子 丙申 己亥 己巳	无	处暑 (8, 22)	无	无	无	鼠	狮子座	祭祀、沐浴、平治道涂、修饰垣墙	出行、结婚姻、宴会、嫁娶、安床、修造、求医疗病、上表章、上官、冠带、进人口、竖柱上梁、经络、开市、纳财、修置产室、开渠、穿井、栽种、牧养、破土、安葬、启攒、搬移、祈福、缮城郭、裁制、上册、开仓、修宫室、颁诏、求嗣、庆赐、招贤、布政事、宣政事、安抚边境、施恩、立券交易、临政、纳畜、举正直、解除、乘船渡水、修仓库、酝酿、选将、鼓铸、营建、纳采、出师、筑堤防
2056-08-16	二零五六 丙子[鼠]年	七月大	初六	周三	丙子 丙申 庚子 辛巳	无	处暑 (8, 22)	无	无	无	鼠	狮子座	祭祀、出行、宴会、沐浴、修造、上官、冠带、进人口、竖柱上梁、安碓硙、牧养、搬移、祈福、缮城郭、裁制、修宫室、求嗣、庆赐、施恩、临政、纳畜、举正直、酝酿	修置产室、安葬、选将、安抚边境、整手足甲、出师
2056-08-17	二零五六 丙子[鼠]年	七月大	初七	周四	丙子 丙申 辛丑 癸巳	无	处暑 (8, 22)	无	七夕-魁星诞	无	鼠	狮子座	纳财、捕捉、赴任、入宅	结婚姻、求医疗病、上官、冠带、竖柱上梁、修置产室、畋猎、破土、安葬、启攒、缮城郭、修宫室、安抚边境、临政、解除、选将、远回、营建、出师、筑堤防
2056-08-18	二零五六 丙子[鼠]年	七月大	初八	周五	丙子 丙申 壬寅 乙巳	无	处暑 (8, 22)	无	无	无	鼠	狮子座	沐浴、覃恩、恤孤茕、雪冤	祭祀、出行、结婚姻、宴会、嫁娶、安床、剃头、修造、求医疗病、上表章、上官、冠带、进人口、竖柱上梁、经络、开市、纳财、修置产室、开渠、穿井、安碓硙、破屋坏垣、伐木、畋猎、栽种、牧养、破土、安葬、启攒、搬移、祈福、缮城郭、裁制、上册、开仓、修宫室、颁诏、求嗣、庆赐、补垣、取鱼、招贤、整容、布政事、宣政事、安抚边境、施恩、立券交易、修饰垣墙、临政、纳畜、举正直、解除、塞穴、修仓库、酝酿、选将、鼓铸、营建、纳采、整手足甲、出师、筑堤防
2056-08-19	二零五六 丙子[鼠]年	七月大	初九	周六	丙子 丙申 癸卯 丁巳	无	处暑 (8, 22)	无	无	无	鼠	狮子座	祭祀、出行、结婚姻、宴会、嫁娶、安床、修造、求医疗病、上表章、上官、竖柱上梁、纳财、栽种、牧养、安葬、搬移、祈福、缮城郭、开仓、裁制、上册、修宫室、颁诏、求嗣、覃恩、恤孤茕、雪冤、庆赐、招贤、宣政事、安抚边境、施恩、立券交易、临政、纳畜、举正直、解除、修仓库、选将、营建、纳采、出师	冠带、修置产室、开渠、穿井、安碓硙、平治道涂、破屋坏垣、畋猎、补垣、取鱼、筑堤防、修饰垣墙
2056-08-20	二零五六 丙子[鼠]年	七月大	初十	周日	丙子 丙申 甲辰 己巳	无	处暑 (8, 22)	无	无	无	鼠	狮子座	祭祀、入学、诉讼、赴任	出行、结婚姻、宴会、嫁娶、安床、剃头、修造、求医疗病、上表章、上官、冠带、进人口、竖柱上梁、经络、开市、纳财、修置产室、开渠、穿井、安碓硙、平治道涂、破屋坏垣、伐木、栽种、牧养、破土、安葬、启攒、搬移、祈福、缮城郭、裁制、开仓、上册、修宫室、颁诏、求嗣、庆赐、补垣、针刺、招贤、整容、布政事、宣政事、安抚边境、施恩、立券交易、修饰垣墙、临政、纳畜、举正直、解除、塞穴、修仓库、酝酿、选将、远回、鼓铸、营建、纳采、整手足甲、出师、筑堤防
2056-08-21	二零五六 丙子[鼠]年	七月大	十一	周一	丙子 丙申 乙巳 辛巳	无	处暑 (8, 22)	无	无	无	鼠	狮子座	结婚姻、宴会、嫁娶、进人口、经络、开市、纳财、捕捉、栽种、牧养、安葬、纳畜、酝酿、开仓、立券交易	祭祀、出行、安床、剃头、修造、求医疗病、上表章、上官、冠带、竖柱上梁、修置产室、开渠、穿井、安碓硙、破屋坏垣、破土、启攒、搬移、祈福、缮城郭、裁制、上册、修宫室、颁诏、求嗣、庆赐、补垣、招贤、整容、布政事、宣政事、安抚边境、施恩、修饰垣墙、临政、举正直、解除、塞穴、修仓库、选将、鼓铸、营建、纳采、整手足甲、出师、筑堤防
2056-08-22	二零五六 丙子[鼠]年	七月大	十二	周二	丙子 丙申 丙午 癸巳	处暑	白露 (9, 7)	无	无	邓小平诞辰纪念日	鼠	狮子座	祭祀、出行、宴会、嫁娶、修造、求医疗病、上表章、上官、入学、开市、修置产室、开渠、穿井、安碓硙、栽种、牧养、搬移、祈福、缮城郭、裁制、上册、修宫室、颁诏、求嗣、覃恩、恤孤茕、雪冤、庆赐、招贤、宣政事、入宅、安抚边境、施恩、临政、举正直、解除、修仓库、选将、纳采、出师	结婚姻、安床、剃头、冠带、进人口、竖柱上梁、经络、破屋坏垣、伐木、畋猎、开仓、补垣、取鱼、整容、布政事、修饰垣墙、塞穴、酝酿、鼓铸、营建、整手足甲、筑堤防、苫盖
2056-08-23	二零五六 丙子[鼠]年	七月大	十三	周三	丙子 丙申 丁未 乙巳	无	白露 (9, 7)	无	长真谭真人诞-大势至菩萨诞	无	鼠	处女座	祭祀、破土、覃恩、恤孤茕、雪冤	出行、结婚姻、宴会、嫁娶、安床、剃头、修造、求医疗病、上表章、上官、冠带、进人口、竖柱上梁、经络、开市、纳财、修置产室、开渠、穿井、安碓硙、破屋坏垣、畋猎、栽种、牧养、安葬、搬移、祈福、缮城郭、裁制、上册、开仓、修宫室、颁诏、求嗣、庆赐、补垣、取鱼、针刺、招贤、整容、布政事、宣政事、安抚边境、施恩、疗目、立券交易、临政、修饰垣墙、纳畜、举正直、解除、塞穴、乘船渡水、修仓库、酝酿、选将、鼓铸、营建、纳采、整手足甲、出师、筑堤防
2056-08-24	二零五六 丙子[鼠]年	七月大	十四	周四	丙子 丙申 戊申 丁巳	无	白露 (9, 7)	无	无	无	鼠	处女座	祭祀、嫁娶、沐浴、上官、进人口、经络、纳财、扫舍宇、牧养、搬移、裁制、颁诏、覃恩、恤孤茕、雪冤、招贤、宣政事、安抚边境、施恩、临政、纳畜、举正直、酝酿、选将、出师	诸事不忌
2056-08-25	二零五六 丙子[鼠]年	七月大	十五	周五	丙子 丙申 己酉 己巳	无	白露 (9, 7)	无	中元节	无	鼠	处女座	出行、沐浴、剃头、求医疗病、上官、扫舍宇、安葬、覃恩、恤孤茕、雪冤、整容、布政事、安抚边境、临政、解除、选将、整手足甲、出师	结婚姻、宴会、嫁娶、安床、修造、上表章、冠带、进人口、竖柱上梁、开市、纳财、修置产室、捕捉、畋猎、栽种、牧养、搬移、祈福、缮城郭、开仓、上册、修宫室、颁诏、求嗣、补垣、取鱼、招贤、宣政事、立券交易、纳畜、塞穴、乘船渡水、修仓库、鼓铸、营建、纳采、筑堤防
2056-08-26	二零五六 丙子[鼠]年	七月大	十六	周六	丙子 丙申 庚戌 辛巳	无	白露 (9, 7)	无	无	无	鼠	处女座	宴会、上表章、进人口、竖柱上梁、开市、纳财、栽种、牧养、缮城郭、裁制、开仓、上册、修宫室、覃恩、恤孤茕、补垣、雪冤、庆赐、布政事、立券交易、纳畜、塞穴、修仓库	祭祀、结婚姻、上官、破土、启攒、取鱼、招贤、举正直、纳采、乘船渡水、施恩
2056-08-27	二零五六 丙子[鼠]年	七月大	十七	周日	丙子 丙申 辛亥 癸巳	无	白露 (9, 7)	无	无	无	鼠	处女座	祭祀、出行、宴会、沐浴、修造、上官、平治道涂、搬移、祈福、覃恩、恤孤茕、庆赐、雪冤、布政事、入宅、修饰垣墙、临政、赴任、纳采	结婚姻、嫁娶、求医疗病、上表章、冠带、竖柱上梁、修置产室、开渠、穿井、栽种、牧养、破土、安葬、启攒、缮城郭、裁制、上册、开仓、修宫室、颁诏、求嗣、招贤、宣政事、安抚边境、施恩、纳畜、举正直、解除、修仓库、选将、鼓铸、营建、出师、筑堤防
2056-08-28	二零五六 丙子[鼠]年	七月大	十八	周一	丙子 丙申 壬子 乙巳	无	白露 (9, 7)	无	西王母诞	无	鼠	处女座	祭祀、出行、宴会、沐浴、修造、上官、冠带、进人口、竖柱上梁、经络、安碓硙、牧养、安葬、搬移、祈福、缮城郭、裁制、修宫室、颁诏、求嗣、覃恩、恤孤茕、雪冤、庆赐、招贤、宣政事、施恩、临政、纳畜、举正直、酝酿、营建、纳采	修置产室、开渠、穿井、畋猎、取鱼
2056-08-29	二零五六 丙子[鼠]年	七月大	十九	周二	丙子 丙申 癸丑 丁巳	无	白露 (9, 7)	无	太岁诞	无	鼠	处女座	祭祀、宴会、修造、求医疗病、上表章、上官、竖柱上梁、纳财、捕捉、栽种、牧养、安葬、祈福、缮城郭、开仓、裁制、上册、修宫室、颁诏、求嗣、覃恩、恤孤茕、雪冤、庆赐、招贤、宣政事、施恩、临政、纳畜、举正直、解除、修仓库、营建	冠带、畋猎、取鱼、远回、整手足甲
2056-08-30	二零五六 丙子[鼠]年	七月大	二十	周三	丙子 丙申 甲寅 己巳	无	白露 (9, 7)	无	无	无	鼠	处女座	诸事不宜	诸事不宜
2056-08-31	二零五六 丙子[鼠]年	七月大	廿一	周四	丙子 丙申 乙卯 辛巳	无	白露 (9, 7)	无	无	无	鼠	处女座	祭祀	出行、结婚姻、宴会、嫁娶、安床、修造、求医疗病、上表章、上官、冠带、进人口、竖柱上梁、经络、开市、纳财、修置产室、开渠、穿井、安碓硙、平治道涂、破屋坏垣、栽种、牧养、破土、安葬、启攒、搬移、祈福、缮城郭、裁制、开仓、上册、修宫室、颁诏、求嗣、庆赐、补垣、招贤、布政事、宣政事、安抚边境、施恩、立券交易、修饰垣墙、临政、纳畜、举正直、解除、塞穴、修仓库、酝酿、选将、鼓铸、营建、纳采、整手足甲、出师、筑堤防
