2056-08-01	2056-6-20	29	满	二	丙子 乙未 乙酉	无	立秋 (8, 7)	建军节	无	无	嫁娶 开光 解除 安床 牧养 理发 开市 入殓 启钻 移柩 安葬 扫舍	作灶 动土 上梁 栽种 入宅 移徙 修造 祈福
2056-08-02	2056-6-21	29	平	三	丙子 乙未 丙戌	无	立秋 (8, 7)	无	无	无	祭祀 解除 馀事勿取	诸事不宜
2056-08-03	2056-6-22	29	定	四	丙子 乙未 丁亥	无	立秋 (8, 7)	无	无	无	祭祀 祈福 求嗣 开光 伐木 出火 拆卸 入宅 安床 修造 动土 上梁 挂匾 纳畜	嫁娶 栽种 行丧 理发 修坟 作灶
2056-08-04	2056-6-23	29	执	五	丙子 乙未 戊子	无	立秋 (8, 7)	无	无	无	解除 祭祀 理发 入殓 安葬 破土	嫁娶 开市 出火 作灶 置产 斋醮 入宅 移徙 安门
2056-08-05	2056-6-24	29	破	六	丙子 乙未 己丑	无	立秋 (8, 7)	无	无	无	破屋 坏垣 馀事勿取	诸事不宜
2056-08-06	2056-6-25	29	危	日	丙子 乙未 庚寅	无	立秋 (8, 7)	无	无	无	开市 交易 立券 纳财 动土 开光 出行 嫁娶 纳采 订盟 入学 开仓 出货财 纳畜 牧养 栽种 破土 启钻 安葬 立碑	入宅 移徙 作灶 祭祀 谢土
2056-08-07	2056-6-26	29	危	一	丙子 丙申 辛卯	立秋	处暑 (8, 22)	无	无	无	祈福 斋醮 出行 冠笄 嫁娶 雕刻 开柱眼 入宅 造桥 开市 交易 立券 纳财 入殓 除服 成服 移柩 破土 安葬 启钻	动土 订盟 安床 开池
2056-08-08	2056-6-27	29	成	二	丙子 丙申 壬辰	无	处暑 (8, 22)	无	无	无	祈福 求嗣 解除 订盟 纳采 动土 起基 放水 造仓 开市 纳畜 牧养 开生坟 入殓 除服 成服 移柩 破土 安葬	无
2056-08-09	2056-6-28	29	收	三	丙子 丙申 癸巳	无	处暑 (8, 22)	无	无	无	塑绘 开光 解除 订盟 纳采 嫁娶 出火 修造 动土 移徙 入宅 拆卸 起基 安门 分居 开市 交易 立券 纳财 纳畜 牧养	无
2056-08-10	2056-6-29	29	开	四	丙子 丙申 甲午	无	处暑 (8, 22)	无	无	无	祈福 出行 订盟 纳采 嫁娶 裁衣 动土 安床 放水 开市 掘井 交易 立券 栽种 开渠 除服 成服 移柩 破土	无
2056-08-11	2056-7-1	30	闭	五	丙子 丙申 乙未	无	处暑 (8, 22)	无	无	无	嫁娶 祭祀 祈福 斋醮 作灶 移徙 入宅	动土 破土
2056-08-12	2056-7-2	30	建	六	丙子 丙申 丙申	无	处暑 (8, 22)	无	无	无	嫁娶 出行 纳畜 祭祀 入殓 启钻 安葬	作灶 动土 破土
2056-08-13	2056-7-3	30	除	日	丙子 丙申 丁酉	无	处暑 (8, 22)	无	无	无	订盟 纳采 祭祀 祈福 修造 动土 上梁 破土 安葬	嫁娶 开市
2056-08-14	2056-7-4	30	满	一	丙子 丙申 戊戌	无	处暑 (8, 22)	无	无	无	订盟 纳采 出行 会亲友 修造 上梁 移徙 入宅	开市 安葬
2056-08-15	2056-7-5	30	平	二	丙子 丙申 己亥	无	处暑 (8, 22)	无	无	无	沐浴 修饰垣墙 平治道涂 馀事勿取	嫁娶 祈福
2056-08-16	2056-7-6	30	定	三	丙子 丙申 庚子	无	处暑 (8, 22)	无	无	无	嫁娶 祭祀 祈福 斋醮 动土 移徙 入宅	开市 安葬
2056-08-17	2056-7-7	30	执	四	丙子 丙申 辛丑	无	处暑 (8, 22)	无	无	无	捕捉 结网 入殓 破土 安葬	嫁娶 入宅
2056-08-18	2056-7-8	30	破	五	丙子 丙申 壬寅	无	处暑 (8, 22)	无	无	无	沐浴 治病 破屋 坏垣 馀事勿取	诸事不宜
2056-08-19	2056-7-9	30	危	六	丙子 丙申 癸卯	无	处暑 (8, 22)	无	无	无	嫁娶 订盟 纳采 出行 开市 祭祀 祈福 移徙 入宅 启钻 安葬	动土 破土
2056-08-20	2056-7-10	30	成	日	丙子 丙申 甲辰	无	处暑 (8, 22)	无	无	无	嫁娶 订盟 纳采 祭祀 祈福 求医 治病 动土 移徙 入宅 破土 安葬	开光 针灸
2056-08-21	2056-7-11	30	收	一	丙子 丙申 乙巳	无	处暑 (8, 22)	无	无	无	订盟 纳采 祭祀 祈福 安机械 作灶 纳畜	动土 安葬
2056-08-22	2056-7-12	30	开	二	丙子 丙申 丙午	处暑	白露 (9, 7)	无	无	无	嫁娶 祭祀 祈福 求嗣 出行 动土 安床 掘井 破土 启钻	入宅 作梁 安门 伐木 修造 上梁 入殓 盖屋
2056-08-23	2056-7-13	30	闭	三	丙子 丙申 丁未	无	白露 (9, 7)	无	无	无	嫁娶 祭祀 祈福 求嗣 出行 出火 拆卸 修造 移徙 动土 安床 入殓 破土 安葬 启钻	盖屋 开光 理发 造船 掘井 作灶
2056-08-24	2056-7-14	30	建	四	丙子 丙申 戊申	无	白露 (9, 7)	无	无	无	祭祀 祈福 求嗣 开光 出行 解除 上梁 盖屋 移徙 安门 纳财 牧养 纳畜 安葬 启钻 入殓	破土 置产 掘井 动土 安床
2056-08-25	2056-7-15	30	除	五	丙子 丙申 己酉	无	白露 (9, 7)	无	无	无	祭祀 解除 沐浴 理发 整手足甲 入殓 移柩 破土 安葬 扫舍	嫁娶 会亲友 进人口 出行 入宅 移徙 赴任 作灶
2056-08-26	2056-7-16	30	满	六	丙子 丙申 庚戌	无	白露 (9, 7)	无	无	无	塑绘 开光 进人口 纳畜 补垣 塞穴 栽种 牧养	嫁娶 纳财 祈福 安葬 修造 开市 交易 立券 动土 上梁
2056-08-27	2056-7-17	30	平	日	丙子 丙申 辛亥	无	白露 (9, 7)	无	无	无	作灶 沐浴 修饰垣墙 平治道涂 馀事勿取	诸事不宜
2056-08-28	2056-7-18	30	定	一	丙子 丙申 壬子	无	白露 (9, 7)	无	无	无	祭祀 求嗣 开光 出行 伐木 作梁 出火 解除 拆卸 进人口 修造 动土 起基 安床 栽种 纳畜 入殓 破土 安葬 除服 成服	嫁娶 移徙
2056-08-29	2056-7-19	30	执	二	丙子 丙申 癸丑	无	白露 (9, 7)	无	无	无	祭祀 塞穴 入殓 破土 安葬 移柩 馀事勿取	诸事不宜
2056-08-30	2056-7-20	30	破	三	丙子 丙申 甲寅	无	白露 (9, 7)	无	无	无	破屋 坏垣 馀事勿取	诸事不宜
2056-08-31	2056-7-21	30	危	四	丙子 丙申 乙卯	无	白露 (9, 7)	无	无	无	祭祀 入殓 移柩 结网 启钻 安葬 除服 成服 馀事勿取	诸事不宜
