2057-08-01 10:00:00	二零五七 丁丑[牛]年 七月大初二	星期三	中、国、人、民、解、放、军、建、军、节	丁丑 丁未 庚寅 辛巳	无	立秋 (8, 7)	牛	狮子座	结婚姻、宴会、安床、上表章、开市、纳财、牧养、安葬、开仓、纳畜、选将、安抚边境、立券交易、酝酿	祭祀、修造、求医疗病、修置产室、开渠、穿井、安碓硙、平治道涂、破屋坏垣、营建、解除、修饰垣墙、修仓库、缮城郭、祈福、补垣、求嗣、修宫室、筑堤防
2057-08-02 10:00:00	二零五七 丁丑[牛]年 七月大初三	星期四	无	丁丑 丁未 辛卯 癸巳	无	立秋 (8, 7)	牛	狮子座	祭祀、出行、宴会、求医疗病、上表章、上官、入学、进人口、竖柱上梁、经络、开市、纳财、牧养、开仓、施恩、解除、祈福、上册、纳采、求嗣、举正直、立券交易、裁制、庆赐、临政	修置产室、开渠、穿井、平治道涂、破屋坏垣、营建、选将、补垣、苫盖、修饰垣墙、出师
2057-08-03 10:00:00	二零五七 丁丑[牛]年 七月大初四	星期五	无	丁丑 丁未 壬辰 乙巳	无	立秋 (8, 7)	牛	狮子座	祭祀、进人口、纳财、捕捉、牧养、纳畜、入宅	上表章、冠带、修置产室、开渠、穿井、安碓硙、平治道涂、破屋坏垣、破土、启攒、营建、招贤、选将、颁诏、修饰垣墙、出师、修仓库、布政事、补垣、鼓铸、上册、宣政事、筑堤防、安抚边境
2057-08-04 10:00:00	二零五七 丁丑[牛]年 七月大初五	星期六	无	丁丑 丁未 癸巳 丁巳	无	立秋 (8, 7)	牛	狮子座	入学、雪冤、恤孤茕、覃恩	祭祀、出行、结婚姻、宴会、嫁娶、安床、剃头、修造、求医疗病、上表章、上官、冠带、进人口、竖柱上梁、经络、开市、纳财、修置产室、开渠、穿井、安碓硙、平治道涂、破屋坏垣、伐木、畋猎、栽种、牧养、破土、安葬、启攒、营建、开仓、纳畜、招贤、施恩、选将、解除、颁诏、整容、修饰垣墙、出师、布政事、修仓库、祈福、缮城郭、补垣、取鱼、鼓铸、上册、整手足甲、乘船渡水、远回、纳采、求嗣、宣政事、举正直、筑堤防、立券交易、塞穴、酝酿、裁制、搬移、安抚边境、庆赐、临政、修宫室
2057-08-05 10:00:00	二零五七 丁丑[牛]年 七月大初六	星期日	恩、格、斯、逝、世、纪、念、日	丁丑 丁未 甲午 己巳	无	立秋 (8, 7)	牛	狮子座	祭祀、经络、安葬、赴任、覃恩、恤孤茕、塞穴、酝酿、诉讼、裁制、雪冤	冠带、修置产室、开渠、穿井、安碓硙、平治道涂、破屋坏垣、捕捉、畋猎、疗目、开仓、取鱼、苫盖、修宫室、针刺、修饰垣墙、整手足甲、布政事
2057-08-06 10:00:00	二零五七 丁丑[牛]年 七月大初七	星期一	国、际、电、影、节、七、夕、-、魁、星、诞	丁丑 丁未 乙未 辛巳	无	立秋 (8, 7)	牛	狮子座	宴会、经络、纳财、纳畜、招贤、施恩、选将、举正直、酝酿、裁制、安抚边境、庆赐、临政	剃头、求医疗病、上表章、开市、修置产室、开渠、穿井、平治道涂、破屋坏垣、伐木、栽种、安葬、启攒、营建、开仓、解除、整容、修饰垣墙、补垣、整手足甲、上册、求嗣、筑堤防、搬移
2057-08-07 10:00:00	二零五七 丁丑[牛]年 七月大初八	星期二	无	丁丑 戊申 丙申 癸巳	立秋	处暑 (8, 22)	牛	狮子座	出行、嫁娶、沐浴、上官、进人口、经络、纳财、扫舍宇、纳畜、招贤、施恩、选将、颁诏、出师、宣政事、举正直、覃恩、恤孤茕、酝酿、裁制、安抚边境、雪冤、临政	安床、修置产室、开渠、穿井、平治道涂、破屋坏垣、伐木、栽种、启攒、营建、开仓、修饰垣墙、祈福、补垣、上册、求嗣、筑堤防
2057-08-08 10:00:00	二零五七 丁丑[牛]年 七月大初九	星期三	无	丁丑 戊申 丁酉 乙巳	无	处暑 (8, 22)	牛	狮子座	祭祀、出行、结婚姻、嫁娶、沐浴、修造、求医疗病、上表章、上官、竖柱上梁、扫舍宇、栽种、牧养、安葬、赴任、营建、纳畜、招贤、施恩、选将、解除、颁诏、出师、修仓库、布政事、祈福、缮城郭、入宅、上册、整手足甲、纳采、求嗣、举正直、覃恩、恤孤茕、裁制、搬移、安抚边境、雪冤、临政	宴会、剃头、冠带、修置产室、捕捉、畋猎、乘船渡水、开仓、补垣、筑堤防、塞穴、取鱼、鼓铸、修宫室
2057-08-09 10:00:00	二零五七 丁丑[牛]年 七月大初十	星期四	无	丁丑 戊申 戊戌 丁巳	无	处暑 (8, 22)	牛	狮子座	出行、宴会、修造、上表章、进人口、竖柱上梁、经络、开市、纳财、栽种、牧养、安葬、营建、开仓、纳畜、解除、颁诏、修仓库、祈福、缮城郭、补垣、上册、求嗣、宣政事、覃恩、恤孤茕、立券交易、塞穴、裁制、搬移、庆赐、雪冤、修宫室	祭祀、畋猎、取鱼、乘船渡水
2057-08-10 10:00:00	二零五七 丁丑[牛]年 七月大十一	星期五	无	丁丑 戊申 己亥 己巳	无	处暑 (8, 22)	牛	狮子座	祭祀、沐浴、平治道涂、修饰垣墙	出行、结婚姻、宴会、嫁娶、安床、修造、求医疗病、上表章、上官、冠带、进人口、竖柱上梁、经络、开市、纳财、修置产室、开渠、穿井、栽种、牧养、破土、安葬、启攒、营建、开仓、纳畜、招贤、施恩、选将、解除、颁诏、出师、修仓库、布政事、祈福、缮城郭、鼓铸、上册、纳采、求嗣、宣政事、举正直、筑堤防、立券交易、酝酿、裁制、搬移、安抚边境、庆赐、临政、修宫室
2057-08-11 10:00:00	二零五七 丁丑[牛]年 七月大十二	星期六	无	丁丑 戊申 庚子 辛巳	无	处暑 (8, 22)	牛	狮子座	祭祀、出行、宴会、沐浴、修造、上官、冠带、进人口、竖柱上梁、安碓硙、牧养、纳畜、施恩、缮城郭、祈福、求嗣、举正直、酝酿、裁制、搬移、庆赐、临政、修宫室	剃头、修置产室、安葬、选将、安抚边境、整容、出师
2057-08-12 10:00:00	二零五七 丁丑[牛]年 七月大十三	星期日	国、际、青、年、日、长、真、谭、真、人、诞、-、大、势、至、菩、萨、诞	丁丑 戊申 辛丑 癸巳	无	处暑 (8, 22)	牛	狮子座	纳财、捕捉	出行、结婚姻、嫁娶、安床、修造、求医疗病、上官、冠带、进人口、竖柱上梁、开市、修置产室、畋猎、破土、安葬、启攒、营建、选将、解除、出师、缮城郭、远回、纳采、筑堤防、立券交易、酝酿、搬移、安抚边境、临政、修宫室
2057-08-13 10:00:00	二零五七 丁丑[牛]年 七月大十四	星期一	无	丁丑 戊申 壬寅 乙巳	无	处暑 (8, 22)	牛	狮子座	沐浴、入宅、覃恩、恤孤茕、雪冤	祭祀、出行、结婚姻、宴会、嫁娶、安床、剃头、修造、求医疗病、上表章、上官、冠带、进人口、竖柱上梁、经络、开市、纳财、修置产室、开渠、穿井、安碓硙、破屋坏垣、伐木、畋猎、栽种、牧养、破土、安葬、启攒、营建、开仓、纳畜、招贤、施恩、选将、解除、颁诏、整容、修饰垣墙、出师、布政事、修仓库、祈福、缮城郭、补垣、取鱼、鼓铸、上册、整手足甲、乘船渡水、纳采、求嗣、宣政事、举正直、筑堤防、立券交易、塞穴、酝酿、裁制、搬移、安抚边境、庆赐、临政、修宫室
2057-08-14 10:00:00	二零五七 丁丑[牛]年 七月大十五	星期二	中、元、节	丁丑 戊申 癸卯 丁巳	无	处暑 (8, 22)	牛	狮子座	祭祀、出行、结婚姻、宴会、嫁娶、安床、修造、求医疗病、上表章、上官、竖柱上梁、纳财、栽种、牧养、安葬、营建、开仓、纳畜、招贤、选将、施恩、解除、颁诏、修仓库、出师、祈福、缮城郭、上册、纳采、求嗣、宣政事、举正直、覃恩、恤孤茕、立券交易、裁制、搬移、安抚边境、庆赐、雪冤、临政、修宫室	剃头、冠带、修置产室、开渠、穿井、安碓硙、平治道涂、破屋坏垣、畋猎、修饰垣墙、补垣、筑堤防、整容、取鱼、整手足甲
2057-08-15 10:00:00	二零五七 丁丑[牛]年 七月大十六	星期三	无	丁丑 戊申 甲辰 己巳	无	处暑 (8, 22)	牛	狮子座	祭祀、入学、赴任、诉讼	出行、结婚姻、宴会、嫁娶、安床、剃头、修造、求医疗病、上表章、上官、冠带、进人口、竖柱上梁、经络、开市、纳财、修置产室、开渠、穿井、安碓硙、平治道涂、破屋坏垣、伐木、栽种、牧养、破土、安葬、启攒、营建、开仓、纳畜、招贤、施恩、选将、解除、针刺、颁诏、整容、修饰垣墙、出师、布政事、修仓库、祈福、缮城郭、补垣、鼓铸、上册、整手足甲、远回、纳采、求嗣、宣政事、举正直、修宫室、筑堤防、立券交易、塞穴、酝酿、裁制、搬移、安抚边境、庆赐、临政
2057-08-16 10:00:00	二零五七 丁丑[牛]年 七月大十七	星期四	无	丁丑 戊申 乙巳 辛巳	无	处暑 (8, 22)	牛	狮子座	结婚姻、宴会、嫁娶、进人口、经络、开市、纳财、捕捉、栽种、牧养、安葬、开仓、纳畜、立券交易、酝酿	祭祀、出行、安床、剃头、修造、求医疗病、上表章、上官、冠带、竖柱上梁、修置产室、开渠、穿井、安碓硙、破屋坏垣、破土、启攒、营建、招贤、施恩、选将、解除、颁诏、整容、修饰垣墙、出师、修仓库、布政事、祈福、缮城郭、补垣、鼓铸、上册、整手足甲、纳采、求嗣、宣政事、举正直、修宫室、筑堤防、塞穴、裁制、搬移、安抚边境、庆赐、临政
2057-08-17 10:00:00	二零五七 丁丑[牛]年 七月大十八	星期五	西、王、母、诞	丁丑 戊申 丙午 癸巳	无	处暑 (8, 22)	牛	狮子座	入学、覃恩、恤孤茕、雪冤	竖柱上梁、经络、伐木、畋猎、启攒、营建、开仓、布政事、补垣、入宅、取鱼、纳采、筑堤防、塞穴、酝酿
2057-08-18 10:00:00	二零五七 丁丑[牛]年 七月大十九	星期六	太、岁、诞	丁丑 戊申 丁未 乙巳	无	处暑 (8, 22)	牛	狮子座	祭祀、破土、赴任、入宅、覃恩、恤孤茕、雪冤	出行、结婚姻、宴会、嫁娶、安床、剃头、修造、求医疗病、上表章、上官、冠带、进人口、竖柱上梁、经络、开市、纳财、修置产室、开渠、穿井、安碓硙、破屋坏垣、畋猎、栽种、牧养、安葬、营建、开仓、纳畜、招贤、施恩、选将、解除、针刺、颁诏、整容、修饰垣墙、出师、布政事、修仓库、祈福、缮城郭、补垣、取鱼、鼓铸、整手足甲、上册、疗目、乘船渡水、纳采、求嗣、宣政事、举正直、修宫室、筑堤防、立券交易、塞穴、酝酿、裁制、搬移、安抚边境、庆赐、临政
2057-08-19 10:00:00	二零五七 丁丑[牛]年 七月大二十	星期日	无	丁丑 戊申 戊申 丁巳	无	处暑 (8, 22)	牛	狮子座	祭祀、出行、嫁娶、沐浴、上官、进人口、经络、纳财、扫舍宇、牧养、纳畜、招贤、施恩、选将、颁诏、出师、宣政事、举正直、覃恩、恤孤茕、酝酿、裁制、搬移、安抚边境、雪冤、临政	诸事不忌
2057-08-20 10:00:00	二零五七 丁丑[牛]年 七月大廿一	星期一	无	丁丑 戊申 己酉 己巳	无	处暑 (8, 22)	牛	狮子座	出行、沐浴、剃头、求医疗病、上官、扫舍宇、安葬、选将、解除、整容、出师、布政事、整手足甲、覃恩、恤孤茕、安抚边境、雪冤、临政	结婚姻、宴会、嫁娶、安床、修造、上表章、冠带、进人口、竖柱上梁、开市、纳财、修置产室、捕捉、畋猎、栽种、牧养、营建、开仓、纳畜、招贤、颁诏、修仓库、祈福、缮城郭、补垣、取鱼、鼓铸、上册、乘船渡水、纳采、求嗣、宣政事、筑堤防、立券交易、塞穴、搬移、修宫室
2057-08-21 10:00:00	二零五七 丁丑[牛]年 七月大廿二	星期二	增、福、财、神、诞	丁丑 戊申 庚戌 辛巳	无	处暑 (8, 22)	牛	狮子座	宴会、上表章、进人口、竖柱上梁、开市、纳财、栽种、牧养、纳畜、开仓、修仓库、布政事、缮城郭、补垣、上册、覃恩、恤孤茕、立券交易、塞穴、裁制、庆赐、雪冤、修宫室	祭祀、结婚姻、嫁娶、上官、破土、启攒、乘船渡水、招贤、施恩、纳采、举正直、取鱼
2057-08-22 10:00:00	二零五七 丁丑[牛]年 七月大廿三	星期三	邓、小、平、诞、辰、纪、念、日	丁丑 戊申 辛亥 癸巳	处暑	白露 (9, 7)	牛	狮子座	祭祀、沐浴、平治道涂、雪冤、覃恩、恤孤茕、修饰垣墙	出行、结婚姻、宴会、嫁娶、安床、修造、求医疗病、上表章、上官、冠带、进人口、竖柱上梁、经络、开市、纳财、修置产室、开渠、穿井、栽种、牧养、破土、安葬、启攒、营建、开仓、纳畜、招贤、施恩、选将、解除、颁诏、修仓库、出师、布政事、祈福、缮城郭、鼓铸、上册、整手足甲、乘船渡水、纳采、求嗣、宣政事、举正直、修宫室、筑堤防、立券交易、酝酿、裁制、搬移、安抚边境、庆赐、临政
2057-08-23 10:00:00	二零五七 丁丑[牛]年 七月大廿四	星期四	无	丁丑 戊申 壬子 乙巳	无	白露 (9, 7)	牛	处女座	祭祀、出行、结婚姻、宴会、嫁娶、沐浴、修造、上官、冠带、进人口、竖柱上梁、经络、安碓硙、牧养、安葬、营建、纳畜、招贤、施恩、颁诏、祈福、缮城郭、入宅、纳采、求嗣、宣政事、举正直、覃恩、恤孤茕、酝酿、裁制、搬移、庆赐、雪冤、临政、修宫室	修置产室、开渠、穿井、畋猎、取鱼
2057-08-24 10:00:00	二零五七 丁丑[牛]年 七月大廿五	星期五	无	丁丑 戊申 癸丑 丁巳	无	白露 (9, 7)	牛	处女座	祭祀、宴会、修造、求医疗病、上表章、上官、竖柱上梁、纳财、捕捉、栽种、牧养、安葬、营建、开仓、纳畜、招贤、施恩、解除、颁诏、修仓库、祈福、缮城郭、上册、求嗣、宣政事、举正直、覃恩、恤孤茕、裁制、庆赐、雪冤、临政、修宫室	冠带、畋猎、取鱼、远回
2057-08-25 10:00:00	二零五七 丁丑[牛]年 七月大廿六	星期六	无	丁丑 戊申 甲寅 己巳	无	白露 (9, 7)	牛	处女座	诸事不宜	诸事不宜
2057-08-26 10:00:00	二零五七 丁丑[牛]年 七月大廿七	星期日	无	丁丑 戊申 乙卯 辛巳	无	白露 (9, 7)	牛	处女座	祭祀	出行、结婚姻、宴会、嫁娶、安床、修造、求医疗病、上表章、上官、冠带、进人口、竖柱上梁、经络、开市、纳财、修置产室、开渠、穿井、安碓硙、平治道涂、破屋坏垣、栽种、牧养、破土、安葬、启攒、营建、开仓、纳畜、招贤、施恩、选将、解除、颁诏、修饰垣墙、出师、修仓库、布政事、祈福、缮城郭、补垣、鼓铸、上册、纳采、求嗣、宣政事、举正直、修宫室、筑堤防、立券交易、塞穴、酝酿、裁制、搬移、安抚边境、庆赐、临政
2057-08-27 10:00:00	二零五七 丁丑[牛]年 七月大廿八	星期一	无	丁丑 戊申 丙辰 癸巳	无	白露 (9, 7)	牛	处女座	祭祀、入学	出行、结婚姻、宴会、嫁娶、安床、剃头、修造、求医疗病、上表章、上官、冠带、进人口、竖柱上梁、经络、开市、纳财、修置产室、开渠、穿井、安碓硙、平治道涂、破屋坏垣、伐木、栽种、牧养、破土、安葬、启攒、营建、开仓、纳畜、招贤、施恩、选将、解除、针刺、颁诏、整容、修饰垣墙、出师、布政事、修仓库、祈福、缮城郭、补垣、鼓铸、上册、整手足甲、远回、纳采、求嗣、宣政事、举正直、修宫室、筑堤防、立券交易、塞穴、酝酿、裁制、搬移、安抚边境、庆赐、临政
2057-08-28 10:00:00	二零五七 丁丑[牛]年 七月大廿九	星期二	杨、公、忌	丁丑 戊申 丁巳 乙巳	无	白露 (9, 7)	牛	处女座	祭祀、结婚姻、宴会、嫁娶、修造、求医疗病、上表章、上官、进人口、竖柱上梁、经络、开市、纳财、捕捉、栽种、牧养、安葬、赴任、营建、开仓、纳畜、招贤、施恩、选将、解除、颁诏、修仓库、祈福、缮城郭、入宅、上册、纳采、求嗣、宣政事、举正直、覃恩、恤孤茕、立券交易、酝酿、裁制、搬移、安抚边境、庆赐、雪冤、临政	出行、剃头、冠带、立券、修置产室、开渠、穿井、安碓硙、破屋坏垣、畋猎、破土、启攒、开张、整容、修饰垣墙、布政事、补垣、取鱼、鼓铸、整手足甲、修宫室、筑堤防、塞穴
2057-08-29 10:00:00	二零五七 丁丑[牛]年 七月大三十	星期三	地、藏、菩、萨、诞	丁丑 戊申 戊午 丁巳	无	白露 (9, 7)	牛	处女座	祭祀、出行、结婚姻、宴会、嫁娶、修造、求医疗病、上表章、上官、入学、竖柱上梁、开市、修置产室、开渠、穿井、安碓硙、栽种、牧养、营建、纳畜、招贤、施恩、选将、解除、颁诏、出师、修仓库、祈福、缮城郭、上册、纳采、求嗣、宣政事、举正直、修宫室、覃恩、恤孤茕、裁制、搬移、安抚边境、庆赐、雪冤、临政	剃头、冠带、破屋坏垣、伐木、畋猎、破土、开仓、苫盖、整容、修饰垣墙、布政事、补垣、入宅、取鱼、鼓铸、整手足甲、筑堤防、塞穴
2057-08-30 10:00:00	二零五七 丁丑[牛]年 八月小初一	星期四	许、真、君、诞	丁丑 戊申 己未 己巳	无	白露 (9, 7)	牛	处女座	诸事不宜	诸事不宜
2057-08-31 10:00:00	二零五七 丁丑[牛]年 八月小初二	星期五	无	丁丑 戊申 庚申 辛巳	无	白露 (9, 7)	牛	处女座	出行、沐浴、上官、进人口、纳财、扫舍宇、纳畜、招贤、施恩、颁诏、宣政事、举正直、覃恩、恤孤茕、酝酿、裁制、雪冤、临政	安床、上表章、修置产室、开渠、穿井、平治道涂、破屋坏垣、伐木、栽种、启攒、营建、开仓、修饰垣墙、祈福、补垣、上册、求嗣、筑堤防
