2058-06-01	二零五八 戊寅[虎]年 闰四月大十一	周六	无	无	国际儿童节	戊寅 丁巳 甲午 己巳	无	芒种 (6, 5)	虎	双子座	祭祀、宴会、沐浴、剃头、扫舍宇、安葬、庆赐、裁制、颁诏、恤孤茕、整容、覃恩、雪冤、宣政事、整手足甲	冠带、修置产室、畋猎、筑堤防、取鱼、苫盖、修宫室、乘船渡水、开仓
2058-06-02	二零五八 戊寅[虎]年 闰四月大十二	周日	无	无	无	戊寅 丁巳 乙未 辛巳	无	芒种 (6, 5)	虎	双子座	覃恩、恤孤茕、雪冤	祭祀、剃头、冠带、修置产室、开渠、穿井、安碓硙、平治道涂、破屋坏垣、伐木、畋猎、启攒、补垣、鼓铸、乘船渡水、整容、布政事、筑堤防、取鱼、修饰垣墙、远回、整手足甲
2058-06-03	二零五八 戊寅[虎]年 闰四月大十三	周一	无	无	无	戊寅 丁巳 丙申 癸巳	无	芒种 (6, 5)	虎	双子座	祭祀、出行、结婚姻、宴会、嫁娶、沐浴、剃头、修造、求医疗病、上表章、上官、进人口、竖柱上梁、经络、开市、纳财、扫舍宇、平治道涂、栽种、牧养、安葬、庆赐、临政、搬移、裁制、开仓、纳采、修仓库、颁诏、恤孤茕、解除、出师、纳畜、招贤、整容、选将、覃恩、举正直、酝酿、求嗣、雪冤、营建、缮城郭、修饰垣墙、施恩、安抚边境、宣政事、上册、整手足甲、立券交易、祈福	诸事不忌
2058-06-04	二零五八 戊寅[虎]年 闰四月大十四	周二	无	纯阳祖师诞	无	戊寅 丁巳 丁酉 乙巳	无	芒种 (6, 5)	虎	双子座	沐浴、修造、冠带、进人口、竖柱上梁、经络、安碓硙、扫舍宇、牧养、安葬、搬移、裁制、纳畜、酝酿、缮城郭、修宫室、整手足甲	出行、宴会、剃头、上表章、修置产室、上册、苫盖、乘船渡水、开仓
2058-06-05	二零五八 戊寅[虎]年 闰四月大十五	周三	无	钟离祖师诞	世界环境日	戊寅 戊午 戊戌 丁巳	芒种	夏至 (6, 21)	虎	双子座	祭祀、出行、结婚姻、宴会、嫁娶、修造、上官、冠带、进人口、竖柱上梁、经络、安碓硙、牧养、庆赐、临政、搬移、裁制、纳采、入宅、纳畜、举正直、酝酿、求嗣、缮城郭、施恩、修宫室、祈福	剃头、修置产室、整容、整手足甲
2058-06-06	二零五八 戊寅[虎]年 闰四月大十六	周四	无	无	全国爱眼日	戊寅 戊午 己亥 己巳	无	夏至 (6, 21)	虎	双子座	祭祀、沐浴、捕捉、恤孤茕、覃恩、雪冤	嫁娶、剃头、冠带、修置产室、开渠、穿井、安碓硙、破屋坏垣、畋猎、破土、启攒、补垣、鼓铸、布政事、整容、筑堤防、取鱼、修饰垣墙、塞穴、整手足甲
2058-06-07	二零五八 戊寅[虎]年 闰四月大十七	周五	无	十殿转轮王诞	无	戊寅 戊午 庚子 辛巳	无	夏至 (6, 21)	虎	双子座	诸事不宜	诸事不宜
2058-06-08	二零五八 戊寅[虎]年 闰四月大十八	周六	无	紫徽大帝诞	世界海洋日	戊寅 戊午 辛丑 癸巳	无	夏至 (6, 21)	虎	双子座	祭祀、恤孤茕、覃恩、雪冤	剃头、冠带、修置产室、开渠、穿井、安碓硙、破屋坏垣、畋猎、破土、启攒、补垣、开仓、鼓铸、布政事、整容、筑堤防、取鱼、修饰垣墙、塞穴、整手足甲、修宫室
2058-06-09	二零五八 戊寅[虎]年 闰四月大十九	周日	无	无	无	戊寅 戊午 壬寅 乙巳	无	夏至 (6, 21)	虎	双子座	结婚姻、宴会、上表章、上官、入学、进人口、竖柱上梁、经络、开市、纳财、安碓硙、栽种、牧养、庆赐、临政、裁制、纳采、立券交易、筑堤防、举正直、酝酿、求嗣、缮城郭、施恩、修宫室、祈福	祭祀、开渠、穿井、选将、远回、整手足甲、出师
2058-06-10	二零五八 戊寅[虎]年 闰四月大二十	周一	无	眼光圣母诞	无	戊寅 戊午 癸卯 丁巳	无	夏至 (6, 21)	虎	双子座	祭祀、赴任、入宅	求医疗病、上表章、上官、冠带、竖柱上梁、修置产室、开渠、穿井、畋猎、安葬、庆赐、补垣、临政、裁制、开仓、修仓库、鼓铸、颁诏、解除、乘船渡水、出师、招贤、布政事、选将、筑堤防、举正直、针刺、营建、缮城郭、施恩、安抚边境、取鱼、宣政事、上册、塞穴、修宫室
2058-06-11	二零五八 戊寅[虎]年 闰四月大廿一	周二	无	无	中国人口日	戊寅 戊午 甲辰 己巳	无	夏至 (6, 21)	虎	双子座	出行、结婚姻、宴会、修造、求医疗病、上表章、上官、入学、竖柱上梁、开市、纳财、修置产室、开渠、穿井、安碓硙、栽种、牧养、庆赐、临政、搬移、裁制、纳采、赴任、颁诏、恤孤茕、解除、招贤、覃恩、举正直、求嗣、雪冤、缮城郭、施恩、宣政事、上册、修宫室、祈福、诉讼	伐木、畋猎、取鱼、整手足甲、乘船渡水
2058-06-12	二零五八 戊寅[虎]年 闰四月大廿二	周三	无	无	无	戊寅 戊午 乙巳 辛巳	无	夏至 (6, 21)	虎	双子座	补垣、裁制、恤孤茕、筑堤防、选将、覃恩、雪冤、安抚边境、塞穴	出行、结婚姻、宴会、嫁娶、安床、修造、求医疗病、上表章、上官、进人口、竖柱上梁、开市、修置产室、开渠、穿井、栽种、破土、安葬、启攒、庆赐、临政、搬移、开仓、纳采、颁诏、解除、出师、招贤、布政事、举正直、疗目、针刺、求嗣、营建、施恩、宣政事、上册、修宫室、祈福
2058-06-13	二零五八 戊寅[虎]年 闰四月大廿三	周四	无	无	无	戊寅 戊午 丙午 癸巳	无	夏至 (6, 21)	虎	双子座	祭祀、覃恩、恤孤茕、雪冤	出行、结婚姻、宴会、嫁娶、安床、剃头、修造、求医疗病、上表章、上官、冠带、进人口、竖柱上梁、经络、开市、纳财、修置产室、开渠、穿井、安碓硙、平治道涂、破屋坏垣、伐木、畋猎、栽种、牧养、破土、安葬、启攒、庆赐、补垣、临政、搬移、裁制、开仓、纳采、修仓库、鼓铸、颁诏、解除、纳畜、出师、乘船渡水、招贤、整容、布政事、选将、筑堤防、举正直、酝酿、求嗣、营建、缮城郭、取鱼、施恩、宣政事、安抚边境、修饰垣墙、上册、苫盖、塞穴、整手足甲、修宫室、远回、立券交易、祈福
2058-06-14	二零五八 戊寅[虎]年 闰四月大廿四	周五	无	无	世界献血日	戊寅 戊午 丁未 乙巳	无	夏至 (6, 21)	虎	双子座	出行、宴会、沐浴、上官、进人口、经络、纳财、扫舍宇、临政、裁制、解除、纳畜、举正直、酝酿、施恩、整手足甲、立券交易	剃头、启攒、纳采
2058-06-15	二零五八 戊寅[虎]年 闰四月大廿五	周六	无	无	无	戊寅 戊午 戊申 丁巳	无	夏至 (6, 21)	虎	双子座	沐浴、剃头、上表章、进人口、竖柱上梁、经络、开市、纳财、扫舍宇、栽种、牧养、破土、安葬、补垣、裁制、入宅、解除、出师、整容、选将、求嗣、缮城郭、安抚边境、塞穴、上册、修宫室、整手足甲、祈福	祭祀、招贤
2058-06-16	二零五八 戊寅[虎]年 闰四月大廿六	周日	无	无	父亲节	戊寅 戊午 己酉 己巳	无	夏至 (6, 21)	虎	双子座	沐浴、剃头、扫舍宇、平治道涂、恤孤茕、整容、覃恩、雪冤、修饰垣墙、整手足甲	祭祀、出行、结婚姻、宴会、嫁娶、安床、修造、求医疗病、上表章、上官、冠带、进人口、竖柱上梁、经络、开市、纳财、修置产室、开渠、穿井、栽种、牧养、破土、安葬、启攒、庆赐、临政、搬移、裁制、开仓、纳采、修仓库、鼓铸、颁诏、解除、纳畜、出师、招贤、布政事、选将、筑堤防、举正直、酝酿、求嗣、营建、缮城郭、施恩、安抚边境、宣政事、上册、修宫室、立券交易、祈福
2058-06-17	二零五八 戊寅[虎]年 闰四月大廿七	周一	无	无	无	戊寅 戊午 庚戌 辛巳	无	夏至 (6, 21)	虎	双子座	祭祀、宴会、修造、上官、冠带、进人口、竖柱上梁、安碓硙、庆赐、临政、裁制、纳采、恤孤茕、纳畜、布政事、覃恩、酝酿、雪冤、缮城郭、修宫室、祈福	求医疗病、开市、修置产室、栽种、开仓、解除
2058-06-18	二零五八 戊寅[虎]年 闰四月大廿八	周二	无	无	无	戊寅 戊午 辛亥 癸巳	无	夏至 (6, 21)	虎	双子座	祭祀、沐浴、捕捉、恤孤茕、覃恩、雪冤	嫁娶、剃头、冠带、修置产室、开渠、穿井、安碓硙、破屋坏垣、畋猎、破土、启攒、补垣、鼓铸、整容、筑堤防、取鱼、修饰垣墙、塞穴、整手足甲、修宫室
2058-06-19	二零五八 戊寅[虎]年 闰四月大廿九	周三	无	无	无	戊寅 戊午 壬子 乙巳	无	夏至 (6, 21)	虎	双子座	诸事不宜	诸事不宜
2058-06-20	二零五八 戊寅[虎]年 闰四月大三十	周四	无	无	无	戊寅 戊午 癸丑 丁巳	无	夏至 (6, 21)	虎	双子座	祭祀、入宅、覃恩、赴任、恤孤茕、雪冤	结婚姻、剃头、求医疗病、上表章、上官、冠带、竖柱上梁、修置产室、开渠、穿井、安碓硙、破屋坏垣、栽种、牧养、破土、安葬、启攒、补垣、临政、裁制、开仓、修仓库、鼓铸、颁诏、解除、纳畜、出师、招贤、整容、筑堤防、举正直、求嗣、营建、缮城郭、施恩、修饰垣墙、宣政事、上册、塞穴、整手足甲、修宫室
2058-06-21	二零五八 戊寅[虎]年 五月小初一	周五	无	南极长生大帝诞	无	戊寅 戊午 甲寅 己巳	夏至	小暑 (7, 7)	虎	双子座	宴会、上官、入学、进人口、竖柱上梁、经络、开市、纳财、安碓硙、栽种、牧养、庆赐、临政、裁制、立券交易、修仓库、筑堤防、举正直、酝酿、求嗣、缮城郭、施恩、修宫室、祈福	祭祀、求医疗病、选将、远回、整手足甲、开仓、出师
2058-06-22	二零五八 戊寅[虎]年 五月小初二	周六	无	无	无	戊寅 戊午 乙卯 辛巳	无	小暑 (7, 7)	虎	巨蟹座	祭祀	出行、结婚姻、宴会、嫁娶、安床、修造、求医疗病、上表章、上官、冠带、进人口、竖柱上梁、经络、开市、纳财、修置产室、开渠、穿井、捕捉、畋猎、栽种、牧养、破土、安葬、启攒、庆赐、补垣、临政、搬移、裁制、开仓、纳采、修仓库、鼓铸、颁诏、解除、乘船渡水、出师、纳畜、招贤、布政事、选将、筑堤防、举正直、酝酿、针刺、求嗣、营建、缮城郭、施恩、安抚边境、宣政事、取鱼、上册、塞穴、修宫室、立券交易、祈福
2058-06-23	二零五八 戊寅[虎]年 五月小初三	周日	无	无	无	戊寅 戊午 丙辰 癸巳	无	小暑 (7, 7)	虎	巨蟹座	出行、宴会、修造、求医疗病、上表章、上官、入学、竖柱上梁、开市、纳财、修置产室、开渠、穿井、安碓硙、栽种、牧养、庆赐、临政、搬移、裁制、纳采、赴任、颁诏、恤孤茕、解除、出师、纳畜、招贤、选将、覃恩、举正直、求嗣、雪冤、营建、缮城郭、施恩、安抚边境、宣政事、上册、修宫室、祈福、诉讼	伐木、畋猎、取鱼
2058-06-24	二零五八 戊寅[虎]年 五月小初四	周一	无	无	无	戊寅 戊午 丁巳 乙巳	无	小暑 (7, 7)	虎	巨蟹座	补垣、裁制、恤孤茕、筑堤防、覃恩、雪冤、塞穴	出行、结婚姻、宴会、嫁娶、安床、剃头、修造、求医疗病、上表章、上官、进人口、竖柱上梁、开市、修置产室、开渠、穿井、破土、安葬、启攒、庆赐、临政、搬移、开仓、纳采、颁诏、解除、出师、招贤、布政事、整容、选将、举正直、针刺、求嗣、营建、施恩、安抚边境、宣政事、上册、修宫室、疗目、祈福
2058-06-25	二零五八 戊寅[虎]年 五月小初五	周二	端午节	无	无	戊寅 戊午 戊午 丁巳	无	小暑 (7, 7)	虎	巨蟹座	祭祀、入宅	出行、结婚姻、宴会、嫁娶、安床、剃头、修造、求医疗病、上表章、上官、冠带、进人口、竖柱上梁、经络、开市、立券、纳财、修置产室、开渠、穿井、安碓硙、平治道涂、破屋坏垣、伐木、栽种、牧养、破土、安葬、启攒、庆赐、补垣、开张、临政、搬移、裁制、开仓、纳采、修仓库、鼓铸、颁诏、解除、纳畜、出师、乘船渡水、招贤、整容、布政事、选将、筑堤防、举正直、酝酿、求嗣、营建、缮城郭、施恩、宣政事、安抚边境、修饰垣墙、上册、苫盖、塞穴、整手足甲、修宫室、远回、立券交易、祈福
2058-06-26	二零五八 戊寅[虎]年 五月小初六	周三	无	无	无	戊寅 戊午 己未 己巳	无	小暑 (7, 7)	虎	巨蟹座	祭祀、出行、宴会、沐浴、剃头、修造、上官、进人口、竖柱上梁、经络、纳财、扫舍宇、栽种、牧养、安葬、庆赐、临政、搬移、裁制、开仓、立券交易、解除、纳畜、整容、举正直、酝酿、求嗣、缮城郭、施恩、修宫室、祈福	诸事不忌
2058-06-27	二零五八 戊寅[虎]年 五月小初七	周四	无	无	无	戊寅 戊午 庚申 辛巳	无	小暑 (7, 7)	虎	巨蟹座	沐浴、剃头、上表章、进人口、竖柱上梁、开市、纳财、扫舍宇、安葬、补垣、裁制、解除、整容、缮城郭、塞穴、上册、修宫室、整手足甲	祭祀、结婚姻、嫁娶、安床、修造、招贤、举正直、施恩、纳采
2058-06-28	二零五八 戊寅[虎]年 五月小初八	周五	无	南方五道诞	无	戊寅 戊午 辛酉 癸巳	无	小暑 (7, 7)	虎	巨蟹座	沐浴、剃头、扫舍宇、平治道涂、恤孤茕、整容、覃恩、雪冤、修饰垣墙、整手足甲	宴会、冠带、修置产室、开渠、穿井、畋猎、启攒、筑堤防、布政事、取鱼、鼓铸、修宫室、开仓
2058-06-29	二零五八 戊寅[虎]年 五月小初九	周六	无	无	无	戊寅 戊午 壬戌 乙巳	无	小暑 (7, 7)	虎	巨蟹座	祭祀、结婚姻、宴会、嫁娶、上官、冠带、进人口、竖柱上梁、经络、安碓硙、庆赐、临政、裁制、纳采、纳畜、酝酿、缮城郭、修宫室、祈福	求医疗病、开市、修置产室、开渠、穿井、栽种、解除、开仓
2058-06-30	二零五八 戊寅[虎]年 五月小初十	周日	无	无	无	戊寅 戊午 癸亥 丁巳	无	小暑 (7, 7)	虎	巨蟹座	祭祀、沐浴、捕捉、赴任、入宅、恤孤茕、覃恩、雪冤	嫁娶、剃头、冠带、修置产室、开渠、穿井、安碓硙、破屋坏垣、畋猎、破土、启攒、补垣、鼓铸、布政事、整容、筑堤防、取鱼、修饰垣墙、塞穴、整手足甲、修宫室
