2058-04-01	2058-3-9	30	满	一	戊寅 乙卯 癸巳	无	清明 (4, 4)	愚人节	无	无	上梁 交易 修造 安床 开光 开市 盖屋 立券 纳财 起基	入宅 出行 动土 嫁娶 安葬 破土 移徙 行丧 词讼 谢土 赴任
2058-04-02	2058-3-10	30	平	二	戊寅 乙卯 甲午	无	清明 (4, 4)	无	无	无	修饰垣墙 冠笄 嫁娶 平治道涂 祈福 祭祀 置产	交易 作灶 出货财 开仓 开市 栽种 盖屋 立券
2058-04-03	2058-3-11	30	定	三	戊寅 乙卯 乙未	无	清明 (4, 4)	无	无	无	修造 入宅 出火 出行 嫁娶 安床 安门 开光 扫舍 拆卸 挂匾 求嗣 祈福 祭祀 移徙 纳财 进人口	伐木 动土 安葬 行丧
2058-04-04	2058-3-12	30	定	四	戊寅 丙辰 丙申	清明	谷雨 (4, 20)	无	无	无	入殓 动土 安葬 开市 斋醮 破土 祭祀	入宅 嫁娶 移徙
2058-04-05	2058-3-13	30	执	五	戊寅 丙辰 丁酉	无	谷雨 (4, 20)	无	无	无	出行 嫁娶 求医 祈福 祭祀 移徙 纳采	动土 开市 破土
2058-04-06	2058-3-14	30	破	六	戊寅 丙辰 戊戌	无	谷雨 (4, 20)	无	无	无	求医 治病 祭祀 解除 馀事勿取	诸事不宜
2058-04-07	2058-3-15	30	危	日	戊寅 丙辰 己亥	无	谷雨 (4, 20)	无	无	无	取渔 沐浴 结网	入宅 嫁娶 安葬
2058-04-08	2058-3-16	30	成	一	戊寅 丙辰 庚子	无	谷雨 (4, 20)	无	无	无	无	诸事不宜
2058-04-09	2058-3-17	30	收	二	戊寅 丙辰 辛丑	无	谷雨 (4, 20)	无	无	无	坏垣 解除 馀事勿取	诸事不宜
2058-04-10	2058-3-18	30	开	三	戊寅 丙辰 壬寅	无	谷雨 (4, 20)	无	无	无	交易 入宅 出火 出行 嫁娶 安床 开光 开市 拆卸 挂匾 栽种 移徙 立券 进人口	作灶 入殓 安葬 探病 祈福 祭祀
2058-04-11	2058-3-19	30	闭	四	戊寅 丙辰 癸卯	无	谷雨 (4, 20)	无	无	无	交易 作灶 入殓 冠笄 出行 合帐 嫁娶 安床 安葬 成服 破土 移柩 立券 除服	开光 开市 词讼
2058-04-12	2058-3-20	30	建	五	戊寅 丙辰 甲辰	无	谷雨 (4, 20)	无	无	无	修饰垣墙 出行 教牛马 造畜稠 馀事勿取	诸事不宜
2058-04-13	2058-3-21	30	除	六	戊寅 丙辰 乙巳	无	谷雨 (4, 20)	无	无	无	伐木 修造 入宅 出火 动土 安床 开光 拆卸 求嗣 祈福 祭祀 移徙 解除 造畜稠	作灶 出行 嫁娶 安葬 开市 栽种 立券 纳财
2058-04-14	2058-3-22	30	满	日	戊寅 丙辰 丙午	无	谷雨 (4, 20)	无	无	无	会亲友 入殓 出行 启钻 嫁娶 安床 开光 开市 栽种 牧养 理发 移柩 纳采	上梁 作灶 修造 入宅 安门 斋醮 祈福 谢土
2058-04-15	2058-3-23	30	平	一	戊寅 丙辰 丁未	无	谷雨 (4, 20)	无	无	无	修饰垣墙 平治道涂 祭祀 解除 馀事勿取	诸事不宜
2058-04-16	2058-3-24	30	定	二	戊寅 丙辰 戊申	无	谷雨 (4, 20)	无	无	无	交易 动土 开光 扫舍 祈福 祭祀 纳畜 纳财 解除	作灶 出行 嫁娶 安床 安葬 置产 赴任 进人口
2058-04-17	2058-3-25	30	执	三	戊寅 丙辰 己酉	无	谷雨 (4, 20)	无	无	无	修造 入宅 出火 启钻 安床 安葬 安门 开光 拆卸 求嗣 祈福 祭祀 纳畜 解除	交易 伐木 动土 开市 挂匾 掘井 破土 纳财
2058-04-18	2058-3-26	30	破	四	戊寅 丙辰 庚戌	无	谷雨 (4, 20)	无	无	无	坏垣 破屋 祭祀 解除 馀事勿取	诸事不宜
2058-04-19	2058-3-27	30	危	五	戊寅 丙辰 辛亥	无	谷雨 (4, 20)	无	无	无	塞穴 扫舍 馀事勿取	诸事不宜
2058-04-20	2058-3-28	30	成	六	戊寅 丙辰 壬子	谷雨	立夏 (5, 5)	无	无	无	上梁 入殓 冠笄 出火 动土 安床 安葬 开光 开池 拆卸 掘井 求嗣 破土 祈福 祭祀 移柩 纳采 解除 进人口 造庙	无
2058-04-21	2058-3-29	30	收	日	戊寅 丙辰 癸丑	无	立夏 (5, 5)	无	无	无	破屋 解除 馀事勿取	诸事不宜
2058-04-22	2058-3-30	30	开	一	戊寅 丙辰 甲寅	无	立夏 (5, 5)	无	无	无	交易 入宅 出火 出行 动土 嫁娶 安床 开光 开市 拆卸 求嗣 破土 祈福 移徙 立券 解除 谢土	入殓 安葬 探病 祭祀
2058-04-23	2058-4-1	29	闭	二	戊寅 丙辰 乙卯	无	立夏 (5, 5)	无	无	无	交易 入殓 冠笄 启钻 塞穴 安床 安葬 开池 成服 破土 祭祀 立券 补垣 裁衣 谢土 除服	嫁娶 开光 开市 掘井 探病 栽种
2058-04-24	2058-4-2	29	建	三	戊寅 丙辰 丙辰	无	立夏 (5, 5)	无	无	无	出行 扫舍 教牛马 祭祀 馀事勿取	伐木 安葬 开光 破土
2058-04-25	2058-4-3	29	除	四	戊寅 丙辰 丁巳	无	立夏 (5, 5)	无	无	无	开光 扫舍 栽种 求嗣 牧养 祈福 祭祀 纳畜 纳采 解除 订盟 进人口	作灶 修坟 入宅 出行 安葬 盖屋 造桥
2058-04-26	2058-4-4	29	满	五	戊寅 丙辰 戊午	无	立夏 (5, 5)	无	无	无	交易 出行 塞穴 嫁娶 安床 开光 开市 理发	上梁 修造 入宅 出火 动土 安葬 破土 祈福 置产
2058-04-27	2058-4-5	29	平	六	戊寅 丙辰 己未	无	立夏 (5, 5)	无	无	无	作灶 修饰垣墙 平治道涂 畋猎 祭祀 结网 馀事勿取	嫁娶 安床 治病
2058-04-28	2058-4-6	29	定	日	戊寅 丙辰 庚申	无	立夏 (5, 5)	无	无	无	安葬 沐浴 破土 祭祀 移柩 解除 谢土 馀事勿取	上梁 入宅 嫁娶 开光 斋醮
2058-04-29	2058-4-7	29	执	一	戊寅 丙辰 辛酉	无	立夏 (5, 5)	无	无	无	入殓 取渔 启钻 安葬 成服 扫舍 捕捉 整手足甲 斋醮 畋猎 祭祀 移柩 解除 谢土 除服	动土 破土
2058-04-30	2058-4-8	29	破	二	戊寅 丙辰 壬戌	无	立夏 (5, 5)	无	无	无	坏垣 求医 沐浴 治病 破屋 祭祀 解除 馀事勿取	嫁娶 开市
