2067-04-01 10:00:00	二零六七 丁亥[猪]年 二月大十八	星期五	国、际、愚、人、节、至、圣、先、师、孔、子、讳、辰	丁亥 癸卯 庚辰 辛巳	无	清明 (4, 5)	猪	白羊座	出行、沐浴、剃头、扫舍宇、施恩、解除、整容、布政事、整手足甲、举正直、覃恩、恤孤茕、雪冤、临政	结婚姻、宴会、嫁娶、修造、求医疗病、上表章、上官、进人口、经络、开市、纳财、修置产室、畋猎、牧养、破土、安葬、启攒、开仓、纳畜、选将、出师、修仓库、祈福、上册、纳采、求嗣、立券交易、酝酿、安抚边境、庆赐
2067-04-02 10:00:00	二零六七 丁亥[猪]年 二月大十九	星期六	国、际、儿、童、图、书、日、观、音、大、士、诞	丁亥 癸卯 辛巳 癸巳	无	清明 (4, 5)	猪	白羊座	宴会、竖柱上梁、经络、开市、纳财、布政事、祈福、覃恩、恤孤茕、立券交易、塞穴、裁制、庆赐、雪冤	祭祀、出行、结婚姻、嫁娶、修造、修置产室、开渠、穿井、安碓硙、平治道涂、破屋坏垣、捕捉、畋猎、栽种、破土、启攒、营建、纳畜、招贤、施恩、选将、颁诏、修饰垣墙、出师、取鱼、整手足甲、纳采、宣政事、举正直、筑堤防、酝酿、安抚边境
2067-04-03 10:00:00	二零六七 丁亥[猪]年 二月大二十	星期日	无	丁亥 癸卯 壬午 乙巳	无	清明 (4, 5)	猪	白羊座	祭祀、平治道涂、修饰垣墙、入宅、覃恩、恤孤茕、雪冤	上表章、冠带、修置产室、开渠、穿井、启攒、营建、招贤、选将、苫盖、安抚边境、宣政事、筑堤防、颁诏、出师、上册、鼓铸、修仓库
2067-04-04 10:00:00	二零六七 丁亥[猪]年 二月大廿一	星期一	普、贤、菩、萨、诞	丁亥 癸卯 癸未 丁巳	无	清明 (4, 5)	猪	白羊座	祭祀、结婚姻、宴会、嫁娶、冠带、进人口、竖柱上梁、经络、纳畜、布政事、祈福、纳采、求嗣、覃恩、恤孤茕、酝酿、裁制、庆赐、雪冤	求医疗病、上表章、开市、修置产室、开渠、穿井、平治道涂、破屋坏垣、栽种、营建、开仓、选将、解除、针刺、修饰垣墙、出师、补垣、整手足甲、上册、筑堤防、安抚边境
2067-04-05 10:00:00	二零六七 丁亥[猪]年 二月大廿二	星期二	清、明、节	丁亥 甲辰 甲申 己巳	清明	谷雨 (4, 20)	猪	白羊座	沐浴、扫舍宇	出行、结婚姻、宴会、嫁娶、安床、剃头、修造、求医疗病、上表章、上官、冠带、进人口、竖柱上梁、经络、开市、纳财、修置产室、开渠、穿井、安碓硙、平治道涂、破屋坏垣、伐木、捕捉、畋猎、栽种、牧养、破土、安葬、启攒、营建、开仓、纳畜、招贤、选将、施恩、解除、颁诏、整容、修饰垣墙、出师、布政事、修仓库、祈福、缮城郭、补垣、取鱼、鼓铸、上册、整手足甲、远回、纳采、求嗣、宣政事、举正直、筑堤防、立券交易、塞穴、酝酿、裁制、搬移、安抚边境、庆赐、临政、修宫室
2067-04-06 10:00:00	二零六七 丁亥[猪]年 二月大廿三	星期三	无	丁亥 甲辰 乙酉 辛巳	无	谷雨 (4, 20)	猪	白羊座	祭祀、出行、结婚姻、嫁娶、沐浴、剃头、修造、求医疗病、上表章、上官、进人口、竖柱上梁、经络、开市、纳财、扫舍宇、捕捉、栽种、牧养、安葬、营建、纳畜、招贤、施恩、选将、解除、颁诏、整容、修仓库、祈福、缮城郭、取鱼、上册、整手足甲、纳采、求嗣、宣政事、举正直、覃恩、恤孤茕、立券交易、酝酿、裁制、搬移、安抚边境、雪冤、临政	宴会、冠带、修置产室、开渠、穿井、安碓硙、平治道涂、破屋坏垣、乘船渡水、开仓、补垣、筑堤防、修宫室、修饰垣墙、出师
2067-04-07 10:00:00	二零六七 丁亥[猪]年 二月大廿四	星期四	世、界、卫、生、日	丁亥 甲辰 丙戌 癸巳	无	谷雨 (4, 20)	猪	白羊座	祭祀、沐浴、求医疗病、破屋坏垣、解除	冠带、修置产室、开渠、穿井、安碓硙、伐木、破土、安葬、启攒、营建、纳畜、招贤、颁诏、修饰垣墙、修仓库、布政事、补垣、取鱼、鼓铸、上册、乘船渡水、宣政事、筑堤防、塞穴
2067-04-08 10:00:00	二零六七 丁亥[猪]年 二月大廿五	星期五	无	丁亥 甲辰 丁亥 乙巳	无	谷雨 (4, 20)	猪	白羊座	祭祀、结婚姻、宴会、安床、沐浴、修造、上表章、上官、竖柱上梁、纳财、栽种、牧养、赴任、营建、纳畜、招贤、施恩、颁诏、缮城郭、入宅、上册、纳采、宣政事、举正直、覃恩、恤孤茕、裁制、搬移、庆赐、雪冤、临政、修宫室	嫁娶、剃头、畋猎、破土、启攒、整容、取鱼
2067-04-09 10:00:00	二零六七 丁亥[猪]年 二月大廿六	星期六	无	丁亥 甲辰 戊子 丁巳	无	谷雨 (4, 20)	猪	白羊座	祭祀、结婚姻、宴会、嫁娶、沐浴、修造、上官、入学、进人口、竖柱上梁、经络、开市、纳财、安碓硙、栽种、牧养、赴任、纳畜、施恩、选将、出师、修仓库、缮城郭、祈福、纳采、举正直、筑堤防、立券交易、酝酿、诉讼、裁制、安抚边境、庆赐、临政、修宫室	破土、启攒、远回
2067-04-10 10:00:00	二零六七 丁亥[猪]年 二月大廿七	星期日	无	丁亥 甲辰 己丑 己巳	无	谷雨 (4, 20)	猪	白羊座	进人口、纳财、捕捉、纳畜、取鱼	出行、结婚姻、宴会、嫁娶、安床、修造、求医疗病、上表章、上官、冠带、竖柱上梁、经络、开市、修置产室、开渠、穿井、破土、安葬、启攒、营建、开仓、招贤、施恩、解除、颁诏、布政事、修仓库、缮城郭、鼓铸、上册、纳采、宣政事、举正直、修宫室、筑堤防、立券交易、酝酿、裁制、搬移、庆赐、临政
2067-04-11 10:00:00	二零六七 丁亥[猪]年 二月大廿八	星期一	无	丁亥 甲辰 庚寅 辛巳	无	谷雨 (4, 20)	猪	白羊座	出行、结婚姻、宴会、求医疗病、上表章、上官、入学、竖柱上梁、开市、纳财、修置产室、开渠、穿井、安碓硙、栽种、牧养、开仓、招贤、施恩、选将、解除、颁诏、祈福、缮城郭、上册、纳采、求嗣、宣政事、举正直、修宫室、覃恩、恤孤茕、立券交易、裁制、搬移、安抚边境、庆赐、雪冤、临政	祭祀、嫁娶、伐木、畋猎、乘船渡水、针刺、取鱼、出师
2067-04-12 10:00:00	二零六七 丁亥[猪]年 二月大廿九	星期二	无	丁亥 甲辰 辛卯 癸巳	无	谷雨 (4, 20)	猪	白羊座	补垣、塞穴	出行、结婚姻、宴会、嫁娶、安床、修造、求医疗病、上表章、上官、冠带、进人口、竖柱上梁、经络、开市、纳财、修置产室、开渠、穿井、栽种、牧养、破土、安葬、启攒、营建、开仓、纳畜、招贤、施恩、选将、解除、针刺、颁诏、出师、布政事、修仓库、祈福、缮城郭、上册、疗目、纳采、求嗣、宣政事、举正直、筑堤防、立券交易、酝酿、搬移、安抚边境、庆赐、临政、修宫室
2067-04-13 10:00:00	二零六七 丁亥[猪]年 二月大三十	星期三	无	丁亥 甲辰 壬辰 乙巳	无	谷雨 (4, 20)	猪	白羊座	祭祀、入宅、覃恩、恤孤茕、雪冤	安床、剃头、冠带、开市、修置产室、开渠、穿井、平治道涂、破屋坏垣、伐木、畋猎、破土、启攒、开仓、整容、修饰垣墙、布政事、补垣、取鱼、鼓铸、整手足甲、筑堤防、塞穴
2067-04-14 10:00:00	二零六七 丁亥[猪]年 三月小初一	星期四	二、殿、楚、江、王、诞	丁亥 甲辰 癸巳 丁巳	无	谷雨 (4, 20)	猪	白羊座	沐浴、扫舍宇、恤孤茕、雪冤	出行、结婚姻、宴会、嫁娶、安床、修造、上表章、冠带、进人口、竖柱上梁、修置产室、开渠、穿井、安碓硙、破屋坏垣、破土、安葬、启攒、营建、招贤、颁诏、修饰垣墙、修仓库、布政事、祈福、缮城郭、补垣、鼓铸、上册、纳采、求嗣、宣政事、筑堤防、塞穴、裁制、搬移、庆赐、修宫室
2067-04-15 10:00:00	二零六七 丁亥[猪]年 三月小初二	星期五	无	丁亥 甲辰 甲午 己巳	无	谷雨 (4, 20)	猪	白羊座	诸事不宜	祭祀、出行、结婚姻、宴会、嫁娶、安床、剃头、修造、求医疗病、上表章、上官、冠带、进人口、竖柱上梁、经络、开市、纳财、修置产室、开渠、穿井、安碓硙、破屋坏垣、栽种、牧养、破土、安葬、启攒、营建、开仓、纳畜、招贤、施恩、选将、苫盖、解除、颁诏、整容、修饰垣墙、出师、布政事、修仓库、祈福、缮城郭、补垣、入宅、鼓铸、上册、整手足甲、纳采、求嗣、宣政事、举正直、修宫室、筑堤防、立券交易、塞穴、酝酿、裁制、搬移、安抚边境、庆赐、临政
2067-04-16 10:00:00	二零六七 丁亥[猪]年 三月小初三	星期六	三、月、三、-、玄、天、上、帝、诞	丁亥 甲辰 乙未 辛巳	无	谷雨 (4, 20)	猪	白羊座	诸事不宜	诸事不宜
2067-04-17 10:00:00	二零六七 丁亥[猪]年 三月小初四	星期日	无	丁亥 甲辰 丙申 癸巳	无	谷雨 (4, 20)	猪	白羊座	祭祀、沐浴、扫舍宇	出行、结婚姻、宴会、嫁娶、安床、剃头、修造、求医疗病、上表章、上官、冠带、进人口、竖柱上梁、经络、开市、纳财、修置产室、开渠、穿井、安碓硙、平治道涂、破屋坏垣、伐木、捕捉、畋猎、栽种、牧养、破土、安葬、启攒、营建、开仓、纳畜、招贤、选将、施恩、解除、颁诏、整容、修饰垣墙、出师、布政事、修仓库、祈福、缮城郭、补垣、取鱼、鼓铸、上册、整手足甲、远回、纳采、求嗣、宣政事、举正直、筑堤防、立券交易、塞穴、酝酿、裁制、搬移、安抚边境、庆赐、临政、修宫室
2067-04-18 10:00:00	二零六七 丁亥[猪]年 三月小初五	星期一	无	丁亥 甲辰 丁酉 乙巳	无	谷雨 (4, 20)	猪	白羊座	祭祀、出行、结婚姻、嫁娶、沐浴、修造、求医疗病、上表章、上官、进人口、竖柱上梁、经络、纳财、扫舍宇、捕捉、栽种、牧养、安葬、赴任、营建、开仓、纳畜、招贤、施恩、选将、解除、颁诏、修仓库、出师、祈福、缮城郭、入宅、上册、整手足甲、纳采、求嗣、宣政事、举正直、覃恩、恤孤茕、立券交易、酝酿、裁制、搬移、安抚边境、雪冤、临政、修宫室	宴会、剃头、冠带、修置产室、开渠、穿井、安碓硙、平治道涂、破屋坏垣、畋猎、修饰垣墙、乘船渡水、补垣、筑堤防、取鱼
2067-04-19 10:00:00	二零六七 丁亥[猪]年 三月小初六	星期二	无	丁亥 甲辰 戊戌 丁巳	无	谷雨 (4, 20)	猪	白羊座	祭祀、沐浴、求医疗病、解除	结婚姻、宴会、安床、修造、上官、冠带、进人口、竖柱上梁、经络、开市、纳财、修置产室、开渠、穿井、安碓硙、平治道涂、伐木、栽种、牧养、破土、安葬、启攒、营建、开仓、纳畜、招贤、施恩、颁诏、修饰垣墙、布政事、修仓库、缮城郭、补垣、取鱼、鼓铸、上册、乘船渡水、纳采、求嗣、宣政事、举正直、筑堤防、立券交易、塞穴、酝酿、庆赐、临政、修宫室
2067-04-20 10:00:00	二零六七 丁亥[猪]年 三月小初七	星期三	无	丁亥 甲辰 己亥 己巳	谷雨	立夏 (5, 5)	猪	白羊座	安床、沐浴、纳财、牧养、纳畜、选将、安抚边境、取鱼、出师	出行、结婚姻、嫁娶、修造、求医疗病、修置产室、开渠、穿井、安碓硙、平治道涂、破屋坏垣、畋猎、破土、安葬、启攒、营建、开仓、解除、修饰垣墙、修仓库、缮城郭、祈福、补垣、求嗣、筑堤防、修宫室
2067-04-21 10:00:00	二零六七 丁亥[猪]年 三月小初八	星期四	六、殿、卞、城、王、诞	丁亥 甲辰 庚子 辛巳	无	立夏 (5, 5)	猪	金牛座	祭祀、结婚姻、宴会、嫁娶、沐浴、上官、入学、进人口、竖柱上梁、开市、纳财、牧养、安葬、赴任、开仓、纳畜、施恩、选将、解除、祈福、纳采、求嗣、举正直、立券交易、酝酿、诉讼、裁制、安抚边境、庆赐、临政	修置产室、开渠、穿井、平治道涂、破屋坏垣、营建、远回、补垣、修饰垣墙
2067-04-22 10:00:00	二零六七 丁亥[猪]年 三月小初九	星期五	列、宁、诞、辰、纪、念、日	丁亥 甲辰 辛丑 癸巳	无	立夏 (5, 5)	猪	金牛座	进人口、纳财、捕捉、纳畜、取鱼	出行、结婚姻、宴会、嫁娶、安床、修造、求医疗病、上表章、上官、冠带、竖柱上梁、经络、开市、立券、修置产室、开渠、穿井、安碓硙、平治道涂、破屋坏垣、栽种、破土、安葬、启攒、营建、开仓、招贤、施恩、解除、开张、颁诏、修饰垣墙、布政事、修仓库、缮城郭、补垣、鼓铸、上册、纳采、宣政事、举正直、修宫室、筑堤防、立券交易、酝酿、裁制、搬移、庆赐、临政
2067-04-23 10:00:00	二零六七 丁亥[猪]年 三月小初十	星期六	世、界、图、书、和、版、权、日	丁亥 甲辰 壬寅 乙巳	无	立夏 (5, 5)	猪	金牛座	出行、结婚姻、宴会、求医疗病、上表章、上官、入学、竖柱上梁、开市、牧养、纳畜、招贤、施恩、选将、解除、颁诏、出师、祈福、入宅、上册、纳采、求嗣、宣政事、举正直、覃恩、恤孤茕、立券交易、裁制、搬移、安抚边境、庆赐、雪冤、临政	祭祀、开渠、平治道涂、破屋坏垣、伐木、畋猎、修饰垣墙、乘船渡水、补垣、筑堤防、针刺、取鱼
2067-04-24 10:00:00	二零六七 丁亥[猪]年 三月小十一	星期日	无	丁亥 甲辰 癸卯 丁巳	无	立夏 (5, 5)	猪	金牛座	塞穴	出行、结婚姻、宴会、嫁娶、安床、修造、求医疗病、上表章、上官、冠带、进人口、竖柱上梁、经络、开市、纳财、修置产室、开渠、穿井、安碓硙、平治道涂、破屋坏垣、栽种、牧养、破土、安葬、启攒、营建、开仓、纳畜、招贤、施恩、选将、解除、针刺、颁诏、修饰垣墙、出师、布政事、修仓库、祈福、缮城郭、补垣、上册、疗目、纳采、求嗣、宣政事、举正直、筑堤防、立券交易、酝酿、搬移、安抚边境、庆赐、临政、修宫室
2067-04-25 10:00:00	二零六七 丁亥[猪]年 三月小十二	星期一	无	丁亥 甲辰 甲辰 己巳	无	立夏 (5, 5)	猪	金牛座	诸事不宜	出行、结婚姻、宴会、嫁娶、安床、剃头、修造、求医疗病、上表章、上官、冠带、进人口、竖柱上梁、经络、开市、纳财、修置产室、开渠、穿井、安碓硙、平治道涂、破屋坏垣、伐木、栽种、牧养、破土、安葬、启攒、营建、开仓、纳畜、招贤、施恩、选将、解除、颁诏、整容、修饰垣墙、修仓库、布政事、出师、祈福、缮城郭、补垣、鼓铸、整手足甲、上册、纳采、求嗣、宣政事、举正直、修宫室、筑堤防、立券交易、塞穴、酝酿、裁制、搬移、安抚边境、庆赐、临政
2067-04-26 10:00:00	二零六七 丁亥[猪]年 三月小十三	星期二	世、界、知、识、产、权、日	丁亥 甲辰 乙巳 辛巳	无	立夏 (5, 5)	猪	金牛座	沐浴、扫舍宇、恤孤茕、雪冤	出行、结婚姻、宴会、嫁娶、安床、修造、上表章、冠带、进人口、竖柱上梁、修置产室、开渠、穿井、安碓硙、平治道涂、破屋坏垣、破土、启攒、营建、招贤、颁诏、修饰垣墙、修仓库、布政事、祈福、缮城郭、补垣、鼓铸、上册、纳采、求嗣、宣政事、筑堤防、塞穴、裁制、搬移、庆赐、修宫室
2067-04-27 10:00:00	二零六七 丁亥[猪]年 三月小十四	星期三	无	丁亥 甲辰 丙午 癸巳	无	立夏 (5, 5)	猪	金牛座	诸事不宜	祭祀、出行、结婚姻、宴会、嫁娶、安床、剃头、修造、求医疗病、上表章、上官、冠带、进人口、竖柱上梁、经络、开市、纳财、修置产室、开渠、穿井、安碓硙、平治道涂、破屋坏垣、栽种、牧养、破土、安葬、启攒、营建、开仓、纳畜、招贤、施恩、选将、苫盖、解除、颁诏、整容、修饰垣墙、出师、布政事、修仓库、祈福、缮城郭、补垣、入宅、鼓铸、上册、整手足甲、乘船渡水、纳采、求嗣、宣政事、举正直、修宫室、筑堤防、立券交易、塞穴、酝酿、裁制、搬移、安抚边境、庆赐、临政
2067-04-28 10:00:00	二零六七 丁亥[猪]年 三月小十五	星期四	昊、天、上、帝、诞	丁亥 甲辰 丁未 乙巳	无	立夏 (5, 5)	猪	金牛座	祭祀、赴任、入宅、覃恩、恤孤茕、雪冤	出行、结婚姻、宴会、嫁娶、安床、剃头、修造、求医疗病、上表章、上官、冠带、进人口、竖柱上梁、经络、开市、纳财、修置产室、开渠、穿井、安碓硙、平治道涂、破屋坏垣、畋猎、栽种、牧养、破土、安葬、启攒、营建、开仓、纳畜、招贤、施恩、选将、解除、颁诏、整容、修饰垣墙、出师、布政事、修仓库、祈福、缮城郭、补垣、取鱼、鼓铸、上册、整手足甲、纳采、求嗣、宣政事、举正直、修宫室、筑堤防、立券交易、塞穴、酝酿、裁制、搬移、安抚边境、庆赐、临政
2067-04-29 10:00:00	二零六七 丁亥[猪]年 三月小十六	星期五	准、提、菩、萨、诞	丁亥 甲辰 戊申 丁巳	无	立夏 (5, 5)	猪	金牛座	沐浴、扫舍宇	出行、结婚姻、宴会、嫁娶、安床、剃头、修造、求医疗病、上表章、上官、冠带、进人口、竖柱上梁、经络、开市、纳财、修置产室、开渠、穿井、安碓硙、平治道涂、破屋坏垣、伐木、捕捉、畋猎、栽种、牧养、破土、安葬、启攒、营建、开仓、纳畜、招贤、选将、施恩、解除、颁诏、整容、修饰垣墙、出师、布政事、修仓库、祈福、缮城郭、补垣、取鱼、鼓铸、上册、整手足甲、远回、纳采、求嗣、宣政事、举正直、筑堤防、立券交易、塞穴、酝酿、裁制、搬移、安抚边境、庆赐、临政、修宫室
2067-04-30 10:00:00	二零六七 丁亥[猪]年 三月小十七	星期六	无	丁亥 甲辰 己酉 己巳	无	立夏 (5, 5)	猪	金牛座	祭祀、结婚姻、嫁娶、沐浴、剃头、求医疗病、上官、进人口、经络、纳财、扫舍宇、捕捉、安葬、纳畜、解除、整容、布政事、祈福、取鱼、整手足甲、覃恩、恤孤茕、立券交易、酝酿、安抚边境、雪冤、临政	出行、宴会、安床、修造、上表章、冠带、竖柱上梁、开市、修置产室、开渠、穿井、安碓硙、平治道涂、破屋坏垣、栽种、牧养、营建、开仓、招贤、施恩、选将、修饰垣墙、修仓库、出师、缮城郭、补垣、上册、乘船渡水、纳采、求嗣、举正直、筑堤防、搬移、修宫室
