2067-05-01	二零六七 丁亥[猪]年	三月小	十八	周日	丁亥 甲辰 庚戌 辛巳	猪	金牛座	无	立夏 (5, 5)	国际劳动节	无	无	祭祀、沐浴、求医疗病、雪冤、覃恩、解除、恤孤茕	嫁娶、冠带、修置产室、开渠、穿井、安碓硙、平治道涂、伐木、破土、安葬、启攒、乘船渡水、招贤、塞穴、纳畜、取鱼、上册、颁诏、修饰垣墙、鼓铸、补垣、修仓库、筑堤防、营建、宣政事
2067-05-02	二零六七 丁亥[猪]年	三月小	十九	周一	丁亥 甲辰 辛亥 癸巳	猪	金牛座	无	立夏 (5, 5)	无	中岳大帝诞	无	宴会、安床、沐浴、纳财、牧养、选将、雪冤、纳畜、布政事、覃恩、安抚边境、取鱼、恤孤茕、庆赐	出行、嫁娶、修造、求医疗病、修置产室、开渠、穿井、安碓硙、平治道涂、破屋坏垣、畋猎、破土、安葬、启攒、缮城郭、修饰垣墙、祈福、酝酿、开仓、补垣、解除、整手足甲、修仓库、筑堤防、营建、求嗣、修宫室
2067-05-03	二零六七 丁亥[猪]年	三月小	二十	周二	丁亥 甲辰 壬子 乙巳	猪	金牛座	无	立夏 (5, 5)	无	子孙娘娘诞	世界新闻自由日	祭祀、结婚姻、宴会、嫁娶、沐浴、求医疗病、上表章、上官、入学、进人口、竖柱上梁、经络、牧养、安葬、雪冤、赴任、裁制、诉讼、覃恩、招贤、举正直、纳畜、上册、颁诏、入宅、祈福、酝酿、庆赐、解除、纳采、施恩、临政、恤孤茕、宣政事、求嗣	修置产室、开渠、穿井、平治道涂、破屋坏垣、畋猎、补垣、修饰垣墙、远回、取鱼、开仓
2067-05-04	二零六七 丁亥[猪]年	三月小	廿一	周三	丁亥 甲辰 癸丑 丁巳	猪	金牛座	无	立夏 (5, 5)	无	无	中国青年节	纳财、捕捉、雪冤、纳畜、覃恩、取鱼、恤孤茕	出行、结婚姻、嫁娶、安床、修造、求医疗病、上表章、上官、冠带、竖柱上梁、经络、开市、修置产室、开渠、穿井、安碓硙、平治道涂、破屋坏垣、栽种、破土、安葬、启攒、立券交易、裁制、缮城郭、招贤、举正直、上册、颁诏、修饰垣墙、酝酿、开仓、鼓铸、补垣、解除、修宫室、施恩、纳采、整手足甲、修仓库、临政、搬移、营建、筑堤防、宣政事
2067-05-05	二零六七 丁亥[猪]年	三月小	廿二	周四	丁亥 乙巳 甲寅 己巳	猪	金牛座	立夏	小满 (5, 21)	无	无	马克思诞辰纪念日	捕捉、赴任、诉讼	祭祀、出行、结婚姻、宴会、嫁娶、安床、剃头、修造、求医疗病、上表章、上官、冠带、进人口、竖柱上梁、经络、开市、纳财、修置产室、开渠、穿井、安碓硙、平治道涂、破屋坏垣、栽种、牧养、破土、安葬、启攒、立券交易、裁制、缮城郭、招贤、布政事、举正直、选将、塞穴、纳畜、上册、颁诏、修饰垣墙、出师、祈福、安抚边境、酝酿、庆赐、开仓、鼓铸、整容、补垣、解除、修宫室、施恩、纳采、修仓库、临政、搬移、营建、筑堤防、宣政事、整手足甲、求嗣
2067-05-06	二零六七 丁亥[猪]年	三月小	廿三	周五	丁亥 乙巳 乙卯 辛巳	猪	金牛座	无	小满 (5, 21)	无	无	无	祭祀、出行、结婚姻、宴会、嫁娶、修造、求医疗病、上表章、上官、入学、竖柱上梁、开市、纳财、修置产室、安碓硙、栽种、牧养、立券交易、雪冤、裁制、覃恩、缮城郭、招贤、举正直、选将、纳畜、上册、颁诏、出师、祈福、庆赐、解除、修宫室、施恩、纳采、修仓库、临政、搬移、营建、恤孤茕、宣政事、求嗣、安抚边境	剃头、冠带、穿井、破屋坏垣、伐木、畋猎、补垣、修饰垣墙、入宅、塞穴、整容、乘船渡水、整手足甲、取鱼、筑堤防、开仓、布政事、鼓铸
2067-05-07	二零六七 丁亥[猪]年	三月小	廿四	周六	丁亥 乙巳 丙辰 癸巳	猪	金牛座	无	小满 (5, 21)	无	无	无	祭祀、雪冤、覃恩、恤孤茕	出行、结婚姻、宴会、嫁娶、安床、剃头、修造、求医疗病、上表章、上官、冠带、进人口、竖柱上梁、经络、开市、纳财、修置产室、开渠、穿井、安碓硙、破屋坏垣、畋猎、栽种、牧养、破土、安葬、启攒、立券交易、疗目、针刺、裁制、缮城郭、招贤、布政事、举正直、选将、塞穴、纳畜、取鱼、上册、颁诏、修饰垣墙、出师、祈福、安抚边境、酝酿、庆赐、开仓、整容、鼓铸、补垣、解除、修宫室、施恩、纳采、整手足甲、修仓库、临政、搬移、营建、筑堤防、宣政事、求嗣
2067-05-08	二零六七 丁亥[猪]年	三月小	廿五	周日	丁亥 乙巳 丁巳 乙巳	猪	金牛座	无	小满 (5, 21)	无	无	母亲节,世界红十字日	宴会、上官、进人口、经络、纳财、立券交易、雪冤、赴任、裁制、覃恩、招贤、举正直、纳畜、颁诏、入宅、酝酿、庆赐、施恩、临政、恤孤茕、宣政事	出行、剃头、求医疗病、上表章、修置产室、开渠、穿井、平治道涂、破屋坏垣、伐木、畋猎、栽种、破土、安葬、启攒、上册、修饰垣墙、祈福、整容、开仓、补垣、解除、整手足甲、筑堤防、营建、求嗣
2067-05-09	二零六七 丁亥[猪]年	三月小	廿六	周一	丁亥 乙巳 戊午 丁巳	猪	金牛座	无	小满 (5, 21)	无	无	无	祭祀、宴会、沐浴、剃头、扫舍宇、裁制、庆赐、整容、整手足甲	嫁娶、上表章、冠带、修置产室、纳畜、乘船渡水、苫盖、修仓库、取鱼、营建、招贤、筑堤防、上册
2067-05-10	二零六七 丁亥[猪]年	三月小	廿七	周二	丁亥 乙巳 己未 己巳	猪	金牛座	无	小满 (5, 21)	无	七殿泰山王诞	无	诸事不宜	祭祀、剃头、冠带、修置产室、开渠、穿井、安碓硙、平治道涂、破屋坏垣、伐木、破土、启攒、乘船渡水、远回、招贤、布政事、选将、纳畜、取鱼、颁诏、修饰垣墙、出师、安抚边境、整容、鼓铸、补垣、整手足甲、筑堤防、营建、宣政事
2067-05-11	二零六七 丁亥[猪]年	三月小	廿八	周三	丁亥 乙巳 庚申 辛巳	猪	金牛座	无	小满 (5, 21)	无	苍颉至圣先师诞	世界肥胖日	祭祀、出行、结婚姻、宴会、嫁娶、沐浴、剃头、修造、求医疗病、上表章、上官、进人口、竖柱上梁、经络、开市、纳财、扫舍宇、平治道涂、栽种、牧养、安葬、立券交易、雪冤、裁制、覃恩、缮城郭、招贤、举正直、选将、纳畜、上册、颁诏、修饰垣墙、出师、祈福、酝酿、庆赐、开仓、整容、解除、施恩、纳采、整手足甲、修仓库、临政、搬移、营建、恤孤茕、宣政事、求嗣、安抚边境	安床、冠带、修置产室、开渠、穿井、安碓硙、破屋坏垣、畋猎、补垣、针刺、塞穴、取鱼、筑堤防、布政事、修宫室、鼓铸
2067-05-12	二零六七 丁亥[猪]年	三月小	廿九	周四	丁亥 乙巳 辛酉 癸巳	猪	金牛座	无	小满 (5, 21)	无	无	无	祭祀、沐浴、剃头、上官、冠带、进人口、竖柱上梁、经络、安碓硙、扫舍宇、牧养、安葬、雪冤、裁制、覃恩、缮城郭、招贤、举正直、纳畜、颁诏、祈福、整容、施恩、整手足甲、临政、搬移、营建、恤孤茕、宣政事、求嗣、修宫室	宴会、修置产室、畋猎、苫盖、取鱼、开仓
2067-05-13	二零六七 丁亥[猪]年	四月大	初一	周五	丁亥 乙巳 壬戌 乙巳	猪	金牛座	无	小满 (5, 21)	无	八殿都市王诞	无	沐浴、剃头、修造、上表章、捕捉、入宅、解除、整容、纳采、搬移	出行、开渠、穿井、安葬、修仓库、开仓
2067-05-14	二零六七 丁亥[猪]年	四月大	初二	周六	丁亥 乙巳 癸亥 丁巳	猪	金牛座	无	小满 (5, 21)	无	无	无	沐浴、破屋坏垣	祭祀、结婚姻、宴会、嫁娶、安床、剃头、修造、上表章、上官、冠带、竖柱上梁、经络、开市、修置产室、开渠、穿井、安碓硙、伐木、捕捉、畋猎、栽种、牧养、破土、安葬、启攒、立券交易、裁制、缮城郭、招贤、布政事、举正直、塞穴、取鱼、上册、颁诏、修饰垣墙、祈福、酝酿、庆赐、整容、鼓铸、开仓、补垣、解除、修宫室、施恩、纳采、整手足甲、修仓库、临政、筑堤防、营建、求嗣、宣政事
2067-05-15	二零六七 丁亥[猪]年	四月大	初三	周日	丁亥 乙巳 甲子 己巳	猪	金牛座	无	小满 (5, 21)	无	无	无	宴会、沐浴、雪冤、覃恩、恤孤茕、布政事、庆赐	结婚姻、修造、求医疗病、冠带、进人口、竖柱上梁、开市、纳财、修置产室、栽种、牧养、安葬、立券交易、缮城郭、招贤、举正直、纳畜、上册、祈福、开仓、解除、修宫室、施恩、纳采、修仓库、营建、筑堤防、求嗣
2067-05-16	二零六七 丁亥[猪]年	四月大	初四	周一	丁亥 乙巳 乙丑 辛巳	猪	金牛座	无	小满 (5, 21)	无	文殊菩萨诞	无	祭祀、出行、结婚姻、宴会、修造、求医疗病、上表章、上官、入学、进人口、竖柱上梁、经络、开市、纳财、安碓硙、牧养、安葬、立券交易、雪冤、裁制、覃恩、缮城郭、招贤、举正直、纳畜、上册、颁诏、祈福、酝酿、庆赐、解除、施恩、纳采、修仓库、临政、筑堤防、恤孤茕、宣政事、营建、求嗣、修宫室	冠带、畋猎、乘船渡水、远回、取鱼
2067-05-17	二零六七 丁亥[猪]年	四月大	初五	周二	丁亥 乙巳 丙寅 癸巳	猪	金牛座	无	小满 (5, 21)	无	无	无	出行、结婚姻、宴会、嫁娶、修造、求医疗病、上表章、上官、进人口、竖柱上梁、纳财、捕捉、栽种、牧养、安葬、立券交易、雪冤、赴任、裁制、诉讼、覃恩、缮城郭、招贤、举正直、选将、纳畜、上册、颁诏、出师、祈福、庆赐、解除、施恩、纳采、修仓库、临政、搬移、营建、恤孤茕、宣政事、求嗣、安抚边境	祭祀、剃头、冠带、修置产室、开渠、穿井、安碓硙、平治道涂、破屋坏垣、畋猎、乘船渡水、塞穴、取鱼、修饰垣墙、整容、开仓、补垣、鼓铸、修宫室、整手足甲、筑堤防
2067-05-18	二零六七 丁亥[猪]年	四月大	初六	周三	丁亥 乙巳 丁卯 乙巳	猪	金牛座	无	小满 (5, 21)	无	无	无	祭祀、出行、结婚姻、宴会、嫁娶、修造、求医疗病、上表章、上官、入学、开市、纳财、修置产室、安碓硙、栽种、牧养、立券交易、雪冤、赴任、裁制、覃恩、缮城郭、招贤、举正直、纳畜、上册、颁诏、入宅、祈福、庆赐、解除、修宫室、施恩、纳采、修仓库、临政、搬移、求嗣、恤孤茕、宣政事	剃头、冠带、竖柱上梁、穿井、破屋坏垣、伐木、畋猎、选将、塞穴、取鱼、修饰垣墙、出师、整容、开仓、补垣、鼓铸、整手足甲、筑堤防、营建、安抚边境
2067-05-19	二零六七 丁亥[猪]年	四月大	初七	周四	丁亥 乙巳 戊辰 丁巳	猪	金牛座	无	小满 (5, 21)	无	无	无	诸事不宜	诸事不宜
2067-05-20	二零六七 丁亥[猪]年	四月大	初八	周五	丁亥 乙巳 己巳 己巳	猪	金牛座	无	小满 (5, 21)	无	释迦牟尼佛诞	无	祭祀、宴会、上官、进人口、经络、纳财、牧养、立券交易、雪冤、裁制、覃恩、招贤、举正直、选将、纳畜、颁诏、酝酿、庆赐、施恩、临政、恤孤茕、宣政事、安抚边境	出行、剃头、上表章、修置产室、开渠、穿井、平治道涂、破屋坏垣、伐木、畋猎、破土、安葬、启攒、上册、修饰垣墙、整容、补垣、整手足甲、筑堤防、营建
2067-05-21	二零六七 丁亥[猪]年	四月大	初九	周六	丁亥 乙巳 庚午 辛巳	猪	双子座	小满	芒种 (6, 5)	无	无	无	祭祀、宴会、沐浴、剃头、扫舍宇、安葬、雪冤、裁制、覃恩、颁诏、庆赐、整容、整手足甲、恤孤茕、宣政事	安床、冠带、进人口、经络、开市、纳财、修置产室、畋猎、立券交易、乘船渡水、苫盖、取鱼、开仓、修宫室、筑堤防
2067-05-22	二零六七 丁亥[猪]年	四月大	初十	周日	丁亥 乙巳 辛未 癸巳	猪	双子座	无	芒种 (6, 5)	无	无	无	覃恩、雪冤、恤孤茕	祭祀、安床、剃头、冠带、修置产室、开渠、穿井、安碓硙、平治道涂、破屋坏垣、伐木、畋猎、启攒、乘船渡水、远回、布政事、取鱼、修饰垣墙、酝酿、整容、鼓铸、补垣、整手足甲、筑堤防
2067-05-23	二零六七 丁亥[猪]年	四月大	十一	周一	丁亥 乙巳 壬申 乙巳	猪	双子座	无	芒种 (6, 5)	无	无	世界读书日	祭祀、结婚姻、宴会、嫁娶、沐浴、剃头、修造、求医疗病、上官、进人口、经络、开市、纳财、扫舍宇、平治道涂、栽种、牧养、安葬、立券交易、纳畜、修饰垣墙、入宅、祈福、酝酿、开仓、整容、解除、纳采、整手足甲、临政、搬移、求嗣	出行、安床、上表章、冠带、竖柱上梁、修置产室、开渠、穿井、安碓硙、破屋坏垣、针刺、裁制、缮城郭、招贤、布政事、举正直、选将、塞穴、上册、颁诏、出师、安抚边境、庆赐、鼓铸、补垣、修宫室、施恩、修仓库、筑堤防、营建、宣政事
2067-05-24	二零六七 丁亥[猪]年	四月大	十二	周二	丁亥 乙巳 癸酉 丁巳	猪	双子座	无	芒种 (6, 5)	无	无	无	沐浴、修造、冠带、进人口、竖柱上梁、经络、安碓硙、扫舍宇、牧养、安葬、裁制、缮城郭、纳畜、酝酿、修宫室、整手足甲、搬移	出行、宴会、上表章、修置产室、苫盖、上册、开仓
2067-05-25	二零六七 丁亥[猪]年	四月大	十三	周三	丁亥 乙巳 甲戌 己巳	猪	双子座	无	芒种 (6, 5)	无	无	无	沐浴、剃头、求医疗病、上表章、捕捉、选将、出师、解除、整容、整手足甲、安抚边境	出行、结婚姻、修仓库、开仓
2067-05-26	二零六七 丁亥[猪]年	四月大	十四	周四	丁亥 乙巳 乙亥 辛巳	猪	双子座	无	芒种 (6, 5)	无	纯阳祖师诞	无	沐浴、破屋坏垣、雪冤、覃恩、解除、恤孤茕	嫁娶、剃头、冠带、修置产室、开渠、穿井、安碓硙、伐木、捕捉、畋猎、破土、启攒、乘船渡水、布政事、塞穴、取鱼、修饰垣墙、整容、开仓、补垣、鼓铸、整手足甲、筑堤防、修宫室
2067-05-27	二零六七 丁亥[猪]年	四月大	十五	周五	丁亥 乙巳 丙子 癸巳	猪	双子座	无	芒种 (6, 5)	无	钟离祖师诞	上海解放日	祭祀、宴会、沐浴、经络、雪冤、裁制、覃恩、颁诏、酝酿、庆赐、恤孤茕、宣政事	诸事不忌
2067-05-28	二零六七 丁亥[猪]年	四月大	十六	周六	丁亥 乙巳 丁丑 乙巳	猪	双子座	无	芒种 (6, 5)	无	无	无	出行、结婚姻、宴会、修造、上表章、上官、入学、进人口、竖柱上梁、经络、开市、纳财、安碓硙、立券交易、赴任、裁制、缮城郭、举正直、纳畜、上册、入宅、酝酿、庆赐、修宫室、纳采、施恩、修仓库、临政、筑堤防	剃头、求医疗病、冠带、选将、出师、乘船渡水、远回、取鱼、整容
2067-05-29	二零六七 丁亥[猪]年	四月大	十七	周日	丁亥 乙巳 戊寅 丁巳	猪	双子座	无	芒种 (6, 5)	无	十殿转轮王诞	无	捕捉、赴任、诉讼	祭祀、出行、结婚姻、宴会、嫁娶、安床、剃头、修造、求医疗病、上表章、上官、冠带、进人口、竖柱上梁、经络、开市、纳财、修置产室、开渠、穿井、安碓硙、平治道涂、破屋坏垣、栽种、牧养、破土、安葬、启攒、立券交易、裁制、缮城郭、招贤、布政事、举正直、选将、塞穴、纳畜、上册、颁诏、修饰垣墙、出师、祈福、酝酿、庆赐、开仓、鼓铸、整容、补垣、解除、修宫室、施恩、纳采、整手足甲、修仓库、临政、搬移、营建、筑堤防、宣政事、求嗣、安抚边境
2067-05-30	二零六七 丁亥[猪]年	四月大	十八	周一	丁亥 乙巳 己卯 己巳	猪	双子座	无	芒种 (6, 5)	无	紫徽大帝诞	无	入学、雪冤、覃恩、恤孤茕	穿井、伐木、畋猎、安葬、启攒、选将、塞穴、取鱼、入宅、出师、安抚边境、补垣、筑堤防、营建
2067-05-31	二零六七 丁亥[猪]年	四月大	十九	周二	丁亥 乙巳 庚辰 辛巳	猪	双子座	无	芒种 (6, 5)	无	无	世界无烟日	祭祀、雪冤、覃恩、恤孤茕	出行、结婚姻、宴会、嫁娶、安床、剃头、修造、求医疗病、上表章、上官、冠带、进人口、竖柱上梁、经络、开市、纳财、修置产室、开渠、穿井、安碓硙、破屋坏垣、畋猎、栽种、牧养、安葬、立券交易、疗目、针刺、裁制、缮城郭、招贤、布政事、举正直、选将、塞穴、纳畜、取鱼、上册、颁诏、修饰垣墙、出师、祈福、安抚边境、酝酿、庆赐、开仓、整容、鼓铸、补垣、解除、施恩、纳采、整手足甲、修仓库、临政、搬移、营建、筑堤防、宣政事、求嗣、修宫室
