2070-08-01	2070-6-25	29	平	五	庚寅 癸未 戊戌	无	立秋 (8, 7)	建军节	无	无	嫁娶 畋猎 祭祀 结网	动土 开渠 治病 破土
2070-08-02	2070-6-26	29	定	六	庚寅 癸未 己亥	无	立秋 (8, 7)	无	无	无	交易 会亲友 入学 出行 动土 开光 开市 栽种 求嗣 牧养 理发 祈福 祭祀 立券 纳畜 纳财 纳采 解除 订盟 起基 造仓	作灶 入宅 出火 嫁娶 安葬 置产
2070-08-03	2070-6-27	29	执	日	庚寅 癸未 庚子	无	立秋 (8, 7)	无	无	无	入殓 启钻 安床 安葬 整手足甲 沐浴 破土 祈福 祭祀 移柩 解除 谢土	伐木 作灶 入宅 出火 出行 嫁娶 安门 开市 斋醮 移徙
2070-08-04	2070-6-28	29	破	一	庚寅 癸未 辛丑	无	立秋 (8, 7)	无	无	无	坏垣 破屋 解除 馀事勿取	嫁娶 安葬
2070-08-05	2070-6-29	29	危	二	庚寅 癸未 壬寅	无	立秋 (8, 7)	无	无	无	会亲友 入宅 入殓 出货财 启钻 嫁娶 安床 安机械 安葬 安门 开仓 开市 开池 拆卸 挂匾 栽种 牧养 破土 移徙 移柩 立券 立碑 纳畜 经络	探病 祈福 祭祀 谢土 造桥
2070-08-06	2070-7-1	30	成	三	庚寅 癸未 癸卯	无	立秋 (8, 7)	无	无	无	上梁 会亲友 嫁娶 安碓磑 安葬 安门 开光 开池 成服 斋醮 求医 治病 盖屋 破土 祈福 祭祀 竖柱 筑堤 纳采 订盟 起基 除服	入宅 合寿木 开市 掘井 词讼
2070-08-07	2070-7-2	30	成	四	庚寅 甲申 甲辰	立秋	处暑 (8, 23)	无	无	无	入宅 动土 嫁娶 安葬 求医 治病 破土 祈福 祭祀 移徙 纳采 订盟	开光 针灸
2070-08-08	2070-7-3	30	收	五	庚寅 甲申 乙巳	无	处暑 (8, 23)	无	无	无	作灶 安机械 祈福 祭祀 纳畜 纳采 订盟	动土 安葬
2070-08-09	2070-7-4	30	开	六	庚寅 甲申 丙午	无	处暑 (8, 23)	无	无	无	出行 动土 启钻 嫁娶 安床 掘井 求嗣 破土 祈福 祭祀	上梁 伐木 作梁 修造 入宅 入殓 安门 盖屋
2070-08-10	2070-7-5	30	闭	日	庚寅 甲申 丁未	无	处暑 (8, 23)	无	无	无	修造 入殓 出火 出行 动土 启钻 嫁娶 安床 安葬 拆卸 求嗣 破土 祈福 祭祀 移徙	作灶 开光 掘井 理发 盖屋 造船
2070-08-11	2070-7-6	30	建	一	庚寅 甲申 戊申	无	处暑 (8, 23)	无	无	无	上梁 入殓 出行 启钻 安葬 安门 开光 求嗣 牧养 盖屋 祈福 祭祀 移徙 纳畜 纳财 解除	动土 安床 掘井 破土 置产
2070-08-12	2070-7-7	30	除	二	庚寅 甲申 己酉	无	处暑 (8, 23)	无	无	无	入殓 安葬 扫舍 整手足甲 沐浴 理发 破土 祭祀 移柩 解除	会亲友 作灶 入宅 出行 嫁娶 移徙 赴任 进人口
2070-08-13	2070-7-8	30	满	三	庚寅 甲申 庚戌	无	处暑 (8, 23)	无	无	无	塑绘 塞穴 开光 栽种 牧养 纳畜 补垣 进人口	上梁 交易 修造 动土 嫁娶 安葬 开市 祈福 立券 纳财
2070-08-14	2070-7-9	30	平	四	庚寅 甲申 辛亥	无	处暑 (8, 23)	无	无	无	作灶 修饰垣墙 平治道涂 沐浴 馀事勿取	诸事不宜
2070-08-15	2070-7-10	30	定	五	庚寅 甲申 壬子	无	处暑 (8, 23)	无	无	无	伐木 作梁 修造 入殓 出火 出行 动土 安床 安葬 开光 成服 拆卸 栽种 求嗣 破土 祭祀 纳畜 解除 起基 进人口 除服	嫁娶 移徙
2070-08-16	2070-7-11	30	执	六	庚寅 甲申 癸丑	无	处暑 (8, 23)	无	无	无	入殓 塞穴 安葬 破土 祭祀 移柩 馀事勿取	诸事不宜
2070-08-17	2070-7-12	30	破	日	庚寅 甲申 甲寅	无	处暑 (8, 23)	无	无	无	坏垣 破屋 馀事勿取	诸事不宜
2070-08-18	2070-7-13	30	危	一	庚寅 甲申 乙卯	无	处暑 (8, 23)	无	无	无	入殓 启钻 安葬 成服 祭祀 移柩 结网 除服 馀事勿取	诸事不宜
2070-08-19	2070-7-14	30	成	二	庚寅 甲申 丙辰	无	处暑 (8, 23)	无	无	无	交易 伐木 入宅 入殓 出火 动土 嫁娶 安床 安葬 开光 开市 拆卸 祈福 祭祀 移徙 立券 纳畜	作灶 出行 栽种 针灸
2070-08-20	2070-7-15	30	收	三	庚寅 甲申 丁巳	无	处暑 (8, 23)	无	无	无	交易 开光 祭祀 立券 纳畜 纳财 解除 进人口	入宅 出火 出行 分居 动土 嫁娶 安香 理发 破土 移徙
2070-08-21	2070-7-16	30	开	四	庚寅 甲申 戊午	无	处暑 (8, 23)	无	无	无	会亲友 出行 嫁娶 安床 开光 成服 栽种 求嗣 祈福 祭祀 移柩 解除 进人口 除服	伐木 入宅 入殓 安葬 盖屋 移徙 纳畜 置产
2070-08-22	2070-7-17	30	闭	五	庚寅 甲申 己未	无	处暑 (8, 23)	无	无	无	会亲友 入殓 动土 塞穴 安葬 开池 破土 祭祀 移柩 筑堤	上梁 作灶 修造 入宅 出行 安门 开光 裁衣
2070-08-23	2070-7-18	30	建	六	庚寅 甲申 庚申	处暑	白露 (9, 7)	无	无	无	作灶 出行 安门 扫舍 祭祀 纳畜 纳财 裁衣 进人口 造畜稠	动土 合寿木 安床 安葬 开生坟
2070-08-24	2070-7-19	30	除	日	庚寅 甲申 辛酉	无	白露 (9, 7)	无	无	无	上梁 修造 入殓 动土 启钻 安床 安门 开池 开渠 拆卸 破土 祭祀 解除 起基	作灶 入宅 出行 嫁娶 栽种 移徙 赴任 进人口
2070-08-25	2070-7-20	30	满	一	庚寅 甲申 壬戌	无	白露 (9, 7)	无	无	无	上梁 会亲友 修造 入宅 出火 出行 安床 安机械 安香 开光 拆卸 栽种 移徙 纳畜 纳采 经络 解除 订盟	伐木 作灶 动土 安葬 破土 祈福 祭祀 行丧 谢土
2070-08-26	2070-7-21	30	平	二	庚寅 甲申 癸亥	无	白露 (9, 7)	无	无	无	作灶 修饰垣墙 平治道涂 沐浴 祭祀	伐木 作梁 嫁娶 安葬 安门 栽种 治病 祈福 置产 词讼
2070-08-27	2070-7-22	30	定	三	庚寅 甲申 甲子	无	白露 (9, 7)	无	无	无	交易 修造 入宅 入殓 出火 出行 动土 嫁娶 安床 安葬 安香 开光 成服 拆卸 求嗣 破土 祈福 祭祀 移徙 立券 解除 谢土 进人口 除服	作灶 开仓 开市 斋醮 造船
2070-08-28	2070-7-23	30	执	四	庚寅 甲申 乙丑	无	白露 (9, 7)	无	无	无	入殓 安葬 成服 捕捉 破土 祭祀 移柩 除服 馀事勿取	交易 入宅 嫁娶 开市
2070-08-29	2070-7-24	30	破	五	庚寅 甲申 丙寅	无	白露 (9, 7)	无	无	无	坏垣 治病 破屋 馀事勿取	入宅 嫁娶 安葬 祈福 纳采 订盟
2070-08-30	2070-7-25	30	危	六	庚寅 甲申 丁卯	无	白露 (9, 7)	无	无	无	交易 伐木 入宅 出火 出行 嫁娶 安床 安葬 安香 开光 开市 栽种 求嗣 祈福 祭祀 移徙 立券 解除	作灶 动土 开池 掘井 理发 破土
2070-08-31	2070-7-26	30	成	日	庚寅 甲申 戊辰	无	白露 (9, 7)	无	无	无	上梁 交易 修造 出火 出行 动土 安床 安机械 安葬 开光 开市 拆卸 普渡 栽种 求嗣 破土 祈福 祭祀 移徙 移柩 立券 纳畜 纳采 订盟 进人口	入宅 嫁娶 掘井 牧养
