2072-12-01	二零七二 壬辰[龙]年	十月大	廿二	周四	壬辰 辛亥 辛亥 癸巳	龙	射手座	无	大雪 (12, 6)	无	无	世界艾滋病日	沐浴、雪冤、覃恩、恤孤茕	祭祀、出行、结婚姻、宴会、嫁娶、安床、剃头、修造、求医疗病、上表章、上官、冠带、进人口、竖柱上梁、经络、开市、纳财、修置产室、开渠、穿井、安碓硙、平治道涂、破屋坏垣、伐木、栽种、牧养、破土、安葬、启攒、立券交易、针刺、裁制、乘船渡水、缮城郭、招贤、布政事、修宫室、举正直、选将、塞穴、纳畜、取鱼、上册、颁诏、修饰垣墙、出师、祈福、酝酿、庆赐、整容、开仓、鼓铸、补垣、解除、纳采、整手足甲、施恩、修仓库、临政、搬移、营建、筑堤防、宣政事、求嗣、安抚边境
2072-12-02	二零七二 壬辰[龙]年	十月大	廿三	周五	壬辰 辛亥 壬子 乙巳	龙	射手座	无	大雪 (12, 6)	无	无	无	出行、宴会、嫁娶、沐浴、剃头、修造、求医疗病、上官、扫舍宇、雪冤、裁制、覃恩、布政事、选将、入宅、出师、庆赐、整容、解除、纳采、整手足甲、临政、搬移、恤孤茕、安抚边境	结婚姻、安床、上表章、冠带、进人口、竖柱上梁、开市、立券、纳财、修置产室、开渠、穿井、栽种、牧养、安葬、立券交易、乘船渡水、缮城郭、招贤、纳畜、取鱼、上册、祈福、开张、开仓、修宫室、修仓库、筑堤防、营建、求嗣
2072-12-03	二零七二 壬辰[龙]年	十月大	廿四	周六	壬辰 辛亥 癸丑 丁巳	龙	射手座	无	大雪 (12, 6)	无	无	无	覃恩、雪冤、恤孤茕	祭祀、出行、结婚姻、宴会、嫁娶、安床、剃头、修造、求医疗病、上表章、上官、冠带、进人口、竖柱上梁、经络、开市、纳财、修置产室、开渠、穿井、安碓硙、平治道涂、破屋坏垣、伐木、栽种、牧养、破土、安葬、启攒、立券交易、裁制、缮城郭、远回、招贤、布政事、举正直、选将、塞穴、纳畜、上册、颁诏、修饰垣墙、出师、祈福、酝酿、庆赐、整容、鼓铸、开仓、补垣、解除、修宫室、施恩、纳采、整手足甲、修仓库、临政、搬移、营建、筑堤防、宣政事、求嗣、安抚边境
2072-12-04	二零七二 壬辰[龙]年	十月大	廿五	周日	壬辰 辛亥 甲寅 己巳	龙	射手座	无	大雪 (12, 6)	无	无	无	出行、结婚姻、宴会、嫁娶、修造、求医疗病、上表章、上官、进人口、竖柱上梁、经络、开市、纳财、平治道涂、栽种、牧养、安葬、立券交易、雪冤、赴任、裁制、诉讼、覃恩、缮城郭、招贤、举正直、选将、纳畜、上册、颁诏、修饰垣墙、出师、祈福、安抚边境、酝酿、庆赐、开仓、解除、施恩、纳采、修仓库、临政、搬移、营建、恤孤茕、宣政事、求嗣、修宫室	祭祀、冠带、修置产室、开渠、穿井、畋猎、乘船渡水、取鱼、筑堤防、布政事、鼓铸
2072-12-05	二零七二 壬辰[龙]年	十月大	廿六	周一	壬辰 辛亥 乙卯 辛巳	龙	射手座	无	大雪 (12, 6)	无	无	无	祭祀、出行、结婚姻、宴会、嫁娶、修造、上官、冠带、进人口、竖柱上梁、经络、安碓硙、牧养、雪冤、裁制、覃恩、缮城郭、招贤、举正直、纳畜、颁诏、祈福、酝酿、庆赐、施恩、纳采、临政、搬移、营建、恤孤茕、宣政事、求嗣、修宫室	修置产室、穿井、畋猎、苫盖、取鱼
2072-12-06	二零七二 壬辰[龙]年	十月大	廿七	周二	壬辰 壬子 丙辰 癸巳	龙	射手座	大雪	冬至 (12, 21)	无	无	无	祭祀、宴会、上官、冠带、进人口、竖柱上梁、经络、安碓硙、安葬、赴任、裁制、诉讼、缮城郭、纳畜、祈福、酝酿、庆赐、修宫室、纳采、临政	求医疗病、开市、修置产室、栽种、解除、开仓
2072-12-07	二零七二 壬辰[龙]年	十月大	廿八	周三	壬辰 壬子 丁巳 乙巳	龙	射手座	无	冬至 (12, 21)	无	无	无	祭祀、捕捉、雪冤、赴任、覃恩、入宅、恤孤茕	出行、剃头、冠带、修置产室、开渠、穿井、安碓硙、破屋坏垣、畋猎、破土、启攒、布政事、塞穴、取鱼、修饰垣墙、整容、鼓铸、补垣、修宫室、整手足甲、筑堤防
2072-12-08	二零七二 壬辰[龙]年	十月大	廿九	周四	壬辰 壬子 戊午 丁巳	龙	射手座	无	冬至 (12, 21)	无	无	无	诸事不宜	诸事不宜
2072-12-09	二零七二 壬辰[龙]年	十月大	三十	周五	壬辰 壬子 己未 己巳	龙	射手座	无	冬至 (12, 21)	无	无	无	伐木、畋猎	出行、结婚姻、宴会、嫁娶、安床、剃头、修造、求医疗病、上表章、上官、冠带、进人口、竖柱上梁、经络、开市、纳财、修置产室、开渠、穿井、安碓硙、破屋坏垣、栽种、牧养、破土、安葬、启攒、立券交易、裁制、缮城郭、招贤、布政事、举正直、选将、塞穴、纳畜、上册、颁诏、修饰垣墙、出师、祈福、酝酿、庆赐、整容、鼓铸、开仓、补垣、解除、修宫室、施恩、纳采、整手足甲、修仓库、临政、搬移、营建、筑堤防、宣政事、求嗣、安抚边境
2072-12-10	二零七二 壬辰[龙]年	冬月小	初一	周六	壬辰 壬子 庚申 辛巳	龙	射手座	无	冬至 (12, 21)	无	无	无	出行、沐浴、剃头、上官、入学、竖柱上梁、扫舍宇、牧养、安葬、裁制、举正直、酝酿、整容、解除、施恩、临政	安床、修置产室、开渠、穿井、平治道涂、破屋坏垣、乘船渡水、选将、塞穴、取鱼、修饰垣墙、出师、开仓、鼓铸、补垣、营建
2072-12-11	二零七二 壬辰[龙]年	冬月小	初二	周日	壬辰 壬子 辛酉 癸巳	龙	射手座	无	冬至 (12, 21)	无	无	无	沐浴、剃头、扫舍宇、捕捉、畋猎、整容、整手足甲	祭祀、出行、结婚姻、宴会、嫁娶、安床、修造、求医疗病、上表章、上官、冠带、进人口、竖柱上梁、经络、开市、纳财、修置产室、开渠、穿井、安碓硙、平治道涂、破屋坏垣、栽种、牧养、破土、安葬、启攒、立券交易、乘船渡水、裁制、缮城郭、招贤、布政事、举正直、选将、纳畜、取鱼、上册、颁诏、修饰垣墙、出师、祈福、酝酿、庆赐、开仓、鼓铸、补垣、解除、修宫室、施恩、纳采、修仓库、临政、搬移、营建、筑堤防、宣政事、求嗣、安抚边境
2072-12-12	二零七二 壬辰[龙]年	冬月小	初三	周一	壬辰 壬子 壬戌 乙巳	龙	射手座	无	冬至 (12, 21)	无	无	西安事变纪念日	宴会、入学、竖柱上梁、开市、修置产室、安碓硙、栽种、牧养、雪冤、裁制、覃恩、缮城郭、举正直、纳畜、入宅、祈福、庆赐、解除、修宫室、施恩、纳采、营建、恤孤茕、求嗣	进人口、开渠、伐木、捕捉、畋猎、取鱼、开仓
2072-12-13	二零七二 壬辰[龙]年	冬月小	初四	周二	壬辰 壬子 癸亥 丁巳	龙	射手座	无	冬至 (12, 21)	无	至圣先师孔子诞	南京大屠杀纪念日	沐浴、雪冤、裁制、覃恩、塞穴、补垣、筑堤防、恤孤茕	出行、结婚姻、宴会、嫁娶、安床、修造、求医疗病、上表章、上官、进人口、竖柱上梁、开市、纳财、修置产室、开渠、穿井、破土、安葬、启攒、立券交易、疗目、针刺、招贤、布政事、举正直、选将、上册、颁诏、出师、祈福、安抚边境、庆赐、开仓、修宫室、解除、施恩、纳采、修仓库、临政、搬移、营建、求嗣、宣政事
2072-12-14	二零七二 壬辰[龙]年	冬月小	初五	周三	壬辰 壬子 甲子 己巳	龙	射手座	无	冬至 (12, 21)	无	无	无	诸事不宜	诸事不宜
2072-12-15	二零七二 壬辰[龙]年	冬月小	初六	周四	壬辰 壬子 乙丑 辛巳	龙	射手座	无	冬至 (12, 21)	无	西岳大帝诞	无	祭祀、出行、结婚姻、宴会、嫁娶、沐浴、剃头、上官、进人口、竖柱上梁、经络、纳财、扫舍宇、牧养、安葬、立券交易、雪冤、裁制、缮城郭、覃恩、布政事、举正直、选将、出师、祈福、酝酿、庆赐、整容、开仓、解除、施恩、纳采、修宫室、临政、搬移、求嗣、恤孤茕、安抚边境	冠带
2072-12-16	二零七二 壬辰[龙]年	冬月小	初七	周五	壬辰 壬子 丙寅 癸巳	龙	射手座	无	冬至 (12, 21)	无	无	无	宴会、上表章、进人口、竖柱上梁、经络、开市、纳财、栽种、牧养、立券交易、雪冤、裁制、缮城郭、覃恩、布政事、选将、塞穴、上册、祈福、庆赐、补垣、解除、修宫室、求嗣、恤孤茕、安抚边境	祭祀、嫁娶、远回、招贤
2072-12-17	二零七二 壬辰[龙]年	冬月小	初八	周六	壬辰 壬子 丁卯 乙巳	龙	射手座	无	冬至 (12, 21)	无	无	无	祭祀、平治道涂、雪冤、赴任、覃恩、入宅、恤孤茕	出行、结婚姻、宴会、嫁娶、安床、剃头、修造、求医疗病、上表章、上官、冠带、进人口、竖柱上梁、经络、开市、纳财、修置产室、开渠、穿井、安碓硙、破屋坏垣、畋猎、栽种、牧养、破土、安葬、启攒、立券交易、裁制、缮城郭、招贤、布政事、举正直、选将、塞穴、纳畜、取鱼、上册、颁诏、修饰垣墙、出师、祈福、酝酿、庆赐、开仓、鼓铸、整容、补垣、解除、修宫室、施恩、纳采、整手足甲、修仓库、临政、搬移、营建、筑堤防、宣政事、求嗣、安抚边境
2072-12-18	二零七二 壬辰[龙]年	冬月小	初九	周日	壬辰 壬子 戊辰 丁巳	龙	射手座	无	冬至 (12, 21)	无	无	无	祭祀、结婚姻、宴会、嫁娶、修造、上官、冠带、进人口、竖柱上梁、经络、安碓硙、安葬、雪冤、赴任、裁制、诉讼、缮城郭、覃恩、布政事、纳畜、祈福、酝酿、庆赐、修宫室、纳采、临政、恤孤茕	求医疗病、开市、修置产室、栽种、解除、开仓
2072-12-19	二零七二 壬辰[龙]年	冬月小	初十	周一	壬辰 壬子 己巳 己巳	龙	射手座	无	冬至 (12, 21)	无	无	无	祭祀、捕捉、雪冤、覃恩、恤孤茕	出行、安床、剃头、冠带、进人口、修置产室、开渠、穿井、安碓硙、破屋坏垣、破土、启攒、布政事、塞穴、取鱼、修饰垣墙、整容、鼓铸、补垣、修宫室、整手足甲、筑堤防
2072-12-20	二零七二 壬辰[龙]年	冬月小	十一	周二	壬辰 壬子 庚午 辛巳	龙	射手座	无	冬至 (12, 21)	无	太乙救苦天尊诞	无	诸事不宜	诸事不宜
2072-12-21	二零七二 壬辰[龙]年	冬月小	十二	周三	壬辰 壬子 辛未 癸巳	龙	射手座	冬至	小寒 (1, 5)	无	无	无	伐木、畋猎	出行、结婚姻、宴会、嫁娶、安床、剃头、修造、求医疗病、上表章、上官、冠带、进人口、竖柱上梁、经络、开市、纳财、修置产室、开渠、穿井、安碓硙、平治道涂、破屋坏垣、栽种、牧养、破土、安葬、启攒、立券交易、裁制、缮城郭、招贤、布政事、举正直、选将、塞穴、纳畜、上册、颁诏、修饰垣墙、出师、祈福、酝酿、庆赐、整容、鼓铸、开仓、补垣、解除、修宫室、施恩、纳采、整手足甲、修仓库、临政、搬移、营建、筑堤防、宣政事、求嗣、安抚边境
2072-12-22	二零七二 壬辰[龙]年	冬月小	十三	周四	壬辰 壬子 壬申 乙巳	龙	射手座	无	小寒 (1, 5)	无	无	无	祭祀、出行、沐浴、剃头、求医疗病、上表章、上官、入学、竖柱上梁、经络、扫舍宇、牧养、安葬、雪冤、裁制、覃恩、招贤、举正直、上册、颁诏、入宅、祈福、酝酿、整容、解除、整手足甲、施恩、临政、恤孤茕、宣政事、求嗣	安床、修置产室、开渠、穿井、平治道涂、破屋坏垣、畋猎、补垣、修饰垣墙、塞穴、乘船渡水、取鱼、开仓、鼓铸
2072-12-23	二零七二 壬辰[龙]年	冬月小	十四	周五	壬辰 壬子 癸酉 丁巳	龙	摩羯座	无	小寒 (1, 5)	无	无	无	沐浴、剃头、扫舍宇、捕捉、畋猎、整容、整手足甲	祭祀、出行、结婚姻、宴会、嫁娶、安床、修造、求医疗病、上表章、上官、冠带、进人口、竖柱上梁、经络、开市、纳财、修置产室、开渠、穿井、栽种、牧养、破土、安葬、启攒、立券交易、乘船渡水、裁制、缮城郭、招贤、布政事、举正直、选将、纳畜、取鱼、上册、颁诏、出师、祈福、酝酿、庆赐、开仓、鼓铸、解除、修宫室、施恩、纳采、修仓库、临政、搬移、营建、筑堤防、宣政事、求嗣、安抚边境
2072-12-24	二零七二 壬辰[龙]年	冬月小	十五	周六	壬辰 壬子 甲戌 己巳	龙	摩羯座	无	小寒 (1, 5)	无	无	平安夜	结婚姻、宴会、入学、竖柱上梁、开市、纳财、修置产室、开渠、穿井、安碓硙、栽种、牧养、雪冤、裁制、覃恩、缮城郭、举正直、祈福、庆赐、解除、修宫室、施恩、纳采、求嗣、恤孤茕	嫁娶、剃头、伐木、捕捉、畋猎、选将、出师、乘船渡水、整手足甲、安抚边境、取鱼、整容
2072-12-25	二零七二 壬辰[龙]年	冬月小	十六	周日	壬辰 壬子 乙亥 辛巳	龙	摩羯座	无	小寒 (1, 5)	无	无	圣诞节	祭祀、沐浴、纳财、牧养、雪冤、裁制、缮城郭、覃恩、选将、塞穴、补垣、筑堤防、恤孤茕、安抚边境	出行、结婚姻、宴会、嫁娶、安床、修造、求医疗病、上表章、上官、进人口、竖柱上梁、开市、修置产室、开渠、穿井、栽种、破土、安葬、启攒、疗目、针刺、招贤、布政事、举正直、上册、颁诏、出师、祈福、庆赐、开仓、解除、施恩、纳采、临政、搬移、营建、求嗣、宣政事、修宫室
2072-12-26	二零七二 壬辰[龙]年	冬月小	十七	周一	壬辰 壬子 丙子 癸巳	龙	摩羯座	无	小寒 (1, 5)	无	阿弥陀佛诞	毛泽东诞辰纪念日	诸事不宜	诸事不宜
2072-12-27	二零七二 壬辰[龙]年	冬月小	十八	周二	壬辰 壬子 丁丑 乙巳	龙	摩羯座	无	小寒 (1, 5)	无	无	无	祭祀、出行、宴会、沐浴、上表章、上官、进人口、竖柱上梁、经络、纳财、扫舍宇、栽种、牧养、安葬、立券交易、雪冤、赴任、裁制、覃恩、缮城郭、招贤、举正直、选将、上册、颁诏、入宅、祈福、酝酿、庆赐、解除、纳采、整手足甲、施恩、临政、搬移、营建、恤孤茕、宣政事、求嗣、安抚边境	剃头、冠带、畋猎、取鱼
2072-12-28	二零七二 壬辰[龙]年	冬月小	十九	周三	壬辰 壬子 戊寅 丁巳	龙	摩羯座	无	小寒 (1, 5)	无	太阳日宫诞	无	宴会、嫁娶、修造、上表章、进人口、竖柱上梁、经络、开市、纳财、栽种、牧养、破土、立券交易、裁制、缮城郭、塞穴、上册、祈福、庆赐、补垣、解除、修宫室、求嗣	祭祀、整手足甲、远回、招贤
2072-12-29	二零七二 壬辰[龙]年	冬月小	二十	周四	壬辰 壬子 己卯 己巳	龙	摩羯座	无	小寒 (1, 5)	无	无	无	诸事不宜	诸事不宜
2072-12-30	二零七二 壬辰[龙]年	冬月小	廿一	周五	壬辰 壬子 庚辰 辛巳	龙	摩羯座	无	小寒 (1, 5)	无	无	无	祭祀、结婚姻、宴会、上官、冠带、进人口、竖柱上梁、安碓硙、安葬、雪冤、赴任、裁制、诉讼、缮城郭、覃恩、布政事、纳畜、祈福、酝酿、庆赐、修宫室、纳采、临政、恤孤茕	求医疗病、开市、立券、修置产室、栽种、开仓、解除、整手足甲、开张
2072-12-31	二零七二 壬辰[龙]年	冬月小	廿二	周六	壬辰 壬子 辛巳 癸巳	龙	摩羯座	无	小寒 (1, 5)	无	无	无	祭祀、捕捉、雪冤、覃恩、恤孤茕	出行、安床、剃头、冠带、进人口、修置产室、开渠、穿井、安碓硙、破屋坏垣、破土、启攒、塞穴、取鱼、修饰垣墙、整容、鼓铸、补垣、修宫室、整手足甲、筑堤防
