2073-02-01	二零七二 壬辰[龙]年	腊月大	廿五	周三	壬辰 癸丑 癸丑 丁巳	无	立春 (2, 3)	无	无	无	龙	水瓶座	宴会、经络、纳财、裁制、覃恩、庆赐、恤孤茕、雪冤、布政事、施恩、立券交易、纳畜、举正直、酝酿	剃头、求医疗病、上表章、冠带、修置产室、开渠、穿井、平治道涂、破屋坏垣、伐木、捕捉、畋猎、栽种、破土、安葬、启攒、搬移、祈福、开仓、上册、颁诏、求嗣、补垣、取鱼、整容、宣政事、修饰垣墙、解除、营建、整手足甲、筑堤防
2073-02-02	二零七二 壬辰[龙]年	腊月大	廿六	周四	壬辰 癸丑 甲寅 己巳	无	立春 (2, 3)	无	无	世界湿地日	龙	水瓶座	沐浴、扫舍宇	祭祀、开渠、穿井、上册、颁诏、补垣、取鱼、招贤、布政事、宣政事、塞穴、乘船渡水、营建、筑堤防
2073-02-03	二零七二 壬辰[龙]年	腊月大	廿七	周五	壬辰 甲寅 乙卯 辛巳	立春	雨水 (2, 18)	无	无	无	龙	水瓶座	出行、结婚姻、宴会、沐浴、剃头、求医疗病、上官、扫舍宇、整容、安抚边境、立券交易、临政、解除、选将、整手足甲、出师	嫁娶、安床、修造、上表章、冠带、进人口、竖柱上梁、开市、纳财、修置产室、穿井、栽种、牧养、搬移、祈福、缮城郭、开仓、上册、修宫室、求嗣、取鱼、招贤、纳畜、乘船渡水、修仓库、营建、纳采、筑堤防
2073-02-04	二零七二 壬辰[龙]年	腊月大	廿八	周六	壬辰 甲寅 丙辰 癸巳	无	雨水 (2, 18)	无	无	世界抗癌日	龙	水瓶座	出行、宴会、上表章、竖柱上梁、经络、牧养、安葬、搬移、祈福、缮城郭、裁制、上册、修宫室、颁诏、求嗣、覃恩、恤孤茕、雪冤、庆赐、宣政事、安抚边境、纳畜、解除、选将、营建	祭祀、畋猎、取鱼、鼓铸、乘船渡水
2073-02-05	二零七二 壬辰[龙]年	腊月大	廿九	周日	壬辰 甲寅 丁巳 乙巳	无	雨水 (2, 18)	无	华严菩萨诞	无	龙	水瓶座	平治道涂、覃恩、恤孤茕、雪冤、入宅、赴任	出行、剃头、冠带、修置产室、开渠、穿井、安碓硙、破屋坏垣、畋猎、破土、启攒、补垣、取鱼、整容、布政事、塞穴、鼓铸、整手足甲、筑堤防
2073-02-06	二零七二 壬辰[龙]年	腊月大	三十	周一	壬辰 甲寅 戊午 丁巳	无	雨水 (2, 18)	无	除夕	无	龙	水瓶座	祭祀、结婚姻、宴会、嫁娶、修造、上官、冠带、进人口、竖柱上梁、经络、安碓硙、牧养、搬移、祈福、缮城郭、裁制、修宫室、求嗣、庆赐、施恩、临政、纳畜、举正直、酝酿、纳采	修置产室、安葬、选将、安抚边境、出师、苫盖
2073-02-07	二零七三 癸巳[蛇]年	正月大	初一	周二	癸巳 甲寅 己未 己巳	无	雨水 (2, 18)	春节	弥勒佛圣诞	京汉铁路罢工纪念	蛇	水瓶座	捕捉	结婚姻、嫁娶、修造、求医疗病、纳畜、选将、安抚边境、纳采、整手足甲、出师
2073-02-08	二零七三 癸巳[蛇]年	正月大	初二	周三	癸巳 甲寅 庚申 辛巳	无	雨水 (2, 18)	无	无	无	蛇	水瓶座	祭祀、沐浴、扫舍宇、破屋坏垣	结婚姻、宴会、嫁娶、安床、修造、上官、冠带、进人口、竖柱上梁、经络、开市、纳财、修置产室、开渠、穿井、安碓硙、伐木、栽种、牧养、启攒、缮城郭、裁制、上册、修宫室、开仓、颁诏、求嗣、庆赐、补垣、招贤、布政事、宣政事、安抚边境、施恩、立券交易、修饰垣墙、临政、纳畜、举正直、塞穴、修仓库、酝酿、选将、鼓铸、营建、纳采、出师、筑堤防
2073-02-09	二零七三 癸巳[蛇]年	正月大	初三	周四	癸巳 甲寅 辛酉 癸巳	无	雨水 (2, 18)	无	无	无	蛇	水瓶座	祭祀、出行、结婚姻、嫁娶、安床、沐浴、剃头、修造、求医疗病、上表章、上官、竖柱上梁、扫舍宇、栽种、牧养、安葬、搬移、祈福、缮城郭、裁制、上册、颁诏、求嗣、覃恩、恤孤茕、雪冤、招贤、整容、宣政事、安抚边境、施恩、临政、纳畜、举正直、解除、修仓库、选将、营建、纳采、整手足甲、出师	宴会、冠带、修置产室、开渠、穿井、安碓硙、畋猎、启攒、补垣、取鱼、修宫室、鼓铸、布政事、筑堤防、塞穴、开仓、修饰垣墙
2073-02-10	二零七三 癸巳[蛇]年	正月大	初四	周五	癸巳 甲寅 壬戌 乙巳	无	雨水 (2, 18)	无	无	国际气象节	蛇	水瓶座	祭祀、出行、结婚姻、宴会、嫁娶、修造、求医疗病、上表章、上官、入学、进人口、竖柱上梁、经络、开市、纳财、安碓硙、栽种、牧养、安葬、搬移、祈福、缮城郭、裁制、上册、修宫室、求嗣、覃恩、恤孤茕、雪冤、庆赐、安抚边境、立券交易、临政、纳畜、解除、修仓库、酝酿、选将、营建、纳采、筑堤防、出师	剃头、冠带、修置产室、开渠、穿井、平治道涂、破屋坏垣、伐木、畋猎、破土、启攒、开仓、补垣、取鱼、整容、布政事、修饰垣墙、塞穴、远回、鼓铸、整手足甲
2073-02-11	二零七三 癸巳[蛇]年	正月大	初五	周六	癸巳 甲寅 癸亥 丁巳	无	雨水 (2, 18)	无	无	无	蛇	水瓶座	祭祀、出行、结婚姻、宴会、沐浴、修造、进人口、经络、开市、纳财、捕捉、栽种、牧养、安葬、搬移、祈福、开仓、入宅、立券交易、纳畜、赴任、酝酿、纳采	嫁娶、剃头、求医疗病、上表章、上官、冠带、竖柱上梁、修置产室、开渠、穿井、安碓硙、破屋坏垣、破土、启攒、缮城郭、裁制、上册、修宫室、颁诏、求嗣、庆赐、补垣、招贤、整容、布政事、宣政事、安抚边境、施恩、修饰垣墙、临政、举正直、解除、塞穴、乘船渡水、修仓库、选将、鼓铸、营建、整手足甲、出师、筑堤防
2073-02-12	二零七三 癸巳[蛇]年	正月大	初六	周日	癸巳 甲寅 甲子 己巳	无	雨水 (2, 18)	无	无	无	蛇	水瓶座	沐浴、入学、诉讼、覃恩、恤孤茕、雪冤、赴任	结婚姻、嫁娶、冠带、进人口、竖柱上梁、经络、伐木、畋猎、破土、安葬、启攒、开仓、补垣、取鱼、入宅、塞穴、酝酿、营建、纳采、筑堤防
2073-02-13	二零七三 癸巳[蛇]年	正月大	初七	周一	癸巳 甲寅 乙丑 辛巳	无	雨水 (2, 18)	无	无	无	蛇	水瓶座	诸事不宜	诸事不宜
2073-02-14	二零七三 癸巳[蛇]年	正月大	初八	周二	癸巳 甲寅 丙寅 癸巳	无	雨水 (2, 18)	无	五殿阎罗天子诞	情人节	蛇	水瓶座	宴会、经络、纳财、牧养、裁制、覃恩、恤孤茕、雪冤、庆赐、布政事、施恩、立券交易、纳畜、举正直、酝酿	祭祀、剃头、修置产室、开渠、穿井、平治道涂、破屋坏垣、伐木、捕捉、畋猎、补垣、取鱼、整容、整手足甲、筑堤防、修饰垣墙
2073-02-15	二零七三 癸巳[蛇]年	正月大	初九	周三	癸巳 甲寅 丁卯 乙巳	无	雨水 (2, 18)	无	玉皇上帝诞	无	蛇	水瓶座	祭祀、出行、结婚姻、宴会、嫁娶、沐浴、修造、求医疗病、上表章、上官、竖柱上梁、纳财、扫舍宇、栽种、牧养、安葬、搬移、祈福、缮城郭、开仓、裁制、上册、修宫室、颁诏、求嗣、覃恩、恤孤茕、雪冤、庆赐、招贤、宣政事、安抚边境、施恩、立券交易、临政、纳畜、举正直、解除、修仓库、选将、营建、纳采、整手足甲、出师	剃头、冠带、修置产室、穿井、畋猎、取鱼、筑堤防、乘船渡水
2073-02-16	二零七三 癸巳[蛇]年	正月大	初十	周四	癸巳 甲寅 戊辰 丁巳	无	雨水 (2, 18)	无	无	无	蛇	水瓶座	宴会、修造、上表章、竖柱上梁、经络、安葬、搬移、缮城郭、裁制、上册、修宫室、覃恩、恤孤茕、雪冤、庆赐、布政事、入宅	祭祀、结婚姻、上官、栽种、取鱼、招贤、选将、鼓铸、安抚边境、举正直、出师、乘船渡水、施恩
2073-02-17	二零七三 癸巳[蛇]年	正月大	十一	周五	癸巳 甲寅 己巳 己巳	无	雨水 (2, 18)	无	无	无	蛇	水瓶座	平治道涂	祭祀、出行、结婚姻、宴会、嫁娶、安床、剃头、修造、求医疗病、上表章、上官、冠带、进人口、竖柱上梁、经络、开市、纳财、修置产室、开渠、穿井、安碓硙、破屋坏垣、栽种、牧养、破土、安葬、启攒、搬移、祈福、缮城郭、裁制、上册、开仓、修宫室、颁诏、求嗣、庆赐、补垣、招贤、整容、布政事、宣政事、安抚边境、施恩、立券交易、修饰垣墙、临政、纳畜、举正直、解除、塞穴、修仓库、酝酿、选将、鼓铸、营建、纳采、整手足甲、出师、筑堤防
2073-02-18	二零七三 癸巳[蛇]年	正月大	十二	周六	癸巳 甲寅 庚午 辛巳	雨水	惊蛰 (3, 5)	无	无	无	蛇	水瓶座	祭祀、结婚姻、宴会、上官、冠带、进人口、竖柱上梁、牧养、搬移、祈福、裁制、求嗣、庆赐、施恩、临政、纳畜、举正直、酝酿、纳采	剃头、修置产室、开渠、穿井、平治道涂、破屋坏垣、补垣、苫盖、整容、选将、安抚边境、营建、出师、筑堤防、修饰垣墙
2073-02-19	二零七三 癸巳[蛇]年	正月大	十三	周日	癸巳 甲寅 辛未 癸巳	无	惊蛰 (3, 5)	无	无	邓小平逝世纪念日	蛇	双鱼座	祭祀、出行、宴会、上表章、上官、竖柱上梁、捕捉、栽种、牧养、破土、安葬、搬移、祈福、缮城郭、裁制、上册、颁诏、求嗣、覃恩、恤孤茕、雪冤、庆赐、招贤、宣政事、安抚边境、施恩、临政、举正直、解除、修仓库、选将、营建、纳采、出师	立券、畋猎、取鱼、开张
2073-02-20	二零七三 癸巳[蛇]年	正月大	十四	周一	癸巳 甲寅 壬申 乙巳	无	惊蛰 (3, 5)	无	无	无	蛇	双鱼座	祭祀、沐浴、求医疗病、扫舍宇、破屋坏垣、覃恩、恤孤茕、雪冤、解除	冠带、修置产室、开渠、穿井、安碓硙、伐木、畋猎、启攒、补垣、取鱼、修宫室、鼓铸、布政事、开仓、筑堤防、塞穴、乘船渡水、修饰垣墙
2073-02-21	二零七三 癸巳[蛇]年	正月大	十五	周二	癸巳 甲寅 癸酉 丁巳	无	惊蛰 (3, 5)	无	元宵节	国际母语日	蛇	双鱼座	祭祀、出行、嫁娶、安床、沐浴、剃头、修造、求医疗病、上官、扫舍宇、安葬、搬移、祈福、恤孤茕、取鱼、雪冤、整容、入宅、安抚边境、临政、解除、赴任、选将、纳采、整手足甲	结婚姻、宴会、上表章、冠带、竖柱上梁、修置产室、栽种、牧养、缮城郭、开仓、上册、修宫室、求嗣、庆赐、招贤、施恩、纳畜、举正直、修仓库、营建、出师、筑堤防
2073-02-22	二零七三 癸巳[蛇]年	正月大	十六	周三	癸巳 甲寅 甲戌 己巳	无	惊蛰 (3, 5)	无	无	无	蛇	双鱼座	入学、诉讼、赴任	出行、结婚姻、宴会、嫁娶、安床、剃头、修造、求医疗病、上表章、上官、冠带、进人口、竖柱上梁、经络、开市、纳财、修置产室、开渠、穿井、安碓硙、平治道涂、破屋坏垣、伐木、畋猎、栽种、牧养、破土、安葬、启攒、搬移、祈福、缮城郭、裁制、开仓、上册、修宫室、颁诏、求嗣、庆赐、补垣、招贤、整容、布政事、宣政事、安抚边境、施恩、立券交易、修饰垣墙、临政、纳畜、举正直、解除、塞穴、修仓库、酝酿、选将、远回、鼓铸、营建、纳采、整手足甲、出师、筑堤防
2073-02-23	二零七三 癸巳[蛇]年	正月大	十七	周四	癸巳 甲寅 乙亥 辛巳	无	惊蛰 (3, 5)	无	无	无	蛇	双鱼座	祭祀、结婚姻、宴会、沐浴、进人口、经络、开市、纳财、捕捉、栽种、牧养、祈福、开仓、取鱼、立券交易、纳畜、酝酿	出行、嫁娶、安床、剃头、修造、求医疗病、上表章、上官、冠带、竖柱上梁、修置产室、开渠、穿井、安碓硙、破屋坏垣、破土、安葬、启攒、搬移、缮城郭、裁制、上册、修宫室、颁诏、求嗣、庆赐、补垣、招贤、整容、布政事、宣政事、安抚边境、施恩、修饰垣墙、临政、举正直、解除、塞穴、修仓库、选将、鼓铸、营建、纳采、整手足甲、出师、筑堤防
2073-02-24	二零七三 癸巳[蛇]年	正月大	十八	周五	癸巳 甲寅 丙子 癸巳	无	惊蛰 (3, 5)	无	无	第三世界青年日	蛇	双鱼座	祭祀、出行、结婚姻、宴会、嫁娶、沐浴、修造、求医疗病、上表章、上官、入学、竖柱上梁、开市、纳财、修置产室、开渠、穿井、安碓硙、栽种、牧养、搬移、祈福、缮城郭、开仓、裁制、上册、修宫室、颁诏、求嗣、覃恩、恤孤茕、雪冤、庆赐、招贤、宣政事、安抚边境、施恩、临政、纳畜、举正直、解除、修仓库、选将、营建、纳采、出师	剃头、冠带、破屋坏垣、伐木、畋猎、补垣、取鱼、修饰垣墙、整容、鼓铸、布政事、入宅、整手足甲、筑堤防、塞穴、苫盖
2073-02-25	二零七三 癸巳[蛇]年	正月大	十九	周六	癸巳 甲寅 丁丑 乙巳	无	惊蛰 (3, 5)	无	无	无	蛇	双鱼座	祭祀、覃恩、恤孤茕、雪冤	出行、结婚姻、宴会、嫁娶、安床、剃头、修造、求医疗病、上表章、上官、冠带、进人口、竖柱上梁、经络、开市、纳财、修置产室、开渠、穿井、安碓硙、平治道涂、破屋坏垣、畋猎、栽种、牧养、破土、安葬、搬移、祈福、缮城郭、裁制、开仓、上册、修宫室、颁诏、求嗣、庆赐、补垣、取鱼、针刺、招贤、整容、布政事、宣政事、安抚边境、施恩、疗目、立券交易、临政、修饰垣墙、纳畜、举正直、解除、塞穴、乘船渡水、修仓库、酝酿、选将、远回、鼓铸、营建、纳采、整手足甲、出师、筑堤防
2073-02-26	二零七三 癸巳[蛇]年	正月大	二十	周日	癸巳 甲寅 戊寅 丁巳	无	惊蛰 (3, 5)	无	无	无	蛇	双鱼座	宴会、经络、纳财、牧养、裁制、覃恩、庆赐、恤孤茕、雪冤、入宅、施恩、立券交易、纳畜、举正直、酝酿	祭祀、剃头、修置产室、开渠、穿井、平治道涂、破屋坏垣、伐木、捕捉、畋猎、启攒、补垣、取鱼、整容、整手足甲、筑堤防、开仓、修饰垣墙
2073-02-27	二零七三 癸巳[蛇]年	正月大	廿一	周一	癸巳 甲寅 己卯 己巳	无	惊蛰 (3, 5)	无	无	无	蛇	双鱼座	出行、结婚姻、宴会、沐浴、剃头、求医疗病、上官、扫舍宇、破土、覃恩、恤孤茕、庆赐、雪冤、整容、布政事、安抚边境、立券交易、临政、解除、选将、整手足甲、出师	嫁娶、安床、修造、上表章、冠带、进人口、竖柱上梁、开市、纳财、修置产室、穿井、栽种、牧养、搬移、祈福、缮城郭、开仓、上册、修宫室、求嗣、取鱼、招贤、纳畜、乘船渡水、修仓库、营建、纳采、筑堤防
2073-02-28	二零七三 癸巳[蛇]年	正月大	廿二	周二	癸巳 甲寅 庚辰 辛巳	无	惊蛰 (3, 5)	无	无	无	蛇	双鱼座	宴会、上表章、竖柱上梁、缮城郭、裁制、上册、修宫室、覃恩、恤孤茕、雪冤、庆赐、布政事	祭祀、结婚姻、嫁娶、上官、栽种、取鱼、招贤、鼓铸、举正直、纳采、乘船渡水、施恩
