2074-01-01	二零七三 癸巳[蛇]年	腊月小	初四	周一	癸巳 甲子 丁亥 乙巳	无	小寒 (1, 5)	元旦节	无	无	蛇	摩羯座	祭祀、沐浴、栽种、牧养、缮城郭、裁制、覃恩、补垣、恤孤茕、雪冤、纳畜、塞穴、修仓库、筑堤防	嫁娶、剃头、修置产室、开渠、穿井、畋猎、破土、启攒、取鱼、针刺、整容、疗目、布政事、开仓、修宫室
2074-01-02	二零七三 癸巳[蛇]年	腊月小	初五	周二	癸巳 甲子 戊子 丁巳	无	小寒 (1, 5)	无	无	无	蛇	摩羯座	沐浴、入宅	出行、结婚姻、宴会、嫁娶、安床、剃头、修造、求医疗病、上表章、上官、冠带、进人口、竖柱上梁、经络、开市、纳财、修置产室、开渠、穿井、安碓硙、平治道涂、破屋坏垣、伐木、栽种、牧养、破土、安葬、启攒、搬移、祈福、缮城郭、裁制、开仓、上册、修宫室、颁诏、求嗣、庆赐、补垣、招贤、整容、布政事、宣政事、安抚边境、施恩、立券交易、修饰垣墙、临政、纳畜、举正直、解除、塞穴、乘船渡水、修仓库、酝酿、选将、远回、鼓铸、营建、纳采、整手足甲、出师、筑堤防
2074-01-03	二零七三 癸巳[蛇]年	腊月小	初六	周三	癸巳 甲子 己丑 己巳	无	小寒 (1, 5)	无	无	无	蛇	摩羯座	祭祀、出行、结婚姻、宴会、嫁娶、沐浴、剃头、上官、进人口、经络、纳财、扫舍宇、安葬、祈福、恤孤茕、雪冤、整容、施恩、立券交易、临政、举正直、解除、酝酿	修造、冠带
2074-01-04	二零七三 癸巳[蛇]年	腊月小	初七	周四	癸巳 甲子 庚寅 辛巳	无	小寒 (1, 5)	无	无	无	蛇	摩羯座	宴会、修造、上表章、进人口、竖柱上梁、开市、纳财、栽种、牧养、祈福、缮城郭、裁制、上册、修宫室、求嗣、庆赐、补垣、安抚边境、立券交易、解除、塞穴、选将、出师	祭祀、招贤、远回
2074-01-05	二零七三 癸巳[蛇]年	腊月小	初八	周五	癸巳 乙丑 辛卯 癸巳	小寒	大寒 (1, 20)	无	腊八节-释迦如来成佛之辰	无	蛇	摩羯座	诸事不宜	祭祀、出行、结婚姻、宴会、嫁娶、安床、剃头、修造、求医疗病、上表章、上官、冠带、进人口、竖柱上梁、经络、开市、纳财、修置产室、开渠、穿井、安碓硙、破屋坏垣、栽种、牧养、破土、安葬、启攒、搬移、祈福、缮城郭、裁制、上册、开仓、修宫室、颁诏、求嗣、庆赐、补垣、招贤、整容、布政事、宣政事、安抚边境、入宅、施恩、立券交易、修饰垣墙、临政、纳畜、举正直、解除、塞穴、修仓库、酝酿、选将、鼓铸、营建、纳采、整手足甲、出师、筑堤防
2074-01-06	二零七三 癸巳[蛇]年	腊月小	初九	周六	癸巳 乙丑 壬辰 乙巳	无	大寒 (1, 20)	无	无	无	蛇	摩羯座	诸事不宜	诸事不宜
2074-01-07	二零七三 癸巳[蛇]年	腊月小	初十	周日	癸巳 乙丑 癸巳 丁巳	无	大寒 (1, 20)	无	无	无	蛇	摩羯座	结婚姻、宴会、修造、冠带、竖柱上梁、经络、安碓硙、搬移、缮城郭、裁制、修宫室、庆赐、入宅、临政、纳畜、赴任、酝酿、纳采	出行、求医疗病、上表章、修置产室、栽种、破土、安葬、启攒、开仓、上册、补垣、取鱼、安抚边境、解除、塞穴、乘船渡水、选将、鼓铸、出师
2074-01-08	二零七三 癸巳[蛇]年	腊月小	十一	周一	癸巳 乙丑 甲午 己巳	无	大寒 (1, 20)	无	无	周恩来逝世纪念日	蛇	摩羯座	祭祀、沐浴、剃头、捕捉、畋猎、诉讼、裁制、整容、赴任、整手足甲	出行、结婚姻、宴会、嫁娶、安床、修造、求医疗病、上表章、上官、冠带、进人口、竖柱上梁、经络、开市、纳财、修置产室、栽种、牧养、破土、安葬、启攒、搬移、祈福、缮城郭、开仓、上册、修宫室、求嗣、庆赐、取鱼、招贤、安抚边境、立券交易、施恩、临政、纳畜、举正直、解除、乘船渡水、修仓库、酝酿、选将、营建、纳采、出师、筑堤防、苫盖
2074-01-09	二零七三 癸巳[蛇]年	腊月小	十二	周二	癸巳 乙丑 乙未 辛巳	无	大寒 (1, 20)	无	无	无	蛇	摩羯座	覃恩、恤孤茕、雪冤、解除	剃头、冠带、修置产室、开渠、穿井、安碓硙、平治道涂、伐木、畋猎、启攒、补垣、取鱼、整容、布政事、修饰垣墙、塞穴、鼓铸、整手足甲、筑堤防
2074-01-10	二零七三 癸巳[蛇]年	腊月小	十三	周三	癸巳 乙丑 丙申 癸巳	无	大寒 (1, 20)	无	无	中国公安110宣传日	蛇	摩羯座	祭祀、沐浴、剃头、经络、开市、纳财、扫舍宇、伐木、畋猎、栽种、牧养、安葬、开仓、整容、安抚边境、纳畜、酝酿、选将、整手足甲	结婚姻、宴会、嫁娶、求嗣、庆赐、纳采
2074-01-11	二零七三 癸巳[蛇]年	腊月小	十四	周四	癸巳 乙丑 丁酉 乙巳	无	大寒 (1, 20)	无	无	无	蛇	摩羯座	沐浴、求医疗病、上表章、上官、入学、进人口、竖柱上梁、经络、开市、纳财、安碓硙、扫舍宇、栽种、牧养、安葬、缮城郭、裁制、上册、修宫室、施恩、临政、举正直、解除、修仓库、酝酿、整手足甲、筑堤防	宴会、剃头、畋猎、选将、出师、乘船渡水、苫盖
2074-01-12	二零七三 癸巳[蛇]年	腊月小	十五	周五	癸巳 乙丑 戊戌 丁巳	无	大寒 (1, 20)	无	无	无	蛇	摩羯座	祭祀、捕捉、畋猎、入宅	出行、结婚姻、宴会、安床、剃头、求医疗病、上表章、上官、冠带、竖柱上梁、经络、开市、修置产室、开渠、穿井、安碓硙、破屋坏垣、栽种、牧养、破土、安葬、启攒、缮城郭、裁制、上册、开仓、修宫室、颁诏、求嗣、庆赐、补垣、招贤、整容、布政事、宣政事、安抚边境、施恩、立券交易、修饰垣墙、临政、举正直、解除、塞穴、修仓库、酝酿、选将、鼓铸、营建、整手足甲、出师、筑堤防
2074-01-13	二零七三 癸巳[蛇]年	腊月小	十六	周六	癸巳 乙丑 己亥 己巳	无	大寒 (1, 20)	无	南岳大帝诞	无	蛇	摩羯座	沐浴、入学、覃恩、恤孤茕、雪冤	祭祀、出行、结婚姻、宴会、嫁娶、安床、剃头、修造、求医疗病、上表章、上官、冠带、进人口、竖柱上梁、经络、开市、纳财、修置产室、开渠、穿井、安碓硙、平治道涂、破屋坏垣、伐木、畋猎、栽种、牧养、破土、安葬、启攒、搬移、祈福、缮城郭、裁制、上册、开仓、修宫室、颁诏、求嗣、庆赐、补垣、取鱼、招贤、整容、布政事、宣政事、安抚边境、施恩、立券交易、修饰垣墙、临政、纳畜、举正直、解除、塞穴、修仓库、酝酿、选将、远回、鼓铸、营建、纳采、整手足甲、出师、筑堤防
2074-01-14	二零七三 癸巳[蛇]年	腊月小	十七	周日	癸巳 乙丑 庚子 辛巳	无	大寒 (1, 20)	无	无	无	蛇	摩羯座	祭祀、沐浴、安葬、裁制、覃恩、恤孤茕、雪冤、塞穴、酝酿	安床、冠带、开市、修置产室、开渠、穿井、安碓硙、平治道涂、破屋坏垣、畋猎、开仓、修宫室、取鱼、针刺、布政事、疗目、修饰垣墙、远回
2074-01-15	二零七三 癸巳[蛇]年	腊月小	十八	周一	癸巳 乙丑 辛丑 癸巳	无	大寒 (1, 20)	无	无	无	蛇	摩羯座	祭祀、宴会、经络、纳财、牧养、裁制、庆赐、施恩、立券交易、纳畜、举正直	剃头、上表章、冠带、修置产室、开渠、穿井、平治道涂、破屋坏垣、伐木、捕捉、畋猎、破土、安葬、启攒、上册、颁诏、补垣、取鱼、整容、宣政事、修饰垣墙、营建、整手足甲、筑堤防
2074-01-16	二零七三 癸巳[蛇]年	腊月小	十九	周二	癸巳 乙丑 壬寅 乙巳	无	大寒 (1, 20)	无	无	无	蛇	摩羯座	沐浴、扫舍宇	祭祀、上表章、立券、开渠、穿井、启攒、上册、颁诏、补垣、招贤、布政事、宣政事、开张、塞穴、营建、筑堤防
2074-01-17	二零七三 癸巳[蛇]年	腊月小	二十	周三	癸巳 乙丑 癸卯 丁巳	无	大寒 (1, 20)	无	无	无	蛇	摩羯座	出行、结婚姻、宴会、嫁娶、修造、求医疗病、上表章、进人口、竖柱上梁、经络、开市、纳财、栽种、牧养、安葬、搬移、祈福、缮城郭、裁制、开仓、上册、修宫室、庆赐、补垣、入宅、安抚边境、立券交易、纳畜、塞穴、修仓库、赴任、选将、纳采、出师	祭祀、剃头、上官、冠带、修置产室、开渠、穿井、安碓硙、平治道涂、破屋坏垣、颁诏、求嗣、招贤、整容、布政事、宣政事、修饰垣墙、施恩、临政、举正直、解除、鼓铸、营建、整手足甲、筑堤防
2074-01-18	二零七三 癸巳[蛇]年	腊月小	廿一	周四	癸巳 乙丑 甲辰 己巳	无	大寒 (1, 20)	无	天猷上帝诞	无	蛇	摩羯座	诸事不宜	诸事不宜
2074-01-19	二零七三 癸巳[蛇]年	腊月小	廿二	周五	癸巳 乙丑 乙巳 辛巳	无	大寒 (1, 20)	无	无	无	蛇	摩羯座	祭祀、宴会、上官、冠带、竖柱上梁、经络、牧养、搬移、祈福、裁制、颁诏、求嗣、覃恩、恤孤茕、雪冤、庆赐、招贤、宣政事、施恩、临政、纳畜、举正直、酝酿、纳采	出行、修置产室、开渠、穿井、平治道涂、破屋坏垣、畋猎、破土、启攒、补垣、取鱼、鼓铸、筑堤防、塞穴、乘船渡水、修饰垣墙
2074-01-20	二零七三 癸巳[蛇]年	腊月小	廿三	周六	癸巳 乙丑 丙午 癸巳	大寒	立春 (2, 3)	无	小年	无	蛇	水瓶座	沐浴、剃头、捕捉、畋猎、诉讼、赴任、整容	出行、结婚姻、宴会、嫁娶、安床、修造、求医疗病、上表章、上官、冠带、进人口、竖柱上梁、经络、开市、纳财、修置产室、开渠、穿井、安碓硙、平治道涂、破屋坏垣、栽种、牧养、破土、安葬、启攒、搬移、祈福、缮城郭、开仓、上册、裁制、修宫室、颁诏、求嗣、庆赐、补垣、取鱼、招贤、布政事、宣政事、安抚边境、立券交易、施恩、修饰垣墙、临政、纳畜、举正直、解除、塞穴、乘船渡水、修仓库、酝酿、选将、鼓铸、营建、纳采、整手足甲、出师、筑堤防、苫盖
2074-01-21	二零七三 癸巳[蛇]年	腊月小	廿四	周日	癸巳 乙丑 丁未 乙巳	无	立春 (2, 3)	无	子时灶君上天朝玉帝	列宁逝世纪念日	蛇	水瓶座	诸事不宜	祭祀、出行、结婚姻、宴会、嫁娶、安床、剃头、修造、上表章、上官、冠带、进人口、竖柱上梁、经络、开市、纳财、修置产室、开渠、穿井、安碓硙、平治道涂、伐木、栽种、牧养、安葬、启攒、搬移、祈福、缮城郭、开仓、裁制、上册、修宫室、颁诏、求嗣、庆赐、补垣、招贤、整容、布政事、宣政事、安抚边境、施恩、立券交易、修饰垣墙、临政、纳畜、举正直、塞穴、修仓库、酝酿、选将、鼓铸、营建、纳采、整手足甲、出师、筑堤防
2074-01-22	二零七三 癸巳[蛇]年	腊月小	廿五	周一	癸巳 乙丑 戊申 丁巳	无	立春 (2, 3)	无	无	无	蛇	水瓶座	祭祀、嫁娶、沐浴、剃头、经络、开市、纳财、扫舍宇、伐木、畋猎、牧养、搬移、开仓、整容、入宅、安抚边境、纳畜、酝酿、选将、整手足甲	结婚姻、宴会、修置产室、开渠、穿井、安碓硙、平治道涂、破屋坏垣、缮城郭、修宫室、求嗣、庆赐、补垣、修饰垣墙、修仓库、营建、筑堤防
2074-01-23	二零七三 癸巳[蛇]年	腊月小	廿六	周二	癸巳 乙丑 己酉 己巳	无	立春 (2, 3)	无	无	无	蛇	水瓶座	出行、沐浴、剃头、求医疗病、上表章、上官、入学、进人口、竖柱上梁、经络、开市、纳财、扫舍宇、牧养、裁制、上册、覃恩、恤孤茕、雪冤、整容、布政事、施恩、临政、举正直、解除、酝酿、整手足甲	宴会、修置产室、开渠、穿井、平治道涂、破屋坏垣、畋猎、补垣、苫盖、选将、营建、出师、修饰垣墙
2074-01-24	二零七三 癸巳[蛇]年	腊月小	廿七	周三	癸巳 乙丑 庚戌 辛巳	无	立春 (2, 3)	无	无	无	蛇	水瓶座	祭祀、捕捉、覃恩、恤孤茕、雪冤	安床、剃头、冠带、经络、开市、修置产室、开渠、穿井、安碓硙、平治道涂、破屋坏垣、破土、启攒、开仓、修宫室、补垣、取鱼、整容、立券交易、修饰垣墙、塞穴、酝酿、鼓铸、整手足甲、筑堤防
2074-01-25	二零七三 癸巳[蛇]年	腊月小	廿八	周四	癸巳 乙丑 辛亥 癸巳	无	立春 (2, 3)	无	无	无	蛇	水瓶座	沐浴、入学、覃恩、恤孤茕、雪冤	祭祀、出行、结婚姻、宴会、嫁娶、安床、剃头、修造、求医疗病、上表章、上官、冠带、进人口、竖柱上梁、经络、开市、纳财、修置产室、开渠、穿井、安碓硙、平治道涂、破屋坏垣、伐木、畋猎、栽种、牧养、破土、安葬、启攒、搬移、祈福、缮城郭、裁制、上册、开仓、修宫室、颁诏、求嗣、庆赐、补垣、取鱼、招贤、整容、布政事、宣政事、安抚边境、施恩、立券交易、修饰垣墙、临政、纳畜、举正直、解除、塞穴、修仓库、酝酿、选将、远回、鼓铸、营建、纳采、整手足甲、出师、筑堤防
2074-01-26	二零七三 癸巳[蛇]年	腊月小	廿九	周五	癸巳 乙丑 壬子 乙巳	无	立春 (2, 3)	无	华严菩萨诞	国际海关日	蛇	水瓶座	祭祀、沐浴、经络、覃恩、恤孤茕、雪冤、塞穴、酝酿	出行、结婚姻、宴会、嫁娶、安床、修造、求医疗病、上表章、上官、冠带、进人口、竖柱上梁、开市、纳财、修置产室、开渠、穿井、安碓硙、平治道涂、破屋坏垣、栽种、牧养、破土、安葬、搬移、祈福、缮城郭、开仓、上册、修宫室、颁诏、求嗣、庆赐、补垣、针刺、招贤、布政事、宣政事、安抚边境、疗目、施恩、立券交易、临政、修饰垣墙、纳畜、举正直、解除、修仓库、选将、远回、营建、纳采、出师、筑堤防
2074-01-27	二零七四 甲午[马]年	正月大	初一	周六	甲午 乙丑 癸丑 丁巳	无	立春 (2, 3)	春节	弥勒佛圣诞	无	马	水瓶座	宴会、经络、纳财、裁制、覃恩、庆赐、恤孤茕、雪冤、布政事、施恩、立券交易、纳畜、举正直、酝酿	剃头、求医疗病、上表章、冠带、修置产室、开渠、穿井、平治道涂、破屋坏垣、伐木、捕捉、畋猎、栽种、破土、安葬、启攒、搬移、祈福、开仓、上册、颁诏、求嗣、补垣、取鱼、整容、宣政事、修饰垣墙、解除、营建、整手足甲、筑堤防
2074-01-28	二零七四 甲午[马]年	正月大	初二	周日	甲午 乙丑 甲寅 己巳	无	立春 (2, 3)	无	无	无	马	水瓶座	出行、结婚姻、宴会、嫁娶、沐浴、剃头、修造、求医疗病、上表章、上官、竖柱上梁、纳财、扫舍宇、栽种、牧养、安葬、搬移、祈福、缮城郭、开仓、裁制、修宫室、求嗣、庆赐、整容、入宅、安抚边境、立券交易、临政、解除、选将、纳采、整手足甲、出师	祭祀、冠带、修置产室、开渠、穿井、安碓硙、平治道涂、破屋坏垣、上册、颁诏、补垣、取鱼、招贤、布政事、宣政事、修饰垣墙、塞穴、乘船渡水、修仓库、鼓铸、营建、筑堤防
2074-01-29	二零七四 甲午[马]年	正月大	初三	周一	甲午 乙丑 乙卯 辛巳	无	立春 (2, 3)	无	无	无	马	水瓶座	出行、结婚姻、宴会、嫁娶、修造、求医疗病、上表章、上官、进人口、竖柱上梁、经络、开市、纳财、栽种、牧养、安葬、搬移、祈福、缮城郭、裁制、开仓、上册、修宫室、颁诏、求嗣、覃恩、补垣、恤孤茕、雪冤、庆赐、招贤、宣政事、安抚边境、施恩、立券交易、临政、纳畜、举正直、解除、塞穴、修仓库、选将、营建、纳采、出师	祭祀、剃头、冠带、修置产室、开渠、穿井、安碓硙、平治道涂、破屋坏垣、畋猎、取鱼、整容、鼓铸、布政事、入宅、整手足甲、筑堤防、修饰垣墙
2074-01-30	二零七四 甲午[马]年	正月大	初四	周二	甲午 乙丑 丙辰 癸巳	无	立春 (2, 3)	无	无	无	马	水瓶座	诸事不宜	诸事不宜
2074-01-31	二零七四 甲午[马]年	正月大	初五	周三	甲午 乙丑 丁巳 乙巳	无	立春 (2, 3)	无	无	无	马	水瓶座	诸事不宜	出行、安床、剃头、求医疗病、上表章、上官、开市、修置产室、开渠、穿井、平治道涂、破屋坏垣、栽种、牧养、破土、安葬、启攒、搬移、祈福、开仓、上册、颁诏、求嗣、补垣、取鱼、招贤、整容、布政事、宣政事、安抚边境、施恩、修饰垣墙、举正直、解除、塞穴、乘船渡水、选将、鼓铸、营建、出师、筑堤防
