2076-12-01	二零七六 丙申[猴]年	冬月大	初六	周二	无	西岳大帝诞	世界艾滋病日	丙申 己亥 壬申 乙巳	无	大雪 (12, 6)	猴	射手座	沐浴、扫舍宇、捕捉	出行、结婚姻、宴会、嫁娶、安床、剃头、修造、求医疗病、上表章、上官、冠带、进人口、竖柱上梁、经络、开市、纳财、修置产室、开渠、穿井、安碓硙、破屋坏垣、畋猎、栽种、牧养、破土、安葬、启攒、布政事、出师、纳畜、颁诏、补垣、纳采、举正直、安抚边境、修仓库、整手足甲、缮城郭、鼓铸、裁制、宣政事、临政、酝酿、立券交易、招贤、开仓、祈福、解除、施恩、筑堤防、求嗣、塞穴、修饰垣墙、上册、庆赐、整容、修宫室、选将、营建、搬移
2076-12-02	二零七六 丙申[猴]年	冬月大	初七	周三	无	无	无	丙申 己亥 癸酉 丁巳	无	大雪 (12, 6)	猴	射手座	沐浴、入学、扫舍宇、雪冤、覃恩、恤孤茕	结婚姻、宴会、嫁娶、冠带、进人口、竖柱上梁、经络、伐木、畋猎、启攒、布政事、取鱼、补垣、纳采、安抚边境、酝酿、开仓、入宅、筑堤防、塞穴、选将、营建、出师
2076-12-03	二零七六 丙申[猴]年	冬月大	初八	周四	无	无	无	丙申 己亥 甲戌 己巳	无	大雪 (12, 6)	猴	射手座	祭祀、雪冤、覃恩、恤孤茕	出行、结婚姻、宴会、嫁娶、安床、剃头、修造、求医疗病、上表章、上官、冠带、进人口、竖柱上梁、经络、开市、纳财、修置产室、开渠、穿井、安碓硙、破屋坏垣、畋猎、栽种、牧养、安葬、布政事、出师、纳畜、取鱼、颁诏、纳采、举正直、补垣、安抚边境、修仓库、整手足甲、缮城郭、鼓铸、裁制、宣政事、临政、乘船渡水、针刺、酝酿、立券交易、招贤、开仓、祈福、解除、施恩、筑堤防、求嗣、塞穴、修饰垣墙、上册、庆赐、整容、修宫室、选将、营建、疗目、搬移
2076-12-04	二零七六 丙申[猴]年	冬月大	初九	周五	无	无	无	丙申 己亥 乙亥 辛巳	无	大雪 (12, 6)	猴	射手座	沐浴、雪冤、覃恩、恤孤茕	嫁娶、剃头、冠带、修置产室、开渠、穿井、平治道涂、破屋坏垣、伐木、畋猎、破土、启攒、布政事、取鱼、补垣、整手足甲、鼓铸、乘船渡水、针刺、筑堤防、塞穴、修饰垣墙、整容
2076-12-05	二零七六 丙申[猴]年	冬月大	初十	周六	无	无	无	丙申 己亥 丙子 癸巳	无	大雪 (12, 6)	猴	射手座	出行、嫁娶、沐浴、剃头、修造、求医疗病、上官、扫舍宇、纳采、安抚边境、整手足甲、临政、解除、入宅、整容、选将、出师、搬移	结婚姻、安床、上表章、冠带、进人口、竖柱上梁、开市、纳财、修置产室、栽种、牧养、安葬、纳畜、取鱼、修仓库、缮城郭、乘船渡水、立券交易、招贤、开仓、祈福、筑堤防、求嗣、上册、修宫室、营建
2076-12-06	二零七六 丙申[猴]年	冬月大	十一	周日	无	太乙救苦天尊诞	无	丙申 庚子 丁丑 乙巳	大雪	冬至 (12, 21)	猴	射手座	祭祀、出行、结婚姻、宴会、嫁娶、沐浴、上表章、上官、进人口、竖柱上梁、经络、纳财、扫舍宇、栽种、牧养、安葬、颁诏、纳采、举正直、安抚边境、雪冤、整手足甲、缮城郭、裁制、宣政事、临政、酝酿、立券交易、招贤、祈福、解除、施恩、求嗣、覃恩、上册、庆赐、恤孤茕、选将、营建、搬移	剃头、冠带、畋猎、取鱼
2076-12-07	二零七六 丙申[猴]年	冬月大	十二	周一	无	无	无	丙申 庚子 戊寅 丁巳	无	冬至 (12, 21)	猴	射手座	宴会、上表章、进人口、竖柱上梁、经络、开市、纳财、栽种、牧养、破土、补垣、缮城郭、裁制、立券交易、祈福、解除、塞穴、求嗣、上册、庆赐、修宫室	祭祀、剃头、整容、招贤、远回
2076-12-08	二零七六 丙申[猴]年	冬月大	十三	周二	无	无	无	丙申 庚子 己卯 己巳	无	冬至 (12, 21)	猴	射手座	诸事不宜	诸事不宜
2076-12-09	二零七六 丙申[猴]年	冬月大	十四	周三	无	无	无	丙申 庚子 庚辰 辛巳	无	冬至 (12, 21)	猴	射手座	祭祀、结婚姻、宴会、嫁娶、修造、上官、冠带、进人口、竖柱上梁、安碓硙、安葬、赴任、布政事、纳畜、纳采、雪冤、缮城郭、裁制、临政、诉讼、酝酿、祈福、覃恩、庆赐、修宫室、恤孤茕	出行、求医疗病、开市、修置产室、栽种、乘船渡水、开仓、解除
2076-12-10	二零七六 丙申[猴]年	冬月大	十五	周四	无	无	无	丙申 庚子 辛巳 癸巳	无	冬至 (12, 21)	猴	射手座	祭祀、捕捉、赴任、雪冤、入宅、覃恩、恤孤茕	出行、剃头、冠带、修置产室、开渠、穿井、安碓硙、破屋坏垣、畋猎、破土、启攒、取鱼、补垣、整手足甲、鼓铸、筑堤防、塞穴、修饰垣墙、整容、修宫室
2076-12-11	二零七六 丙申[猴]年	冬月大	十六	周五	无	无	无	丙申 庚子 壬午 乙巳	无	冬至 (12, 21)	猴	射手座	祭祀、沐浴、雪冤、覃恩、恤孤茕	出行、结婚姻、宴会、嫁娶、安床、剃头、修造、求医疗病、上表章、上官、冠带、进人口、竖柱上梁、经络、开市、纳财、修置产室、开渠、穿井、安碓硙、破屋坏垣、伐木、畋猎、栽种、牧养、破土、安葬、启攒、布政事、出师、纳畜、取鱼、颁诏、纳采、补垣、举正直、解除、苫盖、安抚边境、修仓库、整手足甲、缮城郭、鼓铸、裁制、宣政事、临政、乘船渡水、针刺、酝酿、立券交易、招贤、开仓、入宅、祈福、筑堤防、施恩、求嗣、塞穴、修饰垣墙、上册、庆赐、整容、修宫室、选将、营建、搬移
2076-12-12	二零七六 丙申[猴]年	冬月大	十七	周六	无	阿弥陀佛诞	西安事变纪念日	丙申 庚子 癸未 丁巳	无	冬至 (12, 21)	猴	射手座	伐木、畋猎、雪冤、恤孤茕、覃恩	出行、结婚姻、宴会、嫁娶、安床、剃头、修造、求医疗病、上表章、上官、冠带、进人口、竖柱上梁、经络、开市、纳财、修置产室、开渠、穿井、安碓硙、破屋坏垣、栽种、牧养、破土、安葬、启攒、布政事、纳畜、颁诏、纳采、补垣、举正直、安抚边境、修仓库、整手足甲、缮城郭、鼓铸、裁制、宣政事、临政、酝酿、立券交易、招贤、开仓、祈福、解除、施恩、筑堤防、求嗣、塞穴、修饰垣墙、上册、庆赐、整容、修宫室、选将、营建、出师、搬移
2076-12-13	二零七六 丙申[猴]年	冬月大	十八	周日	无	无	南京大屠杀纪念日	丙申 庚子 甲申 己巳	无	冬至 (12, 21)	猴	射手座	祭祀、出行、沐浴、剃头、求医疗病、上官、入学、竖柱上梁、经络、扫舍宇、牧养、安葬、举正直、整手足甲、裁制、临政、酝酿、祈福、施恩、解除、求嗣、整容	修置产室、开渠、穿井、平治道涂、破屋坏垣、乘船渡水、出师、鼓铸、取鱼、选将、营建、塞穴、补垣、修饰垣墙
2076-12-14	二零七六 丙申[猴]年	冬月大	十九	周一	无	太阳日宫诞	无	丙申 庚子 乙酉 辛巳	无	冬至 (12, 21)	猴	射手座	沐浴、剃头、扫舍宇、捕捉、畋猎、整容	祭祀、出行、结婚姻、宴会、嫁娶、安床、修造、求医疗病、上表章、上官、冠带、进人口、竖柱上梁、经络、开市、纳财、修置产室、开渠、穿井、栽种、牧养、破土、安葬、启攒、布政事、出师、纳畜、取鱼、颁诏、纳采、举正直、安抚边境、修仓库、整手足甲、缮城郭、鼓铸、裁制、宣政事、临政、乘船渡水、酝酿、立券交易、招贤、开仓、祈福、解除、施恩、筑堤防、求嗣、上册、庆赐、修宫室、选将、营建、搬移
2076-12-15	二零七六 丙申[猴]年	冬月大	二十	周二	无	无	无	丙申 庚子 丙戌 癸巳	无	冬至 (12, 21)	猴	射手座	宴会、入学、开市、修置产室、开渠、穿井、安碓硙、栽种、牧养、纳采、举正直、雪冤、缮城郭、裁制、祈福、解除、施恩、入宅、求嗣、覃恩、庆赐、恤孤茕、修宫室	进人口、伐木、捕捉、畋猎、出师、取鱼、安抚边境、开仓、选将
2076-12-16	二零七六 丙申[猴]年	冬月大	廿一	周三	无	无	无	丙申 庚子 丁亥 乙巳	无	冬至 (12, 21)	猴	射手座	祭祀、沐浴、栽种、牧养、纳畜、补垣、雪冤、缮城郭、裁制、筑堤防、塞穴、覃恩、恤孤茕	嫁娶、剃头、立券、修置产室、开渠、穿井、畋猎、破土、启攒、开张、针刺、布政事、整容、整手足甲、修宫室、取鱼、疗目、开仓
2076-12-17	二零七六 丙申[猴]年	冬月大	廿二	周四	无	无	无	丙申 庚子 戊子 丁巳	无	冬至 (12, 21)	猴	射手座	诸事不宜	诸事不宜
2076-12-18	二零七六 丙申[猴]年	冬月大	廿三	周五	无	张仙诞	无	丙申 庚子 己丑 己巳	无	冬至 (12, 21)	猴	射手座	祭祀、结婚姻、宴会、嫁娶、沐浴、剃头、上官、进人口、经络、纳财、扫舍宇、安葬、举正直、雪冤、临政、酝酿、立券交易、祈福、解除、施恩、整容、恤孤茕	修造、冠带、乘船渡水
2076-12-19	二零七六 丙申[猴]年	冬月大	廿四	周六	无	无	无	丙申 庚子 庚寅 辛巳	无	冬至 (12, 21)	猴	射手座	宴会、上表章、进人口、竖柱上梁、开市、纳财、栽种、牧养、补垣、安抚边境、缮城郭、裁制、立券交易、祈福、解除、塞穴、求嗣、上册、庆赐、修宫室、选将、出师	祭祀、招贤、远回
2076-12-20	二零七六 丙申[猴]年	冬月大	廿五	周日	无	无	无	丙申 庚子 辛卯 癸巳	无	冬至 (12, 21)	猴	射手座	平治道涂、赴任、入宅	出行、结婚姻、宴会、嫁娶、安床、剃头、修造、求医疗病、上表章、上官、冠带、进人口、竖柱上梁、经络、开市、纳财、修置产室、开渠、穿井、安碓硙、破屋坏垣、畋猎、栽种、牧养、破土、安葬、启攒、布政事、纳畜、颁诏、补垣、纳采、举正直、安抚边境、修仓库、整手足甲、缮城郭、鼓铸、裁制、宣政事、临政、酝酿、立券交易、招贤、开仓、祈福、解除、施恩、筑堤防、求嗣、塞穴、修饰垣墙、上册、庆赐、整容、修宫室、选将、营建、出师、搬移
2076-12-21	二零七六 丙申[猴]年	冬月大	廿六	周一	无	北方五道诞	无	丙申 庚子 壬辰 乙巳	冬至	小寒 (1, 5)	猴	射手座	祭祀、宴会、经络、安碓硙、赴任、颁诏、举正直、雪冤、裁制、宣政事、诉讼、酝酿、招贤、祈福、施恩、求嗣、覃恩、庆赐、恤孤茕	安床、开市、修置产室、开渠、穿井、畋猎、破土、启攒、取鱼、开仓、筑堤防
2076-12-22	二零七六 丙申[猴]年	冬月大	廿七	周二	无	无	无	丙申 庚子 癸巳 丁巳	无	小寒 (1, 5)	猴	射手座	祭祀、捕捉、雪冤、覃恩、恤孤茕	出行、安床、剃头、冠带、进人口、修置产室、开渠、穿井、安碓硙、破屋坏垣、破土、启攒、布政事、取鱼、补垣、整手足甲、鼓铸、筑堤防、塞穴、修饰垣墙、整容、修宫室
2076-12-23	二零七六 丙申[猴]年	冬月大	廿八	周三	无	无	无	丙申 庚子 甲午 己巳	无	小寒 (1, 5)	猴	摩羯座	诸事不宜	诸事不宜
2076-12-24	二零七六 丙申[猴]年	冬月大	廿九	周四	无	无	平安夜	丙申 庚子 乙未 辛巳	无	小寒 (1, 5)	猴	摩羯座	祭祀、伐木、畋猎	出行、结婚姻、宴会、嫁娶、安床、剃头、修造、求医疗病、上表章、上官、冠带、进人口、竖柱上梁、经络、开市、纳财、修置产室、开渠、穿井、安碓硙、破屋坏垣、栽种、牧养、破土、安葬、启攒、布政事、纳畜、颁诏、纳采、补垣、举正直、安抚边境、修仓库、整手足甲、缮城郭、鼓铸、裁制、宣政事、临政、酝酿、立券交易、招贤、开仓、祈福、解除、施恩、筑堤防、求嗣、塞穴、修饰垣墙、上册、庆赐、整容、修宫室、选将、营建、出师、搬移
2076-12-25	二零七六 丙申[猴]年	冬月大	三十	周五	无	无	圣诞节	丙申 庚子 丙申 癸巳	无	小寒 (1, 5)	猴	摩羯座	出行、沐浴、剃头、求医疗病、上表章、上官、入学、竖柱上梁、经络、扫舍宇、牧养、安葬、举正直、整手足甲、裁制、临政、酝酿、入宅、施恩、解除、整容	安床、修置产室、开渠、穿井、平治道涂、破屋坏垣、取鱼、补垣、鼓铸、乘船渡水、开仓、塞穴、修饰垣墙、选将、营建、出师
2076-12-26	二零七六 丙申[猴]年	腊月小	初一	周六	无	无	毛泽东诞辰纪念日	丙申 庚子 丁酉 乙巳	无	小寒 (1, 5)	猴	摩羯座	沐浴、扫舍宇、捕捉、雪冤、覃恩、恤孤茕	宴会、剃头、冠带、修置产室、开渠、穿井、畋猎、启攒、乘船渡水、布政事、修宫室、鼓铸、取鱼、开仓、筑堤防
2076-12-27	二零七六 丙申[猴]年	腊月小	初二	周日	无	无	无	丙申 庚子 戊戌 丁巳	无	小寒 (1, 5)	猴	摩羯座	宴会、修造、入学、开市、修置产室、开渠、穿井、安碓硙、栽种、牧养、举正直、雪冤、缮城郭、裁制、祈福、解除、施恩、求嗣、覃恩、庆赐、恤孤茕、修宫室	嫁娶、进人口、伐木、捕捉、畋猎、出师、取鱼、安抚边境、开仓、选将
2076-12-28	二零七六 丙申[猴]年	腊月小	初三	周一	无	无	无	丙申 庚子 己亥 己巳	无	小寒 (1, 5)	猴	摩羯座	沐浴、补垣、安抚边境、雪冤、裁制、筑堤防、塞穴、覃恩、恤孤茕、选将	出行、结婚姻、宴会、嫁娶、安床、修造、求医疗病、上表章、上官、进人口、竖柱上梁、开市、修置产室、开渠、穿井、破土、安葬、启攒、布政事、出师、颁诏、纳采、举正直、宣政事、临政、针刺、招贤、开仓、祈福、解除、施恩、求嗣、上册、庆赐、修宫室、营建、疗目、搬移
2076-12-29	二零七六 丙申[猴]年	腊月小	初四	周二	无	无	无	丙申 庚子 庚子 辛巳	无	小寒 (1, 5)	猴	摩羯座	诸事不宜	诸事不宜
2076-12-30	二零七六 丙申[猴]年	腊月小	初五	周三	无	无	无	丙申 庚子 辛丑 癸巳	无	小寒 (1, 5)	猴	摩羯座	祭祀、结婚姻、宴会、嫁娶、沐浴、剃头、上官、进人口、经络、纳财、扫舍宇、安葬、赴任、纳采、举正直、安抚边境、雪冤、整手足甲、临政、立券交易、祈福、解除、入宅、施恩、整容、恤孤茕、选将、出师、搬移	冠带、乘船渡水
2076-12-31	二零七六 丙申[猴]年	腊月小	初六	周四	无	无	无	丙申 庚子 壬寅 乙巳	无	小寒 (1, 5)	猴	摩羯座	宴会、上表章、进人口、竖柱上梁、经络、开市、纳财、栽种、牧养、出师、纳畜、颁诏、补垣、安抚边境、雪冤、缮城郭、裁制、宣政事、立券交易、祈福、解除、塞穴、求嗣、覃恩、上册、庆赐、恤孤茕、修宫室、选将、营建	祭祀、开渠、穿井、畋猎、整手足甲、取鱼、远回
