2079-11-01	2079-10-8	29	危	三	己亥 甲戌 丁巳	无	立冬 (11, 7)	万圣节	无	无	嫁娶 求嗣 纳采 进人口 纳财 结网 纳畜 牧养 会亲友	上梁 作灶 伐木 出行 安葬 安门 理发
2079-11-02	2079-10-9	29	成	四	己亥 甲戌 戊午	无	立冬 (11, 7)	无	无	无	嫁娶 祭祀 开市 开光 出行 入宅 移徙 出火 拆卸 修造 安床	纳畜 伐木 置产 作梁 行丧 安葬 修坟 立碑
2079-11-03	2079-10-10	29	收	五	己亥 甲戌 己未	无	立冬 (11, 7)	无	无	无	嫁娶 祭祀 作灶 纳财	安葬 开市 修坟 立碑
2079-11-04	2079-10-11	29	开	六	己亥 甲戌 庚申	无	立冬 (11, 7)	无	无	无	嫁娶 祭祀 祈福 求嗣 开光 出行 解除 出火 进人口 开市 交易 立券 挂匾 纳财 入宅 移徙 栽种 破土 谢土	安床 安葬
2079-11-05	2079-10-12	29	闭	日	己亥 甲戌 辛酉	无	立冬 (11, 7)	无	无	无	嫁娶 祭祀 祈福 求嗣 动土 安床 扫舍 入殓 移柩 破土 启钻 安葬 作灶 整手足甲 补垣 除服 成服	开光 栽种
2079-11-06	2079-10-13	29	建	一	己亥 甲戌 壬戌	无	立冬 (11, 7)	无	无	无	祭祀 祈福 求嗣 开光 出行 解除 上梁 入宅 移徙 安床 安门 纳财 纳畜 造畜稠	伐木 行丧 破土 嫁娶 安葬 开渠
2079-11-07	2079-10-14	29	建	二	己亥 乙亥 癸亥	立冬	小雪 (11, 22)	无	无	无	祭祀 沐浴 馀事勿取	诸事不宜
2079-11-08	2079-10-15	29	除	三	己亥 乙亥 甲子	无	小雪 (11, 22)	无	无	无	祭祀 会亲友 嫁娶 沐浴 修造 动土 祈福 开光 塑绘 出行 订盟 纳采 裁衣 入殓 除服 成服 移柩 启钻 赴任 竖柱 上梁 纳财 扫舍 栽种 纳畜 伐木	入宅 作灶 安床 开仓
2079-11-09	2079-10-16	29	满	四	己亥 乙亥 乙丑	无	小雪 (11, 22)	无	无	无	理发 会亲友 补垣 塞穴 结网	嫁娶 入宅 安门 移徙
2079-11-10	2079-10-17	29	平	五	己亥 乙亥 丙寅	无	小雪 (11, 22)	无	无	无	祭祀 祈福 订盟 纳采 裁衣 拆卸 修造 动土 起基 安床 移徙 入宅 安香 除服 成服 入殓 移柩 安葬 谢土 赴任 会亲友 进人口 出行 竖柱 上梁 经络 开市 交易 立券 纳财 开仓	作灶 治病 伐木 作梁
2079-11-11	2079-10-18	29	定	六	己亥 乙亥 丁卯	无	小雪 (11, 22)	无	无	无	祭祀 祈福 订盟 纳采 裁衣 拆卸 修造 动土 起基 安床 移徙 入宅 安香 入殓 移柩 安葬 谢土 赴任 进人口 会亲友	作灶 治病
2079-11-12	2079-10-19	29	执	日	己亥 乙亥 戊辰	无	小雪 (11, 22)	无	无	无	祭祀 塑绘 开光 订盟 纳采 嫁娶 安床 进人口 入殓 除服 成服 移柩 启钻 安葬 立碑	开市 交易 破土 作灶
2079-11-13	2079-10-20	29	破	一	己亥 乙亥 己巳	无	小雪 (11, 22)	无	无	无	祭祀 解除 破屋 坏垣 馀事勿取	诸事不宜
2079-11-14	2079-10-21	29	危	二	己亥 乙亥 庚午	无	小雪 (11, 22)	无	无	无	祭祀 解除 祈福 开光 塑绘 斋醮 订盟 纳采 裁衣 冠笄 拆卸 修造 动土 入殓 除服 成服 移柩 启钻 安床 赴任 出行 移徙 竖柱 上梁 伐木 栽种 破土 安葬 纳畜	盖屋 治病
2079-11-15	2079-10-22	29	成	三	己亥 乙亥 辛未	无	小雪 (11, 22)	无	无	无	祭祀 祈福 订盟 纳采 裁衣 合帐 冠笄 安机械 安床 造畜稠 入殓 移柩 启钻 安葬 谢土 除服 成服 会亲友 竖柱 上梁 经络 开市 交易 立券 纳财 纳畜 筑堤	嫁娶 入宅 治病 赴任
2079-11-16	2079-10-23	29	收	四	己亥 乙亥 壬申	无	小雪 (11, 22)	无	无	无	沐浴 扫舍 馀事勿取	诸事不宜
2079-11-17	2079-10-24	29	开	五	己亥 乙亥 癸酉	无	小雪 (11, 22)	无	无	无	诸事不宜	无
2079-11-18	2079-10-25	29	闭	六	己亥 乙亥 甲戌	无	小雪 (11, 22)	无	无	无	祈福 斋醮 出行 订盟 纳采 入殓 移柩 破土 安葬 立碑 结网	入宅 作灶
2079-11-19	2079-10-26	29	建	日	己亥 乙亥 乙亥	无	小雪 (11, 22)	无	无	无	祭祀 沐浴 出行 冠笄 进人口 馀事勿取	嫁娶 动土 安葬 作灶
2079-11-20	2079-10-27	29	除	一	己亥 乙亥 丙子	无	小雪 (11, 22)	无	无	无	祭祀 祈福 斋醮 塑绘 开光 订盟 纳采 裁衣 冠笄 嫁娶 拆卸 入宅 安香 入殓 移柩 理发 安葬 修坟 谢土 赴任 移徙 沐浴 治病 破土 启钻 整手足甲 入学 作梁	开市
2079-11-21	2079-10-28	29	满	二	己亥 乙亥 丁丑	无	小雪 (11, 22)	无	无	无	诸事不宜	无
2079-11-22	2079-10-29	29	平	三	己亥 乙亥 戊寅	小雪	大雪 (12, 7)	无	无	无	开市 交易 立券 挂匾 纳财 开光 出行 入宅 移徙 安床 纳畜 入殓 移柩 安葬	栽种 破土 置产 祭祀 嫁娶 动土 作灶 祈福
2079-11-23	2079-11-1	30	定	四	己亥 乙亥 己卯	无	大雪 (12, 7)	感恩节	无	无	嫁娶 祭祀 祈福 求嗣 开光 出行 解除 出火 拆卸 进人口 入宅 移徙 安床 栽种 动土 修造 纳畜 入殓 安葬 立碑 除服 成服	无
2079-11-24	2079-11-2	30	执	五	己亥 乙亥 庚辰	无	大雪 (12, 7)	无	无	无	开光 解除 拆卸 修造 动土 安床 纳畜 安葬 启钻 入殓	嫁娶 开市 出火 栽种 破土 入宅 移徙 安香 分居 掘井 作灶
2079-11-25	2079-11-3	30	破	六	己亥 乙亥 辛巳	无	大雪 (12, 7)	无	无	无	破屋 坏垣 馀事勿取	诸事不宜
2079-11-26	2079-11-4	30	危	日	己亥 乙亥 壬午	无	大雪 (12, 7)	无	无	无	嫁娶 祭祀 开光 出火 出行 拆卸 修造 动土 解除 开市 交易 立券 挂匾 纳财 入宅 移徙 安床 栽种 纳畜	探病 安葬
2079-11-27	2079-11-5	30	成	一	己亥 乙亥 癸未	无	大雪 (12, 7)	无	无	无	祭祀 祈福 求嗣 开光 解除 理发 会亲友 栽种 纳畜 牧养 安葬 修坟 立碑 启钻	入宅 作灶 词讼 移徙 出行 赴任
2079-11-28	2079-11-6	30	收	二	己亥 乙亥 甲申	无	大雪 (12, 7)	无	无	无	祭祀 沐浴 结网 移柩 入殓 除服 成服	安床 开市 交易 出货财 安葬 修坟 嫁娶 作灶
2079-11-29	2079-11-7	30	开	三	己亥 乙亥 乙酉	无	大雪 (12, 7)	无	无	无	解除 馀事勿取	无
2079-11-30	2079-11-8	30	闭	四	己亥 乙亥 丙戌	无	大雪 (12, 7)	无	无	无	安床 祭祀 开池 补垣 入殓 移柩 破土 启钻	入宅 移徙 嫁娶 掘井 作灶 出火 进人口 开市 开光
