2082-08-01	2082-7-8	30	破	六	壬寅 丁未 辛丑	无	立秋 (8, 7)	建军节	无	无	坏垣 破屋 解除 馀事勿取	嫁娶 安葬
2082-08-02	2082-7-9	30	危	日	壬寅 丁未 壬寅	无	立秋 (8, 7)	无	无	无	会亲友 入宅 入殓 出货财 启钻 嫁娶 安床 安机械 安葬 安门 开仓 开市 开池 拆卸 挂匾 栽种 牧养 破土 移徙 移柩 立券 立碑 纳畜 经络	探病 祈福 祭祀 谢土 造桥
2082-08-03	2082-7-10	30	成	一	壬寅 丁未 癸卯	无	立秋 (8, 7)	无	无	无	上梁 会亲友 嫁娶 安碓磑 安葬 安门 开光 开池 成服 斋醮 求医 治病 盖屋 破土 祈福 祭祀 竖柱 筑堤 纳采 订盟 起基 除服	入宅 合寿木 开市 掘井 词讼
2082-08-04	2082-7-11	30	收	二	壬寅 丁未 甲辰	无	立秋 (8, 7)	无	无	无	上梁 会亲友 入学 入宅 出火 出行 塑绘 嫁娶 安香 开光 拆卸 斋醮 栽种 牧养 盖屋 祈福 祭祀 移徙 竖柱 纳畜 纳采 解除 订盟 起基	出货财 启钻 安葬 开仓 开市 破土
2082-08-05	2082-7-12	30	开	三	壬寅 丁未 乙巳	无	立秋 (8, 7)	无	无	无	上梁 习艺 伐木 作灶 出火 塑绘 嫁娶 安床 安碓磑 开光 挂匾 掘井 沐浴 治病 盖屋 祭祀 竖柱 纳畜 纳采 订盟	出行 安葬 造桥
2082-08-06	2082-7-13	30	闭	四	壬寅 丁未 丙午	无	立秋 (8, 7)	无	无	无	入殓 启钻 塞穴 安葬 成服 断蚁 破土 祭祀 移柩 结网 除服	入宅 嫁娶 开光 开市 盖屋
2082-08-07	2082-7-14	30	闭	五	壬寅 戊申 丁未	立秋	处暑 (8, 22)	无	无	无	修造 入殓 出火 出行 动土 启钻 嫁娶 安床 安葬 拆卸 求嗣 破土 祈福 祭祀 移徙	作灶 开光 掘井 理发 盖屋 造船
2082-08-08	2082-7-15	30	建	六	壬寅 戊申 戊申	无	处暑 (8, 22)	无	无	无	上梁 入殓 出行 启钻 安葬 安门 开光 求嗣 牧养 盖屋 祈福 祭祀 移徙 纳畜 纳财 解除	动土 安床 掘井 破土 置产
2082-08-09	2082-7-16	30	除	日	壬寅 戊申 己酉	无	处暑 (8, 22)	无	无	无	入殓 安葬 扫舍 整手足甲 沐浴 理发 破土 祭祀 移柩 解除	会亲友 作灶 入宅 出行 嫁娶 移徙 赴任 进人口
2082-08-10	2082-7-17	30	满	一	壬寅 戊申 庚戌	无	处暑 (8, 22)	无	无	无	塑绘 塞穴 开光 栽种 牧养 纳畜 补垣 进人口	上梁 交易 修造 动土 嫁娶 安葬 开市 祈福 立券 纳财
2082-08-11	2082-7-18	30	平	二	壬寅 戊申 辛亥	无	处暑 (8, 22)	无	无	无	作灶 修饰垣墙 平治道涂 沐浴 馀事勿取	诸事不宜
2082-08-12	2082-7-19	30	定	三	壬寅 戊申 壬子	无	处暑 (8, 22)	无	无	无	伐木 作梁 修造 入殓 出火 出行 动土 安床 安葬 开光 成服 拆卸 栽种 求嗣 破土 祭祀 纳畜 解除 起基 进人口 除服	嫁娶 移徙
2082-08-13	2082-7-20	30	执	四	壬寅 戊申 癸丑	无	处暑 (8, 22)	无	无	无	入殓 塞穴 安葬 破土 祭祀 移柩 馀事勿取	诸事不宜
2082-08-14	2082-7-21	30	破	五	壬寅 戊申 甲寅	无	处暑 (8, 22)	无	无	无	坏垣 破屋 馀事勿取	诸事不宜
2082-08-15	2082-7-22	30	危	六	壬寅 戊申 乙卯	无	处暑 (8, 22)	无	无	无	入殓 启钻 安葬 成服 祭祀 移柩 结网 除服 馀事勿取	诸事不宜
2082-08-16	2082-7-23	30	成	日	壬寅 戊申 丙辰	无	处暑 (8, 22)	无	无	无	交易 伐木 入宅 入殓 出火 动土 嫁娶 安床 安葬 开光 开市 拆卸 祈福 祭祀 移徙 立券 纳畜	作灶 出行 栽种 针灸
2082-08-17	2082-7-24	30	收	一	壬寅 戊申 丁巳	无	处暑 (8, 22)	无	无	无	交易 开光 祭祀 立券 纳畜 纳财 解除 进人口	入宅 出火 出行 分居 动土 嫁娶 安香 理发 破土 移徙
2082-08-18	2082-7-25	30	开	二	壬寅 戊申 戊午	无	处暑 (8, 22)	无	无	无	会亲友 出行 嫁娶 安床 开光 成服 栽种 求嗣 祈福 祭祀 移柩 解除 进人口 除服	伐木 入宅 入殓 安葬 盖屋 移徙 纳畜 置产
2082-08-19	2082-7-26	30	闭	三	壬寅 戊申 己未	无	处暑 (8, 22)	无	无	无	会亲友 入殓 动土 塞穴 安葬 开池 破土 祭祀 移柩 筑堤	上梁 作灶 修造 入宅 出行 安门 开光 裁衣
2082-08-20	2082-7-27	30	建	四	壬寅 戊申 庚申	无	处暑 (8, 22)	无	无	无	作灶 出行 安门 扫舍 祭祀 纳畜 纳财 裁衣 进人口 造畜稠	动土 合寿木 安床 安葬 开生坟
2082-08-21	2082-7-28	30	除	五	壬寅 戊申 辛酉	无	处暑 (8, 22)	无	无	无	上梁 修造 入殓 动土 启钻 安床 安门 开池 开渠 拆卸 破土 祭祀 解除 起基	作灶 入宅 出行 嫁娶 栽种 移徙 赴任 进人口
2082-08-22	2082-7-29	30	满	六	壬寅 戊申 壬戌	处暑	白露 (9, 7)	无	无	无	上梁 会亲友 修造 入宅 出火 出行 安床 安机械 安香 开光 拆卸 栽种 移徙 纳畜 纳采 经络 解除 订盟	伐木 作灶 动土 安葬 破土 祈福 祭祀 行丧 谢土
2082-08-23	2082-7-30	30	平	日	壬寅 戊申 癸亥	无	白露 (9, 7)	无	无	无	作灶 修饰垣墙 平治道涂 沐浴 祭祀	伐木 作梁 嫁娶 安葬 安门 栽种 治病 祈福 置产 词讼
2082-08-24	2082-7a-1	29	定	一	壬寅 戊申 甲子	无	白露 (9, 7)	无	无	无	交易 修造 入宅 入殓 出火 出行 动土 嫁娶 安床 安葬 安香 开光 成服 拆卸 求嗣 破土 祈福 祭祀 移徙 立券 解除 谢土 进人口 除服	作灶 开仓 开市 斋醮 造船
2082-08-25	2082-7a-2	29	执	二	壬寅 戊申 乙丑	无	白露 (9, 7)	无	无	无	入殓 安葬 成服 捕捉 破土 祭祀 移柩 除服 馀事勿取	交易 入宅 嫁娶 开市
2082-08-26	2082-7a-3	29	破	三	壬寅 戊申 丙寅	无	白露 (9, 7)	无	无	无	坏垣 治病 破屋 馀事勿取	入宅 嫁娶 安葬 祈福 纳采 订盟
2082-08-27	2082-7a-4	29	危	四	壬寅 戊申 丁卯	无	白露 (9, 7)	无	无	无	交易 伐木 入宅 出火 出行 嫁娶 安床 安葬 安香 开光 开市 栽种 求嗣 祈福 祭祀 移徙 立券 解除	作灶 动土 开池 掘井 理发 破土
2082-08-28	2082-7a-5	29	成	五	壬寅 戊申 戊辰	无	白露 (9, 7)	无	无	无	上梁 交易 修造 出火 出行 动土 安床 安机械 安葬 开光 开市 拆卸 普渡 栽种 求嗣 破土 祈福 祭祀 移徙 移柩 立券 纳畜 纳采 订盟 进人口	入宅 嫁娶 掘井 牧养
2082-08-29	2082-7a-6	29	收	六	壬寅 戊申 己巳	无	白露 (9, 7)	无	无	无	上梁 交易 会亲友 修造 冠笄 动土 嫁娶 安床 栽种 求嗣 祈福 祭祀 移徙 立券 竖柱 经络 裁衣 进人口	伐木 作梁 出行 安葬 纳畜 行丧 造桥
2082-08-30	2082-7a-7	29	开	日	壬寅 戊申 庚午	无	白露 (9, 7)	无	无	无	出行 动土 嫁娶 安床 开光 开渠 放水 栽种 理发 祭祀 纳采 订盟 进人口	上梁 伐木 作灶 入宅 入殓 安葬 安门 探病 盖屋 纳畜
2082-08-31	2082-7a-8	29	闭	一	壬寅 戊申 辛未	无	白露 (9, 7)	无	无	无	作梁 修造 入殓 出火 出行 动土 塞穴 安床 安葬 拆卸 破土 祭祀 移柩 补垣 起基 造畜稠	入宅 嫁娶 开光 掘井 斋醮 针灸
