2088-04-01	二零八八 戊申[猴]年	三月小	初十	周四	无	无	国际愚人节	戊申 乙卯 辛未 癸巳	无	清明 (4, 4)	猴	白羊座	祭祀、结婚姻、宴会、修造、冠带、进人口、竖柱上梁、经络、安碓硙、破土、纳畜、纳采、雪冤、缮城郭、裁制、祈福、求嗣、庆赐、修宫室、恤孤茕	求医疗病、上表章、开市、修置产室、栽种、安葬、上册、安抚边境、针刺、选将、开仓、解除、出师
2088-04-02	二零八八 戊申[猴]年	三月小	十一	周五	无	无	国际儿童图书日	戊申 乙卯 壬申 乙巳	无	清明 (4, 4)	猴	白羊座	祭祀、沐浴、扫舍宇、捕捉、雪冤、覃恩、恤孤茕	安床、冠带、进人口、经络、开市、纳财、修置产室、开渠、穿井、安碓硙、破屋坏垣、畋猎、启攒、布政事、补垣、鼓铸、酝酿、立券交易、开仓、筑堤防、塞穴、修饰垣墙、修宫室
2088-04-03	二零八八 戊申[猴]年	三月小	十二	周六	无	无	无	戊申 乙卯 癸酉 丁巳	无	清明 (4, 4)	猴	白羊座	诸事不宜	诸事不宜
2088-04-04	二零八八 戊申[猴]年	三月小	十三	周日	清明节	无	无	戊申 丙辰 甲戌 己巳	清明	谷雨 (4, 19)	猴	白羊座	祭祀、沐浴、求医疗病、破屋坏垣、解除	结婚姻、宴会、安床、修造、上官、冠带、进人口、竖柱上梁、经络、开市、纳财、修置产室、开渠、穿井、安碓硙、伐木、栽种、牧养、破土、安葬、启攒、布政事、纳畜、取鱼、颁诏、纳采、补垣、举正直、修仓库、缮城郭、鼓铸、裁制、宣政事、临政、乘船渡水、酝酿、立券交易、招贤、开仓、筑堤防、施恩、求嗣、塞穴、修饰垣墙、上册、庆赐、修宫室、营建
2088-04-05	二零八八 戊申[猴]年	三月小	十四	周一	无	无	无	戊申 丙辰 乙亥 辛巳	无	谷雨 (4, 19)	猴	白羊座	安床、沐浴、牧养、纳畜、取鱼	出行、结婚姻、嫁娶、求医疗病、进人口、开市、畋猎、破土、安葬、启攒、乘船渡水、修仓库、纳采、立券交易、开仓、祈福、解除、求嗣
2088-04-06	二零八八 戊申[猴]年	三月小	十五	周二	无	昊天上帝诞	无	戊申 丙辰 丙子 癸巳	无	谷雨 (4, 19)	猴	白羊座	祭祀、结婚姻、宴会、嫁娶、沐浴、上表章、上官、入学、进人口、竖柱上梁、经络、开市、纳财、安碓硙、栽种、牧养、安葬、赴任、纳畜、纳采、举正直、缮城郭、裁制、临政、诉讼、酝酿、立券交易、开仓、筑堤防、祈福、施恩、解除、求嗣、庆赐、修宫室	剃头、整手足甲、远回、整容
2088-04-07	二零八八 戊申[猴]年	三月小	十六	周三	无	准提菩萨诞	世界卫生日	戊申 丙辰 丁丑 乙巳	无	谷雨 (4, 19)	猴	白羊座	进人口、纳财、捕捉、栽种、牧养、纳畜、雪冤、覃恩、恤孤茕	剃头、冠带、修置产室、开渠、穿井、畋猎、破土、启攒、乘船渡水、布政事、整容、鼓铸、取鱼、筑堤防
2088-04-08	二零八八 戊申[猴]年	三月小	十七	周四	无	无	无	戊申 丙辰 戊寅 丁巳	无	谷雨 (4, 19)	猴	白羊座	结婚姻、宴会、求医疗病、上表章、上官、入学、竖柱上梁、开市、修置产室、开渠、穿井、安碓硙、栽种、牧养、纳畜、颁诏、纳采、举正直、修仓库、雪冤、缮城郭、裁制、宣政事、临政、立券交易、招贤、祈福、解除、施恩、入宅、求嗣、覃恩、上册、庆赐、恤孤茕、修宫室、营建	祭祀、伐木、畋猎、启攒、乘船渡水、针刺、取鱼、出师
2088-04-09	二零八八 戊申[猴]年	三月小	十八	周五	无	无	无	戊申 丙辰 己卯 己巳	无	谷雨 (4, 19)	猴	白羊座	雪冤、恤孤茕、补垣、覃恩、塞穴	出行、结婚姻、宴会、嫁娶、安床、修造、求医疗病、上表章、上官、冠带、进人口、竖柱上梁、经络、开市、纳财、修置产室、开渠、穿井、栽种、牧养、破土、安葬、启攒、布政事、出师、纳畜、颁诏、纳采、举正直、安抚边境、修仓库、缮城郭、宣政事、临政、针刺、酝酿、立券交易、招贤、开仓、祈福、解除、施恩、筑堤防、求嗣、上册、庆赐、修宫室、选将、营建、疗目、搬移
2088-04-10	二零八八 戊申[猴]年	三月小	十九	周六	无	中岳大帝诞	无	戊申 丙辰 庚辰 辛巳	无	谷雨 (4, 19)	猴	白羊座	祭祀、雪冤、覃恩、恤孤茕	出行、结婚姻、宴会、嫁娶、安床、剃头、修造、求医疗病、上表章、上官、冠带、进人口、竖柱上梁、经络、开市、纳财、修置产室、开渠、穿井、安碓硙、平治道涂、破屋坏垣、伐木、栽种、牧养、破土、安葬、启攒、布政事、纳畜、颁诏、纳采、补垣、举正直、安抚边境、修仓库、整手足甲、缮城郭、鼓铸、裁制、宣政事、临政、酝酿、立券交易、招贤、开仓、祈福、解除、施恩、求嗣、筑堤防、塞穴、修饰垣墙、上册、庆赐、整容、修宫室、选将、营建、出师、搬移
2088-04-11	二零八八 戊申[猴]年	三月小	二十	周日	无	子孙娘娘诞	无	戊申 丙辰 辛巳 癸巳	无	谷雨 (4, 19)	猴	白羊座	沐浴、扫舍宇、雪冤、覃恩、恤孤茕	出行、结婚姻、嫁娶、安床、修造、上表章、冠带、进人口、竖柱上梁、修置产室、开渠、穿井、安碓硙、破屋坏垣、破土、安葬、启攒、颁诏、纳采、补垣、修仓库、缮城郭、鼓铸、裁制、宣政事、招贤、祈福、筑堤防、塞穴、求嗣、修饰垣墙、上册、修宫室、营建、搬移
2088-04-12	二零八八 戊申[猴]年	三月小	廿一	周一	无	无	无	戊申 丙辰 壬午 乙巳	无	谷雨 (4, 19)	猴	白羊座	出行、结婚姻、宴会、嫁娶、修造、求医疗病、上表章、上官、进人口、竖柱上梁、经络、开市、纳财、栽种、牧养、安葬、出师、纳畜、颁诏、纳采、补垣、举正直、安抚边境、修仓库、雪冤、缮城郭、裁制、宣政事、临政、立券交易、招贤、开仓、祈福、解除、施恩、塞穴、求嗣、覃恩、上册、庆赐、恤孤茕、修宫室、选将、营建、搬移	祭祀、剃头、冠带、修置产室、开渠、穿井、安碓硙、破屋坏垣、畋猎、启攒、苫盖、整容、整手足甲、鼓铸、取鱼、入宅、筑堤防、修饰垣墙
2088-04-13	二零八八 戊申[猴]年	三月小	廿二	周二	无	无	无	戊申 丙辰 癸未 丁巳	无	谷雨 (4, 19)	猴	白羊座	平治道涂、赴任、雪冤、恤孤茕、入宅、覃恩	出行、结婚姻、宴会、嫁娶、安床、剃头、修造、求医疗病、上表章、上官、冠带、进人口、竖柱上梁、经络、开市、纳财、修置产室、开渠、穿井、安碓硙、破屋坏垣、栽种、牧养、破土、安葬、启攒、布政事、纳畜、颁诏、纳采、补垣、举正直、安抚边境、修仓库、整手足甲、缮城郭、鼓铸、裁制、宣政事、临政、酝酿、立券交易、招贤、开仓、祈福、解除、施恩、筑堤防、求嗣、塞穴、修饰垣墙、上册、庆赐、整容、修宫室、选将、营建、出师、搬移
2088-04-14	二零八八 戊申[猴]年	三月小	廿三	周三	无	无	无	戊申 丙辰 甲申 己巳	无	谷雨 (4, 19)	猴	白羊座	沐浴、扫舍宇	出行、结婚姻、宴会、嫁娶、安床、剃头、修造、求医疗病、上表章、上官、冠带、进人口、竖柱上梁、经络、开市、纳财、修置产室、开渠、穿井、安碓硙、平治道涂、破屋坏垣、伐木、捕捉、畋猎、栽种、牧养、破土、安葬、启攒、布政事、出师、纳畜、取鱼、颁诏、补垣、纳采、举正直、安抚边境、修仓库、整手足甲、缮城郭、鼓铸、裁制、宣政事、临政、乘船渡水、酝酿、立券交易、招贤、开仓、祈福、解除、施恩、筑堤防、求嗣、塞穴、修饰垣墙、上册、庆赐、整容、修宫室、选将、营建、远回、搬移
2088-04-15	二零八八 戊申[猴]年	三月小	廿四	周四	无	无	无	戊申 丙辰 乙酉 辛巳	无	谷雨 (4, 19)	猴	白羊座	祭祀、出行、结婚姻、嫁娶、沐浴、剃头、修造、求医疗病、上表章、上官、进人口、竖柱上梁、经络、开市、纳财、扫舍宇、捕捉、栽种、牧养、安葬、纳畜、取鱼、颁诏、纳采、举正直、安抚边境、修仓库、雪冤、整手足甲、缮城郭、裁制、宣政事、临政、酝酿、立券交易、招贤、祈福、解除、施恩、求嗣、覃恩、上册、整容、恤孤茕、选将、营建、搬移	宴会、冠带、修置产室、开渠、穿井、安碓硙、平治道涂、破屋坏垣、乘船渡水、修宫室、开仓、筑堤防、出师、补垣、修饰垣墙
2088-04-16	二零八八 戊申[猴]年	三月小	廿五	周五	无	无	无	戊申 丙辰 丙戌 癸巳	无	谷雨 (4, 19)	猴	白羊座	祭祀、沐浴、求医疗病、解除	冠带、修置产室、开渠、穿井、安碓硙、平治道涂、伐木、破土、安葬、启攒、布政事、纳畜、取鱼、颁诏、补垣、修仓库、鼓铸、宣政事、乘船渡水、招贤、筑堤防、塞穴、修饰垣墙、上册、营建
2088-04-17	二零八八 戊申[猴]年	三月小	廿六	周六	无	无	无	戊申 丙辰 丁亥 乙巳	无	谷雨 (4, 19)	猴	白羊座	祭祀、结婚姻、宴会、安床、沐浴、上表章、上官、竖柱上梁、纳财、牧养、纳畜、颁诏、纳采、举正直、雪冤、裁制、宣政事、临政、招贤、施恩、覃恩、上册、庆赐、恤孤茕、搬移	嫁娶、剃头、修置产室、开渠、穿井、安碓硙、平治道涂、破屋坏垣、畋猎、破土、启攒、整容、取鱼、筑堤防、补垣、修饰垣墙
2088-04-18	二零八八 戊申[猴]年	三月小	廿七	周日	无	七殿泰山王诞	无	戊申 丙辰 戊子 丁巳	无	谷雨 (4, 19)	猴	白羊座	祭祀、宴会、沐浴、上官、入学、进人口、竖柱上梁、经络、开市、纳财、牧养、赴任、纳畜、纳采、举正直、安抚边境、裁制、临政、诉讼、酝酿、立券交易、入宅、施恩、祈福、庆赐、选将、出师	修置产室、开渠、穿井、平治道涂、破屋坏垣、破土、启攒、补垣、修饰垣墙、营建、远回
2088-04-19	二零八八 戊申[猴]年	三月小	廿八	周一	无	苍颉至圣先师诞	无	戊申 丙辰 己丑 己巳	谷雨	立夏 (5, 4)	猴	白羊座	进人口、纳财、捕捉、纳畜、取鱼	出行、结婚姻、宴会、安床、修造、求医疗病、上表章、上官、冠带、竖柱上梁、经络、开市、修置产室、开渠、穿井、安碓硙、平治道涂、破屋坏垣、栽种、破土、安葬、启攒、布政事、颁诏、纳采、补垣、举正直、修仓库、缮城郭、鼓铸、裁制、宣政事、临政、酝酿、立券交易、招贤、开仓、解除、施恩、筑堤防、修饰垣墙、上册、庆赐、修宫室、营建、搬移
2088-04-20	二零八八 戊申[猴]年	三月小	廿九	周二	无	无	无	戊申 丙辰 庚寅 辛巳	无	立夏 (5, 4)	猴	白羊座	结婚姻、宴会、求医疗病、上表章、上官、入学、竖柱上梁、开市、纳财、牧养、颁诏、纳采、举正直、安抚边境、雪冤、裁制、宣政事、临政、立券交易、招贤、开仓、祈福、解除、施恩、求嗣、覃恩、上册、庆赐、恤孤茕、选将	祭祀、嫁娶、平治道涂、破屋坏垣、伐木、畋猎、乘船渡水、针刺、取鱼、营建、筑堤防、补垣、修饰垣墙
2088-04-21	二零八八 戊申[猴]年	四月大	初一	周三	无	八殿都市王诞	无	戊申 丙辰 辛卯 癸巳	无	立夏 (5, 4)	猴	金牛座	塞穴	出行、结婚姻、宴会、嫁娶、安床、修造、求医疗病、上表章、上官、冠带、进人口、竖柱上梁、经络、开市、纳财、修置产室、开渠、穿井、安碓硙、平治道涂、破屋坏垣、栽种、牧养、破土、安葬、启攒、布政事、出师、纳畜、颁诏、补垣、纳采、举正直、安抚边境、修仓库、整手足甲、缮城郭、宣政事、临政、针刺、酝酿、立券交易、招贤、开仓、祈福、解除、施恩、筑堤防、求嗣、修饰垣墙、上册、庆赐、修宫室、选将、营建、疗目、搬移
2088-04-22	二零八八 戊申[猴]年	四月大	初二	周四	无	无	列宁诞辰纪念日	戊申 丙辰 壬辰 乙巳	无	立夏 (5, 4)	猴	金牛座	祭祀、雪冤、覃恩、恤孤茕	安床、剃头、冠带、开市、修置产室、开渠、穿井、平治道涂、破屋坏垣、伐木、畋猎、破土、启攒、布政事、取鱼、补垣、整手足甲、鼓铸、开仓、筑堤防、塞穴、修饰垣墙、整容
2088-04-23	二零八八 戊申[猴]年	四月大	初三	周五	无	无	世界图书和版权日	戊申 丙辰 癸巳 丁巳	无	立夏 (5, 4)	猴	金牛座	嫁娶、沐浴、剃头、修造、求医疗病、上官、经络、开市、纳财、扫舍宇、栽种、牧养、赴任、纳畜、纳采、安抚边境、雪冤、整手足甲、临政、酝酿、立券交易、开仓、解除、入宅、整容、恤孤茕、选将、搬移	出行、结婚姻、宴会、上表章、冠带、竖柱上梁、修置产室、开渠、穿井、安碓硙、平治道涂、破屋坏垣、破土、安葬、启攒、布政事、颁诏、补垣、修仓库、缮城郭、鼓铸、裁制、宣政事、招贤、祈福、筑堤防、塞穴、求嗣、修饰垣墙、上册、庆赐、修宫室、营建
2088-04-24	二零八八 戊申[猴]年	四月大	初四	周六	无	文殊菩萨诞	无	戊申 丙辰 甲午 己巳	无	立夏 (5, 4)	猴	金牛座	诸事不宜	祭祀、出行、结婚姻、宴会、嫁娶、安床、剃头、修造、求医疗病、上表章、上官、冠带、进人口、竖柱上梁、经络、开市、纳财、修置产室、开渠、穿井、安碓硙、平治道涂、破屋坏垣、栽种、牧养、破土、安葬、启攒、布政事、纳畜、颁诏、补垣、纳采、举正直、苫盖、安抚边境、修仓库、整手足甲、缮城郭、鼓铸、裁制、宣政事、临政、酝酿、立券交易、招贤、开仓、入宅、祈福、解除、施恩、筑堤防、求嗣、塞穴、修饰垣墙、上册、庆赐、整容、修宫室、选将、营建、出师、搬移
2088-04-25	二零八八 戊申[猴]年	四月大	初五	周日	无	无	无	戊申 丙辰 乙未 辛巳	无	立夏 (5, 4)	猴	金牛座	诸事不宜	诸事不宜
2088-04-26	二零八八 戊申[猴]年	四月大	初六	周一	无	无	世界知识产权日	戊申 丙辰 丙申 癸巳	无	立夏 (5, 4)	猴	金牛座	祭祀、沐浴、扫舍宇、布政事	诸事不忌
2088-04-27	二零八八 戊申[猴]年	四月大	初七	周二	无	无	无	戊申 丙辰 丁酉 乙巳	无	立夏 (5, 4)	猴	金牛座	祭祀、出行、结婚姻、嫁娶、沐浴、修造、求医疗病、上表章、上官、进人口、竖柱上梁、经络、纳财、扫舍宇、捕捉、栽种、牧养、安葬、出师、纳畜、颁诏、纳采、举正直、安抚边境、修仓库、雪冤、整手足甲、缮城郭、裁制、宣政事、临政、酝酿、立券交易、招贤、开仓、祈福、解除、施恩、求嗣、覃恩、上册、恤孤茕、修宫室、选将、营建、搬移	宴会、剃头、冠带、立券、修置产室、开渠、穿井、安碓硙、平治道涂、破屋坏垣、畋猎、开张、乘船渡水、取鱼、筑堤防、修饰垣墙、补垣
2088-04-28	二零八八 戊申[猴]年	四月大	初八	周三	无	释迦牟尼佛诞	无	戊申 丙辰 戊戌 丁巳	无	立夏 (5, 4)	猴	金牛座	祭祀、沐浴、入宅、解除	结婚姻、宴会、安床、上官、冠带、进人口、竖柱上梁、经络、开市、纳财、修置产室、开渠、穿井、安碓硙、平治道涂、伐木、栽种、牧养、破土、安葬、启攒、布政事、纳畜、取鱼、颁诏、补垣、举正直、修仓库、缮城郭、鼓铸、宣政事、临政、乘船渡水、酝酿、立券交易、招贤、开仓、筑堤防、施恩、求嗣、塞穴、修饰垣墙、上册、庆赐、修宫室、营建
2088-04-29	二零八八 戊申[猴]年	四月大	初九	周四	无	无	无	戊申 丙辰 己亥 己巳	无	立夏 (5, 4)	猴	金牛座	安床、沐浴、纳财、牧养、安抚边境、纳畜、选将、取鱼、出师	出行、嫁娶、修造、求医疗病、修置产室、开渠、穿井、安碓硙、平治道涂、破屋坏垣、畋猎、破土、安葬、启攒、补垣、修仓库、缮城郭、开仓、筑堤防、祈福、解除、求嗣、修饰垣墙、修宫室、营建
2088-04-30	二零八八 戊申[猴]年	四月大	初十	周五	无	无	无	戊申 丙辰 庚子 辛巳	无	立夏 (5, 4)	猴	金牛座	祭祀、结婚姻、宴会、嫁娶、沐浴、求医疗病、上官、入学、进人口、竖柱上梁、开市、纳财、牧养、安葬、赴任、纳畜、纳采、举正直、安抚边境、裁制、临政、诉讼、酝酿、立券交易、开仓、施恩、祈福、解除、求嗣、庆赐、选将、出师	修置产室、开渠、穿井、平治道涂、破屋坏垣、营建、远回、补垣、修饰垣墙
