2089-02-01	二零八八 戊申[猴]年	腊月小	廿一	周二	戊申 乙丑 丁丑 乙巳	猴	水瓶座	无	立春 (2, 3)	无	天猷上帝诞	无	宴会、经络、纳财、立券交易、裁制、举正直、纳畜、酝酿、庆赐、施恩	剃头、求医疗病、上表章、冠带、修置产室、开渠、穿井、平治道涂、破屋坏垣、伐木、捕捉、畋猎、栽种、破土、安葬、启攒、取鱼、上册、颁诏、修饰垣墙、祈福、整容、开仓、补垣、解除、整手足甲、搬移、营建、筑堤防、宣政事、求嗣
2089-02-02	二零八八 戊申[猴]年	腊月小	廿二	周三	戊申 乙丑 戊寅 丁巳	猴	水瓶座	无	立春 (2, 3)	无	无	世界湿地日	出行、结婚姻、宴会、嫁娶、沐浴、剃头、修造、求医疗病、上官、竖柱上梁、纳财、扫舍宇、栽种、牧养、破土、立券交易、裁制、缮城郭、选将、入宅、出师、祈福、庆赐、整容、开仓、解除、修宫室、纳采、整手足甲、临政、搬移、求嗣、安抚边境	祭祀、上表章、冠带、修置产室、开渠、穿井、安碓硙、平治道涂、破屋坏垣、安葬、启攒、招贤、布政事、塞穴、上册、颁诏、修饰垣墙、鼓铸、补垣、修仓库、筑堤防、营建、宣政事
2089-02-03	二零八八 戊申[猴]年	腊月小	廿三	周四	戊申 丙寅 己卯 己巳	猴	水瓶座	立春	雨水 (2, 18)	无	小年	无	出行、结婚姻、宴会、嫁娶、沐浴、剃头、求医疗病、上官、扫舍宇、破土、立券交易、雪冤、覃恩、布政事、选将、出师、庆赐、整容、解除、整手足甲、临政、恤孤茕、安抚边境	安床、修造、上表章、冠带、进人口、竖柱上梁、开市、纳财、修置产室、穿井、栽种、牧养、乘船渡水、缮城郭、招贤、纳畜、取鱼、上册、祈福、开仓、纳采、修仓库、搬移、营建、筑堤防、求嗣、修宫室
2089-02-04	二零八八 戊申[猴]年	腊月小	廿四	周五	戊申 丙寅 庚辰 辛巳	猴	水瓶座	无	雨水 (2, 18)	无	子时灶君上天朝玉帝	世界抗癌日	宴会、上表章、竖柱上梁、雪冤、裁制、覃恩、缮城郭、布政事、上册、庆赐、恤孤茕、修宫室	祭祀、结婚姻、嫁娶、上官、栽种、举正直、鼓铸、乘船渡水、纳采、施恩、取鱼、招贤
2089-02-05	二零八八 戊申[猴]年	腊月小	廿五	周六	戊申 丙寅 辛巳 癸巳	猴	水瓶座	无	雨水 (2, 18)	无	无	无	平治道涂、雪冤、覃恩、恤孤茕	出行、剃头、冠带、修置产室、开渠、穿井、安碓硙、破屋坏垣、畋猎、破土、启攒、塞穴、取鱼、整容、开仓、补垣、鼓铸、修宫室、整手足甲、筑堤防
2089-02-06	二零八八 戊申[猴]年	腊月小	廿六	周日	戊申 丙寅 壬午 乙巳	猴	水瓶座	无	雨水 (2, 18)	无	无	无	祭祀、结婚姻、宴会、嫁娶、修造、上官、冠带、进人口、竖柱上梁、经络、安碓硙、牧养、雪冤、裁制、覃恩、缮城郭、招贤、举正直、纳畜、颁诏、祈福、酝酿、庆赐、施恩、纳采、临政、搬移、营建、恤孤茕、宣政事、求嗣、修宫室	修置产室、开渠、穿井、畋猎、苫盖、取鱼
2089-02-07	二零八八 戊申[猴]年	腊月小	廿七	周一	戊申 丙寅 癸未 丁巳	猴	水瓶座	无	雨水 (2, 18)	无	无	京汉铁路罢工纪念	出行、宴会、捕捉、破土、雪冤、入宅、赴任、纳采、覃恩、搬移、恤孤茕、布政事、庆赐	结婚姻、求医疗病、选将、出师、纳畜、安抚边境
2089-02-08	二零八八 戊申[猴]年	腊月小	廿八	周二	戊申 丙寅 甲申 己巳	猴	水瓶座	无	雨水 (2, 18)	无	无	无	祭祀、沐浴、求医疗病、扫舍宇、破屋坏垣、赴任、解除、诉讼	结婚姻、宴会、嫁娶、安床、修造、上官、冠带、进人口、竖柱上梁、经络、开市、纳财、修置产室、开渠、穿井、安碓硙、伐木、栽种、牧养、启攒、立券交易、缮城郭、招贤、布政事、举正直、选将、塞穴、纳畜、上册、颁诏、修饰垣墙、出师、酝酿、庆赐、开仓、鼓铸、补垣、修宫室、施恩、纳采、修仓库、临政、营建、筑堤防、宣政事、求嗣、安抚边境
2089-02-09	二零八八 戊申[猴]年	腊月小	廿九	周三	戊申 丙寅 乙酉 辛巳	猴	水瓶座	无	雨水 (2, 18)	无	华严菩萨诞	无	祭祀、沐浴、剃头、扫舍宇、雪冤、整手足甲、恤孤茕、整容	出行、结婚姻、宴会、嫁娶、安床、修造、求医疗病、上表章、上官、冠带、进人口、竖柱上梁、开市、纳财、修置产室、栽种、牧养、安葬、立券交易、缮城郭、招贤、举正直、选将、纳畜、上册、出师、祈福、安抚边境、庆赐、开仓、解除、施恩、纳采、修仓库、临政、搬移、营建、筑堤防、求嗣、修宫室
2089-02-10	二零八九 己酉[鸡]年	正月大	初一	周四	己酉 丙寅 丙戌 癸巳	鸡	水瓶座	无	雨水 (2, 18)	春节	弥勒佛圣诞	国际气象节	祭祀、出行、结婚姻、宴会、嫁娶、修造、求医疗病、上表章、上官、入学、进人口、竖柱上梁、经络、开市、纳财、安碓硙、栽种、牧养、安葬、立券交易、雪冤、裁制、覃恩、缮城郭、选将、纳畜、上册、出师、祈福、酝酿、庆赐、开仓、解除、修宫室、纳采、修仓库、临政、筑堤防、搬移、恤孤茕、营建、求嗣、安抚边境	剃头、冠带、修置产室、开渠、穿井、平治道涂、破屋坏垣、伐木、畋猎、破土、启攒、远回、布政事、塞穴、取鱼、修饰垣墙、整容、鼓铸、补垣、整手足甲
2089-02-11	二零八九 己酉[鸡]年	正月大	初二	周五	己酉 丙寅 丁亥 乙巳	鸡	水瓶座	无	雨水 (2, 18)	无	无	无	祭祀、出行、结婚姻、宴会、沐浴、修造、求医疗病、上表章、上官、进人口、竖柱上梁、经络、开市、纳财、捕捉、栽种、牧养、安葬、立券交易、雪冤、裁制、覃恩、缮城郭、招贤、举正直、选将、纳畜、上册、颁诏、出师、祈福、安抚边境、酝酿、庆赐、开仓、解除、施恩、纳采、修仓库、临政、搬移、营建、恤孤茕、宣政事、求嗣、修宫室	嫁娶、剃头、冠带、修置产室、开渠、穿井、安碓硙、破屋坏垣、畋猎、破土、启攒、布政事、塞穴、取鱼、修饰垣墙、整容、鼓铸、补垣、整手足甲、筑堤防
2089-02-12	二零八九 己酉[鸡]年	正月大	初三	周六	己酉 丙寅 戊子 丁巳	鸡	水瓶座	无	雨水 (2, 18)	无	无	无	沐浴、入学、雪冤、覃恩、恤孤茕	结婚姻、冠带、进人口、竖柱上梁、经络、伐木、畋猎、破土、安葬、启攒、布政事、塞穴、取鱼、入宅、酝酿、开仓、补垣、纳采、筑堤防、营建
2089-02-13	二零八九 己酉[鸡]年	正月大	初四	周日	己酉 丙寅 己丑 己巳	鸡	水瓶座	无	雨水 (2, 18)	无	无	无	祭祀、入宅、赴任	出行、结婚姻、宴会、嫁娶、安床、剃头、修造、求医疗病、上表章、上官、冠带、进人口、竖柱上梁、经络、开市、纳财、修置产室、开渠、穿井、安碓硙、平治道涂、破屋坏垣、栽种、牧养、破土、安葬、立券交易、疗目、针刺、裁制、缮城郭、远回、招贤、布政事、举正直、选将、塞穴、纳畜、上册、颁诏、修饰垣墙、出师、祈福、安抚边境、酝酿、庆赐、开仓、整容、鼓铸、补垣、解除、修宫室、施恩、纳采、整手足甲、修仓库、临政、搬移、营建、筑堤防、宣政事、求嗣
2089-02-14	二零八九 己酉[鸡]年	正月大	初五	周一	己酉 丙寅 庚寅 辛巳	鸡	水瓶座	无	雨水 (2, 18)	无	无	情人节	宴会、纳财、立券交易、雪冤、裁制、覃恩、举正直、纳畜、酝酿、庆赐、施恩、恤孤茕	祭祀、剃头、求医疗病、上表章、修置产室、开渠、穿井、平治道涂、破屋坏垣、伐木、捕捉、畋猎、栽种、启攒、乘船渡水、取鱼、上册、修饰垣墙、祈福、整容、开仓、补垣、解除、整手足甲、搬移、营建、筑堤防、求嗣
2089-02-15	二零八九 己酉[鸡]年	正月大	初六	周二	己酉 丙寅 辛卯 癸巳	鸡	水瓶座	无	雨水 (2, 18)	无	无	无	祭祀、出行、结婚姻、宴会、嫁娶、沐浴、剃头、修造、求医疗病、上表章、上官、竖柱上梁、扫舍宇、栽种、牧养、安葬、立券交易、雪冤、裁制、覃恩、缮城郭、招贤、举正直、选将、纳畜、上册、颁诏、出师、祈福、庆赐、整容、解除、施恩、整手足甲、纳采、修仓库、临政、搬移、营建、恤孤茕、宣政事、求嗣、安抚边境	冠带、修置产室、穿井、畋猎、修宫室、乘船渡水、取鱼、筑堤防、开仓
2089-02-16	二零八九 己酉[鸡]年	正月大	初七	周三	己酉 丙寅 壬辰 乙巳	鸡	水瓶座	无	雨水 (2, 18)	无	无	无	出行、宴会、修造、上表章、竖柱上梁、经络、牧养、安葬、雪冤、裁制、覃恩、缮城郭、纳畜、上册、颁诏、祈福、庆赐、解除、搬移、营建、恤孤茕、宣政事、求嗣、修宫室	祭祀、开渠、穿井、畋猎、乘船渡水、取鱼、鼓铸
2089-02-17	二零八九 己酉[鸡]年	正月大	初八	周四	己酉 丙寅 癸巳 丁巳	鸡	水瓶座	无	雨水 (2, 18)	无	五殿阎罗天子诞	无	平治道涂	祭祀、出行、结婚姻、宴会、嫁娶、安床、剃头、修造、求医疗病、上表章、上官、冠带、进人口、竖柱上梁、经络、开市、纳财、修置产室、开渠、穿井、安碓硙、破屋坏垣、栽种、牧养、破土、安葬、启攒、立券交易、裁制、缮城郭、招贤、布政事、举正直、选将、塞穴、纳畜、上册、颁诏、修饰垣墙、出师、祈福、安抚边境、酝酿、庆赐、开仓、鼓铸、整容、补垣、解除、修宫室、施恩、纳采、整手足甲、修仓库、临政、搬移、营建、筑堤防、宣政事、求嗣
2089-02-18	二零八九 己酉[鸡]年	正月大	初九	周五	己酉 丙寅 甲午 己巳	鸡	水瓶座	雨水	惊蛰 (3, 5)	无	玉皇上帝诞	无	祭祀、结婚姻、宴会、上官、冠带、进人口、竖柱上梁、经络、安碓硙、牧养、雪冤、赴任、裁制、诉讼、缮城郭、覃恩、招贤、举正直、纳畜、颁诏、入宅、祈福、酝酿、庆赐、纳采、施恩、修宫室、临政、搬移、营建、恤孤茕、宣政事、求嗣	修置产室、苫盖、出师
2089-02-19	二零八九 己酉[鸡]年	正月大	初十	周六	己酉 丙寅 乙未 辛巳	鸡	双鱼座	无	惊蛰 (3, 5)	无	无	邓小平逝世纪念日	捕捉、取鱼	出行、结婚姻、嫁娶、安床、修造、求医疗病、上官、冠带、进人口、竖柱上梁、开市、修置产室、栽种、牧养、安葬、启攒、立券交易、缮城郭、选将、纳畜、出师、解除、修宫室、纳采、修仓库、临政、搬移、营建、筑堤防、安抚边境
2089-02-20	二零八九 己酉[鸡]年	正月大	十一	周日	己酉 丙寅 丙申 癸巳	鸡	双鱼座	无	惊蛰 (3, 5)	无	无	无	祭祀、沐浴、求医疗病、扫舍宇、破屋坏垣、雪冤、覃恩、解除、恤孤茕	冠带、修置产室、开渠、穿井、安碓硙、伐木、畋猎、启攒、补垣、修饰垣墙、塞穴、取鱼、筑堤防、布政事、鼓铸
2089-02-21	二零八九 己酉[鸡]年	正月大	十二	周一	己酉 丙寅 丁酉 乙巳	鸡	双鱼座	无	惊蛰 (3, 5)	无	无	国际母语日	祭祀、出行、结婚姻、嫁娶、安床、沐浴、修造、求医疗病、上表章、上官、竖柱上梁、纳财、扫舍宇、栽种、牧养、安葬、雪冤、裁制、覃恩、缮城郭、招贤、选将、举正直、纳畜、上册、颁诏、出师、祈福、安抚边境、开仓、解除、施恩、纳采、整手足甲、修仓库、临政、搬移、营建、恤孤茕、宣政事、求嗣、修宫室	宴会、剃头、冠带、修置产室、畋猎、取鱼、筑堤防
2089-02-22	二零八九 己酉[鸡]年	正月大	十三	周二	己酉 丙寅 戊戌 丁巳	鸡	双鱼座	无	惊蛰 (3, 5)	无	无	无	入学	出行、结婚姻、宴会、嫁娶、安床、剃头、修造、求医疗病、上表章、上官、冠带、进人口、竖柱上梁、经络、开市、立券、纳财、修置产室、开渠、穿井、安碓硙、平治道涂、破屋坏垣、伐木、畋猎、栽种、牧养、破土、安葬、启攒、立券交易、裁制、缮城郭、远回、招贤、布政事、举正直、选将、塞穴、纳畜、上册、颁诏、修饰垣墙、出师、祈福、安抚边境、酝酿、庆赐、整容、鼓铸、开仓、补垣、宣政事、解除、修宫室、施恩、纳采、整手足甲、修仓库、临政、搬移、营建、筑堤防、求嗣、开张
2089-02-23	二零八九 己酉[鸡]年	正月大	十四	周三	己酉 丙寅 己亥 己巳	鸡	双鱼座	无	惊蛰 (3, 5)	无	无	无	祭祀、出行、结婚姻、宴会、沐浴、修造、进人口、经络、开市、纳财、捕捉、栽种、牧养、安葬、立券交易、赴任、纳畜、取鱼、入宅、祈福、酝酿、开仓、纳采、搬移	嫁娶、剃头、求医疗病、上表章、上官、冠带、竖柱上梁、修置产室、开渠、穿井、安碓硙、破屋坏垣、破土、启攒、乘船渡水、裁制、缮城郭、招贤、布政事、举正直、选将、塞穴、上册、颁诏、修饰垣墙、出师、庆赐、整容、鼓铸、补垣、解除、修宫室、施恩、整手足甲、修仓库、临政、筑堤防、营建、宣政事、求嗣、安抚边境
2089-02-24	二零八九 己酉[鸡]年	正月大	十五	周四	己酉 丙寅 庚子 辛巳	鸡	双鱼座	无	惊蛰 (3, 5)	无	元宵节	第三世界青年日	沐浴、入学、雪冤、覃恩、恤孤茕	结婚姻、冠带、进人口、竖柱上梁、经络、伐木、畋猎、安葬、布政事、塞穴、取鱼、入宅、酝酿、开仓、补垣、纳采、筑堤防、营建
2089-02-25	二零八九 己酉[鸡]年	正月大	十六	周五	己酉 丙寅 辛丑 癸巳	鸡	双鱼座	无	惊蛰 (3, 5)	无	无	无	祭祀、雪冤、覃恩、恤孤茕	出行、结婚姻、宴会、嫁娶、安床、剃头、修造、求医疗病、上表章、上官、冠带、进人口、竖柱上梁、经络、开市、纳财、修置产室、开渠、穿井、安碓硙、平治道涂、破屋坏垣、畋猎、栽种、牧养、破土、安葬、立券交易、疗目、针刺、裁制、缮城郭、远回、招贤、布政事、举正直、选将、塞穴、纳畜、取鱼、上册、颁诏、修饰垣墙、出师、祈福、安抚边境、酝酿、庆赐、开仓、整容、鼓铸、补垣、解除、施恩、纳采、整手足甲、修仓库、临政、搬移、营建、筑堤防、宣政事、求嗣、修宫室
2089-02-26	二零八九 己酉[鸡]年	正月大	十七	周六	己酉 丙寅 壬寅 乙巳	鸡	双鱼座	无	惊蛰 (3, 5)	无	无	无	宴会、经络、纳财、牧养、立券交易、雪冤、裁制、覃恩、举正直、纳畜、酝酿、庆赐、施恩、恤孤茕	祭祀、剃头、修置产室、开渠、穿井、平治道涂、破屋坏垣、伐木、捕捉、畋猎、启攒、补垣、修饰垣墙、整容、整手足甲、取鱼、开仓、筑堤防
2089-02-27	二零八九 己酉[鸡]年	正月大	十八	周日	己酉 丙寅 癸卯 丁巳	鸡	双鱼座	无	惊蛰 (3, 5)	无	无	无	出行、结婚姻、宴会、沐浴、剃头、求医疗病、上官、扫舍宇、立券交易、选将、出师、整容、解除、整手足甲、临政、安抚边境	嫁娶、安床、修造、上表章、冠带、进人口、竖柱上梁、开市、纳财、修置产室、穿井、栽种、牧养、乘船渡水、缮城郭、招贤、纳畜、取鱼、上册、祈福、开仓、纳采、修仓库、搬移、营建、筑堤防、求嗣、修宫室
2089-02-28	二零八九 己酉[鸡]年	正月大	十九	周一	己酉 丙寅 甲辰 己巳	鸡	双鱼座	无	惊蛰 (3, 5)	无	无	无	宴会、上表章、竖柱上梁、经络、赴任、裁制、诉讼、缮城郭、上册、入宅、庆赐、搬移、修宫室	祭祀、结婚姻、上官、栽种、破土、启攒、举正直、出师、乘船渡水、施恩、整手足甲、取鱼、招贤、鼓铸
