2090-05-01	2090-4-2	29	危	一	庚戌 庚辰 辛亥	无	立夏 (5, 5)	劳动节	无	无	塞穴 扫舍 馀事勿取	诸事不宜
2090-05-02	2090-4-3	29	成	二	庚戌 庚辰 壬子	无	立夏 (5, 5)	无	无	无	祭祀 祈福 求嗣 开光 解除 纳采 冠笄 出火 拆卸 进人口 安床 动土 上梁 造庙 掘井 开池 入殓 移柩 安葬 破土	无
2090-05-03	2090-4-4	29	收	三	庚戌 庚辰 癸丑	无	立夏 (5, 5)	无	无	无	解除 破屋 馀事勿取	诸事不宜
2090-05-04	2090-4-5	29	开	四	庚戌 庚辰 甲寅	无	立夏 (5, 5)	青年节	无	无	嫁娶 祈福 求嗣 开光 出行 解除 拆卸 出火 开市 立券 交易 入宅 移徙 安床 动土 破土 谢土	祭祀 入殓 安葬 探病
2090-05-05	2090-4-6	29	开	五	庚戌 辛巳 乙卯	立夏	小满 (5, 20)	无	无	无	嫁娶 祭祀 祈福 求嗣 斋醮 订盟 纳采 解除 出行 动土 破土 习艺 针灸 理发 会亲友 起基 修造 竖柱 定磉 安床 拆卸 纳畜 牧养 放水 除服 成服 修坟 立碑	开市 入宅 探病 出火 盖屋
2090-05-06	2090-4-7	29	闭	六	庚戌 辛巳 丙辰	无	小满 (5, 20)	无	无	无	馀事勿取	无
2090-05-07	2090-4-8	29	建	日	庚戌 辛巳 丁巳	无	小满 (5, 20)	无	无	无	塞穴 断蚁 结网 馀事勿取	破土 安葬
2090-05-08	2090-4-9	29	除	一	庚戌 辛巳 戊午	无	小满 (5, 20)	无	无	无	开光 出行 纳采 嫁娶 伐木 架马 出火 拆卸 移徙 入宅 造庙 造桥 造船 造畜稠 开市 入殓 除服 成服 移柩 安葬	无
2090-05-09	2090-4-10	29	满	二	庚戌 辛巳 己未	无	小满 (5, 20)	无	无	无	进人口 牧养 置产 塞穴 结网 馀事勿取	诸事不宜
2090-05-10	2090-4-11	29	平	三	庚戌 辛巳 庚申	无	小满 (5, 20)	无	无	无	开光 出行 嫁娶	会亲友 进人口 修造 动土 起基 移徙 开市 纳畜 入殓 除服 成服 移柩 破土 安葬 修坟 立碑
2090-05-11	2090-4-12	29	定	四	庚戌 辛巳 辛酉	无	小满 (5, 20)	无	无	无	嫁娶 纳采 出行 祭祀 祈福 开市 动土 移徙 入宅 破土 安葬	安门
2090-05-12	2090-4-13	29	执	五	庚戌 辛巳 壬戌	无	小满 (5, 20)	无	无	无	嫁娶 纳采 求医 治病 修造 动土 移徙 入宅 破土 安葬	开市 开光
2090-05-13	2090-4-14	29	破	六	庚戌 辛巳 癸亥	无	小满 (5, 20)	无	无	无	祭祀 破屋 坏垣 馀事勿取	诸事不宜
2090-05-14	2090-4-15	29	危	日	庚戌 辛巳 甲子	无	小满 (5, 20)	母亲节	无	无	嫁娶 纳采 祭祀 祈福 出行 动土 上梁 移徙 入宅 破土 安葬	斋醮
2090-05-15	2090-4-16	29	成	一	庚戌 辛巳 乙丑	无	小满 (5, 20)	无	无	无	纳采 祭祀 祈福 开市 求医 治病 动土 纳畜	嫁娶 安葬
2090-05-16	2090-4-17	29	收	二	庚戌 辛巳 丙寅	无	小满 (5, 20)	无	无	无	嫁娶 纳采 出行 移徙 入宅	动土 破土 安葬
2090-05-17	2090-4-18	29	开	三	庚戌 辛巳 丁卯	无	小满 (5, 20)	无	无	无	订盟 纳采 祭祀 动土 破土 交易 立券	嫁娶 安葬
2090-05-18	2090-4-19	29	闭	四	庚戌 辛巳 戊辰	无	小满 (5, 20)	无	无	无	嫁娶 裁衣 祭祀 出行 安床 作灶 移徙 入宅 破土 安葬	赴任 捕捉
2090-05-19	2090-4-20	29	建	五	庚戌 辛巳 己巳	无	小满 (5, 20)	无	无	无	塞穴 结网 馀事勿取	诸事不宜
2090-05-20	2090-4-21	29	除	六	庚戌 辛巳 庚午	小满	芒种 (6, 5)	无	无	无	嫁娶 订盟 纳采 出行 祭祀 祈福 斋醮 动土 上梁 破土 安葬	移徙 入宅
2090-05-21	2090-4-22	29	满	日	庚戌 辛巳 辛未	无	芒种 (6, 5)	全国助残日	无	无	订盟 纳采 会亲友 安床 作灶 造畜稠	开市 安葬
2090-05-22	2090-4-23	29	平	一	庚戌 辛巳 壬申	无	芒种 (6, 5)	无	无	无	沐浴 平治道涂 扫舍 入殓 移柩 破土 启钻 安葬 馀事勿取	诸事不宜
2090-05-23	2090-4-24	29	定	二	庚戌 辛巳 癸酉	无	芒种 (6, 5)	无	无	无	嫁娶 祭祀 祈福 求嗣 开光 出行 出火 拆卸 动土 上梁 进人口 入宅 移徙 安床 安门 开市 交易 立券 挂匾 栽种 破土 安葬	无
2090-05-24	2090-4-25	29	执	三	庚戌 辛巳 甲戌	无	芒种 (6, 5)	无	无	无	祭祀 开光 出行 解除 塑绘 裁衣 入殓 移柩 破土 启钻 安葬 除服 成服	嫁娶 上梁 修造 拆卸 架马 入宅 伐木 动土 出火 开柱眼
2090-05-25	2090-4-26	29	破	四	庚戌 辛巳 乙亥	无	芒种 (6, 5)	无	无	无	祭祀 解除 破屋 坏垣 馀事勿取	诸事不宜
2090-05-26	2090-4-27	29	危	五	庚戌 辛巳 丙子	无	芒种 (6, 5)	无	无	无	嫁娶 祭祀 祈福 求嗣 开光 出行 拆卸 动土 上梁 出火 进人口 入宅 移徙 安床 栽种 纳畜 牧养 竖柱 安门 修造 解除 会亲友	无
2090-05-27	2090-4-28	29	成	六	庚戌 辛巳 丁丑	无	芒种 (6, 5)	无	无	无	开市 交易 立券 祭祀 祈福 开光 伐木 进人口 安床 拆卸 修造 动土 栽种 破土 移柩 安葬	入宅 移徙 理发 出火 嫁娶 出行
2090-05-28	2090-4-29	29	收	日	庚戌 辛巳 戊寅	无	芒种 (6, 5)	无	无	无	结网 解除 馀事勿取	诸事不宜
2090-05-29	2090-5-1	30	开	一	庚戌 辛巳 己卯	无	芒种 (6, 5)	无	无	无	嫁娶 祭祀 祈福 求嗣 开光 开市 交易 立券 安床 出行 拆卸	纳畜 入宅 移徙 安葬 探病 伐木 上梁 安门 入殓 动土
2090-05-30	2090-5-2	30	闭	二	庚戌 辛巳 庚辰	无	芒种 (6, 5)	无	无	无	嫁娶 祭祀 祈福 求嗣 出行 出火 拆卸 修造 动土 入宅 移徙 安床 作灶 塞穴 栽种 破土 安葬	开光 掘井 开仓
2090-05-31	2090-5-3	30	建	三	庚戌 辛巳 辛巳	无	芒种 (6, 5)	无	无	无	解除 扫舍 馀事勿取	诸事不宜
