2090-07-01	2090-6-4	29	破	六	庚戌 壬午 壬子	无	小暑 (7, 6)	建党节	无	无	坏垣 破屋 馀事勿取	诸事不宜
2090-07-02	2090-6-5	29	危	日	庚戌 壬午 癸丑	无	小暑 (7, 6)	无	无	无	交易 修造 动土 安床 开厕 开市 开池 放水 破土 祭祀 立券 纳财 经络 结网	作灶 嫁娶 安门 栽种 移徙 词讼 造桥
2090-07-03	2090-6-6	29	成	一	庚戌 壬午 甲寅	无	小暑 (7, 6)	无	无	无	上梁 交易 修造 入殓 动土 安床 安葬 开市 成服 拆卸 栽种 破土 立券 纳财 除服	伐木 入宅 出火 嫁娶 探病 祭祀 移徙 纳畜
2090-07-04	2090-6-7	29	收	二	庚戌 壬午 乙卯	无	小暑 (7, 6)	无	无	无	作灶 祭祀 馀事勿取	诸事不宜
2090-07-05	2090-6-8	29	开	三	庚戌 壬午 丙辰	无	小暑 (7, 6)	无	无	无	坏垣 解除 馀事勿取	诸事不宜
2090-07-06	2090-6-9	29	开	四	庚戌 癸未 丁巳	小暑	大暑 (7, 22)	无	无	无	会亲友 塑绘 嫁娶 安碓磑 开光 开渠 掘井 放水 求医 治病 牧养 祭祀 纳畜	作灶 入学 入宅 安葬 盖屋 行丧
2090-07-07	2090-6-10	29	闭	五	庚戌 癸未 戊午	无	大暑 (7, 22)	无	无	无	塞穴 畋猎 祭祀 结网 馀事勿取	入宅 嫁娶 安门 开光 开市 移徙
2090-07-08	2090-6-11	29	建	六	庚戌 癸未 己未	无	大暑 (7, 22)	无	无	无	会亲友 冠笄 塑绘 安机械 开仓 开市 教牛马 牧养 祭祀 纳畜 纳财 经络 裁衣 造畜稠	动土 安葬 治病 破土
2090-07-09	2090-6-12	29	除	日	庚戌 癸未 庚申	无	大暑 (7, 22)	无	无	无	会亲友 入宅 嫁娶 安香 斋醮 治病 盖屋 祈福 祭祀 移徙 起基	出行 安床 开市 经络
2090-07-10	2090-6-13	29	满	一	庚戌 癸未 辛酉	无	大暑 (7, 22)	无	无	无	交易 入殓 冠笄 出行 启钻 塑绘 嫁娶 安葬 开生坟 成服 牧养 移柩 立券 纳婿 裁衣 进人口 造畜稠 除服	无
2090-07-11	2090-6-14	29	平	二	庚戌 癸未 壬戌	无	大暑 (7, 22)	无	无	无	冠笄 取渔 嫁娶 捕捉 畋猎 祭祀 结网 馀事勿取	无
2090-07-12	2090-6-15	29	定	三	庚戌 癸未 癸亥	无	大暑 (7, 22)	无	无	无	扫舍 沐浴 馀事勿取	诸事不宜
2090-07-13	2090-6-16	29	执	四	庚戌 癸未 甲子	无	大暑 (7, 22)	无	无	无	动土 安葬 破土 祈福 祭祀 纳采 解除	入宅 嫁娶 移徙
2090-07-14	2090-6-17	29	破	五	庚戌 癸未 乙丑	无	大暑 (7, 22)	无	无	无	坏垣 破屋 祭祀 馀事勿取	诸事不宜
2090-07-15	2090-6-18	29	危	六	庚戌 癸未 丙寅	无	大暑 (7, 22)	无	无	无	上梁 入宅 出行 动土 嫁娶 安葬 开市 破土 移徙 纳采	祈福 祭祀
2090-07-16	2090-6-19	29	成	日	庚戌 癸未 丁卯	无	大暑 (7, 22)	无	无	无	上梁 入宅 出行 动土 嫁娶 安葬 开市 破土 移徙 纳采	赴任
2090-07-17	2090-6-20	29	收	一	庚戌 癸未 戊辰	无	大暑 (7, 22)	无	无	无	作灶 捕捉 祭祀 纳财	开市 破土
2090-07-18	2090-6-21	29	开	二	庚戌 癸未 己巳	无	大暑 (7, 22)	无	无	无	入宅 动土 嫁娶 开市 祈福 祭祀 移徙 立券	安葬 造庙
2090-07-19	2090-6-22	29	闭	三	庚戌 癸未 庚午	无	大暑 (7, 22)	无	无	无	入殓 启钻 塞穴 安葬 成服 移柩 结网 补垣 除服 馀事勿取	诸事不宜
2090-07-20	2090-6-23	29	建	四	庚戌 癸未 辛未	无	大暑 (7, 22)	无	无	无	入宅 出行 嫁娶 祈福 祭祀 移徙 纳采 解除	动土 安葬
2090-07-21	2090-6-24	29	除	五	庚戌 癸未 壬申	无	大暑 (7, 22)	无	无	无	嫁娶 安葬 斋醮 治病 破土 祈福 祭祀	入宅 开市
2090-07-22	2090-6-25	29	满	六	庚戌 癸未 癸酉	大暑	立秋 (8, 7)	无	无	无	入殓 出行 启钻 嫁娶 安床 安葬 开市	动土 破土 祈福
2090-07-23	2090-6-26	29	平	日	庚戌 癸未 甲戌	无	立秋 (8, 7)	无	无	无	冠笄 嫁娶 沐浴 祭祀 结网 裁衣	出货财 动土 安葬 开仓 掘井 栽种 破土 置产
2090-07-24	2090-6-27	29	定	一	庚戌 癸未 乙亥	无	立秋 (8, 7)	无	无	无	交易 修造 入宅 出火 动土 安床 开光 开市 拆卸 求嗣 祈福 移徙 立券 进人口	修坟 嫁娶 安葬 栽种 破土 置产 行丧
2090-07-25	2090-6-28	29	执	二	庚戌 癸未 丙子	无	立秋 (8, 7)	无	无	无	入殓 启钻 安葬 整手足甲 沐浴 破土 祭祀 移柩 解除	交易 作灶 入宅 嫁娶 安门 开市 栽种 移徙
2090-07-26	2090-6-29	29	破	三	庚戌 癸未 丁丑	无	立秋 (8, 7)	无	无	无	坏垣 破屋 馀事勿取	诸事不宜
2090-07-27	2090-7-1	29	危	四	庚戌 癸未 戊寅	无	立秋 (8, 7)	无	无	无	交易 作梁 修造 入宅 出火 出行 动土 嫁娶 安床 开光 开市 拆卸 挂匾 栽种 理发 移徙 立券	伐木 祭祀 纳畜
2090-07-28	2090-7-2	29	成	五	庚戌 癸未 己卯	无	立秋 (8, 7)	无	无	无	交易 修造 入宅 入殓 出行 动土 嫁娶 安床 安葬 开光 开市 拆卸 挂匾 栽种 求嗣 祈福 移徙 移柩 立券 纳畜 解除 进人口	无
2090-07-29	2090-7-3	29	收	六	庚戌 癸未 庚辰	无	立秋 (8, 7)	无	无	无	作灶 栽种 祭祀 纳畜 纳财 进人口	修坟 启钻 安床 安葬 开市 破土 立碑 经络
2090-07-30	2090-7-4	29	开	日	庚戌 癸未 辛巳	无	立秋 (8, 7)	无	无	无	开光 开市 求嗣 牧养 理发 祈福 祭祀	上梁 作灶 入宅 入殓 冠笄 出行 嫁娶 安葬
2090-07-31	2090-7-5	29	闭	一	庚戌 癸未 壬午	无	立秋 (8, 7)	无	无	无	入殓 启钻 安葬 成服 破土 祭祀 移柩 谢土 除服 馀事勿取	无
