2091-06-01	2091-4-15	30	破	五	辛亥 癸巳 丁亥	无	芒种 (6, 5)	儿童节	无	无	破屋 坏垣 沐浴 解除 馀事勿取	诸事不宜
2091-06-02	2091-4-16	30	危	六	辛亥 癸巳 戊子	无	芒种 (6, 5)	无	无	无	纳采 订盟 嫁娶 造车器 祭祀 祈福 求嗣 开光 出火 拆卸 修造 动土 进人口 挂匾 入宅 移徙 安床 栽种 入殓 破土 安葬 除服 成服	开市 立券
2091-06-03	2091-4-17	30	成	日	辛亥 癸巳 己丑	无	芒种 (6, 5)	无	无	无	开市 交易 立券 祭祀 祈福 开光 动土 安床 出行 栽种 纳畜 牧养 竖柱 上梁 解除 破土	嫁娶 掘井 入宅 移徙 安葬
2091-06-04	2091-4-18	30	收	一	辛亥 癸巳 庚寅	无	芒种 (6, 5)	无	无	无	解除 出行 纳采 冠笄 竖柱 上梁 移徙 作灶 进人口 入宅 纳畜 牧养	祭祀 伐木 架马 安床 修造 动土 安葬 修坟 破土
2091-06-05	2091-4-19	30	收	二	辛亥 甲午 辛卯	芒种	夏至 (6, 21)	无	无	无	祭祀 捕捉 取渔 修饰垣墙 馀事勿取	诸事不宜
2091-06-06	2091-4-20	30	开	三	辛亥 甲午 壬辰	无	夏至 (6, 21)	无	无	无	嫁娶 纳采 祭祀 祈福 求医 治病 出行 动土 移徙 入宅	开市 安门
2091-06-07	2091-4-21	30	闭	四	辛亥 甲午 癸巳	无	夏至 (6, 21)	无	无	无	裁衣 作灶 移徙 入宅 纳畜	嫁娶 安葬
2091-06-08	2091-4-22	30	建	五	辛亥 甲午 甲午	无	夏至 (6, 21)	无	无	无	祭祀 入殓 移柩 启钻 安葬	上梁 动土 破土
2091-06-09	2091-4-23	30	除	六	辛亥 甲午 乙未	无	夏至 (6, 21)	无	无	无	订盟 纳采 出行 祈福 斋醮 安床 会亲友	移徙 入宅 安葬
2091-06-10	2091-4-24	30	满	日	辛亥 甲午 丙申	无	夏至 (6, 21)	无	无	无	嫁娶 纳采 出行 求医 治病 开市 移徙 入宅 启钻 安葬	动土 破土
2091-06-11	2091-4-25	30	平	一	辛亥 甲午 丁酉	无	夏至 (6, 21)	无	无	无	嫁娶 祭祀 沐浴 扫舍 修饰垣墙	行丧 安葬
2091-06-12	2091-4-26	30	定	二	辛亥 甲午 戊戌	无	夏至 (6, 21)	无	无	无	嫁娶 订盟 纳采 出行 开市 祭祀 祈福 动土 移徙 入宅 破土 安葬	作灶
2091-06-13	2091-4-27	30	执	三	辛亥 甲午 己亥	无	夏至 (6, 21)	无	无	无	订盟 纳采 出行 祭祀 祈福 修造 动土 移徙 入宅	开市 安葬
2091-06-14	2091-4-28	30	破	四	辛亥 甲午 庚子	无	夏至 (6, 21)	无	无	无	诸事不宜	无
2091-06-15	2091-4-29	30	危	五	辛亥 甲午 辛丑	无	夏至 (6, 21)	无	无	无	嫁娶 订盟 纳采 祭祀 祈福 入殓 破土 安葬	开光 开市
2091-06-16	2091-4-30	30	成	六	辛亥 甲午 壬寅	无	夏至 (6, 21)	无	无	无	开光 求医 治病 动土 上梁 入殓 破土 安葬	嫁娶
2091-06-17	2091-5-1	29	收	日	辛亥 甲午 癸卯	无	夏至 (6, 21)	父亲节	无	无	祭祀 栽种 馀事勿取	诸事不宜
2091-06-18	2091-5-2	29	开	一	辛亥 甲午 甲辰	无	夏至 (6, 21)	无	无	无	嫁娶 开光 祭祀 祈福 求嗣 出行 解除 伐木 入宅 移徙 安床 出火 拆卸 修造 上梁 栽种 移柩	安葬 开市 交易 立券
2091-06-19	2091-5-3	29	闭	二	辛亥 甲午 乙巳	无	夏至 (6, 21)	无	无	无	求嗣 嫁娶 纳采 合帐 裁衣 冠笄 伐木 作梁 修造 动土 起基 竖柱 上梁 安门 作灶 筑堤 造畜稠	安葬 出行 祈福 栽种
2091-06-20	2091-5-4	29	建	三	辛亥 甲午 丙午	无	夏至 (6, 21)	无	无	无	祭祀 解除 馀事勿取	诸事不宜
2091-06-21	2091-5-5	29	除	四	辛亥 甲午 丁未	夏至	小暑 (7, 7)	无	无	无	嫁娶 祭祀 祈福 出火 开光 求嗣 出行 拆卸 开市 交易 立券 挂匾 入宅 移徙 安床 栽种 动土	安葬 行丧 伐木 作梁
2091-06-22	2091-5-6	29	满	五	辛亥 甲午 戊申	无	小暑 (7, 7)	无	无	无	开光 求嗣 出行 解除 伐木 出火 拆卸 修造 上梁 起基 入宅 移徙 开市 交易 立券 栽种 牧养 入殓 安葬 除服 成服	置产 安床
2091-06-23	2091-5-7	29	平	六	辛亥 甲午 己酉	无	小暑 (7, 7)	无	无	无	祭祀 理发 修饰垣墙 平治道涂 沐浴 整手足甲 扫舍	出行 安门 修造 嫁娶 上梁 入宅
2091-06-24	2091-5-8	29	定	日	辛亥 甲午 庚戌	无	小暑 (7, 7)	无	无	无	嫁娶 祭祀 开光 祈福 求嗣 出行 出火 拆卸 动土 修造 进人口 入宅 移徙 安床 挂匾 交易 立券 栽种 纳畜 入殓 破土 启钻 安葬	无
2091-06-25	2091-5-9	29	执	一	辛亥 甲午 辛亥	无	小暑 (7, 7)	无	无	无	祭祀 祈福 求嗣 开光 出行 伐木 出火 拆卸 修造 动土 起基 安床 入宅 移徙	嫁娶 开市 交易 行丧 安葬 修坟
2091-06-26	2091-5-10	29	破	二	辛亥 甲午 壬子	无	小暑 (7, 7)	无	无	无	破屋 坏垣 馀事勿取	诸事不宜
2091-06-27	2091-5-11	29	危	三	辛亥 甲午 癸丑	无	小暑 (7, 7)	无	无	无	开市 交易 立券 纳财 开池 开厕 结网 祭祀 修造 动土 安床 放水 经络 破土	嫁娶 造桥 词讼 移徙 安门 作灶 栽种
2091-06-28	2091-5-12	29	成	四	辛亥 甲午 甲寅	无	小暑 (7, 7)	无	无	无	开市 交易 立券 纳财 栽种 安床 拆卸 修造 动土 上梁 入殓 安葬 破土 除服 成服	嫁娶 出火 伐木 祭祀 入宅 移徙 纳畜 探病
2091-06-29	2091-5-13	29	收	五	辛亥 甲午 乙卯	无	小暑 (7, 7)	无	无	无	祭祀 作灶 馀事勿取	诸事不宜
2091-06-30	2091-5-14	29	开	六	辛亥 甲午 丙辰	无	小暑 (7, 7)	无	无	无	解除 坏垣 馀事勿取	诸事不宜
