2091-04-01	2091-2-13	30	危	日	辛亥 辛卯 丙戌	无	清明 (4, 4)	愚人节	无	无	嫁娶 祭祀 出行 冠笄 立券 交易 进人口 开市 移徙 修造 动土 安床 入殓 移柩 破土	开光 作灶 斋醮 安葬
2091-04-02	2091-2-14	30	成	一	辛亥 辛卯 丁亥	无	清明 (4, 4)	无	无	无	开市 立券 交易 挂匾 祭祀 祈福 开光 入宅 移徙 安床 拆卸 动土 上梁 进人口	嫁娶 行丧 架马 作梁 理发 牧养 安葬 纳畜 伐木
2091-04-03	2091-2-15	30	收	二	辛亥 辛卯 戊子	无	清明 (4, 4)	无	无	无	理发 冠笄 嫁娶 进人口	置产 伐木 纳畜 造畜稠 安葬 破土 作梁 作灶 开生坟
2091-04-04	2091-2-16	30	收	三	辛亥 壬辰 己丑	清明	谷雨 (4, 20)	无	无	无	祭祀 馀事勿取	造庙 嫁娶 安床
2091-04-05	2091-2-17	30	开	四	辛亥 壬辰 庚寅	无	谷雨 (4, 20)	无	无	无	订盟 纳采 嫁娶 进人口 会亲友 交易 立券 动土 除服 谢土 移柩 破土 启钻 赴任 出行 开市 纳财 栽种	入殓 安葬 入宅 安床
2091-04-06	2091-2-18	30	闭	五	辛亥 壬辰 辛卯	无	谷雨 (4, 20)	无	无	无	祭祀 祈福 裁衣 合帐 安床 入殓 除服 成服 移柩 破土 启钻 安葬 谢土 立碑 造畜稠	掘井 安门 嫁娶 纳采
2091-04-07	2091-2-19	30	建	六	辛亥 壬辰 壬辰	无	谷雨 (4, 20)	无	无	无	祭祀 进人口 嫁娶 安床 解除 冠笄 出行 裁衣 扫舍	掘井 动土 破土 安葬 开光
2091-04-08	2091-2-20	30	除	日	辛亥 壬辰 癸巳	无	谷雨 (4, 20)	无	无	无	纳采 开光 求医 治病 动土 上梁 移徙 入宅	嫁娶 开市 安葬
2091-04-09	2091-2-21	30	满	一	辛亥 壬辰 甲午	无	谷雨 (4, 20)	无	无	无	祭祀 会亲友 开市 安床 启钻 安葬	嫁娶 动土 破土
2091-04-10	2091-2-22	30	平	二	辛亥 壬辰 乙未	无	谷雨 (4, 20)	无	无	无	祭祀 作灶 掘井 平治道涂	嫁娶 安葬
2091-04-11	2091-2-23	30	定	三	辛亥 壬辰 丙申	无	谷雨 (4, 20)	无	无	无	祭祀 斋醮 开市 动土 入殓 破土 安葬	嫁娶 移徙 入宅
2091-04-12	2091-2-24	30	执	四	辛亥 壬辰 丁酉	无	谷雨 (4, 20)	无	无	无	嫁娶 纳采 祭祀 祈福 出行 移徙 求医	开市 动土 破土
2091-04-13	2091-2-25	30	破	五	辛亥 壬辰 戊戌	无	谷雨 (4, 20)	无	无	无	祭祀 求医 治病 解除 馀事勿取	诸事不宜
2091-04-14	2091-2-26	30	危	六	辛亥 壬辰 己亥	无	谷雨 (4, 20)	无	无	无	沐浴 结网 取渔	嫁娶 入宅 安葬
2091-04-15	2091-2-27	30	成	日	辛亥 壬辰 庚子	无	谷雨 (4, 20)	无	无	无	无	诸事不宜
2091-04-16	2091-2-28	30	收	一	辛亥 壬辰 辛丑	无	谷雨 (4, 20)	无	无	无	解除 坏垣 馀事勿取	诸事不宜
2091-04-17	2091-2-29	30	开	二	辛亥 壬辰 壬寅	无	谷雨 (4, 20)	无	无	无	嫁娶 开光 出行 出火 拆卸 进人口 开市 立券 交易 挂匾 入宅 移徙 安床 栽种	祈福 入殓 祭祀 作灶 安葬 探病
2091-04-18	2091-2-30	30	闭	三	辛亥 壬辰 癸卯	无	谷雨 (4, 20)	无	无	无	嫁娶 出行 合帐 冠笄 安床 除服 成服 作灶 交易 立券 入殓 移柩 破土 安葬	词讼 开光 开市
2091-04-19	2091-3-1	29	建	四	辛亥 壬辰 甲辰	无	谷雨 (4, 20)	无	无	无	出行 修饰垣墙 造畜稠 教牛马 馀事勿取	诸事不宜
2091-04-20	2091-3-2	29	除	五	辛亥 壬辰 乙巳	谷雨	立夏 (5, 5)	无	无	无	祭祀 祈福 开光 求嗣 解除 伐木 出火 入宅 移徙 安床 拆卸 修造 动土 造畜稠	嫁娶 纳财 安葬 出行 开市 立券 作灶 栽种
2091-04-21	2091-3-3	29	满	六	辛亥 壬辰 丙午	无	立夏 (5, 5)	无	无	无	纳采 嫁娶 开光 出行 理发 会亲友 开市 安床 栽种 牧养 入殓 移柩 启钻	谢土 祈福 上梁 作灶 斋醮 修造 入宅 安门
2091-04-22	2091-3-4	29	平	日	辛亥 壬辰 丁未	无	立夏 (5, 5)	无	无	无	祭祀 平治道涂 解除 修饰垣墙 馀事勿取	诸事不宜
2091-04-23	2091-3-5	29	定	一	辛亥 壬辰 戊申	无	立夏 (5, 5)	无	无	无	祭祀 祈福 开光 解除 动土 纳财 交易 纳畜 扫舍	进人口 出行 嫁娶 置产 安床 赴任 安葬 作灶
2091-04-24	2091-3-6	29	执	二	辛亥 壬辰 己酉	无	立夏 (5, 5)	无	无	无	祭祀 祈福 求嗣 开光 解除 出火 拆卸 入宅 安床 修造 安门 纳畜 启钻 安葬	动土 破土 纳财 掘井 挂匾 开市 伐木 交易
2091-04-25	2091-3-7	29	破	三	辛亥 壬辰 庚戌	无	立夏 (5, 5)	无	无	无	祭祀 解除 破屋 坏垣 馀事勿取	诸事不宜
2091-04-26	2091-3-8	29	危	四	辛亥 壬辰 辛亥	无	立夏 (5, 5)	无	无	无	塞穴 扫舍 馀事勿取	诸事不宜
2091-04-27	2091-3-9	29	成	五	辛亥 壬辰 壬子	无	立夏 (5, 5)	无	无	无	祭祀 祈福 求嗣 开光 解除 纳采 冠笄 出火 拆卸 进人口 安床 动土 上梁 造庙 掘井 开池 入殓 移柩 安葬 破土	无
2091-04-28	2091-3-10	29	收	六	辛亥 壬辰 癸丑	无	立夏 (5, 5)	无	无	无	解除 破屋 馀事勿取	诸事不宜
2091-04-29	2091-3-11	29	开	日	辛亥 壬辰 甲寅	无	立夏 (5, 5)	无	无	无	嫁娶 祈福 求嗣 开光 出行 解除 拆卸 出火 开市 立券 交易 入宅 移徙 安床 动土 破土 谢土	祭祀 入殓 安葬 探病
2091-04-30	2091-3-12	29	闭	一	辛亥 壬辰 乙卯	无	立夏 (5, 5)	无	无	无	祭祀 裁衣 冠笄 安床 交易 立券 开池 补垣 塞穴 入殓 破土 启钻 安葬 谢土 除服 成服	嫁娶 掘井 探病 开市 开光 栽种
