2094-12-01	2094-10-24	30	危	三	甲寅 乙亥 丙午	无	大雪 (12, 6)	无	无	无	祭祀 扫舍 破土 安葬 除服 成服 启钻 移柩 入殓 立碑 馀事勿取	嫁娶 入宅 修造 动土
2094-12-02	2094-10-25	30	成	四	甲寅 乙亥 丁未	无	大雪 (12, 6)	无	无	无	订盟 纳采 会亲友 祭祀 祈福 修造 动土 安机械 破土 安葬	嫁娶 移徙 出火 开市 入宅
2094-12-03	2094-10-26	30	收	五	甲寅 乙亥 戊申	无	大雪 (12, 6)	无	无	无	祭祀 沐浴 捕捉 畋猎 结网 扫舍	嫁娶 纳采 订盟 安床 动土 破土 安葬
2094-12-04	2094-10-27	30	开	六	甲寅 乙亥 己酉	无	大雪 (12, 6)	无	无	无	开市 纳财 出行 祭祀 祈福 求嗣 斋醮 问名 入学 起基 定磉 置产 开渠 掘井 拆卸 栽种 纳畜 牧养 动土 破土 启钻	移徙 入宅 出火 入殓 安葬
2094-12-05	2094-10-28	30	闭	日	甲寅 乙亥 庚戌	无	大雪 (12, 6)	无	无	无	祭祀 理发 置产 塞穴 除服 成服 移柩 入殓 破土 安葬	嫁娶 入宅 安床 掘井 开光
2094-12-06	2094-10-29	30	闭	一	甲寅 丙子 辛亥	大雪	冬至 (12, 21)	无	无	无	作梁 修造 动土 安门 作灶 塞穴 开池 开厕 筑堤 补垣 栽种	嫁娶 祈福 掘井 行丧 安葬 安床
2094-12-07	2094-10-30	30	建	二	甲寅 丙子 壬子	无	冬至 (12, 21)	无	无	无	安葬 启钻 移柩 入殓 除服 成服	馀事勿取
2094-12-08	2094-11-1	29	除	三	甲寅 丙子 癸丑	无	冬至 (12, 21)	无	无	无	嫁娶 祭祀 祈福 求嗣 出行 出火 拆卸 开市 交易 立券 挂匾 入宅 移徙 安床 栽种	作灶 塑绘 行丧 词讼 伐木 安葬
2094-12-09	2094-11-2	29	满	四	甲寅 丙子 甲寅	无	冬至 (12, 21)	无	无	无	理发 开光 解除 拆卸 修造 安葬 开市 交易 立券 挂匾 安床 栽种	入宅 移徙 作灶 祈福 祭祀 嫁娶 谢土 掘井 盖屋 探病
2094-12-10	2094-11-3	29	平	五	甲寅 丙子 乙卯	无	冬至 (12, 21)	无	无	无	祭祀 修饰垣墙 馀事勿取	诸事不宜
2094-12-11	2094-11-4	29	定	六	甲寅 丙子 丙辰	无	冬至 (12, 21)	无	无	无	入宅 安床 开光 祭祀 出火 拆卸 动土 挂匾 入殓 破土 安葬 纳畜	嫁娶 开市 作灶 置产 作梁 伐木
2094-12-12	2094-11-5	29	执	日	甲寅 丙子 丁巳	无	冬至 (12, 21)	无	无	无	祭祀 解除 馀事勿取	诸事不宜
2094-12-13	2094-11-6	29	破	一	甲寅 丙子 戊午	无	冬至 (12, 21)	无	无	无	破屋 坏垣 祭祀 沐浴 馀事勿取	诸事不宜
2094-12-14	2094-11-7	29	危	二	甲寅 丙子 己未	无	冬至 (12, 21)	无	无	无	安床 祭祀 祈福 求嗣 冠笄 伐木 架马 动土 开池 开厕 结网 入殓 除服 成服	安门 栽种 作灶 治病
2094-12-15	2094-11-8	29	成	三	甲寅 丙子 庚申	无	冬至 (12, 21)	无	无	无	解除 扫舍 馀事勿取	诸事不宜
2094-12-16	2094-11-9	29	收	四	甲寅 丙子 辛酉	无	冬至 (12, 21)	无	无	无	祭祀 开光 理发 整手足甲 安床 作灶 扫舍 教牛马	伐木 纳畜 破土 安葬 开生坟 嫁娶 开市 动土 交易 作梁
2094-12-17	2094-11-10	29	开	五	甲寅 丙子 壬戌	无	冬至 (12, 21)	无	无	无	祭祀 祈福 求嗣 开光 拆卸 修造 动土 上梁 安床 置产 栽种 破土	嫁娶 进人口 安葬 出行 赴任 入宅 移徙 入殓 开渠
2094-12-18	2094-11-11	29	闭	六	甲寅 丙子 癸亥	无	冬至 (12, 21)	无	无	无	沐浴 冠笄 补垣 塞穴 裁衣 修造 作梁 开柱眼 安碓磑 筑堤 开厕 断蚁	移徙 入宅 嫁娶 祈福 开光 掘井
2094-12-19	2094-11-12	29	建	日	甲寅 丙子 甲子	无	冬至 (12, 21)	无	无	无	交易 进人口 祭祀 沐浴 捕捉 入殓 除服 成服 安葬 谢土 启钻 修坟	斋醮 入宅 修造 动土 破土
2094-12-20	2094-11-13	29	除	一	甲寅 丙子 乙丑	无	冬至 (12, 21)	无	无	无	嫁娶 纳采 订盟 造车器 祭祀 祈福 造庙 安香 出火 出行 归宁 入学 入宅 交易 立券 求医 治病 修造 动土 竖柱 上梁 盖屋 起基 安门	斋醮 伐木 作梁 安葬 行丧
2094-12-21	2094-11-14	29	满	二	甲寅 丙子 丙寅	冬至	小寒 (1, 5)	无	无	无	纳采 订盟 开市 交易 立券 出行 会亲友 安机械 竖柱 上梁 平治道涂 伐木 拆卸 盖屋 起基 安床 安门 解除 安葬 启钻 除服 成服 修坟 立碑 移柩 入殓	嫁娶 动土 破土 祈福 出火 入宅
2094-12-22	2094-11-15	29	平	三	甲寅 丙子 丁卯	无	小寒 (1, 5)	无	无	无	祭祀 平治道涂 除服 成服 安葬 馀事勿取	嫁娶 入宅 纳采 订盟 掘井
2094-12-23	2094-11-16	29	定	四	甲寅 丙子 戊辰	无	小寒 (1, 5)	无	无	无	纳采 订盟 祭祀 祈福 开光 安香 出火 出行 会亲友 安机械 修造 动土 竖柱 上梁 盖屋 起基 定磉 安床 安门 拆卸 移徙 造桥 造船 安葬 破土 入殓	开市 造庙 置产 掘井
2094-12-24	2094-11-17	29	执	五	甲寅 丙子 己巳	无	小寒 (1, 5)	平安夜	无	无	嫁娶 冠笄 祭祀 祈福 求嗣 斋醮 进人口 会亲友 伐木 作梁 开柱眼 安床 掘井 捕捉 畋猎	开生坟 破土 行丧 安葬
2094-12-25	2094-11-18	29	破	六	甲寅 丙子 庚午	无	小寒 (1, 5)	圣诞节	无	无	破屋 坏垣 治病 馀事勿取	移徙 入宅
2094-12-26	2094-11-19	29	危	日	甲寅 丙子 辛未	无	小寒 (1, 5)	无	无	无	安床 架马 祭祀 塑绘 开光 出行 理发 伐木 作梁 开柱眼 开厕 畋猎 破土 入殓 除服 成服 移柩 启钻 修坟 立碑	作灶 安门 造桥 开市 安葬
2094-12-27	2094-11-20	29	成	一	甲寅 丙子 壬申	无	小寒 (1, 5)	无	无	无	嫁娶 祭祀 祈福 求嗣 开光 出行 解除 入宅 移徙 纳畜 入殓 破土 修坟 立碑	伐木 作梁 动土 安床 栽种 造桥
2094-12-28	2094-11-21	29	收	二	甲寅 丙子 癸酉	无	小寒 (1, 5)	无	无	无	祭祀 沐浴 理发 纳财 进人口 栽种 扫舍 捕捉 畋猎 结网	会亲友 安葬 入宅 移徙 安床 开市 行丧 出火 作灶 安门
2094-12-29	2094-11-22	29	开	三	甲寅 丙子 甲戌	无	小寒 (1, 5)	无	无	无	纳采 订盟 祭祀 祈福 求嗣 塑绘 解除 拆卸 修造 动土 竖柱 上梁 安门 置产 开池 掘井 纳畜 安床 栽种 造畜稠 破土 移柩 立碑	嫁娶 开市 出火 进人口 入殓 赴任 入宅 移徙 出行 安葬
2094-12-30	2094-11-23	29	闭	四	甲寅 丙子 乙亥	无	小寒 (1, 5)	无	无	无	入宅 移徙 出行 进人口 修造 动土 起基 上梁 安门 造仓 补垣 塞穴 造畜稠	嫁娶 开市 安床 栽种 安葬 祈福 开光 掘井
2094-12-31	2094-11-24	29	建	五	甲寅 丙子 丙子	无	小寒 (1, 5)	无	无	无	造畜稠 教牛马	入宅 移徙 分居 作灶 出火 安香 动土 嫁娶 掘井 扫舍 造桥
