2094-04-01	2094-2-17	30	闭	四	甲寅 丁卯 壬寅	无	清明 (4, 4)	愚人节	无	无	冠笄 立券 交易 修造 动土 安机械 入殓 安葬 破土	嫁娶 祈福 出火 入宅
2094-04-02	2094-2-18	30	建	五	甲寅 丁卯 癸卯	无	清明 (4, 4)	无	无	无	祭祀 会亲友 出行 立券 交易 冠笄 纳财	嫁娶 动土 掘井 起基 定磉 破土
2094-04-03	2094-2-19	30	除	六	甲寅 丁卯 甲辰	无	清明 (4, 4)	无	无	无	祭祀 沐浴 解除 扫舍 塞穴 牧养	嫁娶 安葬 行丧 安门
2094-04-04	2094-2-20	30	除	日	甲寅 戊辰 乙巳	清明	谷雨 (4, 19)	无	无	无	祭祀 祈福 开光 求嗣 解除 伐木 出火 入宅 移徙 安床 拆卸 修造 动土 造畜稠	嫁娶 纳财 安葬 出行 开市 立券 作灶 栽种
2094-04-05	2094-2-21	30	满	一	甲寅 戊辰 丙午	无	谷雨 (4, 19)	无	无	无	纳采 嫁娶 开光 出行 理发 会亲友 开市 安床 栽种 牧养 入殓 移柩 启钻	谢土 祈福 上梁 作灶 斋醮 修造 入宅 安门
2094-04-06	2094-2-22	30	平	二	甲寅 戊辰 丁未	无	谷雨 (4, 19)	无	无	无	祭祀 平治道涂 解除 修饰垣墙 馀事勿取	诸事不宜
2094-04-07	2094-2-23	30	定	三	甲寅 戊辰 戊申	无	谷雨 (4, 19)	无	无	无	祭祀 祈福 开光 解除 动土 纳财 交易 纳畜 扫舍	进人口 出行 嫁娶 置产 安床 赴任 安葬 作灶
2094-04-08	2094-2-24	30	执	四	甲寅 戊辰 己酉	无	谷雨 (4, 19)	无	无	无	祭祀 祈福 求嗣 开光 解除 出火 拆卸 入宅 安床 修造 安门 纳畜 启钻 安葬	动土 破土 纳财 掘井 挂匾 开市 伐木 交易
2094-04-09	2094-2-25	30	破	五	甲寅 戊辰 庚戌	无	谷雨 (4, 19)	无	无	无	祭祀 解除 破屋 坏垣 馀事勿取	诸事不宜
2094-04-10	2094-2-26	30	危	六	甲寅 戊辰 辛亥	无	谷雨 (4, 19)	无	无	无	塞穴 扫舍 馀事勿取	诸事不宜
2094-04-11	2094-2-27	30	成	日	甲寅 戊辰 壬子	无	谷雨 (4, 19)	无	无	无	祭祀 祈福 求嗣 开光 解除 纳采 冠笄 出火 拆卸 进人口 安床 动土 上梁 造庙 掘井 开池 入殓 移柩 安葬 破土	无
2094-04-12	2094-2-28	30	收	一	甲寅 戊辰 癸丑	无	谷雨 (4, 19)	无	无	无	解除 破屋 馀事勿取	诸事不宜
2094-04-13	2094-2-29	30	开	二	甲寅 戊辰 甲寅	无	谷雨 (4, 19)	无	无	无	嫁娶 祈福 求嗣 开光 出行 解除 拆卸 出火 开市 立券 交易 入宅 移徙 安床 动土 破土 谢土	祭祀 入殓 安葬 探病
2094-04-14	2094-2-30	30	闭	三	甲寅 戊辰 乙卯	无	谷雨 (4, 19)	无	无	无	祭祀 裁衣 冠笄 安床 交易 立券 开池 补垣 塞穴 入殓 破土 启钻 安葬 谢土 除服 成服	嫁娶 掘井 探病 开市 开光 栽种
2094-04-15	2094-3-1	29	建	四	甲寅 戊辰 丙辰	无	谷雨 (4, 19)	无	无	无	祭祀 出行 教牛马 扫舍 馀事勿取	开光 伐木 安葬 破土
2094-04-16	2094-3-2	29	除	五	甲寅 戊辰 丁巳	无	谷雨 (4, 19)	无	无	无	祭祀 祈福 求嗣 开光 纳采 订盟 解除 栽种 纳畜 牧养 扫舍 进人口	修坟 造桥 作灶 出行 安葬 盖屋 入宅
2094-04-17	2094-3-3	29	满	六	甲寅 戊辰 戊午	无	谷雨 (4, 19)	无	无	无	开光 出行 交易 塞穴 嫁娶 理发 开市 安床	祈福 出火 置产 动土 破土 安葬 修造 上梁 入宅
2094-04-18	2094-3-4	29	平	日	甲寅 戊辰 己未	无	谷雨 (4, 19)	无	无	无	祭祀 作灶 畋猎 结网 修饰垣墙 平治道涂 馀事勿取	嫁娶 安床 治病
2094-04-19	2094-3-5	29	定	一	甲寅 戊辰 庚申	谷雨	立夏 (5, 5)	无	无	无	沐浴 祭祀 解除 安葬 破土 谢土 移柩 馀事勿取	斋醮 开光 嫁娶 入宅 上梁
2094-04-20	2094-3-6	29	执	二	甲寅 戊辰 辛酉	无	立夏 (5, 5)	无	无	无	祭祀 解除 入殓 移柩 启钻 安葬 整手足甲 捕捉 畋猎 取渔 除服 成服 扫舍 谢土 斋醮	动土 破土
2094-04-21	2094-3-7	29	破	三	甲寅 戊辰 壬戌	无	立夏 (5, 5)	无	无	无	祭祀 沐浴 解除 破屋 坏垣 求医 治病 馀事勿取	嫁娶 开市
2094-04-22	2094-3-8	29	危	四	甲寅 戊辰 癸亥	无	立夏 (5, 5)	无	无	无	沐浴 塞穴 畋猎 结网 取渔 扫舍 馀事勿取	祈福 安葬
2094-04-23	2094-3-9	29	成	五	甲寅 戊辰 甲子	无	立夏 (5, 5)	无	无	无	开市 交易 立券 挂匾 祭祀 开光 祈福 求嗣 安床 解除 修造 安葬	纳采 问名 订盟 嫁娶 入宅 开仓 出火 动土 破土 纳畜 伐木
2094-04-24	2094-3-10	29	收	六	甲寅 戊辰 乙丑	无	立夏 (5, 5)	无	无	无	祭祀 修门 取渔 纳财 纳畜 馀事勿取	嫁娶 入宅
2094-04-25	2094-3-11	29	开	日	甲寅 戊辰 丙寅	无	立夏 (5, 5)	无	无	无	安香 出火 纳采 订盟 嫁娶 开市 立券 交易 挂匾 开光 出行 解除 安床 栽种 置产 拆卸 修造 动土	作灶 安葬 祭祀 入殓
2094-04-26	2094-3-12	29	闭	一	甲寅 戊辰 丁卯	无	立夏 (5, 5)	无	无	无	祭祀 出行 修造 动土 合帐 造畜稠 安床 移徙 入殓 移柩 破土 启钻 安葬 开生坟 合寿木 补垣 塞穴	入宅 作灶 理发 开光 安门
2094-04-27	2094-3-13	29	建	二	甲寅 戊辰 戊辰	无	立夏 (5, 5)	无	无	无	祭祀 修饰垣墙 馀事勿取	开光 修造 动土 破土
2094-04-28	2094-3-14	29	除	三	甲寅 戊辰 己巳	无	立夏 (5, 5)	无	无	无	嫁娶 祭祀 祈福 求嗣 斋醮 开光 出火 移徙 入宅 竖柱 上梁 会亲友 盖屋 起基 治病 安门 造车器 掘井 开池	纳采 出行 修坟 安葬 开市 立券 作灶
2094-04-29	2094-3-15	29	满	四	甲寅 戊辰 庚午	无	立夏 (5, 5)	无	无	无	祭祀 塑绘 开光 纳采 嫁娶 开市 出行 会亲友 安床 结网 除服 成服 启钻 安葬 移柩	祈福 入宅 盖屋 动土 破土 探病
2094-04-30	2094-3-16	29	平	五	甲寅 戊辰 辛未	无	立夏 (5, 5)	无	无	无	祭祀 作灶 平治道涂 馀事勿取	安床 入宅 安碓磑 栽种
