2095-09-01	二零九五 乙卯[兔]年	八月小	初三	周四	无	司命灶君诞	无	乙卯 甲申 庚辰 辛巳	无	白露 (9, 7)	兔	处女座	祭祀、出行、结婚姻、宴会、嫁娶、修造、上官、入学、进人口、竖柱上梁、经络、开市、纳财、安碓硙、栽种、牧养、布政事、纳畜、纳采、安抚边境、修仓库、雪冤、缮城郭、裁制、临政、酝酿、立券交易、筑堤防、入宅、祈福、求嗣、覃恩、庆赐、修宫室、恤孤茕、搬移	诸事不忌
2095-09-02	二零九五 乙卯[兔]年	八月小	初四	周五	无	无	无	乙卯 甲申 辛巳 癸巳	无	白露 (9, 7)	兔	处女座	结婚姻、宴会、嫁娶、进人口、经络、开市、纳财、捕捉、栽种、牧养、安葬、布政事、纳畜、雪冤、酝酿、立券交易、开仓、覃恩、庆赐、恤孤茕	祭祀、出行、安床、剃头、修造、求医疗病、上表章、上官、冠带、竖柱上梁、修置产室、开渠、穿井、安碓硙、破屋坏垣、破土、启攒、出师、颁诏、纳采、补垣、举正直、安抚边境、修仓库、整手足甲、缮城郭、鼓铸、裁制、宣政事、临政、招贤、祈福、解除、施恩、筑堤防、求嗣、塞穴、修饰垣墙、上册、整容、修宫室、选将、营建、搬移
2095-09-03	二零九五 乙卯[兔]年	八月小	初五	周六	无	雷声大帝诞	中国抗日战争胜利纪念日	乙卯 甲申 壬午 乙巳	无	白露 (9, 7)	兔	处女座	祭祀、出行、结婚姻、宴会、嫁娶、修造、求医疗病、上表章、上官、入学、竖柱上梁、开市、纳财、修置产室、安碓硙、栽种、牧养、纳畜、颁诏、纳采、举正直、安抚边境、修仓库、雪冤、缮城郭、裁制、宣政事、临政、招贤、开仓、祈福、解除、施恩、求嗣、覃恩、上册、庆赐、恤孤茕、修宫室、选将、营建、出师、搬移	剃头、冠带、开渠、破屋坏垣、伐木、畋猎、苫盖、乘船渡水、整容、整手足甲、鼓铸、取鱼、入宅、筑堤防、补垣、塞穴、修饰垣墙
2095-09-04	二零九五 乙卯[兔]年	八月小	初六	周日	无	无	无	乙卯 甲申 癸未 丁巳	无	白露 (9, 7)	兔	处女座	祭祀、破土、雪冤、覃恩、恤孤茕	出行、结婚姻、宴会、嫁娶、安床、剃头、修造、求医疗病、上表章、上官、冠带、进人口、竖柱上梁、经络、开市、纳财、修置产室、开渠、穿井、安碓硙、破屋坏垣、畋猎、栽种、牧养、安葬、布政事、出师、纳畜、取鱼、颁诏、纳采、举正直、补垣、安抚边境、修仓库、整手足甲、缮城郭、鼓铸、裁制、宣政事、临政、针刺、酝酿、立券交易、招贤、开仓、祈福、解除、施恩、筑堤防、求嗣、塞穴、修饰垣墙、上册、庆赐、整容、修宫室、选将、营建、疗目、搬移
2095-09-05	二零九五 乙卯[兔]年	八月小	初七	周一	无	无	无	乙卯 甲申 甲申 己巳	无	白露 (9, 7)	兔	处女座	出行、沐浴、上官、进人口、经络、纳财、扫舍宇、赴任、纳畜、颁诏、举正直、雪冤、裁制、宣政事、临政、诉讼、酝酿、招贤、施恩、覃恩、恤孤茕	安床、上表章、修置产室、开渠、穿井、平治道涂、破屋坏垣、伐木、栽种、启攒、补垣、开仓、祈福、筑堤防、求嗣、修饰垣墙、上册、营建
2095-09-06	二零九五 乙卯[兔]年	八月小	初八	周二	无	无	无	乙卯 甲申 乙酉 辛巳	无	白露 (9, 7)	兔	处女座	出行、嫁娶、沐浴、剃头、修造、求医疗病、上官、扫舍宇、安葬、赴任、纳采、安抚边境、雪冤、整手足甲、临政、解除、入宅、整容、恤孤茕、选将、出师、搬移	结婚姻、宴会、上表章、冠带、竖柱上梁、修置产室、捕捉、畋猎、栽种、牧养、纳畜、取鱼、颁诏、补垣、修仓库、鼓铸、缮城郭、宣政事、乘船渡水、招贤、开仓、祈福、筑堤防、塞穴、求嗣、上册、庆赐、修宫室、营建
2095-09-07	二零九五 乙卯[兔]年	八月小	初九	周三	无	无	无	乙卯 乙酉 丙戌 癸巳	白露	秋分 (9, 23)	兔	处女座	祭祀、出行、沐浴、剃头、扫舍宇、栽种、赴任、举正直、整手足甲、临政、诉讼、解除、施恩、整容	宴会、嫁娶、修造、求医疗病、上表章、上官、进人口、经络、开市、纳财、修置产室、牧养、破土、安葬、启攒、出师、纳畜、纳采、安抚边境、修仓库、针刺、酝酿、立券交易、开仓、祈福、求嗣、上册、庆赐、选将
2095-09-08	二零九五 乙卯[兔]年	八月小	初十	周四	无	北斗大帝诞	世界扫盲日	乙卯 乙酉 丁亥 乙巳	无	秋分 (9, 23)	兔	处女座	出行、宴会、沐浴、上表章、进人口、竖柱上梁、经络、开市、纳财、补垣、缮城郭、裁制、立券交易、塞穴、上册、庆赐、修宫室	祭祀、结婚姻、嫁娶、剃头、修造、破土、启攒、安抚边境、整容、纳畜、招贤、选将、施恩、出师、纳采、举正直
2095-09-09	二零九五 乙卯[兔]年	八月小	十一	周五	无	无	毛泽东逝世纪念日	乙卯 乙酉 戊子 丁巳	无	秋分 (9, 23)	兔	处女座	祭祀、沐浴、平治道涂、修饰垣墙	出行、结婚姻、宴会、嫁娶、安床、修造、求医疗病、上表章、上官、冠带、进人口、竖柱上梁、经络、开市、纳财、修置产室、开渠、穿井、捕捉、畋猎、栽种、牧养、破土、安葬、启攒、布政事、出师、纳畜、取鱼、颁诏、纳采、举正直、安抚边境、修仓库、缮城郭、鼓铸、裁制、宣政事、临政、酝酿、立券交易、招贤、开仓、祈福、解除、施恩、筑堤防、求嗣、上册、庆赐、修宫室、选将、营建、搬移
2095-09-10	二零九五 乙卯[兔]年	八月小	十二	周六	无	西方五道诞	中国教师节	乙卯 乙酉 己丑 己巳	无	秋分 (9, 23)	兔	处女座	结婚姻、宴会、嫁娶、修造、进人口、竖柱上梁、经络、安碓硙、牧养、纳畜、纳采、缮城郭、裁制、酝酿、庆赐、修宫室	剃头、求医疗病、上表章、开市、修置产室、上册、安抚边境、整容、选将、开仓、解除、出师
2095-09-11	二零九五 乙卯[兔]年	八月小	十三	周日	无	无	无	乙卯 乙酉 庚寅 辛巳	无	秋分 (9, 23)	兔	处女座	沐浴、捕捉、雪冤、入宅、覃恩、恤孤茕	祭祀、安床、冠带、进人口、经络、开市、纳财、修置产室、开渠、穿井、安碓硙、破屋坏垣、畋猎、启攒、布政事、取鱼、补垣、鼓铸、酝酿、开仓、筑堤防、塞穴、修饰垣墙、修宫室、远回
2095-09-12	二零九五 乙卯[兔]年	八月小	十四	周一	无	无	无	乙卯 乙酉 辛卯 癸巳	无	秋分 (9, 23)	兔	处女座	诸事不宜	诸事不宜
2095-09-13	二零九五 乙卯[兔]年	八月小	十五	周二	中秋节	无	无	乙卯 乙酉 壬辰 乙巳	无	秋分 (9, 23)	兔	处女座	祭祀	上表章、开渠、穿井、布政事、颁诏、补垣、宣政事、招贤、筑堤防、塞穴、上册、营建、出师
2095-09-14	二零九五 乙卯[兔]年	八月小	十六	周三	无	天曹掠刷真君降	世界清洁地球日	乙卯 乙酉 癸巳 丁巳	无	秋分 (9, 23)	兔	处女座	祭祀、结婚姻、宴会、修造、求医疗病、上表章、上官、入学、进人口、竖柱上梁、经络、开市、纳财、安碓硙、栽种、牧养、纳畜、纳采、举正直、安抚边境、修仓库、缮城郭、裁制、临政、酝酿、立券交易、开仓、筑堤防、祈福、施恩、解除、求嗣、上册、庆赐、修宫室、选将、搬移	出行、破土、安葬、启攒
2095-09-15	二零九五 乙卯[兔]年	八月小	十七	周四	无	无	无	乙卯 乙酉 甲午 己巳	无	秋分 (9, 23)	兔	处女座	祭祀、捕捉	出行、结婚姻、宴会、嫁娶、安床、修造、求医疗病、上表章、上官、冠带、进人口、竖柱上梁、经络、开市、纳财、修置产室、开渠、穿井、栽种、牧养、破土、安葬、启攒、布政事、出师、纳畜、取鱼、颁诏、纳采、补垣、举正直、安抚边境、苫盖、修仓库、缮城郭、鼓铸、裁制、宣政事、临政、乘船渡水、酝酿、立券交易、招贤、开仓、祈福、解除、施恩、筑堤防、求嗣、塞穴、上册、庆赐、修宫室、选将、营建、搬移
2095-09-16	二零九五 乙卯[兔]年	八月小	十八	周五	无	天人兴福之辰	无	乙卯 乙酉 乙未 辛巳	无	秋分 (9, 23)	兔	处女座	出行、宴会、上表章、上官、入学、进人口、竖柱上梁、开市、纳财、牧养、赴任、纳畜、颁诏、纳采、举正直、安抚边境、雪冤、裁制、宣政事、临政、招贤、祈福、解除、施恩、入宅、求嗣、覃恩、上册、庆赐、恤孤茕、选将、出师、搬移	平治道涂、破屋坏垣、伐木、畋猎、取鱼、开仓、筑堤防、补垣、修饰垣墙
2095-09-17	二零九五 乙卯[兔]年	八月小	十九	周六	无	无	无	乙卯 乙酉 丙申 癸巳	无	秋分 (9, 23)	兔	处女座	祭祀、沐浴、剃头、经络、纳财、扫舍宇、栽种、牧养、补垣、安抚边境、雪冤、裁制、酝酿、筑堤防、塞穴、覃恩、整容、恤孤茕、选将	出行、结婚姻、宴会、嫁娶、安床、修造、求医疗病、上表章、上官、进人口、竖柱上梁、开市、修置产室、开渠、穿井、安葬、布政事、出师、纳畜、颁诏、纳采、举正直、整手足甲、宣政事、临政、针刺、立券交易、招贤、开仓、祈福、解除、施恩、求嗣、上册、庆赐、修宫室、营建、疗目、搬移
2095-09-18	二零九五 乙卯[兔]年	八月小	二十	周日	无	无	“九·一八”事变纪念日	乙卯 乙酉 丁酉 乙巳	无	秋分 (9, 23)	兔	处女座	祭祀、沐浴、扫舍宇	出行、结婚姻、宴会、嫁娶、安床、剃头、修造、求医疗病、上表章、上官、冠带、进人口、竖柱上梁、经络、开市、纳财、修置产室、开渠、穿井、安碓硙、平治道涂、破屋坏垣、伐木、栽种、牧养、破土、安葬、启攒、布政事、纳畜、取鱼、颁诏、纳采、补垣、举正直、安抚边境、修仓库、苫盖、整手足甲、缮城郭、鼓铸、裁制、宣政事、临政、乘船渡水、酝酿、立券交易、招贤、开仓、祈福、解除、施恩、求嗣、筑堤防、塞穴、修饰垣墙、上册、庆赐、整容、修宫室、选将、营建、出师、搬移
2095-09-19	二零九五 乙卯[兔]年	八月小	廿一	周一	无	无	无	乙卯 乙酉 戊戌 丁巳	无	秋分 (9, 23)	兔	处女座	祭祀、出行、沐浴、剃头、扫舍宇、栽种、赴任、举正直、临政、诉讼、解除、施恩、整容	宴会、嫁娶、修造、求医疗病、上表章、上官、进人口、经络、开市、纳财、修置产室、牧养、破土、安葬、启攒、出师、纳畜、纳采、安抚边境、修仓库、整手足甲、针刺、酝酿、立券交易、开仓、祈福、求嗣、上册、庆赐、选将
2095-09-20	二零九五 乙卯[兔]年	八月小	廿二	周二	无	无	全国爱牙日	乙卯 乙酉 己亥 己巳	无	秋分 (9, 23)	兔	处女座	出行、宴会、沐浴、上表章、进人口、竖柱上梁、经络、开市、纳财、补垣、缮城郭、裁制、立券交易、塞穴、上册、庆赐、修宫室	祭祀、结婚姻、嫁娶、修造、破土、启攒、安抚边境、纳畜、招贤、选将、施恩、出师、纳采、举正直
2095-09-21	二零九五 乙卯[兔]年	八月小	廿三	周三	无	汉恒候张显王诞	国际和平日	乙卯 乙酉 庚子 辛巳	无	秋分 (9, 23)	兔	处女座	祭祀、沐浴、平治道涂、雪冤、入宅、覃恩、修饰垣墙、恤孤茕	冠带、修置产室、开渠、穿井、捕捉、畋猎、安葬、乘船渡水、布政事、整手足甲、鼓铸、取鱼、筑堤防
2095-09-22	二零九五 乙卯[兔]年	八月小	廿四	周四	无	灶君夫人诞	无	乙卯 乙酉 辛丑 癸巳	无	秋分 (9, 23)	兔	处女座	宴会、经络、安碓硙、裁制、庆赐	出行、安床、求医疗病、上表章、上官、开市、修置产室、破土、安葬、启攒、安抚边境、临政、开仓、解除、筑堤防、上册、选将、营建、出师、搬移
2095-09-23	二零九五 乙卯[兔]年	八月小	廿五	周五	无	无	无	乙卯 乙酉 壬寅 乙巳	秋分	寒露 (10, 8)	兔	天秤座	沐浴、捕捉、雪冤、覃恩、恤孤茕	祭祀、冠带、修置产室、开渠、穿井、安碓硙、破屋坏垣、畋猎、启攒、布政事、鼓铸、取鱼、筑堤防、远回、塞穴、修饰垣墙、补垣
2095-09-24	二零九五 乙卯[兔]年	八月小	廿六	周六	无	无	无	乙卯 乙酉 癸卯 丁巳	无	寒露 (10, 8)	兔	天秤座	诸事不宜	诸事不宜
2095-09-25	二零九五 乙卯[兔]年	八月小	廿七	周日	无	无	无	乙卯 乙酉 甲辰 己巳	无	寒露 (10, 8)	兔	天秤座	诸事不宜	出行、剃头、修造、求医疗病、上官、竖柱上梁、立券、修置产室、开渠、穿井、安碓硙、破屋坏垣、布政事、出师、颁诏、补垣、纳采、举正直、开张、修仓库、整手足甲、缮城郭、鼓铸、裁制、宣政事、临政、招贤、开仓、祈福、解除、施恩、筑堤防、求嗣、塞穴、修饰垣墙、上册、庆赐、整容、修宫室、营建
2095-09-26	二零九五 乙卯[兔]年	八月小	廿八	周一	无	无	无	乙卯 乙酉 乙巳 辛巳	无	寒露 (10, 8)	兔	天秤座	祭祀、结婚姻、宴会、修造、求医疗病、上表章、上官、入学、进人口、竖柱上梁、经络、开市、纳财、安碓硙、牧养、赴任、纳畜、颁诏、纳采、举正直、安抚边境、修仓库、雪冤、缮城郭、裁制、宣政事、临政、酝酿、立券交易、招贤、祈福、筑堤防、入宅、施恩、解除、求嗣、覃恩、上册、庆赐、恤孤茕、修宫室、选将、营建、搬移	出行、畋猎、破土、启攒、取鱼
2095-09-27	二零九五 乙卯[兔]年	八月小	廿九	周二	无	至圣先师孔子诞	世界旅游日	乙卯 乙酉 丙午 癸巳	无	寒露 (10, 8)	兔	天秤座	祭祀、捕捉	出行、结婚姻、宴会、嫁娶、安床、修造、求医疗病、上表章、上官、冠带、进人口、竖柱上梁、经络、开市、纳财、修置产室、开渠、穿井、栽种、牧养、破土、安葬、启攒、布政事、出师、纳畜、取鱼、颁诏、纳采、补垣、举正直、安抚边境、苫盖、修仓库、缮城郭、鼓铸、裁制、宣政事、临政、乘船渡水、酝酿、立券交易、招贤、开仓、祈福、解除、施恩、筑堤防、求嗣、塞穴、上册、庆赐、修宫室、选将、营建、搬移
2095-09-28	二零九五 乙卯[兔]年	九月大	初一	周三	无	北斗九星降世	无	乙卯 乙酉 丁未 乙巳	无	寒露 (10, 8)	兔	天秤座	出行、宴会、上表章、上官、入学、进人口、开市、纳财、牧养、纳畜、颁诏、举正直、雪冤、裁制、宣政事、临政、招贤、祈福、解除、施恩、求嗣、覃恩、上册、庆赐、恤孤茕、搬移	结婚姻、嫁娶、剃头、平治道涂、破屋坏垣、伐木、畋猎、乘船渡水、整容、整手足甲、取鱼、营建、开仓、筑堤防、补垣、纳采、修饰垣墙
2095-09-29	二零九五 乙卯[兔]年	九月大	初二	周四	无	无	无	乙卯 乙酉 戊申 丁巳	无	寒露 (10, 8)	兔	天秤座	祭祀、沐浴、剃头、经络、纳财、扫舍宇、栽种、牧养、破土、补垣、安抚边境、修仓库、雪冤、整手足甲、缮城郭、裁制、酝酿、筑堤防、塞穴、覃恩、整容、恤孤茕、选将	出行、结婚姻、宴会、嫁娶、安床、修造、求医疗病、上表章、上官、进人口、竖柱上梁、开市、修置产室、开渠、穿井、畋猎、安葬、布政事、纳畜、取鱼、颁诏、纳采、举正直、宣政事、临政、针刺、立券交易、招贤、开仓、祈福、解除、施恩、求嗣、上册、庆赐、修宫室、营建、出师、疗目、搬移
2095-09-30	二零九五 乙卯[兔]年	九月大	初三	周五	无	五瘟神诞	无	乙卯 乙酉 己酉 己巳	无	寒露 (10, 8)	兔	天秤座	祭祀、沐浴、扫舍宇、雪冤、覃恩、恤孤茕	出行、结婚姻、宴会、嫁娶、安床、剃头、修造、求医疗病、上表章、上官、冠带、进人口、竖柱上梁、经络、开市、纳财、修置产室、开渠、穿井、安碓硙、平治道涂、破屋坏垣、伐木、栽种、牧养、破土、安葬、启攒、布政事、出师、纳畜、取鱼、颁诏、补垣、纳采、举正直、安抚边境、修仓库、苫盖、整手足甲、缮城郭、鼓铸、裁制、宣政事、临政、乘船渡水、酝酿、立券交易、招贤、开仓、祈福、解除、施恩、求嗣、筑堤防、塞穴、修饰垣墙、上册、庆赐、整容、修宫室、选将、营建、搬移
