2099-09-01	二零九九 己未[羊]年	七月大	十七	周二	己未 壬申 辛丑 癸巳	无	白露 (9, 7)	无	无	无	羊	处女座	纳财、捕捉	出行、结婚姻、嫁娶、安床、修造、求医疗病、上官、冠带、进人口、竖柱上梁、开市、修置产室、畋猎、破土、安葬、启攒、搬移、缮城郭、修宫室、安抚边境、立券交易、临政、解除、修仓库、酝酿、选将、远回、营建、纳采、出师、筑堤防
2099-09-02	二零九九 己未[羊]年	七月大	十八	周三	己未 壬申 壬寅 乙巳	无	白露 (9, 7)	无	西王母诞	无	羊	处女座	沐浴、覃恩、恤孤茕、雪冤	祭祀、出行、结婚姻、宴会、嫁娶、安床、剃头、修造、求医疗病、上表章、上官、冠带、进人口、竖柱上梁、经络、开市、纳财、修置产室、开渠、穿井、安碓硙、破屋坏垣、伐木、畋猎、栽种、牧养、破土、安葬、启攒、搬移、祈福、缮城郭、裁制、上册、开仓、修宫室、颁诏、求嗣、庆赐、补垣、取鱼、招贤、整容、布政事、宣政事、安抚边境、施恩、立券交易、修饰垣墙、临政、纳畜、举正直、解除、塞穴、修仓库、酝酿、选将、鼓铸、营建、纳采、整手足甲、出师、筑堤防
2099-09-03	二零九九 己未[羊]年	七月大	十九	周四	己未 壬申 癸卯 丁巳	无	白露 (9, 7)	无	太岁诞	中国抗日战争胜利纪念日	羊	处女座	祭祀、出行、结婚姻、宴会、嫁娶、安床、修造、求医疗病、上表章、上官、竖柱上梁、纳财、栽种、牧养、安葬、搬移、祈福、缮城郭、开仓、裁制、上册、修宫室、颁诏、求嗣、覃恩、恤孤茕、雪冤、庆赐、招贤、宣政事、安抚边境、施恩、立券交易、临政、纳畜、举正直、解除、修仓库、选将、营建、纳采、出师	冠带、修置产室、开渠、穿井、安碓硙、平治道涂、破屋坏垣、畋猎、补垣、取鱼、整手足甲、筑堤防、修饰垣墙
2099-09-04	二零九九 己未[羊]年	七月大	二十	周五	己未 壬申 甲辰 己巳	无	白露 (9, 7)	无	无	无	羊	处女座	祭祀、出行、结婚姻、宴会、嫁娶、修造、上官、入学、进人口、竖柱上梁、经络、开市、纳财、安碓硙、栽种、牧养、安葬、诉讼、搬移、祈福、缮城郭、裁制、修宫室、求嗣、庆赐、入宅、安抚边境、立券交易、临政、纳畜、修仓库、赴任、酝酿、纳采、筑堤防	安床、剃头、求医疗病、上表章、冠带、修置产室、开渠、穿井、平治道涂、破屋坏垣、伐木、破土、启攒、开仓、上册、颁诏、补垣、针刺、招贤、整容、布政事、宣政事、修饰垣墙、解除、塞穴、选将、远回、鼓铸、营建、整手足甲、出师
2099-09-05	二零九九 己未[羊]年	七月大	廿一	周六	己未 壬申 乙巳 辛巳	无	白露 (9, 7)	无	无	无	羊	处女座	结婚姻、宴会、嫁娶、进人口、经络、开市、纳财、捕捉、栽种、牧养、安葬、纳畜、酝酿、开仓、立券交易	祭祀、出行、安床、剃头、修造、求医疗病、上表章、上官、冠带、竖柱上梁、修置产室、开渠、穿井、安碓硙、破屋坏垣、破土、启攒、搬移、祈福、缮城郭、裁制、上册、修宫室、颁诏、求嗣、庆赐、补垣、招贤、整容、布政事、宣政事、安抚边境、施恩、修饰垣墙、临政、举正直、解除、塞穴、修仓库、选将、鼓铸、营建、纳采、整手足甲、出师、筑堤防
2099-09-06	二零九九 己未[羊]年	七月大	廿二	周日	己未 壬申 丙午 癸巳	无	白露 (9, 7)	无	增福财神诞	无	羊	处女座	入学、覃恩、恤孤茕、雪冤	结婚姻、嫁娶、冠带、进人口、竖柱上梁、经络、伐木、畋猎、启攒、开仓、补垣、取鱼、布政事、入宅、塞穴、酝酿、营建、纳采、筑堤防
2099-09-07	二零九九 己未[羊]年	七月大	廿三	周一	己未 癸酉 丁未 乙巳	白露	秋分 (9, 23)	无	无	无	羊	处女座	宴会、上表章、上官、入学、进人口、开市、纳财、牧养、搬移、祈福、裁制、上册、颁诏、求嗣、覃恩、恤孤茕、雪冤、庆赐、招贤、宣政事、施恩、临政、纳畜、举正直、解除	结婚姻、嫁娶、剃头、平治道涂、破屋坏垣、伐木、畋猎、补垣、取鱼、整容、乘船渡水、营建、纳采、整手足甲、筑堤防、开仓、修饰垣墙
2099-09-08	二零九九 己未[羊]年	七月大	廿四	周二	己未 癸酉 戊申 丁巳	无	秋分 (9, 23)	无	无	世界扫盲日	羊	处女座	祭祀、沐浴、剃头、经络、纳财、扫舍宇、栽种、牧养、破土、缮城郭、裁制、覃恩、恤孤茕、补垣、雪冤、整容、安抚边境、塞穴、修仓库、酝酿、选将、整手足甲、筑堤防	诸事不忌
2099-09-09	二零九九 己未[羊]年	七月大	廿五	周三	己未 癸酉 己酉 己巳	无	秋分 (9, 23)	无	无	毛泽东逝世纪念日	羊	处女座	祭祀、沐浴、扫舍宇、覃恩、恤孤茕、雪冤、入宅、赴任	宴会、上表章、冠带、修置产室、开渠、穿井、平治道涂、破屋坏垣、伐木、栽种、牧养、启攒、开仓、上册、颁诏、补垣、取鱼、宣政事、修饰垣墙、塞穴、乘船渡水、鼓铸、营建、筑堤防、苫盖
2099-09-10	二零九九 己未[羊]年	七月大	廿六	周四	己未 癸酉 庚戌 辛巳	无	秋分 (9, 23)	无	无	中国教师节	羊	处女座	祭祀、出行、结婚姻、宴会、嫁娶、沐浴、剃头、修造、求医疗病、上表章、上官、竖柱上梁、纳财、扫舍宇、栽种、牧养、安葬、诉讼、搬移、祈福、缮城郭、裁制、上册、颁诏、求嗣、覃恩、恤孤茕、雪冤、庆赐、招贤、整容、宣政事、安抚边境、施恩、临政、纳畜、举正直、解除、修仓库、赴任、选将、营建、纳采、整手足甲、出师	进人口、经络、开市、修置产室、畋猎、破土、启攒、开仓、取鱼、针刺、立券交易、酝酿
2099-09-11	二零九九 己未[羊]年	七月大	廿七	周五	己未 癸酉 辛亥 癸巳	无	秋分 (9, 23)	无	无	无	羊	处女座	出行、宴会、沐浴、上表章、竖柱上梁、经络、缮城郭、裁制、上册、修宫室、覃恩、恤孤茕、补垣、雪冤、庆赐、布政事、塞穴	祭祀、结婚姻、嫁娶、修造、破土、安葬、启攒、招贤、纳畜、酝酿、选将、安抚边境、举正直、纳采、出师、施恩
2099-09-12	二零九九 己未[羊]年	七月大	廿八	周六	己未 癸酉 壬子 乙巳	无	秋分 (9, 23)	无	无	无	羊	处女座	祭祀、沐浴、平治道涂、覃恩、恤孤茕、雪冤、修饰垣墙	出行、结婚姻、宴会、嫁娶、安床、修造、求医疗病、上表章、上官、冠带、进人口、竖柱上梁、经络、开市、纳财、修置产室、开渠、穿井、捕捉、畋猎、栽种、牧养、破土、安葬、启攒、搬移、祈福、缮城郭、裁制、上册、开仓、修宫室、颁诏、求嗣、庆赐、取鱼、招贤、布政事、宣政事、安抚边境、施恩、立券交易、临政、纳畜、举正直、解除、修仓库、酝酿、选将、鼓铸、营建、纳采、出师、筑堤防
2099-09-13	二零九九 己未[羊]年	七月大	廿九	周日	己未 癸酉 癸丑 丁巳	无	秋分 (9, 23)	无	杨公忌	无	羊	处女座	祭祀、宴会、上官、进人口、竖柱上梁、经络、安碓硙、牧养、祈福、缮城郭、裁制、修宫室、求嗣、庆赐、覃恩、恤孤茕、雪冤、布政事、施恩、临政、纳畜、举正直、酝酿	上表章、立券、修置产室、选将、开张、安抚边境、出师、上册
2099-09-14	二零九九 己未[羊]年	七月大	三十	周一	己未 癸酉 甲寅 己巳	无	秋分 (9, 23)	无	地藏菩萨诞	世界清洁地球日	羊	处女座	沐浴、捕捉、覃恩、恤孤茕、雪冤、入宅	祭祀、安床、冠带、进人口、经络、开市、纳财、修置产室、开渠、穿井、安碓硙、破屋坏垣、畋猎、开仓、修宫室、补垣、取鱼、布政事、修饰垣墙、塞穴、酝酿、远回、鼓铸、筑堤防
2099-09-15	二零九九 己未[羊]年	八月小	初一	周二	己未 癸酉 乙卯 辛巳	无	秋分 (9, 23)	无	许真君诞	无	羊	处女座	诸事不宜	诸事不宜
2099-09-16	二零九九 己未[羊]年	八月小	初二	周三	己未 癸酉 丙辰 癸巳	无	秋分 (9, 23)	无	无	无	羊	处女座	祭祀、覃恩、恤孤茕、雪冤	剃头、求医疗病、开渠、穿井、开仓、补垣、整容、布政事、解除、塞穴、出师、筑堤防
2099-09-17	二零九九 己未[羊]年	八月小	初三	周四	己未 癸酉 丁巳 乙巳	无	秋分 (9, 23)	无	司命灶君诞	无	羊	处女座	祭祀、宴会、上表章、上官、入学、进人口、竖柱上梁、经络、开市、纳财、搬移、祈福、裁制、上册、庆赐、施恩、立券交易、临政、纳畜、举正直、酝酿、纳采	出行、剃头、修置产室、开渠、穿井、平治道涂、破屋坏垣、栽种、破土、安葬、启攒、补垣、整容、营建、修饰垣墙
2099-09-18	二零九九 己未[羊]年	八月小	初四	周五	己未 癸酉 戊午 丁巳	无	秋分 (9, 23)	无	无	“九·一八”事变纪念日	羊	处女座	祭祀、捕捉	出行、结婚姻、宴会、嫁娶、安床、修造、求医疗病、上表章、上官、冠带、进人口、竖柱上梁、经络、开市、纳财、修置产室、开渠、穿井、栽种、牧养、破土、安葬、启攒、搬移、祈福、缮城郭、开仓、裁制、上册、修宫室、颁诏、求嗣、庆赐、补垣、取鱼、招贤、布政事、宣政事、安抚边境、施恩、立券交易、临政、纳畜、举正直、解除、塞穴、乘船渡水、修仓库、酝酿、选将、鼓铸、营建、纳采、出师、筑堤防、苫盖
2099-09-19	二零九九 己未[羊]年	八月小	初五	周六	己未 癸酉 己未 己巳	无	秋分 (9, 23)	无	雷声大帝诞	无	羊	处女座	宴会、上表章、上官、入学、进人口、开市、纳财、牧养、搬移、祈福、裁制、上册、颁诏、求嗣、覃恩、恤孤茕、雪冤、庆赐、招贤、宣政事、入宅、施恩、临政、纳畜、举正直、解除、赴任	结婚姻、平治道涂、破屋坏垣、伐木、畋猎、破土、补垣、取鱼、乘船渡水、营建、筑堤防、开仓、修饰垣墙
2099-09-20	二零九九 己未[羊]年	八月小	初六	周日	己未 癸酉 庚申 辛巳	无	秋分 (9, 23)	无	无	全国爱牙日	羊	处女座	祭祀、沐浴、剃头、纳财、扫舍宇、栽种、牧养、缮城郭、裁制、覃恩、补垣、恤孤茕、雪冤、整容、塞穴、酝酿、筑堤防	安床、进人口、修置产室、开渠、穿井、畋猎、修宫室、取鱼、针刺、布政事、疗目
2099-09-21	二零九九 己未[羊]年	八月小	初七	周一	己未 癸酉 辛酉 癸巳	无	秋分 (9, 23)	无	无	国际和平日	羊	处女座	祭祀、沐浴、扫舍宇	出行、结婚姻、宴会、嫁娶、安床、剃头、修造、求医疗病、上表章、上官、冠带、进人口、竖柱上梁、经络、开市、纳财、修置产室、开渠、穿井、安碓硙、平治道涂、破屋坏垣、伐木、栽种、牧养、破土、安葬、启攒、搬移、祈福、缮城郭、裁制、开仓、上册、修宫室、颁诏、求嗣、庆赐、补垣、取鱼、招贤、整容、布政事、宣政事、安抚边境、施恩、立券交易、修饰垣墙、临政、纳畜、举正直、解除、塞穴、乘船渡水、修仓库、酝酿、选将、鼓铸、营建、纳采、整手足甲、出师、筑堤防、苫盖
2099-09-22	二零九九 己未[羊]年	八月小	初八	周二	己未 癸酉 壬戌 乙巳	无	秋分 (9, 23)	无	无	无	羊	处女座	祭祀、结婚姻、沐浴、剃头、竖柱上梁、扫舍宇、栽种、诉讼、搬移、缮城郭、裁制、修宫室、整容、施恩、临政、举正直、解除、赴任、整手足甲	出行、宴会、嫁娶、修造、求医疗病、上表章、上官、进人口、经络、开市、纳财、修置产室、开渠、穿井、牧养、破土、安葬、启攒、祈福、开仓、上册、求嗣、庆赐、针刺、安抚边境、立券交易、纳畜、修仓库、酝酿、选将、纳采、出师
2099-09-23	二零九九 己未[羊]年	八月小	初九	周三	己未 癸酉 癸亥 丁巳	秋分	寒露 (10, 8)	无	无	无	羊	天秤座	出行、宴会、沐浴、上表章、进人口、竖柱上梁、经络、开市、纳财、栽种、牧养、祈福、缮城郭、裁制、上册、修宫室、求嗣、庆赐、补垣、立券交易、解除、塞穴	祭祀、嫁娶、破土、启攒、纳畜、招贤、选将、安抚边境、出师
2099-09-24	二零九九 己未[羊]年	八月小	初十	周四	己未 癸酉 甲子 己巳	无	寒露 (10, 8)	无	北斗大帝诞	无	羊	天秤座	祭祀、沐浴、平治道涂、覃恩、恤孤茕、雪冤、入宅、修饰垣墙	冠带、修置产室、开渠、穿井、捕捉、畋猎、破土、安葬、启攒、上册、颁诏、取鱼、招贤、宣政事、安抚边境、修仓库、选将、鼓铸、营建、出师、筑堤防
2099-09-25	二零九九 己未[羊]年	八月小	十一	周五	己未 癸酉 乙丑 辛巳	无	寒露 (10, 8)	无	无	无	羊	天秤座	祭祀、结婚姻、宴会、上官、进人口、竖柱上梁、经络、安碓硙、牧养、祈福、缮城郭、裁制、修宫室、颁诏、求嗣、覃恩、恤孤茕、雪冤、庆赐、招贤、宣政事、施恩、临政、纳畜、举正直、酝酿、营建、纳采	修置产室、畋猎、开仓、取鱼
2099-09-26	二零九九 己未[羊]年	八月小	十二	周六	己未 癸酉 丙寅 癸巳	无	寒露 (10, 8)	无	西方五道诞	无	羊	天秤座	沐浴、捕捉、覃恩、恤孤茕、雪冤	祭祀、安床、冠带、进人口、经络、开市、纳财、修置产室、开渠、穿井、安碓硙、破屋坏垣、畋猎、开仓、修宫室、补垣、取鱼、修饰垣墙、塞穴、酝酿、远回、鼓铸、筑堤防
2099-09-27	二零九九 己未[羊]年	八月小	十三	周日	己未 癸酉 丁卯 乙巳	无	寒露 (10, 8)	无	无	世界旅游日	羊	天秤座	诸事不宜	诸事不宜
2099-09-28	二零九九 己未[羊]年	八月小	十四	周一	己未 癸酉 戊辰 丁巳	无	寒露 (10, 8)	无	无	无	羊	天秤座	覃恩、恤孤茕、雪冤	出行、剃头、修造、求医疗病、上表章、上官、竖柱上梁、修置产室、开渠、穿井、安碓硙、破屋坏垣、祈福、缮城郭、开仓、裁制、上册、修宫室、颁诏、求嗣、补垣、招贤、整容、宣政事、施恩、修饰垣墙、临政、举正直、解除、塞穴、乘船渡水、修仓库、鼓铸、营建、纳采、整手足甲、出师、筑堤防
2099-09-29	二零九九 己未[羊]年	八月小	十五	周二	己未 癸酉 己巳 己巳	无	寒露 (10, 8)	中秋节	无	无	羊	天秤座	祭祀、结婚姻、宴会、修造、上表章、上官、入学、进人口、竖柱上梁、经络、开市、纳财、安碓硙、搬移、祈福、缮城郭、裁制、上册、修宫室、庆赐、入宅、安抚边境、施恩、立券交易、临政、纳畜、举正直、修仓库、赴任、酝酿、选将、纳采、筑堤防	出行、剃头、求医疗病、破土、安葬、启攒、整容、整手足甲
2099-09-30	二零九九 己未[羊]年	八月小	十六	周三	己未 癸酉 庚午 辛巳	无	寒露 (10, 8)	无	天曹掠刷真君降	无	羊	天秤座	祭祀、捕捉、覃恩、恤孤茕、雪冤	安床、冠带、经络、开市、修置产室、开渠、穿井、畋猎、启攒、开仓、修宫室、补垣、取鱼、布政事、立券交易、塞穴、乘船渡水、酝酿、鼓铸、筑堤防、苫盖
